,Songs,Listeners,Playcount,Duration,Tags
492,My Immortal,885968,7117890,264000,"[u'rock', u'female vocalists', u'Gothic', u'Evanescence', u'Gothic Rock', u'sad', u'piano', u'Ballad', u'alternative', u'beautiful', u'alternative rock', u'metal', u'My immortal', u'female vocalist', u'Love', u'Gothic Metal', u'melancholic', u'melancholy', u'emotional', u'favorites', u'pop', u'00s', u'Female fronted metal', u'emo', u'symphonic metal', u'female', u'american', u'romantic', u'Mellow', u'amy lee', u'depressive', u'slow', u'Awesome', u'goth', u'female vocals', u'Nu Metal', u'hard rock', u'dark', u'melodic metal', u'memories', u'chillout', u'alternative metal', u'ballads', u'favorite songs', u'Favorite', u'relax', u'rock ballad', u'love songs', u'Favourites', u'makes me cry']"
493,Everybody's Fool,525448,3783556,195000,"[u'rock', u'Gothic Rock', u'Evanescence', u'female vocalists', u'Gothic', u'alternative rock', u'metal', u'alternative', u'Gothic Metal', u'Female fronted metal', u'hard rock', u'alternative metal', u'female vocalist', u'00s', u'Nu Metal', u'everybodys fool', u'american', u'amy lee', u'symphonic metal', u'female', u'goth', u'favorites', u'heavy metal', u'sad', u'Favorite', u'pop rock', u'dark', u'goth rock', u'angry', u'amazing', u'emo', u'epic', u'2003', u'2004', u'emotional', u'female vocals', u'amayzes loved', u'not gothic', u'USA', u'beautiful', u'Awesome', u'great songs', u'seen live', u'pop', u'punk', u'Love', u'Symphonic Rock', u'90s', u'Favorite Artists', u'loved']"
494,Bring Me to Life,1025620,7699378,237000,"[u'rock', u'Gothic Rock', u'Evanescence', u'Gothic', u'female vocalists', u'alternative', u'metal', u'alternative rock', u'Gothic Metal', u'Bring me to life', u'Female fronted metal', u'female vocalist', u'Nu Metal', u'hard rock', u'00s', u'dark', u'pop', u'alternative metal', u'symphonic metal', u'american', u'favorites', u'Soundtrack', u'female', u'amy lee', u'goth rock', u'goth', u'2003', u'beautiful', u'female vocals', u'Love', u'favorite songs', u'emo', u'melodic metal', u'sad', u'pop rock', u'dramatic', u'fallen', u'evanescence bring me to life', u'heavy metal', u'Favourites', u'Awesome', u'loved', u'instrumental', u'piano', u'cool', u'female vocal', u'Nu-metal', u'seen live', u'dance', u'epic']"
495,Going Under,723730,5108986,214000,"[u'rock', u'Gothic Rock', u'Evanescence', u'female vocalists', u'Gothic', u'metal', u'alternative', u'Gothic Metal', u'alternative rock', u'hard rock', u'alternative metal', u'female vocalist', u'Going Under', u'Nu Metal', u'Female fronted metal', u'dark', u'symphonic metal', u'favorites', u'00s', u'american', u'goth', u'female vocals', u'female', u'pop', u'emo', u'pop rock', u'seen live', u'2003', u'melodic metal', u'amy lee', u'sad', u'USA', u'Nu-metal', u'EVANescence - Going under', u'heavy metal', u'singer-songwriter', u'angry', u'Favorite', u'twilight', u'dark rock', u'electronic', u'Favourites', u'Female Voices', u'8 of 10 stars', u'goth rock', u'not gothic', u'favorite songs', u'sexy', u'dance', u'memories']"
496,From the sound asleep ep (2000),1,1,0,[]
497,Forgive Me,97053,594454,181000,"[u'rock', u'Gothic Rock', u'Evanescence', u'female vocalists', u'Gothic', u'sad', u'Gothic Metal', u'alternative', u'alternative rock', u'Female fronted metal', u'metal', u'piano', u'female', u'Love', u'female vocalist', u'forgive me', u'symphonic metal', u'hard rock', u'female vocals', u'american', u'alternative metal', u'melodic metal', u'goth rock', u'chill', u'goth', u'emo', u'melancholy', u'evanescense', u'beautiful voices', u'sexy', u'pop rock', u'calm', u'acoustic', u'romantic', u'nostalgic', u'ethereal', u'favourite', u'emotional', u'00s', u'Favourites', u'Nu Metal', u'female fronted', u'good music to cry with', u'my life written in song', u'breaks my heart', u'classic rock', u'electronic', u'seen live', u'pop', u'80s']"
498,Give Unto Me,32781,195995,351000,"[u'rock', u'Gothic Rock', u'piano', u'female vocalists', u'Gothic', u'Evanescence', u'alternative', u'metal', u'american', u'melancholy', u'intense', u'Give Unto Me', u'trance', u'seen live', u'chill', u'alternative rock', u'sad', u'hard rock', u'singer-songwriter', u'USA', u'slow', u'Love', u'dark', u'strange', u'acoustic', u'new wave', u'haunting', u'amazing', u'ethereal', u'Gothic Metal', u'depressing', u'female vocalist', u'00s', u'Ballad', u'Favorite', u'Nu Metal', u'english', u'Female Voices', u'great songs', u'1997', u'female fronted', u'creepy', u'Chills', u'america', u'soothing', u'goth rock', u'angelic', u'beautiful vocals', u'beautiful music', u'for rainy days']"
499,The End,25603,121366,120000,"[u'alternative rock', u'female vocalists', u'Evanescence', u'rock', u'Gothic', u'instrumental', u'alternative', u'Gothic Rock', u'not gothic', u'female', u'sad', u'pop rock', u'melancholic', u'darkwave', u'Ballad', u'dark rock', u'new metal', u'Music To Kill Yourself To', u'wooees', u'atmospheric dark', u'short songs and interludes', u'My Dream Concert']"
500,Understanding,45935,380986,444000,"[u'Gothic Rock', u'rock', u'Gothic', u'female vocalists', u'Evanescence', u'alternative rock', u'alternative', u'sad', u'Gothic Metal', u'melancholic', u'depressing', u'metal', u'female', u'dark', u'great', u'depression', u'Favourites', u'depressive', u'not gothic', u'brings tears to my eyes', u'songs to kill yourself to', u'amy lee', u'pop', u'goth', u'hard rock', u'pop rock', u'favorites', u'piano', u'epic', u'sadcore', u'blues', u'beautiful', u'Awesome', u'american', u'alternative metal', u'Psychedelic Rock', u'female vocalist', u'underrated', u'00s', u'Pop-Rock', u'Masterpiece', u'Eargasm', u'darkness', u'7 of 10 stars', u'sad songs', u'songs that make me cry', u'Understanding', u'goth rock', u'best songs ever', u'dark rock']"
501,So Close,50221,320583,266000,"[u'Gothic Rock', u'rock', u'female vocalists', u'Gothic', u'Evanescence', u'alternative rock', u'metal', u'Gothic Metal', u'american', u'goth rock', u'alternative', u'pop rock', u'great song', u'absolutely fucking love it', u'Makes me want to cry', u'amy lee', u'so close', u'Female fronted metal', u'hard rock', u'beautiful', u'Awesome', u'melancholy', u'00s', u'nostalgia', u'7 of 10 stars', u'dark rock', u'saudade', u'my music', u'female voice', u'not gothic', u'quiet hours of the night', u'guitar and voice', u'songs to kill yourself to', u'wooees', u'transcend', u'awesomeness defined', u'stare dobre czasy', u'old feelings', u'cdogg', u'cdawgg', u'sea dawgg', u'chris green from oaktown']"
502,Exodus,54351,351753,187000,"[u'Gothic Rock', u'rock', u'Gothic', u'female vocalists', u'Evanescence', u'alternative rock', u'melodic metal', u'alternative', u'piano', u'beautiful', u'rock ballad', u'sad', u'emotional', u'Female fronted metal', u'metal', u'Gothic Metal', u'melancholic', u'00s', u'Ballad', u'goth rock', u'not gothic', u'indie', u'female', u'Grunge', u'favorite songs', u'ambient', u'singer-songwriter', u'pop rock', u'depressed', u'dark', u'acoustic', u'moody', u'thoughtful', u'psychological', u'american', u'musical', u'melancholy', u'ethereal', u'female vocals', u'piano rock', u'good', u'female vocalist', u'mysterious', u'female vocal', u'Great Lyricists', u'addictive', u'perfect', u'makes me cry', u'lost', u'Love it']"
503,Solitude,50261,334408,346000,"[u'rock', u'Gothic Rock', u'sad', u'Gothic', u'beautiful', u'female vocalists', u'Love', u'alternative', u'alternative rock', u'emotional', u'depressive', u'metal', u'Evanescence', u'female vocalist', u'melancholy', u'Gothic Metal', u'Ballad', u'hard rock', u'pop rock', u'american', u'melancholic', u'Solitude', u'sad songs', u'<3', u'not gothic', u'Music To Kill Yourself To', u'painfully beautiful', u'Heart Felt Piano Driven Metal Song', u'Female fronted metal', u'female', u'goth', u'emo', u'favorites', u'depressed', u'memories', u'acoustic', u'Awesome', u'Dreamy', u'alone', u'Favorite Artists', u'Bittersweet', u'quiet', u'female vocals', u'depressing', u'female vocal', u'Nu Metal', u'rock ballad', u'pain', u'makes me cry', u'fantasy']"
504,Going Under,723730,5108986,214000,"[u'rock', u'Gothic Rock', u'Evanescence', u'female vocalists', u'Gothic', u'metal', u'alternative', u'Gothic Metal', u'alternative rock', u'hard rock', u'alternative metal', u'female vocalist', u'Going Under', u'Nu Metal', u'Female fronted metal', u'dark', u'symphonic metal', u'favorites', u'00s', u'american', u'goth', u'female vocals', u'female', u'pop', u'emo', u'pop rock', u'seen live', u'2003', u'melodic metal', u'amy lee', u'sad', u'USA', u'Nu-metal', u'EVANescence - Going under', u'heavy metal', u'singer-songwriter', u'angry', u'Favorite', u'twilight', u'dark rock', u'electronic', u'Favourites', u'Female Voices', u'8 of 10 stars', u'goth rock', u'not gothic', u'favorite songs', u'sexy', u'dance', u'memories']"
505,Wild Eyes,64606,651586,259000,"[u'metalcore', u'hardcore', u'perfect', u'metal', u'australian', u'Parkway drive', u'wiekopomna melodia', u'epic', u'Favorite', u'melodic hardcore', u'2012', u'2010s', u'Atlas', u'melodic metalcore', u'mega hit', u'How fucking great can a band be', u'pierwsze sekundy utworu a ja juz to uwielbiam', u'indie', u'rock', u'alternative', u'alternative rock', u'catchy', u'Awesome', u'3', u'12', u'4', u'Jam', u'english', u'15', u'FUCKING AWESOME', u'9', u'2', u'7', u'eyes', u'powerful', u'deathcore', u'awesomeness', u'13', u'14', u'6', u'10', u'8', u'breakdown', u'best songs of 2012', u'11', u'Technical Metalcore', u'Liebling', u'matt', u'mind-blowing', u'Carmen Electra']"
506,Dream Run,42079,363549,249000,"[u'metalcore', u'hardcore', u'metal', u'melodic metalcore', u'australian', u'Favorite', u'melodic hardcore', u'Parkway drive', u'Awesome', u'male vocalist', u'2012', u'2010s', u'english lyrics', u'Atlas', u'Milla Jovovich', u'one of the best songs on the new album', u'kate upton', u'doris ivy loves hardstyle', u'camille cerf', u'veronica avluv', u'zahia dehar', u'virginie caprice', u'k1r7m']"
507,Old Ghost / New Regrets,34881,265027,170000,"[u'metalcore', u'hardcore', u'music choice: metal', u'metal', u'Favorite', u'kim kardashian', u'Parkway drive', u'clara morgane', u'sophie lynx', u'ava lauren', u'flora coquerel', u'ayem nour', u'nabilla benattia']"
508,Sparks,40929,306785,138000,"[u'metalcore', u'hardcore', u'metal', u'melodic metalcore', u'intro', u'australian', u'Parkway drive', u'favorites', u'epic', u'Gothic', u'Awesome', u'australia', u'male vocalist', u'Favorite', u'2012', u'2010s', u'english lyrics', u'Atlas', u'aussi', u'k1r7m']"
509,A Cold Day in Hell,92474,731074,241000,"[u'metalcore', u'hardcore', u'metal', u'Melodic Death Metal', u'melodic metalcore', u'aussie hardcore', u'australian', u'death metal', u'Parkway drive', u'Breackdown', u'Fantastic Guitar Intro', u'heavy metal', u'summer', u'2005', u'brutal fucking hardcore move moment', u'sick breakdown', u'amazing', u'Favorite', u'2000s', u'deathcore', u'br00tal', u'australian metalcore', u'PWD', u'killing with a smile', u'Post Apocalyptic Lounge', u'fucking breakdowns', u'k1r7m']"
510,Smoke 'Em If Ya Got 'Em,109278,981917,220000,"[u'metalcore', u'hardcore', u'metal', u'screamo', u'deathcore', u'melodic metalcore', u'australian', u'Just fucking brutally amazing', u'Parkway drive', u'melodic hardcore', u'kick ass', u'breakdown', u'experimental', u'Melodic Death Metal', u'death metal', u'australian metalcore', u'heavy metal', u'amazing', u'hXc', u'breakdowns', u'fuckin good metalcore', u'brootal melodic', u'seen live', u'rock', u'emo', u'good', u'post-hardcore', u'Favourites', u'Aussie', u'Favourite Songs', u'Christian Metalcore', u'best played loud', u'mc', u'aussie hardcore', u'Speedy', u'Head Banging', u'Energetic', u'insane', u'2005', u'2000s', u'fucked up music by fucked up people', u'die', u'awesome riffs', u'jea', u'Fucking masterpiece', u'shirt', u'hurricane 2011', u'want to see it live', u'Breakdowns from Hell', u'not emo or screamo']"
511,Mutiny,99644,758425,193000,"[u'metalcore', u'hardcore', u'metal', u'australian metalcore', u'death metal', u'breakdowns', u'kickass metalcore', u'australian', u'thrash metal', u'Nu Metal', u'melodic metal', u'Technical Metal', u'Parkway drive', u'australian hxc', u'mother fucking metal bitches', u'heavy metal', u'heavy', u'Melodic Death Metal', u'groove metal', u'Grind', u'true metal', u'melodic metalcore', u'new', u'mutiny', u'www', u'breakdown', u'beatdown', u'Hell Yeah', u'fucking brilliant', u'fuck my mother these guys rock', u'high as fuck', u'most-wanted', u'Im Drunk', u'shit your pants metal', u'christians are gay', u'group-vocals', u'gang-vocals', u'of interest', u'guitar', u'good', u'Favorite', u'deathcore', u'<3', u'Pirates of the Caribbean', u'cool intro', u'group vocals', u'killing with a smile', u'4566216', u'fucking breakdowns', u'everything we like']"
512,It's Hard to Speak Without a Tongue,95068,776176,256000,"[u'metalcore', u'hardcore', u'melodic metalcore', u'metal', u'australian metalcore', u'deathcore', u'aussie hardcore', u'brutal', u'favorites', u'just love this track', u'kickass metalcore', u'Favorite Bands', u'Melodic Death Metal', u'death metal', u'post-hardcore', u'Very Good', u'Parkway drive', u'stars in my eyes', u'laying on the gras and looking to the sky', u'alternative', u'australian', u'post hardcore', u'like it', u'New stuff I should listen to', u'absolutely fucking love it', u'really good', u'this rocks', u'deluxe', u'seen live', u'guitar', u'me', u'Favorite', u'shit', u'melodic metal', u'huh', u'Eminem', u'great riff', u'Porno', u'awesome riffs', u'jake', u'great riffs', u'saw them live', u'makes my balls explode', u'parkway', u'Agressive music', u'mayara', u'killing with a smile', u'Kings Of Metal Core', u'SCREAM NIGGA', u'buen temazo pero es mejor el disco killing withs a smile']"
513,"Picture Perfect, Pathetic",90986,687684,163000,"[u'metalcore', u'hardcore', u'metal', u'melodic metalcore', u'Melodic Death Metal', u'melodic hardcore', u'brutal', u'australian', u'death metal', u'kick ass', u'breakdown', u'aussie hardcore', u'Australian Metalcore Scene', u'Breackdown', u'heavy metal', u'Favorite Bands', u'hardcore punk', u'deathcore', u'makes me want to dance', u'All time favourites', u'best played loud', u'brutal fucking hardcore move moment', u'Head Banging', u'Some Damn Good Music', u'Parkway drive', u'Never See Tomorrow', u'Love', u'2005', u'2000s', u'Tough', u'mean', u'Awesome Drums', u'Breakdowns from Hell', u'killing with a smile', u'fucking breakdowns']"
514,Blackout,102666,743167,163000,"[u'metalcore', u'deathcore', u'metal', u'melodic hardcore', u'australian metalcore', u'hardcore', u'death metal', u'Favorite Bands', u'2005', u'kick ass', u'melodic metalcore', u'2000s', u'All time favourites', u'breakdown', u'Some Damn Good Music', u'blackout', u'Parkway drive', u'WwWorld4us', u'killing with a smile', u'australian', u'guitar', u'drums', u'screamo', u'cool intro', u'Awesome Drums', u'PWD', u'fucking breakdowns', u'parkwaydrive', u'a track by parkway drive', u'k1r7m']"
515,"Guns for Show, Knives for a Pro",97849,766090,164000,"[u'metalcore', u'hardcore', u'metal', u'death metal', u'deathcore', u'screamo', u'Breakdowns from Hell', u'Awesome', u'aussie hardcore', u'australian metalcore', u'Parkway drive', u'Breackdown', u'brutal australia', u'heavy metal', u'Favorite Bands', u'australian', u'Melodic Death Metal', u'great song', u'Mosh', u'breakdown', u'best played loud', u'melodic metalcore', u'moshcore', u'brutal fucking hardcore move moment', u'Moshkrieg', u'Metalcore Mania', u'yipee ki yay motherfucker', u'thrash metal', u'2005', u'2000s', u'heard live', u'sample', u'songs', u'guns', u'Die Hard', u'movie sample', u'killing with a smile', u'fucking breakdowns', u'yippee-ki-yay motherfucker', u'die hard sample', u'k1r7m']"
516,Romance Is Dead,136036,1374444,317000,"[u'metalcore', u'hardcore', u'metal', u'australian metalcore', u'breakdown', u'deathcore', u'Melodic Death Metal', u'post-hardcore', u'so cry me a fucking river bitch', u'melodic metalcore', u'seen live', u'heavy metal', u'australian', u'screamo', u'kick ass', u'moshcore', u'so cry my a fucking river BITCH', u'hard rock', u'Love', u'Mosh', u'Brutalcore', u'awesome breakdowns', u'into your goddamn face', u'Breackdown', u'kickass metalcore', u'contains one of the greatest moments in music history', u'chill', u'favorite songs', u'thoughtful', u'aggressive', u'2000s', u'All time favourites', u'work out', u'Fight Music', u'Training Music', u'songs that i sing along to but i always forget the words so i say duh duh while trying to sound like i do know the words and no one is falling for it but they keep quiet because they are embarassed for me', u'breakdowns', u'bitch', u'songs I absolutely love', u'awesome breakdown', u'songs that you wanna listen to over and over again', u'brutal fucking hardcore move moment', u'Head Banging', u'Some Damn Good Music', u'when im angry or depressed', u'Parkway drive', u'friends songs', u'hell of a song', u'Meisterwerk', u'like a lonley dream']"
517,Pandora,107618,863694,238000,"[u'metalcore', u'hardcore', u'metal', u'Melodic Death Metal', u'favorites', u'screamo', u'All time favourites', u'melodic metalcore', u'amazing', u'australian metalcore', u'Parkway drive', u'fucking damn horny', u'heavy metal', u'death metal', u'deathcore', u'aussie hardcore', u'awesome lyrics', u'Head Banging', u'Some Damn Good Music', u'hell of a song', u'aussie metalcore', u'Sick Aussie Metal', u'favorite metalcore band', u'seen live', u'australian', u'Favorite', u'2005', u'I Like It', u'Power metal', u'2000s', u'awesomeness', u'pandora', u'awesome riffs', u'Romancecore', u'Escape the fate', u'stars in my eyes', u'driving fast with the windows down', u'killing with a smile', u'fucking breakdowns', u'damn aussie good']"
518,This Calling,318312,2261684,218000,"[u'metalcore', u'metal', u'Melodic Death Metal', u'hardcore', u'death metal', u'All That Remains', u'melodic metalcore', u'this calling', u'screamo', u'Awesome', u'favorites', u'heavy metal', u'Brutal and melodic', u'post-hardcore', u'rock', u'deathcore', u'seen live', u'Progressive metal', u'All That Remains - This Calling', u'american', u'Guitar Solo', u'Favorite Bands', u'live', u'interesting', u'Favorite', u'rock band', u'absolutely fucking love it', u'Double Kick', u'super fast double kick', u'beautiful', u'amazing', u'2000s', u'Massachusetts', u'rock band dlc', u'black death', u'Metal Core', u'quality metalcore']"
519,Somewhere I Belong,833401,6396891,214000,"[u'rock', u'Nu Metal', u'alternative rock', u'Linkin Park', u'alternative', u'metal', u'rapcore', u'Nu-metal', u'hard rock', u'alternative metal', u'Somewhere I belong', u'favorites', u'american', u'male vocalists', u'00s', u'Awesome', u'lp', u'rap', u'2003', u'crossover', u'rap rock', u'seen live', u'emo', u'Favorite', u'Favourites', u'FUCKING AWESOME', u'rap metal', u'Favourite Songs', u'heavy metal', u'punk', u'great', u'Rap-Rock', u'7 of 10 stars', u'linkin', u'sing along loud till yr voice goes', u'electronic', u'favorite songs', u'pop rock', u'angry', u'male vocalist', u'love at first listen', u'scratch', u'I love this song', u'2000s', u'Meteora', u'Morose Deep dilate Crimson', u'pop', u'hardcore', u'USA', u'Love']"
520,Breaking the Habit,847065,6842291,196000,"[u'rock', u'Nu Metal', u'alternative rock', u'Linkin Park', u'alternative', u'metal', u'Nu-metal', u'rapcore', u'hard rock', u'breaking the habit', u'favorites', u'Awesome', u'00s', u'american', u'electronic', u'lp', u'pop', u'alternative metal', u'male vocalists', u'electronica', u'favorite songs', u'favourite', u'linkin park - breaking the habit', u'2003', u'crossover', u'Meteora', u'emo', u'seen live', u'2004', u'punk rock', u'loved', u'male vocalist', u'Favourites', u'rap metal', u'indie', u'punk', u'epic', u'great song', u'FUCKING AWESOME', u'beautiful', u'angry', u'emotional', u'Favorite', u'electronic rock', u'linkin', u'Habit']"
521,Figure.09,448094,3016118,197000,"[u'Nu Metal', u'rock', u'alternative', u'Linkin Park', u'alternative rock', u'metal', u'rapcore', u'Nu-metal', u'hard rock', u'crossover', u'rap metal', u'american', u'alternative metal', u'00s', u'lp', u'favorites', u'angry', u'rap rock', u'Meteora', u'rap', u'Awesome', u'punk', u'emo', u'2003', u'screamo', u'amazing', u'male vocalists', u'8 of 10 stars', u'FUCKING AWESOME', u'Rap-Rock', u'SWAT Soundtrack', u'Figure09', u'Grunge', u'drums', u'Energetic', u'great', u'favourite', u'great song', u'male vocalist', u'Gothic Rock', u'heavy rock', u'10 of 10 stars', u'chester bennington', u'mike shinoda', u'my music', u'best song', u'impulsive', u'linkin', u'suicide murder machine', u'Nu Metal - Rap']"
522,Faint,952864,7592926,162000,"[u'rock', u'Nu Metal', u'Linkin Park', u'alternative rock', u'alternative', u'metal', u'rapcore', u'faint', u'hard rock', u'Nu-metal', u'favorites', u'Linkin Park - faint', u'american', u'Awesome', u'alternative metal', u'lp', u'00s', u'angry', u'punk', u'Energetic', u'punk rock', u'crossover', u'rap metal', u'Meteora', u'seen live', u'2003', u'aggressive', u'male vocalists', u'Favorite', u'classic rock', u'Hip-Hop', u'emo', u'mike shinoda', u'2000s', u'rap rock', u'heavy metal', u'favorite songs', u'hardcore', u'rap', u'great', u'Favourites', u'linkin', u'faint linkin park', u'pop', u'cool', u'modern rock', u'System of a Down', u'heavy', u'Love', u'screamo']"
523,Easier to Run,487479,3318055,204000,"[u'Nu Metal', u'rock', u'alternative rock', u'Linkin Park', u'alternative', u'rapcore', u'metal', u'Nu-metal', u'alternative metal', u'american', u'crossover', u'lp', u'emo', u'hard rock', u'favorites', u'rap', u'00s', u'male vocalists', u'rap rock', u'pop', u'Meteora', u'linkin park - easier to run', u'seen live', u'loved', u'Rap-Rock', u'Pop/Rock', u'listen forever', u'Nu Metal - Rap', u'easier to run', u'RockPop', u'Awesome', u'2003', u'California', u'rap metal', u'10 of 10 stars', u'6 of 10 stars', u'4 of 10 stars', u'chester bennington', u'mike shinoda', u'favourite tracks', u'Good memories', u'Metal rock', u'heavy metal', u'punk', u'favorite songs', u'reminds me of', u'Alternative  Punk', u'melodic', u'great', u'melancholy']"
524,Hit the Floor,499753,3301811,164000,"[u'Nu Metal', u'rock', u'Linkin Park', u'alternative rock', u'alternative', u'metal', u'rapcore', u'hard rock', u'Nu-metal', u'hit the floor', u'rap', u'american', u'crossover', u'Hip-Hop', u'alternative metal', u'favorite tracks', u'screamo', u'mike shinoda', u'Meteora', u'male vocalists', u'when im angry or depressed', u'pop', u'Favorite Bands', u'angry', u'8 of 10 stars', u'6 of 10 stars', u'Good Stuff', u'Rap-Rock', u'lp', u'Linkin Park - Hit the Floor', u'heavy metal', u'electronic', u'favorite songs', u'sexy', u'pop rock', u'favorites', u'RockPop', u'Awesome', u'favourite', u'FUCKING AWESOME', u'rap metal', u'Faves', u'chester bennington', u'rap-metal', u'5 of 10 stars', u'Niezle', u'rock tag', u'chillout', u'seen live', u'punk']"
525,Lying from You,605722,4508935,175000,"[u'rock', u'Nu Metal', u'Linkin Park', u'alternative rock', u'alternative', u'metal', u'rapcore', u'hard rock', u'Nu-metal', u'crossover', u'Lying From You', u'american', u'alternative metal', u'00s', u'rap', u'favorites', u'rap metal', u'lp', u'male vocalists', u'FUCKING AWESOME', u'rap rock', u'Meteora', u'linkin', u'Hip-Hop', u'emo', u'Awesome', u'angry', u'loved', u'8 of 10 stars', u'mike shinoda', u'my music', u'heavy metal', u'seen live', u'pop', u'RockPop', u'2003', u'screamo', u'live', u'alt rock', u'5 Stars', u'wrif-fm', u'Nu Metal - Rap', u'Grunge', u'Love', u'drums', u'amazing', u'favourite', u'Favorite', u'heard live', u'7 of 10 stars']"
526,Somewhere I Belong,833401,6396891,214000,"[u'rock', u'Nu Metal', u'alternative rock', u'Linkin Park', u'alternative', u'metal', u'rapcore', u'Nu-metal', u'hard rock', u'alternative metal', u'Somewhere I belong', u'favorites', u'american', u'male vocalists', u'00s', u'Awesome', u'lp', u'rap', u'2003', u'crossover', u'rap rock', u'seen live', u'emo', u'Favorite', u'Favourites', u'FUCKING AWESOME', u'rap metal', u'Favourite Songs', u'heavy metal', u'punk', u'great', u'Rap-Rock', u'7 of 10 stars', u'linkin', u'sing along loud till yr voice goes', u'electronic', u'favorite songs', u'pop rock', u'angry', u'male vocalist', u'love at first listen', u'scratch', u'I love this song', u'2000s', u'Meteora', u'Morose Deep dilate Crimson', u'pop', u'hardcore', u'USA', u'Love']"
527,Cure for the Itch,415255,2355435,157000,"[u'Nu Metal', u'rock', u'Linkin Park', u'alternative', u'electronic', u'alternative rock', u'instrumental', u'metal', u'rapcore', u'hard rock', u'Hip-Hop', u'electronica', u'alternative metal', u'00s', u'ambient', u'american', u'Nu-metal', u'turntablism', u'scratch', u'Cure for the Itch', u'techno', u'chillout', u'crossover', u'beat', u'rap metal', u'Linkin Park - Cure For The Itch', u'cool', u'scratching', u'hybrid theory', u'seen live', u'hip hop', u'chill', u'hardcore', u'experimental', u'USA', u'dance', u'Alternative  Punk', u'idm', u'drums', u'breakbeat', u'screamo', u'fav', u'alt rock', u'8 of 10 stars', u'ok', u'6 of 10 stars', u'4 of 10 stars', u'2000', u'lp', u'rap rock']"
528,Forgotten,507731,3371780,194000,"[u'Nu Metal', u'rock', u'Linkin Park', u'alternative', u'alternative rock', u'metal', u'rapcore', u'hard rock', u'Nu-metal', u'alternative metal', u'rap metal', u'crossover', u'rap rock', u'forgotten', u'lp', u'rap', u'favorites', u'american', u'punk', u'heavy', u'00s', u'Favorite', u'2000', u'mike shinoda', u'rap-metal', u'hybrid theory', u'male vocalists', u'Hybrid', u'linkin', u'Hip-Hop', u'great', u'Great Lyricists', u'8 of 10 stars', u'FUCKING AWESOME', u'7 of 10 stars', u'radioultra', u'linkin park rocks', u'Linkin Park - Forgotten', u'metalcore', u'seen live', u'hip hop', u'favorite songs', u'emo', u'Progressive rock', u'USA', u'Alternative  Punk', u'Awesome', u'Energetic', u'punk rock', u'nice']"
