,Songs,Listeners,Playcount,Duration,Tags
524,Breezeblocks,581237,6592242,227000,"[u'indie', u'alternative', u'british', u'10s', u'indie rock', u'fip', u'alt-J', u'indie pop', u'rock', u'art rock', u'2012', u'electronic', u'Experimental Rock', u'indie folk', u'trip-hop', u'seen live', u'alternative rock', u'experimental', u'summer', u'2013', u'2010s', u'neo-folk', u'art pop', u'where the wild things are', u'New to me', u'chill', u'folk', u'dub', u'UK', u'electro', u'catchy', u'indiepop', u'psychedelic pop', u'Driving', u'upbeat', u'atmospheric', u'winter', u'unique', u'1', u'folk rock', u'Rainy Day', u'melancholic', u'Psychedelic Rock', u'loved', u'british invasion', u'50', u'Favorite', u'Music Video', u'brilliant', u'love at first listen']"
525,Loud(y),29458,101859,249000,"[u'somafm', u'Bagel']"
526,Monsters,5685,43931,200000,[u'Scream: The TV Series']
527,Doing It To Death,64339,322579,249000,"[u'rock', u'alternative', u'stoner', u'fip', u'indierock', u'FM4', u'10s', u'fallon', u'2016', u'The Kills', u'garagerock', u'cemetery video', u'13 reasons why']"
528,Doing It To Death,64339,322579,249000,"[u'rock', u'alternative', u'stoner', u'fip', u'indierock', u'FM4', u'10s', u'fallon', u'2016', u'The Kills', u'garagerock', u'cemetery video', u'13 reasons why']"
529,Future Starts Slow,241550,1656659,245000,"[u'indie', u'indie rock', u'Garage Rock', u'rock', u'alternative', u'alternative rock', u'The Kills', u'female vocalists', u'if I ever give you up my heart will surly fail', u'garage rock revival', u'favorite songs', u'10s', u'2010s', u'drums', u'Favorite', u'fuck yeah', u'Post-punk revival', u'catchy as hell', u'political animals', u'pop', u'chill', u'UK', u'USA', u'Love', u'epic', u'Lo-Fi', u'post-punk', u'guitar', u'me', u'summer', u'sex', u'fip', u'future', u'2011', u'duo', u'Favourites', u""Grey's Anatomy"", u'kick your ass', u'explicit', u'9 of 10 stars', u'perfect', u'Friday', u'time', u'2012', u'Eargasm', u'favorites 2011', u'czHit', u'kat fm', u'6 of 10 stars', u'theme song']"
530,Doing It To Death,64339,322579,249000,"[u'rock', u'alternative', u'stoner', u'fip', u'indierock', u'FM4', u'10s', u'fallon', u'2016', u'The Kills', u'garagerock', u'cemetery video', u'13 reasons why']"
531,Heart Is a Beating Drum,101908,592082,260000,"[u'rock', u'alternative', u'indie', u'indie rock', u'Garage Rock', u'10s', u'gossip girl', u'ping pong', u'The Kills', u'dance to it', u'pop', u'punk', u'alternative rock', u'female vocalists', u'garage rock revival', u'kick your ass', u'Eargasm', u'10 of 10 stars', u'handclaps', u'body parts', u'Post-punk revival', u'1Live Fiehe', u'2k11 mix', u'The Best Music', u'saw it live', u'mfnw', u'Table Tennis', u'april-2012', u'blackbird-fly loved tracks', u'radoslavgeorgievindie']"
532,Future Starts Slow,241550,1656659,245000,"[u'indie', u'indie rock', u'Garage Rock', u'rock', u'alternative', u'alternative rock', u'The Kills', u'female vocalists', u'if I ever give you up my heart will surly fail', u'garage rock revival', u'favorite songs', u'10s', u'2010s', u'drums', u'Favorite', u'fuck yeah', u'Post-punk revival', u'catchy as hell', u'political animals', u'pop', u'chill', u'UK', u'USA', u'Love', u'epic', u'Lo-Fi', u'post-punk', u'guitar', u'me', u'summer', u'sex', u'fip', u'future', u'2011', u'duo', u'Favourites', u""Grey's Anatomy"", u'kick your ass', u'explicit', u'9 of 10 stars', u'perfect', u'Friday', u'time', u'2012', u'Eargasm', u'favorites 2011', u'czHit', u'kat fm', u'6 of 10 stars', u'theme song']"
533,Future Starts Slow,241550,1656659,245000,"[u'indie', u'indie rock', u'Garage Rock', u'rock', u'alternative', u'alternative rock', u'The Kills', u'female vocalists', u'if I ever give you up my heart will surly fail', u'garage rock revival', u'favorite songs', u'10s', u'2010s', u'drums', u'Favorite', u'fuck yeah', u'Post-punk revival', u'catchy as hell', u'political animals', u'pop', u'chill', u'UK', u'USA', u'Love', u'epic', u'Lo-Fi', u'post-punk', u'guitar', u'me', u'summer', u'sex', u'fip', u'future', u'2011', u'duo', u'Favourites', u""Grey's Anatomy"", u'kick your ass', u'explicit', u'9 of 10 stars', u'perfect', u'Friday', u'time', u'2012', u'Eargasm', u'favorites 2011', u'czHit', u'kat fm', u'6 of 10 stars', u'theme song']"
534,Alphabet Pony,141084,861425,105000,"[u'Garage Rock', u'indie rock', u'rock', u'alternative rock', u'The Kills', u'indie', u'femalevocalistsgdchill', u'alternative', u'female vocalists', u'crazy', u'2008 favorites', u'miianens playlist', u'electronic', u'seen live', u'british', u'UK', u'USA', u'2008', u'favorites', u'Lo-Fi', u'american', u'Like', u'Indie-Rock', u'investigate', u'00s', u'audioase', u'animals', u'interessant', u'horses', u'international', u'under two minutes', u'makes me want to dance', u'special', u'5 of 10 stars', u'somafm', u'bruno', u'britannique', u'americain', u'club misfits', u'Bagel', u'out the car window', u'une de les seves millors', u'505', u'Saturday night mix', u'horses and ponies and unicorns too', u'i wanna have sex whilst these songs are playing in the background', u'festiva', u'tom de piso', u'fuck my brain', u'andylikes']"
535,Doing It To Death,64339,322579,249000,"[u'rock', u'alternative', u'stoner', u'fip', u'indierock', u'FM4', u'10s', u'fallon', u'2016', u'The Kills', u'garagerock', u'cemetery video', u'13 reasons why']"
536,Monsters,5685,43931,200000,[u'Scream: The TV Series']
537,Future Starts Slow,241550,1656659,245000,"[u'indie', u'indie rock', u'Garage Rock', u'rock', u'alternative', u'alternative rock', u'The Kills', u'female vocalists', u'if I ever give you up my heart will surly fail', u'garage rock revival', u'favorite songs', u'10s', u'2010s', u'drums', u'Favorite', u'fuck yeah', u'Post-punk revival', u'catchy as hell', u'political animals', u'pop', u'chill', u'UK', u'USA', u'Love', u'epic', u'Lo-Fi', u'post-punk', u'guitar', u'me', u'summer', u'sex', u'fip', u'future', u'2011', u'duo', u'Favourites', u""Grey's Anatomy"", u'kick your ass', u'explicit', u'9 of 10 stars', u'perfect', u'Friday', u'time', u'2012', u'Eargasm', u'favorites 2011', u'czHit', u'kat fm', u'6 of 10 stars', u'theme song']"
538,Future Starts Slow,241550,1656659,245000,"[u'indie', u'indie rock', u'Garage Rock', u'rock', u'alternative', u'alternative rock', u'The Kills', u'female vocalists', u'if I ever give you up my heart will surly fail', u'garage rock revival', u'favorite songs', u'10s', u'2010s', u'drums', u'Favorite', u'fuck yeah', u'Post-punk revival', u'catchy as hell', u'political animals', u'pop', u'chill', u'UK', u'USA', u'Love', u'epic', u'Lo-Fi', u'post-punk', u'guitar', u'me', u'summer', u'sex', u'fip', u'future', u'2011', u'duo', u'Favourites', u""Grey's Anatomy"", u'kick your ass', u'explicit', u'9 of 10 stars', u'perfect', u'Friday', u'time', u'2012', u'Eargasm', u'favorites 2011', u'czHit', u'kat fm', u'6 of 10 stars', u'theme song']"
539,Future Starts Slow,241550,1656659,245000,"[u'indie', u'indie rock', u'Garage Rock', u'rock', u'alternative', u'alternative rock', u'The Kills', u'female vocalists', u'if I ever give you up my heart will surly fail', u'garage rock revival', u'favorite songs', u'10s', u'2010s', u'drums', u'Favorite', u'fuck yeah', u'Post-punk revival', u'catchy as hell', u'political animals', u'pop', u'chill', u'UK', u'USA', u'Love', u'epic', u'Lo-Fi', u'post-punk', u'guitar', u'me', u'summer', u'sex', u'fip', u'future', u'2011', u'duo', u'Favourites', u""Grey's Anatomy"", u'kick your ass', u'explicit', u'9 of 10 stars', u'perfect', u'Friday', u'time', u'2012', u'Eargasm', u'favorites 2011', u'czHit', u'kat fm', u'6 of 10 stars', u'theme song']"
540,Future Starts Slow,241550,1656659,245000,"[u'indie', u'indie rock', u'Garage Rock', u'rock', u'alternative', u'alternative rock', u'The Kills', u'female vocalists', u'if I ever give you up my heart will surly fail', u'garage rock revival', u'favorite songs', u'10s', u'2010s', u'drums', u'Favorite', u'fuck yeah', u'Post-punk revival', u'catchy as hell', u'political animals', u'pop', u'chill', u'UK', u'USA', u'Love', u'epic', u'Lo-Fi', u'post-punk', u'guitar', u'me', u'summer', u'sex', u'fip', u'future', u'2011', u'duo', u'Favourites', u""Grey's Anatomy"", u'kick your ass', u'explicit', u'9 of 10 stars', u'perfect', u'Friday', u'time', u'2012', u'Eargasm', u'favorites 2011', u'czHit', u'kat fm', u'6 of 10 stars', u'theme song']"
541,Future Starts Slow,241550,1656659,245000,"[u'indie', u'indie rock', u'Garage Rock', u'rock', u'alternative', u'alternative rock', u'The Kills', u'female vocalists', u'if I ever give you up my heart will surly fail', u'garage rock revival', u'favorite songs', u'10s', u'2010s', u'drums', u'Favorite', u'fuck yeah', u'Post-punk revival', u'catchy as hell', u'political animals', u'pop', u'chill', u'UK', u'USA', u'Love', u'epic', u'Lo-Fi', u'post-punk', u'guitar', u'me', u'summer', u'sex', u'fip', u'future', u'2011', u'duo', u'Favourites', u""Grey's Anatomy"", u'kick your ass', u'explicit', u'9 of 10 stars', u'perfect', u'Friday', u'time', u'2012', u'Eargasm', u'favorites 2011', u'czHit', u'kat fm', u'6 of 10 stars', u'theme song']"
542,Always Malaise (The Man I Am),119926,631539,253000,"[u'indie', u'post-punk', u'indie rock', u'alternative', u'rock', u'interpol', u'Post-punk revival', u'2010', u'10s', u'great titles', u'great indie', u'britpop', u'Post punk', u'beautiful', u'american', u'NYC', u'melancholic', u'New York City', u'matador', u'good music', u'porcupine tree', u'indie roc', u'music for a rainy summer day', u'triste', u'saw them live', u'postpunkgdchill', u'new york city gdchill', u'what am i']"
543,Something Is Not Right With Me,210390,872019,145000,"[u'indie rock', u'alternative', u'indie', u'rock', u'2008', u'alternative rock', u'american', u'cold war kids', u'00s', u'american i like', u'catchy', u'Awesome', u'indie disco', u'2000s', u'favorites', u'crazy', u'download', u'fun', u'blues rock', u'cool', u'good', u'male vocalists', u'love at first listen', u'FM4', u'altrock', u'us', u'ass kicker', u'art pop rock charms', u'seen live', u'70s', u'favorite songs', u'Surf', u'energy', u'Blue-Eyed Soul', u'post-punk', u'guitar', u'weird', u'me', u'upbeat', u'sunday', u'summer', u'Like', u'California', u'dramatic', u'trippy', u'great song', u'loved', u'wishlist', u'groovy', u'WBER']"
544,Mr. Nice Guy,92730,467881,161000,"[u'indie', u'indie rock', u'british', u'rock', u'male vocalist', u'2011', u'sex in the ear', u'Awesome', u'FUCKING AWESOME', u'10s', u'personal favourites', u'audioeric-fm', u'the kooks', u'luisterpaal', u'new favorite', u'120 bpm', u'must be played at full volume', u'Southside 2012', u'Wyjebane', u'new and good', u'songs you have to hear before you die', u'Bossa Muffin']"
545,Love Letters,99550,514586,315000,"[u'trumpet', u'goeiepoep', u'british', u'Retro', u'fip', u'sweet', u'electronic', u'indie', u'indie pop', u'10s', u'2014', u'best of 2014', u'chillout', u'electropop', u'pop', u'chill', u'rock', u'alternative', u'experimental', u'indiepop', u'new wave', u'world', u'quiet storm', u'bass', u'horns', u'3', u'new rave', u'synthpop', u'fun', u'female vocals', u'World Music', u'exotica', u'i love it', u'Fave', u'sunflower', u'elektra', u'Cocktails at Sunset', u'electrochill', u'delicious', u'wonky pop', u'over 5 minutes long', u'because music', u'baixo', u'indiena sound', u'rel-yr:2014', u'rel-mnth:2014:March', u'2014 single', u'BBC6', u'On the floor', u'saw it live']"
546,Cutt Off,356194,1563731,278000,"[u'indie', u'indie rock', u'rock', u'alternative', u'kasabian', u'british', u'alternative rock', u'electronic', u'britpop', u'brit rock', u'FUCKING AWESOME', u'psychedelic', u'hypnotic', u'british i like', u'electronica', u'Driving', u'male vocalists', u'00s', u'electro rock', u'uk undie', u'seen live', u'pop', u'dance', u'Awesome', u'good', u'wow', u'Electro-Rock', u'like it', u'kasabian tracks', u'experimental', u'UK', u'Love', u'2004', u'england', u'I like', u'male vocalist', u'fav', u'dance rock', u'english', u'ok', u'10 of 10 stars', u'Favourite Songs', u'Brit', u'electronic rock', u'fucking love it', u'Beloved tracks', u'rest of a rave', u'no blood for oil', u'fucking favorites', u'cutt off']"
547,Colour Of The Trap,56716,278142,208000,"[u'indie', u'british', u'indie rock', u'lovely', u'Mellow', u'charming', u'britpop', u'love at first listen', u'Retro', u'Favourites', u'this song is ruining my life', u'miles fucking kane', u'seen live', u'rock', u'perfect', u'Perfection', u'oh the climax', u'chillout', u'alternative', u'alternative rock', u'Awesome', u'2011', u'favorite track right now', u'fall in love', u'Marry Me Miles']"
548,Carolina Drama,183343,920398,355000,"[u'rock', u'epic', u'alternative', u'alternative rock', u'jack white', u'story', u'indie rock', u'blues', u'blues rock', u'Ballad', u'acoustic', u'00s', u'best songs ever', u'folk', u'good shit', u'folk rock', u'Southern Rock', u'2008', u'melancholy', u'lyrics', u'the raconteurs', u'sad song', u'favorite songs', u'sad', u'downtempo', u'blues-rock', u'americana', u'narrative', u'amazing', u'cool', u'Alternative Folk', u'Favourites', u'songwriting', u'Murder ballad', u'let me tell you a story', u'I think I am gonna crap in my pants this song is so good', u'Crazy Fucking Lyrics', u'Crybs symphony', u'chillout', u'indie', u'chill', u'Surf', u'Favoriter', u'singer-songwriter', u'favorites', u'calm', u'soft rock', u'Awesome', u'haunting', u'summer']"
549,Coming of Age,220558,1354786,280000,"[u'indie', u'alternative', u'indie rock', u'love at first listen', u'2014', u'indie pop', u'10s', u'rock', u'american', u'foster the people', u'pop', u'2010s', u'alternative rock', u'youtube', u'00s', u'fallon', u'heard live', u'happiness', u'neo psychedelic', u'liked it', u'obsessed', u'2014 single', u'relevant magazine', u'music choice: alternative', u'Channel X', u'favourite songs in 2014', u'discovered in 2014', u'love at frist listen', u'1love', u'love this omg', u'indie grls n boys']"
550,Let's Dance to Joy Division,470630,3530199,173000,"[u'indie', u'indie rock', u'british', u'alternative', u'britpop', u'rock', u'The wombats', u'happy', u'alternative rock', u'fun', u'dance', u'makes me wanna dance', u'indie pop', u'00s', u'Joy Division', u'Awesome', u'seen live', u'catchy', u'Love it', u'liverpool', u'Lets Dance To Joy Division', u'favorites', u'Ideal for dancing around the room', u'pop', u'party', u'pop rock', u'upbeat', u'Favourite Songs', u'wombats', u'2007', u'brit rock', u'indie disco', u'feelgood', u'party rock', u'amayzes loved', u'amazing', u'bouncy', u'love at first listen', u'FUCKING AWESOME', u'2000s', u'danceable', u'makes me happy', u'irony', u'pure joy explosion', u'favorite songs', u'UK', u'energy', u'feel good', u'Energetic', u'favourite']"
551,Someday,1045520,7299679,187000,"[u'indie rock', u'indie', u'rock', u'alternative', u'alternative rock', u'The Strokes', u'Garage Rock', u'00s', u'someday', u'new york', u'american', u'happy', u'favorites', u'garage', u'2001', u'Strokes', u'post-punk', u'fun', u'seen live', u'Love', u'catchy', u'Favourites', u'garage rock revival', u'Awesome', u'upbeat', u'NYC', u'feel good', u'male vocalists', u'rock n roll', u'Favorite', u'nostalgia', u'classic rock', u'chillout', u'Lo-Fi', u'Energetic', u'Makes Me Smile', u'The strokes - someday', u'british', u'favorite songs', u'USA', u'party', u'favourite', u'2000s', u'makes me happy', u'pop', u'cool', u'Favourite Songs', u'chill', u'punk', u'Grunge']"
552,Piledriver Waltz,167662,1485098,204000,"[u'british', u'Soundtrack', u'indie', u'alex turner', u'pop', u'indie rock', u'alternative', u'lyrical genius', u'singer-songwriter', u'rock', u'indie pop', u'beautiful', u'acoustic', u'waltz', u'amazing', u'male vocalist', u'2011', u'love at first listen', u'submarine', u'amazing voice', u'something in the air', u'breakfast at the heartbreak hotel', u'alternative rock', u'britpop', u'arctic monkeys', u'Mellow', u'christian', u'Masterpiece', u'10s', u'Owen Pallett', u'this IS love', u'010s', u'freshtuff', u'just simply adorable', u'czwarta rano wino i balkon', u'sexgod', u'song for lights out and eyes closed', u'submarine soundtrack', u'alex turner being beautiful', u'minimal', u'cover', u'super', u'male vocalists', u'00s', u'classical guitar', u'James Ford', u'good morning', u'makes me cry', u'crying', u'2010s']"
553,All We Ever Wanted Was Everything,29419,89344,263000,"[u'indie', u'cover', u'late night tales', u'prettiest song evahh', u'alternative', u'goth', u'shoegaze', u'american', u'10s', u'4 Stars', u'a perfect cover']"
554,Teeth,38848,147222,327000,"[u'indie rock', u'rock', u'alternative', u'alternative rock']"
555,Future Starts Slow,241550,1656659,245000,"[u'indie', u'indie rock', u'Garage Rock', u'rock', u'alternative', u'alternative rock', u'The Kills', u'female vocalists', u'if I ever give you up my heart will surly fail', u'garage rock revival', u'favorite songs', u'10s', u'2010s', u'drums', u'Favorite', u'fuck yeah', u'Post-punk revival', u'catchy as hell', u'political animals', u'pop', u'chill', u'UK', u'USA', u'Love', u'epic', u'Lo-Fi', u'post-punk', u'guitar', u'me', u'summer', u'sex', u'fip', u'future', u'2011', u'duo', u'Favourites', u""Grey's Anatomy"", u'kick your ass', u'explicit', u'9 of 10 stars', u'perfect', u'Friday', u'time', u'2012', u'Eargasm', u'favorites 2011', u'czHit', u'kat fm', u'6 of 10 stars', u'theme song']"
556,R U Mine?,619674,8244990,202000,"[u'indie rock', u'british', u'indie', u'rock', u'arctic monkeys', u'alternative', u'love at first listen', u'2013', u'Eargasm', u'songs that i will still be listening to in a billion years', u'songs i wish were written for me', u'alternative rock', u'sex', u'2012', u'british rock', u'walking the streets at night with your headphones on', u'Awesome', u'Garage Rock', u'obsessive repeated listening', u'am', u'alex turner', u'R U MINE', u'chill', u'sexy', u'catchy', u'amazing', u'better than god', u'fuckin genius', u'Masterpiece', u'10s', u'badass', u'2010s', u'if this were a pokemon i would catch it', u'songs that you wanna listen to over and over again', u'music choice: alternative', u'songs i would like to perform if i was a musician', u'when I Close My Eyes I go insane', u'moje brytole', u'makes me take my clothes off', u'I FEEL CONNECTED TO THIS SONG ON A SPIRITUAL LEVEL', u'chillout', u'seen live', u'pop', u'soul', u'punk', u'Love', u'epic', u'world', u'Contemporary', u'garage rock revival']"
557,Animal,536086,3762217,216000,"[u'indie', u'electropop', u'electronic', u'electronica', u'miike snow', u'pop', u'swedish', u'dance', u'alternative', u'catchy', u'synthpop', u'indie rock', u'indie pop', u'fun', u'2009', u'happy', u'indietronica', u'fresh', u'electro', u'Mellow', u'chill', u'indie electro', u'gossip girl', u'makes me happy', u'upbeat', u'summer', u'I like', u'synth', u'party', u'interesting', u'animal', u'feel good', u'euphoria', u'male vocalists', u'00s', u'weekend', u'dance around the living room in your underwear', u'Electro Pop', u'Workout', u'good mood', u'sex in the ear', u'i listen to this late at night in my underwear', u'reggea rock', u'MIKE SNOW', u'trip-hop', u'favorites', u'Awesome', u'loved', u'cool', u'Love it']"
558,Untitled,423804,3327660,236000,"[u'indie', u'indie rock', u'post-punk', u'alternative', u'rock', u'alternative rock', u'interpol', u'new york', u'melancholy', u'beautiful', u'hypnotic', u'00s', u'american', u'dark', u'atmospheric', u'seen live', u'sad', u'post-rock', u'chillout', u'favorite songs', u'favorites', u'Love', u'epic', u'new wave', u'Awesome', u'Mellow', u'amazing', u'Post-punk revival', u'intense', u'Bittersweet', u'best album openers', u'chill', u'indie pop', u'shoegaze', u'Dreamy', u'NYC', u'Favourites', u'I never saw you dancing', u'Post punk', u'Driving', u'winter', u'relaxing', u'songs that knock me out', u'forgotten favorites', u'classic', u'sexy', u'downtempo', u'USA', u'dream pop', u'nostalgic']"
559,1901,881388,8125130,193000,"[u'indie', u'indie pop', u'french', u'electronic', u'dance', u'indie rock', u'summer', u'pop', u'rock', u'alternative', u'catchy', u'Phoenix', u'love at first listen', u'best of 2009', u'2009', u'happy', u'00s', u'fun', u'alternative rock', u'upbeat', u'Love', u'france', u'lovedbygdchill', u'1901', u'party', u'favorites', u'electronica', u'FUCKING AWESOME', u'Love it', u'lovedbyale', u'louder is never enough', u'french pop', u'Like', u'male vocalists', u'gossip girl', u'The Vampire Diaries', u'dance in the shower', u'indietronica', u'loved', u'2000s', u'electric rhythm guitars', u'major key tonality', u'prominent use of synth', u'prominent percussion', u'pitchfork Top 500 Tracks of the 2000s', u'favorite songs', u'electro', u'energy', u'Driving', u'synthpop']"
560,Young Folks,825227,6083391,274000,"[u'indie', u'indie pop', u'swedish', u'alternative', u'pop', u'whistling', u'happy', u'indie rock', u'young folks', u'chillout', u'summer', u'whistle', u'fun', u'peter bjorn and john', u'rock', u'catchy', u'Love', u'scandinavian', u'gossip girl', u'folk', u'chill', u'favorites', u'Sweden', u'00s', u'sweet', u'cool', u'love at first listen', u'2006', u'best of 2006', u'beautiful', u'Favorite', u'alternative rock', u'Soundtrack', u'dance', u'Awesome', u'greys anatomy', u'twee', u'cute', u'indiepop', u'Favourites', u'Mellow', u'male vocalists', u'makes me happy', u'Swedish indie', u'the whistle song', u'female vocalists', u'morning', u'loved', u'duet', u'electronic']"
561,Mr. Nice Guy,92730,467881,161000,"[u'indie', u'indie rock', u'british', u'rock', u'male vocalist', u'2011', u'sex in the ear', u'Awesome', u'FUCKING AWESOME', u'10s', u'personal favourites', u'audioeric-fm', u'the kooks', u'luisterpaal', u'new favorite', u'120 bpm', u'must be played at full volume', u'Southside 2012', u'Wyjebane', u'new and good', u'songs you have to hear before you die', u'Bossa Muffin']"
562,The Bay,271945,2249591,290000,"[u'electronic', u'new rave', u'british', u'experimental', u'2011', u'fip', u'indie', u'poptron', u'pop', u'new wave', u'indietronica', u'summer', u'love at first listen', u'dantopluv', u'electropop', u'london', u'favourite', u'electro-indie', u'10 of 10 stars', u'songs to which I am sexually attracted', u'background music for a perfect day', u'video clip', u'Shut Up And Drive', u'chill', u'folk', u'indie pop', u'indie rock', u'electro', u'other', u'beautiful', u'quirky', u'late night', u'bounce', u'party', u'hypnotic', u'tolisten', u'male vocalists', u'sunshine', u'lovely', u'grinding', u'5 Stars', u'road trip', u'Playful', u'sunny', u'Best of', u'Eargasm', u'10s', u'insanely good', u'kat fm', u'catchy as fuck']"
563,Gimme Sympathy,274880,2487938,234000,"[u'indie', u'indie rock', u'female vocalists', u'Canadian', u'rock', u'Metric', u'alternative', u'so fucking catchy', u'i want to jump around to this song', u'fun', u'happy', u'dancing in the sunshine with smeared make-up and my best friend by my side', u'catchy', u'female vocalist', u'summer', u'love at first listen', u'2009', u'best of 2009', u'FUCKING AWESOME', u'party songs', u'beatles reference', u'loud in the morning', u'favorites', u'amazing', u'hypnotic', u'femalevocalistsgdchill', u'favorite song', u'alternative rock', u'new wave', u'beautiful', u'Awesome', u'loved', u'00s', u'Favorite', u'perfect', u'danceable', u'marvelous', u'IIIIIIIIII AMAZING TRACK :D IIIIIIIIII', u'catchy as hell', u'fuck yeah emily', u'emily haines', u'on repeat', u'good one', u'rolling stones reference', u'killer synth', u'songs that make my heart happy', u'electronic', u'seen live', u'favorite songs', u'indie electronic']"
564,You Only Live Once,841581,7125401,187000,"[u'indie rock', u'rock', u'indie', u'alternative', u'The Strokes', u'alternative rock', u'Garage Rock', u'00s', u'american', u'new york', u'favorites', u'post-punk', u'you only live once', u'Strokes', u'happy', u'seen live', u'garage', u'cool', u'indie pop', u'Love', u'Favorite', u'love at first listen', u'british', u'upbeat', u'punk rock', u'NYC', u'favourite', u'pop', u'favorite songs', u'amazing', u'punk', u'britpop', u'Awesome', u'Energetic', u'2006', u'heard on Pandora', u'Favourites', u'Love it', u'makes me happy', u'carpe diem', u'WALK IN THE STREET HEARING THIS', u'garage rock revival', u'guitar', u'feel good', u'fun', u'male vocalist', u'freedom', u'best songs ever', u'addictive the very first time you hear it', u'classic rock']"
565,Black Out Days,124107,812948,227000,"[u'indie pop', u'indie', u'electronic', u'female vocalists', u'psychedelic', u'trip-hop', u'experimental', u'indietronica', u'electronica', u'pop', u'rock', u'alternative', u'alternative rock', u'american', u'Passionate', u'ost', u'political', u'modern rock', u'2013', u'love at first listen', u'breakup', u'politics', u'Eargasm', u'10s', u'loooove', u'fallon', u'Neo-Psychedelia', u'glitch pop', u'powerful', u'ep', u'voices', u'best of 2014', u'best of 2013', u'psychosis', u'somafm', u'Black Celebration', u'redrage keys', u'gals', u'redrage recommends', u'psych-pop', u'Bagel', u'how to get away with murder', u'music choice: alternative', u'phantogram', u'indietonic', u'vices i admire', u'rememberhowlongsever', u'Hot2013', u'Crumpet', u'innakhoabbydanceprtybumfuckdenvercuntfete']"
566,Doing It To Death,64339,322579,249000,"[u'rock', u'alternative', u'stoner', u'fip', u'indierock', u'FM4', u'10s', u'fallon', u'2016', u'The Kills', u'garagerock', u'cemetery video', u'13 reasons why']"
