,Songs,Listeners,Playcount,Duration,Tags
630,Coke Bongs and Sing-A-Longs,17770,121337,128000,"[u'hardcore', u'Straight Edge', u'hc', u'melodic hardcore', u'straight edge hardcore', u'melodic hardcore punk']"
631,Disappearing Act,7204,34114,54000,"[u'Straight Edge', u'hardcore', u'straight edge hardcore', u'melodic hardcore', u'skate punk', u'hardcore punk', u'oldschool hardcore', u'positive hardcore']"
632,Monstar Squad,988,2284,65000,[u'hardcore punk']
633,Inquebrantable,3642,16813,182000,"[u'hardcore', u'Straight Edge', u'vegan sXe', u'metal', u'hardcoree']"
634,Conspiracy,21098,89568,253000,"[u'hardcore', u'moshcore', u'brutal fucking hardcore move moment', u'metalcore', u'metal', u'punk', u'Straight Edge', u'hardcore punk', u'friendsofthekingofrummelpop', u'beatdown', u'garten metal', u'hardcore for live', u'fucking MOSH']"
635,Someday,10457,44236,249000,"[u'metalcore', u'hardcore', u'favorite songs', u'Straight Edge', u'Awesome', u'screamo', u'death metal', u'favourite', u'hc', u'mathcore', u'deathcore', u'no', u'hard core', u'newschool hardcore', u'Prettymuch', u'sick double bass']"
636,Turn It Around,7272,30626,95000,"[u'hardcore', u'USA', u'Straight Edge', u'90s', u'vegetarian', u'youth crew']"
637,One Chance,4101,17628,113000,"[u'hardcore', u'Straight Edge', u'beatdown', u'beatdown hardcore']"
638,One Body Too Many,40131,218699,217000,"[u'deathcore', u'metalcore', u'hardcore', u'Melodic Death Metal', u'symphonic deathcore', u'death metal', u'winds of plague', u'grindcore', u'Straight Edge', u'metal', u'to download', u'symphonic death metal', u'bad ass', u'Melodic Deathcore', u'blackcore', u'sup', u'black metalcore', u'less than a million', u'seen live', u'punk', u'brutal', u'hardcore punk', u'Love it', u'Good Stuff', u'Brutal Death Metal', u'Blackened Death Metal', u'blackened hardcore', u'good song', u'NOT GRINDCORE', u'great drums', u'blackened deathcore', u'pussies', u'whatevercore', u'One Body Too many', u'winds of plauge', u'song i can growl to']"
639,Crossed Fingers,15391,89131,95000,"[u'hardcore', u'Straight Edge', u'punk', u'sick', u'hc', u'go vegan', u'Blacklisted', u'hardcore straight edge', u'Ridiculously awesome', u'blacklisted- crossed fingers', u'Blacklisted Crossed Fingers']"
640,new regrets,899,3055,0,"[u'hardcore', u'Straight Edge', u'argentina', u'00s', u'vegetarian', u'oldschool hardcore', u'hXc', u'positive hardcore', u'Youthcrew']"
641,Understand,13982,94156,175000,"[u'hardcore', u'Straight Edge', u'melodic hardcore', u'hc', u'hardcore punk', u'hXc', u'understand', u'betrayed', u'My first tag', u'New Oldschool']"
642,You're Dead,5606,25307,66000,"[u'Straight Edge', u'hardcore', u'hardcore punk', u'Awesome', u'Favorite songs ever', u'punk minute']"
643,The City Lights,8407,38861,156000,"[u'hardcore', u'melodic hardcore', u'Straight Edge', u'posi', u'USA', u'favorites', u'xxx', u'out', u'00s', u'the best', u'youth crew', u'emo oder was']"
644,Straight Outta Hardcore,8353,35691,119000,"[u'Straight Edge', u'hardcore', u'seen live', u'punk rock', u'posicore', u'hardcore oldschoolhardcore']"
645,Society's Killing Me,2669,7451,49000,"[u'Straight Edge', u'punk', u'hardcore', u'hardcore punk', u'SxE']"
646,Speak Out,4752,16054,182000,"[u'Straight Edge', u'seen live', u'old school', u'listen to more', u'youth crew']"
647,Bully,13389,49317,66000,"[u'hardcore', u'classic', u'punk', u'Straight Edge', u'Old-School', u'heavy bottom end', u'fuzzy guitar goodness', u'fun to skateboard to', u'superb song to drive to', u'i love singing along', u'westcoasthc', u'punl']"
648,Three Hundred Liars,7634,27296,192000,"[u'Straight Edge', u'hardcore', u'metal', u'punk', u'headbangers ball', u'krishna core']"
649,Failure,20260,132551,77000,"[u'hardcore', u'Straight Edge', u'oldschool hardcore', u'youth crew', u'electronic']"
650,To a Dead God,11884,63471,138000,"[u'hardcore', u'Straight Edge', u'best']"
651,By Your Side,3798,18154,106000,"[u'Straight Edge', u'punk', u'punk rock', u'hardcore punk', u'rock', u'hardcore', u'american', u'00s', u'punkrock', u'rex ferric faves', u'standard mid-paced vocals', u'fucking MOSH', u'stompage lol']"
652,Superhero,17469,92815,187000,"[u'hardcore', u'Straight Edge', u'USA', u'90s', u'superheroes', u'best song', u'Youthcrew', u'songs to keep the edge strong', u'watt an intro']"
653,Sword And Bullet,10715,48596,306000,"[u'metalcore', u'hardcore', u'Straight Edge', u'German Metalcore', u'metal', u'seen live', u'insane', u'german', u'awesome riffs', u'vegan straight edge', u'great solos', u'this means music', u'mayara', u'fucking breakdowns', u'purid']"
654,Remember Me,11602,64732,173000,"[u'hardcore', u'Straight Edge', u'brutal fucking hardcore move moment', u'Mosh', u'beatdown', u'metalcore', u'brutal', u'straight edge hardcore', u'boston hardcore', u'beatdown hardcore', u'Solomusika-Loved', u'tough guy', u'straight edge moshcore', u'lols', u'steh auf du sau', u'derber schrammel', u'lolsandwich', u'poopsocks']"
655,Earth and Stone,24950,172198,198000,"[u'hardcore', u'modern hardcore', u'punk', u'Straight Edge', u'melodic hardcore', u'hardcore punk', u'BK', u'shit i need to download', u'100p', u'mayara']"
656,Monster Squad,18945,100790,73000,"[u'hardcore', u'Straight Edge', u'Kids Like Us', u'metalcore', u'hc', u'hardcore punk', u'Mosh', u'indie', u'rock', u'punk', u'alternative', u'indie rock', u'female vocalists', u'dance', u'crazy', u'The Flaming Lips', u'Like', u'intense', u'fun', u'radiohead', u'straight edge hardcore', u'sweet', u'Love it', u'elliott smith', u'coolness', u'tegan and sara', u'Built to Spill', u'death cab for cutie', u'oldschool hardcore', u'Eisley', u'posi', u'Electro-Rock-Pop', u'bane', u'b0ni', u'cv', u'bbbb', u'punk minute', u'yeaboi', u'kids like us - monster squad', u'fuckin BAD', u'jacksonville hardcore']"
657,For Those Who Believe,5837,25884,111000,"[u'hardcore', u'Straight Edge', u'hardcore punk', u'positive hardcore', u'punk rock', u'xlooking forwardx', u'-get', u'el grupo nuevo']"
658,Give It Up,15801,80942,176000,"[u'hardcore', u'Old school Hardcore', u'nyhc', u'Straight Edge', u'straight edge hardcore', u'youth crew', u'Judge', u""80's"", u'hardcore punk', u'80s HC', u'BriansHardcorepunk']"
659,Pain 101,17049,98853,205000,"[u'Straight Edge', u'straight edge hardcore', u'hardcore', u'melodic hardcore', u'positive hardcore', u'seen live', u'not', u'posi-core', u'Casey Jones-Pain 101', u'mayara']"
660,"How 'Bout No, Scott?",30563,166926,79000,"[u'hardcore', u'seen live', u'pop punk', u'melodic hardcore', u'hardcore punk', u'punk pop', u'Set Your Goals', u'Bamboozle 2008', u'pft']"
661,Girl's Got A Face Like Murder,24542,121236,115000,"[u'hardcore', u'screamo', u'mathcore', u'metalcore', u'seen live', u'Love', u'post-hardcore', u'so fucking good', u'beatfarm', u'Fear Before', u'amazingcore', u'face like murder', u'Fear Before The March']"
662,The Machinist,49887,405705,176000,"[u'hardcore', u'hardcore punk', u'Straight Edge', u'hc', u'have heart', u'Strongholds of lyric', u'USA', u'epic', u'Awesome', u'great lyrics', u'00s', u'straight edge hardcore', u'boston hardcore', u'hardcore-punk', u'manifest of anger']"
663,Voices Off Camera,128336,890293,135000,"[u'punk rock', u'punk', u'hardcore', u'melodic hardcore', u'Favourites', u'emocore', u'rock', u'2000s', u'2003', u'american', u'punkrock', u'top songs', u'Rise Against', u'seen live', u'Love', u'male vocalist', u'great lyrics', u'00s', u'8 of 10 stars', u'english lyrics', u'Illinois', u'American Punk', u'just plain good', u'american rock', u'hardcore-punk', u'tracks you should cuddle up with', u'2000s rock', u'Kick ass songs', u'hardcore punkrock', u'lilalaunekatze', u'life wouldnt be the same without this song', u'p4nk7', u'2000s punk', u'revolutions per minute', u'k1r7m']"
664,She Calls Home,31627,118113,155000,"[u'hardcore', u'the bled', u'metalcore', u'favorites', u'metal', u'screamo', u'post-hardcore', u'rock', u'emo', u'hard rock', u'finnish', u'I like', u'good', u'perfect', u'hXc', u'rawkcore', u'junkycore', u'Herms Bangin Party Mix 16', u'screamoish', u'360shift', u'sau fein', u'The Bledx333', u'the bled--she calls home', u'awesomewithahintofhardsex', u'emo oder was', u'she calls home', u'Wow good', u'emo and stuff', u'Better then sex', u'word: home']"
665,Love American,36137,180844,134000,"[u'hardcore', u'hardcore punk', u'melodic hardcore', u'american nightmare', u'metalcore', u'punk', u'heard on Pandora', u'Old school Hardcore', u'massachusetts hardcore', u'Give up the Ghost - Love American', u'metal', u'Straight Edge', u'punk rock', u'screamo', u'post-hardcore', u'hc', u'<3', u'new england', u'Massachusetts', u'bof', u'boston hardcore', u'hard core', u'moshcore', u'less than three', u'Mix Tape', u'Hardcore and Metalcore', u'new school hardcore', u'yep', u'massachusetts rock', u'tracking 2008', u'equal vision', u'screamo punk', u'New Punk', u'Lets All Go Moshy Bashin', u'drive a Mack truck up yo Ass', u'love it or leave it', u'early 00s', u'Give up the ghost', u'well rounded hxc', u'love american', u'tough stuff', u'masscore', u'too bad they broke up', u'songs that shatter crash melt burn', u'memories memories', u'complete takeover', u'throw shit', u'emo oder was', u'wieder hoeren', u'vitaminbombe']"
666,Milligram Smile,71900,387071,216000,"[u'metalcore', u'hardcore', u'screamo', u'post-hardcore', u'emocore', u'From Autumn to Ashes', u'emo', u'rock', u'favorite songs', u'metal', u'favourite', u'Emotional Hardcore', u'punk', u'Progressive metal', u'punk rock', u'cool', u'wow', u'FUCKING AWESOME', u'favorite song', u'powerful', u'Good Stuff', u'Favourite Songs', u'Faves', u'greatness', u'add', u'All time favourites', u'boss', u'emo violence', u'emo-core', u'fav songs', u'i love these tracks', u'my shit', u'First Choice', u'HardcoreFavorites', u'great pickup for downers', u'punk-emo', u'hXc emotion', u'my most favourite', u'To Put The Hate Back In You', u'FATA milligram smile', u'wundertoll', u'milligram', u'huh88h', u'Shit that calms me down', u'punk-rock rock  post-hardcore  screamo  emo  metalcore  hardcore usw', u'I can hear the bass really well here', u'atum to ashes', u'milligram smile', u'milligramsmile']"
667,Tough Guy,143328,459519,57000,"[u'punk', u'hardcore punk', u'hardcore', u'punk rock', u'rap', u'Hip-Hop', u'hip hop', u'90s', u'american i like', u'rock', u'Beastie Boys', u'B-Boys', u'Morose Deep dilate Crimson', u'speed hip hop', u'metal', u'alternative', u'hard rock', u'short', u'new york', u'Energetic', u'the beastie boys', u'Beastie Boys - Tough Guy', u'Grunge', u'alternative rock', u'favorites', u'Awesome', u'american', u'NYC', u'guitar jams', u'Awesome Guitar Jams', u'short song', u'rcks', u'Favourites', u'alternative hip-hop', u'too short', u'under a minute', u'title is a full sentence', u'4 of 10 stars', u'under two minutes', u'old school hip-hop', u'rap rock', u'general hip hop', u'own', u'The Shit', u'Reel', u'hip-hop and rap', u'rock out', u'Killer Beats', u'diablo', u'shouty music']"
668,Off My Chest,16168,108902,131000,"[u'hardcore', u'USA', u'Straight Edge', u'90s', u'hardcore punk', u'posi', u'bourrin', u'olschool hardcore']"
669,Sick Of Sleeping,12106,64702,152000,"[u'hardcore', u'heavy metal', u'USA', u'00s', u'melodic hardcore', u'hardcore punk', u'My Favorites', u'Killing The Dream', u'newschool', u'fracture-sound']"
670,Armageddon,18512,69090,73000,"[u'hardcore', u'beatdown', u'metalcore', u'metal', u'punk', u'hardcore punk', u'awesome breakdowns', u'brutal fucking hardcore move moment', u'Music to kick someones ass to', u'tough guy']"
671,Tonight Is the Night We Ride,24556,110267,153000,"[u'hardcore', u'melodic hardcore', u'metalcore', u'punk', u'Evergreen Terrace', u'seen live', u'Favorite Bands', u'male vocalists', u'Favorite', u'hardcore punk', u'Good Stuff', u'scream', u'Mosh', u'hXc', u'tough guy hardcore', u'melodic metalcore', u'Zaebis', u'rawkcore', u'go vegan', u'city at night', u'love it or leave it', u'good hardcore', u'sau fein', u'ahuenna', u'emo oder was', u'jevi tmb']"
672,We Hate,14754,72070,177000,"[u'hardcore', u'nyhc', u'metalcore', u'metal', u'seen live', u'angry', u'great lyrics', u'Love it', u'bitchy', u'Sworn Enemy', u'music that gets me my dick hard', u'Not Happy', u'WAHHH', u'hate anthem', u'I Hate Pop', u'twisted panties', u'your music sucks']"
673,Life Is Hard Enough,56401,511005,56000,"[u'hardcore', u'Straight Edge', u'punk', u'have heart', u'indie', u'positive', u'metalcore', u'Awesome', u'american', u'punk rock', u'xxx', u'melodic hardcore', u'abrasive', u'under two minutes', u'boston hardcore', u'mess', u'modern hardcore', u'Abriss', u'Life is Hard Enough - Have Heart']"
674,John and Jimmy,36226,221897,112000,"[u'hardcore', u'hardcore punk', u'Modern Life Is War', u'd-beat', u'seen live', u'Crust', u'skinhead reggae', u'male vocalist', u'friendsofthekingofrummelpop', u'my favorite', u'MO', u'us-american', u'witness', u'MLIW', u'melotic hardcore']"
675,Off Broadway,53022,289924,148000,"[u'hardcore', u'every time i die', u'mathcore', u'seen live', u'Southern Rock', u'hardcore punk', u'metalcore', u'favorites', u'crazy', u'screamo', u'heard on Pandora', u'spastic', u'00s', u'post-hardcore', u'emocore', u'post hardcore', u'good music', u'own cd', u'New School', u'Some of my favorite bands', u'B R U T A L', u'sau fein', u'bije po masce', u'Love this shitttt']"
676,Set Your Body Ablaze,26919,128785,220000,"[u'hardcore', u'metalcore', u'melodic hardcore', u'metal', u'screamo', u'shai hulud', u'rapcore', u'Primer 55', u'marilyn manson', u'seen live', u'punk', u'Stoner Rock', u'epic', u'hardcore punk', u'Rammstein', u'Eargasm', u'banger', u'metallic hardcore', u'otep', u'Biohazard', u'killswitch engage', u'Slipknot', u'3rd Strike', u'36 Crazyfists', u'Korn', u'melodic metalcore', u'taproot', u'progressive hardcore', u'Stone Sour', u'Finch', u'Poison The Well', u'Flaw', u'atreyu', u'guano apes', u'Chimaira', u'HED planet earth', u'sPout', u'Demon Hunter', u'Clawfinger', u'American Head Charge', u'HED Pe', u'Snot', u'Bleeding Through', u'Coal Chamber', u'senser', u'Element Eighty', u'Spineshank', u'Evergreen Terrace', u'Mushroomhead', u'check out soon']"
677,The Abolition Of Man,85808,459492,166000,"[u'post-hardcore', u'hardcore', u'screamo', u'hard rock', u'thrice', u'rock', u'punk', u'alternative rock', u'indie', u'Alernative Punk', u'metalcore', u'alternative', u'Hard', u'experimental', u'indie rock', u'Progressive rock', u'Awesome', u'american', u'Paramore', u'punk rock', u'amazing', u'fav', u'Guilty Pleasures', u'melodic hardcore', u'post hardcore', u'FUCKING AWESOME', u'Yay', u'blood', u'Legendary', u'geil', u'Hammer', u'awesomenessss', u':D', u'emo-core', u'FODA', u'radd', u'fave songs at the moment', u'groezrock', u'drum2008', u'de berrege', u'de choke', u'den dierckx', u'Emo and punk', u'Frostys', u'First Choice', u'mars hill', u'Post- hardcore', u'Favouriten', u'Konzertwunschliste', u'Club Planty FM']"
678,"Another Day, Another Idiot",34050,160431,118000,"[u'hardcore', u'metalcore', u'female vocalists', u'metal', u'moshcore', u'loud and dirty', u'miianens playlist', u'black metal', u'seen live', u'punk', u'heavy', u'favorites', u'download', u'death metal', u'Nu Metal', u'hc', u'2', u'Symphonic Black Metal', u'BK', u'really fucking good', u'qq', u'Extreme and aggressive female fronted', u'Walls Of Jericho', u'Candace Kucsulain', u'cleimi']"
679,Epilogue: Forgiveness,19421,112735,226000,"[u'hardcore', u'melodic hardcore', u'deathcore', u'modern hardcore', u'metalcore', u'power', u'epic', u'new', u'131', u'the carrier - epilogue : forgivness', u'THECARRIER']"
680,Pusher,724,1248,151000,[]
681,Reign Of Terror,1169,5254,0,[]
682,fuck you geraldo,1154,5382,0,[]
683,Seeing Is Denying,2931,16416,0,[u'Straight Edge metalcore']
684,Jumping Ships,1866,11829,0,"[u'hardcore', u'metalcore', u'straight edge hardcore']"
685,Intro (the cash man),645,2581,0,[]
686,Misanthropes,6603,28003,256000,"[u'deathcore', u'metalcore', u'metal', u'Melodic Death Metal', u'death metal', u'whatevercore', u'heavy metal', u'Technical Death Metal', u'symphonic deathcore', u'less than a million']"
687,Plague of The Elected,5767,21957,261000,"[u'brutal metal', u'hardcore', u'Melodic Death Metal', u'metal', u'good', u'scream']"
688,Force Of Destruction,6110,24805,349000,"[u'deathcore', u'metalcore', u'hardcore', u'metal', u'Melodic Death Metal', u'death metal', u'over 5 minutes long', u'Kep', u'hisme', u'job for a hardcore melodic dahlia anyone', u'Force of Destruction']"
689,Draining What Remains,6282,26481,270000,"[u'metal', u'death metal', u'metalcore', u'deathcore', u'hardcore', u'screamo', u'Draining what remains']"
690,Chronicles,7266,31335,291000,"[u'deathcore', u'death metal', u'good', u'viatrophy', u'metalcore', u'Progressive metal', u'Technical Death Metal', u'Chron']"
691,In The Hope Of Something Safe,6174,21394,115000,"[u'deathcore', u'metalcore', u'metal', u'instrumental', u'Melodic Death Metal', u'1', u'death metal', u'BladesOfIndica']"
692,Удары Судьбы,2084,15268,0,"[u'hardcore', u'punk', u'punk rock', u'hardcore punk', u'russian punk', u'russian hardcore', u'jebenica', u'jebemtimaterupichku-tojepank', u'russian scene', u'kruto-tekuche', u'hardcore underground full tracks']"
693,Good night white pride,2249,15593,144000,[u'hardcore']
694,Тишина,2119,14606,150000,"[u'punk', u'hardcore', u'screamo', u'hardcore punk', u'Emotional Hardcore', u'russian scene']"
695,Моя Сцена,2771,20913,0,[u'hardcore']
696,Голос животных,2751,18705,200000,"[u'hardcore', u'Straight Edge', u'straight edge hardcore', u'antifa scum', u'antifa is shit', u'anal iisus']"
697,Моя жизнь,2757,20366,147000,[u'hardcore']
698,Ради Чего?,1915,12897,0,[]
699,"Больше, Чем Музыка",1483,11351,0,"[u'hardcore', u'straight edge hardcore']"
700,Последняя война,1674,12079,151000,"[u'hardcore', u'straight edge hardcore', u'antifa']"
701,Друг За Друга,2468,14943,0,"[u'hardcore', u'russian hardcore', u'punk', u'russian', u'antifa', u'beatdown hardcore', u'post-kircore', u'anal-vaginal pop', u'anal gaycore', u'afa shit', u'Huesoscore', u'Pedarstcore']"
702,Отклонение От Схемы,1975,13434,0,[u'hardcore']
703,Кризис земли,1720,12095,188000,[u'hardcore']
704,Наши Друзья,2657,16439,0,"[u'punk', u'hardcore', u'Awesome', u'russian', u'melodic hardcore', u'Old school Hardcore', u'straight edge hardcore', u'hardcore punk', u'<3', u'russian punk', u'Oi', u'oldschool hardcore', u'russian hardcore', u'SxE', u'antifa', u'post-kircore', u'anal-vaginal pop', u'hcpunk', u'jebenica', u'jebemtimaterupichku-tojepank', u'anal gaycore', u'russian scene', u'HC-punk', u'afa shit', u'punk underground full tracks', u'hardcore underground full tracks', u'Huesoscore', u'Pedarstcore']"
705,Annular Eclipse,15085,72556,227000,"[u'metalcore', u'German Metalcore', u'metal', u'seen live', u'rock', u'favorites', u'german', u'Vegan', u'Awesome solo', u'SxE', u'Porno', u'metallcore', u'eunuch', u'RH', u'mercenary', u'unsere Erde', u'ein tag', u'nahrung', u'watn riff alta', u'progressive monster']"
706,Wake Up In Hell,18331,88726,234000,"[u'metalcore', u'hardcore', u'Vegan', u'vegan straight edge', u'seen live', u'Straight Edge', u'german', u'SxE', u'German Metalcore', u'vegan sXe', u'metal', u'Melodic Death Metal', u'1', u'maroon 5', u'XVX', u'breakdowns', u'Fucking masterpiece', u'maroon', u'RH', u'maroon rocks', u'dumme veganer aber nice mucke', u'vegan straightedge', u'Wake Up In Hell']"
707,Sirius,10763,46585,54000,"[u'metalcore', u'instrumental', u'names', u'Sirius', u'German Metalcore', u'metallcore', u'METALCORE VERDAMMT es heisst METALCORE']"
708,"And If I Lose, Welcome Annihilation",10818,56455,138000,"[u'metalcore', u'Vegan']"
709,24hourhate,11231,62120,225000,"[u'metalcore', u'Straight Edge', u'hardcore', u'german', u'seen live', u'Vegan', u'German Metalcore', u'vegan straight edge metalcore', u'Hell On Earth Tour 2006']"
710,Only Time Can Tell,227,591,186000,[]
711,Travail,246,629,305000,[]
712,B) Shifter,256,693,226000,[]
713,A) Shape,251,632,137000,[]
714,Feeler,293,743,99000,[u'metal']
715,Dining With Rats,283,743,321000,[]
716,The Vulgar,305,890,157000,[]
717,Conundrum City,341,926,168000,[]
718,Yester Year,259,709,0,[]
719,Ferocious Were The Ghost Wolves,351,982,208000,[]
720,Ascending White Mountain,405,1245,175000,[]
721,You Are My Shelter,11205,43988,299000,"[u'thrash metal', u'metal', u'metalcore', u'hardcore', u'death metal', u'Nu Metal', u'melodic metal', u'into your fucking heart', u'seen live', u'trash metal', u'Technical Metal', u'groove metal', u'true metal', u'fuck my mother these guys rock', u'high as fuck', u'querbeet4', u'Im Drunk', u'mother fucking metal bitches', u'shit your pants metal', u'christians are gay', u'Pawer Metal', u'MUSIC TO FUCK HOMELESS PEOPLE TO', u'rockorocko style']"
722,Only God,13469,52365,154000,"[u'thrash metal', u'metalcore', u'metal', u'death metal', u'groove metal', u'thrash', u'thrashcore', u'neothrash', u'corrupt', u'Sick Music', u'SICmuSIC', u'elkto', u'querbeet4']"
723,Painful But True,11137,40070,305000,"[u'thrash metal', u'metal', u'groove metal', u'painful but true', u'seen live', u'death metal', u'querbeet4', u'ektomorf - painful but true']"
724,From Far Away,10919,39218,289000,"[u'metalcore', u'metal', u'thrash metal', u'Ektomorf', u'death metal', u'corrupt', u'SICmuSIC', u'querbeet4', u'From Far Away']"
725,Everything,12984,48551,188000,"[u'thrash metal', u'metalcore', u'Ektomorf', u'querbeet4']"
726,No Compromise,14060,49465,171000,"[u'metalcore', u'thrash metal', u'metal', u'Ektomorf', u'hardcore', u'death metal', u'i love it', u'thrashcore', u'groove metal', u'dis', u'SICmuSIC', u'querbeet4', u'Irak metal']"
727,Gypsy,12019,57066,277000,"[u'thrash metal', u'metalcore', u'Gipsy Hardcore', u'hungarian', u'metal', u'root', u'gipsy folk metal', u'seen live', u'hardcore', u'Nu Metal']"
728,Destroy,22028,85411,232000,"[u'thrash metal', u'metal', u'groove metal', u'metalcore', u'death metal', u'seen live', u'hardcore', u'destroy', u'Awesome', u'Gypsy', u'deathcore', u'thrashcore', u'Tribal Metal', u'hungarian metal', u'max', u'groove thrash metal', u'SICmuSIC', u'querbeet4', u'kto nie slucha ten pizda', u'etkomorf', u'w chuj zajebiste', u'awesomeness in form of sound']"
729,Tear Apart,10078,36312,110000,"[u'thrash metal', u'metal', u'groove metal', u'Trashcore', u'fuk yea']"
730,A.e.a.,8974,30450,308000,"[u'thrash metal', u'groove metal', u'trash metal', u'metal', u'wishlist', u'hungarian', u'Thrash-Metal']"
731,I Know Them,28789,120535,279000,"[u'thrash metal', u'metal', u'ethnic', u'Ektomorf', u'thrash', u'hardcore', u'angry', u'trash metal', u'Tribal Metal', u'metalcore', u'groove metal', u'Fuck You All', u'Ektomorf - I Know Them', u'soulfly clone', u'heavy metal', u'seen live', u'Melodic Death Metal', u'death metal', u'Nu Metal', u'gut', u'hungarian metal', u'Old School Metal', u'brazilian metal', u'cavalera conspiracy', u'Ruhrpott', u'ungarn', u'canteo', u'hit maker', u'q3', u'i know them', u'moodUP', u'querbeet4', u'hun', u'HarukaEX S2', u':Belinda Mugge:', u'oxuitelno', u'Die Luzzie geht ab', u'velocitywebdev metalcore', u'Einfach geil ausrufezeichen', u'G-BJ', u'4jspostmetal', u'laureen']"
732,Dead in My Eyes,46019,220827,99000,"[u'deathcore', u'death metal', u'instrumental', u'core', u'Calm Before the Storm', u'metal', u'carnifex', u'wuerde bohno gefallen', u'despirit', u'lovedbyme1', u'O Wretched Man']"
733,My Heart in Atrophy,49670,266866,180000,"[u'deathcore', u'death metal', u'grindcore', u'brutal deathcore', u'metal', u'carnifex', u'metalcore', u'chillout', u'american', u'sex', u'sweet', u'deathgrind', u'bring the mosh', u'L-skar', u'lolsandwich']"
734,Collaborating Like Killers,51834,292557,241000,"[u'deathcore', u'death metal', u'grindcore', u'brutal deathcore', u'Collaborating Like Killers', u'metal', u'carnifex', u'metalcore', u'hardcore', u'double bass', u'low tuning', u'el mostro q se parte en 2']"
735,Love Lies in Ashes,55492,318730,265000,"[u'deathcore', u'death metal', u'brutal deathcore', u'metal', u'metalcore', u'grindcore', u'hardcore', u'brutal death', u'brutal', u'death metall', u'carnifex', u'carnifex love lies in ashes', u'The Heretics Conviction', u'seen live', u'american', u'Nintendocore', u'sick', u'breakdowns', u'moshcore', u'hell of a song', u'double pedals ftw', u'into your goddamn face', u'O Wretched Man', u'Fighting Fate', u'THCBandNJ']"
736,Lie to My Face,81172,572869,181000,"[u'deathcore', u'grindcore', u'brutal deathcore', u'metalcore', u'hardcore', u'death metal', u'breakdown', u'brutal metal', u'O Wretched Man', u'metal', u'emo', u'Doom', u'Brutal Death Metal', u'blastbeat', u'carnifex', u'hacker tunes', u'GEARS TURNING', u'Deathcore is NOT Grindcore', u'The Heretics Conviction', u'heavy metal', u'classic', u'heavy', u'brutal', u'fast', u'epic', u'Awesome', u'Like', u'aggressive', u'cool', u'sick', u'FUCKING AWESOME', u'Horrorcore', u'deathgrind', u'heavy fucking metal', u'tryme', u'what the fuck', u'breakdowns', u'awsome', u'Melodic Deathcore', u'death core', u'i will eat your soul', u'blast beats', u'funeral grindcore', u'hardcore shit', u'i kill people', u'metal music', u'pra proc sabr', u'jizzzzz', u'SoCal hardcore', u'meathook sodomy']"
737,Dead in My Arms,48777,254217,205000,"[u'deathcore', u'grindcore', u'metalcore', u'death metal', u'metal', u'carnifex', u'hardcore', u'heavy metal', u'brutal', u'brutal deathcore', u'Fucking Brutal', u'wtf - one of the best songs ever', u'as i lay dying', u'tema culiao la zorra C:', u'Dead In My Arms', u'insane death']"
738,A Winter in Remorse,48976,255301,181000,"[u'deathcore', u'death metal', u'grindcore', u'deathgrind', u'carnifex', u'brutal deathcore', u'intense', u'heavy metal', u'metal', u'hardcore', u'american', u'cool', u'Love it', u'Brutal Death Metal', u'Technical Brutal Death Metal', u'death core', u'sz']"
