,Songs,Listeners,Playcount,Duration,Tags
619,Burning in the Undertow of God,15838,97540,409000,"[u'drone', u'noise', u'shoegaze', u'epic', u'drone metal', u'Ambient Drone', u'ambient', u'atmospheric', u'ambient noise', u'epic drone', u'Atmospheric metal', u'devastating', u'DOOMGAZE', u'metalgaze', u'doom metal', u'favorites', u'Canadian', u'melancholic', u'ambient metal', u'Post-Metal', u'best songs ever', u'depressive', u'drone doom metal', u'noise metal', u'oceanic', u'apocalypse please', u'everything reminds me of you', u'there is nothing I can truly say that will do this music any justice', u'bootstare', u'ciezkie', u'blood-stained sky', u'it was a dark and stormy night', u'piekno i smierc']"
620,Further Down The Nest I,9808,103885,306000,"[u'black metal', u'poland', u'melodic black metal', u'songs to play after you sit for an hour waiting for a bus', u'atmospheric black metal', u'depresive black metal', u'remind']"
621,Re-Faced,7708,36062,230000,"[u'metal', u'death metal', u'8 of 10 stars']"
622,Abysmal,8261,40808,221000,"[u'metal', u'death metal', u'8 of 10 stars']"
623,"Vlad, Son of the Dragon",10202,53392,176000,"[u'death metal', u'metal', u'epic', u'Melodic Death Metal', u'amazing', u'9 of 10 stars', u'Fuck yes', u'deathcore', u'heavy as fuck', u'fucking vicious', u'phenomenal solos']"
624,Receipt,13465,59839,242000,"[u'metal', u'death metal', u'7 of 10 stars']"
625,Tiznit,8480,34423,188000,"[u'peaceful', u'Gothic Metal']"
626,Born To Die,3826,21989,282000,"[u'cover', u'covers', u'5-STARS', u'the scarred people']"
627,The Red Of The Morning Sun,8306,38304,269000,"[u'Gothic Metal', u'9 of 10 stars', u'4-stars', u'the scarred people']"
628,Paradise,3349,15906,328000,"[u'cover', u'covers', u'4-stars', u'the scarred people']"
629,Awake,43427,311385,254000,"[u'Progressive metal', u'metal', u'progressive death metal', u'math metal', u'epic', u'metalcore', u'death metal', u'beautiful', u'best of 2008', u'melodic metal', u'Textures', u'Awake', u'Progressive Technical Death Metal', u'heavy metal', u'seen live', u'favorite songs', u'DJENT', u'Progressive rock', u'Melodic Death Metal', u'download', u'intelligent', u'FUCKING AWESOME', u'looooove', u'Find More', u'great voice', u'Technical Metal', u'q3jslfm', u'life metal', u'songs that give me chills', u'opposite', u'lifetime soundtrack', u'pell', u'nag', u'innerdown', u'musipellovesong', u'musipell', u'2unban', u'rising soul', u'4jsalternative', u'eclipsed0908', u'my textures', u'4sosippus', u':maddfactory', u'perkusyjnie']"
630,Morning Glory,539876,2968565,303000,"[u'britpop', u'rock', u'oasis', u'british', u'90s', u'alternative', u'alternative rock', u'indie', u'indie rock', u'pop', u'hard rock', u'seen live', u'Britrock', u'favorites', u'brit rock', u'UK', u'Awesome', u'Morning glory', u'timeless', u'classic rock', u'brit pop', u'lovedbyale', u'Manchester', u'male vocalists', u'1990s', u'Bloody great', u'favorite songs', u'acoustic', u'morning', u'england', u'rock n roll', u'FUCKING AWESOME', u'british i like', u'1995', u'british rock', u'Love', u'summer', u'classic', u'epic', u'funk', u'loud', u'favourite', u'groovy', u'Rock and Roll', u'Favorite', u'Favourites', u'jecks', u'All time favourites', u'Roctronik', u'Greatest Track By This Artist or Group']"
631,Oblivion,184017,1666688,347000,"[u'Progressive metal', u'Sludge', u'metal', u'Masterpiece', u'Mastodon', u'sludge metal', u'Progressive rock', u'heavy metal', u'00s', u'love at first listen', u'Psychedelic metal', u'best album openers', u'outer space', u'so fucking good', u'songs I absolutely love', u'songs you could die with', u'damn good shit', u'hard rock', u'great', u'Technical Metal', u'groove metal', u'FUCKIN AMAZING', u'american', u'alternative metal', u'concept album', u'lost in space', u'doom metal', u'favorites', u'Awesome', u'Progressive', u'SUN', u'Megadeth', u'whalecore', u'me like', u'ohmygod', u'oblivious to any other track atm', u'As True As My Balls', u'black metal', u'seen live', u'rock', u'favorite songs', u'hardcore', u'2009', u'prog', u'Stoner Rock', u'memories', u'epic', u'intro', u'Dreamy', u'drums']"
632,Tread Lightly,71705,423605,314000,"[u'Progressive metal', u'metal', u'experimental', u'10 of 10 stars', u'groove metal', u'heavy metal', u'metalcore', u'hardcore', u'post-rock', u'Progressive rock', u'Stoner Rock', u'doom metal', u'catchy', u'epic', u'Experimental Rock', u'speed metal', u'psychedelic', u'atmospheric', u'american', u'thrash metal', u'Progressive', u'stoner metal', u'post-hardcore', u'atmospheric rock', u'sludge metal', u'thrashcore', u'Post-Metal', u'atmospheric doom metal', u'Atmospheric metal', u'experimental metal', u'Post-thrash Metal', u'stoner doom metal', u'atmospheric sludge metal', u'Mastodon', u'fucking good', u'post-sludge metal', u'post-metalcore', u'post-progressive rock', u'doom stoner metal', u'experimental sludge metal', u'songs of the moment', u'atmospheric heavy metal', u'post-groove metal', u'post-thrashcore', u'atmospheric thrash metal', u'post-progressive metal', u'avant-garde sludge metal', u'atmospheric stoner metal', u'herrasmiesklubi', u'jukepoksi']"
633,The Snow Angel,14183,54335,105000,"[u'ost', u'safe', u'eclectonia']"
634,Soon,18739,75759,174000,"[u'post rock', u'instrumental', u'post-rock', u'post-rock underground full tracks', u'swedish', u'ambient', u'experimental', u'spoken word', u'Ef', u'-post-rock-and-shoegaze-', u'poetic post-rock', u'emperorcryn', u'ef - soon', u'ef - hello scotland']"
635,Hello Scotland,56045,245523,739000,"[u'post-rock', u'instrumental', u'post rock', u'ambient', u'beautiful', u'Ef', u'swedish', u'experimental', u'melancholic beauty', u'strings', u'atmospheric', u'postrock', u'seen live', u'favorites', u'Love', u'scandinavian', u'guitar', u'haunting', u'Progressive', u'crescendo', u'soft', u'melancholic', u'brilliant', u'instrumental post-rock', u'hello', u'Favourite bands', u'infinite sadness', u'chillout', u'electronic', u'indie', u'chill', u'rock', u'alternative', u'emo', u'sad', u'memories', u'piano', u'epic', u'Awesome', u'Drum', u'vocals', u'post', u'genius', u'Mellow', u'new', u'fragile', u'relaxing', u'nice', u'loved', u'cool']"
636,American Idiot,907369,6047373,174000,"[u'punk rock', u'rock', u'punk', u'green day', u'alternative', u'pop punk', u'alternative rock', u'political', u'American Idiot', u'american', u'00s', u'favorites', u'pop', u'hard rock', u'GREENDAY', u'favorite songs', u'Awesome', u'Punk-Rock', u'emo', u'Anti-Bush', u'Energetic', u'great songs', u'seen live', u'male vocalists', u'Grunge', u'Pop-punk', u'punkrock', u'indie', u'green day - american idiot', u'2004', u'party', u'2000s', u'cool', u'Favorite', u'indie rock', u'pop rock', u'Alternative  Punk', u'California', u'classic rock', u'metal', u'90s', u'Favourites', u'america', u'happy', u'energy', u'fun', u'good', u'Love it', u'idiot', u'Punk-Pop']"
637,Personal Jesus (The Stargate Mix),18451,103860,237000,"[u'electronic', u'remix', u'new wave', u'stargate', u'synthpop', u'british', u'electro', u'classic rock', u'electropop', u'pop', u'dance', u'House', u'club', u'male vocalists', u'safe', u'80s alternative', u'dance remix', u'predictable', u'DM', u'kinda boring']"
638,Sex on Fire,1393894,13741520,203000,"[u'rock', u'indie rock', u'alternative', u'indie', u'i fucking love this song', u'kings of leon', u'alternative rock', u'Sex on Fire', u'sexy', u'Southern Rock', u'00s', u'Awesome', u'sex', u'american', u'2008', u'obsessive repeated listening', u'male vocalists', u'Love it', u'favorites', u'catchy', u'party', u'Love', u'gossip girl', u'pop', u'hot', u'love at first listen', u'best of 2008', u'USA', u'amazing', u'FUCKING AWESOME', u'Driving Songs', u'addictive', u'this band can do no wrong', u'male vocalist', u'british', u'Energetic', u'Favourites', u'dance', u'pop rock', u'genius', u'2000s', u'<3', u'kol', u'completely awesome', u'Garage Rock', u'cool', u'stuck in my head', u'tunes i have played for hours', u'guitar', u'excellent']"
639,Beauty School,147587,1290529,288000,"[u'alternative metal', u'metal', u'alternative rock', u'Deftones', u'gives me chills', u'Nu Metal', u'alternative', u'beautiful', u'rock', u'post-rock', u'sex', u'Progressive rock', u'romantic', u'Awesome', u'melancholic', u'groovy', u'2010', u'seen live', u'chill', u'experimental', u'hard rock', u'favorites', u'melancholy', u'California', u'10s', u'Nu-metal', u'nighttime', u'chino', u'Warmheart', u'Sex on the beach under the moonlight', u'chillout', u'sexy', u'Love', u'intro', u'techno', u'House', u'shoegaze', u'Driving', u'american', u'art rock', u'spacious', u'male vocalists', u'best song ever', u'Favorite', u'alt rock', u'Love it', u'2010s', u'7 of 10 stars', u'<3', u'fellatio']"
640,Endless Dark,72174,404981,335000,"[u'Love Metal', u'Gothic Rock', u'finnish', u'Gothic Metal', u'HIM', u'rock', u'metal', u'finnish rock', u'dark rock', u'endless dark', u'alternative', u'vampire', u'Stoner Rock', u'favorites', u'Gothic', u'Driving', u'Glam Metal', u'goth rock', u'dark beauty', u'calm-mellow', u'heavy metal', u'alternative rock', u'sexy', u'indie rock', u'hard rock', u'doom metal', u'pop rock', u'alternative metal', u'amazing', u'nostalgic', u'darkwave', u'glam rock', u'great song', u'loved', u'male vocalist', u'male vocalists', u'great lyrics', u'8 of 10 stars', u'melodic metal', u'great voice', u'6 of 10 stars', u'<3', u'5 of 10 stars', u'9 lbs hammer', u'teenage years', u'Sweet memories', u'greatest lyrics', u'When HIM Was Actually Good', u'milk and water', u'hellgreaser']"
641,The Funeral of Hearts,205595,1599411,217000,"[u'Love Metal', u'Gothic Rock', u'rock', u'metal', u'finnish', u'HIM', u'Gothic', u'Gothic Metal', u'alternative', u'hard rock', u'Love', u'beautiful', u'finland', u'alternative metal', u'Ville Valo', u'sad', u'00s', u'The Funeral of Hearts', u'memories', u'favourite', u'melodic metal', u'depressive', u'dark', u'Awesome', u'Soundtrack Of My Life', u'alternative rock', u'favorites', u'romantic', u'male vocalists', u'finnish metal', u'wonderful', u'<3', u'goth rock', u'finnish rock', u'heavy metal', u'punk', u'favorite songs', u'2003', u'2004', u'amazing', u'nostalgic', u'melancholic', u'nice', u'good', u'heard on Pandora', u'male vocalist', u'favourite track', u'simply beautiful', u'heartagram', u'RM']"
642,Animal Arithmetic,148662,1057465,204000,"[u'icelandic', u'alternative', u'experimental', u'post-rock', u'indie', u'lizvelrene2010', u'elf music', u'orchestral', u'beautiful', u'indie rock', u'drums', u'male vocalists', u'running on the beach', u'sunlight unfolds in my hair', u'rock', u'singer-songwriter', u'epic', u'iceland', u'2010', u'best of 2010', u'gilbert', u'chillout', u'electronic', u'instrumental', u'ambient', u'orchestra', u'male vocalist', u'love at first listen', u'2010s', u'sigur ros', u'usually results in turning the volume up', u'Jonsi', u'feels like narnia', u'my dog loves it', u'pop', u'indie pop', u'happy', u'baroque pop', u'indietronica', u'Awesome', u'genius', u'ethereal', u'euphoric', u'folktronica', u'intense', u'Uplifting', u'mix', u'alternative pop', u'falsetto', u'i am a party girl here is my soundtrack']"
643,Go Do,226084,1687525,281000,"[u'icelandic', u'indie', u'experimental', u'alternative', u'post-rock', u'over5min', u'beautiful', u'lizvelrene2010', u'epic', u'orchestral', u'2010', u'love at first listen', u'best of 2010', u'pop', u'instrumental', u'ambient', u'indie rock', u'atmospheric', u'Mellow', u'post rock', u'male vocalists', u'Makes Me Smile', u'i could listen to this on a rainy day and feel better', u'chillout', u'rock', u'indietronica', u'ethereal', u'Sigur R\xf3s', u'Jonsi', u'electronic', u'chill', u'happy', u'orchestra', u'euphoric', u'melancholic', u'Uplifting', u'perfect to listen to while leaving the planet', u'falsetto', u'male vocals', u'2010s', u'heavenly', u'elf music', u'woah', u'gilbert', u'theo73 loves this music', u'singer-songwriter', u'Experimental Rock', u'drums', u'melancholy', u'favourite']"
644,Descending,150759,965383,215000,"[u'metal', u'metalcore', u'thrash metal', u'death metal', u'groove metal', u'lamb of god', u'Pure American Metal', u'Awesome', u'hardcore', u'NWOAHM', u'heavy metal', u'aggressive', u'melodic metal', u'Melodic Death Metal', u'american', u'thrash', u'fuck my mother these guys rock', u'Best Fucking Song on This Album', u'718 Love', u'seen live', u'favorites', u'super', u'favourite tracks', u'666', u'power thrash', u'new wave of american heavy metal', u'Metalbands', u'high as fuck', u'shit your pants metal', u'christians are gay', u'rock', u'albums I own', u'hard rock', u'epic', u'2006', u'10 of 10 stars', u'6 of 10 stars', u'trash metal', u'Local Bands', u'pantera', u'good drums', u'melodic metalcore', u'Nice song', u'5-star', u'Torquemada', u'aggressive depression', u'end all the pain', u'massive assault', u'the rival believer', u'Awesome Drums']"
645,Walk With Me In Hell,223469,1497584,312000,"[u'metalcore', u'metal', u'groove metal', u'thrash metal', u'death metal', u'heavy metal', u'lamb of god', u'Melodic Death Metal', u'hardcore', u'Pure American Metal', u'Awesome', u'seen live', u'FUCKING AWESOME', u'NWOAHM', u'american metal', u'trash metal', u'rock', u'american', u'hard rock', u'Technical Metal', u'Walk With Me In Hell', u'thrash', u'Favourites', u'new wave of american heavy metal', u'log', u'Soundtrack', u'black metal', u'grindcore', u'emo', u'Progressive metal', u'Gothic Metal', u'aggressive', u'Power metal', u'melodic metal', u'agressive', u'progressive death metal', u'Post-Thrash', u'true metal', u'totally awesome', u'destructive', u'headbangers ball', u'New Wave Of American Metal', u'Makes me want to kill things', u'Fuck coldplay', u'Monday wake up', u'classic rock', u'Hard', u'heavy', u'brutal', u'top']"
646,Anything,157,425,0,[]
647,Purple Skies,344,1010,0,[]
648,Redshift,21051,136570,0,"[u'Gothic Metal', u'doom metal', u'metal', u'Paradise Lost', u'Gothic Rock', u'seen live', u'Gothic', u'Awesome', u'fav', u'8 of 10 stars', u'truth', u'7 of 10 stars', u'10 of 10 stars', u'6 of 10 stars', u'best songs ever', u'favourite tracks', u'pure awesomeness', u'my favourite tracks', u'makes my flesh creep']"
649,Grey,48762,292832,207000,"[u'Gothic Metal', u'doom metal', u'metal', u'industrial metal', u'Paradise Lost', u'Gothic Rock', u'heavy metal', u'favorites', u'seen live', u'heard on Pandora', u'melodic death', u'whisky swamp and cigar smoke', u'makes my flesh creep', u'beautiful melancholic', u'other', u'beautiful', u'Melodic Death Metal', u'Doom', u'melancholic', u'PL', u'heart', u'import', u'Down', u'8 of 10 stars', u'9 of 10 stars', u'sing along', u'7 of 10 stars', u'6 of 10 stars', u'grey', u'from: england', u'make me cry', u'garten metal', u'kot', u'my favourite tracks', u'Heavy Doom Metal', u'Favorite Metal', u'romantic doom', u'Doom Gothic', u'DeepSleeP', u'so catchy it makes you wanna slap yo mama', u'Pusukikkelirokkia', u'Djmz', u'Razors favorites', u'arbeit-fetzig', u'deeprock', u'bluebellinbloom-loved', u'the anatomy of melancholy']"
650,Don't Belong,49450,300973,258000,"[u'Gothic Metal', u'doom metal', u'metal', u'melancholic', u'Paradise Lost', u'melodic doom metal', u'Gothic Rock', u'makes my flesh creep', u'journey through pressure', u'Gothic', u'atmospheric', u'Doom', u'8 of 10 stars', u'7 of 10 stars', u'United Kingdom', u'Best of best', u'paradise song', u'me like', u'dark blue', u'heavy metal', u'seen live', u'rock', u'british', u'goth', u'emo', u'favorites', u'slow', u'Love', u'Awesome', u'nostalgic', u'wishlist', u'great solo', u'import', u'melodic metal', u'Solitude', u'loneliness after dusk', u'Favourite Songs', u'<3', u'silence', u'depressive rock', u'Dark metal', u'favourite tracks', u'melodic death', u'best song', u'proggresive metal', u'bookmarked music', u'music for sleep', u'lindo', u'loved on lastfm', u'hard loved']"
651,Intro,24239,73665,162000,"[u'doom metal', u'instrumental', u'Gothic Metal', u'metal', u'Gothic', u'death metal', u'Death/Doom Metal', u'intro', u'8 of 10 stars', u'powerful', u'6 of 10 stars', u'4 of 10 stars', u'death-doom metal', u'doom-death metal', u'makes my flesh creep', u'gotgic metal']"
652,Far From Home - Craig Connelly Remix,1682,5654,0,[]
653,Tunnel Vision - Don Diablo Edit,1904,4851,0,[]
654,Life In Space,20,40,337000,[]
655,Tonight (I'm Fuckin' You),92423,488644,232000,"[u'pop', u'dance', u'male vocalists', u'electronic', u'party', u'electropop', u'2010s', u'Enrique Iglesias', u'Hip-Hop', u'Energetic', u'FUCKING AWESOME', u'Europop', u'fucking amazing', u'spanish', u'electronica', u'electro', u'epic', u'Latin Dance', u'latin', u'Awesome', u'upbeat', u'spain', u'summer', u'1', u'Like', u'amazing', u'2011', u'top 40', u'latin pop', u'poppy', u'freestyle', u'single', u'10s', u'personal favourites', u'fuck', u'featuring', u'title is a full sentence', u'Ludacris', u'Stuck on repeat', u'FUCKING EPIC', u'jordan', u'date rape', u'enrique', u'latin freestyle', u'highly addictive', u'songs i should hate but secretly like', u'play-more', u'pop music tag', u'eres', u'myoffice']"
656,The Daughters of Quiet Minds,56659,300636,789000,"[u'ambient', u'drone', u'instrumental', u'beautiful', u'ambientgdchill', u'post-rock', u'Sleep', u'dronezone', u'instropectives sound for soul', u'chillout', u'minimal', u'atmospheric', u'kranky', u'sublime', u'rustycanuckambient', u'The Daughters of Quiet Minds', u'Love Pedro', u'Kellplanet', u'slow', u'calm', u'Love', u'tranquility', u'new age', u'idm', u'Dreamy', u'cinematic', u'contemplative', u'peace', u'peaceful', u'pretty', u'great', u'melancholy', u'Chillosophy', u'nice', u'bliss', u'harmony', u'future', u'serenity', u'relax', u'relaxation', u'drone ambient', u'Love it', u'minimalist', u'god', u'want', u'comforting', u'all time fav', u'drones', u'buythiscd', u'music for writing your thesis']"
657,Another Ballad for Heavy Lids,66422,335958,271000,"[u'ambient', u'drone', u'instrumental', u'post-rock', u'chillout', u'ambientgdchill', u'electronic', u'beautiful', u'experimental', u'ethereal', u'relaxing', u'chill', u'minimal', u'Dreamy', u'cool', u'minimalist', u'0001', u'drifting in silence', u'indie', u'Love', u'industrial', u'Lo-Fi', u'atmospheric', u'winter', u'Sleep', u'nostalgic', u'minimalism', u'melancholic', u'space music', u'dark ambient', u'kranky', u'drone ambient', u'minimal ambient', u'sublime', u'Dream', u'sleepy', u'Sleeping', u'silence', u'i', u'utopia', u'heavenly', u'Atmosphere', u'ambience', u'like it', u'electonica', u'1111', u'post-classical', u'landscape', u'somafm', u'study music']"
658,Odal,82190,602351,459000,"[u'instrumental', u'doom metal', u'folk metal', u'Progressive metal', u'melancholic', u'Atmospheric metal', u'post-rock', u'Post-Metal', u'folk', u'beautiful', u'atmospheric', u'neofolk', u'Progressive rock', u'night listening', u'black metal', u'Progressive', u'Dark metal', u'Agalloch', u'ambient', u'epic', u'Gothic', u'relaxing', u'gorgeous', u'nostalgia', u'Masterpiece', u'Totally fucking awesome track', u'metal', u'rock', u'experimental', u'favorites', u'piano', u'Avant-Garde', u'Doom', u'winter', u'Mellow', u'post rock', u'instumental', u'ambient metal', u'ambient black metal', u'acoustic guitar', u'atmospheric black metal', u'progressive doom metal', u'songs of my life', u'post black metal', u'melancholic metal', u'Progressive Folk Metal', u'Q4', u'Folk Black Doom metal', u'4jspostmetal', u'heavy metal']"
659,In the Shadow of Our Pale Companion,89882,771538,885000,"[u'doom metal', u'folk metal', u'Progressive metal', u'Atmospheric metal', u'atmospheric', u'black metal', u'epic', u'melancholic', u'folk', u'beautiful', u'atmospheric black metal', u'Agalloch', u'ambient', u'Post-Metal', u'Avant-Garde', u'Dark metal', u'post-rock', u'Gothic Metal', u'melodic black metal', u'metal', u'Progressive rock', u'Folk Doom Metal', u'seen live', u'instrumental', u'dark', u'Awesome', u'Doom', u'Progressive', u'great', u'Pagan', u'dark ambient', u'neofolk', u'brilliant', u'pagan metal', u'Avant-garde Metal', u'Masterpiece', u'Favourite Songs', u'forest', u'progressive black metal', u'extreme progressive metal', u'post metal', u'Progressive Folk Metal', u'folk doom', u'Songs over 10 minutes long', u'Totally fucking awesome track', u'q4jslfm', u'4jspostmetal', u'Win of the most absolute degree', u'heavy metal', u'rock']"
660,A Celebration for the Death of Man...,70467,546479,144000,"[u'instrumental', u'doom metal', u'folk metal', u'Progressive metal', u'acoustic', u'atmospheric', u'black metal', u'folk', u'ambient', u'dark acoustic metal', u'metal', u'melancholy', u'neofolk', u'atmospheric black metal', u'night listening', u'Dark metal', u'post-rock', u'Progressive rock', u'Avant-Garde', u'folk rock', u'Post-Metal', u'Progressive Folk Metal', u'heavy metal', u'USA', u'epic', u'dark', u'intro', u'Awesome', u'moody', u'Radio', u'Progressive', u'winter', u'death metal', u'Gothic Metal', u'melancholic', u'wishlist', u'Pagan', u'dark ambient', u'dark folk', u'depression', u'pagan metal', u'atmospheric rock', u'personal favourites', u'sadness', u'everything', u'bleak', u'progressive black metal', u'depressive black metal', u'atmospheric doom metal', u'Atmospheric metal']"
661,As Embers Dress The Sky,53812,434966,484000,"[u'doom metal', u'folk metal', u'black metal', u'metal', u'beautiful', u'Dark metal', u'Progressive metal', u'melancholic', u'atmospheric', u'Progressive', u'atmospheric folk metal', u'Atmospheric folk doom Metal', u'Folk Doom Metal', u'atmospheric melancholic metal', u'heavy metal', u'epic', u'winter', u'Gothic Metal', u'atmospheric black metal', u'progressive black metal', u'depressive black metal', u'Post-Metal', u'Atmospheric metal', u'best fucking song ever', u'Progressive Folk Metal', u'Agalloch', u'doom folk metal', u'instrumental', u'alternative rock', u'emo', u'folk', u'ambient', u'post-rock', u'Progressive rock', u'intro', u'acoustic', u'Doom', u'melancholy', u'alternative metal', u'f', u'loved', u'heard on Pandora', u'female vocalist', u'Pagan', u'neofolk', u'dark folk', u'depression', u'5 Stars', u'atmospheric rock', u'personal favourites']"
662,One of These Days,364036,2303928,349000,"[u'Progressive rock', u'Psychedelic Rock', u'classic rock', u'rock', u'Pink Floyd', u'instrumental', u'psychedelic', u'70s', u'Progressive', u'british', u'experimental', u'space rock', u'alternative', u'bass', u'art rock', u'hard rock', u'atmospheric', u'dark', u'epic', u'guitar', u'1971', u'alternative rock', u'prog', u'oldies', u'trippy', u'favorite songs', u'Symphonic Rock', u'Awesome', u'prog rock', u'doctor who', u'soundtrackgdchill', u'chill', u'favorites', u'Experimental Rock', u'instrumental rock', u'6 of 10 stars', u'drowning out the voices in my head', u'meddle', u'gotanygoodmusic', u'one of these days', u'play it loud', u'life on mars', u'Morose Deep dilate Crimson', u'paranoic', u'Soundtrack', u'trance', u'Mellow', u'intense', u'Love it', u'psychodelic']"
663,Piano Lessons,100131,640238,261000,"[u'Progressive rock', u'rock', u'alternative rock', u'Psychedelic Rock', u'porcupine tree', u'alternative', u'Awesome', u'Progressive metal', u'space rock', u'steven wilson', u'Progressive', u'strings organs rubber wind', u'british', u'experimental', u'piano', u'Brilliance', u'classic rock', u'pop', u'prog', u'art rock', u'prog rock', u'fucking amazing', u'indie pop', u'UK', u'britpop', u'beautiful', u'90s', u'favourite', u'male vocalists', u'Pop-Rock', u'catchy as hell', u'Prog-Rock/Art Rock', u'makes me wanna dance', u'Awesome rock', u'recommended to me', u'amazing voices', u'shut up and dance', u'the ostrich tag - steven wilson', u'Soundtrack', u'indie', u'classic', u'ambient', u'pop rock', u'memories', u'Love', u'epic', u'Experimental Rock', u'easy listening', u'Alternative  Punk', u'psychedelic']"
664,Still Point,7593,54971,1473000,"[u'ambient sleeping pill', u'ambient', u'lushtone', u'lush tone ambient', u'Space Ambient', u'somafm', u'hammock', u'dronezone']"
665,No Stopping the Sea,7361,42264,314000,"[u'ambient', u'post rock', u'space music', u'somafm', u'lushtone', u'dronezone', u'lush tone ambient']"
666,A Blood Promise Extended Version,1,2,0,[]
667,Passion Play,182489,678285,355000,"[u'acoustic', u'singer-songwriter', u'folk', u'Mellow', u'beautiful', u'indie', u'william fitzsimmons', u'chillout', u'greys anatomy', u'chill', u'male vocalists', u'Love', u'easy listening', u'alternative', u'guitar', u'indie folk', u'relax', u'favorites', u'Bittersweet', u'Passion Play', u'Music I Am Addicted To', u""Grey's Anatomy"", u'goosebumps', u'rock', u'relaxing', u'quiet', u'lovely', u'acoustic guitar', u'to check out', u'nice guitar', u'depressingly beautiful', u'theo73 loves this music', u'slow', u'strings', u'late night', u'great', u'Like', u'Rainy Day', u'nice', u'good', u'rain', u'Favorite', u'best', u'brilliant', u'wow', u'listen again', u'soothing', u'rainy day music', u'hotel cafe', u'acousticindiefolk']"
668,ASA,70577,285929,436000,"[u'post-rock', u'instrumental', u'experimental', u'instrumental rock', u'post rock', u'indie', u'ambient', u'rock', u'shoegaze', u'grey storia', u'alternative', u'USA', u'psychedelic', u'counting black sheep zzz', u'epic', u'beautiful', u'space rock', u'emotional', u'soaring', u'instrumental post-rock', u'caspian', u'beautiful post-rock', u'Progressive rock', u'dark', u'guitar', u'Dreamy', u'spooky', u'sunday', u'post', u'postrock', u'favourite', u'intense', u'relaxing', u'f', u'Down', u'angels', u'acoustic guitar', u'dreams', u'instrumentals', u'exclamation', u'fucking great', u'Mogwai', u'awesome track', u'need to buy', u'silent intensity', u'fab', u'#1', u'Torquemada', u'Concentration', u'exogaze']"
669,Akiko,22408,101202,212000,"[u'post-rock', u'indie', u'instrumental', u'ambient', u'grey storia', u'Progressive rock', u'post rock', u'experimental', u'shoegaze', u'alternative', u'slgdmbestof', u'every name has a story', u'q4jslfm', u'atmosphere: warm', u'mood: serene', u'time: late afternoon', u'season: spring', u'4rmpme', u'setting: meadows']"
