,Songs,Listeners,Playcount,Duration,Tags
824,Across the Streaming Tide,35828,237497,620000,"[u'epic black metal', u'atmospheric black metal', u'black metal', u'Symphonic Black Metal', u'epic', u'Tolkien', u'atmospheric', u'symphonic metal', u'fantasy metal', u'metal', u'folk metal', u'epic metal', u'Atmospheric metal', u'tolkien metal', u'tolkien black metal', u'wraugh', u'folk', u'austrian', u'Austria', u'fantasy', u'Dreamy', u'long', u'Pagan', u'Summoning', u'Atmospheric Epic Metal', u'ambient', u'beautiful', u'satanic', u'Epic Symphonic Metal', u'Avant-garde Metal', u'Masterpiece', u'Favourite Songs', u'melodic black metal', u'ambient black metal', u'lord of the rings', u'My favourite', u'favourite tracks', u'neo-folk', u'Middle-Earth', u'atmospheric epic tolkien metal', u'Folk Black Metal', u'Epic Atmospheric Black Metal', u'Epic Folk Metal', u'Songs over 10 minutes long', u'epic atmosphoeric black metal', u'fucking phenomenal', u'me like', u'fantasy black metal', u'tolkien inspired music', u'metal sinfonico']"
825,Bauglir,40320,293378,178000,"[u'epic black metal', u'black metal', u'atmospheric black metal', u'Symphonic Black Metal', u'Tolkien', u'epic', u'fantasy', u'tolkien metal', u'ambient', u'fantasy metal', u'atmospheric', u'austrian', u'epic metal', u'metal', u'dark ambient', u'instrumental', u'folk metal', u'Atmospheric metal', u'Dark metal', u'neofolk', u'Austria', u'ambient black metal', u'lord of the rings', u'Epic Atmospheric Black Metal', u'alternative', u'folk', u'post-rock', u'intro', u'Dreamy', u'spoken word', u'Summoning', u'medieval ambient', u'neoclassical darkwave', u'fantasy music', u'dungeon synth', u'tolkien black metal', u'Soundtrack', u'chillout', u'chill', u'alternative rock', u'Progressive rock', u'dark', u'acoustic', u'medieval', u'viking metal', u'lounge', u'flute', u'Mellow', u'ethereal', u'darkwave']"
826,Farewell,23823,201581,559000,"[u'epic black metal', u'black metal', u'epic', u'atmospheric black metal', u'Symphonic Black Metal', u'atmospheric', u'fantasy', u'epic tolkien metal', u'Dreamy', u'epic metal', u'FUCKING AWESOME', u'Tolkien', u'Dark metal', u'i had to change my pants after this song', u'Summoning', u'FUCKIN AMAZING', u'metal', u'ambient', u'beautiful', u'melancholic', u'fantasy metal', u'anthems', u'favourite tracks', u'Epicness', u'tolkien metal', u'Favourite metal songs', u'Greatest shit in the world', u'classic', u'Awesome', u'folk metal', u'austrian', u'Favourites', u'brilliant', u'Austria', u'Masterpiece', u'Atmospheric metal', u'Legendary', u'farewell', u'blackmetal', u'EPIC WIN', u'all time favorites', u'Breathtaking', u'strong vocals', u'brilliant epicness', u'irrealnye prityazaniya', u'me like', u'hard hitting', u'symphonic  black metal', u'fantasy black metal', u'Blown away']"
827,Ashen Cold,21869,167591,376000,"[u'atmospheric black metal', u'epic black metal', u'black metal', u'atmospheric', u'Symphonic Black Metal', u'FUCKIN AMAZING', u'epic', u'beautiful', u'Dreamy', u'Tolkien', u'melancholic', u'symphonic metal', u'epic metal', u'fantasy metal', u'fantasy', u'Dark metal', u'tolkien metal', u'invocations of mythical lands', u'songs for going to war', u'metal', u'favorites', u'austrian', u'Austria', u'ambient black metal', u'Atmospheric metal', u'tear-jerker', u'me like', u'very epic', u'fantasy black metal', u'Dungeon synth metal']"
828,Runes of Power,22994,162738,351000,"[u'epic black metal', u'black metal', u'epic', u'atmospheric black metal', u'atmospheric', u'fantasy metal', u'songs I fucking love to death', u'Awesome', u'fantasy', u'Dark metal', u'tolkien metal', u'Dreamy', u'austrian', u'Favourites', u'epic metal', u'Austria', u'Masterpiece', u'Symphonic Black Metal', u'Tolkien', u'tear-jerker', u'Summoning', u'pure aural bliss', u'amazing drums', u'fantasy black metal', u'atmospheric black meta', u'Im in my dark place', u'epic atmospheric melodic black metal']"
829,The Mountain King's Return,16761,111838,533000,"[u'black metal', u'atmospheric black metal', u'epic black metal', u'Tolkien', u'epic', u'metal', u'Dreamy', u'atmospheric', u'fantasy metal', u'fantasy', u'Symphonic Black Metal', u'tolkien metal', u'austrian', u'Favourites', u'epic metal', u'Austria', u'melodic black metal', u'Atmospheric metal', u'Dark metal', u'Awesome metal songs', u'fantasy black metal']"
830,Our Foes Shall Fall,17784,132640,421000,"[u'black metal', u'atmospheric black metal', u'epic', u'Symphonic Black Metal', u'epic black metal', u'metal', u'fantasy metal', u'tolkien metal', u'epic atmospheric melodic black metal', u'atmospheric', u'heard on Pandora', u'majestic', u'Favourites', u'fantasy', u'Tolkien', u'Summoning', u'stomach', u'fantasy black metal', u'prepare for the close war']"
831,In Hollow Halls Beneath the Fells,20398,153068,536000,"[u'black metal', u'epic', u'atmospheric black metal', u'epic black metal', u'metal', u'atmospheric', u'Awesome', u'hypnotic', u'darkwave', u'Favorite', u'fantasy metal', u'fantasy', u'Tolkien', u'divine', u'Summoning', u'tolkien metal', u'stomach', u'made of fucking win', u'fantasy black metal', u'songs to play after you sit for an hour waiting for a bus', u'optime']"
832,South Away,22510,167482,364000,"[u'atmospheric black metal', u'epic black metal', u'black metal', u'epic', u'Symphonic Black Metal', u'atmospheric', u'fantasy metal', u'Austria', u'fantasy', u'Tolkien', u'Summoning', u'tolkien metal', u'metal', u'ambient', u'Dreamy', u'austrian', u'epic metal', u'Masterpiece', u'melodic black metal', u'Atmospheric metal', u'Dark metal', u'i had to change my pants after this song', u'stomach', u'dungeon synth', u'fantasy black metal', u'epic ambiental atmospheric black metal', u'Middle-Earth Inspired Ambient Black Metal', u'epic atmospheric melodic black metal']"
833,A New Power Is Rising,23340,171105,248000,"[u'epic black metal', u'Symphonic Black Metal', u'black metal', u'atmospheric black metal', u'epic', u'Tolkien', u'Dreamy', u'atmospheric', u'austrian', u'Austria', u'fantasy', u'Summoning', u'tolkien metal', u'dungeon synth', u'Middle-Earth Inspired Ambient Black Metal', u'heavy metal', u'ambient', u'intro', u'epic metal', u'fantasy metal', u'legends', u'Atmospheric metal', u'Dark metal', u'Legendary', u'Epic Atmospheric Black Metal', u'neoclassical darkwave', u'stomach', u'middle-earth songs']"
834,A Distant Flame Before the Sun,23498,170309,583000,"[u'epic black metal', u'Symphonic Black Metal', u'black metal', u'atmospheric black metal', u'total ownage', u'epic', u'atmospheric', u'EPIC WIN', u'metal', u'FUCKING AWESOME', u'legendary song', u'Tolkien', u'tolkien metal', u'raise your swords', u'Awesome', u'90s', u'symphonic metal', u'5 Stars', u'epic metal', u'Austria', u'1999', u'ambient black metal', u'immense', u'pwnage', u'kicks mallcore kiddies around like little kids', u'flawless', u'best of 1999', u'Silmarillion', u'symphonic black', u'totaly fucking awesome track', u'Truly Epic', u'second wave black metal', u'fuck great', u'songs to play after you sit for an hour waiting for a bus', u'Mordor Sound', u'epic atmospheric melodic black metal', u'great conclusion', u'optime']"
835,The Loud Music of the Sky,21594,144532,407000,"[u'epic black metal', u'black metal', u'Awesome', u'Symphonic Black Metal', u'ambient black metal', u'metal', u'epic', u'Masterpiece', u'atmospheric black metal', u'tolkien metal', u'epic atmospheric melodic black metal', u'beautiful', u'Austria', u'favorite tracks', u'Atmospheric metal', u'Play this loud enough to raise the dead', u'symphonic black', u'second wave black metal', u'true epicness', u'Spiritual Dimensions']"
836,The Shadow Lies Frozen on the Hills,19841,123494,421000,"[u'black metal', u'epic black metal', u'epic', u'Symphonic Black Metal', u'atmospheric black metal', u'metal', u'tolkien metal', u'Austria', u'melodic black metal', u'ambient black metal', u'symphonic black', u'second wave black metal']"
837,The Rotting Horse on the Deadly Ground,25631,188052,505000,"[u'black metal', u'epic black metal', u'Symphonic Black Metal', u'atmospheric black metal', u'tolkien metal', u'metal', u'epic metal', u'melodic black metal', u'epic', u'Tolkien', u'90s', u'eerie', u'austrian', u'Favourites', u'5 Stars', u'Austria', u'1999', u'ambient black metal', u'i had to change my pants after this song', u'best of 1999', u'symphonic black', u'me like', u'Awesome metal songs', u'Ancient Spirit', u'second wave black metal', u'epic atmospheric melodic black metal']"
838,Where Hope and Daylight Die,28281,217409,388000,"[u'epic black metal', u'black metal', u'epic', u'Symphonic Black Metal', u'epic metal', u'fantasy', u'fantasy metal', u'atmospheric', u'symphonic metal', u'Atmospheric metal', u'atmospheric black metal', u'metal', u'female vocals', u'Tolkien', u'Epic Atmospheric Black Metal', u'tolkien metal', u'FUCKING AWESOME', u'1999', u'best of 1999', u'fantasy black metal', u'ethereal', u'brilliant', u'Austria', u'EPIC WIN', u'Silmarillion', u'epic vocals', u'Female fronted metal', u'sexy', u'Dreamy', u'90s', u'sex', u'soaring', u'mistagged', u'ambient black metal', u'battle', u'female voice', u'zen', u'opera metal', u'true black metal', u'kicks mallcore kiddies around like little kids', u'made of win', u'ethereal metal', u'eroticism', u'Zaebis', u'symphonic black', u'ethereal vocals', u'Listen It Loudly', u'played at an edgar general night', u'operatic vocals', u'epic extreme metal']"
839,Like Some Snow-white Marble Eyes,21863,171382,439000,"[u'black metal', u'Symphonic Black Metal', u'atmospheric black metal', u'epic black metal', u'metal', u'epic', u'Favourite Songs', u'Awesome', u'90s', u'1999', u'kicks mallcore kiddies around like little kids', u'music that makes your head explode of amazement', u'best of 1999', u'tolkien metal', u'Beautiful as any burnt flower', u'romantic', u'beautiful', u'atmospheric', u'nostalgic', u'brilliant', u'epic metal', u'Masterpiece', u'4 Stars', u'1990s', u'ambient black metal', u'evocative', u'Tolkien', u'favourite tracks', u'best of 1990s', u'frozen', u'God-like', u'magnificent', u'symphonic black', u'tolkien black metal', u'Awesome metal songs', u'true epic', u'Ancient Spirit', u'second wave black metal', u'Atmospheric masterpiece', u'songs to play after you sit for an hour waiting for a bus']"
840,The Glory Disappears,27430,195029,469000,"[u'epic black metal', u'epic', u'atmospheric black metal', u'black metal', u'Symphonic Black Metal', u'metal', u'atmospheric', u'epic metal', u'fantasy', u'Atmospheric metal', u'EPIC WIN', u'tolkien black metal', u'medieval black metal', u'fantasy black metal', u'true epic', u'favorites', u'fantasy metal', u'Tolkien', u'God-like', u'tolkien metal', u'90s', u'death', u'nostalgic', u'great song', u'brilliant', u'Masterpiece', u'1990s', u'1999', u'melodic black metal', u'ambient black metal', u'favourite tracks', u'battle metal', u'Godlike', u'kicks mallcore kiddies around like little kids', u'Folk Black Metal', u'best of 1990s', u'melodramatic', u'best of 1999', u'epic as fuck', u'symphonic black', u'powerfull', u'Ancient Spirit', u'Atmospheric Epic Metal', u'second wave black metal', u'Atmospheric masterpiece', u'god-like vocals', u'final fantasy 9 riff', u'epic ambient black metal', u'godlike vocals', u'venomintovein favs']"
841,Long Lost to Where No Pathway Goes,30408,249974,443000,"[u'atmospheric black metal', u'epic black metal', u'black metal', u'Symphonic Black Metal', u'epic', u'tolkien metal', u'metal', u'Awesome', u'Masterpiece', u'best tracks ever', u'i have got an orgasm when i listen to it', u'atmospheric', u'nostalgic', u'melancholic', u'great song', u'austrian', u'brilliant', u'epic metal', u'fantasy metal', u'4 Stars', u'ambient black metal', u'journey', u'Atmospheric metal', u'Tolkien', u'enchanting', u'favourite tracks', u'best song', u'Epic Atmospheric Black Metal', u'symphonic black', u'legendary song', u'me like', u'Awesome metal songs', u'ultimate song', u'Ancient Spirit', u'second wave black metal', u'orchestral black metal', u'Favourite metal songs', u'long live tolkien']"
842,Rhûn,26230,171489,205000,"[u'atmospheric', u'epic', u'black metal', u'atmospheric black metal', u'ambient', u'metal', u'intro', u'epic black metal', u'dungeon synth', u'90s', u'epic metal', u'fantasy', u'4 Stars', u'1999', u'Symphonic Black Metal', u'ambient black metal', u'Tolkien', u'best of 1999', u'tolkien metal', u'war folk', u'symphonic black', u'celt', u'battle folk', u'black metall', u'Ancient Spirit', u'second wave black metal', u'Empty Hills', u'the obligatory ambient intro', u'battle metall', u'holmi', u'war metall', u'overbest']"
843,Over Old Hills,19403,114838,538000,"[u'black metal', u'atmospheric black metal', u'epic black metal', u'epic', u'atmospheric', u'metal', u'Dreamy', u'best song ever', u'Tolkien', u'tolkien metal', u'doom metal', u'Awesome', u'haunting', u'heard on Pandora', u'dark ambient', u'austrian', u'symphonic metal', u'epic metal', u'fantasy metal', u'Austria', u'FUCKING AWESOME', u'fantasy', u'lullaby', u'Symphonic Black Metal', u'Atmospheric metal', u'Dark metal', u'zen', u'sympho black metal', u'totaly fucking awesome track', u'fantasy black metal', u'Ancient Spirit', u'atmospheric epic black metal', u'songs to play after you sit for an hour waiting for a bus', u'haunting song']"
844,Unto a Long Glory...,16909,88314,577000,"[u'atmospheric black metal', u'epic black metal', u'black metal', u'epic', u'tolkien metal', u'atmospheric', u'metal', u'Dreamy', u'austrian', u'symphonic metal', u'epic metal', u'fantasy metal', u'Austria', u'fantasy', u'journey', u'Atmospheric metal', u'Tolkien', u'Dark metal', u'fantasy black metal', u'Ancient Spirit']"
845,Wyrmvater Glaurung,18003,105902,185000,"[u'epic', u'atmospheric', u'instrumental', u'black metal', u'atmospheric black metal', u'ambient', u'Tolkien', u'epic black metal', u'tolkien metal', u'dungeon synth', u'experimental', u'Dreamy', u'austrian', u'symphonic', u'epic metal', u'fantasy metal', u'Austria', u'haunted', u'fantasy', u'Symphonic Black Metal', u'grandiose', u'Dark metal', u'bell', u'total ownage', u'Zaebis', u'klimatyczne']"
846,Kôr,10180,61821,659000,"[u'epic', u'black metal', u'atmospheric black metal', u'epic black metal', u'atmospheric', u'Symphonic Black Metal', u'metal', u'medieval black metal', u'Ancient Spirit', u'90s', u'symphonic metal', u'Austria', u'tolkien metal', u'fantasy black metal']"
847,Khazad Dúm,10419,70590,657000,"[u'epic black metal', u'atmospheric black metal', u'epic', u'black metal', u'medieval black metal', u'metal', u'medieval', u'fantasy black metal', u'folk metal', u'atmospheric', u'nostalgic', u'flawless', u'tolkien metal', u'Ancient Spirit']"
848,Elfstone,21441,126118,651000,"[u'black metal', u'atmospheric black metal', u'epic black metal', u'metal', u'epic', u'Symphonic Black Metal', u'Tolkien', u'atmospheric', u'fantasy black metal', u'symphonic metal', u'fantasy metal', u'melodic black metal', u'grandiose', u'Blackened Folk Metal', u'Silmarillion', u'tolkien metal', u'Awesome metal songs', u'Favourite metal songs', u'heavy mithral']"
849,Nightshade Forests,23134,143348,648000,"[u'epic black metal', u'black metal', u'atmospheric black metal', u'Tolkien', u'metal', u'epic', u'Epic Atmospheric Black Metal', u'sexy', u'pagan metal', u'Symphonic Black Metal', u'folk metal', u'atmospheric', u'heard on Pandora', u'Masterpiece', u'fantasy', u'melodic black metal', u'progressive black metal', u'post black metal', u'Silmarillion', u'tolkien metal', u'tolkien black metal', u'heartpiercing screams and bonecrushing growls', u'mystic art', u'fantasy black metal', u'Ancient Spirit', u'Majesty Black Metal']"
850,Angbands Schmieden,22064,130674,210000,"[u'instrumental', u'sexy', u'intro', u'Symphonic Black Metal', u'dungeon synth', u'ambient', u'atmospheric', u'atmospheric black metal', u'epic', u'black metal', u'folk', u'darkwave', u'fip', u'dark ambient', u'Austria', u'magic', u'Great Intro', u'epic black metal', u'post black metal', u'bell', u'writing music', u'Fantasy Ambient', u'tolkien metal', u'dream ambient', u'medieval black metal', u'WBM', u'orc ambient', u'Ancient Spirit', u'Blackened Electronica']"
851,Dor Daedeloth,22632,111546,615000,"[u'black metal', u'atmospheric black metal', u'epic black metal', u'Symphonic Black Metal', u'epic', u'metal', u'atmospheric', u'Tolkien', u'ethereal', u'symphonic', u'epic metal', u'Masterpiece', u'fantasy', u'ambient black metal', u'journey', u'Atmospheric metal', u'spike', u'tolkien metal', u'symphonic black', u'australian black metal', u'middle-earth songs', u'fantasy black metal', u'second wave black metal', u'motherfucking black fucking metal', u'endless masterpiece']"
852,The Legend of the Master-Ring,23386,132318,327000,"[u'black metal', u'epic black metal', u'atmospheric black metal', u'Symphonic Black Metal', u'metal', u'ambient', u'Tolkien', u'epic', u'folk metal', u'viking metal', u'atmospheric', u'Favourite Songs', u'melodic black metal', u'rock', u'beautiful', u'austrian', u'symphonic', u'brilliant', u'epic metal', u'Masterpiece', u'ambient black metal', u'Amazing song', u'Breathtaking', u'tolkien metal', u'Eluveitie', u'symphonic black', u'austrian black metal', u'Just Amazing', u'fantasy black metal', u'Stormlord', u'Ancient Spirit', u'second wave black metal', u'mexican fiesta', u'107miri', u'c i r c l e s', u'amazing beyond thought', u'endless masterpiece']"
853,Through the Forest of Dol Guldur,22757,130331,286000,"[u'atmospheric black metal', u'epic black metal', u'black metal', u'Symphonic Black Metal', u'epic', u'Favourites', u'metal', u'atmospheric', u'ethereal', u'melancholic', u'symphonic', u'ambient black metal', u'Tolkien', u'Silmarillion', u'tolkien metal', u'symphonic black', u'austrian black metal', u'fantasy black metal', u'second wave black metal', u'songs to play after you sit for an hour waiting for a bus']"
854,Dagor Bragollach,25300,140042,305000,"[u'black metal', u'epic black metal', u'Symphonic Black Metal', u'Tolkien', u'tolkien metal', u'ambient black metal', u'atmospheric black metal', u'epic', u'dark black metal', u'metal', u'viking metal', u'atmospheric', u'Norway', u'melodic black metal', u'warcraft', u'Epic Folk Metal', u'When they still were good', u'norwegian', u'austrian', u'4', u'epic metal', u'Austria', u'Ritual', u'lotr', u'Summoning', u'Folk Black Metal', u'Silmarillion', u'symphonic black', u'austrian black metal', u'fantasy black metal', u'orcs', u'Ancient Spirit', u'second wave black metal', u'orchestral black metal', u'songs to play after you sit for an hour waiting for a bus']"
855,Ungolianth,25482,131967,396000,"[u'black metal', u'atmospheric black metal', u'epic black metal', u'ambient black metal', u'Tolkien', u'metal', u'epic', u'ambient', u'8-bit', u'melodic', u'death metal', u'austrian', u'symphonic', u'epic metal', u'fantasy', u'Symphonic Black Metal', u'belly dance', u'Bathory', u'tolkien metal', u'symphonic black', u'dungeon synth', u'austrian black metal', u'fantasy black metal', u'tolkien epic atmospheric metal', u'second wave black metal', u'zommetal', u'bad synthesisers', u'songs to play after you sit for an hour waiting for a bus', u'epic quest music']"
856,Orthanc,25986,141771,99000,"[u'black metal', u'instrumental', u'atmospheric black metal', u'atmospheric', u'Tolkien', u'alternative', u'ambient', u'dungeon synth', u'metal', u'electronic', u'electronica', u'chill', u'alternative rock', u'experimental', u'Progressive rock', u'epic', u'synthpop', u'tribal', u'darkwave', u'austrian', u'epic metal', u'ambient black metal', u'under two minutes', u'belly dance', u'ambient electronic', u'NOT METAL', u'epic black metal', u'lotr', u'not black metal', u'epic ambient', u'Dark Synthpop', u'Dark Fantasy', u'writing music', u'Fantasy Ambient', u'tolkien metal', u'Instrumental Electronic', u'symphonic black', u'middle-earth songs', u'austrian black metal', u'WBM', u'sda', u'second wave black metal', u'sky2']"
857,Marching Homewards,26096,139383,490000,"[u'black metal', u'epic black metal', u'atmospheric black metal', u'Symphonic Black Metal', u'melodic black metal', u'metal', u'epic', u'epic metal', u'Tolkien', u'rock', u'Gothic Metal', u'male vocalists', u'austrian', u'ambient black metal', u'journey', u'favourite tracks', u'Summoning', u'tolkien metal', u'1a', u'symphonic black', u'austrian black metal', u'fantasy black metal', u'epic fantasy black metal', u'second wave black metal', u'Favourite metal songs', u'smutne jak chuj', u'blackrq', u'hard silence', u'majico']"
858,Morthond,27296,153012,403000,"[u'epic black metal', u'black metal', u'atmospheric black metal', u'Symphonic Black Metal', u'Tolkien', u'metal', u'tolkien metal', u'Awesome', u'atmospheric', u'Black', u'ambient black metal', u'epic', u'dark', u'beautiful', u'Dreamy', u'melancholy', u'Meditation', u'satanic', u'dark ambient', u'austrian', u'symphonic metal', u'best', u'Extreme Metal', u'epic metal', u'Austria', u'anti-christian', u'Masterpiece', u'fantasy', u'melodic black metal', u'satan', u'true', u'good music', u'progressive black metal', u'depressive black metal', u'melancholic black metal', u'lord of the rings', u'blackmetal', u'\xf6sterreich', u'sympho black metal', u'Middle-Earth', u'666', u'kicks mallcore kiddies around like little kids', u'kills nu-metal ten times over', u'Summoning', u'music that makes your head explode of amazement', u'daydreaming', u'Epic Atmospheric Black Metal', u'Black-Metal', u'symphonic black', u'black metal ist kunst']"
859,The Passing of the Grey Company,24060,148067,556000,"[u'atmospheric black metal', u'black metal', u'epic black metal', u'Symphonic Black Metal', u'Tolkien', u'metal', u'middle-earth songs', u'folk metal', u'favorites', u'epic', u'medieval', u'Awesome', u'atmospheric', u'austrian', u'Favorite', u'Favourites', u'Austria', u'ambient metal', u'Chills', u'melodic black metal', u'ambient black metal', u'journey', u'Atmospheric metal', u'kickass', u'tolkien metal', u'symphonic black', u'austrian black metal', u'medieval black metal', u'Awesome metal songs', u'athmosphere', u'fantasy black metal', u'midi black metal', u'austria metal', u'second wave black metal', u'Favourite metal songs', u'Tolkien Legacy', u'songs to play after you sit for an hour waiting for a bus', u'Songs that make me want to play RPGs on the NES', u'soundtrack to nightmares', u'epic quest music', u'goddamned masterpiece']"
860,Lugburz,30002,162356,434000,"[u'atmospheric black metal', u'epic black metal', u'black metal', u'Symphonic Black Metal', u'epic', u'epic metal', u'tolkien metal', u'fantasy black metal', u'metal', u'90s', u'atmospheric', u'fantasy metal', u'fantasy', u'melodic black metal', u'Atmospheric metal', u'Tolkien', u'EPIC WIN', u'tolkien black metal', u'epic-atmospheric black metal', u'ambient', u'Epic Atmospheric Black Metal', u'epic atmospheric metal', u'epic black', u'amazing', u'eerie', u'heard on Pandora', u'symphonic', u'symphonic metal', u'Masterpiece', u'1990s', u'1995', u'ambient black metal', u'best of 1990s', u'best of 90s', u'spirit', u'symphonic black', u'austrian black metal', u'medieval black metal', u'second wave black metal', u'wrath666', u'so fucking epic', u'atmospheric epic black metal', u'wiking pagan metal', u'lame shit', u'Die Verbannten Kinder Evas', u'apogenum']"
861,Soul Wandering,30534,154498,152000,"[u'black metal', u'atmospheric black metal', u'Symphonic Black Metal', u'epic black metal', u'fantasy', u'dungeon synth', u'instrumental', u'ambient', u'dark ambient', u'ambient black metal', u'epic', u'metal', u'intro', u'Tolkien', u'Summoning', u'tolkien metal', u'electronic', u'alternative', u'goth', u'experimental', u'Gothic', u'atmospheric', u'darkwave', u'dark wave', u'epic metal', u'ambient metal', u'gloomy', u'Atmospheric metal', u'ambient electronic', u'NOT METAL', u'lotr', u'not black metal', u'epic ambient', u'Dark Fantasy', u'gothic ambient', u'writing music', u'Fantasy Ambient', u'ceremonial', u'Zaebis', u'Synth ambient', u'RPG Music', u'symphonic black', u'austrian black metal', u'nethack', u'WBM', u'horror soundscapes', u'instrumental ambient', u'Nox Arcana', u'alternative ambient', u'second wave black metal']"
862,Moondance,14620,63314,286000,"[u'black metal', u'epic black metal', u'metal', u'epic metal', u'melodic black metal', u'Tolkien', u'tolkien metal', u'tolkien black metal']"
863,Dragons of Time,15668,71918,360000,"[u'black metal', u'orchestral', u'atmospheric', u'Symphonic Black Metal', u'pompous', u'epic black metal', u'metal', u'epic metal', u'melodic black metal', u'atmospheric black metal', u'Tolkien', u'tolkien metal', u'tolkien black metal']"
864,The Eternal Lands of Fire,15311,64738,216000,"[u'black metal', u'metal', u'Symphonic Black Metal', u'Tolkien', u'epic black metal', u'epic metal', u'melodic black metal', u'tolkien metal']"
865,Between Light and Darkness,16225,70950,209000,"[u'black metal', u'epic black metal', u'austrian', u'epic metal', u'Masterpiece', u'melodic black metal', u'atmospheric black metal', u'Tolkien', u'Amazing song', u'tolkien metal', u'amazing riffs']"
866,Master of the Old Lure,15972,68951,254000,"[u'black metal', u'epic metal', u'metal', u'melodic black metal', u'Tolkien', u'epic black metal', u'tolkien metal', u'black epic metal']"
867,Raising With the Battle-Orcs,14707,63668,343000,"[u'black metal', u'epic black metal', u'tolkien metal', u'metal', u'austrian', u'epic metal', u'Austria', u'Tolkien', u'Dark metal', u'ambient', u'epic', u'Dreamy', u'atmospheric', u'symphonic metal', u'fantasy metal', u'melodic black metal', u'atmospheric black metal', u'lord of the rings', u'Atmospheric metal', u'Epic Atmospheric Black Metal', u'Middle-Earth Inspired Ambient Black Metal']"
