,Songs,Listeners,Playcount,Duration,Tags
499,I Turn My Camera On,349926,2014222,212000,"[u'indie', u'indie rock', u'Veronica Mars', u'alternative', u'rock', u'spoon', u'catchy', u'indie pop', u'favorites', u'sexy', u'dance', u'Soundtrack', u'pop', u'Awesome', u'alternative rock', u'00s', u'funky', u'Favorite', u'fun', u'amayzes loved', u'seen live', u'american', u'texas', u'austin', u'the oc', u'2005', u'FUCKING AWESOME', u'I Turn My Camera On', u'happy', u'Love', u'amazing', u'loved', u'groovy', u'cool', u'bones', u'Friday Night Lights', u'songs that make you want to bop your head', u'chill', u'favorite songs', u'upbeat', u'beat', u'Favourites', u'falsetto', u'makes me want to dance', u'energizing', u'davaho53', u'music from bones', u'chillout', u'funk', u'television']"
500,Klimbim,19557,60181,295000,"[u'acoustic guitar', u'guitar', u'instrumental', u'guitar virtuoso', u'acoustic', u'folk', u'fingerstyle', u'lively', u'instrumental guitar', u'recommendations from my thread', u'suh-weet', u'good new artist', u'guitar ponder', u'new age', u'Canadian', u'upbeat', u'music to work to', u'jazz guitar', u'dad', u'Background', u'heard on last-fm 09', u'sunday morning', u'rhythmic', u'blingtacular', u'bright', u'Guitar Instrumental', u'guitarra', u'Relaxing Instrumental', u'follow-up', u'get this song', u'Play these acoustics', u'love this one', u'jak-superduper', u'timeless classics', u'nieko', u'Acoustic masters', u'acoustic guitar instrumental', u'qwertzer']"
501,"Go Home, Get Down",185440,1147818,139000,"[u'indie', u'alternative', u'dance punk', u'rock', u'alternative rock', u'indie rock', u'noise rock', u'electronic', u'dance', u'canadiangdchill', u'Get Down', u'punk', u'hardcore', u'post-punk', u'Canadian', u'dance rock', u'noise funk', u'noise', u'electronica', u'seen live', u'post-rock', u'canada', u'Garage Rock', u'00s', u'death from above 1979', u'indie punk', u'classic rock', u'test', u'heavy metal', u'metal', u'pop', u'80s', u'heavy', u'emo', u'sexy', u'fast', u'female vocalists', u'Progressive rock', u'electro', u'Stoner Rock', u'favorites', u'Lo-Fi', u'britpop', u'indietronica', u'Awesome', u'loud', u'death', u'Drum and bass', u'Avant-Garde', u'Drum n Bass']"
502,Hysteria,1118811,10317639,227000,"[u'alternative rock', u'rock', u'Muse', u'alternative', u'Progressive rock', u'british', u'indie', u'indie rock', u'favorites', u'Awesome', u'hysteria', u'seen live', u'00s', u'epic', u'Energetic', u'sexy', u'UK', u'electronic', u'hard rock', u'Love', u'FUCKING AWESOME', u'Favourites', u'britpop', u'brit rock', u'Progressive', u'experimental', u'space rock', u'guitar', u'bass', u'metal', u'best of muse', u'Favourite Songs', u'Britrock', u'favorite songs', u'favourite', u'male vocalists', u'new prog', u'energy', u'sex', u'cool', u'Favorite', u'amazing', u'intense', u'great riff', u'beautiful', u'great', u'alt rock', u'catchy', u'dark', u'psychedelic']"
503,Bridge or Cloud? - The Twilight Sad Remix,821,1354,280000,[]
504,All That - Natural Self Remix,610,986,0,[]
505,Hold On,10089,26537,303000,"[u'indie', u'funk', u'cover', u'gran turismo 5', u'nu-disco', u'driving a hovercar through space dust']"
506,New Noise,16186,70977,143000,"[u'electronic', u'cover', u'electro', u'House', u'electro house', u'electro rock', u'10s', u'electrorock', u'electronic rock', u'dirty electro', u'post-nerdcore', u'te ma zo', u'Se nos va de las manos']"
507,Laser Laser,1676,7447,324000,[u'youtube']
508,You Give Love a Bad Name,687297,4003807,220000,"[u'rock', u'80s', u'bon jovi', u'hard rock', u'classic rock', u'hair metal', u'glam rock', u'classic', u'Barney Stinson Get Psyched mix', u'You Give Love a Bad Name', u'Glam Metal', u'Get psyched', u'favorites', u'party', u'how i met your mother', u'pop', u'Love', u'1986', u'Guilty Pleasures', u'arena rock', u'FUCKING AWESOME', u'heavy metal', u'90s', u'80s rock', u'jon bon jovi', u'metal', u'american', u'Must be played loudly', u'Awesome', u'male vocalists', u""80's"", u'seen live', u'nostalgia', u'1980s', u'Favourite Songs', u'motivate', u'number one hits', u'this song makes me happy', u'Grunge', u'alternative', u'amayzes loved', u'bad name', u'barney stinson', u'Rock 80', u'Bon Jovi - You Give Love A Bad Name', u'pop rock', u'acoustic', u'guitar', u'old school', u'favourite']"
509,Roygbiv,313346,2150601,151000,"[u'electronic', u'ambient', u'chillout', u'idm', u'electronica', u'downtempo', u'trip-hop', u'chill', u'instrumental', u'beautiful', u'lounge', u'Warp', u'atmospheric', u'Boards of Canada', u'british', u'experimental', u'minimal', u'Dreamy', u'90s', u'heard on Pandora', u'Ambient Techno', u'happy', u'Scottish', u'Awesome', u'trippy', u'nostalgia', u'Mellow', u'1998', u'electro', u'Love', u'downbeat', u'scotland', u'loved', u'best song ever', u'Favourites', u'perfect', u'ROYGBIV', u'alternative', u'favorite songs', u'indietronica', u'psychedelic', u'amazing', u'relaxing', u'warm', u'relax', u'chill out', u'la creme', u'vugube62', u'indie', u'sexy']"
510,Anthemic,77829,305007,223000,"[u'dubstep', u'Trancestep', u'quisp', u'Magnetic Man', u'electronica', u'loving the bass lines', u'british', u'electro', u'wjlb-FM', u'trance', u'pop', u'dance', u'epic', u'addictive', u'2010s', u'Anthemic', u'anthem', u'synths', u'Electro Hip Hop', u'dupstep', u'skream', u'maybe baby', u'daniel sunspot', u'2011 single', u'mymau5']"
511,Two Can Play That Game - K Klassik Radio Mix,8636,25116,216000,"[u'rnb', u'male vocalists', u'bobby brown']"
512,Animal Rights,76966,297155,375000,"[u'House', u'Progressive House', u'electronic', u'dance', u'american', u'Progressive', u'party', u'bleep', u'electronic music', u'2010', u'design', u'fitness', u'deadmau5', u'crashing computers', u'mybar', u'mymau5', u'Daft Punk Sound alike', u'instrumental-plus']"
513,Miami 2 Ibiza - (Swedish House Mafia vs. Tinie Tempah),12142,31916,0,[]
514,Calaveras Y Diablitos,56334,216162,262000,"[u'Rock Argentino', u'ska', u'Rock en Espanol', u'latin', u'rock', u'ska reggae', u'argentina', u'rock en espa\xf1ol', u'Calaveras y diablitos', u'Los Fabulosos cadillacs', u'fabulosos cadillacs', u'spanish', u'jazz', u'90s', u'espa\xf1ol', u'Beach', u'fabulosos', u'musica que me encanta', u'one of the bests', u'pop', u'chill', u'reggae', u'rocksteady', u'favorites', u'Love', u'world', u'melodic', u'Rock Latino', u'Mellow', u'party', u'Spanish Rock', u'relaxing', u'great song', u'band', u'loved', u'latino', u'exotica', u'rock mexicano', u'salsa', u'fav', u'rock nacional', u'nostalgia', u'classics', u'design', u'love this', u'major key tonality', u'mixed acoustic and electric instrumentation', u'drunk', u'the beach', u'ILoveThis']"
515,Soil to Seed,31218,123001,148000,"[u'indie', u'House', u'vugube62', u'pop', u'funky', u'dub', u'urban', u'weird', u'bounce', u'deep house', u'somafm', u'nu-bluz', u'awwwwwwwwwwwww yeah', u'electronic-lounge', u'poptron', u'Nu-Bluz Funky Grooves in the E-Lounge', u'old skool vibes']"
516,Lost Coastlines,145740,869189,331000,"[u'indie', u'indie rock', u'folk', u'Alt-country', u'Chuck', u'Love', u'best of 2008', u'1Live Fiehe', u'altcountrygdchill', u'rock', u'2008', u'genius', u'Perfection', u'lyrically dense', u'alternative', u'feel good', u'folk rock', u'indie folk', u'00s', u'afternoon porch music', u'handclaps', u'okkervil river', u'la la la', u'ass-kicking', u'KEXP Song of the Day', u'I need to download', u'similar to: wilco', u'similar to: pavement', u'Soundtrack', u'sexy', u'fast', u'USA', u'favorites', u'lalala', u'folk-rock', u'americana', u'beautiful', u'upbeat', u'Energetic', u'morning', u'3', u'summer', u'banjo', u'smooth', u'new', u'amazing', u'good', u'male vocalists', u'Rock and Roll', u'alt country']"
517,Ghosts,335136,1978924,180000,"[u'folk', u'female vocalists', u'singer-songwriter', u'Laura Marling', u'indie', u'pop', u'acoustic', u'beautiful', u'british', u'Love', u'female vocalist', u'indie folk', u'female', u'ghosts', u'Bittersweet', u'brilliant', u'relaxing bliss', u'alternative', u'songs I absolutely love', u'2008', u'Mellow', u'great lyrics', u'storytelling', u'folkish', u'walking the streets at night with your headphones on', u'modern life isnt rubbish', u'alas i cannot swim', u'calm', u'Dreamy', u'melancholy', u'amazing', u'favourite', u'I like', u'relaxing', u'nice', u'female artists', u'love at first listen', u'10 of 10 stars', u'Guaranteed to make me feel better', u'heartbreak heartache', u'acousticindiefolk', u'Sasquatch 2010', u'play me some more', u'music to folk to', u'star crossed', u'strangelylovely', u'its not like i believe in everlasting love', u'seen live', u'chill', u'soul']"
518,This Song Is Definitely Not About You,1266,5423,202000,"[u'skint and demoralised', u'indie', u'rock', u'alternative', u'indie rock', u'love and other catastrophes']"
519,The Man Who Would Be King,192873,1167768,239000,"[u'indie', u'indie rock', u'british', u'rock', u'alternative', u'britpop', u'Garage Rock', u'garage rock revival', u'alternative rock', u'post-punk', u'favorites', u'Love', u'the libertines', u'this is the music i want to dance to', u'punk', u'genius', u'Punk Revival', u'arcadia', u'you dont know how great it is', u'Consistent Dodo Radio - Flittering', u'UK', u'favourite', u'male vocalists', u'Favorite', u'english', u'gute laune', u'Favourite Songs', u'yeah', u'Britrock', u'desperate', u'Fabulous', u'Post-punk revival', u'libertines', u'barat', u'doherty', u'the feeling like my heart will cave in with joy', u'every day', u'when we were older and our hair was longer', u'likely lads', u'great great great great great great song', u'tramwajowanie', u'seen live', u'chill', u'favorite songs', u'post-rock', u'happy', u'lalala', u'catchy', u'Post punk', u'beautiful']"
520,Legend Of A Mind,34519,103752,396000,"[u'psychedelic', u'classic rock', u'60s', u'Progressive rock', u'Psychedelic Rock', u'1968', u'rock', u'Moody Blues', u'Timothy Leary', u'Morose Deep dilate Crimson', u'sufu5a', u'the complete one', u'pop', u'british', u'Symphonic Rock', u'psychedelic pop', u'flute', u'atmospheric', u'Progressive', u'oldies', u'Psychedelia', u'trippy', u'LSD', u'mellotron', u'the Moody Blues', u'JTMlate60s', u'singer-songwriter', u'epic', u'easy listening', u'adult contemporary', u'mixtape', u'strings', u'orchestra', u'summer', u'great', u'psych', u'male vocalists', u'mysterious', u'laptop', u'freakbeat', u'radio paradise', u'radioparadise', u'art-rock', u'yeah', u'lp', u'international', u'close harmony', u'Crossover Prog', u'Traum', u'classic rock favorites']"
521,Stormwatcher,814,1861,394000,[]
522,Operator (Ring Ring) ft. Dances With White Girls,2001,3993,0,[]
523,Okay Alright,155,225,398000,[]
524,Poison - Original Mix,645,1381,0,[]
525,Controller,3229,8364,0,[]
526,Stupid Things,2700,6104,187000,[]
527,Iconic,10890,68285,0,"[u'electronic', u'pop', u'dance', u'2015 single', u'rebel heart']"
528,Across Waters Again,19945,88744,253000,"[u'rock', u'alternative', u'swedish', u'screamo', u'christian', u'christian rock', u'indie', u'alternative rock', u'hardcore', u'emo', u'hard rock', u'poetic', u'post-hardcore', u'bitter', u'okay', u'grungy', u'alternative vocals']"
529,The Waiting Room,24505,223442,214000,"[u'alternative rock', u'indie rock', u'post-hardcore', u'8 of 10 stars', u'10s', u'Giusychevola e che ama', u'giusychevola gifts from friends']"
530,Meant to Live and Die,1,1,222000,[]
531,50 Ways to Leave Your Lover,219398,933654,211000,"[u'70s', u'singer-songwriter', u'folk', u'classic rock', u'pop', u'paul simon', u'rock', u'soft rock', u'Mellow', u'folk rock', u'chill', u'acoustic', u'oldies', u'breakup', u'classic', u'folk-rock', u'pop rock', u'male vocalists', u'old favorites', u'folkrock', u'great songs', u'classics', u'simon', u'favorites', u'catchy', u'easy listening', u'favourite', u'fun', u'matthiastp-loved', u'sing-along', u'chillout', u'USA', u'memories', u'singersongwriter', u'great', u'singer songwriter', u'best', u'Friday', u'geeembee numbers', u'poprock', u'7 of 10 stars', u'1975', u'50 WAYS TO LEAVE YOUR LOVER', u'songs I absolutely love', u'mushy', u'dinner party', u'sunday brunch', u'there must be 50 ways to leave your lover', u'chill enough to pour bourbon on it', u'cool songs heard while listening to lastfm radio']"
532,Everyone Needs A Home,725,1671,0,[]
533,Always Sad,12074,31022,172000,"[u'alternative', u'2017']"
534,I’m Finding It Harder To Be A Gentleman,28873,66657,0,"[u'Garage Rock', u'blues rock']"
535,Totally Wired,6854,16197,217000,[u'cover']
536,It's The Little Things We Do,83836,262015,187000,"[u'indie', u'indie rock', u'rock', u'british', u'the zutons', u'funk', u'UK', u'seen live', u'soul', u'alternative', u'dance', u'favorites', u'Love', u'blues', u'Retro', u'upbeat', u'morning', u'bounce', u'party', u'00s', u'chill out', u'2006', u'lastfm', u'nonsense', u'all the best', u'best songs of the 00s', u'singalong', u'liverpool', u'hangovers', u'tt', u'white stripes', u'female voice', u'The', u'alt', u'to buy', u'british rock', u'male voice', u'hangover days', u'pretty cool', u'i feel good', u'swoon', u'Englishness', u'zutons', u'i know the feeling', u'luv it', u'jerrystroke', u'Inne', u'investigar', u'life is', u'Indie alternativ rock']"
537,No Kind Words,77086,560441,178000,"[u'indie rock', u'indie', u'alternative', u'british', u'love at first listen', u'2009', u'post-punk', u'00s', u'Yeah man', u'seen live', u'Post punk', u'Awesome', u'lizvelrene2009', u'critically acclaimed song', u'acclaimed music top 200 of 2009', u'the maccabees - no kind words', u'rock', u'Favoriter', u'favorites', u'catchy', u'beautiful', u'drums', u'top', u'super', u'Obsession', u'fav', u'accent', u'Remember', u'gaensehaut', u'best songs ever', u'Best of the best', u'readingfestival2010bestsongs', u'kings of leon', u'miau', u'single 2009', u'ciekawe', u'All The Number Ones', u'Fantastisk', u'the maccabees', u'personal meaning', u'muka muka', u'franzis allerliebste lieblingslieder', u'i could listen to it all day long', u'big fete', u'not alone at all', u'harder sound to the maccabees', u'helpless without helping', u'you should say nothing at all']"
538,There Goes The Fear,335184,1593805,288000,"[u'indie', u'indie rock', u'british', u'rock', u'alternative', u'500 Days of Summer', u'britpop', u'Soundtrack', u'doves', u'00s', u'alternative rock', u'sweet', u'Uplifting', u'beautiful', u'Manchester', u'brit pop', u'Love', u'upbeat', u'relaxing', u'heard on Pandora', u'indie pop', u'favorites', u'Favourites', u'2002', u'There Goes The Fear', u'pop', u'folk', u'catchy', u'atmospheric', u'dream pop', u'loved', u'lovely', u'Love it', u'Britrock', u'Just plain beautiful', u'vugube62', u'seen live', u'chill', u'classic', u'happy', u'Alternative  Punk', u'Awesome', u'Mellow', u'great', u'Like', u'nice', u'male vocalist', u'male vocalists', u'great lyrics', u'relax']"
539,Different Drugs,14897,48659,326000,[u'indie']
540,Own Brain,18092,67556,176000,"[u'indie', u'Manchester', u'listen again', u'stolen', u'ian brown', u'dolcix']"
541,Back - Kolsch Remix,378,628,0,[]
542,No Known Drink Or Drug,16123,55814,192000,"[u'somafm', u'Bagel']"
543,Hallelujah,70927,550793,181000,"[u'alternative', u'soul', u'anthem', u'power pop', u'gospel', u'indie', u'alternative rock', u'indie rock', u'pop rock', u'beautiful', u'american', u'pop punk', u'alternative pop', u'love at first listen', u'perfect', u'10s', u'god', u'2015', u'best of 2015', u'songs I absolutely love', u'gospel choir', u'l', u'2015 single', u'panic! at the disco', u'lead single', u'Anthem Rock', u'music choice: alternative', u'brendon urie', u'favorites 2015', u'brendon', u'power anthem', u'gospel influence', u'fpbdml gif', u'bbc radio1 playlist 2016']"
544,Lullaby,18148,54993,195000,"[u'2016 single', u'bbc radio1 playlist 2016']"
545,Show Yourself,31133,144366,189000,"[u'pop punk', u'somafm', u'Bagel']"
546,Shakespeare's Sister,297612,1538210,129000,"[u'80s', u'alternative', u'indie', u'The Smiths', u'rock', u'new wave', u'british', u'post-punk', u'britpop', u'1985', u'Morrissey', u'pop', u'alternative rock', u'indie pop', u'indie rock', u'melancholy', u'madchester', u'british i like', u'Manchester', u'smiths', u'amayzes loved', u'classic rock', u'rockabilly', u'alt rock', u'davaho53', u'SOLOMUSIKA-post punk', u'SOLOMUSIKA-British', u'Favorite Bands', u'UK', u'John Peel', u'Favourites', u'Moz', u'halloween', u'clementine', u'yeah', u'Britrock', u'80s alternative', u'john peels festive 50 1985', u'electronic', u'electronica', u'japanese', u'punk', u'singer-songwriter', u'favorites', u'Love', u'catchy', u'dark', u'alternative pop rock', u'college rock', u'new age']"
547,Animal Style,29441,135819,210000,"[u'british', u'Scottish', u'lively', u'songs that i will still be listening to in a billion years', u'great riffs', u'awesome sound', u'songs that make me move', u'2016 single', u'bbc radio1 playlist 2016']"
548,Secret Door,325347,2822518,223000,"[u'indie rock', u'indie', u'british', u'rock', u'alternative', u'alternative rock', u'arctic monkeys', u'00s', u'humbug', u'fools on parade', u'post-punk', u'britpop', u'Psychedelic Rock', u'Neo-Psychedelia', u'psychedelic', u'Retro', u'Garage-Rock', u'vugube62', u'chill', u'UK', u'Alternative  Punk', u'beautiful', u'Dreamy', u'genius', u'art rock', u'Mellow', u'amazing', u'songs that take you over', u'i love it', u'sweet bassline', u'secret door', u'seen live', u'baroque', u'60s', u'2009', u'hard rock', u'Contemporary', u'garage rock revival', u'other', u'Awesome', u'Psychedelia', u'new', u'Indie-Rock', u'Garage Rock', u'relaxing', u'f', u'majestic', u'best song ever', u'gorgeous', u'2011']"
549,Is This It,694172,4574963,155000,"[u'indie rock', u'rock', u'indie', u'alternative', u'alternative rock', u'Garage Rock', u'The Strokes', u'american', u'00s', u'new york', u'garage', u'is this it', u'post-punk', u'favorites', u'britpop', u'Strokes', u'calm', u'Lo-Fi', u'indie pop', u'2001', u'seen live', u'favorite songs', u'Love', u'garage rock revival', u'Mellow', u'amazing', u'cool', u'heard on Pandora', u'chill', u'Favorite', u'classic rock', u'pop', u'RockPop', u'Post punk', u'bass', u'NYC', u'male vocalists', u'Favourites', u'no radiohead radio', u'sexy', u'albums I own', u'hard rock', u'slow', u'intro', u'Alternative  Punk', u'feel good', u'good', u'High School', u'rock n roll', u'indierock']"
550,Ful Stop,122668,839279,367000,"[u'krautrock', u'post-punk', u'art rock', u'motorik', u'electronic', u'alternative rock', u'clinically romantic', u'post-revolutionary pop song', u'Avantgarde Pop', u'2010s', u'4 Stars', u'2016', u'6/8', u'art pop', u'achingly intelligent', u'alternative pop/rock', u'Best of Radiohead', u'FULL STOP', u'']"
551,Ruby,890881,5351075,202000,"[u'indie', u'indie rock', u'rock', u'britpop', u'british', u'alternative', u'kaiser chiefs', u'alternative rock', u'Ruby', u'pop', u'00s', u'catchy', u'Guitar Hero', u'2007', u'UK', u'happy', u'favorites', u'seen live', u'male vocalists', u'brit rock', u'indie pop', u'cool', u'pop rock', u'Awesome', u'brit pop', u'Britrock', u'Kaiser Chiefs - Ruby', u'england', u'Favorite', u'party', u'fun', u'2000s', u'Guitar Hero 3', u'Brit', u'british indie', u'Ruby Ruby Ruby Ruby', u'ruby ruby ruby', u'Energetic', u'Favourites', u'Love', u'upbeat', u'feelgood', u'Leeds', u'dance', u'summer', u'sing along', u'chill', u'post-punk', u'gute laune', u'makes me happy']"
552,Pocket Full Of Stars,94,272,0,[]
553,Soldier Boys and Jesus Freaks,72922,413662,202000,"[u'rock', u'alternative rock', u'britpop', u'indie rock', u'baroque rock', u'alternative', u'trumpet', u'seen live', u'catchy', u'summer', u'favourite', u'male vocalists', u'2011', u'styles', u'Noel Gallagher', u'this and that', u'vivacubalibre loved tracks', u'preciso de pouco para ser feliz', u'noel gallaghers hfb', u'people on the village green']"
554,Walls Get Smaller,2841,4736,369000,"[u'alternative', u'xxx', u'Psychedelic Rock', u'mantra', u'chill music', u'indie b-sides', u'indie ruhig']"
555,Sweet By and By,63859,316466,185000,"[u'jazz', u'blues', u'british', u'singer-songwriter', u'indie', u'acoustic', u'alternative', u'jazzy', u'sexy', u'vocal jazz', u'britpop', u'download', u'Peter Doherty', u'pete doherty', u'made with heart', u'life is a cabaret', u'pop', u'rock', u'indie rock', u'cool', u'00s', u'lovely', u'indie-pop', u'cafe music', u'feelgood', u'acoustic guitar', u'not jazz', u'foxtrot', u'West Coast swing', u'Garage-pop', u'My pop music', u'my gang 09', u'freakey stylish', u'mellow Indie', u'charmant', u'doherty', u'tijdloos', u'my favourite jazz', u'Jills Station', u'Keep the Fate', u'teddymuzik', u'smeeradio', u'peterD', u'as adoraveis', u'Libertines Playlist']"
556,One More Cup of Coffee,143581,586708,194000,"[u'cover', u'rock', u'Garage Rock', u'alternative', u'alternative rock', u'blues rock', u'Bob Dylan cover', u'blues', u'covers', u'indie', u'american', u'coffee', u'The White Stripes', u'loved it so much it made me sick', u'indie rock', u'90s', u'00s', u'Dylan', u'favorites', u'late night', u'detroit', u'garage', u'Great Covers', u'Dylan cover', u'Bob Dylan', u'good cover', u'music for people with superior taste in music', u'my nostalgia', u'better than bob dylan', u'seen live', u'70s', u'heavy', u'folk', u'sexy', u'acoustic', u'Lo-Fi', u'blues-rock', u'garage rock revival', u'RockPop', u'organ', u'best covers', u'favourite', u'nice', u'60s influenced', u'loved', u'male vocalist', u'mysterious', u'cover songs', u'Favourites', u'2000s']"
557,Apply some Pressure - Original Demo Version,14404,43590,0,[]
558,The Good Ones,262636,983303,206000,"[u'indie rock', u'Garage Rock', u'indie', u'rock', u'alternative', u'The Kills', u'alternative rock', u'female vocalists', u'Lo-Fi', u'sexy', u'the good ones', u'00s', u'british', u'interesting', u'lovedbyale', u'kills', u'garage', u'Love it', u'amayzes loved', u'sufu5a', u'Stoner Rock', u'good', u'femalevocalistsgdchill', u'scream and shake', u'the kills - the good ones', u'post-punk', u'Awesome', u'american', u'party', u'cool', u'2005', u'duos', u'davaho53', u'so sexy', u'elovibeloved', u'punk', u'favorites', u'Love', u'dirty', u'Mellow', u'altparty', u'bringing sexy back', u'indierock', u'Favorite', u'fav', u'best', u'Favourites', u'english', u'Find More', u'Britrock']"
559,The Love Within,41111,159738,278000,"[u'indie', u'british', u'2015 single']"
560,Gigantic,395744,2385337,193000,"[u'alternative', u'rock', u'indie', u'indie rock', u'alternative rock', u'80s', u'pixies', u'female vocalists', u'favorites', u'punk', u'Grunge', u'post-punk', u'seen live', u'kim deal', u'catchy', u'american', u'college rock', u'noise pop', u'fun', u'indie pop', u'Love', u'90s', u'1988', u'Favourites', u'happy', u'Favorite', u'favorite songs', u'sex', u'4ad', u'Gigantic', u'classic rock', u'Awesome', u'upbeat', u'the pixies', u'chill', u'sexy', u'bass', u'favourite', u'garage', u'lyrics', u'1980s', u'Favourite Songs', u'best songs ever', u'all time favorites', u'fucking love', u'This would play over the credits of the movie adaptation of the sequel to my life', u'vugube62', u'metal', u'female', u'USA']"
561,Cassius - Tensnake Remix,3948,5863,489000,"[u'House', u'nu-disco']"
562,Burn Baby Burn,125684,598921,208000,"[u'rock', u'indie', u'britpop', u'alternative', u'alternative rock', u'indie rock', u'90s', u'ash', u'seen live', u'british', u'punk', u'pop rock', u'00s', u'happy', u'Favourites', u'irish', u'pop', u'2001', u'Smallville', u'ASH 1977', u'power pop', u'indiepop', u'Awesome', u'loud', u'party', u'punk rock', u'heard on Pandora', u'alt rock', u'Favourite Songs', u'brit pop', u'Hell Yeah', u'Burn Baby Burn', u'Grunge', u'brutal', u'post-rock', u'dance', u'favorites', u'energy', u'Alternative  Punk', u'post-punk', u'feel good', u'Driving', u'subway', u'Progressive', u'oldies', u'pop punk', u'amazing', u'fun', u'Uplifting', u'cool']"
563,Alright,447076,1916311,179000,"[u'britpop', u'90s', u'indie', u'rock', u'alternative', u'british', u'pop', u'happy', u'indie rock', u'alternative rock', u'summer', u'upbeat', u'1995', u'supergrass', u'Soundtrack', u'fun', u'party', u'piano', u'catchy', u'feel good', u'good mood', u'indie pop', u'Favourites', u'power pop', u'classic', u'UK', u'memories', u'Awesome', u'male vocalists', u'feelgood', u'brit pop', u'Uplifting', u'Playful', u'british i like', u'alright', u'clueless', u'england', u'nostalgic', u'High School', u'childhood', u'1990s', u'daria', u'classic rock', u'Driving', u""90's"", u'uptempo', u'nostalgia', u'misc', u'all time favorites', u'grew up on']"
564,Feeling Good,763836,5902770,199000,"[u'rock', u'alternative rock', u'cover', u'alternative', u'Muse', u'british', u'Progressive rock', u'indie', u'covers', u'sexy', u'seen live', u'indie rock', u'feeling good', u'Love', u'00s', u'piano', u'britpop', u'Awesome', u'beautiful', u'UK', u'favorites', u'queer as folk', u'favorite songs', u'piano rock', u'male vocalists', u'sex', u'great cover', u'hard rock', u'feel good', u'Progressive', u'male vocalist', u'jazz', u'amazing', u'Favourite Songs', u'happy', u'upbeat', u'great song', u'Favourites', u'FUCKING AWESOME', u'good cover', u'songs that make you feel better', u'bass', u'angst', u'nina simone', u'nina simone cover', u'songs to fall in love to', u'chillout', u'intense', u'good', u'heard on Pandora']"
565,She Bangs The Drums - Remastered,55716,168001,0,[]
