,Songs,Listeners,Playcount,Duration,Tags
604,Against Them All,26220,273146,198000,"[u'hardcore', u'metalcore', u'melodic hardcore', u'diamond', u'Stick To Your Guns', u'metal', u'Awesome', u'Selena Gomez', u'heartcore', u'modern hardcore', u'hilary duff', u'Easycore', u'kim kardashian', u'Vanessa Hudgens', u'Ariana Grande', u'yeaaa boy', u'megan fox', u'styg', u'kate upton', u'Minka', u'nabilla benattia', u'jade laroche', u'anna polina', u'anissa kate', u'eva shaw']"
605,Nobody,18811,121505,186000,"[u'hardcore', u'Awesome', u'melodic hardcore', u'hardcore punk', u'Stick To Your Guns', u'disobedient']"
606,We Still Believe,23925,256007,214000,"[u'hardcore', u'metalcore', u'melodic hardcore', u'metal', u'punk rock', u'Easycore', u'emo', u'emocore', u'2012', u'2010s', u'diamond', u'Stick To Your Guns']"
607,World Tour 2013,52,96,0,[]
608,Gimme Death,13904,77003,109000,[u'rock']
609,No Longer Human,6215,50314,724000,"[u'Crust', u'epic as fuck', u'Epic Crust', u'neo-crust', u'epic', u'Awesome', u'amazing', u'best song ever', u'epic-crust']"
610,... Won`t Dry On Their Own,59,195,0,[]
611,[Vulnus],6547,32286,312000,"[u'Post-Metal', u'dark hardcore', u'neo crust']"
612,Lunar Caustic,6701,42181,471000,"[u'experimental', u'Gothic Metal', u'post metal']"
613,Lunar Caustic,6701,42181,471000,"[u'experimental', u'Gothic Metal', u'post metal']"
614,Gimme Death,13904,77003,109000,[u'rock']
615,Gimme Death,13904,77003,109000,[u'rock']
616,Solar Flare Homicide,60716,560703,230000,"[u'metalcore', u'deathcore', u'hardcore', u'moshcore', u'Nu-metal', u'metal', u'DJENT', u'dubstep', u'<3', u'posthardcore', u'Emmure', u'The Heretics Conviction', u'death metal', u'Nu Metal', u'10 of 10 stars', u'heavy as fuck', u'i had to change my pants after this song', u'wiggercore', u'beatdown hardcore', u'br00tal', u'motherfucking snakes on a motherfucking plane', u'Music to kick someones ass to', u'sun and moon and stars and outer space', u'br00t4l', u'Mushroomhead', u'nu-deathcore', u'wob wob', u'powermetalcore', u'Post Apocalyptic Lounge', u'ignorancecore', u'Rockgarden', u'lovedbyme1', u'Sollar Flare Homicide', u'speaker of the dead', u'i traiyin mai fakin vest']"
617,I Thought You Met Telly and Turned Me Into Casper,36798,314956,173000,"[u'deathcore', u'metalcore', u'hardcore', u'Melodic Deathcore', u'shouty', u'metal', u'Awesome', u'gay', u'i had to change my pants after this song', u'moshcore', u'metalcore metal', u'bitchcore', u'talked vocals do not make you popular', u'morning mix', u'find this shit', u'Victory Records Memorial Day Metal Sampler 2010', u'ignorancecore', u'i thought you met telly', u'O Wretched Man', u'scream bitch']"
618,Burn Alive,14364,80164,117000,[]
619,Gimme Death,13904,77003,109000,[u'rock']
620,Gimme Death,13904,77003,109000,[u'rock']
621,Gimme Death,13904,77003,109000,[u'rock']
622,No Peace,15,18,0,[]
623,Gimme Death,13904,77003,109000,[u'rock']
624,Awake EP,53,87,0,[]
625,Awake,27408,162379,100000,"[u'hardcore', u'punk', u'hardcore punk', u'punk rock', u'2011', u'post-hardcore', u'skate', u'friendsofthekingofrummelpop', u'powerviolence', u'post-powerviolence', u'brain on drugz']"
626,Cloudkicker,7405,26356,179000,[u'hardcore punk']
627,The Great Escape,5601,18952,53000,[]
628,F.E.B.N.,12986,59502,95000,[]
629,Le Discours De Ta Méthode,330,1066,248000,[]
630,Derrumbemos,511,1623,309000,"[u'Crust', u'atmospheric', u'screamo', u'crust punk']"
631,La Machine Dure,333,944,181000,[]
632,L'Amour Au Temps De La Peste,389,1259,262000,[]
633,"Aimer, Mourir Jeune et Faire Un Beau Cadavre",292,871,215000,[]
634,Le Discours De Ta Méthode,330,1066,248000,[]
635,"Aimer, Mourir Jeune et Faire Un Beau Cadavre",292,871,215000,[]
636,At the Mouth of the Sounding Sea,1564,5325,600000,[]
637,Imperfect (Carla's Dreams Cover) l Pop Goes Wicked,10,31,0,[]
638,Rege Pe Deal (Subcarpati Cover) l Hip-Pop Goes Wicked,5,6,0,[]
639,Enough Is Enough,30058,203908,238000,"[u'metalcore', u'hardcore', u'melodic hardcore', u'triphop', u'moshcore', u'seen live', u'melodic', u'Easycore', u'tralafitti', u'lovedbyme1']"
640,Amber,29628,288639,214000,"[u'hardcore', u'metalcore', u'melodic hardcore', u'metal', u'seen live', u'post-hardcore', u'positive hardcore', u'Easycore', u'Stick To Your Guns', u'baggysweatercore', u'the hope division']"
641,"Like A G6 ft. The Cataracs, Dev",4478,21278,0,[]
642,"Like A G6 ft. The Cataracs, Dev",4478,21278,0,[]
643,Get Deaded (Moody Good Remix),219,485,321000,[]
644,I'm Trying to Disappear,8521,55396,229000,[]
645,Live in TheCell // Full Gig,1,1,0,[]
646,Cotton Eye Joe,242064,826336,190000,"[u'country', u'dance', u'90s', u'eurodance', u'party', u'pop', u'swedish', u'rednex', u'fun', u'1994', u'techno', u'electronic', u'one hit wonder', u'cotton eye joe', u'Disco', u'happy', u'upbeat', u'country pop', u'Sweden', u'positive', u'electronica', u'folk', u'favorites', u'guilty pleasure', u""90's"", u'meine liebsten kellerleichen der 90er', u'celtic-dance', u'svensk country taggradio', u'female vocalists', u'Love', u'oldies', u'nostalgic', u'cool', u'top 40', u'Guilty Pleasures', u'8 of 10 stars', u""so bad it's good"", u'life', u'childhood', u'1995', u'names', u'linedance', u'four-on-the-floor beats', u'swedish poprock', u'awful awful awful', u'Lulz: A corruption of LOL', u'leapsandloved', u'i adore this regardless of how embarrassing it is', u'a tight kick sound', u'galaxystardust']"
647,Grandfather,27544,151376,279000,"[u'mathcore', u'hardcore', u'experimental', u'grindcore', u'screamo', u'metalcore', u'math rock', u'party', u'jazzcore', u'emotion', u'noisecore', u'Destruction', u'Grind', u'messed up', u'kuhl solo', u'metal', u'seen live', u'epic', u'beautiful', u'Driving', u'Nintendocore', u'00s', u'jesus christ', u'geil', u'fun stuff', u'Krank', u'The Number Twelve Looks Like You', u'Beautiful kaos']"
648,The Chariot,19,32,0,[]
649,LOSS // live at studio148,5,6,0,[]
650,LOSS // live at studio148,5,6,0,[]
651,Depths,242,740,0,[]
652,Rapture,339,1159,273000,[]
653,Monolith - Loss,1,1,0,[]
654,Deceive,4191,14763,284000,[]
655,River in Me,17775,54265,0,"[u'electronic', u'pop']"
656,Redefine,14424,38055,286000,[]
657,Do You Remember,12910,166178,229000,"[u'melodic hardcore', u'post-rock', u'post-grunge', u'post-hardcore', u'emo', u'ambient', u'post rock', u'perfect to listen to while leaving the planet', u'heartcore', u'raping the replay']"
658,My Sharona,19960,101799,0,"[u'punk rock', u'rock', u'punk', u'Ramones', u'classic rock', u'classic', u'70s', u'pop rock', u'Awesome', u'cover', u'love songs', u'lyrics', u'Perfection', u'emotion', u'genial', u'rythm', u'Solomusika-Loved', u'back in the day', u'so good youll put your foot in a bucket', u'unica', u'oifm']"
659,start,23,96,0,[]
660,She's A Hack,8347,51465,198000,[]
661,Tentacles (Outer Edges),153,342,0,[]
662,Vigilantes (Outer Edges),72,140,0,[]
663,Collider (Outer Edges),173,627,0,[]
664,Anomaly (Outer Edges),175,490,0,[]
665,The Approach (Outer Edges),85,120,0,[]
666,Collider,5831,19932,287000,[]
667,Do You Remember,12910,166178,229000,"[u'melodic hardcore', u'post-rock', u'post-grunge', u'post-hardcore', u'emo', u'ambient', u'post rock', u'perfect to listen to while leaving the planet', u'heartcore', u'raping the replay']"
668,...In Black Vaults of a Death God,985,3544,258000,"[u'death metal', u'black metal', u'metal', u'black/death metal', u'blackened death']"
669,Death.Rot.Monolith,1275,4414,150000,"[u'death metal', u'black metal', u'metal', u'black/death metal', u'blackened death']"
670,Scourge of a World Ablaze,1720,7620,326000,"[u'death metal', u'black metal', u'metal', u'black/death metal', u'blackened death']"
671,Ruin Enshrined,1327,4722,289000,"[u'death metal', u'black metal', u'metal', u'Blackened Death Metal', u'black/death metal', u'blackened death']"
672,"In a Night of Endless Pain, War Came to Flood It's Heart...",687,2380,0,[u'death metal']
673,All Idols Fall Before the Hammer,1423,4975,276000,"[u'death metal', u'black metal', u'metal', u'black/death metal', u'blackened death']"
674,Churning the Storm,1456,5259,289000,"[u'death metal', u'black metal', u'metal', u'black/death metal', u'blackened death']"
675,Thralls,1977,8652,330000,"[u'death metal', u'black metal', u'metal', u'black/death metal', u'blackened death']"
676,The Cormorants Shiver on Their Rocks,3808,16926,278000,"[u'atmospheric black metal', u'black metal']"
677,Silence,4148,19181,580000,"[u'atmospheric black metal', u'black metal', u'folk metal']"
678,Nonesuch River Chant,4086,18652,97000,"[u'folk', u'atmospheric black metal', u'black metal']"
679,Awaiting the Fire or Flood that Awakes It,4261,21310,808000,"[u'black metal', u'atmospheric black metal', u'folk', u'folk metal', u'orgasmic acoustic.']"
680,Banished,4975,25135,647000,"[u'black metal', u'atmospheric black metal', u'folk metal', u'that riff']"
681,Earth's Old Timid Grace,4946,23396,233000,"[u'atmospheric black metal', u'black metal', u'folk metal', u'Atmospheric Folk Black Metal', u'bliss.']"
682,Tir Nan Og,61254,464512,370000,"[u'shoegaze', u'atmospheric', u'post-rock', u'beautiful', u'black metal', u'ambient', u'atmospheric black metal', u'french', u'peaceful', u'chillout', u'rock', u'piano', u'Mellow', u'melancholic', u'post rock', u'Consistent Dodo Radio - Flittering', u'metal', u'folk', u'dream pop', u'fantasy', u'Post-Metal', u'Post-Black Metal', u'not black metal', u'favorito', u'metalgaze', u'me like', u'black shoegaze', u'melancholic dark metal', u'black metal - shoegaze', u'heavy metal', u'pop', u'alternative rock', u'Love', u'acoustic', u'Awesome', u'Dreamy', u'summer', u'postrock', u'ethereal', u'irish', u'underrated', u'00s', u'gorgeous', u'celtic', u'Favorite', u'Sweden', u'perfect', u'Nature', u'6 of 10 stars', u'favourite tracks']"
683,Sur l'autre rive je t'attendrai,61003,455295,410000,"[u'shoegaze', u'atmospheric black metal', u'black metal', u'atmospheric', u'french', u'post-rock', u'Post-Black Metal', u'melancholic', u'blackgaze', u'ambient', u'darkwave', u'french black metal', u'black shoegaze', u'melancholic dark metal', u'rock', u'favorites', u'dream pop', u'shoegazer', u'france', u'Post-Black', u'Post-Metal', u'favourite tracks', u'not black metal', u'shogaze', u'Consistent Dodo Radio - Flittering', u'it shakes my mind', u'black metal - shoegaze', u'metal', u'alternative rock', u'acoustic', u'beautiful', u'lovesong', u'ethereal', u'post rock', u'00s', u'moving', u'annoying', u'6 of 10 stars', u'DSBM', u'saudade', u'french metal', u'more please', u'love to death', u'audrey sylvain', u'metalgaze', u'ethereal metal', u'blackened shoegaze', u'me like', u'melody blowz my mind', u'dream metal']"
684,Ciel errant,65815,516483,433000,"[u'shoegaze', u'atmospheric', u'atmospheric black metal', u'post-rock', u'black metal', u'french', u'Post-Metal', u'melancholic', u'rock', u'beautiful', u'dream pop', u'post rock', u'ambient', u'france', u'Post-Black Metal', u'french metal', u'not black metal', u'blackgaze', u'metalgaze', u'black shoegaze', u'prozac songs', u'metal', u'alternative rock', u'ethereal', u'00s', u'shoegazer', u'francais', u'love at first listen', u'Post-Black', u'personal favourites', u'6 of 10 stars', u'tender', u'unreal', u'favourite tracks', u'genial', u'french black metal', u'ethereal metal', u'Loved Songs', u'blackened shoegaze', u'Unimaginable Brilliance', u'dream metal', u'melancholic dark metal', u'black metal shoegaze', u'the best song i ever heard']"
685,Les iris,69897,580006,461000,"[u'shoegaze', u'black metal', u'atmospheric black metal', u'atmospheric', u'post-rock', u'french', u'melancholic', u'ambient', u'post rock', u'ethereal', u'Post-Black Metal', u'cant be described by words', u'rock', u'beautiful', u'Post-Metal', u'blackgaze', u'Blackened Post-Rock', u'black shoegaze', u'folk', u'Progressive metal', u'doom metal', u'Avant-Garde', u'shoegaze black metal', u'Favourite Songs', u'ambient black metal', u'melancholic black metal', u'Godlike', u'not black metal', u'prozac songs', u'metal', u'instrumental', u'alternative', u'alternative rock', u'folk metal', u'dream pop', u'Doom', u'Favorite Artists', u'favourite', u'intense', u'00s', u'shoegazer', u'france', u'9 of 10 stars', u'Nature', u'feelgood', u'suicidal', u'god', u'songs to fuck to', u'DSBM', u'depressive']"
686,Souvenirs d'un autre monde,83484,804450,369000,"[u'shoegaze', u'black metal', u'atmospheric black metal', u'melancholic', u'atmospheric', u'post-rock', u'ambient', u'beautiful', u'Post-Metal', u'black shoegaze', u'french', u'Atmospheric metal', u'Post-Black Metal', u'romantic', u'Mellow', u'Love', u'Dreamy', u'summer', u'ethereal', u'depressing', u'Eargasm', u'depressive rock', u'depressive', u'not black metal', u'metalgaze', u'blackened shoegaze', u'metal', u'rock', u'experimental', u'memories', u'epic', u'Awesome', u'dream pop', u'melancholy', u'atmospheric rock', u'Favourite Songs', u'shoegaze metal', u'music to listen to by a forest river at night', u'dream metal', u'Alcest', u'black metal - shoegaze', u'multiple orgasms', u'one and only love', u'alternative rock', u'female vocalists', u'doom metal', u'folk metal', u'orchestral', u'soundscape', u'genius']"
687,Printemps Émeraude,22478,144729,0,"[u'shoegaze', u'black metal', u'post-rock', u'atmospheric', u'atmospheric black metal', u'french', u'Post-Metal', u'shoegaze metal', u'not black metal', u'blackgaze', u'metalgaze', u'metal', u'rock', u'2007', u'melancholic', u'Atmospheric metal', u'Post-Black Metal', u'french metal', u'blackened shoegaze', u'heavy metal', u'alternative rock', u'dream pop', u'ethereal', u'00s', u'francais', u'Extreme Metal', u'2000s', u'6 of 10 stars', u'post metal', u'french black metal', u'ethereal metal', u'so beautiful it hurts', u'my favourite tracks', u'really good metal', u'dream metal', u'black metal shoegaze']"
688,Necromania,6831,36195,222000,"[u'metal', u'speed metal']"
689,Rip This Hell,7302,43653,170000,"[u'metal', u'speed metal', u'black metal', u'thrash metal']"
690,You Can't Stop Steel,9111,52946,202000,"[u'speed metal', u'heavy metal', u'666', u'metal']"
691,Satanic Royalty,8255,48586,203000,"[u'metal', u'speed metal', u'FUCKING AWESOME', u'satan', u'Black n Roll', u'blackened speed metal', u'free waterfall senior']"
692,The Great Deceiver,4265,14065,269000,"[u'thrash metal', u'black metal', u'metal', u'speed metal', u'blackened thrash metal', u'old school black metal', u'Speed/Thrash Metal', u'first wave black metal', u'black/thrash metal']"
693,Fallen Angel,6597,22480,237000,"[u'thrash metal', u'old school black metal', u'speed metal', u'First Wave Of Black Metal', u'metal', u'proto-black metal', u'1st wave black metal', u'first wave black metal', u'black metal', u'1st wave of black metal', u'thrash', u'old school thrash', u'Power metal', u'trash metal', u'blackened thrash metal', u'true metal', u'Old School Metal', u'true black metal', u'pure evil', u'Black Thrash', u'italian black metal', u'black Thrash metal', u'Speed/Thrash Metal', u'Pure Fucking Metal', u'Blackened Thrash', u'black/thrash metal', u'primitive black metal', u'Mendigao thrash', u'metallo', u'brutal thrash', u'Blackest Of The Black', u'true metal gods', u'this could be venom', u'primitive thrash', u'the italian venom', u'blacker than the black']"
694,Insurrection of the Living Damned,4683,15927,343000,"[u'black metal', u'metal', u'thrash metal', u'speed metal', u'extremeshocksexviolenceorcomedy', u'blackened thrash metal', u'old school black metal', u'Speed/Thrash Metal', u'first wave black metal', u'black/thrash metal']"
695,Cut Throat,2534,9045,234000,"[u'black Thrash metal', u'dirty as fuck riff']"
696,Cut Throat,2534,9045,234000,"[u'black Thrash metal', u'dirty as fuck riff']"
697,Transpolar Combat,2259,10306,463000,"[u'death metal', u'heavy metal', u'metal', u'Melodic Death Metal']"
698,Rape of a Slave,2878,16712,278000,"[u'death metal', u'heavy metal', u'metal', u'Melodic Death Metal', u'Heavy shit']"
699,Fall of the MeLanic Breeds,2402,10429,289000,"[u'death metal', u'heavy metal', u'metal', u'Melodic Death Metal']"
700,Incursions,2537,11361,242000,"[u'death metal', u'heavy metal', u'metal', u'Melodic Death Metal', u'good shit', u'proggish']"
701,Ten Lost Tribes,2529,12565,390000,"[u'death metal', u'heavy metal', u'metal', u'Melodic Death Metal']"
702,The Imperial Clans,2829,15305,330000,"[u'death metal', u'Melodic Death Metal', u'heavy metal', u'metal', u'good shit', u'total ownage', u'Bass Guitar Extravaganza']"
703,Galloping Through the Battle Ruins,2198,11226,407000,"[u'death metal', u'Melodic Death Metal', u'metal', u'NS Death metal']"
704,The Entity,2885,14164,250000,"[u'death metal', u'metal', u'Melodic Death Metal', u'Fucking Badass', u'total ownage']"
705,The Banners of Castile,2909,15465,247000,"[u'death metal', u'metal', u'Melodic Death Metal', u'good shit']"
706,Defile the Angelic,2990,14987,367000,"[u'death metal', u'heavy metal', u'metal', u'Melodic Death Metal', u'good shit', u'total ownage', u'kk', u'majestic death metal']"
707,The Reaper,2963,11511,209000,"[u'metal', u'punk', u'speed metal', u'thrash']"
708,Hell & Back,3193,13136,158000,"[u'metal', u'speed metal']"
709,Death Ripper,3354,13766,202000,"[u'Werewolves on wheels', u'metal', u'punk', u'speed metal', u'thrash']"
710,I Can't Die,3387,13519,235000,"[u'metal', u'punk', u'speed metal', u'thrash']"
711,Never Twice,3469,14348,219000,"[u'metal', u'punk', u'speed metal', u'thrash']"
712,Never Twice,3469,14348,219000,"[u'metal', u'punk', u'speed metal', u'thrash']"
713,Time to Annihilate,3783,16833,223000,"[u'metal', u'punk', u'speed metal', u'thrash']"
714,I Am the Demon,4334,20056,217000,"[u'metal', u'punk', u'speed metal', u'thrash', u'free waterfall senior']"
715,Out On Bail,4009,17954,164000,"[u'metal', u'punk', u'speed metal', u'thrash']"
716,Up All Night,4334,20008,168000,"[u'speed metal', u'thrash', u'heavy metal', u'metal', u'punk']"
717,Speedwolf,5482,25247,328000,"[u'speed metal', u'thrash', u'heavy metal', u'metal', u'punk', u'like motorhead']"
718,Road to Burn,8017,32034,529000,[]
719,Still the Night Is Awake,5824,29085,210000,"[u'melodic black metal', u'black metal', u'melancholic', u'Masterpiece']"
720,As I Behold the Dying Sun,6180,31735,374000,"[u'black metal', u'melodic black metal', u'swedish', u'melancholic', u'very emotional']"
721,A Castle So Crystal Clear,6541,35603,328000,"[u'black metal', u'melodic black metal', u'swedish black metal']"
722,I'm an Other in the Night,6395,33740,425000,"[u'black metal', u'melodic black metal']"
723,Wings of Sorrow,5495,28286,537000,"[u'black metal', u'metal', u'melancholic', u'melodic black metal', u'heard on youtube', u'insane guitarwork']"
724,A Winter Breeze,5654,27515,289000,"[u'melancholic', u'melodic black metal', u'melancholic black metal']"
725,Still the Night Is Awake,5824,29085,210000,"[u'melodic black metal', u'black metal', u'melancholic', u'Masterpiece']"
726,Vinterskogen,5987,31696,237000,"[u'black metal', u'melodic black metal', u'amazing', u'melancholic', u'brilliant', u'Masterpiece', u'Legendary', u'Breathtaking', u'very emotional', u'this makes me feel euphoric']"
727,As I Behold the Dying Sun,6180,31735,374000,"[u'black metal', u'melodic black metal', u'swedish', u'melancholic', u'very emotional']"
728,As I Behold the Dying Sun,6180,31735,374000,"[u'black metal', u'melodic black metal', u'swedish', u'melancholic', u'very emotional']"
729,A Castle So Crystal Clear,6541,35603,328000,"[u'black metal', u'melodic black metal', u'swedish black metal']"
730,A Castle So Crystal Clear,6541,35603,328000,"[u'black metal', u'melodic black metal', u'swedish black metal']"
731,So Far Beyond... (The Great Vastforest),3128,15434,211000,"[u'black metal', u'swedish']"
732,I'm an Other in the Night,6395,33740,425000,"[u'black metal', u'melodic black metal']"
733,Our Dawn of Glory,7235,41019,369000,"[u'black metal', u'melodic black metal', u'classic', u'swedish', u'melancholic', u'Legendary', u'insane guitarwork']"
734,Voodoo Queen,1658,7382,221000,"[u'metal', u'Swedish Heavy Metal']"
735,Tåget,356,1979,284000,[]
736,Embrace by the Occult,905,4148,254000,[]
737,Possessed,961,4203,226000,[]
738,Night of Mayhem,914,4459,285000,[]
739,The ritual,893,4369,75000,[]
740,Death Militia,970,5770,239000,[]
741,Thunder,991,5740,340000,[]
742,Heaven's Devils,1159,3644,212000,[]
743,Five Days in Hell,1304,4466,187000,[u'old-school heavy metal']
744,Woman at Last,1351,4684,224000,[u'rock n roll']
745,Hooked on Metal,1517,6254,268000,"[u'female fronted heavy metal', u'old school SPEED METAL']"
746,Demon,1276,4387,181000,[]
747,Anvill,899,2887,151000,"[u'heavy metal', u'metal']"
748,Hell on Wheels,1525,5726,270000,[u'Belgian Heavy Metal']
749,Ghostriders,1620,5974,176000,"[u'metal', u'thrash metal', u'Belgian Heavy Metal', u'female fronted heavy metal', u'female fronted speed metal', u'old school SPEED METAL', u'old-school heavy metal']"
750,Acid,1596,5908,240000,[]
751,Vultures,3031,11022,305000,[]
752,Low,3700,16507,259000,[]
753,Horses' Green,2814,10663,204000,[]
754,She,3540,13168,381000,[]
755,Big Beatiful,1026,4948,0,[]
756,Claws,4889,19500,331000,"[u'Stoner Rock', u'Greek', u'athens', u'New Release', u'May 2014']"
757,Below The Slumber,3918,20208,381000,"[u'heavy metal', u'thrash metal']"
758,Below The Slumber,3918,20208,381000,"[u'heavy metal', u'thrash metal']"
759,Below The Slumber,3918,20208,381000,"[u'heavy metal', u'thrash metal']"
760,One With Fire,4098,20292,172000,"[u'heavy metal', u'thrash metal', u'Swedish Metal']"
761,From Beyond,4365,23903,202000,"[u'heavy metal', u'thrash metal', u'Awesome']"
762,Undying Evil,5393,31663,233000,"[u'heavy metal', u'metal', u'thrash metal', u'Swedish Metal', u'best of 2015', u'NWOTHM']"
763,Destroyer,5512,27042,221000,"[u'heavy metal', u'speed metal', u'thrash metal', u'2015']"
764,Take Me to Hell,6334,32347,216000,"[u'heavy metal', u'hard rock', u'metal', u'speed metal', u'thrash metal', u'old school', u'old school heavy metal']"
765,Walk With Me,6823,39549,359000,"[u'heavy metal', u'speed metal', u'metal', u'hard rock', u'fire walk with me', u'Swedish Metal', u'fenriz', u'VICE Records', u'Swedish Heavy Metal', u'Heavy Speed Metal', u'trapped under vice', u'swedish speed metal', u'a fist in the face of god', u'vice magazine', u'dj vkom', u'mmpps', u'fenriz band of the week', u'enforcer', u'new wave of heavy metal', u'cherrysthorne']"
766,Nightmares,6642,38102,273000,"[u'heavy metal', u'swedish', u'hard rock', u'speed metal', u'thrash metal', u'falsetto', u'enforcer']"
767,Live for the Night,7103,38279,156000,"[u'heavy metal', u'speed metal', u'hard rock', u'thrash metal']"
768,Diamonds (Instrumental),2743,11072,213000,[]
769,High Roller,7539,46225,201000,"[u'heavy metal', u'metal', u'hard rock', u'thrash metal', u'cherrysthorne']"
770,Running in Menace,7878,50552,225000,"[u'heavy metal', u'swedish', u'hard rock', u'NWOTHM', u'gargulec', u'tokyocore']"
771,Katana,9711,61750,382000,"[u'heavy metal', u'NWOTHM', u'metal', u'hard rock', u'epic', u'thrash metal', u'epic metal', u'Traditional Metal', u'killer solo', u'gargulec', u'optime']"
772,Roll the Dice,8597,49137,227000,"[u'heavy metal', u'hard rock', u'thrash metal']"
773,Midnight Vice,10524,61103,198000,"[u'heavy metal', u'hard rock', u'swedish', u'new wave of traditional heavy metal', u'speed metal', u'metal']"
774,Defective Decay,15498,64282,243000,"[u'death metal', u'Swedish Death Metal', u'old school death metal', u'metal', u'Dystopian Prophecies', u'aggressive depression', u'massive assault', u'best metalband', u'metalband', u'Metalbands', u'World Destruction', u'Melodic Death Metal', u'thrash', u'8 of 10 stars', u'Swedish Metal', u'old school death', u'end all the pain', u'the rival believer', u'Dismember', u'swedish death', u'Mendigao thrash', u'best death metal', u'grindcore - thrash - death metal', u'Havrda', u'forever war', u'swallow my venom']"
775,Deathevocation,13853,54502,287000,"[u'death metal', u'old school death metal', u'Swedish Death Metal', u'metal', u'Dystopian Prophecies', u'massive assault', u'best metalband', u'metalband', u'Metalbands', u'World Destruction', u'black metal', u'Progressive metal', u'8 of 10 stars', u'sludge metal', u'Swedish Metal', u'symphonic death metal', u'aggressive depression', u'end all the pain', u'the rival believer', u'swedish death', u'Old School Swedish Death Metal', u'note this favourite', u'Dismember - Deathevocation', u'forever war', u'swallow my venom', u'you failed']"
776,In Death's Sleep,22528,86365,321000,"[u'death metal', u'old school death metal', u'Swedish Death Metal', u'metal', u'Melodic Death Metal', u'swedish', u'Swedish Metal', u'Dystopian Prophecies', u'aggressive depression', u'massive assault', u'best metalband', u'metalband', u'Metalbands', u'World Destruction', u'Sweden', u'9 of 10 stars', u'kick ass', u'end all the pain', u'the rival believer', u'Dismember', u'swedish death', u'death metall', u'Mendigao thrash', u'merol', u'swedish death metall', u'bestmetal', u'In Deaths Sleep', u'forever war', u'you failed']"
777,Sickening Art,25457,98139,235000,"[u'death metal', u'Swedish Death Metal', u'old school death metal', u'metal', u'Sweden', u'FUCKING AWESOME', u'Swedish Metal', u'Sickening Art', u'heavy metal', u'9 of 10 stars', u'Brutal Death Metal', u'kick ass', u'deathmetal', u'Come with me', u'Dystopian Prophecies', u'aggressive depression', u'end all the pain', u'massive assault', u'Dismember', u'swedish death', u'best metalband', u'metalband', u'Metalbands', u'best death metal', u'World Destruction', u'bestmetal', u'grind do costinha']"
