,Songs,Listeners,Playcount,Duration,Tags
756,Duality,566865,5330157,252000,"[u'metal', u'Nu Metal', u'Slipknot', u'alternative metal', u'rock', u'heavy metal', u'hard rock', u'Nu-metal', u'alternative', u'metalcore', u'Duality', u'death metal', u'hardcore', u'thrash metal', u'aggressive', u'american', u'00s', u'songs to play extra loud', u'alternative rock', u'favorites', u'Awesome', u'Favorite', u'corey taylor', u'Vol 3 The Subliminal Verses', u'best slipknot song', u'2004', u'angry', u'iowa', u'Favourite Songs', u'maggot music', u'radioultra', u'Slipknot - Duality', u'seen live', u'heavy', u'thrash', u'love at first listen', u'trash metal', u'groove metal', u'All time favourites', u'pissed off', u'rock band dlc', u'so fucking good', u'Rarrrrrr', u'Fuck You All', u'slipknot-duality', u'wraugh']"
757,Duality,566865,5330157,252000,"[u'metal', u'Nu Metal', u'Slipknot', u'alternative metal', u'rock', u'heavy metal', u'hard rock', u'Nu-metal', u'alternative', u'metalcore', u'Duality', u'death metal', u'hardcore', u'thrash metal', u'aggressive', u'american', u'00s', u'songs to play extra loud', u'alternative rock', u'favorites', u'Awesome', u'Favorite', u'corey taylor', u'Vol 3 The Subliminal Verses', u'best slipknot song', u'2004', u'angry', u'iowa', u'Favourite Songs', u'maggot music', u'radioultra', u'Slipknot - Duality', u'seen live', u'heavy', u'thrash', u'love at first listen', u'trash metal', u'groove metal', u'All time favourites', u'pissed off', u'rock band dlc', u'so fucking good', u'Rarrrrrr', u'Fuck You All', u'slipknot-duality', u'wraugh']"
758,"Atlas, Rise!",73543,305554,388000,"[u'heavy metal', u'thrash metal', u'metal', u'metallica', u'Progressive metal', u'hard rock', u'Contemporary', u'Favorite', u'NWOBHM', u'8', u'2016', u'Guitar Solo', u'bay area thrash metal', u'new album', u'Hardwired\u2026To Self-Destruct', u'hardwired to self destruct', u'atlas rise']"
759,Hardwired,94200,445348,189000,"[u'metal', u'thrash metal', u'heavy metal', u'speed metal', u'metallica', u'trash metal', u'2016', u'thrash', u'bay area thrash metal', u'rock', u'fast', u'hard rock', u'epic', u'Contemporary', u'american', u'California', u'4', u'Favorite', u'10s', u'2010s', u'Guitar Solo', u'american metal', u'hard core', u'Trash-Metal', u'new album', u'Trashmetal', u'2010s Metal', u'trash metall', u'2016', u'Hardwired To Self-Destruct', u'trash-metall', u'trashmetall', u'hardwired to self-destruct!', u'blowing my fucking face to smitherines', u'hardwired', u'hardwired to self destruct']"
760,just,214,1170,380000,[]
761,The Duke,11222,33920,271000,[u'metal']
762,You Know I'm No Good (Amy Winehouse),20382,142280,0,"[u'cover', u'indie', u'british', u'covers', u'indie rock', u'sexy', u'beautiful', u'Amy Winehouse', u'uk indie', u'damned good', u're', u'holy mother of badassery', u'rock', u'romantic', u'7 of 10 stars', u'Favorite songs ever', u'good mood', u'better than original', u'downers', u'the best covers']"
763,Under Black Flags We March,39644,223584,280000,"[u'Melodic Death Metal', u'death metal', u'Female fronted metal', u'metal', u'heavy metal', u'speed metal', u'Power metal', u'Extreme Power Metal', u'Megadeth', u'swedish', u'7 of 10 stars', u'Testament', u'melodic metalcore', u'exodus', u'white power', u'Arch Enemy', u'kkk', u'White Pride', u'718 Love', u'haohmaru', u'jeff young']"
764,Handbrake (radio edit),187,435,0,"[u'uutta jazzia', u'acid lounge', u'lounge groove', u'smooth lounge', u'serve chilled', u'jazzy flavoured', u'downtempo influences', u'city lounge', u'best of chill', u'Best Of Down Tempo', u'Best Of Downtempo', u'my-love', u'downtempo lounge', u'acoustic groove', u'Chillout Downtempo', u'electrocool', u'lounge downtempo', u'jazz-trip', u'alternative lounge', u'genre: downtempo', u'lounge chill', u'lounge-tech', u'Smoothly Sexy Sounding', u'groove lounge', u'electronic lounge jazz', u'lounge electronic', u'Lounge uptempo', u'my lounge room', u'sweet downtempo', u'electropcool', u'Ouahhhhh', u'tropcool', u'lounge vibe', u'chillounge1', u'chill chill', u'Jazzy vibes', u'lounge at home tres', u'chillair', u'1st Vine', u'awesome downtempo', u'epic lounge', u'genre:downtempo', u'served chilled', u'sexy sounding', u'1st vine acid', u'acid jazz vibe', u'chilllounge1', u'nu jazz vibe', u'nu-jazz vibe', u'nujazz vibe']"
765,In Sickness And Death,6142,19275,300000,"[u'metal', u'death metal', u'progressive death metal', u'Pestilence']"
766,Gojira,9,153,0,[]
767,Gojira,5,18,0,[]
768,Gojira,5,18,0,[]
769,Under Black Flags We March,39644,223584,280000,"[u'Melodic Death Metal', u'death metal', u'Female fronted metal', u'metal', u'heavy metal', u'speed metal', u'Power metal', u'Extreme Power Metal', u'Megadeth', u'swedish', u'7 of 10 stars', u'Testament', u'melodic metalcore', u'exodus', u'white power', u'Arch Enemy', u'kkk', u'White Pride', u'718 Love', u'haohmaru', u'jeff young']"
770,Killing in the Name,1136815,7353531,314000,"[u'rock', u'alternative rock', u'metal', u'political', u'alternative', u'rapcore', u'hard rock', u'Rage Against The Machine', u'90s', u'crossover', u'rap metal', u'alternative metal', u'funk metal', u'ratm', u'angry', u'rage', u'Guitar Hero', u'heavy', u'funk', u'fuck you i wont do what you tell me', u'heavy metal', u'Nu Metal', u'favorites', u'Awesome', u'punk', u'hardcore', u'1992', u'killing in the name', u'christmas', u'rap rock', u'seen live', u'rap', u'american', u'classic', u'epic', u'punk rock', u'Funk Rock', u'Nu-metal', u'Guitar Hero 2', u'tom morello', u'Hip-Hop', u'hip hop', u'Favourite Songs', u'political rock', u'power', u'Grunge', u'Fusion', u'guitar', u'aggressive', u'indie']"
771,Ghetto Woman (prod. Léo Grijó & DJ Soares),6,94,0,[]
772,In Sickness And Death,6142,19275,300000,"[u'metal', u'death metal', u'progressive death metal', u'Pestilence']"
773,Laid to Rest,341322,2441743,230000,"[u'metal', u'metalcore', u'thrash metal', u'groove metal', u'death metal', u'lamb of god', u'heavy metal', u'Guitar Hero', u'hardcore', u'Progressive metal', u'Melodic Death Metal', u'american', u'new wave of american heavy metal', u'Pure American Metal', u'laid to rest', u'seen live', u'Awesome', u'NWOAHM', u'Guitar Hero 2', u'rock', u'aggressive', u'american metal', u'black metal', u'grindcore', u'hard rock', u'thrash', u'Post Thrash', u'Makes me want to kill things', u'Nu Metal', u'trash metal', u'favorites', u'Guitar Hero II', u'heavy', u'Favorite', u'deathcore', u'rock band dlc', u'Modern thrash metal', u'thrash groove metalcore', u'Lamb of God - Laid to Rest', u'Hard', u'epic', u'00s', u'FUCKING EPIC', u'kicks mallcore kiddies around like little kids', u'destructive', u'great drums', u'badmotherfuckingass', u'brutal', u'Love', u'2004']"
774,Laid to Rest,341322,2441743,230000,"[u'metal', u'metalcore', u'thrash metal', u'groove metal', u'death metal', u'lamb of god', u'heavy metal', u'Guitar Hero', u'hardcore', u'Progressive metal', u'Melodic Death Metal', u'american', u'new wave of american heavy metal', u'Pure American Metal', u'laid to rest', u'seen live', u'Awesome', u'NWOAHM', u'Guitar Hero 2', u'rock', u'aggressive', u'american metal', u'black metal', u'grindcore', u'hard rock', u'thrash', u'Post Thrash', u'Makes me want to kill things', u'Nu Metal', u'trash metal', u'favorites', u'Guitar Hero II', u'heavy', u'Favorite', u'deathcore', u'rock band dlc', u'Modern thrash metal', u'thrash groove metalcore', u'Lamb of God - Laid to Rest', u'Hard', u'epic', u'00s', u'FUCKING EPIC', u'kicks mallcore kiddies around like little kids', u'destructive', u'great drums', u'badmotherfuckingass', u'brutal', u'Love', u'2004']"
775,Dead Memories,347622,3014105,299000,"[u'Nu Metal', u'metal', u'Slipknot', u'alternative metal', u'rock', u'heavy metal', u'Nu-metal', u'dead memories', u'hard rock', u'alternative', u'corey taylor', u'all hope is gone', u'thrash metal', u'metalcore', u'Awesome', u'favorites', u'hardrock', u'2008', u'death metal', u'FUCKING AWESOME', u'System of a Down', u'Stone Sour', u'hardcore', u'post-hardcore', u'alternative rock', u'memories', u'american', u'iowa', u'metallica', u'00s', u'american metal', u'hell of a song', u'psyco metal', u'The Best Bands', u'slipknot-dead memories', u'seen live', u'Love it', u'songs that rip out my fucking heart', u'nu-mtal', u'slip not', u'Love', u'angry', u'1', u'8 of 10 stars', u'2000s', u'Favourite Songs', u'Dark metal', u'new metal', u'awesome voice', u'2000s rock']"
776,Shake It Out,683876,6798473,276000,"[u'indie', u'female vocalists', u'indie pop', u'alternative', u'love at first listen', u'british', u'amazing', u'makes me feel bigger than i am', u'Florence and The Machine', u'pop', u'epic', u'best of 2011', u'FUCKING AWESOME', u'intense', u'positive', u'if you fall in love with me you should know these songs by heart', u'Ceremonials', u'indie rock', u'baroque pop', u'2011', u'magic', u'shake it out', u'art rock', u'female vocalist', u'addictive', u'florence', u'rock', u'soul', u'beautiful', u'atmospheric', u'10s', u'anthem', u'magical', u'if my soul were composed of musical notes', u'oh its a lady', u'music I wanna hug but can not hug because it is music and you can not hug sounds', u'songs I can actually listen to on repeat', u'killer voice', u'drunken anthem', u'loud', u'inspirational', u'i fucking love this song', u'<3', u'fucking great', u'how i met your mother', u'Makes Me Smile', u'my party is better than yours', u'perfect drug', u'songs that exceed the ceiling', u'city walking']"
777,Flying Whales,85184,686670,353000,"[u'progressive death metal', u'whalecore', u'Progressive metal', u'death metal', u'metal', u'french', u'epic', u'flying whalecore', u'songs about whales', u'epic ocean metal', u'atmospheric', u'Masterpiece', u'genious riffs', u'heavy', u'Progressive', u'I love this song', u'Favourite Songs', u'best songs ever', u'french metal', u'bad ass', u'only metal gods like these people can make this', u'progressive groove metal', u'technical death thrash metal', u'fuckin brutal', u'whale vocalist', u'bizarre feeling', u'there is not only whales who are flying while this song is playing', u'awesome guitar themes', u'genious themes', u'sound of pain', u'heavy metal', u'metalcore', u'jazz', u'chill', u'rock', u'instrumental', u'hard rock', u'Progressive rock', u'strange', u'beautiful', u'Awesome', u'psychedelic', u'groove', u'death', u'thrash metal', u'Radio', u'cosmic', u'thrash', u'alternative metal', u'catharsis']"
778,The Sharpest Lives,377959,3116751,200000,"[u'rock', u'alternative rock', u'emo', u'alternative', u'my chemical romance', u'punk rock', u'punk', u'pop punk', u'mcr', u'seen live', u'Love', u'Awesome', u'favorites', u'american', u'screamo', u'Favourites', u'emocore', u'the black parade', u'indie', u'post-hardcore', u'FUCKING AWESOME', u'emo punk', u'hard rock', u'great lyrics', u'Pop-punk', u'twilight', u'hardcore', u'pop rock', u'epic', u'dark', u'Energetic', u'cool', u'male vocalists', u'new jersey', u'The Sharpest Lives', u'pop', u'Favorite Bands', u'catchy', u'death metal', u'favourite', u'male vocalist', u'00s', u'Good Stuff', u'Emo rock', u'vampires', u'My reason to breathe', u'my chem', u'favorite songs', u'goth', u'indie rock']"
779,The Sharpest Lives,377959,3116751,200000,"[u'rock', u'alternative rock', u'emo', u'alternative', u'my chemical romance', u'punk rock', u'punk', u'pop punk', u'mcr', u'seen live', u'Love', u'Awesome', u'favorites', u'american', u'screamo', u'Favourites', u'emocore', u'the black parade', u'indie', u'post-hardcore', u'FUCKING AWESOME', u'emo punk', u'hard rock', u'great lyrics', u'Pop-punk', u'twilight', u'hardcore', u'pop rock', u'epic', u'dark', u'Energetic', u'cool', u'male vocalists', u'new jersey', u'The Sharpest Lives', u'pop', u'Favorite Bands', u'catchy', u'death metal', u'favourite', u'male vocalist', u'00s', u'Good Stuff', u'Emo rock', u'vampires', u'My reason to breathe', u'my chem', u'favorite songs', u'goth', u'indie rock']"
780,The Gift of Guilt,59854,427516,357000,"[u'progressive death metal', u'Progressive metal', u'groove metal', u'death metal', u'metal', u'Technical Death Metal', u'math metal', u'french', u'seen live', u'Melodic Death Metal', u'thrash metal', u'Progressive', u'male vocalist', u'i fucking love this song', u'9 of 10 stars', u'2012', u'I love this song', u'10s', u'2010s', u'english lyrics', u'10 of 10 stars', u'gift', u'guilt', u'Technical Metal', u'awesome riffs', u'I could listen to this song forever', u'Gojira', u'Awesome Drums', u'Earthcore', u'718 Love', u'l-enfant sauvage', u'death-groove metal', u'one of the best songs on the new album', u'addictin', u'simple riff makes this shit one of the best song i have ever heard', u'k1r7m']"
781,The Gift of Guilt,59854,427516,357000,"[u'progressive death metal', u'Progressive metal', u'groove metal', u'death metal', u'metal', u'Technical Death Metal', u'math metal', u'french', u'seen live', u'Melodic Death Metal', u'thrash metal', u'Progressive', u'male vocalist', u'i fucking love this song', u'9 of 10 stars', u'2012', u'I love this song', u'10s', u'2010s', u'english lyrics', u'10 of 10 stars', u'gift', u'guilt', u'Technical Metal', u'awesome riffs', u'I could listen to this song forever', u'Gojira', u'Awesome Drums', u'Earthcore', u'718 Love', u'l-enfant sauvage', u'death-groove metal', u'one of the best songs on the new album', u'addictin', u'simple riff makes this shit one of the best song i have ever heard', u'k1r7m']"
782,Gojira,5,18,0,[]
783,Im a Boss Ass Bitch,14,123,0,[]
784,Kill All Your Friends,40631,439195,268000,"[u'rock', u'alternative', u'alternative rock', u'mcr', u'b-side', u'emo', u'favorites', u'my chemical romance', u'punk', u'punk rock', u'not emo', u'funny', u'favorite songs', u'Love', u'makes me happy', u'seen live', u'Favorite Bands', u'Gothic', u'2006', u'Gerard Way', u'<3', u'Kill All Your Friends', u'I want played at my funeral', u'metalcore', u'chill', u'2009', u'USA', u'dance', u'pop rock', u'epic', u'Awesome', u'american', u'pop punk', u'melancholic', u'fun', u'cool', u'00s', u'Gothic Rock', u'Favourites', u'bubblegum', u'funeral', u'FUCKING AWESOME', u'2000s', u'favorite song', u'title is a full sentence', u'favorite tracks', u'heavenly voices', u'anthem', u'fucking amazing', u'new jersey']"
785,In My Darkest Hour,186092,1241087,376000,"[u'thrash metal', u'metal', u'heavy metal', u'Megadeth', u'speed metal', u'thrash', u'rock', u'80s', u'Dave Mustaine', u'Awesome', u'classic metal', u'hard rock', u'seen live', u'Cliff Burton', u'Favorite Songs from All Time', u'Masterpiece', u'heavy', u'1988', u'FUCKING AWESOME', u'trash metal', u'Morose Deep dilate Crimson', u'jeff young', u'wraugh', u'In my hour of need', u'epic', u'american', u'excellent', u'Awesome Guitar Jams', u'All time favourites', u'80s metal', u'psycho metal', u'my favorite band', u'general awesomeness', u'metal top', u'haohmaru', u'PsychoMetal4Life', u'classic', u'guitar', u'death', u'cool', u'best song ever', u'underground', u'2012', u'Bay Area', u'rockin', u'american metal', u'bay area thrash metal', u'classic rock - metal', u'Nakoruru', u'deja vu']"
786,Override,28545,139514,337000,"[u'Nu Metal', u'metal', u'2014', u'Slipknot', u'5 - the gray chapter', u'heavy metal', u'alternative', u'english', u'2010s']"
787,Killing in the Name,1136815,7353531,314000,"[u'rock', u'alternative rock', u'metal', u'political', u'alternative', u'rapcore', u'hard rock', u'Rage Against The Machine', u'90s', u'crossover', u'rap metal', u'alternative metal', u'funk metal', u'ratm', u'angry', u'rage', u'Guitar Hero', u'heavy', u'funk', u'fuck you i wont do what you tell me', u'heavy metal', u'Nu Metal', u'favorites', u'Awesome', u'punk', u'hardcore', u'1992', u'killing in the name', u'christmas', u'rap rock', u'seen live', u'rap', u'american', u'classic', u'epic', u'punk rock', u'Funk Rock', u'Nu-metal', u'Guitar Hero 2', u'tom morello', u'Hip-Hop', u'hip hop', u'Favourite Songs', u'political rock', u'power', u'Grunge', u'Fusion', u'guitar', u'aggressive', u'indie']"
788,Laid to Rest,341322,2441743,230000,"[u'metal', u'metalcore', u'thrash metal', u'groove metal', u'death metal', u'lamb of god', u'heavy metal', u'Guitar Hero', u'hardcore', u'Progressive metal', u'Melodic Death Metal', u'american', u'new wave of american heavy metal', u'Pure American Metal', u'laid to rest', u'seen live', u'Awesome', u'NWOAHM', u'Guitar Hero 2', u'rock', u'aggressive', u'american metal', u'black metal', u'grindcore', u'hard rock', u'thrash', u'Post Thrash', u'Makes me want to kill things', u'Nu Metal', u'trash metal', u'favorites', u'Guitar Hero II', u'heavy', u'Favorite', u'deathcore', u'rock band dlc', u'Modern thrash metal', u'thrash groove metalcore', u'Lamb of God - Laid to Rest', u'Hard', u'epic', u'00s', u'FUCKING EPIC', u'kicks mallcore kiddies around like little kids', u'destructive', u'great drums', u'badmotherfuckingass', u'brutal', u'Love', u'2004']"
789,Nemesis,210649,1734860,305000,"[u'Melodic Death Metal', u'death metal', u'metal', u'Female fronted metal', u'swedish', u'Arch Enemy', u'thrash metal', u'heavy metal', u'female vocalists', u'Swedish Metal', u'metalcore', u'Awesome', u'Power metal', u'melodic death', u'melodic metal', u'FUCKING AWESOME', u'gothenburg metal', u'Swedish Death Metal', u'Gothic Metal', u'Brutal Death Metal', u'black metal', u'seen live', u'female vocalist', u'brilliant', u'fuck yeah', u'nemesis', u'brutal', u'melodic', u'speed metal', u'favourite', u'Sweden', u'Megadeth', u'Death Metal/Black Metal', u'best vocalist', u'death by speed', u'metal woman fronted', u'718 Love']"
790,Yesterday Is Dead And Gone,51083,302379,261000,"[u'Melodic Death Metal', u'metal', u'death metal', u'Female fronted metal', u'metalcore', u'5 of 10 stars', u'awesome riff', u'best femal metal singer ever', u'heavy metal', u'3', u'thrash metal', u'female vocalist', u'melodic metal', u'2012', u'Megadeth', u'melodeath', u'Dance whenever you feel like it', u'ffm', u'white power', u'malloy2000 playlist - top songs - classical to metal', u'White Pride', u'melodeath metal', u'Female metal vocalist', u'metal top', u'kurwa epiczna', u'jeff young', u'actfav', u'2012mytest']"
791,Disposable Teens,312675,1807488,184000,"[u'industrial metal', u'metal', u'industrial', u'rock', u'marilyn manson', u'alternative', u'alternative metal', u'alternative rock', u'hard rock', u'Gothic', u'industrial rock', u'Shock Rock', u'american', u'manson', u'seen live', u'Gothic Metal', u'disposable teens', u'heavy metal', u'favorite songs', u'favorites', u'90s', u'political', u'Nu Metal', u'Hard', u'favourite', u'USA', u'Awesome', u'loved', u'cool', u'00s', u'rock band', u'Favourites', u'MM', u'2000', u'hardrock', u'rock band dlc', u'New World Disorder', u'radioultra', u'rocck', u'good kids go to hell', u'Soundtrack', u'electronic', u'indie', u'classic', u'80s', u'goth', u'brutal', u'emo', u'Progressive metal', u'indie rock']"
792,Duality,566865,5330157,252000,"[u'metal', u'Nu Metal', u'Slipknot', u'alternative metal', u'rock', u'heavy metal', u'hard rock', u'Nu-metal', u'alternative', u'metalcore', u'Duality', u'death metal', u'hardcore', u'thrash metal', u'aggressive', u'american', u'00s', u'songs to play extra loud', u'alternative rock', u'favorites', u'Awesome', u'Favorite', u'corey taylor', u'Vol 3 The Subliminal Verses', u'best slipknot song', u'2004', u'angry', u'iowa', u'Favourite Songs', u'maggot music', u'radioultra', u'Slipknot - Duality', u'seen live', u'heavy', u'thrash', u'love at first listen', u'trash metal', u'groove metal', u'All time favourites', u'pissed off', u'rock band dlc', u'so fucking good', u'Rarrrrrr', u'Fuck You All', u'slipknot-duality', u'wraugh']"
793,We Will Rise,163994,1144798,246000,"[u'Melodic Death Metal', u'death metal', u'metal', u'Female fronted metal', u'thrash metal', u'Arch Enemy', u'female vocalists', u'swedish', u'Swedish Metal', u'seen live', u'heavy metal', u'melodic death', u'black metal', u'melodic metal', u'gothenburg metal', u'metalcore', u'still kill the old way', u'00s', u'Swedish Death Metal', u'extremely awesome', u'We Will Rise', u'music orgasm', u'death', u'thrash', u'female vocals', u'songs that if covered properly could be excellent', u'epic', u'amazing', u'aggressive', u'female vocalist', u'female fronted', u'melodeath', u'aggressive depression', u'massive assault', u'Swedish Melodic Death Metal', u'Neuroshima', u'Full of Emotion', u'amazing experience', u'hard rock', u'favorites', u'Awesome', u'speed metal', u'Favourites', u'love at first listen', u'Sweden', u'best songs ever', u'scandinavian metal', u'Megadeth', u'end all the pain', u'the rival believer']"
794,You Will Know My Name,59,251,0,[]
795,Desolation Row,86352,645220,179000,"[u'cover', u'Soundtrack', u'rock', u'alternative rock', u'Watchmen', u'punk rock', u'covers', u'punk', u'alternative', u'emo', u'my chemical romance', u'puta de mierda ojala y te mueras con un pinche dildo electrico atorado en tu ronosa pucha', u'2009', u'Bob Dylan cover', u'Bob Dylan', u'shemale vocalists', u'hard rock', u'favorites', u'american', u'gay', u'cover songs', u'FUCKING AWESOME', u'Officially Shit', u'movie', u'not emo', u'shitcore', u'mallcore', u'mierda', u'shemale', u'best riff ever', u'radioultra', u'homosex', u'emos de mierda', u'red shoes ecstasy', u'bob dylan revolting on his grave', u'classic rock', u'seen live', u'british', u'Hard', u'Dead', u'fast', u'pop rock', u'memories', u'catchy', u'alternative pop rock', u'Awesome', u'crazy', u'angry', u'ost', u'pop punk']"
796,Oroborus,107487,821464,321000,"[u'progressive death metal', u'Progressive metal', u'death metal', u'metal', u'groove metal', u'French Death Metal', u'brilliant riff', u'Progressive', u'Technical Death Metal', u'math metal', u'TOTAL FUCKING WIN', u'french', u'seen live', u'Awesome', u'french metal', u'Gojira', u'Energetic', u'thrash metal', u'my favourite songs', u'progressive groove metal', u'Epic Showcase of musicianship', u'Amazing riff', u'mystical metal', u'pierwsze sekundy utworu a ja juz to uwielbiam', u'beautiful', u'Incredible', u'riff', u'diablo', u'Memorable', u'dance the dream with your body on', u'CamdenSounds', u'classic rock', u'pop', u'rock', u'instrumental', u'hard rock', u'Progressive rock', u'melodic', u'Melodic Death Metal', u'groove', u'guitar', u'death', u'Radio', u'thrash', u'alternative metal', u'emotional', u'blues rock', u'stoner metal', u'Extreme Metal', u'poor']"
797,The Sharpest Lives,377959,3116751,200000,"[u'rock', u'alternative rock', u'emo', u'alternative', u'my chemical romance', u'punk rock', u'punk', u'pop punk', u'mcr', u'seen live', u'Love', u'Awesome', u'favorites', u'american', u'screamo', u'Favourites', u'emocore', u'the black parade', u'indie', u'post-hardcore', u'FUCKING AWESOME', u'emo punk', u'hard rock', u'great lyrics', u'Pop-punk', u'twilight', u'hardcore', u'pop rock', u'epic', u'dark', u'Energetic', u'cool', u'male vocalists', u'new jersey', u'The Sharpest Lives', u'pop', u'Favorite Bands', u'catchy', u'death metal', u'favourite', u'male vocalist', u'00s', u'Good Stuff', u'Emo rock', u'vampires', u'My reason to breathe', u'my chem', u'favorite songs', u'goth', u'indie rock']"
798,The Sharpest Lives,377959,3116751,200000,"[u'rock', u'alternative rock', u'emo', u'alternative', u'my chemical romance', u'punk rock', u'punk', u'pop punk', u'mcr', u'seen live', u'Love', u'Awesome', u'favorites', u'american', u'screamo', u'Favourites', u'emocore', u'the black parade', u'indie', u'post-hardcore', u'FUCKING AWESOME', u'emo punk', u'hard rock', u'great lyrics', u'Pop-punk', u'twilight', u'hardcore', u'pop rock', u'epic', u'dark', u'Energetic', u'cool', u'male vocalists', u'new jersey', u'The Sharpest Lives', u'pop', u'Favorite Bands', u'catchy', u'death metal', u'favourite', u'male vocalist', u'00s', u'Good Stuff', u'Emo rock', u'vampires', u'My reason to breathe', u'my chem', u'favorite songs', u'goth', u'indie rock']"
799,The Sharpest Lives,377959,3116751,200000,"[u'rock', u'alternative rock', u'emo', u'alternative', u'my chemical romance', u'punk rock', u'punk', u'pop punk', u'mcr', u'seen live', u'Love', u'Awesome', u'favorites', u'american', u'screamo', u'Favourites', u'emocore', u'the black parade', u'indie', u'post-hardcore', u'FUCKING AWESOME', u'emo punk', u'hard rock', u'great lyrics', u'Pop-punk', u'twilight', u'hardcore', u'pop rock', u'epic', u'dark', u'Energetic', u'cool', u'male vocalists', u'new jersey', u'The Sharpest Lives', u'pop', u'Favorite Bands', u'catchy', u'death metal', u'favourite', u'male vocalist', u'00s', u'Good Stuff', u'Emo rock', u'vampires', u'My reason to breathe', u'my chem', u'favorite songs', u'goth', u'indie rock']"
800,Raining Blood,554471,3690446,263000,"[u'thrash metal', u'metal', u'heavy metal', u'Slayer', u'thrash', u'speed metal', u'80s', u'death metal', u'trash metal', u'seen live', u'FUCKING AWESOME', u'american', u'Guitar Hero', u'rock', u'Guitar Hero 3', u'Raining Blood', u'Legendary', u'aggressive', u'reign in blood', u'In Your Fucking Face', u'hardcore', u'epic', u'classic metal', u'Kerry King', u'favorites', u'1986', u'hard rock', u'angry', u'Extreme Metal', u'brutal thrash metal', u'Jeff Hannemann', u'slayer kurwa', u'favorite songs', u'brutal', u'Awesome', u'rain', u'Killing Riff', u'v-rock', u'best of slayer', u'Tom ARAYA', u'black metal', u'metalcore', u'classic', u'heavy', u'Extreme', u'Play this loud enough to raise the dead', u'dave lombardo', u'All time favourites', u'Pure Fucking Metal', u'classic riff']"
