,Songs,Listeners,Playcount,Duration,Tags
840,Pentagram,33015,148887,212000,"[u'death metal', u'thrash metal', u'old school death metal', u'metal', u'80s', u'thrash', u'Megadeth', u'Possessed', u'USA', u'satanic', u'old school thrash metal', u'deathrash', u'KILL', u'718 Metal', u'heavy metal', u'rock', u'heavy', u'brutal', u'solo', u'speed metal', u'death', u'american', u'old school', u'san francisco', u'Extreme Metal', u'occult', u'anti-christian', u'Ritual', u'fuck yeah', u'1980s', u'Old-School', u'Brutal Death Metal', u'us', u'cryptic', u'hell', u'murder', u'speed', u'Destruction', u'Killing', u'satan', u'legend', u'Legendary', u'mtv', u'classic metal', u'true metal', u'80s metal', u'Extreme', u'death-thrash metal', u'american metal', u'american death metal']"
841,The Exorcist,32935,171284,290000,"[u'death metal', u'thrash metal', u'old school death metal', u'metal', u'Masterpiece', u'speed metal', u'thrash', u'Megadeth', u'80s', u'death thrash metal', u'In Your Fucking Face', u'US death metal', u'heavy metal', u'USA', u'Awesome', u'death', u'satan', u'mtv', u'718 Metal', u'Death-Thrash', u'Testament', u'thrash death metal', u'exodus', u'death/thrash metal', u'Possessed', u'old school deathmetal', u'satan headbangs to this stuff', u'attacker', u'seen live', u'rock', u'heavy', u'brutal', u'solo', u'american', u'Favorite Artists', u'old school', u'satanic', u'san francisco', u'Extreme Metal', u'occult', u'anti-christian', u'Ritual', u'1980s', u'Old-School', u'Brutal Death Metal', u'us', u'hell', u'murder', u'speed', u'Destruction']"
842,Children of the Haze,1232,3419,447000,[]
843,Navigator,1478,4031,486000,[]
844,Preacher Electrick,3141,12103,531000,"[u'stoner doom', u'doom metal', u'Doom', u'stoner']"
845,Preacher Electrick,3141,12103,531000,"[u'stoner doom', u'doom metal', u'Doom', u'stoner']"
846,Preacher Electrick,3141,12103,531000,"[u'stoner doom', u'doom metal', u'Doom', u'stoner']"
847,III. Whitewater,1599,7116,0,"[u'rock', u'alternative rock', u'hard rock']"
848,III. Whitewater,1599,7116,0,"[u'rock', u'alternative rock', u'hard rock']"
849,III. Whitewater,1599,7116,0,"[u'rock', u'alternative rock', u'hard rock']"
850,III. Whitewater,1599,7116,0,"[u'rock', u'alternative rock', u'hard rock']"
851,III. Whitewater,1599,7116,0,"[u'rock', u'alternative rock', u'hard rock']"
852,III. Whitewater,1599,7116,0,"[u'rock', u'alternative rock', u'hard rock']"
853,III. N.O.,1679,7121,0,[]
854,III. Conan Troutman,1722,7641,0,[]
855,III. Odyssey,1757,8465,0,[]
856,III. Odyssey,1757,8465,0,[]
857,II. Demon Cleaner,1894,10568,0,[u'tracks that make me want to shake my booty']
858,II. Space Cadet,1852,9543,0,[]
859,II. 100 Degrees,1914,9471,0,[]
860,I. Supa Scoopa and Mighty Scoop,2023,11193,0,[]
861,I. Asteroid,2021,10089,0,[]
862,Gardenia,121471,766519,353000,"[u'Stoner Rock', u'desert rock', u'stoner', u'rock', u'90s', u'stoner metal', u'Kyuss', u'psychedelic', u'hard rock', u'favorites', u'heavy metal', u'Psychedelic Rock', u'sexy', u'american', u'what god has on his i-pod', u'metal', u'Grunge', u'alternative rock', u'Awesome', u'Josh Homme', u'great riffs', u'welcome to sky valley', u'alternative', u'epic', u'alternative metal', u'sex', u'cool', u'neo psychedelia', u'riff', u'John Garcia', u'tasty jam', u'experimental', u'Progressive rock', u'groove', u'guitar', u'bass', u'Dreamy', u'Doom', u'Sludge', u'deep', u'old school', u'garage', u'trippy', u'euphoria', u'fav', u'popular', u'Desert', u'play', u'8 of 10 stars', u'great songs']"
863,Sweet Danger,14115,61477,184000,"[u'heavy metal', u'NWOBHM', u'metal', u'80s', u'british', u'hard rock', u'speed metal', u'80s Heavy Metal', u'1980s', u'New Wave of British Heavy Metal', u'Megadeth', u'Testament', u'exodus', u'kkk', u'80s british heavy metal', u'haohmaru', u'mmpps', u'bronze records', u'fenriz band of the week', u'lucafoxmetal']"
864,Gorgon,18263,74730,244000,"[u'heavy metal', u'NWOBHM', u'metal', u'speed metal', u'Power metal', u'80s', u'New Wave of British Heavy Metal', u'albums I own', u'Awesome', u'rock n roll', u'80s Heavy Metal', u'mtv', u'fucking incredible', u'british heavy metal', u'Megadeth', u'Testament', u'exodus', u'total ownage', u'Great Britain', u'dat solo', u'fudido', u'80s british heavy metal', u'bronze records', u'fenriz band of the week', u'attacker']"
865,Sorceress,13715,62694,330000,"[u'heavy metal', u'NWOBHM', u'metal', u'hot', u'80s Heavy Metal', u'Megadeth', u'Nakoruru', u'80s british heavy metal', u'haohmaru', u'mmpps', u'bronze records', u'fenriz band of the week', u'jubei yagyu']"
866,Confused,14421,63840,171000,"[u'heavy metal', u'NWOBHM', u'metal', u'80s', u'albums I own', u'80s Heavy Metal', u'Great Britain', u'80s british heavy metal', u'bronze records', u'fenriz band of the week']"
867,White Witch,21162,92191,286000,"[u'heavy metal', u'NWOBHM', u'New Wave of British Heavy Metal', u'metal', u'hard rock', u'angel witch', u'rock', u'80s', u'classic british heavy metal', u'80s british heavy metal', u'classic rock', u'british', u'80s Heavy Metal', u'British Metal', u'speed metal', u'hot', u'Classic British Hard Rock', u'classic hard rock', u'british rock', u'classic metal', u'Old School Metal', u'british heavy metal', u'Motorhead', u'Megadeth', u'Old-School Metal', u'old school heavy metal', u'classic heavy metal', u'80s hard rock', u'british hard rock', u'Nakoruru', u'classic British rock', u'Venom', u'Diamond Head', u'80s british rock', u'80s british hard rock', u'Classic British Metal', u'Girlschool', u'haohmaru', u'mmpps', u'bronze records', u'fenriz band of the week', u'jubei yagyu']"
868,Sunstorm,20995,114632,175000,"[u'folk', u'indie', u'singer-songwriter', u'acoustic', u'indie folk', u'alternative', u'experimental', u'female vocalists', u'Lo-Fi', u'haunting', u'ethereal', u'psychedelic folk', u'voices', u'quietly disturbing', u'Those Songs', u'lifelines']"
869,Hyper Oz,21036,105398,153000,"[u'folk', u'indie', u'singer-songwriter', u'acoustic', u'indie folk', u'alternative', u'experimental', u'female vocalists', u'haunting', u'ethereal', u'psychedelic folk', u'voices', u'quietly disturbing', u'nezemaljski lijepo']"
870,Our Work Was Good,22317,116622,113000,"[u'folk', u'singer-songwriter', u'acoustic', u'indie folk', u'indie', u'experimental', u'female vocalists', u'haunting', u'melancholy', u'folk rock', u'psychedelic folk', u'voices', u'quietly disturbing', u'goth music for pussies', u'post-pretentious']"
871,Appalachia,25682,140483,188000,"[u'folk', u'acoustic', u'experimental', u'indie folk', u'indie', u'alternative', u'singer-songwriter', u'Dreamy', u'ethereal', u'psychedelic folk', u'quietly disturbing', u'shoegazefan', u'violence only against the vile or violent soul against the vibe']"
872,Spinning Centers,25515,141302,189000,"[u'folk', u'ethereal', u'psychedelic', u'indie folk', u'indie', u'singer-songwriter', u'acoustic', u'Dreamy', u'psychedelic folk', u'voices', u'psy ambient', u'quietly disturbing', u'dreamlove']"
873,Flatlands,46948,280815,240000,"[u'folk', u'acoustic', u'ethereal', u'experimental', u'female vocalists', u'Hip-Hop', u'chillout', u'indie', u'hip hop', u'pop', u'japanese', u'alternative', u'emo', u'rap', u'singer-songwriter', u'dance', u'cute', u'epic', u'dark', u'easy listening', u'new age', u'strings', u'pretentious', u'kitsch', u'JPop', u'club', u'gay', u'comedy', u'rnb', u'humour', u'indie folk', u'anime', u'guilty pleasure', u'psychedelic folk', u'corny', u'Workout', u'J-rock', u'parody', u'j-pop', u'ridiculous', u'wtf', u'Guilty Pleasures', u'love at first listen', u'Trash', u'SCHEISSE', u'cheesy', u'hilarious', u'evil', u'boring', u'overrated']"
874,Sirenum Scopuli,5860,17634,120000,[]
875,Bounce House Demons,17651,64920,200000,"[u'experimental', u'folk', u'psychedelic', u'indie', u'Lo-Fi', u'female vocalist', u'post-punk', u'Gothic', u'indie folk', u'psychedelic folk', u'neofolk', u'Gothic Rock', u'psych-folk', u'prda']"
876,Halfsleeper,22751,117836,368000,"[u'folk', u'experimental', u'ethereal', u'neofolk', u'Lo-Fi', u'haunting', u'indie', u'female vocalists', u'Gothic', u'psychedelic', u'freak folk', u'indie folk', u'female vocalist', u'psychedelic folk', u'psych-folk', u'doom folk', u'Time and moments 2011']"
877,Gene Wilder,9789,28324,185000,"[u'experimental', u'piano', u'haunting', u'noise', u'indie', u'Lo-Fi', u'atmospheric', u'ethereal', u'indie folk', u'hauntingly beautiful']"
878,Noorus,19448,78552,209000,"[u'experimental', u'alternative', u'psychedelic', u'indie', u'folk', u'female vocalists', u'Lo-Fi', u'post-punk', u'Gothic', u'haunting', u'indie folk', u'female vocalist', u'Gothic Rock', u'psych-folk', u'shoegazefan']"
879,The Whys,18820,71625,234000,"[u'experimental', u'Lo-Fi', u'noise', u'indie', u'folk', u'Gothic', u'psychedelic', u'haunting', u'Avant-Garde', u'indie folk', u'female vocalist', u'psychedelic folk', u'psych-folk', u'zef', u'Jabba', u'pocahontas', u'omelet']"
880,Benjamin,21132,88845,260000,"[u'experimental', u'indie', u'folk', u'piano', u'psychedelic', u'noise', u'female vocalists', u'Lo-Fi', u'Gothic', u'ethereal', u'indie folk', u'female vocalist', u'dark ambient', u'neofolk', u'psych-folk', u'lubimyi pop', u'me mata deus', u'mano puta que pariu eu amo essa musica']"
881,Fang,21852,93184,132000,"[u'experimental', u'indie', u'folk', u'psychedelic', u'Gothic', u'ethereal', u'female vocalist', u'alternative', u'sad', u'female vocalists', u'indie folk', u'depression', u'psych-folk', u'depressive', u'sad sad sad']"
882,Deep Talks,21240,78060,202000,"[u'experimental', u'noise rock', u'punk', u'folk', u'psychedelic', u'noise', u'indie', u'rock', u'female vocalists', u'Lo-Fi', u'Gothic', u'haunting', u'drone', u'indie folk', u'female vocalist', u'dark ambient', u'psych-folk', u'Jabba', u'pocahontas', u'aksama bak', u'omelet']"
883,Moses,48503,340710,243000,"[u'experimental', u'dark ambient', u'ethereal', u'Gothic Rock', u'psychedelic', u'neofolk', u'Ritual', u'folk', u'female vocalists', u'Love', u'noise', u'indie', u'ambient', u'sad', u'dark', u'Lo-Fi', u'Gothic', u'atmospheric', u'drone', u'melancholic', u'trippy', u'indie folk', u'female vocalist', u'dark folk', u'depression', u'2010', u'psych-folk', u'hauntingly beautiful', u'depressive', u'Fuckin AWESOME', u'ethereal wave', u'pocahontas', u'rel-yr:2011', u'rel-mnth:2011:august', u'feels', u'chelsea wolfe', u'omelet', u'Pigeon Hymns', u'NEVER let you down now', u'lchtrton']"
884,Cousins Of The Antichrist,25022,115682,173000,"[u'dark folk', u'folk', u'ethereal', u'alternative', u'Lo-Fi', u'indie', u'female vocalists', u'Soundtrack', u'digital', u'noise', u'Disco', u'heavy metal', u'black metal', u'metalcore', u'metal', u'chillout', u'seen live', u'Classical', u'jazz', u'japanese', u'goth', u'brutal', u'grindcore', u'swedish', u'emo', u'ambient', u'experimental', u'Electroclash', u'best of 2006', u'singer-songwriter', u'electro', u'dance', u'favorites', u'happy', u'Love', u'omg', u'cute', u'epic', u'christmas', u'acoustic', u'new wave', u'easy listening', u'world', u'post-punk', u'funk metal', u'hair metal', u'soft rock', u'medieval', u'Gothic', u'new age']"
885,Advice & Vices,27494,124908,178000,"[u'experimental', u'alternative', u'folk', u'welove2011', u'indie', u'female vocalists', u'Lo-Fi', u'ethereal', u'indie folk', u'good', u'interesting', u'pendu', u'psych-folk', u'to check out']"
886,Sunstorm,20995,114632,175000,"[u'folk', u'indie', u'singer-songwriter', u'acoustic', u'indie folk', u'alternative', u'experimental', u'female vocalists', u'Lo-Fi', u'haunting', u'ethereal', u'psychedelic folk', u'voices', u'quietly disturbing', u'Those Songs', u'lifelines']"
887,Sunstorm,20995,114632,175000,"[u'folk', u'indie', u'singer-songwriter', u'acoustic', u'indie folk', u'alternative', u'experimental', u'female vocalists', u'Lo-Fi', u'haunting', u'ethereal', u'psychedelic folk', u'voices', u'quietly disturbing', u'Those Songs', u'lifelines']"
888,Sunstorm,20995,114632,175000,"[u'folk', u'indie', u'singer-songwriter', u'acoustic', u'indie folk', u'alternative', u'experimental', u'female vocalists', u'Lo-Fi', u'haunting', u'ethereal', u'psychedelic folk', u'voices', u'quietly disturbing', u'Those Songs', u'lifelines']"
889,Sunstorm,20995,114632,175000,"[u'folk', u'indie', u'singer-songwriter', u'acoustic', u'indie folk', u'alternative', u'experimental', u'female vocalists', u'Lo-Fi', u'haunting', u'ethereal', u'psychedelic folk', u'voices', u'quietly disturbing', u'Those Songs', u'lifelines']"
890,Never On Sunday,38900,115442,293000,"[u'lounge', u'Greek', u'jazz', u'female vocalists', u'pink martini', u'cover', u'world', u'chillout', u'downtempo', u'piano', u'easy listening', u'Mellow', u'spanish', u'chill', u'beautiful', u'lovely', u'never on sunday', u'vugube62', u'sebolo90', u'female', u'female vocalist', u'paris', u'beautiful voices', u'Greek Music', u'french', u'alternative', u'folk', u'favorites', u'romantic', u'latin', u'Dreamy', u'orchestral', u'late night', u'smooth', u'melancholy', u'melancholic', u'female vocals', u'loved', u'funny', u'bringing sexy back', u""90's"", u'standard', u'female vocal', u'inspiration', u'female singers', u'nostalgia', u'life', u'work', u'classics', u'dinner']"
891,Song Of The Black Lizard,44486,132990,247000,"[u'jazz', u'lounge', u'chillout', u'pink martini', u'alternative', u'world', u'Mellow', u'amayzes loved', u'chill', u'Bossa Nova', u'piano', u'relaxing', u'relax', u'chill out', u'for rainy days', u'davaho53', u'vugube62', u'soul', u'instrumental', u'sexy', u'female vocalists', u'downtempo', u'cafe del mar', u'latin', u'beautiful', u'Dreamy', u'great', u'soft', u'Rainy Day', u'female vocalist', u'mood', u'best song ever', u'sensual', u'female voice', u'Stunning', u'found through lastfm', u'tantotempotaste', u'melancholy days', u'jazz ballads', u'comfort music', u'Bands that I should listen to more', u'music for making pancakes', u'seduce me', u'Pink Martini- Chillout', u'lounge chill', u'Soundtrack', u'french', u'pop', u'japanese', u'easy listening']"
892,Andalucia,53046,164281,216000,"[u'lounge', u'jazz', u'instrumental', u'latin', u'chillout', u'easy listening', u'pink martini', u'french', u'world', u'Bossa Nova', u'smooth', u'Mellow', u'relax', u'pop', u'chill', u'alternative', u'dance', u'favorites', u'piano', u'vocal jazz', u'cello', u'nice', u'francais', u'latin lounge', u'andalucia', u'electronica', u'indie', u'Classical', u'soul', u'classic', u'ensemble', u'ambient', u'sexy', u'Cool music', u'female vocalists', u'downtempo', u'Love', u'blues', u'tango', u'House', u'beautiful', u'strings', u'quirky', u'orchestral', u'ethnic', u'soundscape', u'swing', u'90s', u'horns', u'Big Band']"
893,"Donde Estas, Yolanda?",37834,135171,202000,"[u'latin', u'jazz', u'salsa', u'lounge', u'pink martini', u'latin jazz', u'world', u'chillout', u'dance', u'happy', u'fandango', u'easy listening', u'cuba', u'latino', u'cha cha cha', u'spanish', u'upbeat', u'Energizer', u'yolanda', u'BEREP Custom', u'pop', u'Bossa Nova', u'instrumental', u'alternative', u'female vocalists', u'favorites', u'piano', u'Latin Dance', u'romantic', u'Retro', u'crazy', u'party', u'chilled', u'nice', u'Smooth Jazz', u'male vocalists', u'female vocalist', u'jazz piano', u'PDX', u'mambo', u'love song', u'SUN', u'work', u'misc', u'questions', u'group of people who are', u'vintage', u'Favourite Songs', u'Feel Good Songs', u'rumba']"
894,La Soledad,79171,274974,339000,"[u'lounge', u'jazz', u'chillout', u'latin', u'piano', u'pink martini', u'world', u'easy listening', u'spanish', u'chill', u'downtempo', u'romantic', u'tango', u'Mellow', u'Bossa Nova', u'night', u'Classical', u'instrumental', u'ambient', u'favorites', u'melodic', u'electronic', u'vocal jazz', u'90s', u'Smooth Jazz', u'late evening mood', u'la soledad', u'french', u'male vocalist', u'flowing', u'neo-tango', u'top rated tracks', u'classic relax', u'alternative', u'sexy', u'dance', u'beautiful', u'ethnic', u'cool', u'chill out', u'buddha bar', u'intricate melodic phrasing', u'minor key tonality', u'mellow rock instrumentation', u'prominent percussion', u'acoustic sonority', u'heartbreaking lyrics', u'solo strings', u'demanding instrumental part writing', u'nice nice nice']"
895,Que Sera Sera,43063,144056,250000,"[u'female vocalists', u'lounge', u'jazz', u'cover', u'waltz', u'chillout', u'pink martini', u'Soundtrack', u'Mellow', u'lovely', u'easy listening', u'world', u'melancholic', u'Dead Like Me', u'dark', u'vocal jazz', u'latin', u'haunting', u'cabaret', u'nostalgic', u'Calming', u'music box', u'work', u'beautiful voice', u'questions', u'wise', u'adorable', u'football', u'paris', u'Film Soundtrack', u'fascinating', u'doris day', u'interesting lyrics', u'Sincere', u'melancholy days', u'nip tuck', u'Carnivalesque', u'lucid', u'comfort music', u'Softies', u'indie', u'chill', u'alternative', u'sad', u'favorites', u'beautiful', u'Awesome', u'trumpet', u'mystery', u'weird']"
896,Sympathique,151897,645054,167000,"[u'french', u'jazz', u'lounge', u'female vocalists', u'chillout', u'chanson francaise', u'pink martini', u'francais', u'easy listening', u'world', u'cool', u'chill', u'Mellow', u'electronic', u'chanson', u'happy', u'pop', u'alternative', u'vocal jazz', u'90s', u'Smooth Jazz', u'ambient', u'romantic', u'female vocalist', u'latin', u'favourite', u'jazzy', u'loved tracks', u'French jazz', u'sympathique', u'USA', u'favorites', u'Love', u'catchy', u'upbeat', u'cabaret', u'nice', u'france', u'chill out', u'Favourites', u'francaise', u'Pink Martini - Sympathique', u'female', u'jazz vocal', u'downtempo', u'piano', u'blues', u'acid jazz', u'cover', u'swing']"
897,No Hay Problema,64626,203157,372000,"[u'lounge', u'jazz', u'latin', u'chillout', u'pink martini', u'easy listening', u'latin jazz', u'instrumental', u'chill', u'piano', u'world', u'chachacha', u'cha-cha', u'ambient', u'amayzes loved', u'Mellow', u'cool jazz', u'jazzy', u'latin lounge', u'sexy', u'salsa', u'tiki', u'davaho53', u'lounge party', u'electronic', u'Bossa Nova', u'alternative', u'favorites', u'90s', u'late night', u'smooth', u'brasil', u'exotica', u'san francisco', u'Favourites', u'Jazz favorites', u'collapse', u'cool baby', u'Chez Jez', u'sunny side up sunday station', u'jazzy lounge', u'conguera', u'saint tropez', u'pirate jazz', u'my lounge room', u'musica del mundo mia favoritos', u'only jazz', u'no hay problema', u'4cinema', u'jazzi electro']"
898,Tupelo,78864,298724,437000,"[u'rock', u'alternative', u'Post punk', u'alt rock', u'tupelo', u'punk', u'Awesome', u'elvis', u'rock n roll', u""80's"", u'Gothic Rock', u'rain', u'8 of 10 stars', u'spring', u'One of the best', u'rage', u'Nick Cave and the Bad Seeds', u'Impending Doom', u'seen performed live', u'AMG Pick', u'swamp punk']"
899,City of Refuge,48367,173912,288000,"[u'alt rock', u'post-punk', u'Nick Cave and the Bad Seeds', u'80s', u'alternative', u'dark', u'blues', u'1988']"
900,Into My Arms,242973,1382366,255000,"[u'alternative', u'rock', u'Ballad', u'singer-songwriter', u'beautiful', u'piano', u'australian', u'post-punk', u'indie', u'spiritual', u'Love', u'Nick Cave', u'90s', u'australia', u'male vocalist', u'meaningful lyrics', u'candle', u'another voice to die for', u'i believe in love', u'similar to: pale blue eyes by the velvet underground', u'seen live', u'alternative rock', u'folk', u'experimental', u'indie rock', u'sad', u'hard rock', u'calm', u'solo', u'acoustic', u'new wave', u'Alternative  Punk', u'romantic', u'night', u'song', u'haunting', u'winter', u'melancholy', u'christian', u'depressing', u'male vocalists', u'wave', u'fav', u'religious', u'8 of 10 stars', u'sweet', u'crying', u'Masterpiece', u'ZicCool', u'darkness']"
901,Stagger Lee,138963,612769,315000,"[u'rock', u'alternative', u'alternative rock', u'post-punk', u'singer-songwriter', u'90s', u'folk-rock', u'Nick Cave', u'lyrics that explode my mind', u'evil lyrics', u'experimental', u'australian', u'excellent', u'badass', u'essentials', u'Balls', u'dark pop', u'rude words', u'80s', u'indie rock', u'australia', u'singer songwriter', u'alternative pop', u'Gothic Rock', u'Ballad', u'hilarious', u'ZicCool', u'darkness', u'1990s', u'Murder ballad', u'murder', u'guns', u'STAGGER LEE', u'rage', u'zictop', u'swagger', u'5 star songs', u'fucking beautiful', u'guiltypleasure', u'Songs with names', u'OH NO', u'seen performed live', u'Achmed Tarquins Loved Tracks', u'Songs I never get tired of', u'favourite riffs hooks and motifs', u'the word stagger', u'boys name', u'transitglambat', u'Swears', u'kattis hall of fame']"
902,Blind Lemon Jefferson,25161,68069,367000,"[u'alt rock', u'habba babb']"
903,Mermaids,99777,582037,229000,"[u'alternative', u'singer-songwriter', u'chill', u'2013', u'art rock', u'chamber pop', u'soft', u'fip', u'alt rock', u'10s', u'One of the best', u'Nick Cave', u'mermaids', u'Very Good', u'alternative singer-songwriter', u'seen performed live', u'elves and other magical beings', u'fish and other sea creatures', u'HOF 2013', u'k00l gu7s']"
904,Darker With the Day,49370,213617,367000,"[u'australian', u'rock', u'alternative', u'alternative rock', u'beautiful', u'indie', u'experimental', u'indie rock', u'hard rock', u'downtempo', u'singer-songwriter', u'Alternative  Punk', u'blues', u'Mellow', u'melancholy', u'alternative pop', u'easy', u'Nick Cave', u'nick cave: moon and stars and ice and snow']"
905,The Weeping Song,124100,721529,251000,"[u'rock', u'post-punk', u'Gothic', u'Great Lyricists', u'Masterpiece', u'heart of darkness', u'classic', u'alternative', u'singer-songwriter', u'epic', u'night', u'90s', u'post', u'beauty', u'poetry', u'melancholy', u'live', u'singer songwriter', u'Gothic Rock', u'duet', u'Favorite', u'alt rock', u'love at first listen', u'gods', u'1990', u'ZicCool', u'gdchills90s', u'essentials', u'1990s', u'favs', u'Nick Cave', u'Nick Cave and the Bad Seeds', u'Orgasmic', u'laut', u'90er', u'darker than the deepest sea', u'blixa bargeld', u'popular in a perfect world', u'montag', u'transitmelancholie', u'all time favs', u'traumhaft', u'boot nuernberg', u'seen performed live', u'tiefsttraurigst', u'hicior', u'Songs for Julie', u'two old gay businessmen at the disco']"
906,Anesthesia,38781,278899,401000,"[u'Gothic Metal', u'doom metal', u'metal', u'Gothic', u'depression', u'Gothic Rock', u'sex', u'great songs', u'for loveless lonely nights', u'worth dying for', u'heavy metal', u'emo', u'Brooklyn', u'american', u'great lyrics', u'goth rock', u'Music To Kill Yourself To', u'Songs to slit my wrists to', u'sick of the world', u'sexy', u'Stoner Rock', u'favorites', u'Love', u'catchy', u'epic', u'dark', u'Awesome', u'haunting', u'beauty', u'emotional', u'melancholic', u'great song', u'00s', u'drugs', u'8 of 10 stars', u'9 of 10 stars', u'fantasy metal', u'spring', u'Masterpiece', u'fuck', u'darkness', u'essentials', u'10 of 10 stars', u'6 of 10 stars', u'heavy or aggressive', u'atmospheric doom metal', u'peter steele', u'greatest song ever made', u'numb', u'fucking incredible']"
907,Nettie,36308,225799,286000,"[u'Gothic Metal', u'doom metal', u'metal', u'Gothic', u'Gothic Rock', u'goth rock', u'heavy metal', u'depressed', u'bitter', u'seen live', u'goth', u'Stoner Rock', u'beautiful', u'Progressive', u'one of their best songs', u'00s', u'8 of 10 stars', u'9 of 10 stars', u'emotive', u'great voice', u'7 of 10 stars', u'10 of 10 stars', u'goth metal', u'atmospheric doom metal', u'Amazing song', u'modern metal', u'i had to change my pants after this song', u'fucking incredible', u'thirteen', u'All-Time Favorites', u'total ownage', u'to be played at my funeral', u'Moody Rock', u'bands i have met personally', u'a very beautiful song', u'RIP Peter Steele', u'DAT RIFF', u'TOTAL FUCKING WIN', u'larry', u'my all time favorites', u'celebrate your mother', u'miss red hook of 1922', u'holy trip']"
908,Nettie,36308,225799,286000,"[u'Gothic Metal', u'doom metal', u'metal', u'Gothic', u'Gothic Rock', u'goth rock', u'heavy metal', u'depressed', u'bitter', u'seen live', u'goth', u'Stoner Rock', u'beautiful', u'Progressive', u'one of their best songs', u'00s', u'8 of 10 stars', u'9 of 10 stars', u'emotive', u'great voice', u'7 of 10 stars', u'10 of 10 stars', u'goth metal', u'atmospheric doom metal', u'Amazing song', u'modern metal', u'i had to change my pants after this song', u'fucking incredible', u'thirteen', u'All-Time Favorites', u'total ownage', u'to be played at my funeral', u'Moody Rock', u'bands i have met personally', u'a very beautiful song', u'RIP Peter Steele', u'DAT RIFF', u'TOTAL FUCKING WIN', u'larry', u'my all time favorites', u'celebrate your mother', u'miss red hook of 1922', u'holy trip']"
909,Nettie,36308,225799,286000,"[u'Gothic Metal', u'doom metal', u'metal', u'Gothic', u'Gothic Rock', u'goth rock', u'heavy metal', u'depressed', u'bitter', u'seen live', u'goth', u'Stoner Rock', u'beautiful', u'Progressive', u'one of their best songs', u'00s', u'8 of 10 stars', u'9 of 10 stars', u'emotive', u'great voice', u'7 of 10 stars', u'10 of 10 stars', u'goth metal', u'atmospheric doom metal', u'Amazing song', u'modern metal', u'i had to change my pants after this song', u'fucking incredible', u'thirteen', u'All-Time Favorites', u'total ownage', u'to be played at my funeral', u'Moody Rock', u'bands i have met personally', u'a very beautiful song', u'RIP Peter Steele', u'DAT RIFF', u'TOTAL FUCKING WIN', u'larry', u'my all time favorites', u'celebrate your mother', u'miss red hook of 1922', u'holy trip']"
910,Do You Love Me (Part 2),896,3432,0,[]
911,Do You Love Me (Part 2),896,3432,0,[]
912,Do You Love Me (Part 2),896,3432,0,[]
913,Lay me low,3852,14325,0,"[u'Progressive metal', u'singer-songwriter', u'tired', u'take your time', u'relaxing calm and fresh', u'10 estrellas', u'11 estrellas', u'1000 estrellas']"
914,Ain't Gonna Rain Anymore,4628,16083,0,[u'chilly']
915,Thirsty Dog,4489,15499,197000,"[u'alternative', u'wild', u'Nick Cave', u'dogs dogs dogs', u'mad regret', u'if i was a song']"
