,Songs,Listeners,Playcount,Duration,Tags
293,La Jument De Michao,8724,30288,225000,"[u'celtic', u'folk', u'breton', u'bretagne', u'francais', u'french', u'folk rock', u'irish', u'celtic folk', u'fantasy dance', u'medieval', u'chanson francaise', u'Mittelalter', u'battle', u'brittany', u'pipes', u'discover', u'french folk', u'breizh', u'Tri Yann', u'folk  rock favourites', u'folk rock favourites', u'mudog-children', u'mudog-christmas', u'bretagne et tradition', u'sdkfz', u'-n7', u'-45t', u'-65t', u'ok today 110512', u'did not stream on n7 120925', u'bluesfolketc', u'la jument de michao']"
294,Les Prisons De Nantes - Quebec,1100,3248,0,"[u'folk', u'celtic', u'breton']"
295,El Libro de las Sombras,3835,18415,331000,[u'later']
296,La Conquista,13090,53983,307000,"[u'folk metal', u'Spanish Metal', u'heavy metal', u'MAGO DE OZ', u'Power metal', u'melodic heavy metal', u'metal', u'melodic metal', u'Melodic Power Metal', u'Excalibur', u'spanish', u'rock', u'Progressive metal', u'spain', u'folk rock', u'symphonic metal', u'Gaia', u'999', u'New List', u'107', u'pitbullcarfc', u'jytakampaa', u'0 kirotenshu HALF GODS half eternals inumans', u'rrrrrrrrrrrrrrrrrrrrrrrrrrrrrrrrrrrrrrrrrrrrrrrr']"
297,Gaia,20324,95921,663000,"[u'folk metal', u'MAGO DE OZ', u'Power metal', u'Progressive metal', u'celtic', u'metal', u'spanish', u'rock', u'celtic metal', u'Spanish Metal', u'heavy metal', u'Spanish Folk Metal', u'Gaia', u'folk', u'Progressive rock', u'Symphonic Rock', u'spain', u'espa\xf1ol', u'folk rock', u'cool', u'symphonic metal', u'Favorite', u'hippy', u'I Like It', u'Talking', u'neo progressive', u'Spanish language', u'cool beans', u'ambiental', u'silent intensity', u'celta', u'83', u'eargasmic', u'Over 10 minutes', u'very favorite', u'Zodo', u'metal iberico', u'18032006', u'una cancion de 10 minutos es una intro', u'flipaos', u'awesome flute', u'Fol Metal', u'jytakampaa', u'mgo de oz', u'Mago de oz - gaia', u'magoz', u'gaia mago de oz', u'mago de gaia']"
298,Obertura MDXX,11745,41979,235000,"[u'folk metal', u'MAGO DE OZ', u'spanish', u'instrumental', u'Soundtrack', u'heavy metal', u'Classical', u'rock', u'folk', u'Progressive metal', u'spain', u'folk rock', u'Power metal', u'Spanish Metal', u'jytakampaa']"
299,El Libro de las Sombras,3835,18415,331000,[u'later']
300,El Libro de las Sombras,3835,18415,331000,[u'later']
301,Maite Zaitut,14813,64054,200000,"[u'folk metal', u'folk rock', u'celtic', u'MAGO DE OZ', u'spanish', u'spain', u'heavy metal', u'seen live', u'rock', u'Spanish Rock', u'Espanol', u'Power metal', u'try', u'versiones', u'good sound', u'metal iberico', u'flipaos', u'roman paladino', u'canciones que me hacen recordar a quien mas amo']"
302,Polla Dura No Cree en Dios,12084,49607,270000,"[u'folk metal', u'Power metal', u'celtic metal', u'spanish', u'hard rock', u'spain', u'folk rock', u'symphonic metal', u'melodic metal', u'Spanish Metal', u'heavy metal', u'metal', u'rock', u'heavy', u'folk', u'Progressive metal', u'Spanish Rock', u'celtic', u'Celtic Folk Metal', u'Melodic Power Metal', u'MAGO DE OZ', u'Zodo', u'dbpower', u'for my', u'despertando']"
303,El Senor de los Gramillos,2217,6057,0,"[u'folk metal', u'Power metal', u'Spanish Metal']"
304,Hasta Que El Cuerpo Aguante,30617,205061,272000,"[u'folk metal', u'spanish', u'MAGO DE OZ', u'folk rock', u'Spanish Metal', u'heavy metal', u'Progressive metal', u'metal', u'spain', u'live', u'celtic', u'melodic metal', u'trance', u'seen live', u'male vocalist', u'Favorite', u'spanish heavy metal', u'Spanish Folk Metal', u'goodsongs', u'Mago', u'hasta que el cuerpo aguante', u'happy', u'techno', u'Power metal', u'Jambimbera', u'Folk-Metal', u'celtic metal', u'celta', u'rock celta', u'Zodo', u'agregar', u'pitbullcarfc', u'Good band Buy this also', u'es meu tag']"
305,La Danza Del Fuego,26114,153097,313000,"[u'folk metal', u'metal', u'spanish', u'epic', u'folk rock', u'Power metal', u'Spanish Metal', u'MAGO DE OZ', u'see live', u'folk meta', u'bluesfolk']"
306,La Cruz de Santiago,14241,68999,319000,"[u'folk metal', u'heavy metal', u'MAGO DE OZ', u'spanish', u'spain', u'folk rock', u'true metal', u'Spanish Metal', u'Heavy Folk', u'Songs that send me', u'tengo un orgasmo cuando la escucho', u'la mejor cancion del mago de oz', u'107miri']"
307,Satania,20034,107114,572000,"[u'folk metal', u'heavy metal', u'Power metal', u'Spanish Metal', u'MAGO DE OZ', u'spanish', u'Progressive metal', u'metal', u'melodic metal', u'spanish heavy metal', u'celtic', u'celtic metal', u'rock', u'hard rock', u'spain', u'revolucion', u'Progressive', u'folk rock', u'luna', u'Spanish Folk Metal', u'ddd', u'very favorite', u'Zodo', u'spanish power metal', u'tengo un orgasmo cuando la escucho', u'bluesfolk', u'spanish folk metal el peso del alma', u'Djmz', u'satania', u'magoz', u'Chalala']"
308,Prólogo,10517,37312,139000,"[u'folk metal', u'spanish', u'folk rock', u'MAGO DE OZ', u'metal', u'folk', u'spain', u'Spanish Metal', u'Hispanic Music']"
309,Réquiem,12774,63274,492000,"[u'folk metal', u'spanish', u'heavy metal', u'metal', u'folk rock', u'rock nacional', u'spanish heavy metal', u'heavy', u'90s', u'spain', u'european', u'Spanish Metal', u'MAGO DE OZ', u'metal iberico', u'temazos de ayer y hoy', u'flipaos', u'mago de oz - requiem', u'spanisih metal']"
310,El templo del adios,7763,35208,0,"[u'folk rock', u'pitbullcarfc', u'jose andrea']"
311,La Insula De Barataria,6051,23864,434000,"[u'folk rock', u'RM', u'hechizo transformado en notas celtas de violin y algun tipo de flauta']"
312,El pacto,11995,58174,0,"[u'folk metal', u'spanish', u'Spanish Metal', u'MAGO DE OZ', u'mago de oz - el pacto', u'slgdmfolk', u'seen live', u'90s', u'spain', u'folk rock', u'celtic rock', u'european', u'rock espannol', u'pitbullcarfc', u'Mi Last']"
313,El Bálsamo De Fierabras,1368,3205,218000,[]
314,Maritornes,10097,47827,256000,"[u'folk metal', u'spanish', u'metal']"
315,Dime con quién andas,10733,44378,332000,"[u'folk metal', u'spanish', u'folk rock', u'metal', u'spain', u'european', u'Spanish Metal', u'MAGO DE OZ', u'90s', u'blues rock', u'Power metal', u'European Metal', u'Spanish Folk Metal', u'european folk metal', u'spanish male vocalists', u'RM', u'oldtimes']"
316,Molinos De Viento,42741,263501,250000,"[u'folk metal', u'metal', u'spanish', u'rock', u'heavy metal', u'Rock Espanol', u'spain', u'folk rock', u'rock en espa\xf1ol', u'Power metal', u'MAGO DE OZ', u'Rock en Espanol', u'Spanish Metal', u'Locuras', u'Molinos de vientos', u'electronica', u'jazz', u'Progressive metal', u'favorites', u'epic', u'Spanish Rock', u'excellent', u'celtic', u'fiesta', u'10 of 10 stars', u'celtic metal', u'Favoritos', u'celta', u'luna', u'Spanish Folk Metal', u'fiesta pagana', u'flor', u'Fol Metal', u'Asi es la vida', u'pagana', u'variado', u'MUSICA CELTA', u'bluesfolk', u'my rebel days of heavy metal in mexico city', u'this genre makes me to remember old friends', u'un buen rokc', u'rpgistic', u'guitaring cool', u'mko', u'Woow muy buen tema', u'molinos del viento', u'miguels music bitches']"
317,Noche Toledana,10311,43622,73000,"[u'spanish', u'instrumental', u'folk metal']"
318,La Leyenda De Mancha,1579,4274,259000,[]
319,El Santo Grial,16821,90599,344000,"[u'folk metal', u'heavy metal', u'spanish', u'Awesome', u'MAGO DE OZ', u'metal', u'seen live', u'Progressive metal', u'favorites', u'spain', u'Power metal', u'Spanish Metal', u'Spanish Folk Metal', u'pitbullcarfc']"
320,En un lugar...,11324,36526,104000,"[u'spanish', u'MAGO DE OZ', u'folk metal', u'folk', u'symphonic metal', u'Power metal', u'Spanish Metal', u'classic rock', u'metal', u'seen live', u'rock', u'instrumental', u'spain', u'folk rock', u'heavy metal', u'Grunge', u'heavy', u'Progressive metal', u'female vocalists', u'hard rock', u'Progressive rock', u'favorites', u'90s', u'espa\xf1ol', u'thrash metal', u'Spanish Rock', u'prog rock', u'latino', u'celtic', u'Espanol', u'Flamenco', u'rock nacional', u'melodic metal', u'celtic rock', u'badass', u'Jambimbera', u'sweet child of mine', u'european', u':PlayList666:', u'prog metal', u'celtic metal', u'progressive power metal', u'Foreign', u'My favorite bands', u'spanish heavy metal', u'Spanish Folk Metal', u'traditional-power-symphonic metal', u'To check out eventually', u'Me gusta', u'espanhol']"
321,H2Oz,4629,23314,233000,"[u'spanish', u'folk metal', u'Power metal']"
322,El Libro de las Sombras,3835,18415,331000,[u'later']
323,El Amor De Mi Vida,6588,26404,293000,"[u'Power metal', u'Spanish Metal', u'Tierra Santa', u'heavy metal', u'Love', u'spanish', u'4', u'Spanish language', u'Metal Ballade', u'el amor de mi vida', u'love metal1']"
324,El Laberinto Del Minotauro,4680,21415,307000,"[u'Power metal', u'Spanish Metal', u'heavy metal', u'Spanish Rock', u'rich hard rock']"
325,La Armada Invencible,3606,13752,263000,"[u'Spanish Metal', u'heavy metal', u'4', u'Power metal', u'awsome music', u'deff lepard', u'similar on iron maiden']"
326,Dos Vidas,1680,6089,128000,[u'Spanish Metal']
327,La Sombra De La Bestia,5029,22580,313000,"[u'heavy metal', u'spanish', u'Power metal', u'Spanish Metal']"
328,Juana De Arco,5153,30859,264000,"[u'Gothic Rock', u'heavy metal', u'Gothic Metal', u'Power metal', u'modern metal', u'jda', u'despertando', u'107miri', u'Karlaghotic', u'Juana de arco']"
329,Pegaso,6682,29247,242000,"[u'Spanish Metal', u'heavy metal', u'spanish heavy metal', u'metal', u'spanish', u'4', u'Tierra Santa', u'spanish power metal', u'rock vasco', u'metal espanol', u'torcon-beach', u'similar on iron maiden']"
330,La Ciudad Secreta,3200,10724,224000,"[u'heavy metal', u'4', u'Power metal', u'Spanish Metal-Rock', u'para desaburrirse']"
331,David Y El Gigante,3910,13155,333000,"[u'heavy metal', u'metal', u'spanish', u'4', u'speed', u'Spanish Metal', u'spanish power metal', u'torcon-beach']"
332,El Caballo De Troya,8535,31982,209000,"[u'Spanish Metal', u'heavy metal', u'Power metal', u'metal', u'spanish', u'rock', u'spanish heavy metal', u'Tierra Santa', u'dance', u'90s', u'3', u'Espanol', u'FUCKING AWESOME', u'45', u'latin metal', u'troya', u'torcon-beach', u'metal azeiteiro']"
333,Hijos Del Odio,3580,11610,237000,"[u'heavy metal', u'rock-spain', u'HdO']"
334,Desterrado,3318,10340,461000,"[u'heavy metal', u'Power metal', u'metal', u'rock', u'spanish heavy metal', u'Spanish Metal', u'Rock Urbano', u'magnanimous metal', u'107miri']"
335,Leyenda,3316,10332,412000,"[u'metal', u'heavy metal', u'MAGO DE OZ', u'Spanish Metal', u'Tierra Santa', u'107miri']"
336,Tierra Santa,7100,27183,243000,"[u'heavy metal', u'Power metal', u'metal', u'spanish power metal', u'Spanish Metal', u'Tierra Santa', u'artist name in song title', u'metal espanol', u'107miri']"
337,Medieval,6088,20938,313000,"[u'heavy metal', u'Spanish Metal', u'Tierra Santa', u'rock en espa\xf1ol', u'leyenda', u'jest epicko', u'vikingos', u'107miri', u'desterrado', u'hijos del odio', u'tirra santa']"
338,Jug of Punch,22,31,154000,[]
339,Old Man Dillon,8,9,306000,[]
340,Patrick Coyle,12,13,306000,[]
341,Red Haired Boy,44,70,138000,[]
342,Reel Set,15,23,227000,[]
343,Crack the Walnut/Roger the Shrubber,14,21,178000,[]
344,Les Filles Des Forges - Bretagne : Région De Paimpont,790,2303,141000,"[u'folk', u'optime']"
345,La Jument De Michao,8724,30288,225000,"[u'celtic', u'folk', u'breton', u'bretagne', u'francais', u'french', u'folk rock', u'irish', u'celtic folk', u'fantasy dance', u'medieval', u'chanson francaise', u'Mittelalter', u'battle', u'brittany', u'pipes', u'discover', u'french folk', u'breizh', u'Tri Yann', u'folk  rock favourites', u'folk rock favourites', u'mudog-children', u'mudog-christmas', u'bretagne et tradition', u'sdkfz', u'-n7', u'-45t', u'-65t', u'ok today 110512', u'did not stream on n7 120925', u'bluesfolketc', u'la jument de michao']"
346,Suite Sudarmoricaine,10188,32421,210000,"[u'celtic', u'folk', u'breton', u'top celt', u'dance', u'world', u'breizh', u'herz', u'slgdm', u'rock', u'harpe', u'medieval', u'beautiful', u'Drum', u'irish', u'france', u'international', u'whistle', u'goldies', u'rythm', u'slgdmbestof', u'bzh', u'middle age', u'heard on last-fm 08', u'songs i play', u'america del sur', u'lastfm radio', u'celtica', u'Alan Stivell', u'fantasy dance', u'pizdato', u'new to me but just soo good', u'porannik', u'bluesfolk', u'h2hannes', u'musique traditionnelle bretonne', u'AStivell', u'kjjatn', u'celtic brittany breton', u'bluesfolketc', u'suite sudamoricaine']"
347,Map of the Problematique,738695,7135716,258000,"[u'rock', u'alternative rock', u'alternative', u'Muse', u'british', u'Progressive rock', u'electronic', u'indie', u'seen live', u'Awesome', u'epic', u'indie rock', u'space rock', u'beautiful', u'00s', u'best track on earth', u'britpop', u'FUCKING AWESOME', u'favorites', u'psychedelic', u'Progressive', u'amazing', u'Favourites', u'electronic rock', u'genius', u'experimental', u'Love', u'makes the heart beat a little faster', u'haunting', u'map of the problematique', u'UK', u'Masterpiece', u'powerful', u'sad', u'energy', u'hard rock', u'dark', u'male vocalists', u'Favorite', u'brilliant', u'Favourite Songs', u'Night Driving', u'beautiful sound', u'upbeat', u'Britrock', u'Aural Orgasm', u'midnight sun', u'chillout', u'piano', u'favourite']"
348,Wilderness,59762,325110,84000,"[u'ethereal', u'Gothic', u'ambient', u'medieval', u'darkwave', u'rock', u'alternative', u'Dead Can Dance', u'amayzes loved', u'folk', u'female vocalists', u'world', u'90s', u'4ad', u'davaho53', u'chillout', u'indie', u'Fusion', u'new age', u'atmospheric', u'Avant-Garde', u'World Music', u'neofolk', u'mystical', u'Soundtrack', u'electronic', u'pop', u'instrumental', u'experimental', u'indie pop', u'choral', u'Alternative  Punk', u'beautiful', u'Awesome', u'dream pop', u'art rock', u'melancholy', u'Meditation', u'indie folk', u'dark ambient', u'Alternative Folk', u'alternative pop', u'world fusion', u'Favorite', u'Acapella', u'fav', u'dark wave', u'neo classical', u'Oriental', u'fantasy']"
349,Reflections,6243,40515,257000,"[u'Melodic Death Metal', u'Gothic Metal', u'Melodic Dark Metal', u'finnish', u'Dark metal', u'finnish metal']"
350,Sky Is Mine,57127,530501,260000,"[u'Melodic Death Metal', u'Progressive metal', u'melodic metal', u'metal', u'finnish metal', u'progressive death metal', u'Gothic Metal', u'heavy metal', u'doom metal', u'epic', u'folk metal', u'death metal', u'Amorphis', u'seen live', u'Progressive rock', u'favorites', u'Progressive', u'Uplifting', u'great solo', u'8 of 10 stars', u'Masterpiece', u'7 of 10 stars', u'10 of 10 stars', u'progressive doom metal', u'doom death metal', u'awesome vocals', u'my kind of metal', u'One of the best songs ever', u'damn good', u'melodical', u'valkyriex powerr', u'number ones', u'seen live 2013', u'hyper-energetic', u'finnish melodic death metal', u'so zorry', u'haruka', u'harukaex', u'harukaex s2i', u'HarukaEX S2', u'cronowish power', u'valkyriex loves', u'pure fucking finnish metal', u'Scryed Edward Tracks Power', u'valkyriex love', u'harukaexS2', u'Sahnestueck', u'fucking atmospheric', u'pretty fucking badass', u'luv luv luv song']"
351,Age Of Loneliness - Enigmatic Club Mix,2681,7310,0,[]
352,Turn Around - Northern Lights Club Mix,255,418,0,[]
353,The Cross Of Changes,86311,383593,143000,"[u'new age', u'ambient', u'chillout', u'enigma', u'electronica', u'electronic', u'pop', u'ethnic fusion', u'chill', u'alternative', u'piano', u'trance', u'downtempo', u'90s', u'Favorite Artists', u'female vocalists', u'Love', u'world', u'beautiful', u'Dreamy', u'synthesizer', u'relaxing', u'Ambient Techno', u'chill out', u'Favourites', u'ambient or new age', u'sample', u'ibiza', u'My Favorites', u'Greatest', u'best ever', u'spokojne', u'For studying', u'my melodies', u'tranquility', u'easy listening', u'ethnic', u'g', u'Mellow', u'ethereal', u'spiritual', u'Meditation', u'hypnotic', u'Smooth Jazz', u'suave', u'nighttime is the righttime', u'jazz piano', u'meditative', u'yes', u'relaxation']"
354,Morphing Thru Time,80527,371304,347000,"[u'new age', u'ambient', u'chillout', u'enigma', u'electronic', u'electronica', u'spiritual', u'trance', u'relaxing', u'pop', u'instrumental', u'downtempo', u'beautiful', u'Engima', u'sexy', u'renato ventura saids bravo', u'chill', u'epic', u'90s', u'ethereal', u'gregorian', u'enigmatic', u'mystic', u'-New-Age-and-Ambient-', u'Atmosfera', u'5 star song', u'-erotica-', u'vocal', u'opera', u'rock', u'alternative', u'favorite songs', u'female vocalists', u'dance', u'tranquility', u'choral', u'romantic', u'other', u'techno', u'Awesome', u'choir', u'Dreamy', u'lounge', u'vocals', u'atmospheric', u'deep', u'Meditation', u'german', u'favourite', u'hypnotic']"
355,Age Of Loneliness,56180,249859,250000,"[u'new age', u'ambient', u'electronic', u'chillout', u'enigma', u'electronica', u'relaxing', u'instrumental', u'90s', u'relax', u'Relaxa', u'trance', u'chill', u'female vocalists', u'ethereal', u'easy', u'ethnic vocals', u'Music to code by', u'mystic mt', u'vocal', u'rock', u'classic', u'alternative', u'dance', u'Love', u'tranquility', u'easy listening', u'Mellow', u'oldies', u'great', u'spiritual', u'german', u'hypnotic', u'sex', u'cool', u'love at first listen', u'relaxation', u'8 of 10 stars', u'lost', u'autumn', u'loneliness after dusk', u'emotive', u'7 of 10 stars', u'6 of 10 stars', u'german artist', u'reading', u'eddie', u'pan flute', u'enigmatic', u'mystic']"
356,Beyond the Invisible,140771,718023,290000,"[u'new age', u'ambient', u'chillout', u'enigma', u'electronic', u'relax', u'chill', u'electronica', u'relaxing', u'90s', u'mystic', u'atmospheric', u'trance', u'Dreamy', u'ethereal', u'downtempo', u'female vocalists', u'pop', u'instrumental', u'beautiful', u'spiritual', u'enigmatic', u'electronic-ambient', u'Beyond the Invisible', u'alternative', u'world', u'80s', u'sexy', u'Mellow', u'german', u'chill-out', u'chill out', u'gregorian', u'chant', u'Greatest', u'la femme nikita', u'renato ventura saids bravo', u'vocal', u'rock', u'alternative rock', u'epic', u'techno', u'yoga', u'lounge', u'melancholy', u'melancholic', u'hypnotic', u'sex', u'super', u'Uplifting']"
357,Push the Limits,104633,481121,228000,"[u'new age', u'ambient', u'electronic', u'enigma', u'chillout', u'electronica', u'trance', u'relax', u'chill', u'enigmatic', u'dance', u'New Age and Ambient', u'alternative', u'downtempo', u'ethereal', u'relaxing', u'pop', u'rock', u'female vocalists', u'amayzes loved', u'Push the limits', u'world', u'beautiful', u'celtic', u'meditative', u'gregorian fusion', u'above & beyond', u'davaho53', u'Enigma sounds', u'electro', u'techno', u'lounge', u'germany', u'trip hop', u'Mellow', u'spiritual', u'hypnotic', u'depressing', u'female vocalist', u'Favourites', u'Sandra', u'dream trance', u'Anjunabeats', u'club cafe', u'electronic-ambient', u'above and beyond', u'-New-Age-and-Ambient-', u'only relax', u'Dream Dance', u'Byron']"
358,Mea Culpa,173749,798829,237000,"[u'new age', u'ambient', u'chillout', u'enigma', u'electronic', u'electronica', u'relaxing', u'chill', u'alternative', u'90s', u'trance', u'sexy', u'Mellow', u'ethereal', u'mea culpa', u'celtic', u'relax', u'easy listening', u'gregorian', u'female vocalists', u'pop', u'chill out', u'instrumental', u'rock', u'80s', u'downtempo', u'Gothic', u'choir', u'atmospheric', u'dark ambient', u'enigmatic', u'chambers and catacombs', u'jazz', u'alternative rock', u'favorites', u'world', u'funk', u'House', u'beautiful', u'lounge', u'funky', u'spiritual', u'sex', u'groovy', u'Ambient Techno', u'relaxation', u'jecks', u'chant', u'gregorian chant', u'gregorian fusion']"
359,Smell Of Desire,100817,442774,272000,"[u'new age', u'ambient', u'enigma', u'chillout', u'electronic', u'electronica', u'trance', u'female vocalists', u'relaxing', u'chill', u'instrumental', u'smell of desire', u'sexy', u'pop', u'alternative', u'world', u'relax', u'sensual', u'wabbits picks', u'90s', u'sex music', u'Club Dance', u'Progressive rock', u'easy listening', u'beautiful', u'Mellow', u'trippy', u'best', u'7 of 10 stars', u'ballads', u'enigmatic', u'mystic', u'gregorian fusion', u'ambient chillout', u'ambiental', u'-favorites-', u'Michael Cretu', u'absolute favourite', u'-erotica-', u'french', u'Classical', u'soul', u'80s', u'alternative rock', u'downtempo', u'electro', u'slow', u'tranquility', u'cafe del mar', u'Fusion']"
360,Silence Must Be Heard,100394,433872,286000,"[u'new age', u'ambient', u'chillout', u'enigma', u'electronic', u'electronica', u'female vocalists', u'world', u'german', u'chill', u'relaxing', u'relax', u'alternative', u'easy listening', u'90s', u'Mellow', u'spiritual', u'00s', u'silence must be heard', u'rock', u'instrumental', u'Progressive rock', u'Awesome', u'atmospheric', u'relaxation', u'french', u'pop', u'sexy', u'electro', u'favorites', u'bass', u'Driving', u'ethereal', u'melancholic', u'sex', u'cool', u'sensual', u'Dream', u'electrorock', u'deep techno', u'ambient trance', u'dream trance', u'Silkred-LovedAll', u'-New-Age-and-Ambient-', u'trance', u'classic rock', u'trip-hop', u'electropop', u'vocal', u'experimental']"
361,Sadeness,58359,236594,254000,"[u'new age', u'chillout', u'ambient', u'enigma', u'electronica', u'electronic', u'relaxing', u'sexy', u'chill', u'easy listening', u'90s', u'spiritual', u'world', u'holloween skitz0rz', u'new wave', u'3', u'Mellow', u'sex', u'Skitz0rz', u'video clip', u'uitluisteren artist', u'my dance room', u'french', u'pop', u'favorites', u'Awesome', u'Dreamy', u'Favourites', u'relaxation', u'sensual', u'chant', u'sunflower', u'sadeness', u'voice sampling', u'mvideo', u'Goth Atmosphere', u'indie', u'rock', u'classic', u'instrumental', u'80s', u'alternative', u'alternative rock', u'emo', u'female vocalists', u'downtempo', u'dance', u'calm', u'Love', u'epic']"
362,Principles of Lust,99363,417472,188000,"[u'new age', u'ambient', u'chillout', u'enigma', u'electronic', u'electronica', u'trance', u'relax', u'chill', u'alternative', u'sexy', u'ethereal', u'instrumental', u'meditative', u'amayzes loved', u'downtempo', u'favorites', u'Love', u'90s', u'sex', u'female vocalists', u'easy listening', u'Mellow', u'relaxing', u'celtic', u'relaxation', u'enigmatic', u'davaho53', u'free your mind', u'Principles Of Lust', u'jazzyslovedtracks 2010A', u'female', u'rock', u'world', u'lounge', u'heard on Pandora', u'chill out', u'loneliness after dusk', u'enya', u'calmer', u'mystic', u'Erotic', u'jazzyschantwithtwist', u'Soundtrack', u'trip-hop', u'indie', u'pop', u'80s', u'experimental', u'Progressive rock']"
363,I Love You... I'll Kill You,32089,159136,481000,"[u'new age', u'chillout', u'ambient', u'electronic', u'electronica', u'enigma', u'sexy', u'female vocalists', u'relaxing', u'sensual', u'chill', u'instrumental', u'alternative', u'downtempo', u'dance', u'Mellow', u'relaxation', u'-New-Age-and-Ambient-', u'Soundtrack', u'trance', u'indie', u'pop', u'experimental', u'Progressive rock', u'slow', u'tranquility', u'new wave', u'easy listening', u'romantic', u'Gothic', u'techno', u'90s', u'vocals', u'oldies', u'top', u'chilled', u'Meditation', u'melancholic', u'percussion', u'vocal trance', u'good', u'female vocalist', u'celtic', u'female vocal', u'depression', u'cool title', u'relax', u'melody', u'i am a party girl here is my soundtrack', u'loneliness']"
364,Return to Innocence,321468,1681321,248000,"[u'new age', u'ambient', u'chillout', u'enigma', u'electronic', u'90s', u'relaxing', u'spiritual', u'relax', u'chill', u'electronica', u'beautiful', u'world', u'pop', u'atmospheric', u'return to innocence', u'alternative', u'easy listening', u'ethereal', u'trance', u'Mellow', u'female vocalists', u'Soundtrack', u'instrumental', u'favorites', u'Love', u'worldbeat', u'sexy', u'melancholy', u'inspiring', u'downtempo', u'Dreamy', u'celtic', u'1994', u'Sentimental', u'rock', u'experimental', u'dance', u'calm', u'ethnic', u'smooth', u'chill out', u'soothing', u'lounge', u'peaceful', u'soft', u'german', u'loved', u'inspirational', u'magic']"
365,Shadows in Silence,104669,493133,261000,"[u'new age', u'ambient', u'chillout', u'enigma', u'electronic', u'instrumental', u'relaxing', u'electronica', u'chill', u'relax', u'Mellow', u'ethereal', u'beautiful', u'New Age instrumental', u'enigma - shadows in silence', u'pop', u'eldad666loved', u'alternative', u'easy listening', u'atmospheric', u'Meditation', u'Ambient Electronica', u'New Age  And Ambient', u'enigma-shadows in silence', u'rock', u'slow', u'german', u'relaxation', u'heavenly', u'ethnic fusion', u'most loved', u'Favoritos', u'Shadows in silence', u'trance', u'indie', u'sexy', u'female vocalists', u'albums I own', u'downtempo', u'Love', u'Fusion', u'romantic', u'lounge', u'90s', u'violin', u'longing', u'peaceful', u'spacious', u'psychill', u'composer']"
366,Modern Crusaders,78848,385531,231000,"[u'new age', u'ambient', u'electronic', u'enigma', u'chillout', u'electronica', u'trance', u'relaxing', u'amayzes loved', u'gregorian', u'rock', u'alternative', u'relax', u'davaho53', u'pop', u'chill', u'instrumental', u'dance', u'techno', u'90s', u'ethereal', u'Favourites', u'relaxation', u'enigmatic', u'best ever', u'la femme nikita', u'absolute favourite', u'vocal', u'experimental', u'sexy', u'female vocalists', u'albums I own', u'power pop', u'memories', u'catchy', u'epic', u'industrial', u'world', u'latin', u'RockPop', u'ethnic', u'germany', u'industrial rock', u'Mellow', u'synthpop', u'spiritual', u'german', u'hypnotic', u'Bach', u'good']"
