,Songs,Listeners,Playcount,Duration,Tags
0,Holiday Song,1887,9501,178000,[]
1,Oxygen,86664,349834,184000,"[u'acoustic', u'folk', u'indie', u'singer-songwriter', u'alternative', u'Mellow', u'Love', u'political', u'rock', u'american', u'Favourites', u'lyrics', u'oxygen', u'seen live', u'indie rock', u'beautiful', u'guitar', u'male vocalists', u'lovely', u'willy mason', u'chillout', u'chill', u'sad', u'calm', u'soft', u'chilled', u'fun', u'indie folk', u'inspiring', u'social justice', u'090405', u'guitarsy', u'in the box of old letters under the desk', u'sung aloud in empty houses', u'vocal', u'pop', u'country', u'punk', u'favorite songs', u'USA', u'favorites', u'slow', u'Lo-Fi', u'americana', u'soft rock', u'Awesome', u'2004', u'groove', u'quirky', u'weird']"
2,Magia,23704,493897,309000,"[u'anime', u'japanese', u'female vocalists', u'Gothic Metal', u'Symphonic Rock', u'j-pop', u'Kalafina', u'puella magi madoka magica', u'Gothic Rock', u'dark', u'symphonic metal', u'J-rock', u'Soundtrack', u'Gothic', u'epic', u'madoka', u'Female fronted metal', u'rock', u'fantasy metal', u'neoclassical', u'vocal', u'haunting', u'melancholy', u'Asian', u'emotional', u'anime soundtrack', u'FUCKING AWESOME', u'10s', u'6 of 10 stars', u'symphonic gothic metal', u'ending', u'Ending Theme', u'female fronted gothic metal', u'japanese female vocal', u'Female fronted symphonic metal', u'mahou shoujo madoka magica', u'metal', u'indie', u'alternative', u'alternative rock', u'Progressive metal', u'baroque pop', u'orchestral', u'atmospheric', u'JPop', u'mezzo-soprano', u'band', u'symphonic', u'female vocal', u'love at first listen']"
3,Surfboard,1831,8591,253000,[u'lust pop']
4,Work,7147,32250,229000,[u'Grime']
5,Lah-Di-Dah,4790,18990,198000,"[u'english', u'singer-songwriter', u'comedy', u'folk', u'chanson', u'acoustic', u'humour', u'underrated', u'gentle carrots', u'cookdandbombd', u'house md', u'cooper was here', u'battersea rain dance', u'surprised i had not heard this earlier', u'l8', u'fun and silly stuff', u'GH10', u'Jake Thackray', u'-f9', u'-55t', u'1103rh', u'cute but too sweet -SURELY VERY SOUR -ISNT THAT THE POINT', u'9 rem 120309', u'cute but too sweet']"
6,Sky,3318,20558,113000,[]
7,Sister Cities,16783,90529,308000,[u'favorites 2013']
8,The Softest Hard,3693,20420,284000,[]
9,TORADORA,3,3,0,[]
10,Take a Fall for Me (feat. RZA),156883,912329,214000,"[u'Hip-Hop', u'electronic', u'experimental', u'rap', u'dubstep', u'soul', u'hiphop', u'amazing', u'2013', u'featuring', u'7 of 10 stars', u'Wu-Tang Clan', u'post-dubstep', u'UK Garage', u'collab', u'RZA', u'sss', u'vocal sample', u'wiosna', u'keiaspissed']"
11,Love (feat. Ra Saite),2064,10905,179000,[]
12,Twisted Nerve,22336,110350,182000,"[u'garage', u'indie punk rock', u'mixtape', u'Awesome', u'american', u'Garage Rock', u'Favourites', u'audioase', u'heavy bottom end', u'chick rock', u'fuzzy guitar goodness', u'headphone music', u'proudly addicted', u'pop lament', u'para ouvir mesmo mt alto', u'fuk u']"
13,Rabbit,3251,17948,190000,"[u'witch house', u'DMT']"
14,Tears,508,1195,0,[]
15,Desire,1227,4948,188000,"[u'Disco', u'laidback', u'disco funk', u'electrofunk', u'new discovery']"
16,EvFL NYC,2459,12723,164000,[]
17,Himawari,14,55,0,[]
18,River of Brakelights,136069,594685,313000,"[u'indie rock', u'alternative', u'indie', u'rock', u'julian casablancas', u'sexy', u'love at first listen', u'electronic', u'alternative rock', u'american', u'00s', u'new wave', u'2009', u'synth pop', u'NYC', u'best of 2009', u'fucking amazing', u'electropop', u'male', u'pop', u'Grunge', u'hard rock', u'singer-songwriter', u'USA', u'Lo-Fi', u'death', u'favourite', u'Bittersweet', u'garage', u'male vocalists', u'english', u'The Strokes', u'2010', u'electro rock', u'FUCKING AWESOME', u'zicbouge', u'2000s', u'10s', u'gute laune', u'favorite song', u'Soundtrack des Lebens', u'One of the best', u'powerful', u'DL', u'synth rock', u'shambolic', u'Awesome song', u'sexy voice', u'Version', u'over 5 minutes long']"
19,So Wat Cha Sayin',25772,55734,255000,"[u'hip hop', u'Hip-Hop', u'rap', u'EPMD', u'dope beats', u'classic hip-hop', u'sample', u'1989', u'Certified classic', u'classic', u'80s', u'clean', u'hiphop', u'beats', u'old school', u'good shit', u'True Hip Hop', u'sick beat', u'wjlb-FM', u'east coast rap', u'Real hip-hop', u'The Shit', u'beatz', u'Classic Hip Hop', u'Hip-HopRap', u'loved real random', u'the real', u'hippity hoppity', u'fresh records', u'Hip Hop Legends', u'don m oldskool', u'Time To Roll', u'old fly shit', u'zesthop', u'carmelsoulsista']"
20,"Weekender - 12"" version",4263,8693,775000,"[u'indie', u'we']"
21,Split & Fly,3054,16509,216000,[]
22,Duvet,48141,630710,202000,"[u'anime', u'serial experiments lain', u'Soundtrack', u'female vocalists', u'british', u'lain', u'alternative', u'rock', u'alternative rock', u'indie', u'beautiful', u'sad', u'90s', u'female vocalist', u'melancholic', u'anime soundtrack', u'pop', u'japanese', u'pop rock', u'atmospheric', u'melancholy', u'depressing', u'Favourites', u'opening', u'hopeless', u'test', u'chillout', u'vocal', u'female', u'favorite songs', u'emo', u'indie rock', u'romantic', u'psychedelic', u'theme', u'lounge', u'haunting', u'JPop', u'1998', u'soft', u'ethereal', u'Electronic Pop', u'Indie-Rock', u'relaxing', u'cyberpunk', u'Coldplay', u'female vocals', u'cool', u'great lyrics', u'00s']"
23,Since you were not mine,2220,5684,225000,[]
24,Champagne 121212,4358,24303,198000,[]
25,My Friends,41899,208776,238000,"[u'folk', u'british', u'indie', u'female vocals', u'ridiculously perfect', u'indie folk', u'2011']"
26,Still Life,3232,16386,265000,"[u'End Credits', u'exceptional voice', u'Somewhere Out There']"
27,kiri,35443,609363,106000,"[u'anime', u'ergo proxy', u'J-rock', u'Soundtrack', u'rock', u'japanese', u'alternative', u'ost', u'alternative rock', u'beautiful', u'anime soundtrack', u'monoral', u'emotional', u'melancholic', u'best anime soundtracks', u'atmospheric', u'cool', u'00s', u'jrock', u'anime op', u'sad', u'theme', u'deep', u'melancholy', u'ethereal', u'great lyrics', u'Favourites', u'love at first listen', u'Japanese music', u'sountrack', u'Anime music', u'nocturne', u'makes me feel free', u'i want to marry this track', u'Anime OPs', u'amazing opening and song', u'a different dimension', u'anti-gravity', u'makes my heart go faster', u'ergo proxy ost', u'indie', u'post-rock', u'downtempo', u'2008', u'Love', u'new age', u'melodic', u'JPop', u'great', u'japan']"
28,Truth,129861,696172,258000,"[u'indie', u'folk', u'whistle', u'Breaking Bad', u'makes me want to learn how to whistle', u'chill', u'alternative', u'singer-songwriter', u'acoustic', u'indie folk', u'male vocalists', u'FUCKING AWESOME', u'Alex Ebert', u'chillout', u'country', u'female vocalists', u'Love', u'groove', u'Dreamy', u'beauty', u'Mellow', u'melancholy', u'fip', u'folk pop', u'Alternative Folk', u'relax', u'out there', u'lovely', u'love at first listen', u'whistling', u'indie-pop', u'perfect', u'Remember', u'2012', u'fuck yeah', u'ZicCool', u'Soundtrack des Lebens', u'as good as it gets', u'czHit', u'team coco', u'easy', u'want', u'margot', u'alt-folk', u'chillax', u'desert island', u'zicdanse', u'zictop', u'RZA', u'alt-pop']"
29,"Porpoise Song - Theme from ""Head""",6050,12960,0,"[u'psychedelic', u'dream pop', u'sixties', u'genre: psychedelic rock', u'genre: psychedelic pop', u'radio-moonlight-psychedelic pop', u'type: dark song', u'radio-moonlight-dark songs', u'type: soundtrack', u'tag: play this at my funeral', u'type: gothic hippie', u'type: hippie music', u'type: sad song', u'tag: awesome singing voice', u'tag: awesome musical sound']"
30,Tentacles (Teddy Killerz Remix),231,435,211000,[]
31,Mantra (Mat Zo Remix),325,632,265000,[]
32,Crying for No Reason,56356,443481,221000,"[u'pop', u'Ballad', u'synth', u'love at first listen', u'dance', u'Love', u'dance pop', u'2014', u'katy b', u'british', u'female vocalists', u'rnb', u'female vocals', u'female vocalist', u'crying', u'adorable', u'fucking incredible', u'balada', u'bbc radio1 playlist 2014', u'one of my favorite songs of all time', u'Britpop indie', u'permanent record', u'2013 single', u'britanic', u'synth ballad', u'graham norton', u'awesome :O', u'love at firsten listen', u'linedance 2014', u'2014 singles', u'the kid needed her mother', u'2014 bitches', u'indicated', u'MyNewMusicPicksOfTheWeek', u'acoustic looks better']"
33,Lights On (single mix) (feat. Ms Dynamite),207,887,0,[]
34,Katy on a Mission,225768,1337744,219000,"[u'dubstep', u'british', u'electronic', u'female vocalists', u'katy b', u'Katy On a Mission', u'dance', u'electro', u'funky', u'breakbeat', u'pop', u'Grime', u'electronica', u'Drum and bass', u'female vocals', u'female vocalist', u'UK Garage', u'must be played at full volume', u'Hip-Hop', u'vocal', u'rap', u'funk', u'synth', u'Energetic', u'r&b', u'party', u'Like', u'amazing', u'rnb', u'garage', u'love at first listen', u'alternative hip-hop', u'2010', u'checkitout', u'gangsta', u'dub-step', u'danceable', u'chart', u'uk funky', u'loopy', u'if this were a pokemon i would catch it', u'my party is better than yours', u'Popstep', u'Vocal dubstep', u'DeanMarkTaylorLoved', u'Dubstep Select', u'festival playlist', u'boss dubstep', u'KatyB Katy on A Mission', u'digital']"
35,Katy on a Mission,225768,1337744,219000,"[u'dubstep', u'british', u'electronic', u'female vocalists', u'katy b', u'Katy On a Mission', u'dance', u'electro', u'funky', u'breakbeat', u'pop', u'Grime', u'electronica', u'Drum and bass', u'female vocals', u'female vocalist', u'UK Garage', u'must be played at full volume', u'Hip-Hop', u'vocal', u'rap', u'funk', u'synth', u'Energetic', u'r&b', u'party', u'Like', u'amazing', u'rnb', u'garage', u'love at first listen', u'alternative hip-hop', u'2010', u'checkitout', u'gangsta', u'dub-step', u'danceable', u'chart', u'uk funky', u'loopy', u'if this were a pokemon i would catch it', u'my party is better than yours', u'Popstep', u'Vocal dubstep', u'DeanMarkTaylorLoved', u'Dubstep Select', u'festival playlist', u'boss dubstep', u'KatyB Katy on A Mission', u'digital']"
36,Puppy,46683,288188,260000,"[u'House', u'Drum and bass', u'dance', u'electro house', u'electronic', u'electro', u'happy', u'EDM', u'electronica', u'energy', u'techno', u'club', u'summer', u'Progressive House', u'tech-house', u'belgian', u'2012', u'dynamic', u'4 minute songs', u'exciting', u'Hospital Records', u'electrohouse', u'spannend', u'dynamique', u'Southside', u'dynamisch', u'puppy', u'Dinamico', u'excitant', u'dinamican']"
37,Thunder (feat. Emeli Sandé),1376,6816,0,[]
38,Memory Lane,37897,244505,335000,"[u'liquid funk', u'Drum and bass', u'Drum n Bass', u'dnb', u'mainstream', u'electronic', u'Liquid', u'british', u'ambient', u'Awesome', u'melodic', u'summer', u'Uplifting', u""drum'n'bass"", u'drum & bass', u'2010', u'FUCKING AWESOME', u'feelgood', u'drumandbass', u'Hospital Records', u""drum 'n' bass"", u'fucking great', u""D'n'B"", u'drum&bass', u'd&b', u'Ohrgasmus', u'Awesome DnB', u'ukf', u'auflegen', u'ukf drum and bass', u'keeping me alive', u'Endlazer', u'songs from friends of stretchead']"
39,Come Alive,62810,387500,248000,"[u'Drum and bass', u'drumstep', u'Drum n Bass', u'electronic', u'electronica', u'synthpoppers', u'dubstep', u'dance', u'dnb', u'drum & bass', u'Hospital Records', u'Netsky', u'Lucky Charms', u'seen live', u'dub', u'synth pop', u'Drum', u'neurofunk', u'synthpop', u'female vocals', u'belgian', u'2012', u'dynamic', u'n-a', u'4 minute songs', u'powerful', u'exciting', u'Belgisch', u""D'n'B"", u'kraftvoll', u'scatter funk', u'spannend', u'dynamique', u'Southside', u'dynamisch', u'mocno', u'Dinamico', u'excitant', u'dinamican', u'eccitante', u'vigoroso', u'vigoureux']"
40,Work It Out (Feat. Digital Farm Animals),2384,11369,0,[u'Drum and bass']
41,Secret Agent,62061,387046,334000,"[u'Drum and bass', u'liquid funk', u'Drum n Bass', u'dnb', u'electronic', u'Hospital Records', u'dance', u'Awesome', u'neurofunk', u'drum & bass', u'addictive', u'Netsky', u'electronica', u'dubstep', u'melodic', u'Liquid', u'loved', u'2011', u'belgian', u'2010', u'Electrostep', u'dynamic', u'5 minute songs', u'powerful', u'exciting', u""drum 'n' bass"", u""D'n'B"", u'liquid dnb', u'kraftvoll', u'spannend', u'prevalent use of groove', u'trippy soundscapes', u'rozpierdol', u'dynamique', u'dynamisch', u'mocno', u'skins us', u'Endlazer', u'elektronik for stretch', u'Dinamico', u'songs that are perfectly in sync with my avatar', u'DX7 EP', u'excitant', u'dinamican', u'eccitante', u'uzbudljiv', u'vigoroso', u'vigoureux']"
42,Rio (feat. Digital Farm Animals),2752,14572,247000,[u'Drum and bass']
43,Eyes Closed,66799,374656,379000,"[u'liquid funk', u'Drum and bass', u'dnb', u'Drum n Bass', u'memories', u'melodic', u'Uplifting', u'drum & bass', u'Electrostep', u'dynamic', u'exciting', u'Netsky', u'spannend', u'dynamique', u'happy dnb', u'dynamisch', u'Dinamico', u'the best of the bests', u'excitant', u'dinamican', u'eccitante', u'uzbudljiv']"
44,Puppy,46683,288188,260000,"[u'House', u'Drum and bass', u'dance', u'electro house', u'electronic', u'electro', u'happy', u'EDM', u'electronica', u'energy', u'techno', u'club', u'summer', u'Progressive House', u'tech-house', u'belgian', u'2012', u'dynamic', u'4 minute songs', u'exciting', u'Hospital Records', u'electrohouse', u'spannend', u'dynamique', u'Southside', u'dynamisch', u'puppy', u'Dinamico', u'excitant', u'dinamican']"
45,Thunder (feat. Emeli Sandé),1376,6816,0,[]
46,Memory Lane,37897,244505,335000,"[u'liquid funk', u'Drum and bass', u'Drum n Bass', u'dnb', u'mainstream', u'electronic', u'Liquid', u'british', u'ambient', u'Awesome', u'melodic', u'summer', u'Uplifting', u""drum'n'bass"", u'drum & bass', u'2010', u'FUCKING AWESOME', u'feelgood', u'drumandbass', u'Hospital Records', u""drum 'n' bass"", u'fucking great', u""D'n'B"", u'drum&bass', u'd&b', u'Ohrgasmus', u'Awesome DnB', u'ukf', u'auflegen', u'ukf drum and bass', u'keeping me alive', u'Endlazer', u'songs from friends of stretchead']"
47,Come Alive,62810,387500,248000,"[u'Drum and bass', u'drumstep', u'Drum n Bass', u'electronic', u'electronica', u'synthpoppers', u'dubstep', u'dance', u'dnb', u'drum & bass', u'Hospital Records', u'Netsky', u'Lucky Charms', u'seen live', u'dub', u'synth pop', u'Drum', u'neurofunk', u'synthpop', u'female vocals', u'belgian', u'2012', u'dynamic', u'n-a', u'4 minute songs', u'powerful', u'exciting', u'Belgisch', u""D'n'B"", u'kraftvoll', u'scatter funk', u'spannend', u'dynamique', u'Southside', u'dynamisch', u'mocno', u'Dinamico', u'excitant', u'dinamican', u'eccitante', u'vigoroso', u'vigoureux']"
48,Work It Out (Feat. Digital Farm Animals),2384,11369,0,[u'Drum and bass']
49,Didn't Know,3463,13742,0,[]
50,Only One (Blonde vs Sigala Remix),17,38,336000,[]
51,Wanna Know (feat. R. Kelly),27,74,183000,[]
52,True,4247,13619,184000,[]
53,Digital Love (feat. Hailee Steinfeld),3196,8723,0,"[u'pop', u'dance', u'House', u'electro house', u'dance pop', u'Hailee Steinfeld']"
54,Millionaire (feat. Nelly),2741,8949,0,[]
55,Maps,297817,2618028,190000,"[u'pop', u'2014', u'love at first listen', u'FollowingFollowingFollowing', u'maroon 5', u'pop rock', u'v', u'adam levine', u'best of 2014', u'ryan tedder', u'american', u'male vocalists', u'Maps', u'snl', u'2014 single', u'viciado nessa merda', u'chillout', u'male', u'chill', u'dance', u'catchy', u'world', u'Awesome', u'feel good', u'Hope', u'3', u'summer', u'r&b', u'California', u'nice', u'World Music', u'male vocalist', u'00s', u'texas', u'Colorado', u'Favorite', u'top 40', u'fav', u'english', u'Nebraska', u'hits', u'addictive', u'annoying', u'I love this song', u'Love it', u'10s', u'fallon', u'actor', u'6 of 10 stars', u'billboard']"
56,Sugar,335547,2813753,235000,"[u'pop', u'katy perry birthday', u'katy perry', u'love at first listen', u'10 of 10 stars', u'Birthday', u'pop rock', u'2015', u'Disco', u'rock', u'american', u'sugar', u'catchy', u'male vocalists', u'falsetto', u'best of 2015', u'happy and upbeat', u'Birthday cover', u'electronic', u'soul', u'alternative rock', u'indie pop', u'happy', u'Love', u'epic', u'funk', u'romantic', u'Awesome', u'guitar', u'feel good', u'upbeat', u'prince', u'road', u'summer', u'cool', u'male vocalist', u'Ballad', u'top 40', u'Beach', u'5 Stars', u'hits', u'maroon 5', u'sweet', u'boring', u'design', u'Love it', u'10s', u'pink', u'2010s', u'party time']"
57,The Lazy Song,514281,3091304,195000,"[u'pop', u'Bruno Mars', u'rnb', u'reggae', u'lazy', u'male vocalists', u'lazy song', u'2011', u'bruno', u'acoustic', u'funny', u'american', u'summer', u'The Lazy Song', u'chillout', u'chill', u'guitar', u'r&b', u'no matter where i am I MUST SING ALONG', u'fun', u'love at first listen', u'2010', u'10s', u'2010s', u'slow jams', u'Carefree', u'songs that restore my faith in humanity', u'singer-songwriter', u'happy', u'Awesome', u'upbeat', u'cool', u'good', u'Favorite', u'relax', u'whistling', u'hawaii', u'the beach', u'la la la', u'whistle', u'my theme song', u'reggae pop', u'uk number one', u'feels like summertime', u'kocham', u'all about maggie', u'beach tunes', u'pop music tag', u'summer 2011 song for me', u'male']"
58,24K Magic,151201,968054,0,"[u'funk', u'pop', u'bomba', u'Disco', u'party', u'80s', u'american', u'r&b', u'Trash', u'boogie', u'electrofunk', u'snl', u'lixo', u'hino', u'Pop 90s', u'boogie funk', u'farofa', u'dangerous man', u'machista', u'best of 2016', u'2016 single', u'bbc radio1 playlist 2016', u'machista nojento']"
59,When I Was Your Man,398191,2879425,213000,"[u'pop', u'Bruno Mars', u'piano', u'american', u'great song', u'Love', u'male vocalists', u'Ballad', u'r&b', u'rnb', u'soul', u'2013', u'10s', u'sad', u'When I Was Your Man', u'dance', u'slow', u'male vocalist', u'love songs', u'2012', u'FUCKING AWESOME', u'<3', u'bruno', u'chorar', u'Bruno Mars -  when I was your man', u'rock', u'singer-songwriter', u'calm', u'cute', u'acoustic', u'adult contemporary', u'romantic', u'Awesome', u'Retro', u'Miserable', u'lovesong', u'soft', u'favourite', u'elegant', u'inspirational', u'best song ever', u'Favorite', u'heartbreak', u'relax', u'fav', u'love at first listen', u'5 Stars', u'Great Lyricists', u'wow', u'Perfection']"
60,It Will Rain,238987,1776551,253000,"[u'pop', u'Love', u'soul', u'Bruno Mars', u'Soundtrack', u'male vocalists', u'love at first listen', u'<3', u'it will rain', u'sad', u'easy listening', u'rnb', u'rain', u'10s', u'epic', u'american', u'r&b', u'Ballad', u'makes me cry', u'2010s', u'twilight', u'bruno', u'breaking dawn', u'fav888', u'singer-songwriter', u'love songs', u'2011', u'FUCKING AWESOME', u'Mars', u'it', u'will', u'fave singer-songwriters', u'chillout', u'rock', u'catchy', u'cute', u'soft rock', u'adult contemporary', u'romantic', u'90s', u'vocals', u'Mellow', u'ost', u'1', u'amazing', u'Rainy Day', u'favourite', u'great song', u'loved', u'Favorite']"
61,Grenade,500117,4401821,222000,"[u'pop', u'Bruno Mars', u'rnb', u'male vocalists', u'Grenade', u'r&b', u'2010', u'sad', u'weicheisongs', u'soul', u'Love', u'male vocalist', u'bruno', u'emotional', u'american', u'coolelyrics', u'singer-songwriter', u'dance', u'2011', u'heartbreak', u'2010s', u'CD', u'wdzh-FM', u'Ballad', u'<3', u'hit', u'West Coast swing', u'wkqi-fm', u'favorites', u'catchy', u'Awesome', u'amazing', u'love songs', u'10s', u'Hip-Hop', u'male', u'sexy', u'pop rock', u'piano', u'crazy', u'depressing', u'00s', u'rock band', u'love at first listen', u'hawaii', u'8 of 10 stars', u'pain', u'breakup', u'FUCKING AWESOME', u'slow jams']"
62,Just the Way You Are,646534,5317890,219000,"[u'pop', u'Bruno Mars', u'rnb', u'Love', u'male vocalists', u'2010', u'Just the Way You Are', u'r&b', u'american', u'romantic', u'piano', u'Ballad', u'love at first listen', u'<3', u'happy', u'catchy', u'love songs', u'addictive', u'singer-songwriter', u'favorites', u'10s', u'bruno', u'soul', u'male vocalist', u'beautiful', u'Awesome', u'amazing', u'love song', u'2010s', u'hip hop', u'r and b', u'2011', u'dance', u'pop rock', u'bass', u'new', u'rhythm and blues', u'chillin', u'ballads', u'glee', u'bruno mars - just the way you are', u'wkqi-fm', u'wdzh-FM', u'easy listening', u'kiss', u'lovesongs', u'billboard number ones', u'us top 40', u'all about love', u'billboard top 10']"
63,Runaway Baby,230895,1414595,147000,"[u'pop', u'Bruno Mars', u'rnb', u'Energetic', u'rock', u'soul', u'bouncy', u'love at first listen', u'pop rock', u'american', u'r&b', u'alternative', u'singer-songwriter', u'great', u'2010', u'10s', u'makes me want to dance', u'bruno', u'male-vocalist', u'pop music tag', u'Runaway Baby', u'Soundtrack', u'alternative rock', u'rap', u'sexy', u'dance', u'funk', u'crazy', u'1', u'fun', u'fip', u'cool', u'male vocalists', u'hawaii', u'running', u'personal favourites', u'party time', u'CD', u'6 of 10 stars', u'singalong', u'<3', u'foot-tapping', u'best of 2011', u'walk', u'Hooligan', u'if this were a pokemon i would catch it', u'core', u'runaway', u'cool singer', u'probably contains an addictive substance like crack']"
64,Locked Out of Heaven,539905,4418380,233000,"[u'pop', u'Bruno Mars', u'rnb', u'2012', u'10s', u'male vocalists', u'locked out of heaven', u'dance', u'cant even express how much i love this song', u'american', u'r&b', u'best of 2012', u'bruno', u'love at first listen', u'2010s', u'pop rock', u'funk', u'Favorite', u'electronic', u'soul', u'Love', u'<3', u'heaven', u'Reggae Rock', u'rock', u'sexy', u'favorites', u'party', u'cool', u'top 40', u'love song', u'Faves', u'hit', u'best of 2013', u'want to see in concert', u'Mark Ronson', u'i had to get up and dance', u'jeff bhasker', u'10s pop', u'2012 pop', u'indie', u'male', u'hip hop', u'alternative', u'singer-songwriter', u'USA', u'memories', u'happy', u'catchy', u'new wave']"
65,Treasure,369995,2655133,178000,"[u'pop', u'funk', u'Disco', u'Treasure', u'Bruno Mars', u'american', u'male vocalists', u'10s', u'dance', u'Love', u'funky', u'rnb', u'soul', u'r&b', u'party', u'nu disco', u'hip hop', u'chill', u'sexy', u'dance-pop', u'melodic', u'guitar', u'summer', u'cool jazz', u'great song', u'male vocalist', u'guilty pleasure', u'2013', u'Favorite', u'love at first listen', u'hawaii', u'slap bass', u'2012', u'FUCKING AWESOME', u'light', u'4 Stars', u'best of 2012', u'actor', u'singalong', u'Lovers', u'20s', u'positive', u'Hawaiian', u'80s style', u'hit', u'best of 2013', u'snl', u'should be a single', u'Makes Me Smile', u'bruno']"
66,That's What I Like,81690,442854,206000,"[u'funk', u'pop', u'soul', u'Retro', u'american', u'rnb', u'love at first listen', u'Eargasm', u'badass', u'best', u'2017 single', u'bbc radio1 playlist 2017', u'mj vibes']"
67,Marry You,372875,2551048,230000,"[u'pop', u'Bruno Mars', u'rnb', u'makes me crave love', u'Love', u'cute', u'marry you', u'male vocalists', u'2011', u'upbeat', u'american', u'2010', u'dance', u'Sigh and swoon in equal measure', u'10s', u'charming', u'happy', u'romantic', u'beautiful', u'emotional', u'male vocalist', u'love at first listen', u'wedding', u'makes me happy', u'glee', u'pop music tag', u'jazzyslovedtracks 01', u'jazzyfunL-Z', u'soul', u'singer-songwriter', u'favorites', u'great', u'great lyrics', u'rock band', u'sweet', u'feelgood', u'partytime', u'rock band dlc', u'bruno', u'songs I am completely obsessed with', u'songs that restore my faith in humanity', u'more than favourite', u'no matter where i am I MUST SING ALONG', u'proposal', u'this song is for you', u'new pop of 2013', u'chillout', u'chill', u'rock', u'alternative rock']"
68,ELEMENT.,79773,320232,208000,"[u'Hip-Hop', u'hiphop', u'conscious hip-hop', u'Diss', u'2pac', u'tupac shakur', u'west coast hip-hop', u'big sean', u'lil bitch']"
69,You Don't Know Me (feat. RAYE),4507,26823,0,"[u'british', u'House', u'london', u'tune']"
70,Shape of You,199442,2009174,234000,"[u'pop', u'best of 2017', u'dancehall', u'sia', u'hino', u'2017', u'dance', u'catchy', u'tropical house', u'Ed Sheeran', u'electronic', u'british', u'dance-pop', u'funk', u'beautiful', u'new', u'rnb', u'male vocalists', u'tropical', u'single', u'10s', u'fallon', u'Be my baby', u'snl', u'king of pop', u'tlc', u'wake-up song', u'uk number one', u'us number one', u'No Scrubs', u'smash hit', u'farofa', u'superpop', u'german number one', u'fode essa buceta', u'playlista rmf fm', u'post-nerdcore', u'australian number one', u'i love cheap thrills', u'2017 single', u'muito cheap thrills sim', u'bbc radio1 playlist 2017', u'Sia Felings', u'singer-somngwriter']"
71,Fire (feat. Max Marshall),296,1719,182000,[]
72,Don't Look Back (feat. Tanya Lacey),962,6082,240000,"[u'Drum and bass', u'Drum n Bass', u'2014']"
73,All I Know (M&F's Rolling Out DJ Mix) [feat. Luke Bingham],79,318,0,[]
74,Magnetic Eyes (Extended DJ Mix) (feat. Baby Blue),33,260,0,[]
75,CONTROL (FEAT. MAX MARSHALL),1657,16857,194000,[]
76,Universal Truth,24683,99973,339000,"[u'Drum and bass', u'dnb', u'electronic', u'jungle', u'metal', u'electronica', u'80s', u'upbeat', u'atmospheric', u'Drum n Bass', u'liquid funk', u'summer', u'scifi', u'loved', u'guitars', u'eee', u'machine', u'futurestep', u'annie mac', u'electronic and trance', u'hangarba', u'awesome :O']"
77,Steal My Heart (feat. Youngman) [VIP],32,51,0,[]
78,Cobra (VIP),71,113,0,[]
79,Shake It On,15371,37747,314000,[u'Disco']
80,Shape of You,200398,1996760,234000,"[u'pop', u'best of 2017', u'dancehall', u'sia', u'hino', u'2017', u'dance', u'catchy', u'tropical house', u'Ed Sheeran', u'electronic', u'british', u'dance-pop', u'funk', u'beautiful', u'new', u'rnb', u'male vocalists', u'tropical', u'single', u'10s', u'fallon', u'Be my baby', u'snl', u'king of pop', u'tlc', u'wake-up song', u'uk number one', u'us number one', u'No Scrubs', u'smash hit', u'farofa', u'superpop', u'german number one', u'fode essa buceta', u'playlista rmf fm', u'post-nerdcore', u'australian number one', u'i love cheap thrills', u'2017 single', u'muito cheap thrills sim', u'bbc radio1 playlist 2017', u'Sia Felings', u'singer-somngwriter']"
