,Songs,Listeners,Playcount,Duration,Tags
115,Love Is the Devil (And I Am in Love),20375,131551,283000,"[u'Post-Black Metal', u'Progressive metal', u'icelandic', u'Post-Metal', u'metal', u'melancholic', u'doom metal', u'atmospheric', u'Progressive', u'Suicidal Black Metal', u'post metal', u'post black metal', u'fave songs', u'obsessive', u'me like']"
116,I Wanna Be Your Dog,4707,21410,193000,"[u'cover', u'black metal', u'metal', u'Suicidal Black Metal', u'depressive black metal', u'DSBM', u'Depressive Suicidal Black Metal', u'stooges cover', u'stooges', u'iggy pop should be really proud']"
117,Murder,60772,368365,294000,"[u'doom metal', u'death metal', u'metal', u'Gothic Metal', u'Death Doom Metal', u'death-doom metal', u'swedish', u'Progressive metal', u'Doom', u'melancholic', u'Sweden', u'Swedish Metal', u'depressive rock', u'melancholy', u'1996', u'death doom', u'Dark metal', u'a place for people with that tiny black spot on their brain to go when the darkness leaks out and does what it wills', u'Katatonia', u'mikael akerfeldt', u'depressive metal', u'Katatonia - Murder', u'seen live', u'rock', u'goth', u'dark', u'Gothic', u'shoegaze', u'beautiful', u'90s', u'death', u'atmospheric', u'fav', u'8 of 10 stars', u'autumn', u'1990s', u'Favourite Songs', u'everything', u'depressive', u'ss', u'doom death metal', u'sw', u'bloody', u'death-doom', u'silent intensity', u'best of 1996', u'Death/Doom Metal', u'death/doom', u'deathfuck', u'Zaebis']"
118,Rainroom,50779,300024,391000,"[u'doom metal', u'metal', u'death metal', u'Progressive metal', u'Death Doom Metal', u'Gothic Metal', u'swedish', u'atmospheric', u'Swedish Metal', u'black metal', u'Melodic Death Metal', u'great', u'melancholic', u'Sweden', u'1996', u'depressive', u'Dark metal', u'death-doom metal', u'mikael akerfeldt', u'death-doom', u'best of 1996', u'depressive metal', u'Katatonia - Rainroom', u'sad', u'90s', u'Doom', u'Progressive', u'melancholy', u'interesting', u'8 of 10 stars', u'Masterpiece', u'4 Stars', u'6 of 10 stars', u'awesomeness', u'everything', u'gloomy', u'depressive rock', u'melodic doom metal', u'doomdeath', u'Katatonia', u'All-time favourites', u'Killer', u'Melodic Death Doom Metal', u'Death/Doom Metal', u'death/doom', u'peaceville', u'Zaebis', u'depressive doom metal', u'me like', u'rainy day song']"
119,Lady In Black,10161,41708,0,"[u'heavy metal', u'lib', u'satanjeff', u'SIMONJAIME', u'KING KING KING 777']"
120,Day,56758,388793,268000,"[u'doom metal', u'depressive', u'melancholic', u'beautiful', u'depressive rock', u'atmospheric', u'Progressive metal', u'metal', u'Doom', u'Gothic Metal', u'melancholy', u'rock', u'sad', u'depressing', u'Dark metal', u'Gothic', u'death metal', u'Sweden', u'Katatonia', u'swedish', u'Progressive rock', u'dark', u'post-punk', u'nostalgic', u'1996', u'depressive metal', u'slgdm', u'Favorite Bands', u'emo', u'favorites', u'shoegaze', u'psychedelic', u'night', u'90s', u'Progressive', u'winter', u'great', u'alternative metal', u'original', u'ethereal', u'favourite', u'emotional', u'good', u'Gothic Rock', u'rain', u'depression', u'Favourites', u'brilliant', u'Female Voices', u'8 of 10 stars']"
121,A Darkness Coming,48964,270967,316000,"[u'doom metal', u'Gothic Metal', u'Progressive metal', u'depressive rock', u'metal', u'swedish', u'melancholic', u'Katatonia', u'Doom', u'mournful guitar', u'rock', u'alternative', u'Progressive rock', u'slow', u'3', u'Progressive', u'progressive doom metal', u'from: sweden', u'Favorite guitar solos', u'chillout metal', u'reminds me of someone', u'reminds me of something', u'nieco melancholicke', u'LiebeLiebeLiebe', u'Tonights Decision', u'q3', u'highly emotional', u'Angenoma', u'stimmen in mein Kopf', u'Katatonia -A Darkness Coming']"
122,Springtime Depression,12503,75396,290000,"[u'depressive black metal', u'melancholic', u'instrumental', u'depressive', u'doom metal', u'Doom', u'Suicidal Black Metal', u'black metal', u'emotional', u'suicidal', u'beautiful', u'atmospheric', u'dark folk', u'goosebumps', u'beautiful melancholy', u'to try', u'All-Time Faves', u'Music to commit suicide to', u'Instrumental Doom Metal', u'Beautifully Depressing', u'fucking stunning', u'seamless transition from previous track']"
123,By the Time You Read This (I Will Already Be Dead),12813,84595,389000,"[u'doom metal', u'gothic doom', u'blackened doom', u'black metal', u'Black Doom Metal', u'suicide song', u'green metal', u'fucking intense', u'me like']"
124,Her Alone,48903,364593,466000,"[u'Progressive metal', u'Melodic Death Metal', u'metal', u'death metal', u'doom metal', u'My favourite ballad', u'epic', u'finnish', u'Amorphis', u'melancholic atmospheric ballad metal', u'heavy metal', u'amazing', u'Gothic Metal', u'melancholic', u'Ballad', u'Passion', u'progressive doom metal', u'melancholic metal', u'metal ballad', u'damn good', u'reminds me of someone special', u'reminds me of a nice girl', u'Soundtrack', u'seen live', u'favorite songs', u'Love', u'romantic', u'folk metal', u'melodic', u'Dreamy', u'hypnotic', u'great lyrics', u'00s', u'9 of 10 stars', u'melodic metal', u'FUCKING AWESOME', u'Masterpiece', u'2000s', u'One of the best', u'Favourite Songs', u'favs', u'dreaming', u'finland', u'best songs ever', u'uwielbiam', u'All time favourites', u'death-doom metal', u'suomi metal', u'gothic doom', u'excellent song']"
125,Will You Share This Ending With Me? (digital bonus track),334,950,339000,[]
126,Canitude,1000,7606,498000,[]
127,Departure,968,6490,412000,[]
128,Springtime Depression,12503,75396,290000,"[u'depressive black metal', u'melancholic', u'instrumental', u'depressive', u'doom metal', u'Doom', u'Suicidal Black Metal', u'black metal', u'emotional', u'suicidal', u'beautiful', u'atmospheric', u'dark folk', u'goosebumps', u'beautiful melancholy', u'to try', u'All-Time Faves', u'Music to commit suicide to', u'Instrumental Doom Metal', u'Beautifully Depressing', u'fucking stunning', u'seamless transition from previous track']"
129,By the Time You Read This (I Will Already Be Dead),12813,84595,389000,"[u'doom metal', u'gothic doom', u'blackened doom', u'black metal', u'Black Doom Metal', u'suicide song', u'green metal', u'fucking intense', u'me like']"
130,Her Alone,48903,364593,466000,"[u'Progressive metal', u'Melodic Death Metal', u'metal', u'death metal', u'doom metal', u'My favourite ballad', u'epic', u'finnish', u'Amorphis', u'melancholic atmospheric ballad metal', u'heavy metal', u'amazing', u'Gothic Metal', u'melancholic', u'Ballad', u'Passion', u'progressive doom metal', u'melancholic metal', u'metal ballad', u'damn good', u'reminds me of someone special', u'reminds me of a nice girl', u'Soundtrack', u'seen live', u'favorite songs', u'Love', u'romantic', u'folk metal', u'melodic', u'Dreamy', u'hypnotic', u'great lyrics', u'00s', u'9 of 10 stars', u'melodic metal', u'FUCKING AWESOME', u'Masterpiece', u'2000s', u'One of the best', u'Favourite Songs', u'favs', u'dreaming', u'finland', u'best songs ever', u'uwielbiam', u'All time favourites', u'death-doom metal', u'suomi metal', u'gothic doom', u'excellent song']"
131,Will You Share This Ending With Me? (digital bonus track),334,950,339000,[]
132,Canitude,1000,7606,498000,[]
133,Black Erotica,8560,32250,549000,"[u'doom metal', u'metal', u'seen live', u'rock', u'Progressive metal', u'death metal', u'Gothic Metal', u'7 of 10 stars', u'Death/Doom Metal', u'so dark', u'the title']"
134,Nón,20018,95842,467000,"[u'Post-Black Metal', u'metal']"
135,Forever Failure,53181,336480,258000,"[u'Gothic Metal', u'doom metal', u'metal', u'Gothic Doom Metal', u'Gothic', u'seen live', u'british', u'melancholic', u'Paradise Lost', u'8 of 10 stars', u'Charles Manson', u'obsessive', u'fuck hope', u'makes my flesh creep', u'Soundrack to my suicide', u'heavy metal', u'rock', u'goth', u'sad', u'favorites', u'Love', u'Awesome', u'Melodic Death Metal', u'atmospheric', u'ominous', u'Doom', u'melancholy', u'emotional', u'loved', u'male vocalist', u'great lyrics', u'brilliant', u'psycho', u'9 of 10 stars', u'makes me cry', u'Masterpiece', u'10 of 10 stars', u'6 of 10 stars', u'atmospheric doom metal', u'Atmospheric metal', u'Dark metal', u'Guitar Solo', u'serial killer', u'All time favourites', u'my life', u'fucking incredible', u'uk metal', u'psychedelic doom', u'atonement', u'nice lyrics']"
136,Megalomaniac,1277,6629,430000,"[u'black metal', u'great video']"
137,Nowhere,24778,121595,368000,"[u'doom metal', u'metal', u'Progressive metal', u'masterpieces', u'death doom', u'death metal', u'Death Doom Metal', u'mikael akerfeldt', u'swedish', u'Doom', u'Progressive', u'Gothic Metal', u'8 of 10 stars', u'goth metal', u'death/doom', u'my ringtone', u'Melancholisches Zeug']"
138,Losing Tomorrow,18306,87813,155000,"[u'doom metal', u'melancholic', u'atmospheric', u'depression', u'sad', u'male vocals', u'depressive', u'songs to listen while looking at an empty white wall', u'ambient', u'beautiful', u'Doom', u'deep', u'melancholy', u'7 of 10 stars', u'sorrow', u'songs that i will still be listening to in a billion years', u'Death/Doom Metal', u'Torquemada', u'absolute favorite', u'my beloved', u'me like', u'Jonas renkse', u'You make me cry when I want to', u'my doom', u'songs to hear before i die', u'cloudy autumn', u'tomorrow is another day', u'way too short but still amazing']"
139,At Last,23831,112718,374000,"[u'doom metal', u'metal', u'death metal', u'swedish', u'Gothic Metal', u'melancholic', u'Dark metal', u'Progressive metal', u'black metal', u'seen live', u'rock', u'alternative', u'Progressive rock', u'Gothic', u'Melodic Death Metal', u'Doom', u'melancholy', u'8 of 10 stars', u'depressive rock', u'depressive', u'Death Doom Metal', u'doomdeath', u'Katatonia', u'mikael akerfeldt', u'dynder', u'Z3PO like this', u'featuring the brilliant mikael akerfeldt', u'i would die without this band']"
140,In The Sleep Of Death,11795,50232,490000,"[u'metal', u'doom metal', u'death metal', u'black metal', u'Avant-garde Metal', u'Gothic Doom Metal']"
141,Runaway Train,1042,3686,429000,"[u'metal', u'cover']"
142,Intro,18209,111300,126000,"[u'black metal', u'depressive black metal', u'atmospheric black metal', u'Suicidal Black Metal', u'instrumental', u'ambient black metal', u'Suicide Black Metal', u'metal', u'ambient', u'USA', u'intro', u'atmospheric', u'dark ambient', u'black ambient', u'stupid', u'USBM', u'Megadeth', u'one man metal', u'white power', u'White Pride', u'venomintovein favs', u'really stupid']"
143,Into The Indigo Abyss,3023,10314,240000,[]
144,The Dreaming Eye,3250,12674,606000,[]
145,Consummation,3542,13899,1011000,[]
146,Tides Of Oneiric Darkness,5212,19201,333000,[]
147,Breath And Levitation,4355,17480,562000,"[u'atmospheric black metal', u'dark ambient', u'ambient black metal', u'dark', u'ominous', u'eerie', u'occultism']"
148,III-6,1569,6739,0,[u'black metal']
149,III-5,1629,7802,0,[u'black metal']
150,III-4,1684,7382,0,[u'black metal']
151,III-3,1811,8017,0,"[u'black metal', u'holy shit']"
152,III-2,1871,8780,0,"[u'black metal', u'instrumental', u'atmospheric black metal', u'oppressive']"
153,III-1,2032,10225,0,"[u'black metal', u'instrumental', u'atmospheric black metal']"
154,Castigation and Betrayal,18248,107007,242000,"[u'my cat died when this played', u'ive just been hit by a fucking train omfg', u'holy jesus what the fuck', u'most brutal ever', u'blacker than the blackest black times infinity', u'black metal', u'grindcore', u'metal', u'What the fuck was that', u'anal tract vomiting', u'when I heard this I was half-drunk in the afternoon and maybe that clouded my judgement but I dont know I think i like it', u'i want to die but in a good way', u'easy listening', u'death metal', u'the lullaby of chuck norris', u'good evening old chap the weather is certainly marvellous today', u'heavy metal', u'UK', u'screamo', u'4', u'brilliant', u'Extreme Metal', u'omfg', u'pain', u'chaos', u'fuck', u'love on first listen', u'music to fuck to', u'5', u'headphones', u'transcendental', u'brutal black metal', u'what the fuck', u'earthbound', u'final battle', u'Anaal Nathrakh', u'giygas', u'pandemonic hyperblast', u'psychotic necro metal', u'Killer', u'the most frostbitten and grim music from the very very very very very very inverted mountains of Kxziiiimfghhhblaghl', u'oh my fucking god', u'closing track', u'Brutal as Fuck', u'i have to change my underwear after this song', u'FUCKING INSANE', u'heaviest song ever', u'infernal', u'black grind', u'great track to hear with headphones']"
155,Sanction Extremis (Kill Them All),19292,106151,212000,"[u'black metal', u'grindcore', u'metaaaaaaal', u'goregrind', u'deathfuck', u'metal', u'a place for people with that tiny black spot on their brain to go when the darkness leaks out and does what it wills', u'serial killer soundtrack', u'rape roleplay', u'Warhammer 40k', u'porngrind', u'choked out', u'Progressive metal', u'UK', u'death metal', u'brutal black metal', u'heavy funk', u'black grind', u'anal masturbation', u'extreme insanity']"
156,Genetic Noose,19762,114772,214000,"[u'black metal', u'grindcore', u'necro metal', u'metal', u'death metal', u'industrial black metal', u'UK', u'industrial', u'Gothic Metal', u'groovy', u'guest vocals', u'Extreme', u'awesome vocals', u'brutal black metal', u'Sick Metal', u'kaj je ovo sleyer koji', u'daj ne fakat kaj je ovo sleyer kaj smo u 1994 il kaj']"
157,Until the World Stops Turning,19894,120508,173000,"[u'black metal', u'metal', u'grindcore', u'industrial', u'death metal', u'heavy funk', u'mg42']"
158,Lama Sabachthani,20443,137229,228000,"[u'black metal', u'black grindcore metal', u'grindcore', u'metal', u'brilliant', u'FUCKING AWESOME', u'death metal', u'Amazing song', u'brutal black metal', u'prepare a skin graft from my ass because this song just melted my face off', u'best songs of all time', u'ive just been hit by a fucking train omfg', u'black grind', u'Black Metal Grindcore']"
159,Shatter the Empyrean,21886,144288,184000,"[u'black metal', u'grindcore', u'metal', u'death metal', u'Warhammer 40k', u'viking metal', u'melodic', u'intense', u'bizarre', u'industrial metal', u'alcohol', u'hatred', u'wanna see live', u'brutal black metal', u'misanthropic', u'Anaal Nathrakh', u'I love', u'lovely voice', u'clean vocals', u'heavy funk', u'blackgrind', u'ricordi', u'dobra rzeznia', u'venomintovein favs', u'apocalypse in your ears']"
160,The Final Absolution,24020,164144,235000,"[u'black metal', u'grindcore', u'metal', u'industrial metal', u'Grind', u'experimental', u'epic', u'grimness', u'cybergrind', u'industrial black metal', u'Warhammer 40k', u'Awesome', u'death metal', u'00s', u'love this', u'Masterpiece', u'7 of 10 stars', u'6 of 10 stars', u'Favourite Songs', u'look into', u'Anaal Nathrakh', u'All time favourite', u'sticky', u'absolute gods', u'Industrial Black', u'melo', u'awesome songs', u'Happy Headbangin', u'approved by the pope', u'favourite riffs', u'WOWOWOWOWOWOW', u'mindblasting thing']"
161,Virus Bomb,23623,163140,216000,"[u'black metal', u'grindcore', u'death metal', u'industrial black metal', u'metal', u'Blackened Death Metal', u'Warhammer 40k', u'Apocalyptic Black Metal', u'progressive black metal', u'experimental', u'apocalyptic', u'bombcore', u'Post-Black Metal', u'Extreme', u'apocalyptic metal', u'industrial', u'guitar', u'industrial metal', u'FUCKING AWESOME', u'Grind', u'brutal black metal', u'kicks mallcore kiddies around like little kids', u'Anaal Nathrakh', u'clean vocals', u'epic chorus', u'nice guitar solo', u'soundtrack to apocalypse', u'winter silence napierdalac', u'anaal nathrakh meets meshuggah', u'ultra-danceable breakdown', u'mindblasting thing']"
162,Screaming of the Unborn,23207,141690,166000,"[u'black metal', u'grindcore', u'death metal', u'metal', u'noise', u'industrial', u'intense', u'interesting', u'd-beat', u'industrial black metal', u'blackened grindcore', u'anaal', u'do jaja', u'machine gun drumming', u'i want to die but in a good way']"
163,Der Hölle Rache kocht in meinem Herzen,22127,145631,219000,"[u'black metal', u'grindcore', u'death metal', u'metal', u'british', u'grinding black metal', u'seen live', u'loud', u'intense', u'noisy', u'Extreme Metal', u'Blackened Death Metal', u'hatred', u'industrial black metal', u'brutal black metal', u'Anaal Nathrakh', u'I love', u'Necro', u'blackened grindcore', u'Melodic Death Black Metal', u'GR', u'neo-classical black metal', u'folk black', u'ravenous', u'brutal deth metal', u'dobra rzeznia', u'Para-fucking-noia', u'Twuj Stary', u'Mozart Arrangement', u'dirty and fucking ENGLISH', u'Music to commit serial murder to', u'Not your average cup o tea']"
164,Solifugae (Intro),14716,77856,65000,"[u'black metal', u'metal', u'instrumental', u'grindcore', u'intro', u'terminator']"
165,Regression to the Mean,16645,93626,192000,"[u'black metal', u'industrial black metal', u'grindcore', u'industrial', u'awesome vocals', u'metal', u'powernoise', u'guest vocals', u'Attila Csihar', u'cold wave', u'Blackened Death Metal', u'demons', u'atmospheric black metal', u'oppressive', u'Dark metal', u'pure evil', u'satanic death metal', u'closing track', u'pure holocaust', u'atilla csihar', u'extreme industrial', u'grind-black', u'mindblasting thing']"
166,The Necrogeddon,16422,87139,251000,"[u'black metal', u'grindcore', u'metal', u'Necro', u'TOTAL FUCKING EXTREME HOLOCAUST IN YOUR HEAD FACE RIP TYPHOON AVALANCHE TIDAL WAVE NECRO THRASHING FACE FUCKING BRUTALITY', u'Every time I hear this shit I feel like doing WTC but the jews done it', u'EVERYTIME SOMEONE IS TROLLING ON THE INTERNET WITH STUPID LAME ASS TAGS THE CHAOS THEORY IS IN SET WHICH CREATES SO TIDAL WAVE ACROSS ASIA', u'KILLING MILLIONS OF PEOPLE AND JEWS DOING WTC', u'Black Metal Grindcore', u'industrial blackened grind', u'killingbees', u'Bed Time Songs', u""YOU'RE ALL GOING TO DIE""]"
167,When the Lion Devours Both Dragon and Child,18393,120153,297000,"[u'black metal', u'grindcore', u'metal', u'brutal', u'epic', u'UK', u'death metal', u'great lyrics', u'evil', u'awesome vocals', u'Necro', u'DJENT', u'Favoriter', u'favourite', u'Extreme Metal', u'choon', u'melodic black metal', u'ugly', u'overwhelming', u'riff', u'Extreme', u'industrial black metal', u'uk metal', u'Nietzsche', u'modern black metal', u'great drumming', u'Truly Great', u'necro metal', u'best death metal', u'green songs', u'awesome chorus', u'Skamhardt']"
168,The Yellow King,17633,97972,294000,"[u'black metal', u'grindcore', u'Blackened Death Metal', u'post black metal', u'metal', u'satanic', u'video', u'industrial black metal', u'Black-Death Metal', u'X50', u'mindblasting thing']"
169,Waiting for the Barbarians,18360,103944,286000,"[u'black metal', u'grindcore', u'death metal', u'Necro', u'metal', u'industrial black metal', u'industrial', u'industrial metal', u'Extreme Metal', u'WAITING FOR THE  BARBARIANS', u'Black Metal Grindcore']"
170,The Destroying Angel,19317,116751,191000,"[u'black metal', u'grindcore', u'metal', u'Extreme Metal', u'brutal', u'UK', u'Necro', u'sick shit', u'british', u'insane', u'death metal', u'apocalyptic', u'Avant-garde Metal', u'european', u'Extreme', u'industrial black metal', u'brutal black metal', u'0mix', u'vitriolic', u'violence and hatred', u'ABSOLUTELY FUCKING PISSED OFF MUSIC', u'Black Metal Grindcore', u'metalmittwoch', u'KILL EVERYBODY IN THE WHOLE WORLD AHAHAHAHA']"
171,Timewave Zero,19474,120088,181000,"[u'black metal', u'grindcore', u'2012', u'industrial black metal', u'metal', u'blackened Satanic auditory decimation in the key of death metal brutality', u'brutal', u'UK', u'epic', u'industrial', u'death metal', u'great lyrics', u'apocalyptic', u'melodic black metal', u'screaming', u'ugly', u'overwhelming', u'Extreme', u'uk metal', u'great drumming', u'amazing album', u'avantgarde black - grindcore', u'mindblasting thing']"
172,Between Shit and Piss We Are Born,25748,200642,234000,"[u'black metal', u'grindcore', u'industrial black metal', u'Extreme Metal', u'death metal', u'metal', u'experimental', u'melodic black metal', u'Extreme Black metal', u'great title', u'Necro', u'Black Metal Grindcore', u'british', u'UK', u'epic', u'industrial metal', u'video', u'brilliant', u'friendsofthekingofrummelpop', u'title is a full sentence', u'6 of 10 stars', u'Brutal Death Metal', u'Blackened Death Metal', u'awesome vocals', u'brutal black metal', u'misanthropic', u'Fucking Brutal', u'modern black metal', u'Awesome Guitar Solo', u'Blackened Grind', u'nice solos', u'wakes you up', u'firstsong', u'mmt metal', u'pfav', u'wake up metal', u'black metal-melodico', u'avangart black death metal', u'mindblasting thing', u'juuj', u'something that will shrink dickless pussies to worthless husks']"
173,Bellum Omnium Contra Omnes,20779,121709,196000,"[u'black metal', u'grindcore', u'metal', u'melodic black metal', u'Black Metal Grindcore', u'industrial', u'latin', u'death metal', u'industrial black metal', u'brutal black metal', u'blackened grindcore', u'industrial grind', u'TOTAL FUCKING EXTREME HOLOCAUST IN YOUR HEAD FACE RIP TYPHOON AVALANCHE TIDAL WAVE NECRO THRASHING FACE FUCKING BRUTALITY', u'facesplattering metal', u'a train repeatedly hitting your face']"
174,Incipid Flock,15612,64434,321000,"[u'black metal', u'industrial black metal', u'grindcore', u'fuck', u'classic rock', u'metal', u'british', u'floating', u'death metal', u'sex', u'Rock and Roll', u'Extreme Metal', u'miam', u'to own', u'Necro', u'br00tal', u'lucipro', u'GAY MUSIK OV SATAN LOL', u'black grind', u'Mendigao thrash', u'bitch fuck']"
175,Rakkaudesta Saatanaan,2158,6956,520000,[]
176,Gallows of Inversion,2154,6410,244000,[]
177,Pentagram of the Black Earth,2252,7019,0,[]
178,Chalice Of The Abyssal Water,2343,7279,425000,"[u'black metal', u'Orthodox Black Metal', u'Finnish Black Metal', u'radical black metal']"
179,Tyrant of Luminous Darkness,2402,7342,0,[]
180,Umbra Luciferi,2614,8397,337000,[]
181,A Sword Of Promethean Fire,284,1101,0,[]
182,Cave of the Dark Dreams,3992,11598,0,[]
183,The Wand of Shadows,2909,8709,0,[]
184,The Poisonous Path,3382,10326,359000,[]
185,Waves Of Eternal Darkness,1690,4890,66000,"[u'black metal', u'metal', u'Sweden']"
186,Witches Dance For Satan,1600,4765,331000,"[u'black metal', u'Sweden']"
187,From Haunted Depths,1735,5424,313000,"[u'black metal', u'swedish black metal', u'Sweden']"
188,Starcursed And Dead,1818,5989,292000,"[u'black metal', u'raw balck metal', u'serious black', u'Sweden']"
189,Great Mysteries Of Death,1920,5973,314000,"[u'black metal', u'raw black metal', u'swedish', u'Sweden', u'Swedish Metal']"
190,Upon The Throne,1900,6541,283000,"[u'black metal', u'Sweden', u'raw black metal']"
191,Vampyric Sleep,2097,6973,327000,"[u'black metal', u'Sweden']"
192,Bloodline,2170,7205,275000,"[u'black metal', u'Sweden']"
193,Terrordemon,2137,6942,277000,"[u'black metal', u'Sweden']"
194,I'm Cleopatre's Killer,227,728,328000,[]
195,Nekromantic Flesh,1419,4573,292000,[u'black metal']
196,It Breathes,1504,4822,305000,"[u'black metal', u'Dead']"
197,Tunnels of his Majesty,1678,5411,314000,[u'black metal']
198,Dungeons,1752,5728,355000,[u'black metal']
199,Apocalyptic Prophecy,1853,5835,273000,[u'black metal']
200,"Of Horror, and the Black Shawls",4274,17625,341000,[]
201,Shadows Painting My Eyes,529,1696,357000,"[u'black metal', u'swedish black metal']"
202,Cursed Blaze from the Castle,567,1758,298000,[]
203,Under the Devil's Moon,1243,4283,335000,"[u'black metal', u'Sweden']"
204,Ghoulhaunted Forest,590,1928,413000,[]
205,Snake in the Garden of Eden,668,2380,386000,[u'black metal']
206,The True Legend,1288,4354,310000,"[u'black metal', u'Sweden']"
207,Tearing Your Soul,1426,4629,272000,"[u'black metal', u'Sweden']"
208,Nightmarish Sleep,100,264,425000,[]
209,Outside The Flesh,103,239,286000,[]
210,Cursed Be The Rivers,104,246,379000,[]
211,Split Tongue Dialogue,107,290,348000,[]
212,Heru Ra Ha: Let There Be Might,10851,49658,183000,"[u'black metal', u'death metal', u'Blackened Death Metal', u'metal', u'polish', u'8 of 10 stars', u'black/death metal', u'polish death metal', u'polish black metal', u'Behemoth']"
213,Typhonian Soul Zodiack,28363,124414,268000,"[u'death metal', u'Blackened Death Metal', u'black metal', u'polish', u'metal', u'666', u'nice', u'polska', u'polish death metal', u'polish metal', u'polish black metal', u'Behemoth', u'zajebista muza', u'6 of 10 stars', u'ugh', u'melodic black metal', u'polskie', u'black/death metal', u'blingtacular', u'energize', u'garten metal', u'egyptian death metal', u'anal pop', u'Playlist3', u'schary', u'massive defecation', u'zryj papierosa']"
214,Fornicatus Benefictus,30939,137591,52000,"[u'black metal', u'death metal', u'metal', u'Blackened Death Metal', u'Behemoth', u'dark ambient', u'ambient', u'thrash', u'polish', u'poland', u'6 of 10 stars', u'ambient metal', u'black/death metal', u'polish death metal', u'5 of 10 stars', u'polish black metal', u'Mendigao thrash', u'good5']"
215,Zos Kia Cultus,33081,166607,333000,"[u'black metal', u'death metal', u'Blackened Death Metal', u'metal', u'polish', u'Behemoth', u'black death metal', u'anti-christian', u'polish death metal', u'satanic', u'satan', u'Zos Kia Cultus', u'brutal', u'death', u'aggressive', u'Extreme Metal', u'8 of 10 stars', u'Technical Death Metal', u'mistagged', u'6 of 10 stars', u'ugh', u'black/death metal', u'Extreme', u'666', u'polish black metal', u'garten metal', u'good9', u'blackened death', u'Mendigao thrash', u'polish metalcore', u'Dobra robota from Poland', u'fills', u'black true metal', u'sxf13', u'fucking poland aiiiiiiiiiiiiii', u'Behemoth-Zos kis Cultus', u'Behemoth- Zos Kia Cultus', u'first league of polish music', u'infectious death']"
