,Songs,Listeners,Playcount,Duration,Tags
480,Stigmata Diaboli,15409,99118,171000,"[u'Love Metal', u'finnish', u'HIM', u'rock', u'6 of 10 stars', u'metal', u'alternative', u'alternative rock', u'goth', u'alternative metal', u'Gothic Metal', u'male vocalist', u'finnish metal', u'Gothic Rock', u'1996', u'finnish rock', u'uh finnish rock', u'skull ring collection', u'cloven hoof']"
481,Sigillum Diaboli,59395,365379,233000,"[u'Love Metal', u'HIM', u'metal', u'finnish', u'rock', u'Gothic Rock', u'Gothic Metal', u'goth', u'Gothic', u'finland', u'dark rock', u'for energy', u'Favorite Bands', u'alternative', u'sexy', u'favorites', u'Love', u'heard on Pandora', u'male vocalist', u'finnish metal', u'5 Stars', u'8 of 10 stars', u'Power metal', u'devil', u'2000', u'adam', u'Best music ever', u'suomirock', u'finnish rock', u'songs for lonesome lovers', u'teenage years', u'fave songs ever', u'daves faves', u'play it loud loud loud', u'finnish gothic rock', u'bam margera', u'Fuckin Good Music', u'Razorblade Romance', u'v10 rock', u'Sigillum Diaboli', u'best of love metal', u'Dave Hiddens Music Box', u'heart metal', u'cky4', u'i think Paulina may like it', u'skate movie ost', u'diab']"
482,Serpent Ride,4503,25753,0,"[u'Love Metal', u'Gothic Metal', u'Gothic Rock', u'HIM', u'rock', u'goth', u'finnish', u'male vocalist', u'hp lovecraft']"
483,Dark Secret Love,17347,97961,318000,"[u'Love Metal', u'finnish', u'Gothic Rock', u'HIM', u'rock', u'Love', u'romantic', u'psycho', u'sweet', u'vampire', u'Gothic Metal', u'male vocalists', u'6 of 10 stars', u'enigma', u'loved ones', u'lacrimaindarkness', u'swoony', u'greatest lyrics', u'in heaven', u'My reason to breathe', u'uh finnish rock']"
484,The Phantom Gate,3427,27395,0,"[u'finnish', u'Gothic Rock', u'Love Metal', u'uh finnish rock']"
485,Borellus,5081,29994,0,"[u'Love Metal', u'metal', u'hp lovecraft', u'nordic', u'finnish', u'Nu Metal', u'favorite song', u'HIM', u'great drums', u'great guitars', u'Pet Shop of Horrors', u'HIM Borellus']"
486,The Heartless (demo),5496,19050,333000,"[u'rock', u'finnish', u'finnish rock']"
487,The Heartless (demo),5496,19050,333000,"[u'rock', u'finnish', u'finnish rock']"
488,The Heartless (demo),5496,19050,333000,"[u'rock', u'finnish', u'finnish rock']"
489,The Heartless (demo),5496,19050,333000,"[u'rock', u'finnish', u'finnish rock']"
490,The Heartless (demo),5496,19050,333000,"[u'rock', u'finnish', u'finnish rock']"
491,The Heartless (demo),5496,19050,333000,"[u'rock', u'finnish', u'finnish rock']"
492,Once Emperor,9665,39832,374000,"[u'black metal', u'Norwegian Black Metal', u'metal', u'pagan metal', u'ambient black metal', u'Burzum', u'True Norwegian Black Metal', u'true black metal', u'ambient', u'viking metal', u'death metal', u'Pagan', u'Norway', u'black ambient', u'great title', u'Trve Norwegian Black Metal']"
493,Chant for Eschaton 2000,26777,168590,321000,"[u'Blackened Death Metal', u'death metal', u'black metal', u'metal', u'polish', u'seen live', u'satanic', u'black death metal', u'Extreme Metal', u'poland', u'6 of 10 stars', u'Brutal Death Metal', u'black/death metal', u'polish black metal', u'fon', u'Some of my favorite songs', u'szatan jest wielki wiec w gore podniesmy butelki', u'deat metal', u'sxf13', u'epic infernal black instrumental metal', u'OH MY FUCKIN GOD']"
494,Chant for Eschaton 2000,26777,168590,321000,"[u'Blackened Death Metal', u'death metal', u'black metal', u'metal', u'polish', u'seen live', u'satanic', u'black death metal', u'Extreme Metal', u'poland', u'6 of 10 stars', u'Brutal Death Metal', u'black/death metal', u'polish black metal', u'fon', u'Some of my favorite songs', u'szatan jest wielki wiec w gore podniesmy butelki', u'deat metal', u'sxf13', u'epic infernal black instrumental metal', u'OH MY FUCKIN GOD']"
495,Jesus Wept,7832,32975,359000,"[u'ebm', u'industrial', u'dark electro', u'Harsh EBM']"
496,See You In Hell 2002,3566,15148,292000,"[u'ebm', u'electronic', u'seen live', u'Gothic', u'dark electro', u'indus', u'electro dark', u'Gothic Festival 2008']"
497,Fuck You Bitch (TB Mix By Suicide Commando),860,4122,371000,"[u'electro', u'industrial', u'dark electro', u'ebm', u'Harsh EBM', u'terror ebm']"
498,Comatose Delusion (Overdose Shot Two),11429,54993,312000,"[u'industrial', u'dark electro', u'Gothic', u'electro industrial', u'Suicide Commando', u'Energetic', u'ethereal', u'ebm', u'brilliant', u'Loudness', u'fine', u'lovely music', u'crystalline', u'DarkLight', u'harsh dance', u'melodic harsh electro', u'high voltage', u'cybermarch', u'electro dark', u'jesters finest electro', u'critty', u'krabateglisteen', u'comatose delusion', u'saturate bass', u'BRICKWEEDZ']"
499,"Bind, Torture, Kill",15059,93159,361000,"[u'ebm', u'industrial', u'dark electro', u'electro', u'Harsh EBM', u'electronic', u'Aggrotech', u'idm', u'Belgium', u'Recommended', u'my neighbours will love this', u'underworld', u'Harsh', u'all time favorites', u'impossible for liberals to deal with', u'albums I own', u'drone', u'synthpop', u'glitchy', u'favourite', u'darkwave', u'female vocals', u'dark industrial', u'00s', u'belgian', u'life', u'psychic', u'male vocals', u'personal favourites', u'aggro', u'terror ebm', u'dark ebm', u'electro-industrial', u'majesty', u'hellektro', u'brillant', u'spotify', u'hard electro', u'DarkLight', u'harsh dance', u'harsh rave', u'harsh trance', u'trance ebm floorfiller', u'Hymnen an die Nacht', u'my favourits', u'hellectro', u'faccemd', u'aggro techno', u'clubhit', u'triplet timing']"
500,Victims Among Friends (Suicide Commando remix),668,2312,362000,[]
501,Victims Among Friends,11485,54966,361000,"[u'ebm', u'industrial', u'dark electro', u'Harsh EBM', u'darkwave', u'electronic', u'electro', u'favorites', u'god module', u'electronica', u'8 of 10 stars', u'badass', u'terror ebm', u'electro-industrial', u'Aggrotech', u'like it', u'rawr', u'lovely music', u'dark dance', u'Dark Elektro', u'ebm goth', u'lucipro', u'cold harsh electro', u'harsh rave', u'harsh trance', u'played at cyberia', u'castle party', u'medena4', u'critty', u'victims among friends', u'akirahoshi dark', u'cless', u'DxSFx', u'madderz', u'ebm floorfiller', u'neuter', u'Heart beat music', u'ebm industial dark electro', u'harshncatchy']"
502,Lunacy,13679,48073,326000,"[u'ebm', u'industrial', u'dark electro', u'darkwave', u'electronic', u'dance', u'Gothic', u'god module', u'goth', u'sad', u'downtempo', u'catchy', u'synthpop', u'6 of 10 stars', u'electro-industrial', u'sadness', u'lunacy', u'Dead Can Dance', u'dark dance', u'DarkLight', u'melodic dark electro', u'360shift', u'Slowbeat', u'godmodule', u'critty', u'empath', u'michewwe techno', u'antiphonal', u'cyberlimping', u'armastusabielu']"
503,Ever After,12245,40764,297000,"[u'industrial', u'dark electro', u'ebm', u'Harsh EBM', u'electronic', u'Gothic', u'darkwave', u'electronica', u'alternative', u'goth', u'Mellow', u'synthpop', u'german', u'love songs', u'distorted ebm', u'terror ebm', u'electro-industrial', u'Aggrotech', u'kick ass', u'hey there', u'lucipro', u'DarkLight', u'god module', u'critty', u'wayy too groovy baby', u'tanz muzik']"
504,Victims Among Friends (Suicide Commando remix),668,2312,362000,[]
505,Victims Among Friends (Suicide Commando remix),668,2312,362000,[]
506,Reverse Inversion,14975,54609,278000,"[u'ebm', u'industrial', u'electronic', u'dark electro', u'Aggrotech', u'god module', u'darkwave', u'epic', u'dark', u'spooky', u'synthpop', u'Harsh EBM', u'electro-industrial', u'gritty', u'cyber', u'industrial electro', u'ebm-psytrance', u'genial', u'heard on myspace', u'ebm goth', u'night drive', u'radiant', u'trance ebm floorfiller', u'played at an edgar general night', u'female fronted industrial', u'EEUU', u'Me Likes', u'empath', u'reverse inversion', u'DxSFx', u'madderz', u'minio', u'hellish good', u'sweetncatchy', u'duo vocalist', u'antiphonal', u'God module rverse inversion', u'merrypinkbunnies']"
507,Entranced,10682,36667,316000,"[u'industrial', u'ebm', u'dark electro', u'god module', u'electronic', u'synth', u'american', u'synthpop', u'dark industrial', u'futurepop', u'electro-industrial', u'over 5 minutes long', u'olde fave', u'critty']"
508,As the Night Falls,12699,44778,260000,"[u'dark electro', u'ebm', u'industrial', u'electro-industrial', u'god module', u'darkwave', u'electronic', u'Gothic', u'techno', u'oldies', u'live', u'electronica', u'FUCKING AWESOME', u'live performance', u'critty', u'as the night falls', u'empath', u'akirahoshi dark', u'gasoline fueled rage']"
509,Telekinetic,21728,90134,301000,"[u'industrial', u'ebm', u'dark electro', u'electro-industrial', u'electro', u'dark', u'god module', u'electronic', u'new wave', u'spooky', u'darkwave', u'Harsh EBM', u'DarkLight', u'SantiOriginal Radio', u'telekinetic', u'miianens playlist', u'goth', u'experimental', u'dance', u'techno', u'Awesome', u'synth', u'space', u'industrial rock', u'k', u'glitchy', u'to download', u'nine inch nails', u'futurepop', u'80', u'brilliant', u'dark electronica', u'techno-industrial', u'time travel', u'a place for people with that tiny black spot on their brain to go when the darkness leaks out and does what it wills', u'Tech-Trance', u'cyber', u'dark trance', u'dark dance', u'fucking sweet', u'crystalline', u'muted', u'deathfuck', u'contrasted', u'i will eat your soul', u'Apollyon Dark Electro List', u'i kill people', u'dark technologies', u'hacker tunes', u'empath']"
510,She's on Drugs (Seduced by CHAINREACTOR),1735,6873,251000,"[u'dark electro', u'Harsh EBM', u'tbm', u'hardstyle', u'Harsh', u'fat beat', u'harsh industrial', u'ebm-powernoise-psytrance', u'harsh dance', u'harsh rave', u'harsh trance', u'broken harsh electro', u'triplet timing']"
511,She's on Drugs (Seduced by CHAINREACTOR),1735,6873,251000,"[u'dark electro', u'Harsh EBM', u'tbm', u'hardstyle', u'Harsh', u'fat beat', u'harsh industrial', u'ebm-powernoise-psytrance', u'harsh dance', u'harsh rave', u'harsh trance', u'broken harsh electro', u'triplet timing']"
512,Fearless,4157,24179,247000,"[u'dark electro', u'ebm', u'Harsh EBM', u'electronic', u'industrial', u'Uplifting', u'Hard Trance', u'Harsh', u'industrial dance', u'melodramatic', u'harsh dance', u'harsh rave', u'harsh trance', u'melodic harsh electro pop', u'awesome power']"
513,Before It's Too Late,3776,20338,356000,"[u'industrial', u'black metal', u'electronic', u'sad', u'beautiful', u'dark electro', u'melancholic', u'ebm', u'brilliant', u'Harsh EBM', u'symphonic gothic metal', u'Symphonic Black Metal', u'tragic', u'solemn', u'grave', u'melodramatic', u'DarkLight', u'harsh trance', u'melodic harsh electro', u'post-progressive emocore', u'symphonic electro', u'dark harsh synthpop']"
514,The Convent Burns,8520,42181,304000,"[u'Harsh Electro', u'Hard Trance', u'industrial', u'Awesome', u'drone', u'dark electro', u'brilliant', u'electro industrial', u'electro-industrial', u'Harsh', u'dark trance', u'shiny', u'dark dance', u'Dark Elektro', u'melodramatic', u'DarkLight', u'harsh trance', u'rotating', u'Sweet memories', u'harsh elektro']"
515,Ov Fire and the Void,83116,871236,274000,"[u'death metal', u'Blackened Death Metal', u'black metal', u'metal', u'polish', u'epic', u'Behemoth', u'ov fire and the void', u'Behemoth - Ov Fire And The Void', u'heavy metal', u'best song ever', u'black death metal', u'Technical Death Metal', u'heavy as fuck', u'evangelion', u'polska dusza', u'swietny teledysk', u'brutal', u'thrash metal', u'8 of 10 stars', u'9 of 10 stars', u'epic metal', u'boring', u'Masterpiece', u'2000s', u'7 of 10 stars', u'Symphonic Black Metal', u'black/death metal', u'epic black metal', u'epic death metal', u'polish death metal', u'polish metal', u'i had to change my pants after this song', u'Pure Fucking Metal', u'pierdolniecie', u'zuo', u'music choice: metal', u'decadeology', u'o kurwa', u'songs of the moment', u'poput ruze u cvatu', u'blackended death metal', u'catchy death metal', u'rozkurwia kosmos', u'moc', u'rzniecie dupki', u'monumental armageddon', u'nietzschean conspiracy', u'pathoscore', u'epic pathoscore']"
516,Ov Fire and the Void,83116,871236,274000,"[u'death metal', u'Blackened Death Metal', u'black metal', u'metal', u'polish', u'epic', u'Behemoth', u'ov fire and the void', u'Behemoth - Ov Fire And The Void', u'heavy metal', u'best song ever', u'black death metal', u'Technical Death Metal', u'heavy as fuck', u'evangelion', u'polska dusza', u'swietny teledysk', u'brutal', u'thrash metal', u'8 of 10 stars', u'9 of 10 stars', u'epic metal', u'boring', u'Masterpiece', u'2000s', u'7 of 10 stars', u'Symphonic Black Metal', u'black/death metal', u'epic black metal', u'epic death metal', u'polish death metal', u'polish metal', u'i had to change my pants after this song', u'Pure Fucking Metal', u'pierdolniecie', u'zuo', u'music choice: metal', u'decadeology', u'o kurwa', u'songs of the moment', u'poput ruze u cvatu', u'blackended death metal', u'catchy death metal', u'rozkurwia kosmos', u'moc', u'rzniecie dupki', u'monumental armageddon', u'nietzschean conspiracy', u'pathoscore', u'epic pathoscore']"
517,Bol'no Mne,2048,8893,340000,"[u'pagan metal', u'folk metal', u'Female fronted metal', u'female vocalists']"
518,Odna,8695,47748,349000,"[u'pagan metal', u'folk metal', u'Female fronted metal', u'metal', u'female vocalists', u'6 of 10 stars']"
519,Bol'no Mne,2048,8893,340000,"[u'pagan metal', u'folk metal', u'Female fronted metal', u'female vocalists']"
520,Ov Fire and the Void,83116,871236,274000,"[u'death metal', u'Blackened Death Metal', u'black metal', u'metal', u'polish', u'epic', u'Behemoth', u'ov fire and the void', u'Behemoth - Ov Fire And The Void', u'heavy metal', u'best song ever', u'black death metal', u'Technical Death Metal', u'heavy as fuck', u'evangelion', u'polska dusza', u'swietny teledysk', u'brutal', u'thrash metal', u'8 of 10 stars', u'9 of 10 stars', u'epic metal', u'boring', u'Masterpiece', u'2000s', u'7 of 10 stars', u'Symphonic Black Metal', u'black/death metal', u'epic black metal', u'epic death metal', u'polish death metal', u'polish metal', u'i had to change my pants after this song', u'Pure Fucking Metal', u'pierdolniecie', u'zuo', u'music choice: metal', u'decadeology', u'o kurwa', u'songs of the moment', u'poput ruze u cvatu', u'blackended death metal', u'catchy death metal', u'rozkurwia kosmos', u'moc', u'rzniecie dupki', u'monumental armageddon', u'nietzschean conspiracy', u'pathoscore', u'epic pathoscore']"
521,Wiking,1921,10808,339000,[]
522,Lesbian Nuns Suck Me Dry,10457,53903,252000,"[u'industrial', u'tbm', u'Harsh Electro', u'electro', u'dark electro', u'lesbian', u'electro-industrial', u'death trance', u'harsh trance', u'dramatic', u'satanic', u'brilliant', u'electro industrial', u'english lyrics', u'terror ebm', u'ebm-psytrance', u'hellektro', u'Terror-EBM', u'Dark Elektro', u'melodramatic', u'DarkLight', u'rotating', u'trance ebm floorfiller', u'hellectro', u'PodobaSieMi', u'harsh elektro', u'harsh drone', u'q2jslfm']"
523,Lasy Pomorza,22687,96689,386000,"[u'black metal', u'death metal', u'polish', u'metal', u'Blackened Death Metal', u'pagan metal', u'pagan black metal', u'Behemoth', u'Lasy Pomorza', u'Extreme Metal', u'poland', u'polish death metal', u'heavy metal', u'black death metal', u'Brutal Death Metal', u'kvlt', u'Amazing song', u'polish metal', u'Aggresive', u'greatest behemoth song', u'seen live', u'rock', u'brutal', u'grindcore', u'hardcore', u'doom metal', u'acoustic', u'Melodic Death Metal', u'90s', u'death', u'thrash metal', u'Technical Death Metal', u'666', u'polish black metal', u'garten metal', u'kitch', u'anti-christ', u'Mendigao thrash', u'iscametal', u'this will fucking own your ass', u'the best shit since teddy bears', u'nekroasfak', u'blows your fucking brains out', u'when puppies listen to this their heads get raped', u'iramusa', u'niszczy obiekty']"
524,Chant for Eschaton 2000,26777,168590,321000,"[u'Blackened Death Metal', u'death metal', u'black metal', u'metal', u'polish', u'seen live', u'satanic', u'black death metal', u'Extreme Metal', u'poland', u'6 of 10 stars', u'Brutal Death Metal', u'black/death metal', u'polish black metal', u'fon', u'Some of my favorite songs', u'szatan jest wielki wiec w gore podniesmy butelki', u'deat metal', u'sxf13', u'epic infernal black instrumental metal', u'OH MY FUCKIN GOD']"
525,Chant for Eschaton 2000,26777,168590,321000,"[u'Blackened Death Metal', u'death metal', u'black metal', u'metal', u'polish', u'seen live', u'satanic', u'black death metal', u'Extreme Metal', u'poland', u'6 of 10 stars', u'Brutal Death Metal', u'black/death metal', u'polish black metal', u'fon', u'Some of my favorite songs', u'szatan jest wielki wiec w gore podniesmy butelki', u'deat metal', u'sxf13', u'epic infernal black instrumental metal', u'OH MY FUCKIN GOD']"
526,Sections,13222,62478,317000,"[u'ebm', u'dark electro', u'industrial', u'darkwave', u'Gothic', u'synthpop', u'female vocalist', u'god module', u'electronic', u'vocal', u'downtempo', u'electro', u'synth', u'club', u'melancholy', u'brilliant', u'electro-industrial', u'Aggrotech', u'catchy as hell', u'electrogoth', u'seen live', u'USA', u'techno', u'american', u'melancholic', u'Bittersweet', u'hypnotic', u'female vocals', u'futurepop', u'female vocal', u'Masterpiece', u'english lyrics', u'10 of 10 stars', u'unusual for artist', u'florida', u'United States', u'best songs ever', u'modular', u'mustHave', u'shiny', u'loved tracks', u'crystalline', u'Harsh Electro', u'Conde Maquina favourite track', u'purplevelvets loved tracks', u'EUA', u'my precious', u'critty', u'onecyze project', u'akirahoshi dark']"
527,Forseen,4162,25916,330000,"[u'industrial', u'dark electro', u'ebm', u'electronic', u'catchy', u'dark', u'spooky', u'american', u'Favourite Songs', u'Harsh EBM', u'industrial dance', u'DarkLight']"
528,Victims Among Friends (Suicide Commando remix),668,2312,362000,[]
529,Stenka na stenku,11896,95401,156000,"[u'pagan metal', u'folk metal', u'Female fronted metal', u'viking metal', u'russian', u'orgasm']"
530,Marena,12369,52369,449000,"[u'pagan metal', u'folk metal', u'metal', u'female fronted', u'russian metal', u'black metal', u'Female fronted metal', u'folk', u'viking metal', u'Girl', u'pagan death metal', u'war folk', u'battle folk', u'tyu', u'Baamhakke']"
531,Pokrovy Nebesnogo Startsa,7148,41322,265000,"[u'folk metal', u'pagan metal', u'female vocalists', u'Folk Pagan Metal', u'metal', u'Awesome', u'viking metal', u'russian']"
532,Kupala I Kostroma,8826,59916,174000,"[u'folk metal', u'pagan metal', u'metal', u'viking metal', u'russian']"
533,Katitsya Kolo,4536,24750,0,"[u'metal', u'folk metal', u'viking metal', u'pagan metal']"
534,V Tsepiakh Drevney Tainy (In Chains of Ancient Mystery),4786,26191,0,"[u'folk metal', u'russian', u'pagan metal', u'FUCKING AWESOME', u'6 of 10 stars']"
535,"Goi, Rode, Goi!!!",6524,50102,0,"[u'folk metal', u'pagan metal', u'slavic pagan metal', u'viking metal', u'russian', u'8 of 10 stars']"
536,Slavsya Rus,5061,43615,0,"[u'folk metal', u'viking metal', u'beautiful', u'russian', u'Favorite', u'Arkona', u'srogi kawal muzyki', u'slavsya rus']"
537,Slavsya Rus,5061,43615,0,"[u'folk metal', u'viking metal', u'beautiful', u'russian', u'Favorite', u'Arkona', u'srogi kawal muzyki', u'slavsya rus']"
538,Brate Slavyane,5584,27551,295000,"[u'black metal', u'metal', u'folk metal', u'pagan metal', u'russian metal']"
539,Brate Slavyane,5584,27551,295000,"[u'black metal', u'metal', u'folk metal', u'pagan metal', u'russian metal']"
540,"Oy, Pechal-Toska",5022,31484,0,"[u'folk metal', u'metal', u'atmospheric', u'pagan metal', u'Folk Pagan Metal', u'Russian Folk Metal']"
541,Ot Serdtsa K Nebu,6593,43542,0,"[u'folk metal', u'pagan metal', u'metal', u'atmospheric', u'viking metal', u'russian', u'Pagan', u'russian metal', u'pagan black metal', u'Folk Pagan Metal']"
542,"Goy, Kupala!!!",5242,31169,0,"[u'folk metal', u'metal', u'pagan metal', u'Folk Pagan Metal']"
543,Pokrovy Nebesnogo Startsa,7148,41322,265000,"[u'folk metal', u'pagan metal', u'female vocalists', u'Folk Pagan Metal', u'metal', u'Awesome', u'viking metal', u'russian']"
544,Zov Predkov,7726,27549,245000,"[u'folk metal', u'black metal', u'metal', u'russian', u'pagan metal', u'rain', u'freaked', u'slavic pagan metal', u'sear me']"
545,Zalozhniy,310,2071,0,[]
546,Maslenitsa,15931,73763,174000,"[u'folk metal', u'pagan metal', u'viking metal', u'metal', u'black metal', u'Female fronted metal', u'russian', u'slavic pagan metal', u'seen live', u'1', u'rus', u'optime']"
547,"Goi, Rode, Goi!!!",6524,50102,0,"[u'folk metal', u'pagan metal', u'slavic pagan metal', u'viking metal', u'russian', u'8 of 10 stars']"
548,Kolyada,7400,39844,383000,"[u'folk metal', u'pagan metal', u'russian', u'slavic pagan metal', u'metal', u'seen live']"
549,Kolyada,7400,39844,383000,"[u'folk metal', u'pagan metal', u'russian', u'slavic pagan metal', u'metal', u'seen live']"
550,Arkaim,9372,50418,353000,"[u'folk metal', u'pagan metal', u'Female fronted metal', u'metal', u'female vocalists', u'viking metal', u'6 of 10 stars']"
551,Zakliatie,10288,65822,318000,"[u'folk metal', u'pagan metal', u'Female fronted metal', u'metal', u'female vocalists', u'russian', u'6 of 10 stars', u'Folk Pagan Metal']"
552,Zakliatie,10288,65822,318000,"[u'folk metal', u'pagan metal', u'Female fronted metal', u'metal', u'female vocalists', u'russian', u'6 of 10 stars', u'Folk Pagan Metal']"
553,za dla cieniw minionych,21945,397970,189000,"[u'thrash metal', u'heavy metal', u'polish', u'metal', u'polish metal', u'kat', u'polish music', u'black metal', u'romantic', u'Ballad', u'fav', u'melancholy', u'zajebiste', u'best vocalists', u'beautiful', u'speed metal', u'art rock', u'ulubione', u'metal ballad', u'metal ballads', u'ballada', u'heavy metal ballad', u'cudne', u'heavy', u'poetry', u'old metal', u'favourite', u'poland', u'polskie', u'blackened thrash metal', u'Amazing song', u'best ever', u'eastern european metal', u'blackened heavy metal', u'silent intensity', u'rock metal', u'great metal song', u'ballady', u'polish thrash metal', u'polish heavy metal', u'katharsis', u'boskie', u'JRC', u'finski gotyk', u'gargulec', u'my dark side', u'suicidal lovers', u'avantgarde gothic rock flavour with poetic lyrics', u'niezwyka piosenka', u'Kat-lza dla cieniow minionych']"
554,Miasma,72787,480845,282000,"[u'death metal', u'Melodic Death Metal', u'deathcore', u'metalcore', u'metal', u'The Black Dahlia Murder', u'black metal', u'heavy metal', u'grindcore', u'hardcore', u'Brutal Death Metal', u'music that gets me my dick hard', u'seen live', u'brutal', u'melodic', u'blacker than the blackest black times infinity', u'deathmetal', u'gives me shivers', u'brilliant riff', u'Evil Music', u'Most Brutal', u'Favorite Bands', u'angry', u'genius', u'amazing', u'best song ever', u'8 of 10 stars', u'melodic metal', u'good lyrics', u'Favourite Songs', u'NWOAHM', u'sickness', u'title track', u'technical', u'kickass', u'i had to change my pants after this song', u'Face Melting', u'blastbeat', u'closing track', u'live seen', u'ace tune', u'hart', u'mdm', u'new generation', u'miasma', u'CHOO CHOO TRAIN 2k5', u'songs that make me shiver', u'interresting', u'The Burning Season', u'so genius it makes me wanna cry']"
555,Spite Suicide,58676,321867,172000,"[u'death metal', u'deathcore', u'Melodic Death Metal', u'metalcore', u'metal', u'hardcore', u'thrash metal', u'Brutal Death Metal', u'kickass', u'brutal', u'thrash', u'tech metal', u'The Black Dahlia Murder', u'deadcore', u'brilliant riff', u'go vegan', u'seen live', u'good shit', u'best song ever', u'Technical Death Metal', u'favorite song', u'good lyrics', u'sickness', u'i had to change my pants after this song', u'Face Melting', u'great drums', u'great guitars', u'Technical Deathcore', u'new generation', u'Th Black Dahlia Murder', u'mdkmetal', u'Eat More Meat', u'theblackdahliamurder', u'Jagon', u'The Black Dahlia Murder-Spite Suicide']"
556,Miscarriage,59504,343185,189000,"[u'Melodic Death Metal', u'death metal', u'deathcore', u'metal', u'metalcore', u'grindcore', u'Melodic Deathcore', u'noisecore', u'Brutal Death Metal', u'american metal', u'Makes me want to kill things', u'melodic', u'The Black Dahlia Murder', u'favorites', u'lalala', u'futurepop', u'interesting', u'8 of 10 stars', u'Rammstein', u'music', u'favs', u'sickness', u'cannibalism', u'Rhytmic', u'dance metal', u'Killer', u'Chill Out Music', u'Metal rock', u'new generation', u'nang', u'songs you can listen to fifty times over', u'pure-DEATH', u'Th Black Dahlia Murder', u'the black dahlia', u'Mind Boggling', u'unhandled exception', u'spitafield the days you felt alive', u'watn geiler refrain', u'wie dick ist das denn', u'wild party', u'MFBR', u'halle saale', u'synesthaesia 2005', u'miscarriaged', u'waldrock09']"
557,Dave Goes To Hollywood,30303,175668,239000,"[u'Melodic Death Metal', u'death metal', u'deathcore', u'metal', u'metalcore', u'american death metal', u'thrash metal', u'8 of 10 stars', u'sickness', u'fuckin sick', u'watn geiler refrain', u'i kiss this fucking world goodnight', u'howling metal']"
558,Novelty Crosses,57589,342587,232000,"[u'Melodic Death Metal', u'death metal', u'deathcore', u'Brutal Death Metal', u'metalcore', u'Melodic Deathcore', u'metal', u'seen live', u'Favorite Bands', u'brutal', u'hardcore', u'sexy', u'8 of 10 stars', u'favorite song', u'sickness', u'1111', u'great drums', u'great guitars', u'brilliant riff', u'Awesome Guitar Solo', u'best fucking riff ever']"
