,Songs,Listeners,Playcount,Duration,Tags
0,Torn Beyond Reason (full w lyrics),27,34,0,[]
1,Somehow (w/ Lyrics),120,236,0,[]
2,Lonely,359,1306,615000,[]
3,Useless,436,1790,735000,[u'depressive black metal']
4,To have ever had,86,212,0,[]
5,A Tapestry of Winter Wolves,172,590,937000,[]
6,The Rain that falls alone...,163,659,1274000,[]
7,When the first snow fell...,161,823,1184000,[]
8,Kiss in October,229,1339,811000,[]
9,Carmen,48,105,0,[]
10,Her,215,1078,771000,[]
11,In All This Dark,878,4153,777000,[]
12,In The Ocean Of My Tears,961,4274,654000,[]
13,How Can I Be There,1179,5655,749000,[]
14,In All This Dark,878,4153,777000,[]
15,You Went So Silent,1969,14311,492000,"[u'doom metal', u'Atmospheric Funeral Doom Metal', u'melancholic']"
16,The Deep Vast Emptiness,2178,13476,785000,[]
17,In The Ocean Of My Tears,961,4274,654000,[]
18,I Gave My Heart Away,796,3521,621000,[]
19,Still Ill,367483,2599198,200000,"[u'indie', u'80s', u'alternative', u'new wave', u'british', u'The Smiths', u'post-punk', u'rock', u'indie pop', u'Morrissey', u'indie rock', u'britpop', u'lovedbygdchill', u'Manchester', u'alternative rock', u'Great Lyricists', u'UK', u'favorites', u'1984', u'Soundtrack Of My Life', u'pop', u'british i like', u'reasons to worship morrissey', u'I never saw you dancing', u'Favourites', u'smiths', u'Moz', u'johnny marr', u'still ill', u'genius', u'melancholy', u'harmonica', u'male vocalist', u'Reasons why I love Moz', u'vugube62', u'singer-songwriter', u'pop rock', u'jangle pop', u'RockPop', u'Awesome', u'guitar', u'favourite', u'melancholic', u'male vocalists', u'great lyrics', u'friendsofthekingofrummelpop', u'1980s', u'best songs ever', u'FREAKING BRILLIANT', u'smith']"
20,Last Night I Dreamt That Somebody Loved Me,280368,1600824,189000,"[u'alternative', u'80s', u'indie', u'british', u'melancholy', u'sad', u'new wave', u'rock', u'post-punk', u'The Smiths', u'beautiful', u'alternative rock', u'melancholic', u'indie pop', u'indie rock', u'Morrissey', u'favorites', u'depressing', u'1987', u'Love', u'Mellow', u'loneliness', u'britpop', u'male vocalists', u'british i like', u'Songs that seem to know more about me than I do', u'loved', u'Favorite', u'johnny marr', u'sadness', u'songs to get drunk to', u'singer-songwriter', u'Manchester', u'lonely', u'love at first listen', u'1980s', u'sleepy', u'forever alone', u'i cannot sufficiently express my love in a tag', u'unconventional songs', u'dear old dismal england', u'classic rock', u'pop', u'UK', u'memories', u'piano', u'epic', u'Post punk', u'Awesome', u'moody']"
21,Girlfriend in a Coma,405857,2600075,122000,"[u'80s', u'indie', u'alternative', u'new wave', u'british', u'The Smiths', u'rock', u'pop', u'post-punk', u'alternative rock', u'indie rock', u'Manchester', u'1987', u'britpop', u'indie pop', u'Love', u'melancholy', u'Morrissey', u'favorites', u'sweetly sad', u'classic rock', u'Favorite', u'british i like', u'favorite songs', u'beautiful', u'1980s', u'eerily saccharine', u'punk', u'sad', u'death', u'Favourites', u'smiths', u'Moz', u'major key tonality', u'mixed acoustic and electric instrumentation', u'80s alternative', u'dawsons creek', u'Short Track', u'being human', u'classic', u'Alternative  Punk', u'jangle pop', u'Post punk', u'Awesome', u'quirky', u'Mellow', u'oldies', u'pretty', u'nice', u'funny']"
22,The Headmaster Ritual (Oxford Road Show),4,4,0,[]
23,Bigmouth strikes again (with lyrics EN) (Legendado PTbr) HD 720p,13,15,0,[]
24,Boy With The Thorn In His Side,33,35,0,[]
25,Stop Me If You Think You've Heard This One Before,263429,1668357,213000,"[u'80s', u'indie', u'alternative', u'new wave', u'The Smiths', u'british', u'post-punk', u'rock', u'britpop', u'Love', u'Morrissey', u'alternative rock', u'indie rock', u'Manchester', u'1987', u'lovedbygdchill', u'classic', u'Favourites', u'indie pop', u'Awesome', u'reasons to worship morrissey', u'favorites', u'Favorite', u'british i like', u'witty', u'who said i lied because    i never', u'Favourite Songs', u'Stop Me if You Think Youve Heard this one Before', u'pop', u'amazing', u'cool', u'my classics', u'good songs to help fuel my alcoholism', u'dear old dismal england', u'favorite songs', u'Alternative  Punk', u'melancholy', u'favourite', u'rock band', u'lovely', u'smiths', u'angsty', u'1980s', u'johnny marr', u'aaah', u'ridiculously awesomely good', u'reasons to love 80s', u'love love love love love', u'3am songs', u'rock band 3']"
26,Ask,382926,2788764,193000,"[u'80s', u'indie', u'new wave', u'alternative', u'The Smiths', u'british', u'rock', u'post-punk', u'Manchester', u'Morrissey', u'pop', u'britpop', u'happy', u'indie pop', u'alternative rock', u'catchy', u'favorites', u'male vocalists', u'1986', u'story of my life', u'UK', u'Favourites', u'smiths', u'classic rock', u'Love', u'summer', u'great lyrics', u'party', u'High School', u'british i like', u'goth', u'indie rock', u'pop rock', u'cute', u'Alternative  Punk', u'melancholy', u'fun', u'ask', u'Morrisey', u'the bong', u'shyness is nice', u'dance', u'jangle pop', u'Post punk', u'Awesome', u'Favorite', u'Great Lyricists', u'1980s', u'a subtle use of vocal harmony', u'anthem']"
27,Panic,453073,3186742,186000,"[u'80s', u'indie', u'alternative', u'new wave', u'british', u'rock', u'post-punk', u'The Smiths', u'britpop', u'hang the dj', u'pop', u'Morrissey', u'Manchester', u'indie pop', u'indie rock', u'1986', u'alternative rock', u'Favourites', u'smiths', u'classic rock', u'favorites', u'london', u'Moz', u'Panic', u'favorite songs', u'beautiful', u'Awesome', u'Favorite', u'british i like', u'catchy', u'melancholy', u'favourite', u'madchester', u'best songs ever', u'seen live', u'Favorite Bands', u'cute', u'Alternative  Punk', u'Post punk', u'favorite tracks', u'Brit-pop', u'brit pop', u'80s alternative', u'dancing around in the bedroom', u'treasures', u'Soundtrack', u'Love', u'modern', u'RockPop', u'Driving']"
28,What Difference Does It Make?,305282,2042480,230000,"[u'80s', u'indie', u'alternative', u'new wave', u'The Smiths', u'british', u'post-punk', u'rock', u'indie rock', u'Morrissey', u'Manchester', u'britpop', u'indie pop', u'alternative rock', u'melancholy', u'smiths', u'Awesome', u'1984', u'pop', u'Favorite', u'Favourites', u'british i like', u'1980s', u'favorites', u'catchy', u'dark', u'beautiful', u'loved', u'Great Lyricists', u'Moz', u'classics', u'johnny marr', u'best song titles', u'theo73 loves this music', u'What Difference Does It Make', u'vugube62', u'sad', u'pop rock', u'Alternative  Punk', u'jangle pop', u'RockPop', u'moody', u'Driving', u'oldies', u'Favorite Artists', u'favourite', u'melancholic', u'male vocalists', u'madchester', u'4']"
29,Please Please Please Let Me Get What I Want,408,470,0,[]
30,Heaven Knows I'm Miserable Now,477545,3496264,214000,"[u'80s', u'indie', u'new wave', u'alternative', u'british', u'rock', u'The Smiths', u'melancholy', u'post-punk', u'Morrissey', u'pop', u'britpop', u'indie rock', u'1984', u'alternative rock', u'indie pop', u'Manchester', u'smiths', u'sad', u'favorites', u'Love', u'favorite songs', u'UK', u'beautiful', u'Awesome', u'melancholic', u'male vocalist', u'Favourites', u'classic rock', u'moody', u'england', u'male vocalists', u'Favorite', u'Moz', u'british i like', u'The soundtrack to my wasted life', u'Post punk', u'Bittersweet', u'heaven and hell', u'story of my life', u'80s alternative', u'amayzes loved', u'reasons to worship morrissey', u'dear old dismal england', u'classic', u'Alternative  Punk', u'jangle pop', u'party', u'favourite', u'madchester']"
31,How Soon Is Now?,736035,5271762,403000,"[u'80s', u'alternative', u'indie', u'new wave', u'rock', u'The Smiths', u'british', u'post-punk', u'alternative rock', u'britpop', u'Morrissey', u'indie rock', u'melancholy', u'pop', u'smiths', u'favorites', u'Manchester', u'Favourites', u'How Soon Is Now', u'Love', u'Awesome', u'Soundtrack', u'classic rock', u'beautiful', u'1985', u'indie pop', u'UK', u'Charmed', u'sad', u'genius', u'male vocalists', u'epic', u'Favorite', u'chill', u'classic', u'favorite songs', u""80's"", u'best songs ever', u'lovedbygdchill', u'dark', u'favourite', u'cool', u'madchester', u'questions', u'haunting', u'Mellow', u'amazing', u'Moz', u'queer as folk', u'Songs that saved your life']"
32,The Queen Is Dead - a film by Derek Jarman,249,351,0,[]
33,This Charming Man,703867,6144476,163000,"[u'80s', u'indie', u'new wave', u'alternative', u'The Smiths', u'british', u'rock', u'post-punk', u'britpop', u'indie rock', u'alternative rock', u'Morrissey', u'pop', u'indie pop', u'Manchester', u'Great Lyricists', u'favorites', u'1983', u'Awesome', u'Favourites', u'melancholy', u'smiths', u'classics', u'beautiful', u'UK', u'Post punk', u'Love', u'jangle pop', u'1984', u'This charming man', u'dance', u'happy', u'college rock', u'party', u'love at first listen', u'80s alternative', u'charming', u'melancholic', u'Favorite', u'perfect', u'Moz', u'power pop', u'pop rock', u'catchy', u'england', u'Favorite Artists', u'british i like', u'Favourite Songs', u'anthem', u'amayzes loved']"
34,Burn Girl Prom Queen,37929,166003,511000,"[u'post-rock', u'instrumental', u'alternative', u'melancholic', u'Bittersweet', u'Instrumental music that makes you feel-group tag radio', u'indie', u'ambient', u'indie rock', u'beautiful', u'post rock', u'songs that made me cry - or almost did', u'seen live', u'rock', u'epic', u'britpop', u'post-punk', u'Awesome', u'moody', u'soundscape', u'horns', u'Progressive', u'emotional', u'love songs', u'Favourites', u'nostalgia', u'perfect', u'le kiff', u'duyster', u'achingly intelligent', u'calmness', u'fall 2005', u'adrien wayne', u'december 2005', u'iminlovewiths', u'electronic-ace', u'drama-rama', u'epos', u'sickening soundtrack', u'dark room music', u'Destrukcja', u'Wepon of Mass Destruction', u'bron masowego razenia', u'as calm as calm can be', u'q-narf', u'queima garota rainha do baile']"
35,God's Gonna Cut You Down,269984,1719411,158000,"[u'country', u'folk', u'Johnny Cash', u'singer-songwriter', u'rock', u'Alt-country', u'blues', u'Supernatural', u'dark', u'americana', u'favorites', u'classic rock', u'Awesome', u'cash', u'Nashville', u'acoustic', u'american', u'Recommended', u'kickasstic', u'pay attention', u'american i like', u'sad', u'epic', u'folk rock', u'jesus', u'legend', u'Consistent Dodo Radio - Flittering', u'rockabilly', u'alternative', u'favorite songs', u'cover', u'spiritual', u'male vocalist', u'male vocalists', u'outlaw country', u'Favourites', u'brilliant', u'powerful', u'Favourite Songs', u'handclaps', u'god', u'bad ass', u'singer-songwritergdchill', u'classic', u'haunting', u'covers', u'oldies', u'favourite', u'emotional', u'00s']"
36,Hurt,1009094,7810321,218000,"[u'country', u'cover', u'acoustic', u'sad', u'folk', u'Johnny Cash', u'melancholy', u'singer-songwriter', u'covers', u'beautiful', u'rock', u'hurt', u'classic rock', u'favorites', u'melancholic', u'american', u'male vocalists', u'cash', u'legend', u'Mellow', u'emotional', u'00s', u'Alt-country', u'Awesome', u'guitar', u'classic', u'alternative', u'depressing', u'nine inch nails', u'pain', u'better than the original', u'blues', u'intense', u'americana', u'Favourites', u'nine inch nails cover', u'haunting', u'Favorite', u'dark', u'Great Covers', u'Love', u'male vocalist', u'amazing', u'Heartbreaking', u'powerful', u'oldies', u'favourite', u'perfect', u'brilliant', u'classic country']"
37,Hurt,1009094,7810321,218000,"[u'country', u'cover', u'acoustic', u'sad', u'folk', u'Johnny Cash', u'melancholy', u'singer-songwriter', u'covers', u'beautiful', u'rock', u'hurt', u'classic rock', u'favorites', u'melancholic', u'american', u'male vocalists', u'cash', u'legend', u'Mellow', u'emotional', u'00s', u'Alt-country', u'Awesome', u'guitar', u'classic', u'alternative', u'depressing', u'nine inch nails', u'pain', u'better than the original', u'blues', u'intense', u'americana', u'Favourites', u'nine inch nails cover', u'haunting', u'Favorite', u'dark', u'Great Covers', u'Love', u'male vocalist', u'amazing', u'Heartbreaking', u'powerful', u'oldies', u'favourite', u'perfect', u'brilliant', u'classic country']"
38,Go,172895,593215,241000,"[u'electronic', u'dance', u'electronica', u'trance', u'ambient', u'techno', u'House', u'chillout', u'90s', u'Moby', u'Rave', u'heard on Pandora', u'alternative', u'electro', u'old skool', u'pop', u'rock', u'seen live', u'favorites', u'1991', u'twin peaks', u'dj delberts dorky dance drops', u'Soundtrack', u'chill', u'classic', u'funk', u'beautiful', u'funky', u'old school', u'groovy', u'jecks', u'Nineties House', u'meine liebsten kellerleichen der 90er', u'-electronic-', u'indie', u'lounge', u'party', u'Laura Palmer', u'schwabinger schicksen', u'Moby - go', u'MJ-just playin tunes', u'Ambient Atmospheric House', u'Disco', u'classic rock', u'trip-hop', u'jazz', u'soul', u'instrumental', u'punk', u'alternative rock']"
39,Wait for Me,90433,515543,254000,"[u'electronic', u'chillout', u'ambient', u'downtempo', u'piano', u'easy listening', u'melancholy', u'Moby', u'electronica', u'sad', u'female vocalists', u'2009', u'beautiful', u'late night', u'melancholic', u'relaxing', u'chill', u'Dreamy', u'moody', u'seen clip', u'trip-hop', u'pop', u'experimental', u'down tempo', u'idm', u'trip hop', u'Mellow', u'amazing', u'Progressive House', u'best of 2009', u'00s', u'chill out', u'import', u'perfect', u'sensual', u'2000s', u'radio paradise', u'radioparadise', u'loneliness after dusk', u'loooove', u'magic', u'mind-melting', u'7 of 10 stars', u'10 of 10 stars', u'6 of 10 stars', u'Silent Hill', u'fall', u'tv show', u'rainy night', u'Akira Yamaoka']"
40,The Beast,100476,629481,230000,"[u'folk', u'australian', u'indie', u'alternative', u'singer-songwriter', u'Mellow', u'chill', u'chillout', u'rock', u'acoustic', u'angus and julia stone', u'beautiful', u'pop', u'indie rock', u'Driving', u'2007', u'australia', u'rainy day music', u'seen live', u'alternative rock', u'Surf', u'indie pop', u'epic', u'lounge', u'funky', u'deep', u'folk rock', u'nice', u'indie folk', u'loved', u'good', u'male vocalists', u'00s', u'alternative pop', u'perfect to listen to while leaving the planet', u'sweet', u'animals', u'Love it', u'3 stars', u'Background', u'easy', u'Very Good', u'festival', u'winter music', u'Learn on guitar', u'favourite track', u'new indie', u'awsome', u'feels good', u'My pop music']"
41,Black Crow,98005,636301,230000,"[u'indie', u'folk', u'australian', u'vugube62', u'pop', u'alternative rock', u'folkpop', u'nu jazz', u'chillout', u'singer-songwriter', u'acoustic', u'lounge', u'nujazz', u'Mellow', u'indie folk', u'jazzy', u'2010', u'animals', u'ouch', u'male vocals', u'radio paradise', u'radioparadise', u'suziko-u5', u'4 Stars', u'4 of 10 stars', u'progressive folk', u'softly', u'ben', u'Better Than Sex', u'i relate', u'wishing well of ghosts']"
42,Hold On,115289,738202,265000,"[u'indie', u'folk', u'beautiful', u'sad', u'australian', u""Grey's Anatomy"", u'Mellow', u'vugube62', u'chillout', u'pop', u'female vocalists', u'singer-songwriter', u'Dreamy', u'melancholy', u'heartbreak', u'makes me sad', u'reminds me of someone', u'angus and julia stone', u'nu jazz', u'chill', u'alternative rock', u'favorite songs', u'indie rock', u'acoustic', u'strings', u'nujazz', u'fip', u'female vocals', u'indie folk', u'loved', u'jazzy', u'female vocalist', u'break', u'relax', u'heartache', u'nostalgia', u'2010', u'magic', u'suziko-u5', u'4 Stars', u'7 of 10 stars', u'6 of 10 stars', u'LOVE LOVE LOVE', u'lush', u'revenge', u'softly', u'pensive', u'somafm', u'relevant magazine', u'folkpop']"
43,And the Boys,164680,997708,250000,"[u'folk', u'indie', u'singer-songwriter', u'australian', u'female vocalists', u'lizvelrene2010', u'acoustic', u'LastfmSC', u'female vocalist', u'driving with the windows down on a breezy night', u'angus and julia stone', u'vugube62', u'pop', u'alternative', u'Mellow', u'love at first listen', u'2010', u'light', u'the boys i mean are not refined', u'niceday', u'from friends to enjoy', u'nu jazz', u'chill', u'alternative rock', u'favorite songs', u'2009', u'sad', u'calm', u'Love', u'christmas', u'beautiful', u'Awesome', u'nujazz', u'party', u'folk rock', u'emotional', u'melancholic', u'fun', u'quiet', u'jazzy', u'lovely', u'Aussie', u'XYZ', u'indie-folk', u'8 of 10 stars', u'sick', u'broken heart', u'ouch', u'ZicCool', u'as good as it gets']"
44,Paper Aeroplane,235169,1334205,223000,"[u'folk', u'chillout', u'acoustic', u'australian', u'indie', u'smooth', u'chill', u'singer-songwriter', u'alternative', u'pop', u'indie folk', u'lounge', u'indie pop', u'Mellow', u'00s', u'ambient', u'favorites', u'electronic', u'easy listening', u'folk pop', u'2006', u'Hotel Costes', u'alternative rock', u'indie rock', u'downtempo', u'roots', u'folk rock', u'loved', u'male vocalists', u'relax', u'chill out', u'tantotempotaste', u'angus and julia stone', u'Paper Aeroplane', u'paper aeroplane by angus and julia stone', u'Angus  Julia Stone', u'Soundtrack', u'seen live', u'vocal', u'rock', u'albums I own', u'calm', u'Love', u'Lo-Fi', u'Fusion', u'britpop', u'beautiful', u'melodic', u'guitar', u'cover']"
45,Just a Boy,137088,970610,237000,"[u'folk', u'acoustic', u'indie', u'australian', u'harmonica', u'Angus and Juli Stone', u'chillout', u'rock', u'indie pop', u'singer-songwriter', u'favorites', u'Mellow', u'<3', u'angus and julia stone', u'sweet harmonica', u'seen live', u'pop', u'chill', u'alternative', u'Love', u'americana', u'lovesong', u'pretty', u'new', u'soft', u'folk rock', u'2007', u'loved', u'male vocalist', u'male vocalists', u'alternative pop', u'Singer/Songwriter', u'accoustic', u'relax', u'lovely', u'indie-folk', u'2010', u'sweet', u'Words', u'3 stars', u'Background', u'Favourite Songs', u'5', u'softly', u'DL', u'New Love', u'something about it', u'for you', u'My pop music', u'verlieben ist ne super sache so']"
46,Big Jet Plane,338415,2613560,239000,"[u'indie', u'folk', u'chillout', u'beautiful', u'indie folk', u'australian', u'pop', u'love at first listen', u'singer-songwriter', u'alternative rock', u'Love', u'acoustic', u'Mellow', u'melancholic', u'favorites', u'Awesome', u'chill', u'alternative', u'indie pop', u'female vocalists', u'melancholy', u'male vocalists', u'gilbert', u'gilbert linley', u'vugube62', u'happy', u'easy listening', u'feel good', u'lounge', u'peaceful', u'Like', u'folk rock', u'australia', u'love songs', u'sunshine', u'duet', u'duo', u'Favourites', u'2010', u'sensual', u'4 Stars', u'chillig', u'easy a', u'angus and julia stone', u'Open Skies', u'nu jazz', u'female', u'country', u'favorite songs', u'sexy']"
47,For You,142865,961087,319000,"[u'indie', u'folk', u'acoustic', u'female vocalists', u'singer-songwriter', u'beautiful', u'Mellow', u'pop', u'chill', u'australian', u'Love', u'indie folk', u'love songs', u'Masterpiece', u'lush', u'vugube62', u'chillout', u'alternative rock', u'favorite songs', u'indie rock', u'sad', u'Awesome', u'amazing', u'melancholic', u'male vocalist', u'female vocalist', u'Ballad', u'lovely', u'sweet', u'beautiful voice', u'as good as it gets', u'revenge', u'alt-folk', u'Soundtrack Of My Life', u'sweetest female voices', u'Soundtrack', u'nu jazz', u'indie pop', u'Cool music', u'cute', u'Dreamy', u'feel good', u'nujazz', u'summer', u'Adult Alternative', u'emotional', u'female vocals', u'loved', u'jazzy', u'surf rock']"
48,I'm Not Yours,95383,631194,238000,"[u'folk', u'indie', u'piano', u'chillout', u'beautiful', u'female vocalists', u'Awesome', u'vugube62', u'pop', u'australian', u'nu jazz', u'rock', u'alternative rock', u'sad', u'singer-songwriter', u'dark', u'angry', u'nujazz', u'winter', u'melancholic', u'earnest', u'female vocals', u'indie folk', u'jazzy', u'Heartbreaking', u'love at first listen', u'2010', u'makes me cry', u'ZicCool', u'4 Stars', u'softly', u'depressive', u'5 of 10 stars', u'broken soul', u'you break my heart dear song', u'disquieting', u'makes me remember things i should not remember', u'songs that kill you inside', u'heartbreaks and bittersweet days', u'Consistent Dodo Radio - Flittering', u'Do You Want The Truth Or Something Beautiful', u'aydolor', u'viha']"
49,Killing All the Flies,156761,889081,275000,"[u'post-rock', u'instrumental', u'indie', u'post rock', u'experimental', u'ambient', u'rock', u'alternative', u'seen live', u'Scottish', u'Mogwai', u'beautiful', u'epic', u'amayzes loved', u'chillout', u'electronic', u'Progressive rock', u'shoegaze', u'00s', u'davaho53', u'electronica', u'chill', u'alternative rock', u'favorite songs', u'Dreamy', u'cinematic', u'atmospheric', u'scotland', u'postrock', u'Instrumental music that makes you feel-group tag radio', u'WoopWoop', u'british', u'sad', u'downtempo', u'favorites', u'britpop', u'Experimental pop', u'Awesome', u'instrumental rock', u'2003', u'choir', u'bass', u'loud', u'late night', u'Progressive', u'Mellow', u'top', u'great', u'space rock', u'favourite']"
50,The Sun Smells Too Loud,120062,668795,418000,"[u'post-rock', u'instrumental', u'post rock', u'happy', u'electronic', u'summer', u'rock', u'british', u'hypnotic', u'flowing', u'sleep music', u'so much happiness it bothers ur ear', u'alternative rock', u'experimental', u'Scottish', u'psychedelic', u'feel good', u'Uplifting', u'00s', u'mesmerising', u'noise', u'chillout', u'indie', u'alternative', u'noise rock', u'downtempo', u'UK', u'2008', u'repetitive', u'britpop', u'beautiful', u'melodic', u'long', u'atmospheric', u'post', u'glasgow', u'Mellow', u'postrock', u'Favorite Artists', u'intense', u'relaxing', u'fun', u'sex', u'trippy', u'great song', u'love at first listen', u'audioase', u'tune', u'Air', u'subtle']"
51,I'm Jim Morrison I'm Dead,24463,145810,417000,"[u'post-rock', u'post rock', u'Progressive rock', u'Mogwai', u'alternative', u'trip', u'suicidal', u'subtle', u'Orgasmic', u'real music', u'force', u'me like', u'Everybody Should Listen To', u'contender for 2008 CD', u'perfect song for a suicide']"
52,"I Love You, I'm Going To Blow Up Your School",80665,419678,477000,"[u'post-rock', u'instrumental', u'post rock', u'alternative', u'ambient', u'melancholy on the edge of apocalypse', u'soul', u'sad', u'beautiful', u'soft', u'powerful', u'rock', u'experimental', u'Progressive rock', u'slow', u'Love', u'britpop', u'space', u'lovesong', u'postrock', u'emotional', u'noisy', u'love at first listen', u'school', u'Eargasm', u'easy', u'drama', u'immense', u'great song titles', u'i have seen live', u'I could listen to this song forever', u'slow-motion rock', u'radio hugh', u'songs that you wanna listen to over and over again', u'the sky was so big that it broke my soul', u'iminlovewiths', u'awesome title', u'too good to be true', u'me like', u'title says it all', u'worte', u'idioteque', u'sporo a mocno', u'i cant identify with this', u'title-tastic', u'giusychevola gifts from friends', u'Die Besten Songtitel', u'strong title', u'best name song everrrrr', u'happy h mhpws xapi']"
53,May nothing but hapiness come through your door,1414,3249,0,"[u'instrumental', u'post-rock', u'ambient']"
54,Take Me Somewhere Nice,185146,970874,417000,"[u'post-rock', u'indie', u'beautiful', u'post rock', u'Mogwai', u'instrumental', u'Mellow', u'Scottish', u'atmospheric', u'alternative', u'ambient', u'sad', u'chillout', u'chill', u'rock', u'melancholic', u'indie rock', u'alternative rock', u'experimental', u'favorites', u'calm', u'guitar', u'relaxing', u'Dreamy', u'melancholy', u'ambient rock', u'Take Me Somewhere Nice', u'emo', u'Experimental Rock', u'easy listening', u'shoegaze', u'instrumental rock', u'strings', u'haunting', u'slowcore', u'nice', u'Whisper', u'queer as folk', u'4jsduskmellow', u'electronic', u'Progressive rock', u'epic', u'sadcore', u'Awesome', u'melodic', u'drums', u'Progressive', u'introspective', u'Sleep', u'Favorite']"
55,Teargas,84155,835343,203000,"[u'doom metal', u'depressive rock', u'Progressive metal', u'metal', u'Gothic Metal', u'swedish', u'alternative metal', u'dark rock', u'melancholic', u'Katatonia', u'rock', u'Doom', u'alternative rock', u'Progressive', u'death metal', u'heard on Pandora', u'Sweden', u'Masterpiece', u'Swedish Metal', u'the best', u'Kill me now', u'heavy metal', u'seen live', u'sad', u'Gothic', u'beautiful', u'favourite', u'great lyrics', u'Rips my fucking soul apart', u'despair', u'Emo rock', u'lyrical genius', u'depressive', u'progressive doom metal', u'Dark metal', u'really awesome', u'awesome harmony', u'slgdm', u'alternative', u'favorite songs', u'Progressive rock', u'favorites', u'energy', u'epic', u'Awesome', u'Dreamy', u'Mellow', u'melancholy', u'1', u'amazing']"
56,Cody,189180,1002072,371000,"[u'post-rock', u'instrumental', u'indie', u'post rock', u'Scottish', u'ambient', u'Mogwai', u'Mellow', u'slowcore', u'british', u'atmospheric', u'skins', u'chillout', u'shoegaze', u'Ballad', u'alternative', u'indie rock', u'chill', u'downtempo', u'90s', u'relaxing', u'rock', u'alternative rock', u'experimental', u'UK', u'beautiful', u'haunting', u'sad', u'Lo-Fi', u'amazing', u'Rainy Day', u'emotional', u'lovely', u'Dream', u'evening', u'4jsduskmellow', u'sad songs to listen to while lying on your back in the dark', u'pop', u'favorites', u'Experimental Rock', u'new age', u'glasgow', u'melancholy', u'ethereal', u'melancholic', u'trip', u'6 of 10 stars', u'1999', u'touching', u'serene']"
57,Next To Me,16708,66315,236000,"[u'singer-songwriter', u'male vocalists', u'You know', u'For Her', u'hairy chest', u'sweet - sweeter - nina', u'whatevertogether', u'songsof2010', u'plvaronaswow2010', u'songsof2011', u'us-singer', u'i know love']"
58,West,5970,22779,227000,"[u'male vocalists', u'hairy chest', u'us-singer']"
59,Pacific,11998,53609,168000,[u'goodvideobackgroundmusic']
60,Arctic,6380,27470,292000,[]
61,Neptune,13725,68614,280000,"[u'male vocalists', u'Great Lyricists', u'hairy chest', u'songsof2014', u'us-singer']"
62,Pluto,6292,32878,229000,[]
63,Earth,10793,48698,268000,[]
