,Songs,Listeners,Playcount,Duration,Tags
362,Wicked Game,264023,2104387,245000,"[u'Love Metal', u'rock', u'cover', u'metal', u'HIM', u'Gothic Rock', u'covers', u'finnish', u'Gothic', u'Gothic Metal', u'alternative', u'hard rock', u'Love', u'alternative rock', u'cover songs', u'sexy', u'Wicked Game', u'heavy metal', u'favorites', u'90s', u'alternative metal', u'chris isaak', u'dark rock', u'Chris Isaak cover', u'Ville Valo', u'HiM Wicked Game', u'favorite songs', u'male vocalist', u'Nu Metal', u'male vocals', u'Smallville', u'classic rock', u'seen live', u'indie', u'pop', u'Grunge', u'goth', u'Progressive metal', u'Progressive rock', u'dance', u'beautiful', u'sex', u'cover song', u'finland', u'goth rock', u'indie rock', u'Awesome', u'amazing', u'nostalgic', u'melancholic']"
363,Cyberchrist,6316,20176,339000,"[u'black metal', u'metal', u'classic', u'finland', u'oulu', u'its not black metal']"
364,True Strengths,6499,20695,154000,"[u'hardcore', u'hardcore punk', u'punk', u'nyhc', u'thrash metal']"
365,Alpha and Omega,129,259,323000,[]
366,Hopeless Etheride,3400,10290,189000,"[u'black metal', u'USBM', u'metal', u'United States', u'kvlt', u'favorite band', u'Underground Black Metal', u'headbangers ball']"
367,Bitch (Dance H@x0RZ $h1+),305,876,0,[u'breakcore']
368,While We Sleep,38341,312988,381000,"[u'Melodic Death Metal', u'metal', u'epic', u'death metal', u'finnish', u'finnish metal', u'seen live', u'chill', u'Progressive metal', u'doom metal', u'folk metal', u'8 of 10 stars', u'fuck yeah', u'Masterpiece', u'Melodic death-doom metal', u'gothemburg metal', u'more awesome than a box of pure awesomeness', u'salvadorsas']"
369,Entering Odin's Huge Palace,963,2808,348000,"[u'viking metal', u'fresh', u'Morning music', u'Himinbjorg']"
370,Nuclear Attack,46712,418490,249000,"[u'Power metal', u'heavy metal', u'metal', u'war metal', u'Swedish Metal', u'WWII', u'epic', u'battle metal', u'seen live', u'war', u'nuclear', u'HEERSCHT', u'rock', u'swedish', u'speed metal', u'alternative metal', u'heard on Pandora', u'4', u'Sweden', u'6 of 10 stars', u'World War II', u'nagasaki', u'sett live', u'Beef Metal', u'hiroshima', u'nuclear metal', u'marcia likes it', u'songs about aerial warfare', u'kasi', u'42fm', u'dynamic and energetic music']"
371,Shapeless (Judgement) (ft. Adrian Fitipaldes),9,41,0,[]
372,Jeszcze I Jeszcze,6125,56279,353000,"[u'black metal', u'metal', u'polish', u'traditional', u'polish black metal']"
373,Mooneskyggens Slave,2909,10591,0,"[u'black metal', u'Norway']"
374,Wizard Of Sextown,4,5,0,[]
375,Amidst The Macabre (Instrumental),842,3247,113000,"[u'metal', u'instrumental', u'instrumental metal']"
376,Somersault,19350,114457,270000,"[u'prevrtanje preko glave', u'road trip in the middle of the night']"
377,Sessions You'll Never See,1518,4413,151000,[]
378,Not of this Earth,7804,36582,256000,"[u'electronic', u'synthpop', u'synthwave']"
379,Withershins,26678,140389,62000,"[u'black metal', u'instrumental', u'dark ambient', u'raw black metal', u'chambers and catacombs', u'Black', u'swedish black metal', u'metal', u'swedish', u'dark', u'intro', u'black death metal', u'Sweden', u'funeral', u'melodic black metal', u'Swedish Metal', u'interlude', u'instrumental black metal', u'Dissection', u'Season Of Mist', u'TOTAL WAR', u'mmpps']"
380,No Hope Goat Farm,4862,18398,226000,"[u'doom metal', u'metal', u'wino', u'Stoner Rock', u'stoner doom', u'Psychedelic Rock', u'stoner metal', u'Traditional Doom Metal', u'fuzz-rock', u'70s revival', u'old-school great melodic yet heavy oh yeahh']"
381,Far Too Long,5124,13902,224000,"[u'rock', u'hard rock', u'industrial rock', u'metal', u'indie', u'7 of 10 stars', u'6 of 10 stars', u'songs by bands with the suffix head', u'Godhead', u'GODHEAD - EVOLVER - FAR TOO LONG', u'Norderdorfer', u'Norderdorfer-Indie', u'Norderdorfer-Punk', u'norderdorfer-hardrock']"
382,Embrace the Afterglow,38,85,0,[]
383,Red,10663,61380,395000,"[u'Progressive metal', u'metal', u'Avant-garde Metal']"
384,Ein eim av blod og helvetesild,14340,66604,189000,"[u'black metal', u'Norwegian Black Metal', u'metal', u'True Norwegian Black Metal', u'Gorgoroth', u'satan', u'norwegian', u'grim', u'caustic', u'true black metal', u'3 of 10 stars', u'old school black metal', u'norwegia']"
385,"1,000 Eyes",85800,568994,268000,"[u'death metal', u'Technical Death Metal', u'progressive death metal', u'metal', u'Progressive metal', u'death', u'old school death metal', u'heavy metal', u'USA', u'90s', u'Masterpiece', u'epic', u'Melodic Death Metal', u'american', u'Progressive', u'amazing', u'FUCKING AWESOME', u'1995', u'Brutal Death Metal', u'headbanging', u'Technical Metal', u'All time favourites', u'Awesome solo', u'Death Metal Legend', u'Awesome', u'aggressive', u'great lyrics', u'8 of 10 stars', u'Love it', u'Favourite Songs', u'technical death', u'nice intro', u'classic metal', u'Great Intro', u'musical genius', u'Razor', u'9 lbs hammer', u'Chuck Schuldiner', u'nice solo', u'nice riff', u'Killing Riff', u'death thrash metal', u'best death metal', u'argh', u'florida death', u'Neo Romantic', u'prog death', u'CHOO CHOO TRAIN 2k5', u'Technical Drums', u'sick-solo-action']"
386,Wheel,8408,26783,472000,"[u'Progressive rock', u'psychedelic', u'mellotron', u'cowbell', u'experimental', u'Progressive metal', u'art rock', u'6 of 10 stars', u'look into', u'revisit', u'from: sweden', u'FODA', u'gentle giant', u'RetroProg', u'hard progressive rock', u'Rzepa', u'anekdoten-wheel', u'jos4', u'jos3', u'gentle giant-esque']"
387,Looking Out My Back Door (Creedence Clearwater Revival),1330,5322,0,"[u'heavy metal', u'cover', u'excellent']"
388,Black Stains,2432,9542,292000,"[u'Progressive metal', u'Avant-garde Metal', u'Kick ass metal']"
389,Times Without Changes,11976,64290,178000,"[u'Ballad', u'Melodic Death Metal', u'piano', u'Power metal', u'seen live', u'calm', u'rock', u'Progressive rock', u'beautiful', u'Awesome', u'thrash metal', u'melancholy', u'emotional', u'danish', u'wonderful', u'Eargasm', u'eargasms', u'ballads', u'best songs ever', u'beautiful vocals', u'most beautiful songs ever', u'Beautiful sadness', u'metal ballad', u'beautiful piano', u'Beautiful atmosphere', u'songs to sing along with', u'the most beautiful', u'special ballads selection - Hastear', u'no words can describe this', u'very emotional', u'Atmospheric masterpiece', u'fantastic feeling', u'genious atmosphere', u'beautiful feeling', u'wonderful piano', u'euphory', u'extra melancholy', u'beautiful clean vocals', u'wonderful synth themes', u'beautiful synth themes']"
390,The Perils Of Indifference (Xotox Remix),3230,11805,252000,"[u'grindcore', u'electric', u'powerful', u'whispering', u'Aggrotech', u'terrifying', u'cybergrind', u'radiant', u'rotating', u'high voltage', u'cyberglitch', u'cyberotating']"
391,Snowing Still,10680,44684,342000,"[u'black metal', u'doom metal', u'melodic black metal', u'Greek', u'best', u'Eargasm', u'melancholic black metal', u'death-doom metal', u'kills', u'greek metal', u'gothic doom', u'cinnamon', u'90s black metal', u'metal united']"
392,Plastik Christ,4656,19476,348000,"[u'dark electro', u'ebm', u'industrial', u'Harsh EBM', u'Aggrotech', u'electronic', u'electro', u'3', u'1', u'dark industrial', u'2', u'electro-industrial', u'All']"
393,Your Time Is Gonna Come,355436,1637556,281000,"[u'classic rock', u'rock', u'hard rock', u'Led Zeppelin', u'60s', u'blues rock', u'70s', u'Progressive rock', u'british', u'blues', u'heavy metal', u'organ', u'classic', u'favorites', u'male vocalists', u'1969', u'guitar', u'Psychedelic Rock', u'chill', u'male vocalist', u'alternative', u'Awesome', u'British Blues', u'keyboards', u'Robert Plant', u'strings organs rubber wind', u'favorite songs', u'heavy', u'UK', u'calm', u'acoustic', u'blues-rock', u'rock n roll', u'Favourites', u'6 of 10 stars', u'revenge', u'british rock', u'jimmy page', u'zeppelin', u'john paul jones', u'led zep', u'your time is gonna come', u'vugube62', u'melodic', u'psychedelic', u'groove', u'Progressive', u'oldies', u'folk rock', u'Rock and Roll']"
394,Danse Macabre,26578,81566,231000,"[u'black metal', u'thrash metal', u'metal', u'Avant-Garde', u'death metal', u'blackened thrash metal', u'Celtic Frost', u'heavy metal', u'instrumental', u'ambient', u'dark ambient', u'Atmospheric metal', u'experimental', u'viking metal', u'Doom', u'Gothic Metal', u'switzerland', u'trippy', u'4', u'Extreme Metal', u'evil', u'halloween', u'Black', u'pagan metal', u'classic metal', u'old school black metal', u'Kult', u'first wave black metal', u'black/thrash metal', u'early black metal', u'necropotence', u'reminds me of the residents', u'proto-death', u'Heavy Oldies', u'zombie orgy', u'twisted and scary', u'mmpps', u'myk celtic frost', u'sex-offender ambient']"
395,To The End,24318,108728,296000,"[u'Progressive metal', u'Progressive rock', u'metal', u'Pain Of Salvation', u'heavy metal', u'rock', u'swedish', u'prog', u'Progressive', u'good', u'inspiring', u'6 of 10 stars', u'great singer', u'from: sweden', u'daniel gildenlow', u'metal favorites', u'tagged to remember', u'jlunare', u'jlunarepowerful', u'Devo321']"
396,End Of Love,820,2547,220000,[u'SuomiPop']
397,Frozen Mile,2392,13418,276000,"[u'Gothic Metal', u'Gothic Rock', u'HIM', u'Dark metal', u'melancholic rock']"
398,Venter på stormene,3354,18159,786000,"[u'black metal', u'albums I own', u'ambient black metal', u'Norwegian Black Metal', u'atmospheric black metal', u'norvege', u'Black Metal Atmospherique', u'Black metal melodique', u'nidrosian black metal', u'terratur possessions', u'songs to play after you sit for an hour waiting for a bus']"
399,Frozen,36631,219164,225000,"[u'black metal', u'melodic black metal', u'death metal', u'Melodic Death Metal', u'Swedish Metal', u'metal', u'swedish black metal', u'Dissection', u'favorite songs', u'Blackened Death Metal', u'old school death metal', u'pure evil', u'classic', u'winter', u'cold', u'Sweden', u'8 of 10 stars', u'7 of 10 stars', u'Best Band EVER', u'Anti-Cosmic Metal of Death', u'frozen', u'swedish blackened death metal', u'black hearted', u'90s black metal', u'90s death metal', u'90s swedish black metal', u'90s melodic death metal', u'myk black metal', u'anti-cosmic', u'ftgtdxhtr', u'swedisch black metal', u'metalmittwoch']"
400,Behold the Kingdom of the Wretched Undying,1060,5281,0,[]
401,Bringing Me Down,101492,341722,187000,"[u'Nu Metal', u'metal', u'alternative metal', u'rock', u'Drowning Pool', u'hard rock', u'Nu-metal', u'Bringing Me Down', u'heavy metal', u'alternative', u'heavy', u'drowning  pool', u'test', u'marilyn manson', u'Favorite Bands', u'Hard', u'pop rock', u'Awesome', u'funky', u'Radio', u'great song', u'heard on Pandora', u'post-grunge', u'relax', u'2012', u'6 of 10 stars', u'In Flames', u'preferiti', u'kick ass', u'aggression', u'best played loud', u'rocking out', u'Fuckin AWESOME', u'Southern Gospel', u'study music', u'amber', u'Stone Sour', u'Torquemada', u'fun rock', u'gospel soul', u'x3', u'abrocken', u'Sau nice', u'March 22', u'Working Mix', u'the m-c big smile award', u'RockItToMe', u'Drowning Pool - Bringing Me Down', u'electricsaint charts', u'LordLex92s']"
402,The Sentient,105,199,472000,[]
403,And The Consequence Macabre,10005,64396,403000,"[u'Symphonic Black Metal', u'black metal', u'metal', u'symphonic', u'black fucking metal', u'Best Symphonic Black Metal band']"
404,Devil's Path 2000,9100,41105,365000,"[u'black metal', u'Symphonic Black Metal', u'metal', u'norwegian', u'amazing', u'symphonic metal', u'8 of 10 stars', u'love the solo', u'Favourite metal songs']"
405,See You In Disneyland,436,2504,288000,[]
406,Kalmankaunis,1834,10861,334000,"[u'melodic black metal', u'Dark metal', u'finland']"
407,Sintetic...,7,21,0,[]
408,The Carnage People,10641,40136,181000,"[u'Gothic Metal', u'symphonic metal', u'investigate', u'Gothic Rock', u'flowing tears', u'zen6ini']"
409,Kalt' Ritt In Leicht Faltiger Leere,1562,4682,325000,"[u'black metal', u'metal', u'depressive black metal', u'blackened doom metal']"
410,Keep Your Eyes Closed,2095,15430,247000,"[u'speedcore', u'atmospheric black metal', u'industrial black metal']"
411,Blood of Saturn,869,3008,1062000,"[u'funeral doom metal', u'songs to play after you sit for an hour waiting for a bus']"
412,Watching In Silence,7543,38863,264000,"[u'heavy metal', u'Power metal', u'melodic metal', u'Progressive metal', u'metal', u'seen live', u'hard rock', u'folk metal', u'viking metal', u'melodic', u'2000s', u'bookmark', u'progressive power metal', u'pure love', u'The best songs', u'Black Metal sinfonico', u'lind', u'ProgPower Metal', u'heavy roll']"
413,Gypsy (Mercyful Fate cover),5240,19314,0,"[u'black metal', u'cover', u'covers', u'Norway', u'Symphonic Black Metal', u'Zaebis', u'mercyful fate', u'cover supreme']"
414,Beyond the Maze,2346,11916,393000,"[u'doom metal', u'Gothic', u'Gothic Metal', u'Gothic Rock', u'lacrimaindarkness']"
415,Celebration of the Fourth,20879,89800,173000,"[u'black metal', u'metal', u'industrial metal', u'Dark metal', u'Gothic Metal', u'industrial black metal', u'industrial', u'death metal', u'swiss', u'swiss black metal', u'heavy metal', u'electronica', u'swedish', u'experimental', u'doom metal', u'death', u'thrash metal', u'Doom', u'switzerland', u'check', u'Extreme Metal', u'8 of 10 stars', u'Black Doom Metal', u'Black n Roll', u'ulubione', u'Samael', u'bands I need to check out', u'my stuff', u'Rock and Roll Thrash', u'to the bone', u'black hearted', u'myk black metal']"
416,Pentagram,33015,148887,212000,"[u'death metal', u'thrash metal', u'old school death metal', u'metal', u'80s', u'thrash', u'Megadeth', u'Possessed', u'USA', u'satanic', u'old school thrash metal', u'deathrash', u'KILL', u'718 Metal', u'heavy metal', u'rock', u'heavy', u'brutal', u'solo', u'speed metal', u'death', u'american', u'old school', u'san francisco', u'Extreme Metal', u'occult', u'anti-christian', u'Ritual', u'fuck yeah', u'1980s', u'Old-School', u'Brutal Death Metal', u'us', u'cryptic', u'hell', u'murder', u'speed', u'Destruction', u'Killing', u'satan', u'legend', u'Legendary', u'mtv', u'classic metal', u'true metal', u'80s metal', u'Extreme', u'death-thrash metal', u'american metal', u'american death metal']"
417,Filth,662,2038,184000,[]
418,Das Model (Kraftwerk Cover),16,28,0,[]
419,Hinein Ins Licht,647,2472,211000,[u'akirahoshi unsure']
420,Bats In the Belfry,7544,24225,287000,"[u'thrash metal', u'metal', u'heavy metal', u'guitar', u'good shit', u'heard on Pandora', u'male vocalist', u'2005', u'2000s', u'english lyrics', u'animal', u'bat', u'Overkill', u'aboooo', u'belfry', u'relixiv', u'k1r7m']"
421,Alley of Oaks,1597,6359,329000,"[u'metal', u'6 of 10 stars']"
422,Victory Memorial,292,661,0,[]
423,Part VII,6215,35169,579000,"[u'black metal', u'true black metal', u'norwegian', u'true', u'Norwegian Black Metal']"
424,For Your Demons,11232,95560,264000,"[u'doom metal', u'melancholic', u'Death Doom Metal', u'late at night', u'dark', u'beautiful', u'Doom', u'Gothic Metal', u'saturnus', u'folk', u'folk metal', u'atmospheric', u'melancholy', u'death metal', u'love at first listen', u'melodic metal', u'sorrow', u'Feeling Blue', u'Gothic Doom Metal', u'me like', u'doom at its best', u'the sweetest memories', u'mylimiausieji']"
425,Play Dead,4,5,0,[]
426,The Missing Hour,5860,36462,182000,"[u'neofolk', u'martial industrial', u'martial', u'neoclassical', u'Fever', u'apocalyptic folk', u'sear me', u'zonsondergang', u'heartsick radio', u'love adventure']"
427,Til Kongens Grav de Dode Vandrer,1846,5473,390000,"[u'black metal', u'metal', u'ambient black metal', u'atmospheric black metal']"
428,Sands,1391,5882,597000,"[u'chillout', u'electronic', u'electronica', u'indie', u'chill', u'instrumental', u'ambient', u'post-rock', u'downtempo', u'Love', u'epic', u'beautiful', u'instrumental rock', u'guitar', u'long', u'atmospheric', u'emotional', u'post rock', u'romantic music', u'no lyrics', u'orange label reflective frequencies', u'moodiness is next to godliness', u'instrumental tones to write by', u'beQuiet', u'endspann', u'thisEndsofStart', u'contrapunkt']"
429,Walkin',514,1617,238000,[]
430,Ground,42675,200938,235000,"[u'black metal', u'doom metal', u'thrash metal', u'metal', u'death metal', u'heavy metal', u'Gothic Metal', u'Avant-garde Metal', u'blackened thrash metal', u'rock', u'avant garde', u'Avant-Garde', u'avantgarde', u'satanic', u'Avantgarde Metal', u'Gothic Doom Metal', u'death/doom', u'seen live', u'Doom', u'switzerland', u'heard on Pandora', u'brilliant', u'Extreme Metal', u'Blackened Death Metal', u'Death Doom Metal', u'My Favorites', u'true metal', u'Old School Metal', u'the undertaker', u'fiendish', u'Celtic Frost', u'black/doom metal', u'ausgezeichnet', u'giger', u'arsivde', u'metal extremo', u'Blackest Of The Black', u'true metal gods', u'schary', u'myk celtic frost', u'Remember When I Set You On Fire', u'chh', u'blacker than the black', u'metalmittwoch']"
431,Redway.Org,1277,4444,213000,"[u'industrial metal', u'industrial black metal', u'cyber black metal', u'black metal']"
432,Still,5116,37709,209000,"[u'Gothic', u'german', u'Gothic Rock', u'deutsch', u'Favorite', u'i am a party girl here is my soundtrack', u'Remember', u'Depressiv', u'songs I fucking love to death', u'Everything i need', u'Titletracks', u'darwave']"
433,Relax You're Dead,287,679,408000,[]
434,Framed in Blood,43027,276872,225000,"[u'Gothic Rock', u'Gothic Metal', u'Gothic', u'finnish', u'goth', u'metal', u'The 69 eyes', u'rock', u'male vocalist', u'goth rock', u'alternative', u'sexy', u'finnish rock', u'goth n roll', u'69 Eyes', u'seen live', u'vocal', u'vampire', u'glam rock', u'skate', u'8 of 10 stars', u'Masterpiece', u'<3', u'lust', u'sends shivers down my spine', u'my doom', u'best fi', u'the 69 eyes - framed in blood', u'albums I own', u'hard rock', u'favorites', u'dark', u'Awesome', u'darkwave', u'groovy', u'cool', u'Favourites', u'3 stars', u'10 of 10 stars', u'Love Metal', u'2000', u'stfu', u'dark matter', u'dark rock', u'pantera', u'suomirock', u'My favourite', u""goth'n'roll"", u'psycho metal', u'Slipknot']"
435,Angel's Tombstone,10396,76016,286000,"[u'Melodic Death Metal', u'8 of 10 stars', u'7 of 10 stars']"
436,Akt 5.2,517,1317,280000,[]
437,Coma Song,204,1101,280000,[]
438,Climate Controller,5724,19643,471000,"[u'death metal', u'metal', u'progressive death metal', u'old school death metal', u'Progressive', u'cosmic death metal', u'florida death', u'prog death', u'nocturnus', u'S-F HORROR METAL']"
439,1985 (Instrumental),390,1180,0,[]
440,To the Victor the Spoils,18693,69066,223000,"[u'death metal', u'old school death metal', u'metal', u'morbid angel', u'Mendigao thrash', u'grindcore', u'Progressive metal', u'Progressive', u'great', u'great solo', u'Extreme Metal', u'Technical Death Metal', u'Stuff I Have Seen Live', u'718 Metal', u'war ensemble', u'Havrda', u'Dissonant Death Metal', u'natasha nice', u'aletta ocean', u'cecilia vega', u'brooke bennett', u'kelly divine', u'michelle vawer', u'olivia del rio', u'adrianne palicki']"
441,Inanimate Fathers,541,1177,459000,[]
442,9-29-045,11695,91193,929000,"[u'acoustic', u'Progressive metal', u'Progressive rock', u'beautiful', u'Songs over 10 minutes long', u'Progressive', u'FUCKING AWESOME', u'loved tracks', u'chill kill me', u'rock', u'Mellow', u'amazing', u'melancholic', u'Solitude', u'Masterpiece', u'lullaby', u'Orgasmic', u'goosebumps', u'stay in bed', u'melancholic rock', u'chill me', u'lifetime soundtrack', u'Cayman Islands', u'10min over', u'pell', u'pells roadtrack', u'oggock', u'favorite songs which hold a special place in my heart', u'the acoustic verses', u'chh', u'Dreaming is essential']"
443,Kerosene,3003,21173,237000,"[u'Gothic Rock', u'Gothic', u'german', u'Great Lyricists', u'metal', u'rock', u'calm', u'darkwave', u'male vocalists', u'dark rock', u'songs I fucking love to death', u'loved tracks', u'Everything i need', u'overdramatic', u'Razors favorites']"
444,dark dimensions (seelenzorn remix),481,3040,335000,[]
445,I Fade Away,5790,26925,605000,"[u'2012', u'2010s', u'darkmetal', u'downfall of gaia', u'suffocating in the swarm of cranes', u'k1r7m']"
446,Conjuration,3553,11136,117000,"[u'black metal', u'Blackened Death Metal', u'lucifer', u'uk metal']"
447,Dreaming in Columbian,8534,26719,240000,"[u'thrash metal', u'heavy metal', u'Overkill', u'thrash', u'heard on Pandora', u'pissed off', u'i hear black', u'k1r7m']"
448,Forgotten,7924,46458,239000,"[u'Gothic Metal', u'industrial', u'Gothic', u'industrial metal', u'batman', u'Headbang', u'Gothic industrial metal', u'electro metal']"
449,No Destiny,5156,16785,215000,"[u'Melodic Death Metal', u'death metal', u'progressive death metal']"
450,A Day in December,4524,29796,252000,[]
451,Tools of the New Church,302,964,419000,"[u'doom metal', u'stoner metal', u'Psychedelic Stoner Metal']"
452,Plague,259,1403,363000,[]
453,The Flame Surreal,8369,48239,210000,"[u'Progressive metal', u'Technical Death Metal', u'metal', u'instrumental', u'hardcore', u'metalcore', u'grindcore', u'death metal', u'post-hardcore', u'deathcore']"
454,Numbers Count For Nothing,60531,501617,230000,"[u'metalcore', u'hardcore', u'mathcore', u'metal', u'breakdown', u'british', u'UK', u'post-hardcore', u'audioase', u'FUCKING AWESOME', u'architects', u'Progressive Metalcore', u'Hollow Crown', u'regency ballroom 2010', u'k1r7m']"
455,Little Sisters (remix),52,138,186000,[u'industrial rock']
456,Dove-Tongued Aggressor,2913,10515,265000,"[u'metal', u'doom metal', u'wino', u'stoner-doom']"
457,Mutiny,7924,38107,178000,"[u'Nu-metal', u'heavy metal', u'metal', u'alternative', u'hard rock', u'alternative metal', u'industrial metal', u'Nu Metal', u'static-x', u'My reason to breathe', u'SICmuSIC']"
458,Ovum,11391,51791,205000,"[u'Technical Death Metal', u'death metal', u'Industrial Death Metal', u'metal', u'Melodic Death Metal', u'american', u'true metal', u'Love this song', u'electronic death metal']"
459,Satan's Boundaries Unchained,2348,12962,271000,"[u'thrash metal', u'Black Thrash', u'black metal']"
460,Ideate,15498,90918,245000,"[u'Progressive metal', u'Progressive rock']"
461,Acid Rain,38657,257187,401000,"[u'metal', u'heavy metal', u'rock', u'epic', u'symphonic metal', u'AVENGED SEVENFOLD', u'hardcore', u'doom metal', u'slow', u'death', u'male vocalists', u'heartbreak', u'3 stars', u'FUCKING EPIC', u'recovery', u'Guitar Solo', u'metal ballad', u'hail to the king', u'los angeles kings', u'plachoo']"
462,Book 1: Page 27,6636,19141,98000,"[u'Avant-garde Metal', u'experimental', u'mike patton', u'experimental metal']"
463,Extirpation,2316,11195,373000,"[u'electronic', u'industrial', u'synthpop', u'futurepop']"
464,Dark Spring,878,3708,318000,[]
465,Golfstrom,45,154,422000,[]
466,Paid In Blood,484,1050,199000,[]
467,Book 1: Page 8,8104,24675,61000,"[u'Avant-garde Metal', u'9 lbs hammer']"
468,My Drinkin' Problem,7079,38327,0,"[u'Alt-country', u'Recommended', u'Nashville', u'kickasstic', u'pay attention', u'indie', u'americana', u'country', u'alternative country', u'outlaw country', u'cowpunk', u'god-damned country']"
469,March,1723,5321,55000,[]
470,Electra Descending,14381,61606,272000,"[u'deathrock', u'goth', u'Gothic Rock', u'post-punk', u'Gothic', u'80s', u'goth rock', u'indie', u'rock', u'dark', u'Post punk', u'beautiful', u'upbeat', u'club', u'lyrics', u'FUCKING AWESOME', u'death rock', u'le dancefloor', u'music to drive by', u'batcave', u'loved tracks', u'rozz williams', u'I want back to the 80s', u'mage', u'just all sorts of faves', u'girls name', u'iheartdead', u'Christian Death', u'iheartdark', u'El Rey Cadaver', u'distress', u'transitglambat', u'pure magick', u'the sexiest male vocalist ever', u'California deathrock', u'true gothic rock']"
471,You Can't Love This (Pt. 1),557,1911,0,[]
472,Sign From The North Side,25135,92872,296000,"[u'death metal', u'Melodic Death Metal', u'metal', u'doom metal', u'finnish', u'doom death metal', u'Progressive metal', u'Gothic Rock', u'experimental', u'6 of 10 stars', u'nightmares', u'Folk-Metal', u'SuomiPop', u'Death Doom Metal', u'finnish death metal', u'Death/Doom Metal', u'death/doom', u'good7', u'suomimetalli']"
473,Dissonant Dissident,3079,13393,328000,"[u'Mechanical Technocracy', u'industrial', u'industrial metal', u'industrial rock', u'ebm', u'coldwave', u'4 Stars', u'electro-industrial', u'power electronics']"
474,Where the Last Wave Broke,44816,392549,303000,"[u'Melodic Death Metal', u'metal', u'death metal', u'atmospheric', u'finnish', u'melodic', u'6 of 10 stars', u'Insomnium', u'seen live', u'epic', u'finnish metal', u'melodic metal', u'FUCKING AWESOME', u'gothenburg metal', u'Bob Dylan', u'melodic death', u'my favorite band', u'9 lbs hammer', u'energizing', u'doomy melodic death metal', u'i came', u'finish melodic death metal', u'Ring Of Scars']"
475,Harshlizer,5102,28004,278000,"[u'Harsh EBM', u'electronic', u'industrial', u'ebm', u'dance', u'harsh dance', u'harsh rave', u'harsh trance', u'broken mellow harsh ebm synthpop', u'melodic harsh electro pop', u'Harshlizer']"
476,Little Fly/Mouchette,24780,130354,352000,"[u'atmospheric', u'ambient', u'Dreamy', u'contemporary classical', u'post rock', u'sounds', u'over 5 minutes long', u'hallig', u'zu harmonisch']"
477,Sound of Snow,3609,24783,282000,"[u'melancholic', u'rock', u'sad', u'atmospheric', u'beautiful', u'Awesome', u'finnish', u'alternative rock', u'Progressive rock', u'Love', u'piano', u'Dreamy', u'male vocalists', u'Gothic Rock', u'ShamRain', u'goosh']"
478,Fuck the Whales,246,831,890000,[]
479,Circles of the Oath,8697,34145,311000,"[u'black metal', u'metal', u'thrash metal', u'black/thrash metal']"
