,Songs,Listeners,Playcount,Duration,Tags
403,Seeds Of The Suffering,26756,113449,351000,"[u'death metal', u'Brutal Death Metal', u'Technical Death Metal', u'metal', u'Suffocation', u'Death  Metal', u'brutal', u'grindcore', u'USA', u'death', u'genius', u'Brutal Technical Death Metal', u'old school death metal', u'technical death', u'brutal death', u'Wicked', u'Elite Death Metal', u'this will fucking own your ass', u'Effigy of The Forgotten', u'the best shit since teddy bears', u'songs to headbang to', u'OMG xBREAKDOWNx', u'dheat metal', u'seeds of the suffering']"
404,Infecting The Crypts,47431,242542,285000,"[u'death metal', u'Brutal Death Metal', u'Technical Death Metal', u'metal', u'old school death metal', u'heavy metal', u'USA', u'death', u'american', u'Brutal Technical Death Metal', u'brutal death', u'old school death', u'my cat died when this played', u'best song of the album', u'alternative', u'Awesome', u'genius', u'Extreme Metal', u'favorite tracks', u'Iron Maiden', u'Tentacles', u'deathgrind', u'Technical Brutal Death Metal', u'technical', u'heavy as fuck', u'Greatest band ever', u'Old School Metal', u'extreme death metal', u'i had to change my pants after this song', u'Headbang', u'american death metal', u'deathmetal', u'rifftastic', u'real metal', u'zajebiste', u'Death Thrash', u'Brutal as Fuck', u'garten metal', u'new york death metal', u'Cradle Of Filth', u'US death metal', u'ive just been hit by a fucking train omfg', u'Suffocation', u'song is win', u'Songs That I Love To Play In Guitar', u'Guttural Deathcore', u'Ideal for Quaking', u'this will fucking own your ass', u'the best shit since teddy bears', u'Greatest Death Metal band ever']"
405,Liege of Inveracity,37860,176807,268000,"[u'death metal', u'Brutal Death Metal', u'Technical Death Metal', u'old school death metal', u'metal', u'Favorite Songs Metal', u'death', u'genius', u'aaaaa', u'live', u'Love it', u'Technical Brutal Death Metal', u'brutal death', u'riffs', u'9 lbs hammer', u'slam death metal', u'brutal metal', u'morbid angel', u'NYDM', u'gw metal', u'Brutal Deathmetal', u'Old School Brutal Death metal', u'Effigy of The Forgotten', u'fan heavy', u'guau death', u'listen any heavy', u'listenanyheavy', u'myk suffocation', u'insane death metal', u'weeenooo chakal la wea']"
406,Älä Käy Mulle,464,2982,0,[]
407,Solo Por Ser Indios,827,3419,224000,[u'intense']
408,Let It Go,179,658,356000,[]
409,Reviviendo las huestes,351,1044,190000,[]
410,La marcha de las ratas,358,1135,214000,[]
411,No habrá piedad,287,889,350000,[]
412,Somos el poder,61,188,0,[]
413,Etiqueta negra,46,182,0,[]
414,Etiqueta negra,46,182,0,[]
415,Etiqueta negra,46,182,0,[]
416,Spirit In Black,143043,747626,247000,"[u'thrash metal', u'metal', u'Slayer', u'heavy metal', u'thrash', u'speed metal', u'1990', u'dave lombardo', u'rock', u'favorites', u'angry', u'american', u'aggressive', u'good', u'trash metal', u'Awesome song', u'bay area thrash metal', u'718 Metal', u'metal favorites', u'Seasons In The Abyss', u'black metal', u'seen live', u'great', u'Like', u'crossover', u'satanic', u'male vocalist', u'great solo', u'Trash', u'uptempo', u'8 of 10 stars', u'9 of 10 stars', u'active', u'friendsofthekingofrummelpop', u'english lyrics', u'1990s', u'Faves', u'colours', u'rocks', u'Bay Area', u'From: USA', u'All time favourites', u'true metal', u'Old School Metal', u'death-thrash metal', u'old school thrash metal', u'9 lbs hammer', u'Megadeth', u'Testament', u'Live recording']"
417,Skeletons Of Society,132057,692452,281000,"[u'thrash metal', u'metal', u'Slayer', u'heavy metal', u'thrash', u'speed metal', u'rock', u'1990', u'friendsofthekingofrummelpop', u'seen live', u'Love', u'Awesome', u'cool', u'FUCKING AWESOME', u'apocalypse', u'dave lombardo', u'bay area thrash metal', u'metal as fuck', u'Seasons In The Abyss', u'skeletons of society', u'black metal', u'punk', u'alternative', u'alternative rock', u'heavy', u'emo', u'hard rock', u'doom metal', u'epic', u'american', u'punk rock', u'green day', u'amazing', u'death metal', u'loved', u'heard on Pandora', u'female vocalist', u'rock n roll', u'post-grunge', u'fav', u'brilliant', u'great solo', u'Trash', u'8 of 10 stars', u'9 of 10 stars', u'great songs', u'Power metal', u'Fuck yes', u'3 stars', u'wrif-fm']"
418,Hallowed Point,132409,683958,204000,"[u'thrash metal', u'metal', u'speed metal', u'Slayer', u'thrash', u'heavy metal', u'seen live', u'1990', u'hallowed point', u'rock', u'death metal', u'8 of 10 stars', u'bay area thrash metal', u'718 Metal', u'slgdmbestof', u'Seasons In The Abyss', u'classic', u'80s', u'90s', u'death', u'american', u'heard on Pandora', u'male vocalist', u'uptempo', u'3 stars', u'english lyrics', u'1990s', u'trash metal', u'Bay Area', u'dave lombardo', u'All time favourites', u'classic metal', u'aggression', u'80s metal', u'modern metal', u'death-thrash metal', u'riffs', u'5 of 10 stars', u'9 lbs hammer', u'Megadeth', u'Live recording', u'ass kicking', u'death thrash metal', u'In Your Fucking Face', u'west coast thrash', u'Nakoruru', u'Mendigao thrash', u'Tom ARAYA', u'Kerry King', u'Jeff Hannemann']"
419,Älä Käy Mulle,464,2982,0,[]
420,Älä Käy Mulle,464,2982,0,[]
421,Dead God in Me,92326,494397,255000,"[u'Melodic Death Metal', u'death metal', u'metal', u'Swedish Metal', u'gothenburg metal', u'In Flames', u'heavy metal', u'swedish', u'melodic metal', u'Extreme Metal', u'7 of 10 stars', u'Scandinavian Death Metal', u'seen live', u'hard rock', u'epic', u'Progressive', u'Sweden', u'progressive death metal', u'tool', u'scandinavia', u'Swedish Death Metal', u'scandinavian metal', u'a favorite', u'great riffs', u'oldschool melodic death metal', u'European Metal', u'relaxing and heavy', u'good1', u'less or more metal', u'melodious death metal', u'jester race', u'carne de juanolas', u'de gran magnitud', u'107miri', u'The Inborn Lifeless']"
422,Artifacts of the Black Rain,117628,791569,194000,"[u'Melodic Death Metal', u'death metal', u'metal', u'gothenburg metal', u'Swedish Metal', u'swedish', u'In Flames', u'melodic metal', u'heavy metal', u'gothenburg', u'Masterpiece', u'Masterpiece of IN FLAMES', u'seen live', u'epic', u'Awesome', u'90s', u'good', u'1996', u'growl', u'what god has on his i-pod', u'relaxing and heavy', u'melodic death metal - absolutely great song', u'best of in flames', u'satan headbangs to this stuff', u'Kick Ass nigger killing metal', u'artifacts of the black raine', u'rock', u'alternative', u'alternative rock', u'grindcore', u'sexy', u'favorites', u'melodic', u'speed metal', u'alternative metal', u'Favorite', u'fav', u'Extreme Metal', u'8 of 10 stars', u'7 of 10 stars', u'6 of 10 stars', u'Favourite Songs', u'colours', u'flames', u'june', u'may', u'headbanging', u'influential', u'Swedish Death Metal', u'favourite tracks']"
423,Destiny,1150,3333,578000,"[u'thrash metal', u'death metal', u'old school death metal', u'metal', u'melodic', u'death', u'thrash', u'Faves', u'chilling', u'american death metal']"
424,The Psychic,1173,3524,373000,"[u'thrash metal', u'death metal', u'old school death metal', u'metal', u'american death metal']"
425,Unhuman Drama,1164,3400,316000,"[u'thrash metal', u'death metal', u'old school death metal', u'metal', u'american death metal']"
426,Beyond Science,1282,3760,271000,"[u'thrash metal', u'death metal', u'old school death metal', u'metal', u'thrash', u'american death metal']"
427,Mysterious Research,1260,3802,448000,"[u'thrash metal', u'death metal', u'old school death metal', u'metal', u'death', u'Faves', u'speed', u'american death metal']"
428,Graphic Repulsion,1453,4639,305000,"[u'death metal', u'thrash metal', u'old school death metal', u'metal', u'thrash', u'american death metal']"
429,Night of the Deceased,1451,4794,459000,"[u'thrash metal', u'death metal', u'old school death metal', u'metal', u'death', u'Faves', u'speed', u'american death metal']"
430,From the Ground They Came,1501,4613,136000,"[u'thrash metal', u'death metal', u'old school death metal', u'metal', u'neo-classical metal', u'american death metal']"
431,Fearless Undead Machines,1585,5572,507000,"[u'thrash metal', u'death metal', u'old school death metal', u'metal', u'death', u'thrash', u'Faves', u'speed', u'american death metal', u'Criminally Underrated']"
432,Contamination,1469,4492,133000,"[u'doom metal', u'thrash metal', u'death metal', u'old school death metal', u'american death metal', u'horror soundscapes']"
433,The Silent Creature,1607,5657,520000,"[u'thrash metal', u'death metal', u'old school death metal', u'metal', u'american death metal']"
434,The Triangle,1524,3840,354000,"[u'death metal', u'thrash metal', u'old school death metal', u'death/thrash']"
435,Morbid Shape in Black,1420,4014,342000,"[u'old school death metal', u'metal', u'thrash metal', u'death metal', u'heard on Pandora']"
436,the cemetary´s full,5,6,0,[]
437,Fading Survival,2914,8651,179000,"[u'death metal', u'thrash metal', u'old school death metal', u'metal', u'hrm']"
438,Fading Survival,2914,8651,179000,"[u'death metal', u'thrash metal', u'old school death metal', u'metal', u'hrm']"
439,Our Hearts Of Ruin,45373,235188,332000,"[u'downtempo', u'chillout', u'chill', u'amazing', u'electronic', u'instrumental', u'experimental', u'idm', u'death', u'Uplifting', u'brilliant', u'inspiration', u'running', u'10 of 10 stars', u'heaven', u'simple', u'hopeful', u'writing music', u'wonderous', u'recos']"
440,Our Hearts Of Ruin,45373,235188,332000,"[u'downtempo', u'chillout', u'chill', u'amazing', u'electronic', u'instrumental', u'experimental', u'idm', u'death', u'Uplifting', u'brilliant', u'inspiration', u'running', u'10 of 10 stars', u'heaven', u'simple', u'hopeful', u'writing music', u'wonderous', u'recos']"
441,Satan - Feuer,189,452,669000,[]
442,Earthborn Evolution,7884,48788,335000,"[u'death metal', u'Technical Death Metal', u'progressive death metal', u'technical melodic death metal']"
443,Earthborn Evolution,7884,48788,335000,"[u'death metal', u'Technical Death Metal', u'progressive death metal', u'technical melodic death metal']"
444,Earthborn Evolution,7884,48788,335000,"[u'death metal', u'Technical Death Metal', u'progressive death metal', u'technical melodic death metal']"
445,Earthborn Evolution,7884,48788,335000,"[u'death metal', u'Technical Death Metal', u'progressive death metal', u'technical melodic death metal']"
446,despairing,70,355,0,[]
447,despairing,70,355,0,[]
448,will we heed,75,291,0,[]
449,pining,18,89,0,[]
450,celestial and textual signs,98,495,0,[u'LO-FI FOLK']
451,Anti Human - Anti Life,41,65,0,[]
452,Rise and Fall,16754,64765,647000,"[u'dark ambient', u'darkwave', u'medieval', u'neoclassical', u'ambient', u'Gothic', u'epic', u'ETEREO', u'DARGAARD-Winter', u'female vocalists', u'ethereal', u'neofolk', u'symphonic', u'Austria', u'Atmospheric metal', u'darkfolk', u'Ambient Music', u'Dragonlance', u'boskie', u'chillout', u'folk', u'world', u'fantastic', u'orchestral', u'atmospheric', u'haunting', u'eerie', u'cool', u'neo-classical', u'relax', u'Masterpiece', u'heavenly voices', u'dreaming', u'silence', u'fey', u'very slow', u'Dark-Ambient', u'RPG soundtrack', u'neoclassical darkwave', u'All-Time Faves', u'get this album', u'Dargaard', u'GOTIC CATALA', u'19100959', u'ulalume-ethereal', u'ulalume-for-later', u'HeCouldLikeMe', u'rise and fall dargard']"
453,In Empty Phrases,9049,45399,358000,"[u'progressive death metal', u'metal', u'Progressive metal', u'death metal', u'Awesome', u'omg', u'beautiful', u'Swedish Metal', u'Awesome solo', u'shows you that swedes are not only good in making furniture', u'awesome melody', u'fucking awesome times million', u'head asploding']"
454,Encounterparts,8660,41929,365000,"[u'Progressive metal', u'progressive death metal', u'metal', u'instrumental', u'death metal']"
455,The Big Sleep,9874,52324,317000,"[u'death metal', u'Progressive metal', u'metal', u'progressive death metal', u'Swedish Metal', u'melodic death']"
456,Creating Illusions,10537,53946,252000,"[u'Progressive metal', u'death metal', u'progressive death metal', u'metal', u'Swedish Metal', u'death', u'Progressive', u'prog rock', u'side project', u'dan swano', u'melodic death', u'Solo Project', u'gotme', u'death bands']"
457,Add Reality,11063,66872,376000,"[u'Progressive metal', u'progressive death metal', u'death metal', u'metal', u'Progressive rock', u'9 of 10 stars', u'Swedish Metal', u'Dan Swan\xf6']"
458,Uncreation,15150,89418,340000,"[u'progressive death metal', u'Progressive metal', u'death metal', u'metal', u'Swedish Metal', u'Melodic Death Metal', u'Progressive', u'8 of 10 stars', u'god', u'genious', u'dan swano', u'HarukaEX S2', u'Dan Swano is God']"
459,Sun of the Night,12866,73137,314000,"[u'Progressive metal', u'progressive death metal', u'death metal', u'metal', u'Melodic Death Metal', u'dan swano', u'FUCKING AWESOME', u'dark', u'Awesome', u'Progressive', u'8 of 10 stars', u'Swedish Metal', u'fucking awesome times 5', u'zyphfave']"
460,Thrashard,22267,108449,198000,"[u'thrash metal', u'hardcore', u'thrash', u'crossover thrash', u'crossover', u'metal', u'Mosh', u'punk', u'hardcore punk', u'80s', u'Straight Edge', u'old school', u'FUCKING AWESOME', u'wwe', u'old school thrash metal', u'Megadeth', u'Testament', u'mosh pit', u'exodus', u'haohmaru']"
461,Black Sabbath,407,1239,451000,"[u'doom metal', u'Doom', u'traditional doom']"
462,Holy Graveyard,494,1518,401000,[]
463,Your Call,556,2295,351000,[]
464,Tres Seis Diez Dos,556,2324,272000,[]
465,Voices,568,1864,271000,[]
466,El Mal Del Bien,637,2167,237000,[]
467,The Grace,630,1909,347000,"[u'doom metal', u'groove metal', u'metal nacional', u'metal venezolano']"
468,No Es Mi Verdad,663,2450,359000,[]
469,El Sur De La Fe,833,3339,274000,[]
470,Los Muertos De Mi Color,688,2134,274000,[]
471,Purified,793,3034,269000,[]
472,Propiedad de dios,800,2860,440000,[]
473,Dying,33062,150979,270000,"[u'death metal', u'old school death metal', u'metal', u'thrash metal', u'oldschool deathmetal', u'Masterpiece', u'Obituary', u'florida death metal', u'aggressive depression', u'end all the pain', u'massive assault', u'seen live', u'classic', u'USA', u'doom metal', u'Awesome', u'old school', u'heard on Pandora', u'learn to play', u'Brutal Death Metal', u'kick ass', u'Come with me', u'Dystopian Prophecies', u'plead not guilty', u'the rival believer', u'headbangers ball', u'ausgezeichnet', u'florida death', u'this will fucking own your ass', u'headroll', u'World Destruction', u'obituary - duing', u'BleederLOCO', u'Thee Diablero', u'sick guitar chops']"
474,Descend Into Winter,3021,9862,376000,"[u'heavy metal', u'black metal', u'metal']"
475,Descend Into Winter,3021,9862,376000,"[u'heavy metal', u'black metal', u'metal']"
476,Time Heals Nothing,28,55,0,"[u'black metal', u'United States', u'USBM', u'raw black metal']"
477,Time Heals Nothing,28,55,0,"[u'black metal', u'United States', u'USBM', u'raw black metal']"
478,Corporal Jigsore Quandary,64247,358778,328000,"[u'death metal', u'grindcore', u'goregrind', u'metal', u'Melodic Death Metal', u'carcass', u'deathgrind', u'Grind', u'Technical Death Metal', u'Masterpiece', u'killer riffs', u'would drive normal people insane', u'heavy metal', u'favorites', u'death', u'Progressive', u'groovy', u'Favorite', u'old school death metal', u'classic death metal', u'great drums', u'aggressive depression', u'massive assault', u'the rival believer', u'Gore-Grind', u'best metalband', u'swallow my venom', u'seen live', u'male', u'british', u'beautiful', u'Awesome', u'90s', u'drums', u'thrash', u'amazing', u'aggressive', u'majestic', u'4', u'brilliant', u'english', u'Trash', u'check out', u'9 of 10 stars', u'sinister', u'What', u'powerful', u'10 of 10 stars', u'Brutal Death Metal', u'danceable']"
479,The Switch,1034,3235,279000,"[u'post-rock', u'beanoboo']"
480,Remarkable,1157,3759,261000,[]
481,Vows & Promises,1137,3439,262000,[]
482,Her Hair,1194,3292,241000,"[u'downtempo', u'idm', u'2012']"
483,Locked From The Inside,1324,3766,299000,"[u'downtempo', u'2012']"
484,Evil,651974,5841756,216000,"[u'indie', u'indie rock', u'alternative', u'rock', u'interpol', u'post-punk', u'alternative rock', u'favorites', u'new york', u'00s', u'evil', u'seen live', u'american', u'Awesome', u'greys anatomy', u'new wave', u'indie pop', u'melancholy', u'Favourites', u'favorite songs', u'Post punk', u'NYC', u'Post-punk revival', u'Favourite Songs', u'rosemary heaven restores you in life', u'punk', u'post-rock', u'dance', u'britpop', u'male vocalists', u'hard rock', u'Love', u'catchy', u'dark', u'bass', u'Mellow', u'Favorite', u'Good Stuff', u'Joy Division', u'chillout', u'pop', u'experimental', u'2004', u'favourite', u'fun', u'cool', u""Grey's Anatomy"", u'Love it', u'Interpol - evil', u'emo']"
485,Naglfar,14801,53037,329000,"[u'black metal', u'metal', u'folk metal', u'Norwegian Black Metal', u'viking metal', u'Norway', u'dark', u'norwegian', u'cool', u'Black', u'norwegian metal', u'Tolkien', u'epic black metal', u'Folk Black Metal', u'tolkien black metal', u'norsk metal', u'burps']"
486,Fanden Lokker Til Stupet,1918,7771,0,[u'forest']
487,In The Halls And Chambers Of Stardust The Crystallic Heavens Open,6251,24305,153000,"[u'instrumental', u'folk metal', u'norsk metal']"
488,Gjenom Skogen Til Blaafjellene,1530,6185,0,[]
489,Naglfar,14801,53037,329000,"[u'black metal', u'metal', u'folk metal', u'Norwegian Black Metal', u'viking metal', u'Norway', u'dark', u'norwegian', u'cool', u'Black', u'norwegian metal', u'Tolkien', u'epic black metal', u'Folk Black Metal', u'tolkien black metal', u'norsk metal', u'burps']"
490,Storm of Evil,14650,56006,362000,"[u'black metal', u'folk metal', u'viking metal', u'metal', u'groove', u'Pagan', u'pagan metal', u'Folk Black Metal', u'heavy metal', u'dark', u'weird', u'00s', u'Gothic Rock', u'Norway', u'Black', u'2', u'Tag', u'favourite tracks of zimziki', u'norsk metal', u'Isengard', u'Ian Curtis grew up in 1960s Norway', u'Captn Iglo', u'myk black metal', u'post post-punk', u'blackened post punk']"
491,Storm of Evil,14650,56006,362000,"[u'black metal', u'folk metal', u'viking metal', u'metal', u'groove', u'Pagan', u'pagan metal', u'Folk Black Metal', u'heavy metal', u'dark', u'weird', u'00s', u'Gothic Rock', u'Norway', u'Black', u'2', u'Tag', u'favourite tracks of zimziki', u'norsk metal', u'Isengard', u'Ian Curtis grew up in 1960s Norway', u'Captn Iglo', u'myk black metal', u'post post-punk', u'blackened post punk']"
492,Silence In The End,66,235,0,"[u'raw black metal', u'German Black Metal']"
493,Time Heals Nothing,28,55,0,"[u'black metal', u'United States', u'USBM', u'raw black metal']"
494,Time Heals Nothing,28,55,0,"[u'black metal', u'United States', u'USBM', u'raw black metal']"
495,Time Heals Nothing,28,55,0,"[u'black metal', u'United States', u'USBM', u'raw black metal']"
496,Time Heals Nothing,28,55,0,"[u'black metal', u'United States', u'USBM', u'raw black metal']"
497,Time Heals Nothing,28,55,0,"[u'black metal', u'United States', u'USBM', u'raw black metal']"
498,Time Heals Nothing,28,55,0,"[u'black metal', u'United States', u'USBM', u'raw black metal']"
499,Time Heals Nothing,28,55,0,"[u'black metal', u'United States', u'USBM', u'raw black metal']"
500,Time Heals Nothing,28,55,0,"[u'black metal', u'United States', u'USBM', u'raw black metal']"
501,Time Heals Nothing,28,55,0,"[u'black metal', u'United States', u'USBM', u'raw black metal']"
502,Reclaiming Lost Culture,44,92,0,[]
503,Blood Will be Avenged,30,49,0,[]
504,Intro,29,44,0,[]
505,Unblemished Mastery,15,18,0,[]
506,Fate,17,32,0,[]
507,Snow Stained With the Blood of Traitors,15,30,0,[]
508,Will of Iron,17,32,0,[]
509,Beyond the Smoke of Battle,21,36,0,[]
510,Banners of Victory,19,35,0,[]
511,The Eternal Law,19,34,0,[]
512,Vanguard,19,34,0,[]
513,Resistance To Modern Way,18,35,0,[]
514,Voice Of Perdition,21,49,0,[]
515,Shade,22,48,0,[]
516,Material Agony,24,53,0,[]
517,Disruption Of The Deepest Dreams,34,79,359000,[]
518,Dead In The Crowd,24,57,0,[]
519,Intro,25,55,0,[]
520,Crash Course in Brain Surgery,10769,47216,157000,"[u'hard rock', u'classic rock', u'rock', u'heavy metal', u'70s', u'proto-metal', u'metal', u'welsh', u'british', u'wales', u'proto metal', u'british rock', u'classic', u'punk', u'heavy', u'Progressive rock', u'Stoner Rock', u'doom metal', u'psychedelic', u'guitar', u'bass', u'Energetic', u'Garage Rock', u'blues rock', u'1970s', u'Masterpiece', u'70s British Hard Rock', u'70s British Rock', u'70s hard rock', u'Classic British Hard Rock', u'british blues rock', u'classic hard rock', u'proto punk', u'classic metal', u'British Metal', u'british heavy metal', u'New Wave of British Heavy Metal', u'great title', u'70s heavy metal', u'mca', u'Great Britain', u'classic heavy metal', u'rock-protopunk', u'british hard rock', u'covered by metallica', u'classic british heavy metal', u'meaty beaty big and bouncy', u'headbangers ball', u'classic British rock', u'theyre coming to take me away hehee']"
521,Memoria de Siglos,2103,11498,347000,"[u'heavy metal', u'metal', u'9 of 10 stars', u'Heavy Metal Argentino']"
522,PBS,81975,381820,281000,"[u'electronic', u'ambient', u'idm', u'electronica', u'downtempo', u'chillout', u'chill', u'ethereal', u'instrumental', u'Dreamy', u'chillout-electronica', u'Dope', u'melancholy', u'Elephant 6', u'groovy', u'Boards of Canada', u'check later', u'2006', u'fresh', u'merck', u'10', u'authentic', u'ambient-electronic', u'Torquemada', u'psychoalgie', u'headdown', u'exogaze', u'exogazing', u'electro with soul', u'chill4265', u'dream4265', u'instrumental4265', u'summer 2013', u'nice one', u'limbik', u'slim let me in and drive', u'c-ma', u'secret of life', u'Bellezza', u'uplifting beat', u'frickinawesomeman', u'chillychill', u'supanice', u'trackytech', u'boarddogs']"
523,Dictaphone's Lament,105526,599605,310000,"[u'ambient', u'electronic', u'chillout', u'idm', u'downtempo', u'electronica', u'instrumental', u'chill', u'experimental', u'Mellow', u'Duck Dich WolkeWolke', u'electro', u'lounge', u'trip-hop', u'beautiful', u'Dreamy', u'relaxing', u'tycho', u'-electronic-', u'simenu22', u'melodic', u'smooth', u'relax', u'Boards of Canada', u'sensual', u'MJ-down-down-down time', u'Silkred-LovedAll', u'-favorites-', u'-chill-trip-lounge-down-', u'sexy', u'indie electronic', u'easy listening', u'synth pop', u'urban', u'downbeat', u'indietronica', u'Awesome', u'morning', u'dream pop', u'psychill', u'Chillosophy', u'amazing', u'nostalgic', u'crescendo', u'Rainy Day', u'hypnotic', u'spacey', u'trippy', u'loved', u'chill-out']"
524,Dictaphone's Lament,105526,599605,310000,"[u'ambient', u'electronic', u'chillout', u'idm', u'downtempo', u'electronica', u'instrumental', u'chill', u'experimental', u'Mellow', u'Duck Dich WolkeWolke', u'electro', u'lounge', u'trip-hop', u'beautiful', u'Dreamy', u'relaxing', u'tycho', u'-electronic-', u'simenu22', u'melodic', u'smooth', u'relax', u'Boards of Canada', u'sensual', u'MJ-down-down-down time', u'Silkred-LovedAll', u'-favorites-', u'-chill-trip-lounge-down-', u'sexy', u'indie electronic', u'easy listening', u'synth pop', u'urban', u'downbeat', u'indietronica', u'Awesome', u'morning', u'dream pop', u'psychill', u'Chillosophy', u'amazing', u'nostalgic', u'crescendo', u'Rainy Day', u'hypnotic', u'spacey', u'trippy', u'loved', u'chill-out']"
525,Excitable,60107,184407,259000,"[u'hard rock', u'80s', u'rock', u'Def Leppard', u'hair metal', u'classic rock', u'metal', u'heavy metal', u'Glam Metal', u'british', u'6 of 10 stars', u'80s metal', u'favorites', u'arena rock', u'other', u'eighties', u'favourite', u'Pop-Rock', u'80s Heavy Metal', u'1980s', u'exciting', u'one-word titles', u'sound storm', u'cool beans', u'All time favourites', u'Rock 80s', u'2 of 10 stars', u'80s rock', u'80s hair metal', u'80s hard rock', u'video killed the radio star', u'yeaaahhhhh', u'80s hair bands', u'the word excite', u'sweaty headbands', u'dougs rock', u'heavy roll', u'80s rock rules', u'dleppard', u'fredags kveld', u'HBLOLista01']"
526,Hysteria,228529,1039932,354000,"[u'rock', u'80s', u'hard rock', u'classic rock', u'Def Leppard', u'hair metal', u'hysteria', u'british', u'metal', u'heavy metal', u'soft rock', u'favorites', u'melodic rock', u'80s rock', u'power ballads', u'def Leppard-hysteria', u'Power ballad', u'Awesome', u'great song', u'ballads', u'Glam Metal', u'over5min', u'favorite songs', u'pop', u'arena rock', u""80's"", u'good music', u'Love', u'easy listening', u'love songs', u'1987', u'good because I say so', u'DEF', u'male vocalists', u'80', u'Ballad', u'Favorite', u'80s Heavy Metal', u'catchy as hell', u'def leppard classic', u'UK', u'memories', u'catchy', u'new wave', u'beautiful', u'guitar', u'Driving', u'glam rock', u'loved', u'rock ballad']"
527,Pour Some Sugar on Me,333037,1760249,265000,"[u'80s', u'rock', u'hard rock', u'classic rock', u'Def Leppard', u'hair metal', u'heavy metal', u'metal', u'british', u'80s rock', u'Pour Some Sugar On Me', u'glam rock', u'Glam Metal', u'sexy', u'classic', u'favorites', u'guilty pleasure', u'Pop Metal', u'pop', u'dance', u'fun', u'sex', u'Def Leppard-Pour some sugar on me', u'NWOBHM', u'80s hair metal', u'great song', u'Favorite', u'1987', u'rock out', u'Awesome', u'party', u'sugar', u'melodic rock', u'hair', u'hard n heavy', u'catchy', u'great songs', u'hair band', u'80s metal', u'sexy rock', u'Soundtrack', u'arena rock', u'upbeat', u'amazing', u""80's"", u'Favourites', u'Cock rock', u'1980s', u'sing-along', u'80s hard rock']"
