,Songs,Listeners,Playcount,Duration,Tags
280,Embrace of the Endless Ocean,94758,785240,404000,"[u'Melodic Death Metal', u'viking metal', u'Viking Death Metal', u'metal', u'death metal', u'epic', u'amon amarth', u'beautiful', u'swedish', u'sad', u'2008', u'favorites', u'great lyrics', u'melodic metal', u'suicidal', u'melodic viking metal', u'music to fall asleep on', u'fucking atmospheric', u'black metal', u'seen live', u'Awesome', u'folk metal', u'death', u'loved', u'Ballad', u'brilliant', u'love at first listen', u'Sweden', u'Extreme Metal', u'Power metal', u'Fuck yes', u'6 of 10 stars', u'FUCKING EPIC', u'all time favorites', u'9 lbs hammer', u'best songs 2008', u'really fucking good', u'northern metal', u'skandinavian', u'schweden', u'Metal Blade Records', u'awesome melody', u'more viking than erik the fucking viking', u'Awesome Songs That Are Over 7 Minutes Long', u'Tema Increible', u'pretty fucking badass', u'zagrajcie mi to na pogrzebie']"
281,Epic,455941,2594186,294000,"[u'rock', u'alternative rock', u'90s', u'alternative', u'metal', u'funk metal', u'alternative metal', u'hard rock', u'80s', u'epic', u'mike patton', u'faith no more', u'rap metal', u'crossover', u'funk', u'rock band', u'favorites', u'Awesome', u'rap rock', u'heavy metal', u'experimental', u'american', u'rapcore', u'Funk Rock', u'seen live', u'Grunge', u'Nu Metal', u'1990', u'1989', u'heavy', u'Progressive rock', u'Favourites', u'patton', u'90s Rock', u'male vocalists', u'amayzes loved', u'classic rock', u'hardcore', u'rap', u'Energetic', u'nostalgic', u""90's"", u'Favorite', u'FUCKING AWESOME', u'10 of 10 stars', u'favorite songs', u'indie rock', u'Love', u'piano', u'Fusion']"
282,Walk - Live From Donington,4999,8699,315000,[]
283,Made Of Scars,203456,1081949,203000,"[u'hard rock', u'metal', u'rock', u'alternative metal', u'Nu Metal', u'Stone Sour', u'heavy metal', u'alternative', u'Nu-metal', u'heavy', u'corey taylor', u'classic rock', u'seen live', u'post-grunge', u'2000s', u'wrif-fm', u'alternative rock', u'favorite songs', u'modern rock', u'00s', u'iowa', u'rock band', u'My Favorites', u'rock band dlc', u'bad ass', u'My reason to breathe', u'music for my soul', u'Favorite Bands', u'Hard', u'favorites', u'epic', u'Awesome', u'drums', u'american', u'amazing', u'good shit', u'adrenaline', u'2007', u'Favorite', u'brilliant', u'2006', u'8 of 10 stars', u'heard live', u'great voice', u'powerful', u'Supergroup', u'Faves', u'biology', u'scars', u'good music']"
284,Hell & Back,15414,52599,286000,"[u'heavy metal', u'Metal God']"
285,Black Hole Sun,937907,4961622,318000,"[u'Grunge', u'rock', u'90s', u'alternative rock', u'alternative', u'soundgarden', u'seattle', u'hard rock', u'Chris Cornell', u'favorites', u'Black Hole Sun', u'classic rock', u'american', u'Awesome', u'1994', u'90s Rock', u'rock band', u'favorite songs', u'alternative metal', u'male vocalists', u'nostalgia', u'psychedelic', u'Mellow', u'slow', u'metal', u'great song', u'Grunge Rock', u'chill', u'classic', u'melancholic', u'FUCKING AWESOME', u'memories', u'guitar', u'Psychedelic Rock', u'dark', u'Garage Rock', u'cool', u'Ballad', u'Love', u'melancholy', u'soundgarden - black hole sun', u'epic', u'loved', u'Favourites', u'Favourite Songs', u'Nirvana', u'heavy metal', u'seen live', u'indie', u'beautiful']"
286,Dehumanization,53763,303152,175000,"[u'Technical Metal', u'Progressive metal', u'math metal', u'Technical Death Metal', u'metal', u'thrash metal', u'death metal', u'Meshuggah', u'mathcore', u'experimental', u'dark', u'rage', u'Avant-Garde Death Metal', u'Chaotic Metal', u'extreme technical metal', u'heavy metal', u'heavy', u'grindcore', u'swedish', u'Awesome', u'amazing', u'progressive death metal', u'Post-Thrash', u'experimental metal', u'tech metal', u'Math-metal', u'dissonance', u'absolutely unrelenting carnage', u'Heavier Than Satans Ballsack', u'possibly the most crushingly insane riff ive ever heard', u'extreme techinical metal', u'metalcore', u'seen live', u'alternative rock', u'DJENT', u'favorites', u'atmospheric', u'male vocalist', u'2005', u'chaos', u'math', u'Avant-garde Metal', u'2000s', u'english lyrics', u'polyrhythmic', u'techcore', u'mindblowing', u'the best', u'9 lbs hammer', u'holy fuck']"
287,No More Tears,261064,1178711,441000,"[u'heavy metal', u'metal', u'hard rock', u'Ozzy Osbourne', u'rock', u'classic rock', u'90s', u'ozzy', u'classic metal', u'british', u'favorites', u'guitar', u'bass', u'Awesome Guitar Jams', u'zakk wylde', u'no more tears', u'80s', u'Favourite Songs', u'heavy', u'Progressive metal', u'great solo', u'1991', u'Glam Metal', u'Greatest Songs', u'classic', u'old school', u'10 of 10 stars', u'All time favourites', u'british rock', u'the best', u'British Metal', u'amazing solo', u'classically classic', u'the best of rock', u'headbanging time', u'metal top', u'alternative', u'favorite songs', u'Progressive rock', u'thrash metal', u'murder ballads', u'symphonic metal', u'guitar virtuoso', u'wrif-fm', u'rock band dlc', u'songs with awesome solos', u'Way my favourite in the fucking world', u'Greatest Guitar Solos', u'weekend motivator', u'The Good Ole Metal Days']"
288,Roots Bloody Roots,285143,1594235,212000,"[u'thrash metal', u'metal', u'death metal', u'heavy metal', u'Sepultura', u'groove metal', u'brazilian', u'thrash', u'Nu Metal', u'rock', u'hardcore', u'trash metal', u'heavy', u'90s', u'favorites', u'max cavalera', u'brazil', u'aggressive', u'Favourite Songs', u'tribal', u'Tribal Metal', u'Awesome', u'roots', u'death-thrash metal', u'black metal', u'alternative metal', u'FUCKING AWESOME', u'metalcore', u'alternative', u'alternative rock', u'hard rock', u'brasil', u'political', u'heard on Pandora', u'live', u'anger', u'1996', u'brazilian metal', u'Roots Bloody Roots', u'igor cavalera', u'seen live', u'brutal', u'angry', u'Extreme Metal', u'1990s', u'Metal favourites', u'Killer Tune', u'Sep']"
289,Halo,158182,1061141,543000,"[u'thrash metal', u'metal', u'groove metal', u'heavy metal', u'metalcore', u'Machine Head', u'seen live', u'alternative metal', u'Awesome', u'speed metal', u'great solo', u'totally fucking awesome', u'epic', u'modern metal', u'i never get tired of this', u'FUCKING AWESOME', u'Progressive metal', u'beautiful', u'american', u'trash metal', u'thrashcore', u'kick ass', u'Epic solo', u'greatest riffs', u'Eargasm', u'Halo', u'great guitar solo', u'nice solo', u'aggressive', u'industrial metal', u'10 of 10 stars', u'greatest solos', u'best riffs', u'neckbreaker', u'Fucking Musical Fire', u'Fucking kick you in the teeth', u'hardcore', u'favorites', u'melodic', u'angry', u'amazing', u'2007', u'favourite', u'emotional', u'Favorite', u'Post-Thrash', u'progressive thrash metal', u'beautiful solo', u'When sex with guitars is celebrated with Love', u'genious riffs']"
290,Best of You,1084943,7687316,255000,"[u'rock', u'alternative rock', u'alternative', u'foo fighters', u'Grunge', u'hard rock', u'favorites', u'00s', u'american', u'post-grunge', u'Dave Grohl', u'Best Of You', u'seen live', u'indie', u'2005', u'favorite songs', u'acoustic', u'Awesome', u'Love', u'punk rock', u'live', u'Favourites', u'Post Grunge', u'powerful', u'play it loud', u'punk', u'love at first listen', u'emo', u'90s', u'Energetic', u'the best', u'Foo Fighters - Best Of You', u'memories', u'male vocalists', u'beautiful', u'foo', u'sad', u'metal', u'seattle', u'classic rock', u'indie rock', u'Progressive rock', u'loud', u'favourite', u'emotional', u'male vocalist', u'Favorite', u'FUCKING AWESOME', u'I love', u'energy']"
291,I'm The Man - Def Uncensored Version,3884,10121,182000,[]
292,Rock Star,84701,365192,161000,"[u'Grunge', u'90s', u'rock', u'female vocalists', u'hole', u'alternative', u'alternative rock', u'riot grrrl', u'female vocalist', u'Courtney Love', u'angry', u'american', u'indie', u'female', u'punk', u'hard rock', u'USA', u'favorites', u'aggressive', u'Favorite', u'1994', u'fall', u'slacker', u'90s alternative', u'girlpower', u'posh', u'Chicks that Rock', u'creepy dolls', u'Put Your boots on', u'hole-rock star', u'Soundtrack', u'pop', u'indie pop', u'post-rock', u'catchy', u'alternative pop rock', u'argentina', u'punk rock', u'political', u'California', u'favourite', u'sex', u'radiohead', u'female vocals', u'underrated', u'college', u'High School', u'Rock and Roll', u'rock n roll', u'los angeles']"
293,Hunger Strike - 25th Anniversary Mix,3689,6076,0,[]
294,Prayer For The Afflicted,10394,38871,295000,[u'finnish']
295,Panama,337664,2132029,211000,"[u'hard rock', u'rock', u'classic rock', u'80s', u'van halen', u'heavy metal', u'hair metal', u'guitar', u'metal', u'1984', u'guitar virtuoso', u'american', u'Panama', u'glam rock', u'80s rock', u'favorites', u'fun', u'male vocalists', u'Awesome Guitar Jams', u'superbad', u'party', u'1983', u'Barney Stinson Get Psyched mix', u'1980s', u'Favourite Songs', u'pop', u'Awesome', u'rock n roll', u'eddie van halen', u'Michael Anthony', u'classic', u'USA', u'pop rock', u'upbeat', u'good', u'places', u'great songs', u'poprock', u'wrif-fm', u'SoCal', u'Greatest Songs Of All Time', u'David Lee Roth', u'Alex Van Halen', u'seen live', u'Hard', u'arena rock', u'Driving', u'Energetic', u'summer', u'old school']"
296,Silvera,40626,242646,215000,"[u'Progressive metal', u'groove metal', u'metal', u'death metal', u'Melodic Death Metal', u'Progressive', u'rock', u'Progressive rock', u'epic', u'melodic', u'groove', u'death', u'thrash metal', u'thrash', u'fip', u'Music Video', u'melodic metal', u'Technical Death Metal', u'progressive death metal', u'environmental', u'green', u'Earth', u'hatred', u'environment', u'progressive thrash metal', u'Melodic Groove Metal', u'Melodic Thrash Metal', u'progressive melodic death metal', u'Progressive Melodic Metal', u'Gojira', u'progressive groove metal', u'environmentalists', u'progressive melodic thrash metal', u'progressive melodic groove metal', u'human hatred']"
297,Conjure,7559,24073,511000,"[u'heavy metal', u'metal', u'sludge metal', u'Pesado Gostoso']"
298,Angel of Death,467668,3217404,291000,"[u'thrash metal', u'metal', u'Slayer', u'heavy metal', u'thrash', u'speed metal', u'80s', u'death metal', u'trash metal', u'american', u'aggressive', u'angry', u'legends', u'seen live', u'rock', u'Awesome', u'heavy', u'favorites', u'666', u'old-school thrash', u'hard rock', u'death', u'Extreme Metal', u'headbanging music', u'1986', u'reign in blood', u'brutal', u'Angel of Death', u'SSSSSSSSSLLLLLLLLLLLLLLLLLLAAAAAAAAAAAAAAAAAAAYYYYYYYYYYYYYYEEEEEEEEEEERRRRRRRRRR', u'USA', u'fucking CLASSIC', u'AAAAAAAAAAAAAAAAAAAAAAAAAAAAAAAAAAAAAAAHHHHHHH', u'black metal', u'classic', u'kick ass', u'bay area thrash metal', u'Progressive metal', u'classic metal', u'slayer kurwa', u'punk', u'hardcore', u'Trash', u'FUCKING AWESOME', u'Brutal Death Metal', u'metalcore', u'Favorite', u'classics', u'dave lombardo', u'Extreme', u'satanic']"
299,Brotherhood Of The Snake,15419,52586,253000,"[u'thrash metal', u'Testament', u'bay area thrash metal', u'Thrash/Death Metal', u'Lyric Video', u'brotherhood of the snake', u'the atomic clock']"
300,"Atlas, Rise!",73543,305554,388000,"[u'heavy metal', u'thrash metal', u'metal', u'metallica', u'Progressive metal', u'hard rock', u'Contemporary', u'Favorite', u'NWOBHM', u'8', u'2016', u'Guitar Solo', u'bay area thrash metal', u'new album', u'Hardwired\u2026To Self-Destruct', u'hardwired to self destruct', u'atlas rise']"
301,Give It Away,801622,4277631,282000,"[u'rock', u'funk', u'alternative', u'90s', u'Funk Rock', u'Red Hot Chili Peppers', u'alternative rock', u'rhcp', u'funk metal', u'funky', u'1991', u'seen live', u'american', u'classic rock', u'punk', u'favorites', u'Give it away', u'hard rock', u'pop', u'favorite songs', u'Awesome', u'punk rock', u'groovy', u'rapcore', u'bass', u'Favorite', u'metal', u'indie', u'Alternative  Punk', u'groove', u'California', u'live', u'pop rock', u'guitar', u'fun', u'crossover', u'modern rock', u'i am a party girl here is my soundtrack', u'happy', u'crazy', u'summer', u'party', u'cool', u'rock band', u'Favourite Songs', u'90s Rock', u'flea', u'rock band 2', u'amayzes loved', u'John Frusciante']"
302,Red Scare,1784,3846,199000,[]
303,Mouth for War,332780,1782617,236000,"[u'thrash metal', u'metal', u'groove metal', u'heavy metal', u'pantera', u'Power metal', u'hard rock', u'thrash', u'rock', u'Power groove', u'90s', u'american', u'aggressive', u'hardcore', u'guitar virtuoso', u'Favourite Songs', u'Dimebag Darrell', u'Philip Anselmo', u'Dimebag', u'heavy', u'angry', u'Post-Thrash', u'phil anselmo', u'1992', u'Post-thrash Metal', u'Vulgar Display Of Power', u'sufu5a', u'speed metal', u'guitar', u'good shit', u'death metal', u'classic metal', u'american metal', u'rock band dlc', u'angry metal', u'black metal', u'grindcore', u'favorites', u'viking metal', u'songs i love', u'rock band', u'Nu Metal', u'Down', u'FUCKING AWESOME', u'metallica', u'Damageplan', u'Dark metal', u'My Favorites', u'Fight Music', u'718 Metal']"
304,Innervision,4983,10159,0,[]
305,Mission Statement,81857,513484,230000,"[u'alternative metal', u'hard rock', u'metal', u'Nu Metal', u'rock', u'alternative', u'Stone Sour', u'heavy metal', u'energy', u'Energetic', u'atmospheric', u'american', u'xxx', u'male vocalists', u'2010', u'10s', u'heard live', u'powerful', u'10 of 10 stars', u'identity', u'attitude', u'riff', u'Angst-Ridden', u'Boisterous', u'opener', u'over 5 minutes long', u'alt. metal', u'cimx-fm', u'corey taylor', u'awesome voice', u'radioultra', u'Post- Grunge', u'damn great song', u'audio secrecy', u'rasta666']"
306,Wasted Years - 1998 Remastered Version,26630,89795,0,"[u'heavy metal', u'metal', u'hard rock', u'7 of 10 stars', u'devon', u'Vanessa Hudgens', u'Iggy Azalea', u'nayer', u'Pilar Montenegro', u'nikki benz']"
307,Spotlights,651,1973,313000,[]
308,Wicked Garden,225248,915361,246000,"[u'Grunge', u'rock', u'90s', u'alternative rock', u'alternative', u'hard rock', u'stone temple pilots', u'metal', u'Scott Weiland', u'favorites', u'1992', u'90s Rock', u'wicked garden', u'Stoner Rock', u'classic rock', u'heavy metal', u'indie', u'alternative metal', u'wrif-fm', u'STP', u'seen live', u'punk', u'favorite songs', u'hardcore', u'indie rock', u'Awesome', u'vocals', u'angry', u'american', u'Favorite Artists', u'good shit', u'songs i love', u'los angeles', u'8 of 10 stars', u'4 Stars', u'a subtle use of vocal harmony', u'melodic songwriting', u'minor key tonality', u'stone', u'pilots', u'carcass', u'System of a Down', u'ny', u'hard rock roots', u'Slipknot', u'a vocal-centric aesthetic', u'dirty electric guitar riffs', u'a subtle use of vocal counterpoint', u'a clear focus on recording studio production', u'aggressive male vocalist']"
309,Something I Can Never Have - Remastered,10188,27158,0,[]
310,My Hero,938297,5842399,296000,"[u'rock', u'alternative rock', u'alternative', u'foo fighters', u'Grunge', u'90s', u'hard rock', u'post-grunge', u'My Hero', u'favorites', u'american', u'Dave Grohl', u'seen live', u'acoustic', u'Awesome', u'guitar', u'punk rock', u'indie', u'hero', u'1997', u'drums', u'live', u'seattle', u'1998', u'Favourites', u'foo', u'classic rock', u'favorite songs', u'indie rock', u'male vocalist', u'intense', u'90s Rock', u'punk', u'Progressive rock', u'epic', u'beautiful', u'loved', u'powerful', u'Favourite Songs', u'anthem', u'soundtrackgdchill', u'Love', u'Good Rock', u'rock ballad', u'Love it', u'Porieux-loved', u'foo figthers', u'chillout', u'Stoner Rock', u'loud']"
311,Ghosts Will Haunt My Bones,24753,284955,366000,"[u'metal', u'groove metal', u'herrasmiesklubi', u'heavy metal', u'riff', u'Machine Head', u'progressive trash metal', u'intense shit', u'salvadorsas', u'METAL AS ITS BEST', u'in machine head we trust', u'Jared mcEarhan bass master', u'MFnH', u'Haunted Bones by Ghosts', u'nozferatu']"
312,Angel of Death,467668,3217404,291000,"[u'thrash metal', u'metal', u'Slayer', u'heavy metal', u'thrash', u'speed metal', u'80s', u'death metal', u'trash metal', u'american', u'aggressive', u'angry', u'legends', u'seen live', u'rock', u'Awesome', u'heavy', u'favorites', u'666', u'old-school thrash', u'hard rock', u'death', u'Extreme Metal', u'headbanging music', u'1986', u'reign in blood', u'brutal', u'Angel of Death', u'SSSSSSSSSLLLLLLLLLLLLLLLLLLAAAAAAAAAAAAAAAAAAAYYYYYYYYYYYYYYEEEEEEEEEEERRRRRRRRRR', u'USA', u'fucking CLASSIC', u'AAAAAAAAAAAAAAAAAAAAAAAAAAAAAAAAAAAAAAAHHHHHHH', u'black metal', u'classic', u'kick ass', u'bay area thrash metal', u'Progressive metal', u'classic metal', u'slayer kurwa', u'punk', u'hardcore', u'Trash', u'FUCKING AWESOME', u'Brutal Death Metal', u'metalcore', u'Favorite', u'classics', u'dave lombardo', u'Extreme', u'satanic']"
313,Raining Blood,554471,3690446,263000,"[u'thrash metal', u'metal', u'heavy metal', u'Slayer', u'thrash', u'speed metal', u'80s', u'death metal', u'trash metal', u'seen live', u'FUCKING AWESOME', u'american', u'Guitar Hero', u'rock', u'Guitar Hero 3', u'Raining Blood', u'Legendary', u'aggressive', u'reign in blood', u'In Your Fucking Face', u'hardcore', u'epic', u'classic metal', u'Kerry King', u'favorites', u'1986', u'hard rock', u'angry', u'Extreme Metal', u'brutal thrash metal', u'Jeff Hannemann', u'slayer kurwa', u'favorite songs', u'brutal', u'Awesome', u'rain', u'Killing Riff', u'v-rock', u'best of slayer', u'Tom ARAYA', u'black metal', u'metalcore', u'classic', u'heavy', u'Extreme', u'Play this loud enough to raise the dead', u'dave lombardo', u'All time favourites', u'Pure Fucking Metal', u'classic riff']"
314,Hug You Hardcore,3747,12677,220000,"[u'heavy metal', u'glam rock', u'Music Video', u'femdom', u'Glam Metal', u'Mistress', u'strap-on', u'strapon', u'Hard Rock Combined With Strong Heavy Metal Elements']"
315,Universe on Fire,5379,50109,246000,[u'epic metal']
316,Na jednej z dzikich pla,11413,106465,214000,"[u'polish', u'rock', u'soft rock', u'lubila tanczyc', u'tanczenie', u'no i spiewam za kazdym razem', u'classic rock', u'pop', u'classic', u'Love', u'summer', u'party', u'nice', u'sometimes', u'polska', u'smile', u'old', u'Sentimental', u'polish rock', u'best ever', u'great memories', u'dobre bo polskie', u'Ines', u'summer hits', u'greatest polish hits', u'liceum', u'kocham to', u'sentymentalne', u'ladne', u'bete noire', u'playlista rmf fm', u'kamienie milowe', u'polish staff', u'ciagle gonila wiatr', u'jaka to melodia', u'i sing in the car']"
317,Dugo dwiku samotnoci,91157,1048864,251000,"[u'polish', u'rock', u'alternative rock', u'myslovitz', u'alternative', u'polish rock', u'chillout', u'polskie', u'polish music', u'Polak potrafi', u'polska muza tez miazdzyc potrafi', u'greatest polish hits', u'like to sing along', u'klimat kurwa', u'nie no ta piosenka to juz klasyk jest', u'indie rock', u'sad', u'melancholy', u'melancholic', u'great lyrics', u'dobre bo polskie', u'wieczor', u'kiedy chcesz sie powiesic', u'polska melancholia', u'najlepsza polska muzyka', u'indie', u'memories', u'beautiful', u'night', u'Dreamy', u'90s', u'Hope', u'Mellow', u'nostalgic', u'nice', u'male vocalist', u'soulful', u'depression', u'freedom', u'Solitude', u'childhood', u'broken heart', u'so true', u'magic', u'great voice', u'poland', u'Favourite Songs', u'17', u'positive', u'night listening']"
318,Pola Ar,2986,20643,331000,[]
319,Jammin',15358,184059,252000,"[u'polish', u'funky', u'tak bardzo ja', u'alternative', u'makes me happy']"
320,Lovelock,11061,118190,240000,"[u'polish', u'happy', u'party', u'Best of', u'interviewed', u'what the fuck', u'positive yeah', u'fuckebmbdsm yeah']"
321,an Paa,9936,87370,262000,"[u'polish', u'Makes Me Smile', u'makes me fucking jump around', u'electronic', u'alternative', u'funk', u'szalenstwo', u'juwenalia', u'dobre wspomnienia', u'playlista rmf fm']"
322,Mucha Nie Siada,1837,8259,0,"[u'funk', u'laki lan', u'mucha nie siada', u'laki funk']"
323,Bombaj,1781,9248,288000,[u'moc energia endorfina']
324,Pola Ar,2986,20643,331000,[]
325,Bombaj,1781,9248,288000,[u'moc energia endorfina']
326,Pola Ar,2986,20643,331000,[]
327,Bombaj,1781,9248,288000,[u'moc energia endorfina']
328,Pola Ar,2986,20643,331000,[]
329,The Conference of the Birds,28472,154105,553000,"[u'post-rock', u'experimental', u'Post-Metal', u'Progressive', u'Sludge', u'epic', u'metal', u'british', u'post rock', u'Favourite Songs', u'post metal', u'chillout', u'rock', u'3', u'screamo', u'melancholic', u'groovy', u'interesting', u'post-hardcore', u'love at first listen', u'audioase', u'fuck', u'songs that make me cry', u'find', u'trumpets', u'epic rock', u'H5N1', u'divine', u'Orgasmic', u'repeat', u'doomcore', u'jazz metal', u'tryme', u'golden arrows', u'more please', u'remarkable', u'jjj', u'omg love', u'music full of space', u'Asleep', u'nieco melancholicke', u'Simply love it', u'fuckin eargasm', u'drifting into dreams', u'I have to think about someone', u'epic post-metal', u'my dear love', u'soundtrack to my brain', u'nomador', u'extraordinary song']"
330,Journey Into Melody - 2007 Digital Remaster,26294,62561,295000,[]
331,[sic!],50106,564296,159000,"[u'rock', u'polish', u'alternative', u'female vocalists', u'hey', u'polish rock', u'nosowska', u'seen live', u'hard rock', u'polish artist', u'indie', u'Grunge', u'alternative rock', u'female vocalist', u'polskie', u'orgasm', u'rodacy', u'indie rock', u'genius', u'Unplugged', u'shiver', u'MTV Unplugged', u'Hey Unplugged', u'fucking good', u'naj naj naj', u'Genialne', u'nie nie nie', u'Love', u'90s', u'angry', u'favourite', u'ghplus', u'inspiration', u'poland', u'woodstock', u'drive', u'ulubione', u'sic', u'polski rock', u'zespol z najambitniejszymi tekstami w Polsce xD', u'fajne teksty', u'greatest polish hits', u'Kasia', u'beeeeeeeeee', u'ulubione by shen', u'rozpierdala stylem', u'o mnie', u'ziejka xD', u'zespol z najambitniejszymi tekstami w polsce', u'bonifacet']"
332,Gotten - feat. Adam Levine,5737,23767,0,[]
333,...Steel for Humans,6215,28892,0,[]
334,Wilcza zamie - Wiedmin 3: Dziki Gon,1918,16622,0,[]
335,Lullaby Of Woe,3729,21305,150000,"[u'Soundtrack', u'ost', u'trailer', u'Witcher3']"
336,Gorgeous - Live  Upstate Sessions,722,2015,0,[]
337,Elegia - 2015 Remastered Version,24841,65684,0,"[u'ost', u'shoegazefan', u'Stranger Things']"
338,Atmosphere - 2010 Remastered Version,15425,37586,0,[u'ost']
339,Waiting for a Girl Like You,270960,1034882,275000,"[u'80s', u'classic rock', u'rock', u'soft rock', u'pop', u'Foreigner', u'Love', u'love songs', u'romantic', u'Ballad', u'easy listening', u'oldies', u'Waiting for a Girl Like You', u'Power ballad', u'Mellow', u'AOR', u'rock ballad', u'favorites', u'GTA Vice city', u'70s', u'hard rock', u'slow', u'Vice City', u'Foreigner - Waiting For A Girl Like You', u'british', u'beautiful', u'melodic rock', u'ballads', u'rock ballads', u'GTA', u'123 drippy sappy', u'classic', u'male vocalists', u""80's"", u'love song', u'1981', u'lovesongs', u'Grand Theft Auto', u'foreigner-waiting for a girl like you', u'Soundtrack', u'chill', u'alternative', u'singer-songwriter', u'Progressive rock', u'pop rock', u'adult contemporary', u'waiting', u'american', u'soft', u'good']"
340,"I Melt With You (7"" mix)",21664,62680,230000,"[u'80s', u'pop', u'new wave', u'best song ever', u'1982', u'put this on and feel better', u'thinking-about-justine', u'i-love-you-justine', u'to be played at my wedding', u'shoegazefan', u'song featured in the movie valley girl']"
341,Hazy Shade of Winter,95250,345988,168000,"[u'80s', u'cover', u'pop', u'female vocalists', u'rock', u'new wave', u'covers', u'bangles', u'winter', u'favorites', u'american', u'1987', u'Soundtrack', u'female vocals', u'female', u'classic', u'pop rock', u'guitar', u'1988', u'best', u'cover version', u'7 of 10 stars', u'The Bangles', u'Pop/Rock', u'80s rock', u'chick rock', u'Female Group', u'classic rock', u'soul', u'cowbell', u'power pop', u'singer-songwriter', u'dance', u'Love', u'synth pop', u'Schlager', u'loud', u'Driving', u'atmospheric', u'thrash metal', u'oldies', u'party', u'Rocking', u'synthpop', u'dramatic', u'new romantic', u'Great Covers', u'rock n roll', u""80's"", u'80']"
342,Can't Seem To Make You Mine,87716,361443,150000,"[u'Garage Rock', u'60s', u'psychedelic', u'garage', u'60s garage', u'Psychedelic Rock', u'rock', u'classic rock', u'nuggets', u'proto punk', u'MetroHadriani Loves this music', u'1965', u'pop', u'punk', u'surf rock', u'proto-punk', u'power pop', u'oldies', u'psych', u'best song ever', u'love at first listen', u'psych rock', u'elevator music', u'psychedelic garage rock', u'psicodelia', u'music i discovered through tv commercials', u'lovedbybeyondwithin', u'60s garage psych', u'beyondwithins party', u'the seeds', u'song to sing to', u'60s underground rock', u'rockabilly soul', u'neatneatneat', u'similar to: pale blue eyes by the velvet underground', u'metal', u'alternative', u'alternative rock', u'favorite songs', u'experimental', u'hard rock', u'favorites', u'Love', u'psychedelic pop', u'moody', u'longing', u'american', u'summer', u'party', u'Alt-country']"
343,Africa,748023,4556033,325000,"[u'80s', u'classic rock', u'rock', u'pop', u'soft rock', u'toto', u'africa', u'pop rock', u'oldies', u'Progressive rock', u'favorites', u'scrubs', u'american', u'easy listening', u'Mellow', u'classic', u'Love', u'nostalgia', u'male vocalists', u'1982', u'GTA Vice city', u'Soundtrack', u'relax', u'Favourites', u'70s', u'yacht rock', u'Toto Africa', u'AOR', u'guilty pleasure', u'party', u""80's"", u'chillout', u'romantic', u'Favorite', u'Vice City', u'Toto - Africa', u'USA', u'Progressive', u'beautiful', u'Chuck', u'Sentimental', u'My Favorites', u'80s rock', u'GTA']"
