,Songs,Listeners,Playcount,Duration,Tags
794,Silvera,40626,242646,215000,"[u'Progressive metal', u'groove metal', u'metal', u'death metal', u'Melodic Death Metal', u'Progressive', u'rock', u'Progressive rock', u'epic', u'melodic', u'groove', u'death', u'thrash metal', u'thrash', u'fip', u'Music Video', u'melodic metal', u'Technical Death Metal', u'progressive death metal', u'environmental', u'green', u'Earth', u'hatred', u'environment', u'progressive thrash metal', u'Melodic Groove Metal', u'Melodic Thrash Metal', u'progressive melodic death metal', u'Progressive Melodic Metal', u'Gojira', u'progressive groove metal', u'environmentalists', u'progressive melodic thrash metal', u'progressive melodic groove metal', u'human hatred']"
795,Offer Your Light,11790,49298,238000,"[u'metal', u'Progressive metal']"
796,Atoma,20244,105916,259000,"[u'Melodic Death Metal', u'chillout', u'pop', u'japanese', u'emo', u'female vocalists', u'dance', u'cute', u'epic', u'easy listening', u'new age', u'pretentious', u'kitsch', u'gay', u'comedy', u'death metal', u'humour', u'anime', u'J-rock', u'parody', u'j-pop', u'ridiculous', u'wtf', u'love at first listen', u'Trash', u'SCHEISSE', u'hilarious', u'boring', u'overrated', u'bullshit', u'halloween', u'garbage', u'BDSM', u'whore', u'dumb', u'sellout', u'porn', u'annoying', u'What', u'awful', u'based', u'lame', u'visual kei', u'vulgar', u'Brutal Death Metal', u'jrock', u'meme', u'2016', u'embarrassing', u'Gay Metal']"
797,Blush,44026,230815,259000,"[u'indie', u'alternative', u'female vocal', u'lovely', u'One of the best', u'End Credits', u'my secret agent lover man', u'exceptional voice', u'Somewhere Out There', u'ttecss', u""i won't chicken out i promise""]"
798,When Two Empires Collide,1041,5327,290000,[]
799,Black Tar,15821,61123,232000,"[u'FM4', u'somafm', u'Bagel']"
800,Smells Like Teen Spirit,1934990,14638490,301000,"[u'Grunge', u'rock', u'Nirvana', u'90s', u'alternative', u'alternative rock', u'punk', u'classic rock', u'anthem', u'hard rock', u'Kurt Cobain', u'seattle', u'american', u'classic', u'favorites', u'Smells Like Teen Spirit', u'punk rock', u'legend', u'Awesome', u'Grunge Rock', u'indie', u'1991', u'best songs ever', u'metal', u'FUCKING AWESOME', u'Favourites', u'90s Rock', u'party', u'favourite', u'guitar', u'cool', u'male vocalists', u'genius', u'powerful', u'favorite songs', u'USA', u'best song ever', u'nevermind', u'Favourite Songs', u'Energetic', u'amazing', u'Rolling Stone 500 Greatest Songs of All Time', u'indie rock', u'epic']"
801,Nan You're a Window Shopper,101340,512120,179000,"[u'pop', u'british', u'female vocalists', u'britpop', u'funny', u'Lily Allen', u'reggae', u'UK', u'cover', u'fun', u'trashpop', u'singer-songwriter', u'london', u'nice', u'00s', u'parody', u'Brilliance', u'indie pop', u'ska', u'Uplifting', u'Story telling', u'dancing', u'Lily', u'beach songs', u'thats hot', u'ukpop', u'Allen', u'fucking rules', u'Hip-Hop', u'indie', u'rock', u'favorite songs', u'best of 2006', u'favorites', u'happy', u'catchy', u'cute', u'unclassifiable', u'Awesome', u'quirky', u'england', u'funky', u'summer', u'ragga', u'dancehall', u'b-side', u'female vocalist', u'Great Covers', u'british invasion', u'Detached']"
802,Satyrs,3570,15526,410000,"[u'doom metal', u'atmospheric doom metal', u'melancholic', u'female vocals']"
803,Not Getting There,57118,306523,166000,"[u'lizvelrene2010', u'electronic', u'femalevocalistsgdchill', u'2010', u'electro rock', u'vugube62', u'indietronica', u'sweet', u'Arguman-loved tracks', u'indie', u'alternative', u'indie rock', u'haunting', u'10s', u'look into', u'luisterpaal', u'songs by bands with the suffix head', u'Soundtrack Of My Life', u'Achmed Tarquins Loved Tracks', u'coramao', u'2download', u'pour toujours', u'Songs played on KSLU']"
804,Gone is Gone,1491,5510,252000,[]
805,"Untouchable, Part 1",41612,509994,374000,"[u'Progressive rock', u'atmospheric rock', u'alternative metal', u'alternative rock', u'rock', u'atmospheric', u'Love', u'british', u'beautiful', u'2012', u'Weather Systems', u'alternative', u'favorite songs', u'UK', u'epic', u'romantic', u'melodic', u'guitar', u'drums', u'Progressive', u'1', u'amazing', u'Gothic Metal', u'keyboard', u'percussion', u'prog rock', u'Favourites', u'melodic metal', u'love song', u'melodic rock', u'FUCKING AWESOME', u'10s', u'magic', u'heard live', u'7 of 10 stars', u'10 of 10 stars', u'6 of 10 stars', u'Favourite Songs', u'i', u'female voice', u'new prog', u'My Favourites', u'good song', u'untouchable', u'best ever', u'openers', u'opener', u'opening track', u'Music to have sex to', u'l']"
806,Lift Me Up,398392,2354777,188000,"[u'electronic', u'dance', u'electronica', u'Moby', u'alternative', u'pop', u'chillout', u'ambient', u'techno', u'rock', u'electro', u'party', u'trance', u'Uplifting', u'energy', u'lift me up', u'00s', u'House', u'Energetic', u'Ambient Techno', u'happy', u'club', u'favorites', u'american', u'cool', u'male vocalists', u'2005', u'Formula 1', u'trip-hop', u'indie', u'catchy', u'favourite', u'Moby - Lift me up', u'experimental', u'Awesome', u'Favourites', u'getting ready for a night out', u'Soundtrack', u'chill', u'alternative rock', u'epic', u'remix', u'summer', u'fav', u'powerful', u'danceable', u'amayzes loved', u'danceable beats', u'Verbotene Liebe', u'sufu5a']"
807,Hate It When You See Me Cry,14025,111022,191000,"[u'rock', u'alternative rock', u'sound storm', u'Female Artist', u'rocking out', u'halestorm']"
808,Diamond Heart,52527,224618,227000,"[u'folk', u'female vocalists', u'ethereal', u'beautiful', u'gilbert', u'soft', u'dream folk', u'alternative', u'folktronica', u'acoustic', u'melancholy', u'gilbert linley', u'female vocals', u'marissa nadler', u'singer-songwriter', u'Love', u'Mellow', u'indie folk', u'neofolk', u'gothic folk', u'this is what dreams are made of', u'haunting', u'darkwave', u'female vocalist', u'Pastoral', u'fantasy', u'sunday morning', u'Lana Del Rey', u'sad and beautiful', u'neo-folk', u'velvet folk', u'Akiko Shikata', u'vugube62', u'indie', u'female', u'sad', u'dark', u'Gothic', u'new age', u'guitar', u'Dreamy', u'peaceful', u'atmospheric', u'dream pop', u'freak folk', u'melancholic', u'Heartbreaking', u'lovely', u'love at first listen', u'yes']"
809,Edge of the World,94666,454769,250000,"[u'rock', u'alternative rock', u'mike patton', u'faith no more', u'alternative metal', u'funk metal', u'alternative', u'metal', u'hard rock', u'80s', u'Progressive rock', u'jazz', u'groovy', u'experimental', u'Awesome', u'rap metal', u'heavy metal', u'sexy', u'favorites', u'piano', u'funk', u'90s', u'vocals', u'american', u'Ballad', u'patton', u'80s rock', u'pedophile', u'classic rock', u'blues', u'groove', u'bass', u'blues rock', u'cool', u'9 of 10 stars', u'Funk Rock', u'Jazz Inflected Rock', u'80s metal', u'pedophilia', u'seen live', u'punk', u'Grunge', u'hardcore', u'Progressive metal', u'USA', u'Stoner Rock', u'pop rock', u'calm', u'Love', u'epic']"
810,tightrope,10290,39407,231000,[]
811,My Sweet Prince,273436,1814255,345000,"[u'alternative', u'alternative rock', u'Placebo', u'rock', u'british', u'sad', u'melancholic', u'indie rock', u'Love', u'indie', u'melancholy', u'depressive', u'beautiful', u'britpop', u'90s', u'atmospheric', u'dark', u'night', u'emotional', u'chillout', u'favourite', u'depressing', u'drugs', u'sexy', u'acoustic', u'touching', u'My Sweet Prince', u'glam rock', u'male vocalists', u'Ballad', u'good music to cry with', u'UK', u'favorites', u'quiet storm', u'waltz', u'Favourites', u'makes me cry', u'best songs ever', u'seen live', u'memories', u'slow', u'Mellow', u'quiet', u'nostalgia', u'floating in space music', u'the best of placebo', u'pop', u'downtempo', u'moody', u'love this band']"
812,Cain,58862,407494,326000,"[u'Gothic Metal', u'doom metal', u'Gothic', u'metal', u'Gothic Rock', u'rock', u'vampire the masquerade bloodlines', u'swedish', u'tiamat', u'bloodlines', u'Jointstereo', u'seen live', u'atmospheric gothic rock', u'vampire', u'Progressive metal', u'dark', u'Progressive', u'death metal', u'melancholic', u'male vocalists', u'worship', u'8 of 10 stars', u'cain', u'Atmospheric metal', u'Soundtrack', u'black metal', u'alternative', u'goth', u'sad', u'fav', u'melodic metal', u'goth metal', u'Female fronted metal', u'hip hop', u'classic', u'sexy', u'favorites', u'Awesome', u'2003', u'morning', u'angry', u'atmospheric', u'Doom', u'excellent', u'melancholy', u'amazing', u'sex', u'nice', u'5-STARS', u'great lyrics']"
813,Lunatic Soul,32707,227350,407000,"[u'Progressive rock', u'psychedelic', u'polish', u'Lunatic Soul', u'experimental', u'ambient', u'melancholic', u'Psychedelic Rock', u'rock', u'Awesome', u'atmospheric', u'Progressive', u'emotional', u'magic', u'lunatic rock', u'sad', u'epic', u'beautiful', u'melodic', u'melancholy', u'brilliant', u'touching', u'soothing', u'q3jslfm', u'4jsduskmellow', u'beyond human understanding', u'Mariusz Duda', u'::kainkagr', u'my own dream-on', u'metal', u'chillout', u'instrumental', u'alternative', u'alternative rock', u'singer-songwriter', u'industrial', u'acoustic', u'haunting', u'3', u'Mellow', u'amazing', u'catharsis', u'darkwave', u'post rock', u'exotic', u'dark ambient', u'lyrics', u'melodic metal', u'atmospheric rock', u'Masterpiece']"
814,Spirits in the Material World,207695,752033,178000,"[u'80s', u'rock', u'new wave', u'classic rock', u'pop', u'The Police', u'british', u'reggae', u'alternative rock', u'post-punk', u'alternative', u'sting', u'police', u'mpsvdloved', u'Progressive rock', u'album rock', u'male vocalists', u'poprock', u'1981', u'ska', u'classic', u'eighties', u'Favourites', u'6 of 10 stars', u'1982', u'Reggae Rock', u'good feely', u'Spirits in the Material World', u'the greatest rock n roll group of em all', u'mpsvd-young-d', u'jazz', u'chill', u'punk', u'dance', u'pop rock', u'favorites', u'90s', u'drums', u'punk rock', u'good', u'male vocalist', u""80's"", u'early mtv years', u'porabuelito', u'abarritedicolamadecoa', u'the real junk', u'rock top', u'great 80s', u'top 1000', u'Porieux-loved']"
815,Sleepwalkers Dream,48024,328488,267000,"[u'symphonic metal', u'Gothic Metal', u'Female fronted metal', u'Delain', u'metal', u'female vocalists', u'Gothic', u'symphonic gothic metal', u'dutch', u'melodic metal', u'netherlands', u'female vocal', u'beautiful voices', u'Delain - Sleepwalkers Dream', u'seen live', u'favorites', u'Symphonic Rock', u'beautiful', u'glam rock', u'female vocals', u'Gothic Rock', u'Power metal', u'Lady metal', u'Female Vocal Gothic Metal', u'gothic symphonic metal', u'heavy metal', u'instrumental', u'C', u'atmospheric', u'Doom', u'Sleep', u'relaxing', u'Coldplay', u'loved', u'good', u'female vocalist', u'majestic', u'symphonic', u'Favourites', u'brilliant', u'love at first listen', u'investigate further', u'8 of 10 stars', u'Jambimbera', u'3 stars', u'english lyrics', u'dutch artist', u'ladies', u'sleepwalking', u'Fabulous']"
816,The Game,411121,2396696,225000,"[u'metal', u'Nu Metal', u'hard rock', u'Disturbed', u'rock', u'heavy metal', u'alternative metal', u'alternative', u'alternative rock', u'Disturbed - The Game', u'industrial', u'the game', u'Nu-metal', u'hardcore', u'favorites', u'Progressive metal', u'industrial rock', u'aggressive', u'heavy', u'angry', u'heavy rock', u'kick ass', u'Awesome', u'american', u'Power metal', u'I love this song', u'my music', u'metalcore', u'electronic', u'seen live', u'Favorite Bands', u'Progressive rock', u'00s', u'alternative hard rock', u'intense', u'Favourites', u'2000', u'favorite band', u'high energy', u'cool', u'good', u'heard on Pandora', u'industrial metal', u'chicago', u'rock band', u'8 of 10 stars', u'FUCKING AWESOME', u'american metal', u'rock band dlc', u'god I love this song']"
817,Calm Now,23083,122175,233000,"[u'chillout', u'trip-hop', u'Progressive rock', u'indie rock', u'Awesome', u'male vocalists', u'love at first listen', u'5 Stars', u'wonderful', u'Titorsbrother', u'magic', u'7 of 10 stars', u'6 of 10 stars', u'fucking great', u'to listen at night', u'Breathtaking', u'songs that you wanna listen to over and over again', u'emotional landscapes', u'if you fall in love with me you should know these songs by heart', u'it makes me cry', u'i begin to luv the way u r', u'soul disaster', u'repeat please', u'if this song were a human i would marry it twice', u'love for the first listening', u'something so good']"
818,Ten Thousand Fists,444137,2754559,212000,"[u'metal', u'Nu Metal', u'hard rock', u'alternative metal', u'Disturbed', u'rock', u'heavy metal', u'alternative', u'Ten Thousand Fists', u'Nu-metal', u'american', u'favorites', u'00s', u'industrial metal', u'american metal', u'Progressive metal', u'Awesome', u'chicago', u'If this disturbs you then walk away', u'Disturbed - Ten Thousand Fists', u'david draiman', u'alternative rock', u'epic', u'loved', u'Favorite', u'Power metal', u'wrif-fm', u'hardrock', u'metalcore', u'seen live', u'favorite songs', u'heavy', u'Favorite Artists', u'amazing', u'good', u'8 of 10 stars', u'FUCKING AWESOME', u'6 of 10 stars', u'Favourite Songs', u'yeah', u'best songs ever', u'good song', u'metal anthem', u'awesome voice', u'10000 fists', u'Death Bed Confession']"
819,Les dictateurs,4863,21486,224000,[u'rock fran\xe7ais']
820,Tatutia,1341,5898,296000,"[u'rock', u'great', u'francais', u'lovely']"
821,The Passing,9939,52988,288000,"[u'Gothic Metal', u'harmony', u'symphonic gothic metal', u'female and male vocalists']"
822,Versus,29321,124592,439000,"[u'electronic', u'dub', u'trip-hop', u'electro', u'electro-dub', u'electronica', u'french', u'electro dub', u'political', u'downtempo', u'dark', u'EZ3kiel', u'versus', u'trip hop', u'france', u'ElectglitchdubhoP', u'Hip-Hop', u'experimental', u'techno', u'Awesome', u'spoken word', u'maerchenmusik', u'trance', u'chillout', u'ambient', u'strange', u'downbeat', u'idm', u'me', u'electronic dub', u'triphop', u'loved', u'goa', u'cool', u'live', u'interesting', u'wish list', u'hate', u'latin jazz', u'french electro', u'fiesta', u'Jam', u'i am a party girl here is my soundtrack', u'psycho', u'wow', u'wake up', u'negative', u'zicbouge', u'wisdom', u'zicdanse']"
823,Yap In My Pillow,632,2269,269000,[]
824,Let's Get Rocked,76727,395490,296000,"[u'rock', u'hard rock', u'80s', u'Def Leppard', u'hair metal', u'classic rock', u'british', u'90s', u'heavy metal', u'metal', u'Glam Metal', u'NWOBHM', u'glam rock', u'favorites', u'catchy', u'1992', u'hair band', u'hair bands', u'Hair Rock', u'Pop Metal', u'Megadeth', u'adrenalize', u'Rick Savage', u'phil collen', u'happy', u'energy', u'guitar', u'upbeat', u'top', u'thrash', u'old school', u'glam', u'fun', u'good', u'Rock and Roll', u'rhythm and blues', u""80's"", u'english', u'road trip', u'hits', u'8 of 10 stars', u'9 of 10 stars', u'lyrics', u'Best of', u'growing up', u'greatest hits', u'gute laune', u'all the best', u'1990s', u'4 of 10 stars']"
825,Shiny Happy People,474127,1990057,224000,"[u'rock', u'90s', u'alternative', u'alternative rock', u'happy', u'REM', u'pop', u'classic rock', u'indie', u'fun', u'nostalgic', u'1991', u'80s', u'pop rock', u'american', u'upbeat', u'party', u'Favourites', u'summer', u'cheerful', u'college rock', u'favorites', u'male vocalists', u'feelgood', u'soft rock', u'indie rock', u'songs that make me happy', u'shiny', u'Uplifting', u""90's"", u'male vocals', u'Shiny Happy People', u'Wake up Music', u'Kate Pierson', u'classic', u'catchy', u'jangle pop', u'favourite', u'good', u'ironic', u'Summery', u'10 of 10 stars', u'Favourite Songs', u'Feelgood tracks', u'dance', u'memories', u'Energetic', u'new', u'soft', u'I like']"
826,Folk of the North,24587,99522,77000,"[u'instrumental', u'Melodic Death Metal', u'melodic metal', u'finnish death metal', u'metal', u'doom metal', u'folk metal', u'90s', u'vocals', u'finnish', u'death metal', u'symphonic metal', u'7 of 10 stars', u'suomirock', u'good7', u'ctrlc']"
827,Cuts You Up,68486,418813,324000,"[u'new wave', u'alternative', u'Gothic', u'80s', u'goth', u'post-punk', u'rock', u'Gothic Rock', u'alternative rock', u'90s', u'favorites', u'pop', u'darkwave', u'peter murphy', u'Love', u'melancholy', u'dark wave', u'perfect', u'bauhaus', u'dark', u'male vocalists', u'1990', u'goth rock', u'loved tracks', u'modern vs classical', u'classic rock', u'UK', u'beautiful', u'Favorite', u'gothic romance', u'dear old dismal england', u'seen live', u'indie', u'british', u'favorite songs', u'indie rock', u'sad', u'singer-songwriter', u'dance', u'night', u'WBER', u'interesting', u'essentials', u'addicting', u'1990s', u'1989', u'veterans', u'peter', u'repeat', u'5 star songs']"
828,Ethica Odini,30092,200955,479000,"[u'progressive black metal', u'black metal', u'Progressive metal', u'metal', u'extreme progressive metal', u'norwegian', u'viking metal', u'2010', u'Enslaved', u'grindcore', u'Awesome', u'Coldplay', u'my life story', u'norsk', u'prog metal', u'epic black metal', u'totally awesome', u'progressive viking metal', u'cool riff', u'heartpiercing screams and bonecrushing growls', u'dat solo', u'Tema Increible', u'Evergreen Favorite', u'Prog Black', u'metalistkreig']"
829,Forget Not,19388,178573,722000,"[u'progressive black metal', u'Progressive metal', u'brilliant', u'epic', u'black metal', u'symphonic', u'best use of violin ever', u'metal', u'experimental', u'beautiful', u'violins', u'Progressive', u'00s', u'Extreme Metal', u'Power metal', u'Masterpiece', u'10s', u'tapping', u'Avantgarde Metal', u'music to play at my funeral', u'Fuckin brilliant', u'Best Song in the History of Humanity', u'progressive blackened death thrash metal', u'AS THE DEAD SIGH YAYA']"
830,Some Velvet Morning,12248,58333,359000,"[u'doom metal', u'cover', u'covers', u'symphonic metal', u'Doom', u'metal', u'Gothic Metal', u'Songs nobody knows but are worth finding out about', u'favorites', u'violin', u'great lyrics', u'4', u'cover songs', u'i am a party girl here is my soundtrack', u'music to fall asleep to', u'addicting', u'cover song', u'nancy sinatra', u'Death Doom Metal', u'metal cover', u'nancy sinatra cover', u'songs I fucking love to death', u'loved tracks', u'lovely stuff', u'Kill me now', u'death-doom', u'Everything i need', u'suru', u'The Greatest Songs Ever', u'asa', u'rauhoittavia', u'best cover songs', u'good1', u'hard and beautiful', u'my doom', u'goth rock and more', u'Cool Cover songs', u'kivoja', u'hjuva metal', u'leijuvaa', u'synu', u'nick cave crossover']"
831,Unchained (Tales of the Unexpected),25778,162387,258000,"[u'Progressive rock', u'melancholic', u'alternative', u'Progressive metal', u'acoustic', u'melancholy', u'katharsis', u'seen live', u'rock', u'alternative rock', u'beautiful', u'atmospheric', u'loved', u'7 of 10 stars', u'Atmospheric metal', u'dream rock', u'this is NOT METAL', u'dobre', u'hindsight', u'hipnotyzujace']"
832,She Said Destroy,32234,193858,214000,"[u'neofolk', u'apocalyptic folk', u'post-punk', u'industrial', u'neo-folk', u'darkwave', u'Gothic', u'folk', u'experimental', u'I want back to the 80s', u'electronica', u'seen live', u'british', u'alternative', u'new york', u'indie rock', u'epic', u'dark', u'soft rock', u'guitar', u'Hope', u'Doom', u'NYC', u'loved', u'dark folk', u""80's"", u'Gothic Rock', u'wave', u'1984', u'Black', u'I love this song', u'darkness', u'martial industrial', u'seeking', u'virgin', u'dark pop', u'all time favorites', u'lovelovelove', u'bloody', u'death in june', u'sacred songs', u'ghotic', u'helplessly singing along', u'sf cloudy days', u'cigarette break', u'banners', u'blessed virgin', u'prey', u'tatters', u'artistically spark']"
833,Down By the Neonlights,554,1362,191000,"[u'AOR', u'melodic rock']"
834,Endless Sea (gentle version),5495,20777,359000,[u'progressive folk']
835,Red Light,13175,46627,211000,"[u'Grunge', u'rock', u'alternative', u'alternative rock', u'colours', u'Darkness and Light']"
836,Pretty Like Drugs,27725,160822,240000,"[u'alternative rock', u'female vocalists', u'alternative', u'Gothic', u'riot grrrl', u'rock', u'Grunge', u'Queen Adreena', u'industrial', u'female vocalist', u'<3', u'metal', u'goth', u'sexy', u'indie rock', u'noisy', u'Gothic Rock', u'drugs', u'BANG THINE HEAD', u'pretty like drugs', u'indie', u'favorites', u'Favourite Songs', u'riot grrl', u'alice in wonderland', u'on repeat', u'bitchrock', u'miianens playlist', u'noise', u'female', u'british', u'favorite songs', u'vampire', u'hardcore', u'noise rock', u'hard rock', u'UK', u'happy', u'Love', u'dark', u'RockPop', u'beautiful', u'Dreamy', u'day', u'angry', u'punk rock', u'alternative metal', u'ethereal', u'Gothic Metal', u'cyberpunk']"
837,Running to the Sea,74664,471324,295000,"[u'electronic', u'Dreamy', u'chillout', u'downtempo', u'epic', u'electronica', u'House', u'synthpop', u'love at first listen', u'2012', u'dancing by myself', u'10s', u'loooove', u'instant hardon', u'my neighbours will love this', u'10 of 10 stars', u'2014', u'scarlett johansson', u'emotional landscapes', u'Carmen Electra', u'running on the beach', u'dominique simone']"
838,Alone,40817,277382,297000,"[u'trip rock', u'alternative rock', u'female vocalists', u'Gothic', u'atmospheric', u'Gothic Metal', u'rock', u'Progressive metal', u'Gothic Rock', u'The Gathering', u'alternative', u'heard on Pandora', u'trip-rock', u'metal', u'chillout', u'sad', u'industrial', u'Awesome', u'Dreamy', u'perfect voice', u'q4jslfm', u'4jspostmetal', u'Female fronted metal', u'indie', u'ambient', u'experimental', u'sexy', u'post-rock', u'Progressive rock', u'depressed', u'catchy', u'dark', u'beautiful', u'melancholy', u'amazing', u'nostalgic', u'ethereal', u'intense', u'melancholic', u'post rock', u'female vocals', u'dutch', u'depressing', u'rock n roll', u'00s', u'relax', u'play this at my funeral', u'brilliant', u'female singers', u'Solitude']"
839,Slanias Song,51758,450154,340000,"[u'folk metal', u'celtic metal', u'metal', u'pagan metal', u'Folk Death Metal', u'Melodic Death Metal', u'Celtic Folk Metal', u'Eluveitie', u'medieval', u'death metal', u'celtic', u'folk melodic death metal', u'seen live', u'folk', u'excellent', u'female vocals', u'swiss', u'FUCKING AWESOME', u'melodies', u'absolute uebersong', u'slanias Song', u'slania', u'Hard', u'beautiful', u'want to see live', u'8 of 10 stars', u'Masterpiece', u'Favourite Songs', u'Chills', u'sorrow', u'Stunning', u'9 lbs hammer', u'Obama', u's2', u'beautiful female vocals', u'gaul', u'great feeling', u'swiss band', u'month', u'gaelic metal', u'very emotional', u'helvetian', u'Atmospheric masterpiece', u'nulinya fav songs', u'fantastic feeling', u'Songs zum Nachdenken', u'genious atmosphere', u'genious feeling', u'motivational music to intice riots of epic proportions', u'melodioes']"
840,On Most Surfaces,32118,189781,450000,"[u'Gothic Metal', u'Progressive metal', u'female vocalists', u'metal', u'Gothic', u'The Gathering', u'alternative', u'winter', u'heard on Pandora', u'Atmospheric metal', u'trip-rock', u'Breathtaking', u'perfect voice', u'Progressive rock', u'Symphonic Rock', u'amazing', u'melancholic', u'symphonic metal', u'Favorite', u'Masterpiece', u'7 of 10 stars', u'1997', u'Gothic Doom Metal', u'melancholic gothic metal', u'lacrimaindarkness', u'pop', u'ambient', u'doom metal', u'Awesome', u'psychedelic', u'90s', u'atmospheric', u'alternative metal', u'dutch', u'female vocalist', u'live', u'Gothic Rock', u'brilliant', u'Power metal', u'melodic metal', u'perfect', u'heavy rock', u'atmospheric rock', u'melodic rock', u'powerful', u'goth metal', u'opera metal', u'numb', u'gothic-doom metal', u'best of 1997']"
841,This Is A trick,19481,116302,0,"[u'sexy as fuck', u'blowing my mind']"
842,In Times,10254,44458,644000,"[u'black metal', u'Progressive metal', u'metal', u'death metal', u'progressive black metal']"
843,Amaranth,4210,14439,445000,[]
844,New Song,48731,209498,256000,"[u'fip', u'alternative dance', u'fallon']"
845,Ice Water,21812,141880,249000,"[u'alternative rock', u'rock', u'female vocalists', u'atmospheric', u'melancholic', u'alternative', u'beautiful', u'anneke van giersbergen', u'art rock', u'dutch', u'audioase', u'trip rock', u'agua de annique', u'chieps favourites', u'Female fronted metal', u'indie rock', u'Awesome', u'00s', u'alt rock', u'brilliant', u'Masterpiece', u'dreams', u'Godlike', u'Dutch bands', u'coffee break', u'Q4', u'lacrimaindarkness', u'guano apes', u'female gothic', u'q5', u'4jsduskmellow', u'country:netherlands', u'great duet', u'play again', u'poetical', u'new art rock', u'Slave Called Shiver', u'rock it girl', u'myk female voices', u'for: kainkagr', u'boyamaca', u'for: js-dusk-mellow', u'4jsindie', u'q5jslfm']"
846,The Presence Is Ominous,17473,70581,294000,"[u'black metal', u'melodic black metal', u'metal', u'viking metal', u'00s', u'2000', u'Folk Black Metal', u'21st century', u'kk', u'best song ever ever']"
847,Breath on a Window,36888,166125,320000,"[u'heavy metal', u'Grunge', u'alternative metal', u'hard rock', u'Sludge', u'rock', u'sludge metal', u'metal', u'alternative', u'alternative rock', u'doom metal', u'10s', u'Alice in Chains', u'Stoner Rock', u'american', u'Garage Rock', u'stoner metal', u'shit', u'4 Stars', u""rock 'n roll"", u'Music Choice: Rock', u'DAT OUTRO', u'Rockizinho']"
848,Ever Expanding Eternity,4227,25214,360000,"[u'Gothic Metal', u'beautiful', u'Gothic Rock', u'ethnic doom metal', u'screaming from the dark', u'doom metal', u'ethnic doom-gothic metal']"
849,Angus McFife,17346,117311,208000,"[u'Power metal', u'heavy metal', u'metal', u'symphonic metal', u'Rhapsody', u'Epic Power Metal', u'metalmittwoch']"
