,Songs,Listeners,Playcount,Duration,Tags
638,The Shape,188959,833863,217000,"[u'metal', u'Nu Metal', u'Slipknot', u'heavy metal', u'Nu-metal', u'alternative metal', u'rock', u'Melodic Death Metal', u'thrash metal', u'metalcore', u'hardcore', u'hard rock', u'favorites', u'the shape', u'seen live', u'alternative', u'90s', u'angry', u'american', u'hardcore metal', u'maggot music', u'slipknot - the shape', u'Favorite Bands', u'Hard', u'heavy', u'emo', u'Love', u'industrial', u'idm', u'drums', u'death metal', u'good', u'hate', u'iowa', u'best', u'love at first listen', u'underground', u'2012', u'2000s', u'2001', u'awesomeness', u'ace', u'scream', u'growl', u'kick ass', u'My favourite', u'smeg', u'street', u'new metal', u'My Favorites']"
639,Left Behind,391431,2357860,241000,"[u'metal', u'Nu Metal', u'Slipknot', u'heavy metal', u'alternative metal', u'Nu-metal', u'hard rock', u'rock', u'left behind', u'metalcore', u'Melodic Death Metal', u'alternative rock', u'alternative', u'death metal', u'maggot music', u'hardcore', u'favorites', u'american', u'thrash metal', u'2001', u'My Plague', u'slipknot - left behind', u'seen live', u'heavy', u'Awesome', u'iowa', u'slipknot left behind', u'Progressive metal', u'Progressive rock', u'angry', u'thrash', u'rock band', u'My favourite', u'666', u'718 Metal', u'rock band dlc', u'corey', u'all hope is gone', u'ich liebe dich cr4ke', u'hard truth', u'indie', u'favorite songs', u'Hard', u'emo', u'USA', u'pop rock', u'memories', u'power', u'epic', u'90s']"
640,The Heretic Anthem,269402,1573351,253000,"[u'metal', u'Nu Metal', u'Slipknot', u'death metal', u'Nu-metal', u'heavy metal', u'alternative metal', u'rock', u'hard rock', u'alternative', u'metalcore', u'maggot music', u'666', u'I am 6-6-6', u'Awesome', u'thrash metal', u'aggressive', u'Favorite', u'Favourite Songs', u'The Heretic Anthem', u'break your face shit', u'if your 555 then im 666', u'black metal', u'alternative rock', u'hardcore', u'thrash', u'great song', u'All time favourites', u'corey taylor', u'classic rock', u'heavy', u'Melodic Death Metal', u'trash metal', u'songs that you wanna listen to over and over again', u'songs to headbang to', u'favorites', u'industrial', u'Rocking', u'Gothic Metal', u'iowa', u'2001', u'hardcore metal', u'best played loud', u'neo-metal', u'heretic', u'kopie w dupe', u'Headbanging material', u'Pop Star Threat', u'greatest guitar riffs', u'music for people who are against everything without any reason']"
641,Everything Ends,281753,1557870,254000,"[u'metal', u'Nu Metal', u'Slipknot', u'heavy metal', u'Nu-metal', u'metalcore', u'rock', u'alternative metal', u'Everything Ends', u'angry', u'Awesome', u'fast', u'hard rock', u'Melodic Death Metal', u'thrash metal', u'FUCKING AWESOME', u'maggot music', u'fucked and overrated', u'seen live', u'heavy', u'sad', u'favorites', u'great', u'Like', u'iowa', u'fav', u'rap metal', u'2001', u'best songs ever', u'my music', u'All time favourites', u'psycho metal', u'718 Metal', u'real fuckin shit', u'psychometal', u'PsychoMetal4Life', u'Slipknot-Everything Ends', u'Slipknot Everything Ends', u'black metal', u'alternative', u'alternative rock', u'hardcore', u'experimental', u'memories', u'loud', u'drums', u'Driving', u'excellent', u'amazing', u'death metal']"
642,My Plague,379857,2079933,220000,"[u'metal', u'Nu Metal', u'Slipknot', u'heavy metal', u'alternative metal', u'rock', u'Nu-metal', u'alternative', u'death metal', u'metalcore', u'My Plague', u'thrash metal', u'hard rock', u'favorites', u'Awesome', u'industrial metal', u'Hard', u'hardcore', u'american', u'iowa', u'Slipknot - my Plague', u'heavy', u'Resident Evil', u'Soundtrack', u'angry', u'thrash', u'great', u'Awesome Guitar Jams', u'Favourites', u'groove metal', u'Turbonegro', u'maggot music', u'pennywise', u'Neuroshima', u'hard loved', u'360shift', u'harder then a coffin nail', u'My Plague - Slipknot', u'industrial', u'Melodic Death Metal', u'aggressive', u'heard on Pandora', u'Love it', u'Favourite Songs', u'2001', u'corey taylor', u'Mendigao thrash', u'neverbackdown', u'ravenous', u'old stuff i liked when i was little']"
643,Disasterpiece,276940,1553137,308000,"[u'metal', u'Nu Metal', u'Slipknot', u'heavy metal', u'Nu-metal', u'alternative metal', u'hard rock', u'death metal', u'rock', u'Melodic Death Metal', u'thrash metal', u'iowa', u'corey taylor', u'metalcore', u'angry', u'maggot music', u'seen live', u'alternative', u'heavy', u'hardcore', u'thrash', u'00s', u'Favorite', u'My Favorites', u'Aggresive', u'Slip', u'roadrunner records', u'let me fuck you cr4ke', u'disasterpiece', u'slipknot-disasterpiece', u'I Wanna Slit Your Throat And Fuck The Wound', u'noise', u'black metal', u'Hip-Hop', u'pop', u'punk', u'Grunge', u'Hard', u'dance', u'favorites', u'loud', u'american', u'Dope', u'genius', u'brasil', u'punk rock', u'screamo', u'Like', u'good', u'live']"
644,People = Shit,396696,2609199,215000,"[u'metal', u'Nu Metal', u'heavy metal', u'Slipknot', u'metalcore', u'alternative metal', u'death metal', u'Nu-metal', u'thrash metal', u'rock', u'hardcore', u'hard rock', u'alternative', u'angry', u'people shit', u'Fuck You All', u'PEOPLE EQUAL SHIT', u'iowa', u'american', u'deathcore', u'aggressive', u'seen live', u'kick ass', u'i hate you all', u'hate', u'shit', u'anger', u'rage', u'alternative brutal death', u'alternative rock', u'Progressive metal', u'favorites', u'Awesome', u'great', u'FUCKING AWESOME', u'2001', u'groove metal', u'maggot music', u'deathfuck', u'music for people who are against everything without any reason', u'mizantropic', u'children of the korn', u'experimental', u'screamo', u'Extreme Metal', u'2000s', u'unfuckwithable', u'a place for people with that tiny black spot on their brain to go when the darkness leaks out and does what it wills', u'great song title', u'Adrenaline Rush']"
645,(515),19145,39023,59000,"[u'metal', u'Nu Metal', u'Nu-metal', u'hard rock', u'Slipknot', u'alternative metal', u'Short Track', u'heavy metal', u'metalcore', u'rock', u'thrash metal', u'NOT METAL', u'pimp', u'System of a Down', u'maggot music', u'515', u'heavy', u'hardcore', u'best', u'Favourites', u'chaos', u'listinha legal', u'SICmuSIC', u'bar0009', u'p4n1c0', u'Papat', u'this is soooooooooooo funny', u'punk not die', u'yellowcard- twenty three', u'Slipknot - 515', u'american', u'all hope is gone', u'11 years old', u'intro noise']"
646,Liberate,202821,1275595,186000,"[u'Nu Metal', u'metal', u'Slipknot', u'alternative metal', u'heavy metal', u'Nu-metal', u'rock', u'american', u'Hard', u'hard rock', u'1999', u'alternative', u'death metal', u'male vocalist', u'8 of 10 stars', u'rap metal', u'maggot music', u'makes my hands and head move', u'metalcore', u'seen live', u'heavy', u'hardcore', u'rap', u'Contemporary', u'90s', u'drums', u'Avant-Garde', u'emotional', u'male vocalists', u'live', u'industrial metal', u'hate', u'Crap', u'Favorite', u'rapcore', u'2005', u'underground', u'drum solo', u'wow', u'perfect', u'ouch', u'2012', u'Love it', u'heard live', u'favorite tracks', u'english lyrics', u'1990s', u'5', u'bananas', u'madness']"
647,Me Inside,118692,620345,159000,"[u'Nu Metal', u'metal', u'alternative metal', u'heavy metal', u'Slipknot', u'Nu-metal', u'metalcore', u'Melodic Death Metal', u'thrash metal', u'death metal', u'hardcore metal', u'alternative', u'Progressive metal', u'american', u'6 of 10 stars', u'1999', u'core', u'neo-metal', u'maggot music', u'corey taylor', u'ich liebe dich cr4ke', u'du bist so geil schatz', u'ich will ein kind von dir cr4ke', u'rock', u'grindcore', u'90s', u'Avant-Garde', u'winter', u'male vocalists', u'8 of 10 stars', u'love this', u'2000s', u'1990s', u'new metal', u'all hope is gone', u'cr4ke mein Schatz', u'cr4ke', u'cr4key', u'cr4ke ist mein leben', u'cr4ke ich liebe dich', u'machs mir cr4ke', u'mein ein und alles: cr4ke', u'ich will dich du luder', u'nimm sie in den mund', u'du machst mich so geil cr4ke', u'in love with cr4ke', u'cr4ke du bist die beste und geilste', u'mein drogenkind cr4ke', u'fick mich cr4ke', u'let me fuck you cr4ke']"
648,Spit It Out,336038,2426795,159000,"[u'Nu Metal', u'metal', u'Slipknot', u'heavy metal', u'alternative metal', u'Nu-metal', u'rapcore', u'metalcore', u'rock', u'rap metal', u'hard rock', u'hardcore', u'Spit It Out', u'alternative', u'fast', u'corey taylor', u'seen live', u'favorites', u'Hard', u'heavy', u'american', u'thrash metal', u'trash metal', u'maggots we are', u'nu- metal', u'Awesome', u'death metal', u'1990s', u'1999', u'kick ass', u'666', u'maggot music', u'Favorite', u'roadrunner records', u'deserves to be played loud', u'emo', u'memories', u'90s', u'iowa', u'best', u'10 of 10 stars', u'songs that you wanna listen to over and over again', u'Great Shit', u'all hope is gone', u'Some Damn Good Music', u'motherfucking rage', u'Jump The Fuck Up', u'music to break things to', u'Disco', u'Hip-Hop']"
649,Wait and Bleed,775785,5662151,147000,"[u'metal', u'Nu Metal', u'Slipknot', u'heavy metal', u'rock', u'alternative metal', u'Nu-metal', u'hard rock', u'hardcore', u'alternative', u'metalcore', u'death metal', u'angry', u'aggressive', u'FUCKING AWESOME', u'Slipknot - Wait and Bleed', u'thrash metal', u'Wait and Bleed', u'heavy', u'Awesome', u'alternative rock', u'american', u'rapcore', u'maggot music', u'corey taylor', u'favorite songs', u'1999', u'seen live', u'punk', u'favorites', u'groove metal', u'bleed', u'wait', u'dark', u'new metal', u'Soundtrack', u'rap metal', u'radioultra', u'Grunge', u'emo', u'industrial', u'cool', u'I love this song', u'powerful', u'favourite vocalists', u'fucking good', u'sufu5a']"
650,Eyeless,262618,1867687,236000,"[u'Nu Metal', u'metal', u'alternative metal', u'Slipknot', u'Nu-metal', u'heavy metal', u'metalcore', u'rock', u'angry', u'hard rock', u'hardcore', u'FUCKING AWESOME', u'maggot music', u'corey taylor', u'heavy', u'thrash metal', u'favorites', u'Awesome', u'screamo', u'amazing', u'favorite tracks', u'shit metal', u'neo-metal', u'you cant see california without marlon brandos eyes', u'eyeless', u'seen live', u'power', u'drums', u""drum'n'bass"", u'great lyrics', u'10 of 10 stars', u'hateful', u'all hope is gone', u'so fucking goddamn awesome', u'alternative', u'experimental', u'RIP', u'Melodic Death Metal', u'Driving', u'Avant-Garde', u'american', u'great', u'good shit', u'California', u'emotional', u'melancholic', u'f', u'great song', u'groovy', u'High School']"
651,Despise,17624,76981,220000,"[u'metal', u'Slipknot', u'Nu Metal', u'rock', u'alternative metal', u'soramimi', u'cr4ke mein Schatz', u'cr4ke', u'cr4key', u'cr4ke ist mein leben', u'cr4ke ich liebe dich', u'machs mir cr4ke', u'mein ein und alles: cr4ke', u'ich liebe dich cr4ke', u'du bist so geil schatz', u'ich will dich du luder', u'nimm sie in den mund', u'du machst mich so geil cr4ke', u'in love with cr4ke', u'ich will ein kind von dir cr4ke', u'cr4ke du bist die beste und geilste', u'mein drogenkind cr4ke', u'fick mich cr4ke', u'let me fuck you cr4ke', u'du bist mein schatz', u'fuck me cr4ke', u'ohne dich bin ich nichts', u'i love you cr4ke', u'Original Purity']"
652,Interloper,22423,104758,178000,"[u'Nu Metal', u'metal', u'rapcore', u'Slipknot', u'alternative metal', u'Fucking Metal', u'rock', u'cr4ke mein Schatz', u'cr4ke', u'cr4key', u'cr4ke ist mein leben', u'cr4ke ich liebe dich', u'machs mir cr4ke', u'mein ein und alles: cr4ke', u'ich liebe dich cr4ke', u'du bist so geil schatz', u'ich will dich du luder', u'nimm sie in den mund', u'du machst mich so geil cr4ke', u'in love with cr4ke', u'ich will ein kind von dir cr4ke', u'cr4ke du bist die beste und geilste', u'mein drogenkind cr4ke', u'fick mich cr4ke', u'let me fuck you cr4ke', u'du bist mein schatz', u'fuck me cr4ke', u'ohne dich bin ich nichts', u'i love you cr4ke']"
653,Wait and Bleed (Terry Date mix),14764,66198,0,"[u'alternative metal', u'Nu Metal', u'maggot music', u'Nu-metal', u'corey taylor', u'fucking loving it']"
654,Spit It Out (Hyper version),13259,59495,0,"[u'metal', u'alternative metal', u'Nu Metal', u'seen live', u'rock', u'Slipknot', u'maggot music']"
655,Get This,85757,502924,123000,"[u'Nu Metal', u'metal', u'alternative metal', u'Slipknot', u'death metal', u'rock', u'brutal', u'Nu-metal', u'metalcore', u'alternative', u'thrash metal', u'favorite tracks', u'1999', u'legend', u'WAKE UP AND BURN', u'seen live', u'hardcore', u'emo', u'90s', u'american', u'insane', u'Gothic Metal', u'9 of 10 stars', u'get this', u'agressive', u'heard live', u'new metal', u'wake the fuck up', u'Live recording', u'maggot music', u'corey taylor', u'roadrunner records', u'songs that should be in rock band', u'cr4ke mein Schatz', u'cr4ke', u'cr4key', u'cr4ke ist mein leben', u'cr4ke ich liebe dich', u'machs mir cr4ke', u'mein ein und alles: cr4ke', u'ich liebe dich cr4ke', u'du bist so geil schatz', u'ich will dich du luder', u'nimm sie in den mund', u'du machst mich so geil cr4ke', u'in love with cr4ke', u'ich will ein kind von dir cr4ke', u'cr4ke du bist die beste und geilste', u'mein drogenkind cr4ke', u'fick mich cr4ke']"
656,Scissors,122065,553444,504000,"[u'metal', u'Nu Metal', u'alternative metal', u'Nu-metal', u'heavy metal', u'rock', u'Slipknot', u'hard rock', u'metalcore', u'industrial metal', u'rapcore', u'Favourites', u'1999', u'maggot music', u'songs that rip out my fucking heart', u'nu- metal', u'experimental', u'psychedelic', u'Avant-Garde', u'american', u'thrash metal', u'chaotic', u'Great Lyricists', u'8 of 10 stars', u'evil', u'psychic', u'1990s', u'6 of 10 stars', u'Insanity', u'rage', u'psychodelic', u'hidden track', u'Psychedelic metal', u'5 of 10 stars', u'Depp', u'NU', u'best ever', u'Good intro', u'my favourite songs', u'Songs over 10 minutes long', u'corey taylor', u'Awesome Songs That Are Over 7 Minutes Long', u'Masterpieces of Disasterpieces', u'slipknot - st', u'WHGrupo', u'lol he mad', u'blatant korn rip off', u'k1r7m']"
657,Only One,223511,1027357,146000,"[u'Nu Metal', u'metal', u'Slipknot', u'alternative metal', u'heavy metal', u'Only One', u'rock', u'hard rock', u'Nu-metal', u'rapcore', u'rap metal', u'alternative', u'hardcore', u'death metal', u'favorites', u'american', u'thrash metal', u'industrial metal', u'metalcore', u'alternative rock', u'funk metal', u'Awesome', u'angry', u'RapMetal', u'9 of 10 stars', u'numetal', u'groove metal', u'experimental metal', u'new metal', u'in love', u'maggot music', u'corey taylor', u'aggressive metal', u'nu- metal', u'screamoo', u'Mate Feed Kill Repeat', u'slipknot - only one anders vocals', u'slipknotslipknot', u'my guerilla', u'Hip-Hop', u'seen live', u'Grunge', u'rap', u'experimental', u'C', u'Avant-Garde', u'funky', u'german', u'radiohead', u'great lyrics']"
658,Diluted,150510,807409,203000,"[u'metal', u'Nu Metal', u'alternative metal', u'Slipknot', u'alternative', u'heavy metal', u'rock', u'hard rock', u'Nu-metal', u'maggot music', u'1999', u'seen live', u'Favorite Bands', u'emo', u'dark', u'Avant-Garde', u'modern rock', u'8 of 10 stars', u'despair', u'1990s', u'6 of 10 stars', u'suffering', u'kick ass', u'new metal', u'My Favorites', u'jump da fuck up', u'music to slit your wrists to', u'noise metal', u'corey taylor', u'roadrunner records', u'aggressive metal', u'Head Banging', u'songs that should be in rock band', u'hit maker', u'nu- metal', u'cr4ke mein Schatz', u'cr4ke', u'cr4key', u'cr4ke ist mein leben', u'cr4ke ich liebe dich', u'machs mir cr4ke', u'mein ein und alles: cr4ke', u'ich liebe dich cr4ke', u'du bist so geil schatz', u'ich will dich du luder', u'nimm sie in den mund', u'du machst mich so geil cr4ke', u'in love with cr4ke', u'ich will ein kind von dir cr4ke', u'cr4ke du bist die beste und geilste']"
659,No Life,169436,978532,167000,"[u'Nu Metal', u'metal', u'alternative metal', u'Nu-metal', u'Slipknot', u'heavy metal', u'rock', u'black metal', u'death metal', u'rapcore', u'nu- metal', u'Progressive metal', u'rap metal', u'favorite tracks', u'6 of 10 stars', u'maggot music', u'corey taylor', u'Songs that kill me inside a little more', u'metalcore', u'Awesome', u'90s', u'Avant-Garde', u'american', u'thrash', u'Like', u'Gothic Metal', u'male vocalist', u'underground', u'8 of 10 stars', u'running', u'2012', u'english lyrics', u'1990s', u'1999', u'Wicked', u'kick ass', u'new metal', u'psycho metal', u'american metal', u'noise metal', u'Get A Life', u'slipkont', u'rock and metal', u'deja vu', u'cr4ke mein Schatz', u'cr4ke', u'cr4key', u'cr4ke ist mein leben', u'cr4ke ich liebe dich', u'machs mir cr4ke']"
660,Prosthetics,148593,776405,298000,"[u'metal', u'Nu Metal', u'alternative metal', u'heavy metal', u'Nu-metal', u'rock', u'fantastic', u'sinister', u'Slipknot', u'Awesome', u'thrash metal', u'maggot music', u'songs that rip out my fucking heart', u'Favorite', u'6 of 10 stars', u'goose bumps', u'perfectly haunting', u'heavy', u'grindcore', u'ambient', u'experimental', u'hard rock', u'energy', u'dark', u'industrial', u'atmospheric', u'Avant-Garde', u'american', u'nostalgic', u'death metal', u'intense', u'aggressive', u'great lyrics', u'industrial metal', u'cold', u'best', u'underground', u'drum solo', u'9 of 10 stars', u'perfect', u'2012', u'FUCKING AWESOME', u'powerful', u'1990s', u'Favourite Songs', u'1999', u'new metal', u'fucking great', u'psycho metal', u'iowa metal']"
661,Liberate,202821,1275595,186000,"[u'Nu Metal', u'metal', u'Slipknot', u'alternative metal', u'heavy metal', u'Nu-metal', u'rock', u'american', u'Hard', u'hard rock', u'1999', u'alternative', u'death metal', u'male vocalist', u'8 of 10 stars', u'rap metal', u'maggot music', u'makes my hands and head move', u'metalcore', u'seen live', u'heavy', u'hardcore', u'rap', u'Contemporary', u'90s', u'drums', u'Avant-Garde', u'emotional', u'male vocalists', u'live', u'industrial metal', u'hate', u'Crap', u'Favorite', u'rapcore', u'2005', u'underground', u'drum solo', u'wow', u'perfect', u'ouch', u'2012', u'Love it', u'heard live', u'favorite tracks', u'english lyrics', u'1990s', u'5', u'bananas', u'madness']"
662,Me Inside,118692,620345,159000,"[u'Nu Metal', u'metal', u'alternative metal', u'heavy metal', u'Slipknot', u'Nu-metal', u'metalcore', u'Melodic Death Metal', u'thrash metal', u'death metal', u'hardcore metal', u'alternative', u'Progressive metal', u'american', u'6 of 10 stars', u'1999', u'core', u'neo-metal', u'maggot music', u'corey taylor', u'ich liebe dich cr4ke', u'du bist so geil schatz', u'ich will ein kind von dir cr4ke', u'rock', u'grindcore', u'90s', u'Avant-Garde', u'winter', u'male vocalists', u'8 of 10 stars', u'love this', u'2000s', u'1990s', u'new metal', u'all hope is gone', u'cr4ke mein Schatz', u'cr4ke', u'cr4key', u'cr4ke ist mein leben', u'cr4ke ich liebe dich', u'machs mir cr4ke', u'mein ein und alles: cr4ke', u'ich will dich du luder', u'nimm sie in den mund', u'du machst mich so geil cr4ke', u'in love with cr4ke', u'cr4ke du bist die beste und geilste', u'mein drogenkind cr4ke', u'fick mich cr4ke', u'let me fuck you cr4ke']"
663,Tattered and Torn,108725,461133,174000,"[u'metal', u'Nu Metal', u'Slipknot', u'alternative metal', u'Nu-metal', u'heavy metal', u'psychedelic', u'alternative rock', u'industrial metal', u'seen live', u'metalcore', u'rock', u'favorites', u'psycho', u'sic', u'Tattered and Torn', u'noise', u'grindcore', u'Love', u'dark', u'angry', u'disturbing', u'Avant-Garde', u'funky', u'pop punk', u'death metal', u'Favorite', u'Favourites', u'Love it', u'4 of 10 stars', u'fucking amazing', u'deathgrind', u'Masks', u'vegetarian progressive grindcore', u'zajebiste', u'Slip', u'maggot music', u'roadrunner records', u'Songs that totaly rule', u'chop', u'barbar tag', u'cr4ke mein Schatz', u'cr4ke', u'cr4key', u'cr4ke ist mein leben', u'cr4ke ich liebe dich', u'machs mir cr4ke', u'mein ein und alles: cr4ke', u'ich liebe dich cr4ke', u'du bist so geil schatz']"
664,Spit It Out,336038,2426795,159000,"[u'Nu Metal', u'metal', u'Slipknot', u'heavy metal', u'alternative metal', u'Nu-metal', u'rapcore', u'metalcore', u'rock', u'rap metal', u'hard rock', u'hardcore', u'Spit It Out', u'alternative', u'fast', u'corey taylor', u'seen live', u'favorites', u'Hard', u'heavy', u'american', u'thrash metal', u'trash metal', u'maggots we are', u'nu- metal', u'Awesome', u'death metal', u'1990s', u'1999', u'kick ass', u'666', u'maggot music', u'Favorite', u'roadrunner records', u'deserves to be played loud', u'emo', u'memories', u'90s', u'iowa', u'best', u'10 of 10 stars', u'songs that you wanna listen to over and over again', u'Great Shit', u'all hope is gone', u'Some Damn Good Music', u'motherfucking rage', u'Jump The Fuck Up', u'music to break things to', u'Disco', u'Hip-Hop']"
665,Surfacing,268725,1849238,218000,"[u'Nu Metal', u'metal', u'alternative metal', u'Slipknot', u'heavy metal', u'Nu-metal', u'hard rock', u'thrash metal', u'alternative', u'metalcore', u'Melodic Death Metal', u'seen live', u'rock', u'experimental', u'aggressive', u'fuck it all', u'hardcore', u'Awesome', u'fuck yeah', u'90s', u'angry', u'heard on Pandora', u'Favorite', u'1999', u'hardcore metal', u'i hate you', u'maggot music', u'metal kurwa moc dziwko', u'heavy', u'emo', u'favorites', u'drums', u'Avant-Garde', u'american', u'groovy', u'male vocalist', u'great lyrics', u'fav', u'underground', u'Extreme Metal', u'8 of 10 stars', u'2012', u'awful', u'FUCKING AWESOME', u'fuck', u'heard live', u'english lyrics', u'lame', u'1990s', u'10 of 10 stars']"
666,Wait and Bleed,775785,5662151,147000,"[u'metal', u'Nu Metal', u'Slipknot', u'heavy metal', u'rock', u'alternative metal', u'Nu-metal', u'hard rock', u'hardcore', u'alternative', u'metalcore', u'death metal', u'angry', u'aggressive', u'FUCKING AWESOME', u'Slipknot - Wait and Bleed', u'thrash metal', u'Wait and Bleed', u'heavy', u'Awesome', u'alternative rock', u'american', u'rapcore', u'maggot music', u'corey taylor', u'favorite songs', u'1999', u'seen live', u'punk', u'favorites', u'groove metal', u'bleed', u'wait', u'dark', u'new metal', u'Soundtrack', u'rap metal', u'radioultra', u'Grunge', u'emo', u'industrial', u'cool', u'I love this song', u'powerful', u'favourite vocalists', u'fucking good', u'sufu5a']"
667,Eyeless,262618,1867687,236000,"[u'Nu Metal', u'metal', u'alternative metal', u'Slipknot', u'Nu-metal', u'heavy metal', u'metalcore', u'rock', u'angry', u'hard rock', u'hardcore', u'FUCKING AWESOME', u'maggot music', u'corey taylor', u'heavy', u'thrash metal', u'favorites', u'Awesome', u'screamo', u'amazing', u'favorite tracks', u'shit metal', u'neo-metal', u'you cant see california without marlon brandos eyes', u'eyeless', u'seen live', u'power', u'drums', u""drum'n'bass"", u'great lyrics', u'10 of 10 stars', u'hateful', u'all hope is gone', u'so fucking goddamn awesome', u'alternative', u'experimental', u'RIP', u'Melodic Death Metal', u'Driving', u'Avant-Garde', u'american', u'great', u'good shit', u'California', u'emotional', u'melancholic', u'f', u'great song', u'groovy', u'High School']"
668,(Sic),240397,1661240,232000,"[u'Nu Metal', u'metal', u'alternative metal', u'Slipknot', u'Nu-metal', u'heavy metal', u'hardcore', u'aggressive', u'rock', u'metalcore', u'FUCKING AWESOME', u'death metal', u'seen live', u'hardcore metal', u'angry', u'thrash metal', u'best played loud', u'maggot music', u'heavy', u'hard rock', u'Awesome', u'Melodic Death Metal', u'screamo', u'sick', u'psychodelic', u'heavy as fuck', u'sic', u'corey taylor', u'you cant kill me cause im already inside you', u'my kids will listen to', u'favourite', u'Favorite', u'favorite tracks', u'singalong', u'1999', u'groove metal', u'makes me want to dance', u'hardrock', u'I love', u'songs that you wanna listen to over and over again', u'fucking good', u'agressive metal', u'children of the korn', u'Agresive metal', u'alternative rock', u'brutal', u'rap', u'favorites', u'industrial', u'Avant-Garde']"
669,742617000027,144047,782833,152000,"[u'Nu Metal', u'metal', u'heavy metal', u'alternative metal', u'Nu-metal', u'Slipknot', u'intro', u'rock', u'hardcore', u'experimental', u'thrash metal', u'under a minute', u'punk', u'industrial', u'maggot music', u'classic rock', u'instrumental', u'emo', u'1999', u'psychodelic', u'sample heavy', u'original thought', u'cr4ke mein Schatz', u'cr4ke', u'cr4key', u'cr4ke ist mein leben', u'cr4ke ich liebe dich', u'machs mir cr4ke', u'mein ein und alles: cr4ke', u'ich liebe dich cr4ke', u'du bist so geil schatz', u'ich will dich du luder', u'nimm sie in den mund', u'du machst mich so geil cr4ke', u'in love with cr4ke', u'ich will ein kind von dir cr4ke', u'cr4ke du bist die beste und geilste', u'mein drogenkind cr4ke', u'fick mich cr4ke', u'let me fuck you cr4ke', u'du bist mein schatz', u'fuck me cr4ke', u'ohne dich bin ich nichts', u'i love you cr4ke', u'Nu Neo Metal', u'seen live', u'psychedelic', u'Avant-Garde', u'american', u'underground']"
670,Killers Are Quiet,47066,145787,616000,"[u'Nu Metal', u'Slipknot', u'metal', u'alternative metal', u'Nu-metal', u'heavy metal', u'hard rock', u'death', u'death metal', u'black metal', u'seen live', u'Grunge', u'doom metal', u'pop rock', u'favorites', u'dark', u'psychedelic', u'brazil', u'crazy', u'angry', u'Doom', u'Sludge', u'drone', u'thrash', u'brasil', u'old school', u'brazilian', u'loved', u'Power metal', u'zombie', u'pimp', u'My Favorites', u'my life', u'rap-metal', u'brazilian metal', u'Fuckin AWESOME', u'pi', u'shit metal', u'Indies', u'maggot music', u'Dark Music', u'dth', u'Mendigao thrash', u'Adding heavy songs', u'p4n1c0', u'susie7', u'from hell s', u'sslow', u'Purpletag', u'metallia']"
671,Some Feel,57117,173470,220000,"[u'metal', u'Nu Metal', u'Slipknot', u'heavy metal', u'hard rock', u'wtf', u'rock', u'Awesome', u'alternative metal', u'Nu-metal', u'some feel', u'metalcore', u'funky', u'crossover', u'new metal', u'the best', u'maggot music', u'corey taylor', u'daves', u'fluzao', u'p4n1c0', u'Mate Feed Kill Repeat', u'rocck', u'mfkr', u'slipk', u'SLP']"
