,Songs,Listeners,Playcount,Duration,Tags
705,Blood Hunger Doctrine,71517,397924,279000,"[u'black metal', u'Symphonic Black Metal', u'melodic black metal', u'metal', u'Norwegian Black Metal', u'symphonic metal', u'Dark metal', u'epic', u'norwegian', u'blood', u'atmospheric death metal', u'dimmu borgir', u'emo', u'Melodic Death Metal', u'orchestral', u'atmospheric', u'dramatic', u'Norway', u'melodic metal', u'hunger', u'scandinavian metal', u'weird vocals', u'shagrath', u'blood hunger doctrine', u'mgtsunwelletc', u'heavy metal', u'electronic', u'punk', u'heavy', u'RIP', u'dark', u'melodic', u'2003', u'guitar', u'bass', u'drums', u'death', u'My', u'death metal', u'Gothic Metal', u'00s', u'Extreme Metal', u'synthesizers', u'Black', u'english lyrics', u'7 of 10 stars', u'10 of 10 stars', u'norwegian artist', u'lulz', u'Bra']"
706,Blood Hunger Doctrine,71517,397924,279000,"[u'black metal', u'Symphonic Black Metal', u'melodic black metal', u'metal', u'Norwegian Black Metal', u'symphonic metal', u'Dark metal', u'epic', u'norwegian', u'blood', u'atmospheric death metal', u'dimmu borgir', u'emo', u'Melodic Death Metal', u'orchestral', u'atmospheric', u'dramatic', u'Norway', u'melodic metal', u'hunger', u'scandinavian metal', u'weird vocals', u'shagrath', u'blood hunger doctrine', u'mgtsunwelletc', u'heavy metal', u'electronic', u'punk', u'heavy', u'RIP', u'dark', u'melodic', u'2003', u'guitar', u'bass', u'drums', u'death', u'My', u'death metal', u'Gothic Metal', u'00s', u'Extreme Metal', u'synthesizers', u'Black', u'english lyrics', u'7 of 10 stars', u'10 of 10 stars', u'norwegian artist', u'lulz', u'Bra']"
707,Blood Hunger Doctrine,71517,397924,279000,"[u'black metal', u'Symphonic Black Metal', u'melodic black metal', u'metal', u'Norwegian Black Metal', u'symphonic metal', u'Dark metal', u'epic', u'norwegian', u'blood', u'atmospheric death metal', u'dimmu borgir', u'emo', u'Melodic Death Metal', u'orchestral', u'atmospheric', u'dramatic', u'Norway', u'melodic metal', u'hunger', u'scandinavian metal', u'weird vocals', u'shagrath', u'blood hunger doctrine', u'mgtsunwelletc', u'heavy metal', u'electronic', u'punk', u'heavy', u'RIP', u'dark', u'melodic', u'2003', u'guitar', u'bass', u'drums', u'death', u'My', u'death metal', u'Gothic Metal', u'00s', u'Extreme Metal', u'synthesizers', u'Black', u'english lyrics', u'7 of 10 stars', u'10 of 10 stars', u'norwegian artist', u'lulz', u'Bra']"
708,Grom,21065,97334,328000,"[u'black metal', u'Behemoth', u'death metal', u'metal', u'polish', u'black death metal', u'pagan black metal', u'polish black metal', u'pagan metal', u'Blackened Death Metal', u'melodic black metal', u'polish death metal', u'kvlt', u'satanic black metal', u'black death', u'grom', u'Pagan', u'FUCKING AWESOME', u'ugh', u'Amazing song', u'Black and Death Metal', u'Venom Cover', u'simple the best', u'good3', u'cos', u'slav proud', u'nekroasfak', u'sxf13', u'Behemoth Gorm']"
709,Drawn to Black,47045,417634,360000,"[u'Melodic Death Metal', u'death metal', u'metal', u'finnish metal', u'FUCKING AWESOME', u'doom metal', u'finnish', u'melodeath', u'seen live', u'epic', u'beautiful', u'melancholic', u'5 Stars', u'Masterpiece', u'amazing beyond all reason', u'favorites', u'gentle', u'6 of 10 stars', u'Favourite Songs', u'finland', u'kickass', u'9 lbs hammer', u'Sentenced', u'melodic black', u'Kalmah', u'winter nights', u'melodic-death-metal', u'awesome as fuck', u'Insomnium', u'Metawesomeness', u'the best music i ever listened to', u'fuck this is what metal is made of', u'Extreme kill people melodic death metal']"
710,Channelling the Power of Souls Into a New God,45237,221012,226000,"[u'black metal', u'dark ambient', u'ambient', u'ambient black metal', u'metal', u'True Norwegian Black Metal', u'Norway', u'Norwegian Black Metal', u'interlude', u'electronic', u'dark', u'Black', u'pagan metal', u'non commercial metal', u'90s', u'atmospheric', u'1', u'hypnotic', u'meditative', u'sadness', u'blacker than the blackest black times infinity', u'atmospheric black metal', u'pagan black metal', u'Burzum', u'Space Ambient', u'true black metal', u'old school black metal', u'space drifting', u'second wave black metal', u'chilling out in the extreme', u'OH JESUS WERE ALL GOING TO DIE', u'Shit to trip out on']"
711,23 (The Youth Manifesto),29475,146809,235000,"[u'death metal', u'black metal', u'metal', u'Blackened Death Metal', u'polish', u'Extreme Metal', u'Brutal Death Metal', u'Favourites', u'Behemoth', u'seen live', u'sexy', u'Melodic Death Metal', u'death', u'I Like It', u'youth', u'7 of 10 stars', u'6 of 10 stars', u'23', u'Amazing song', u'polish death metal', u'polish metal', u'polish black metal', u'manifesto', u'garten metal', u'BLASTY KURWA', u'my very favourite', u'trallalametal', u'melodic death metal with balls', u'youth metal']"
712,Seven Harmonies of Unknown Truth,897,3003,185000,"[u'black metal', u'black ambient']"
713,Ideomotor,12937,86199,487000,"[u'Melodic Death Metal', u'metal', u'metalcore', u'heavy metal', u'Female fronted metal', u'female vocalists', u'9 of 10 stars', u'Eargasm', u'10 of 10 stars', u'awesomeness', u'great outro', u'amazing guitar solo', u'Epic Showcase of musicianship', u'porra', u'caralho', u'i cant hear you over the sound of how awesome this is', u'takiej solowki to dawno nie slyszalem', u'one of the best songs on the new album', u'Alissa White-Gluz', u'esti ginzburg', u'mathilde hubert', u'chloe saive', u'puma swede', u'ai meu core', u'alissa sua linda te amo mano', u'iscrimo porra']"
714,On Stirring Seas of Salted Blood,23963,164705,282000,"[u'Melodic Death Metal', u'death metal', u'metal', u'7 of 10 stars']"
715,Be Without Fear,63275,444784,197000,"[u'death metal', u'Blackened Death Metal', u'black metal', u'metal', u'polish', u'black death metal', u'polish metal', u'Behemoth', u'Brutal Death Metal', u'polish death metal', u'666', u'Killer', u'aggressive', u'polish black metal', u'Black and Death Metal', u'The Apostasy', u'be without fear', u'seen live', u'8 of 10 stars', u'I love this song', u'kick ass', u'heavy as fuck', u'zuo', u'absolute evil', u'start a mosh pit', u'fckn awesome wave of progressive and other kinds of metal', u'rzniecie dupki', u'chh', u'hard fuck', u'niech sasiedzi cierpia']"
716,Dominuus Sathans,44737,212302,184000,"[u'black metal', u'ambient black metal', u'dark ambient', u'Burzum', u'True Norwegian Black Metal', u'metal', u'norwegian', u'Norwegian Black Metal', u'atmospheric black metal', u'Norway', u'Suicidal Black Metal', u'ambient', u'satan', u'depressive black metal', u'true black metal', u'instrumental', u'Crap', u'Black', u'pagan metal', u'fantasy', u'instrumetal', u'Atmospheric metal', u'pagan black metal', u'white metal', u'black doom', u'tr00', u'Black and Death Metal', u'heavy funk', u'false black metal', u'False Norwegian Black Metal', u'Unholy Black Metal', u'second wave black metal', u'norsk svart metal', u'Dominus Sathanas']"
717,Halo of Flies,2794,13456,314000,"[u'doom metal', u'brilliant', u'Death Doom Metal', u'Gothic Doom Metal', u'Atmospheric Gothic Metal']"
718,Weighed Down With Sorrow,32026,277417,351000,"[u'Melodic Death Metal', u'metal', u'beautiful', u'death metal', u'doom metal', u'fucking hopeless', u'seen live', u'sad', u'epic', u'Awesome', u'melodic', u'death', u'finnish', u'6 of 10 stars', u'motivate', u'9 lbs hammer', u'death/doom', u'awesome riff', u'amazing beyond all reason', u'awesome melody', u'everything reminds me of you', u'favourite riffs', u'gman2k04']"
719,Behind The Mask,13079,55309,238000,"[u'melodic black metal', u'black metal', u'norwegian', u'Norway', u'norwegian metal', u'Symphonic Black Metal', u'Norwegian Black Metal', u'6666', u'Angels Metal Zone']"
720,Dunkelheit,1091,3866,389000,[u'life has new meaning']
721,Cosmic Seas,707,1996,263000,[u'winter']
722,Turn the Sign of the Microcosm (Snu Mikrokosmos' Tegn),7424,24494,590000,"[u'black metal', u'dark ambient', u'norsk svart metal']"
723,All My Best Friends Are Bullets,12732,57973,63000,"[u'Melodic Death Metal', u'death metal', u'deathcore']"
724,Illa Tithandi,591,3171,0,[]
725,Map of Scars,11253,63157,319000,"[u'Melodic Death Metal', u'death metal', u'metalcore', u'metal', u'death', u'8 of 10 stars', u'melodic metal', u'deathcore', u'melodic black metal']"
726,Raabjrn Speiler Draugheimens Skodde [Re-recorded],3070,9980,0,[]
727,Beholding the Daughters of the Firmament,814,2751,472000,"[u'burzum cover', u'life has new meaning']"
728,Life Deprived,17498,68886,289000,"[u'black metal', u'Symphonic Black Metal', u'melodic black metal', u'metal', u'loved', u'heard on Pandora', u'Norwegian Black Metal', u'i will eat your soul', u'Old Mans Child', u'Christians crushing enemies', u'Life Deprived', u'death metal', u'melodic metal', u'marvelous', u'Garm', u'good songs', u'dbpower', u'Meidor']"
729,In Black Endless Void,11468,41802,266000,"[u'black metal', u'melodic black metal', u'metal', u'Symphonic Black Metal', u'satan', u'music that gets me my dick hard', u'Old Mans Child', u'sound of the gods', u'tro bon']"
730,Song Of the Forlorn Son,27360,176095,345000,"[u'Melodic Death Metal', u'death metal', u'metal', u'fuckin best death metal ever', u'seen live', u'epic', u'beautiful', u'atmospheric', u'finnish', u'finnish metal', u'Ballad', u'8 of 10 stars', u'Black', u'Masterpiece', u'awesome vocals', u'9 lbs hammer', u'One of the best songs ever', u'kalevala', u'northern metal', u'sympho black', u'extremely awesome', u'Fucking Heavy', u'pretty fucking badass']"
731,Martyr Art,31807,216824,271000,"[u'Melodic Death Metal', u'metalcore', u'Female fronted metal', u'metal', u'female vocalists', u'female vocals', u'death metal', u'female growl', u'albums I own', u'canadian metal', u'melodeath', u'great solos', u'female fronted metalcore', u'The Agonist', u'pornfucking']"
732,Lost Wisdom,82165,617568,279000,"[u'black metal', u'Norwegian Black Metal', u'ambient black metal', u'metal', u'True Norwegian Black Metal', u'Burzum', u'atmospheric black metal', u'dark ambient', u'true black metal', u'ambient', u'norwegian', u'atmospheric', u'depressive black metal', u'Pagan', u'FUCKING AWESOME', u'Norway', u'pagan metal', u'nsbm', u'suicidal', u'heavy metal', u'doom metal', u'viking metal', u'death metal', u'christian', u'relaxing', u'Favourites', u'grim', u'Ritual', u'depressive', u'old school black metal', u'Varg Vikernes', u'magia', u'Varg', u'melancholic sounds', u'awesome lyric', u'AGRRRHHH', u'LOTR METAL BURZUM BLACKENED METAL', u'burzum aya', u'Hip-Hop', u'rock', u'folk', u'favorites', u'industrial', u'easy listening', u'Awesome', u'thrash metal', u'thrash', u'emotional', u'neofolk', u'dark folk']"
733,Halflight,2568,9517,298000,[u'Symphonic Black Metal']
734,Lost Wisdom,82165,617568,279000,"[u'black metal', u'Norwegian Black Metal', u'ambient black metal', u'metal', u'True Norwegian Black Metal', u'Burzum', u'atmospheric black metal', u'dark ambient', u'true black metal', u'ambient', u'norwegian', u'atmospheric', u'depressive black metal', u'Pagan', u'FUCKING AWESOME', u'Norway', u'pagan metal', u'nsbm', u'suicidal', u'heavy metal', u'doom metal', u'viking metal', u'death metal', u'christian', u'relaxing', u'Favourites', u'grim', u'Ritual', u'depressive', u'old school black metal', u'Varg Vikernes', u'magia', u'Varg', u'melancholic sounds', u'awesome lyric', u'AGRRRHHH', u'LOTR METAL BURZUM BLACKENED METAL', u'burzum aya', u'Hip-Hop', u'rock', u'folk', u'favorites', u'industrial', u'easy listening', u'Awesome', u'thrash metal', u'thrash', u'emotional', u'neofolk', u'dark folk']"
735,The Prolonging,15120,71676,1162000,"[u'doom metal', u'metal', u'black metal', u'Dark metal', u'crushing', u'Consistent Dodo Radio - Flittering', u'thrash metal', u'heavy metal', u'heavy', u'epic', u'Gothic Metal', u'2010', u'best of 2010', u'10 of 10 stars', u'progressive doom metal', u'heavy as fuck', u'Gothic Doom Metal', u'riffage', u'Type O Negative', u'black Thrash metal', u'Songs over 10 minutes long', u'crybbage power', u'over 15 minutes', u'consistent dodo radio-flittering', u'Doomed Doom Metal', u'sick guitar tone']"
736,Typhonian Soul Zodiak,1298,4393,0,[u'death metal']
737,Elder Misanthropy,54228,380499,154000,"[u'Melodic Death Metal', u'deathcore', u'death metal', u'metalcore', u'metal', u'Awesome', u'kickass', u'puro deathmetal', u'heavy metal', u'hardcore', u'thrash', u'great', u'great song', u'aggressive metal', u'speed metal', u'loved', u'post-hardcore', u'8 of 10 stars', u'trash metal', u'trancecore', u'Headbang', u'electronic post-hardcore', u'great guitarwork', u'will likely cause your brain to implode and then leak out through your nose', u'deat metal', u'Makes me want to kill things', u'Potkii perseelle']"
738,Et hvitt lys over skogen,14412,73396,544000,"[u'black metal', u'Norwegian Black Metal', u'ambient black metal', u'norwegian', u'metal', u'true black metal', u'pagan metal', u'nsbm', u'True Norwegian Black Metal', u'ambient', u'dark', u'industrial', u'viking metal', u'Norway', u'black ambient', u'depressive black metal', u'DSBM', u'Burzum', u'black metal ist krieg', u'kvlt', u'norsk metal', u'Second Wave of Black Metal', u'pretty cool stuff', u'dupa szatana', u'better than alcest', u'kvlt kurwa']"
739,Ephemeral,24876,235255,241000,"[u'Melodic Death Metal', u'metal', u'death metal', u'finnish', u'finnish metal', u'seen live', u'folk metal', u'7 of 10 stars', u'Perfect song', u'Sentenced', u'if this were a pokemon i would catch it', u'Kalmah', u'winter nights', u'DT plz']"
740,Tomhet Essay,371,732,0,[u'dark ambient']
741,Christ Deformed,31160,243496,210000,"[u'death metal', u'Melodic Death Metal', u'deathcore', u'metal', u'Technical Death Metal', u'The Black Dahlia Murder', u'christian', u'8 of 10 stars', u'Blackened Death Metal', u'Blasphemy', u'aggressive depression', u'end all the pain', u'massive assault', u'death/black metal', u'i cant hear you over the sound of how awesome this is']"
742,Hermor  Helfer,31180,164213,161000,"[u'dark ambient', u'ambient', u'songs to sleep to', u'black metal', u'electronic', u'Norway', u'loneliness', u'dungeon synth', u'feel good', u'floating', u'minimalism', u'Favourite Songs', u'gloomy', u'atmospheric black metal', u'Moonmusick']"
743,Ceremony Of Shiva,46708,241123,212000,"[u'death metal', u'black metal', u'Blackened Death Metal', u'Behemoth', u'polish', u'metal', u'black death metal', u'Ceremony Of Shiva', u'6 of 10 stars', u'at home', u'polish death metal', u'polish black metal', u'Death Black Metal', u'Progressive metal', u'melodic', u'Melodic Death Metal', u'drums', u'death', u'Progressive', u'symphonic', u'Technical Death Metal', u'FUCKING AWESOME', u'Brutal Death Metal', u'ugh', u'black/death metal', u'nile', u'shiva', u'polish metal', u'promising', u'garten metal', u'Black and Death Metal', u'nice drumming', u'behemoth - ceremoney of shiva', u'New Age Death Metal', u'good riff', u'good4', u'yuppers', u'hjhjhj', u'sxf13', u'rozpiernicz :D', u'behemoth the best', u'infectious death']"
744,Conquer All,110348,974136,231000,"[u'death metal', u'Blackened Death Metal', u'black metal', u'metal', u'polish', u'Brutal Death Metal', u'polish death metal', u'Technical Death Metal', u'Behemoth', u'black death metal', u'poland', u'Black-Death Metal', u'Makes me want to kill things', u'seen live', u'FUCKING AWESOME', u'polish metal', u'brutal', u'sexy', u'Melodic Death Metal', u'death', u'rock band', u'satan', u'Norwegian Black Metal', u'rock band dlc', u'polish black metal', u'holy fucking shit this is kick ass', u'New Age Death Metal', u'I have a headache from headbanging and its GOOD', u'total rozpierdalacz']"
745,Of Sephirotic Transformation and Carnality,28722,122953,270000,"[u'death metal', u'Blackened Death Metal', u'black metal', u'metal', u'polish', u'black death metal', u'polish black metal', u'polish death metal', u'Behemoth', u'Melodic Death Metal', u'heard on Pandora', u'6 of 10 stars', u'Favourite Band', u'good3', u'of sephirotic transformation and carnality']"
746,At the Left Hand Ov God,83252,708587,313000,"[u'death metal', u'Blackened Death Metal', u'black metal', u'polish', u'metal', u'black death metal', u'Behemoth', u'polish metal', u'Masterpiece', u'brutal', u'Technical Death Metal', u'seen live', u'epic', u'satanic', u'Brutal Death Metal', u'666', u'I would play this song while i am deflowering a young nun', u'songs I can listen to 100 times in a row without getting sick of them', u'heavy metal', u'Melodic Death Metal', u'Pagan', u'Favorite', u'war metal', u'evil', u'satan', u'polish death metal', u'magnificent', u'music that gets me my dick hard', u'approved by the pope', u'time to start windmilling', u'Behemoth black metal', u'Great polish metal', u'solo', u'favourite', u'symphonic', u'hate', u'symphonic metal', u'8 of 10 stars', u'Perfection', u'pagan metal', u'deathcore', u'legend', u'polish black metal', u'prepare a skin graft from my ass because this song just melted my face off', u'god I love this song', u'satanic black metal', u'aliens 25 million light years away are headbanging to this shit', u'pure energy', u'br00tal', u'sick drumming']"
747,Ephemeral,24876,235255,241000,"[u'Melodic Death Metal', u'metal', u'death metal', u'finnish', u'finnish metal', u'seen live', u'folk metal', u'7 of 10 stars', u'Perfect song', u'Sentenced', u'if this were a pokemon i would catch it', u'Kalmah', u'winter nights', u'DT plz']"
748,Tomhet,636,2635,611000,"[u'black metal', u'cover', u'Atmospheric metal', u'Burzum', u'a Tribute to Burzum']"
749,Odejd w dniu gdy dwik zamilknie...,708,2340,309000,[]
750,Sacred Ice and Bloody Tears (1993),606,2068,200000,[]
751,And Their Eulogies Sang Me to Sleep,24232,226422,0,"[u'Melodic Death Metal', u'metalcore', u'Female fronted metal', u'death metal', u'metal', u'female scream', u'hardcore', u'female vocalists', u'epic', u'female vocals', u'deathcore', u'female', u'insane', u'female vocalist', u'breakdown', u'canadian metal', u'Some serious fucking riffage going on here', u'female growl', u'female fronted metalcore', u'szatan jest wielki wiec w gore podniesmy butelki', u'guitar that makes the room spin with awesome', u'rowling', u'Female screamer', u'just fucking incredible', u'How fucking great can a band be', u'EXTREME METAL GIRLS', u'metalmittwoch']"
752,Hit helga Tr,17840,72492,407000,"[u'black metal', u'atmospheric black metal', u'metal']"
753,Lovesong,788478,5631799,204000,"[u'80s', u'new wave', u'alternative', u'post-punk', u'rock', u'The Cure', u'Love', u'alternative rock', u'british', u'pop', u'favorites', u'Gothic', u'goth', u'love songs', u'beautiful', u'Gothic Rock', u'melancholy', u'classic rock', u'indie', u'Cure', u'sad', u'lovesong', u'darkwave', u'1989', u'love song', u'memories', u'melancholic', u'Favourites', u'electronic', u'seen live', u'dark', u'Mellow', u'chill', u'acoustic', u'britpop', u'Awesome', u'90s', u'chillout', u'Post punk', u""80's"", u'lovely', u'QaF', u'goth rock', u'Reasons why I love the Cure', u'queer as folk', u'favorite songs', u'UK', u'romantic', u'loved', u'male vocalists']"
754,Das Modell,88967,603483,284000,"[u'industrial metal', u'metal', u'industrial', u'cover', u'german', u'Rammstein', u'rock', u'deutsch', u'kraftwerk', u'covers', u'Neue Deutsche Haerte', u'90s', u'germany', u'neue deutsche h\xe4rte', u'electronica', u'German metal', u'kraftwerk cover', u'hard rock', u'favorites', u'Awesome', u'industrial rock', u'1997', u'NDH', u'covers as good as the originals or even better', u'alternative', u'bounce', u'2007', u'sex', u'Tribute', u'Favourites', u'8 of 10 stars', u'great cover', u'tanz-metall', u'dance metal', u'Amazing songs', u'kraftwerk covers', u'angry german music', u'ich liebe es', u'heavy metal', u'electronic', u'alternative rock', u'sexy', u'dance', u'Love', u'genius', u'party', u'favourite', u'loved', u'male vocalists', u'Europe']"
755,Pussy - RMX by Scooter,4763,12601,0,[u'remix']
756,Hilf mir,196520,1327691,284000,"[u'industrial metal', u'metal', u'industrial', u'Rammstein', u'german', u'rock', u'deutsch', u'hard rock', u'Neue Deutsche Haerte', u'industrial rock', u'heavy metal', u'tanz metal', u'tanz-metall', u'epic', u'German metal', u'electronic', u'germany', u'Hilf Mir', u'Rosenrot', u'Favourites', u'Nu Metal', u'Dark metal', u'aggression', u'dance metal', u'german rock', u'Gothic', u'Awesome', u'aggressive', u'Musik', u'7 of 10 stars', u'10 of 10 stars', u'seen live', u'alternative', u'sexy', u'favorites', u'energy', u'Love', u'dark', u'help', u'beauty', u'winter', u'Sleep', u'Deutschrock', u'male vocalists', u'00s', u'cold', u'4', u'9 of 10 stars', u'best lyrics', u'childhood']"
757,Haifisch,191809,1906213,222000,"[u'industrial metal', u'industrial', u'german', u'rock', u'Rammstein', u'heavy metal', u'metal', u'neue deutsche h\xe4rte', u'deutsch', u'Awesome', u'Neue Deutsche Haerte', u'hard rock', u'germany', u'00s', u'seen live', u'epic', u'Tanzmetal', u'2009', u'2000s', u'10 of 10 stars', u'christian alexander tietgen', u'10s', u'6 of 10 stars', u'NDH', u'dance metal', u'you tell em flake', u'liebe ist fur alle da', u'Liebe ist fuer alle da', u'alternative', u'alternative rock', u'favorites', u'memories', u'summer', u'industrial rock', u'christian', u'ebm', u'Favourites', u'wow', u'8 of 10 stars', u'perfect', u'crying', u'essentials', u'heard live', u'7 of 10 stars', u'german lyrics', u'<3', u'anthem', u'fall', u'Tears', u'Richard']"
758,Der Meister,193576,1221391,248000,"[u'industrial metal', u'industrial', u'metal', u'german', u'Rammstein', u'rock', u'deutsch', u'Neue Deutsche Haerte', u'industrial rock', u'hard rock', u'neue deutsche h\xe4rte', u'tanz-metal', u'germany', u'tanz-metall', u'NDH', u'seen live', u'alternative', u'7 of 10 stars', u'10 of 10 stars', u'6 of 10 stars', u'German metal', u'tanz metal', u'german rock', u'christian alexander tietgen', u'heavy metal', u'electronic', u'alternative rock', u'Hard', u'favorites', u'power', u'Love', u'epic', u'Gothic', u'Awesome', u'guitar', u'Driving', u'great', u'alternative metal', u'Deutschrock', u'dark electro', u'aggressive', u'Favourites', u'drugs', u'Musik', u'evil', u'work', u'BDSM', u'essentials', u'yummy', u'Racing Music']"
759,Jeder lacht,3260,19914,215000,"[u'industrial metal', u'aggressive', u'Rammstein', u'tanz-metall']"
760,Frhling in Paris,161286,1510412,285000,"[u'industrial metal', u'german', u'Rammstein', u'metal', u'neue deutsche h\xe4rte', u'deutsch', u'rock', u'heavy metal', u'industrial', u'seen live', u'germany', u'beautiful', u'melancholy', u'00s', u'paris', u'Neue Deutsche Haerte', u'Love it', u'tanz metal', u'Tanzmetal', u'liebe ist fur alle da', u'christian alexander tietgen', u'2009', u'Love', u'Gothic', u'beauty', u'Ballad', u'8 of 10 stars', u'pure bliss', u'Metal Ballade', u'je ne regrette rien', u'chillout', u'hard rock', u'favorites', u'calm', u'epic', u'Awesome', u'Favorite Artists', u'love at first listen', u'FUCKING AWESOME', u'essentials', u'edith piaf', u'6 of 10 stars', u'german lyrics', u'fall', u'Failure', u'sound storm', u'Erotic', u'Favourite Band', u'geil', u'5 of 10 stars']"
761,Scar Trek / Parasite God,2575,17659,362000,"[u'industrial', u'darkwave', u'chillout', u'ambient', u'industrial rock', u'dark ambient', u'industrial metal', u'Zaebis']"
762,Disintegration,227902,1391874,498000,"[u'new wave', u'post-punk', u'80s', u'alternative', u'The Cure', u'rock', u'alternative rock', u'Gothic Rock', u'goth', u'darkwave', u'Gothic', u'british', u'sad', u'dark', u'beautiful', u'Masterpiece', u'melancholy', u'favorites', u'Favourites', u'Reasons why I love the Cure', u'indie', u'epic', u'dark wave', u'1989', u'seen live', u'Love', u'best of the cure', u'pop', u'melancholic', u'Incredible', u'Cure', u'disintegration', u'Perfection', u'british i like', u'songs I fucking love to death', u'amayzes loved', u'The 80s was not a dead decade', u'amazing', u'Bittersweet', u'all time favorites', u'FREAKING BRILLIANT', u'heart-wrenching', u'chillout', u'chill', u'atmospheric', u'World Music', u'male vocalists', u'great lyrics', u""80's"", u'Favorite']"
763,The Big Hand,15897,64069,291000,"[u'rock', u'post-punk', u'new wave', u'british', u'The Cure', u'pop', u'alternative', u'amazing b-sides', u'best of the cure', u'80s', u'alternative rock', u'goth', u'sad', u'dark', u'Druggy', u'Gothic', u'beautiful', u'2004', u'Dreamy', u'england', u'haunting', u'dream pop', u'winter', u'Gothic Rock', u'heartbreak', u'rock ballad', u'1992', u'magic', u'anatomy', u'warmth', u'The', u'cry', u'rain coat', u'orange label chlorine dreams', u'bujamsie', u'nowa fala', u'Austin Loved Tracks', u'-3', u'play out', u'reminds me of the cure', u'Flip sides', u'to learn and play', u'himmlisch', u'Night Pop', u'the best of the cure', u'the big hand']"
764,Pistol Whipped,49660,251766,250000,"[u'industrial metal', u'industrial rock', u'metal', u'industrial', u'alternative rock', u'3 stars', u'marilyn manson', u'sexy', u'sex', u'male vocalist', u'8 of 10 stars', u'spring', u'10s', u'rage', u'NOT METAL', u'metal industrial', u'orgasm', u'perversion', u'seen performed live', u'immer 3mal mehr herzchen lieder', u'leckerschmecker']"
765,Slutgarden,119749,701950,246000,"[u'industrial metal', u'industrial', u'metal', u'rock', u'industrial rock', u'marilyn manson', u'alternative metal', u'alternative rock', u'hard rock', u'Gothic', u'Shock Rock', u'Slutgarden', u'favourite', u'heavy metal', u'seen live', u'alternative', u'american', u'sleazy', u'Favourites', u'6 of 10 stars', u'Rock on', u'obsessed', u'the meaning of this is grand', u'future husbandlover', u'nu jazz', u'punk', u'Grunge', u'heavy', u'Progressive metal', u'USA', u'ska', u'xxx', u'Gothic Metal', u'sex', u'great lyrics', u'00s', u'spring', u'porn', u'electro industrial', u'3 stars', u'darkness', u'essentials', u'10 of 10 stars', u'Nu-metal', u'music to fuck to', u'religion', u'nothing', u'sleaze', u'Addictions', u'baby daddy']"
