,Songs,Listeners,Playcount,Duration,Tags
75,Under,38554,108295,258000,"[u'industrial', u'rock', u'metal', u'hard rock', u'90s', u'industrial rock', u'alternative', u'alternative metal', u'filter', u'Grunge', u'alternative rock', u'hardcore', u'thrash metal', u'Power metal', u'heavy metal', u'Hard', u'favorites', u'dark', u'upbeat', u'angry', u'american', u'good shit', u'Good Metal', u'rockin', u'killer riffs', u'Strange and Beautiful', u'richard patrick', u'for fucking', u'heavy', u'catchy', u'post-punk', u'winter', u'Random', u'industrial metal', u'Ohio', u'beatles', u'post-hardcore', u'Favourites', u'import', u'essentials', u'football', u'<3', u'Cleveland', u'90s Rock', u'Post Grunge', u'american metal', u'harsh industrial', u'american rock', u'lucipro', u'Torquemada']"
76,Dose,49140,141442,233000,"[u'rock', u'alternative rock', u'industrial', u'alternative', u'industrial rock', u'industrial metal', u'anger is a gift', u'classic rock', u'metal', u'hard rock', u'dark', u'angry', u'Garage Rock', u'filter', u'rockin', u'electronic', u'seen live', u'Grunge', u'Hard', u'heavy', u'female vocalists', u'Stoner Rock', u'favorites', u'90s', u'crossover', u'Favourites', u'import', u'programming', u'2', u'essentials', u'4 of 10 stars', u'eddie', u'rage', u'my music', u'atheism', u'alex', u'rock alternatif', u'gym', u'harsh industrial', u'classicrock', u'rock alternative', u'tracks i know', u'lucipro', u'Torquemada', u'richard patrick', u'-5', u'meaty beaty big and bouncy', u'q101chicago', u'bom', u'motorcycle']"
77,Hey Man Nice Shot,77629,428879,0,"[u'industrial', u'rock', u'alternative rock', u'alternative', u'90s', u'Supernatural', u'industrial rock', u'hard rock', u'filter', u'Soundtrack', u'american', u'alternative metal', u'metal', u'Grunge', u'industrial metal', u'wrif-fm', u'Supernatural OST', u'heavy metal', u'heavy', u'dark', u'angry', u'atmospheric', u'male vocalists', u'rock band', u'classic rock', u'classic', u'indie rock', u'epic', u'Awesome', u'loved', u'heard on Pandora', u'Favourites', u'bad day', u'music choice: classic alternative', u'demon knight', u'Nice Shot', u'seen live', u'vampire', u'sexy', u'dance', u'favorites', u'groove', u'Driving', u'death', u'free', u'Like', u'aggressive', u'great song', u'rock n roll', u""90's""]"
78,So Cool,27100,70520,266000,"[u'alternative rock', u'alternative', u'industrial', u'rock', u'Grunge', u'metal', u'chill', u'90s', u'industrial rock', u'punk', u'Mellow', u'chillout', u'seen live', u'favorites', u'calm', u'melancholy', u'post-grunge', u'relax', u'import', u'4 of 10 stars', u'sound storm', u'harsh industrial', u'richard patrick', u'Filter - so cool', u'reefermadness63']"
79,Consider This,31125,86937,258000,"[u'industrial', u'rock', u'alternative', u'alternative rock', u'Grunge', u'industrial rock', u'90s', u'industrial metal', u'filter', u'metal', u'indie', u'heavy', u'favorites', u'dark', u'winter', u'post-grunge', u'Favorite', u'import', u'music', u'meta', u'90s Rock', u'rockin', u'harsh industrial', u'death songs', u'richard patrick', u'-5', u'20 songs mix : 90s US Alternatives', u'dreamrock', u'hyride', u'scrincic', u'My way or the highway          again', u'kappe fav', u'filter - consider this', u'rispolverare dal dimenticatoio', u'SPLIFFING special', u'MINOG Case']"
80,White Like That,29070,78594,257000,"[u'rock', u'alternative rock', u'industrial', u'industrial rock', u'metal', u'alternative', u'Grunge', u'downtempo', u'90s', u'angry', u'alternative metal', u'Hard', u'hard rock', u'dark', u'free', u'american', u'Ohio', u'post-grunge', u'best', u'import', u'RAWK', u'filter', u'gloom', u'Cleveland', u'90s Rock', u'rockin', u'underground rock', u'sound storm', u'The Good Stuff', u'harsh industrial', u'american rock', u'richard patrick', u'krachmusik', u'Memories Of Self Hatred', u'ohio rock', u'filter - white like that', u'MINOG Case']"
81,Gerbil,32983,85340,201000,"[u'rock', u'industrial', u'alternative rock', u'industrial rock', u'filter', u'alternative', u'hard rock', u'heavy metal', u'black metal', u'metal', u'punk', u'Grunge', u'hardcore', u'doom metal', u'death metal', u'classic rock', u'indie', u'heavy', u'Stoner Rock', u'angry', u'soft', u'stoner', u'crossover', u'on my ipod', u'1995', u'rockin', u'Flaming Lips', u'frocks', u'Punk-Rock', u'animal kingdom', u'harsh industrial', u'richard patrick', u'yeahh', u'my zany zoo', u'UKass', u'RockItToMe', u'scrincic', u'loud and dirty', u'Kirchberg Rock City', u'MINOG Case']"
82,It's Over,31215,85310,216000,"[u'rock', u'alternative rock', u'hard rock', u'industrial', u'industrial rock', u'alternative', u'alternative metal', u'punk', u'classic rock', u'heavy metal', u'metal', u'Grunge', u'emo', u'favorites', u'industrial metal', u'Hard', u'90s', u'laidback', u'modern rock', u'post-grunge', u'best', u'import', u'suicide', u'heavy rock', u'on my ipod', u'harsh industrial', u'classicrock', u'malloy2000 playlist - top songs - classical to metal', u'richard patrick', u'brutality', u'love em', u'Gaming Rock', u'metal top', u'scrincic', u'rocky industry', u'not under', u'SPLIFFING special', u'beanoboo']"
83,Stuck in Here,33817,94961,214000,"[u'alternative rock', u'industrial', u'alternative', u'rock', u'90s', u'filter', u'acoustic', u'Mellow', u'gloom', u'metal', u'hard rock', u'soft rock', u'industrial rock', u'melancholy', u'Stoner Rock', u'Driving', u'winter', u'Favorite', u'relax', u'import', u'darkness', u'on my ipod', u'6 of 10 stars', u'4 of 10 stars', u'90s Rock', u'chilly', u'songs of my life', u'dizzy', u'Soundtrack Of My Life', u'High School Soundtrack', u'alt. rock', u'richard patrick', u'Down and Out', u'track I love', u'guitar chillout', u'theyre coming to take me away hehee', u'bulletproof ideas', u'stuck in here', u'MyTopTracks', u'UKass', u'odmor']"
84,Take Another,33082,90214,263000,"[u'rock', u'industrial', u'alternative', u'Grunge', u'metal', u'alternative rock', u'industrial rock', u'filter', u'90s', u'hard rock', u'industrial metal', u'downtempo', u'heavy', u'dark', u'angry', u'cool', u'import', u'1997', u'alt metal', u'rockin', u'frocks', u'Primary', u'harsh industrial', u'richard patrick', u'ta', u'Soldadito marinero', u'SPLIFFING special', u'iced ink palace', u'MINOG Case', u'beanoboo']"
85,Spent,31886,83471,277000,"[u'alternative rock', u'industrial rock', u'rock', u'industrial', u'metal', u'hard rock', u'90s', u'heard on Pandora', u'alternative', u'heavy metal', u'favorites', u'alternative metal', u'industrial metal', u'filter', u'angry', u'NIN', u'import', u'Paul', u'rockin', u'check this out', u'biker rock', u'Adrenalin', u'harsh industrial', u'Biker Metal', u'richard patrick', u'most excellent rock', u'The Best Metal', u'its suicidal even think dissin me', u'lucipro excercise', u'ufc music', u'lucipro rock', u'troshenje', u'SPLIFFING special', u'MINOG Case']"
86,Under,38554,108295,258000,"[u'industrial', u'rock', u'metal', u'hard rock', u'90s', u'industrial rock', u'alternative', u'alternative metal', u'filter', u'Grunge', u'alternative rock', u'hardcore', u'thrash metal', u'Power metal', u'heavy metal', u'Hard', u'favorites', u'dark', u'upbeat', u'angry', u'american', u'good shit', u'Good Metal', u'rockin', u'killer riffs', u'Strange and Beautiful', u'richard patrick', u'for fucking', u'heavy', u'catchy', u'post-punk', u'winter', u'Random', u'industrial metal', u'Ohio', u'beatles', u'post-hardcore', u'Favourites', u'import', u'essentials', u'football', u'<3', u'Cleveland', u'90s Rock', u'Post Grunge', u'american metal', u'harsh industrial', u'american rock', u'lucipro', u'Torquemada']"
87,Dose,49140,141442,233000,"[u'rock', u'alternative rock', u'industrial', u'alternative', u'industrial rock', u'industrial metal', u'anger is a gift', u'classic rock', u'metal', u'hard rock', u'dark', u'angry', u'Garage Rock', u'filter', u'rockin', u'electronic', u'seen live', u'Grunge', u'Hard', u'heavy', u'female vocalists', u'Stoner Rock', u'favorites', u'90s', u'crossover', u'Favourites', u'import', u'programming', u'2', u'essentials', u'4 of 10 stars', u'eddie', u'rage', u'my music', u'atheism', u'alex', u'rock alternatif', u'gym', u'harsh industrial', u'classicrock', u'rock alternative', u'tracks i know', u'lucipro', u'Torquemada', u'richard patrick', u'-5', u'meaty beaty big and bouncy', u'q101chicago', u'bom', u'motorcycle']"
88,Hey Man Nice Shot,77629,428879,0,"[u'industrial', u'rock', u'alternative rock', u'alternative', u'90s', u'Supernatural', u'industrial rock', u'hard rock', u'filter', u'Soundtrack', u'american', u'alternative metal', u'metal', u'Grunge', u'industrial metal', u'wrif-fm', u'Supernatural OST', u'heavy metal', u'heavy', u'dark', u'angry', u'atmospheric', u'male vocalists', u'rock band', u'classic rock', u'classic', u'indie rock', u'epic', u'Awesome', u'loved', u'heard on Pandora', u'Favourites', u'bad day', u'music choice: classic alternative', u'demon knight', u'Nice Shot', u'seen live', u'vampire', u'sexy', u'dance', u'favorites', u'groove', u'Driving', u'death', u'free', u'Like', u'aggressive', u'great song', u'rock n roll', u""90's""]"
89,Useless,19417,64453,355000,"[u'industrial', u'industrial metal', u'industrial rock', u'metal', u'ministry', u'al jourgensen', u'filth pig', u'heavy metal', u'electronic', u'rock', u'downtempo', u'dark', u'beautiful', u'angry', u'YuM', u'sludge metal', u'eclectonia', u'essentials', u'fall', u'XTC', u'rockin', u'Playlist', u'kmfdm', u'Filthy', u'useless', u'industrial sludge metal', u'monolithic industrial metal', u'brainstorm-spunk-music', u'industrial  rock industrial', u'music to drive off a cliff to', u'SPLIFFING special', u'iced ink palace', u'Symphony for Death Palace']"
90,Crumbs,22755,80651,254000,"[u'industrial', u'industrial metal', u'metal', u'ministry', u'rock', u'heavy', u'loud', u'driving rock', u'heavy metal', u'electronic', u'jazz', u'alternative', u'favorites', u'beautiful', u'Avant-Garde', u'english', u'15', u'aggro', u'eclectonia', u'4 of 10 stars', u'music', u'nocturnal', u'lyrical genius', u'al jourgensen', u'kmfdm', u'foodcore', u'Solomusika-Loved', u'true industrial', u'kick-ass tunes', u'critty', u'mitt', u'crumbs', u'whythelies', u'Rooties X3 Classicks']"
91,Lava,26036,104573,390000,"[u'industrial metal', u'industrial', u'ministry', u'metal', u'sludge metal', u'electronic', u'rock', u'90s', u'angry', u'industrial rock', u'al jourgensen', u'Play this loud enough to raise the dead', u'industrial sludge metal', u'monolithic industrial metal', u'best of industrial', u'burning red hot', u'burning christ screaming on the cross', u'industrial stoner sludge', u'heavy metal', u'punk', u'sexy', u'hard rock', u'Awesome', u'edgy', u'3', u'alternative metal', u'Crunchy', u'stoner metal', u'Favorite', u'evil', u'eclectonia', u'Monsters', u'hell', u'repetition', u'lava', u'stuff', u'burning', u'rage', u'monstrous', u'classic metal', u'shivers', u'kmfdm', u'Alternate Rock', u'stoner sludge', u'rocket sauce', u'baylok', u'Pre-and-Post Punk', u'Second Wave Industrial', u'sieg heil', u'Best Of Alternate Rock']"
92,Filth Pig,26102,109251,379000,"[u'industrial', u'industrial metal', u'ministry', u'metal', u'industrial rock', u'rock', u'90s', u'al jourgensen', u'filth pig', u'pain junkie radio', u'electronic', u'punk', u'hard rock', u'beautiful', u'Sludge', u'political', u'live', u'great lyrics', u'drugs', u'fuck', u'eclectonia', u'darkness', u'4 of 10 stars', u'fall', u'cryptic', u'a place for people with that tiny black spot on their brain to go when the darkness leaks out and does what it wills', u'music for an ass-beating', u'kmfdm', u'Live recording', u'pig fuck', u'fuck music', u'BETTY X', u'serial killer soundtrack', u'songs of the wilderness', u'Moi', u'GANGBANG MUSIC', u'prong', u'Helmet', u'porcine', u'ernie', u'Titletracks', u'rape roleplay', u'best of industrial', u'kick-ass tunes', u'industrial sludge', u'sjsjjw sijd sd ddioswow', u'powerfuck', u'LongDayEdition', u'aiwendilia', u'd radio']"
93,Reload,30127,109773,144000,"[u'industrial metal', u'industrial', u'ministry', u'rock', u'industrial rock', u'alternative', u'hardcore', u'REload', u'metal', u'electronic', u'heavy', u'hard rock', u'rage', u'Street Industrial', u'heavy metal', u'metalcore', u'seen live', u'alternative rock', u'beautiful', u'underrated', u'Favorite', u'programming', u'fuck', u'eclectonia', u'essentials', u'4 of 10 stars', u'fall', u'Insanity', u'a place for people with that tiny black spot on their brain to go when the darkness leaks out and does what it wills', u'music for an ass-beating', u'al jourgensen', u'true metal', u'fuck you', u'pissed off', u'industrial hardcore', u'kmfdm', u'Fuck Off', u'fuck music', u'fury', u'garten metal', u'serial killer soundtrack', u'GANGBANG MUSIC', u'rape roleplay', u'public transport is WAR', u'powerfuck', u'ministry - reload', u'victorious hymns', u'filth pig', u'yeah music', u'true metal gods']"
94,Brick Windows,17779,59193,323000,"[u'industrial', u'industrial metal', u'rock', u'metal', u'heavy metal', u'darkwave', u'goth', u'90s', u'shreds', u'classic rock', u'electronic', u'ambient', u'experimental', u'hard rock', u'post-punk', u'beautiful', u'industrial rock', u'avantgarde', u'green day', u'ebm', u'neofolk', u'best song ever', u'heavy rock', u'eclectonia', u'Pounding', u'ministry', u'al jourgensen', u'kmfdm', u'Alternate Rock', u'best ever', u'not darkwave', u'Best Of Alternate Rock', u'best of industrial', u'Best Of Industrial Metal', u'Best Of Favorite Artists']"
95,Lay Lady Lay,53177,213970,344000,"[u'industrial', u'cover', u'industrial metal', u'industrial rock', u'covers', u'rock', u'Bob Dylan cover', u'metal', u'ministry', u'electronic', u'cover song', u'Bob Dylan', u'fistKranKping', u'fuck', u'fuck music', u'sexy', u'synthpop', u'Great Covers', u'out of genre covers', u'a place for people with that tiny black spot on their brain to go when the darkness leaks out and does what it wills', u'al jourgensen', u'Dylan', u'A perfect love I bring', u'serial killer soundtrack', u'awesome sound', u'GANGBANG MUSIC', u'urban pimp assault', u'rape roleplay', u'Stripperella', u'heavy metal', u'seen live', u'indie', u'punk', u'alternative', u'alternative rock', u'favorite songs', u'hardcore', u'emo', u'hard rock', u'dance', u'epic', u'new wave', u'shoegaze', u'beautiful', u'Awesome', u'laid back', u'thrash metal', u'lovesong', u'alternative metal', u'amazing']"
96,Filth Pig,26102,109251,379000,"[u'industrial', u'industrial metal', u'ministry', u'metal', u'industrial rock', u'rock', u'90s', u'al jourgensen', u'filth pig', u'pain junkie radio', u'electronic', u'punk', u'hard rock', u'beautiful', u'Sludge', u'political', u'live', u'great lyrics', u'drugs', u'fuck', u'eclectonia', u'darkness', u'4 of 10 stars', u'fall', u'cryptic', u'a place for people with that tiny black spot on their brain to go when the darkness leaks out and does what it wills', u'music for an ass-beating', u'kmfdm', u'Live recording', u'pig fuck', u'fuck music', u'BETTY X', u'serial killer soundtrack', u'songs of the wilderness', u'Moi', u'GANGBANG MUSIC', u'prong', u'Helmet', u'porcine', u'ernie', u'Titletracks', u'rape roleplay', u'best of industrial', u'kick-ass tunes', u'industrial sludge', u'sjsjjw sijd sd ddioswow', u'powerfuck', u'LongDayEdition', u'aiwendilia', u'd radio']"
97,Filth Pig,26102,109251,379000,"[u'industrial', u'industrial metal', u'ministry', u'metal', u'industrial rock', u'rock', u'90s', u'al jourgensen', u'filth pig', u'pain junkie radio', u'electronic', u'punk', u'hard rock', u'beautiful', u'Sludge', u'political', u'live', u'great lyrics', u'drugs', u'fuck', u'eclectonia', u'darkness', u'4 of 10 stars', u'fall', u'cryptic', u'a place for people with that tiny black spot on their brain to go when the darkness leaks out and does what it wills', u'music for an ass-beating', u'kmfdm', u'Live recording', u'pig fuck', u'fuck music', u'BETTY X', u'serial killer soundtrack', u'songs of the wilderness', u'Moi', u'GANGBANG MUSIC', u'prong', u'Helmet', u'porcine', u'ernie', u'Titletracks', u'rape roleplay', u'best of industrial', u'kick-ass tunes', u'industrial sludge', u'sjsjjw sijd sd ddioswow', u'powerfuck', u'LongDayEdition', u'aiwendilia', u'd radio']"
98,Wszystko to co ja,13202,106186,280000,"[u'rock', u'hard rock', u'polish rock', u'female vocalists', u'polish', u'metal', u'ona', u'alternative', u'nine inch nails', u'loneliness after dusk', u'poland', u'Type O Negative', u'loved track', u'polski rock', u'naj naj naj', u'milestone track', u'Chylinska', u'polisz mtv', u'rockoteka', u'wszystko to co ja', u'wzor polskiego rocka', u'rockoblivion', u'adasko13', u'kurwakurwakurwa']"
99,Suka,12457,87999,301000,"[u'hard rock', u'rock', u'polish rock', u'polish', u'industrial', u'metal', u'alternative', u'female vocalists', u'polski metal', u'Nu Metal', u'poland', u'Needles', u'polskie', u'female metal', u'ona', u'like it loud', u'songs about Julia', u'suka', u'famale vocalists', u'na wkurwa', u'swietne glosy kobiece', u'Kappi123 favourites', u'bansuj dziwko', u'paranoja', u'ona suka']"
100,On tu jest,7753,44450,279000,"[u'rock', u'hard rock', u'polish']"
101,On tu jest,7753,44450,279000,"[u'rock', u'hard rock', u'polish']"
102,Shades Of God,36132,179776,235000,"[u'Gothic Metal', u'doom metal', u'metal', u'british', u'Gothic', u'8 of 10 stars', u'riff', u'Paradise Lost', u'heavy metal', u'seen live', u'male vocalist', u'Gothic Rock', u'fav', u'7 of 10 stars', u'10 of 10 stars', u'brittish', u'gothic doom', u'fon', u'bishide', u'Awesome Drums', u'my favourite tracks', u'post doom metal', u'makes my flesh creep']"
103,Yearn For Change,36793,188379,259000,"[u'Gothic Metal', u'doom metal', u'metal', u'british', u'Progressive metal', u'Progressive rock', u'Paradise Lost', u'heavy metal', u'7 of 10 stars', u'seen live', u'Gothic', u'Awesome', u'90s', u'loved', u'male vocalist', u'8 of 10 stars', u'9 of 10 stars', u'modern metal', u'gothic doom', u'mk-79s finest metal', u'fabulosa', u'trauriger Metal', u'ah the memories', u'songs that I love to play on drum set', u'similar tracks: the gathering - Marooned', u'similar tracks: the gathering - Nighttime Birds', u'similar tracks: the gathering - golden Grounds']"
104,Elusive Cure,37289,190127,201000,"[u'Gothic Metal', u'doom metal', u'Gothic Doom Metal', u'metal', u'melancholic', u'heavy metal', u'Gothic', u'Paradise Lost', u'seen live', u'british', u'Atmospheric metal', u'instrumental', u'Progressive metal', u'atmospheric', u'male vocalist', u'8 of 10 stars', u'7 of 10 stars', u'10 of 10 stars', u'1995', u'Sombre', u'riff', u'5 of 10 stars', u'best of 1995', u'Awesome Drums', u'saturnine', u'makes my flesh creep', u'atmospheric heavy metal', u'honcuks choice', u'melancholic heavy rock', u'emotional heavy rock', u'similar tracks: the gathering - Marooned', u'Elusive Cure']"
105,Shadowkings,36795,197030,282000,"[u'Gothic Metal', u'doom metal', u'Gothic Doom Metal', u'heavy metal', u'seen live', u'my personal favourite tracks', u'metal', u'alternative', u'Progressive metal', u'melancholy', u'Gothic Rock', u'fav', u'8 of 10 stars', u'9 of 10 stars', u'heavy rock', u'10 of 10 stars', u'6 of 10 stars', u'depressive rock', u'dark rock', u'riff', u'5 of 10 stars', u'Some good music', u'gothic doom', u'bishide', u'Awesome Drums', u'heavy-doom metal', u'Tema Increible', u'honcuks choice', u'honcuks chargers', u'uptempo doom metal', u'best gothic metal', u'just the right words']"
106,Once Solemn,44113,243401,183000,"[u'Gothic Metal', u'doom metal', u'metal', u'heavy metal', u'Gothic', u'alternative metal', u'seen live', u'8 of 10 stars', u'10 of 10 stars', u'dark rock', u'modern metal', u'best of 1995', u'british', u'alternative', u'favorite songs', u'loved', u'male vocalist', u'7 of 10 stars', u'1995', u'5 of 10 stars', u'a favorite', u'Paradise Lost', u'nosan', u'Awesome Drums', u'headbanging music', u'Songs That I Love To Play In Guitar', u'the anatomy of melancholy']"
107,Forever Failure,53177,336429,258000,"[u'Gothic Metal', u'doom metal', u'metal', u'Gothic Doom Metal', u'Gothic', u'seen live', u'british', u'melancholic', u'Paradise Lost', u'8 of 10 stars', u'Charles Manson', u'obsessive', u'fuck hope', u'makes my flesh creep', u'Soundrack to my suicide', u'heavy metal', u'rock', u'goth', u'sad', u'favorites', u'Love', u'Awesome', u'Melodic Death Metal', u'atmospheric', u'ominous', u'Doom', u'melancholy', u'emotional', u'loved', u'male vocalist', u'great lyrics', u'brilliant', u'psycho', u'9 of 10 stars', u'makes me cry', u'Masterpiece', u'10 of 10 stars', u'6 of 10 stars', u'atmospheric doom metal', u'Atmospheric metal', u'Dark metal', u'Guitar Solo', u'serial killer', u'All time favourites', u'my life', u'fucking incredible', u'uk metal', u'psychedelic doom', u'atonement', u'nice lyrics']"
108,The Last Time,51180,296373,205000,"[u'doom metal', u'Gothic Metal', u'heavy metal', u'metal', u'Gothic', u'seen live', u'Gothic Doom Metal', u'british', u'favorites', u'Awesome', u'Doom', u'excellent', u'loved', u'super', u'male vocalist', u'Favourites', u'8 of 10 stars', u'I love this song', u'Masterpiece', u'football', u'10 of 10 stars', u'6 of 10 stars', u'goth metal', u'The Last Time', u'Atmospheric metal', u'good solo', u'a favorite', u'UFC', u'best guitar solos', u'Paradise Lost', u'Fucking masterpiece', u'lucipro', u'Awesome Drums', u'whisky swamp and cigar smoke', u'motorcycle', u'music that gets me my dick hard', u'Tema Increible', u'LAUTER', u'vg duel', u'Cryb Test', u'BOA12', u'gothic metal']"
109,Hallowed Land,51855,303703,303000,"[u'Gothic Metal', u'doom metal', u'metal', u'Gothic', u'favorites', u'melancholy', u'seen live', u'british', u'90s', u'death metal', u'brilliant', u'heavy metal', u'alternative', u'experimental', u'Love', u'epic', u'Doom', u'alternative metal', u'emotional', u'melancholic', u'super', u'male vocalist', u'symphonic metal', u'english', u'8 of 10 stars', u'heavy rock', u'Masterpiece', u'7 of 10 stars', u'10 of 10 stars', u'1995', u'gas', u'atmospheric doom metal', u'Dark metal', u'Mosh', u'Psychedelic metal', u'riff', u'Gothic Doom Metal', u'5 of 10 stars', u'fucking incredible', u'so so', u'best of 1995', u'eargasmic', u'Paradise Lost', u'gothic doom', u'very emotive', u'not gothic metal', u'Awesome Drums', u'Gothic - Doom', u'my favourite tracks', u'Pjesme koje me jeze']"
110,Enchantment,46980,266085,364000,"[u'Gothic Metal', u'doom metal', u'metal', u'Gothic', u'seen live', u'british', u'10 of 10 stars', u'90s', u'heavy metal', u'chill', u'favorite songs', u'favorites', u'piano', u'intro', u'strings', u'melancholic', u'loved', u'male vocalist', u'fav', u'english', u'8 of 10 stars', u'9 of 10 stars', u'melodic metal', u'Love it', u'addicting', u'7 of 10 stars', u'1995', u'Sombre', u'atmospheric doom metal', u'Atmospheric metal', u'Gothic Doom Metal', u'riffs', u'songs I fucking love to death', u'5 of 10 stars', u'fucking incredible', u'loved tracks', u'gothic-doom metal', u'lovely stuff', u'best of 1995', u'Paradise Lost', u'gothic doom', u'Everything i need', u'bishide', u'Awesome Drums', u'really cool', u'my favourite tracks', u'saturnine', u'wyciskacz', u'TOTAL FUCKING WIN', u'post-doom metal']"
111,Jaded,34219,165285,209000,"[u'doom metal', u'Gothic Metal', u'Paradise Lost', u'seen live', u'british', u'10 of 10 stars', u'jaded', u'metal', u'epic', u'Gothic', u'90s', u'Doom', u'melancholic', u'loved', u'male vocalist', u'8 of 10 stars', u'Masterpiece', u'great voice', u'7 of 10 stars', u'atmospheric doom metal', u'Playlist', u'Gothic Doom Metal', u'5 of 10 stars', u'gothic doom', u'suffer life', u'Tema Increible', u'PAIN BURNS IN MANY WAYS', u'DOOMMM', u'Draconian Times']"
112,...Steel for Humans,4834,43034,87000,"[u'Soundtrack', u'epic', u'ost', u'Witcher3']"
113,Silver for Monsters...,5195,43395,140000,"[u'Soundtrack', u'epic', u'ost', u'Witcher3']"
114,Can't Happen Here,8320,26808,489000,"[u'industrial rock', u'industrial', u'industrial metal', u'rock', u'alternative rock', u'stabbing westward', u'alternative', u'90s', u'Gothic Metal', u'Nu Metal', u'bitter', u'Torquemada', u'heavy alternative rock', u'Street Industrial']"
115,Burn the Witch,215852,1593999,220000,"[u'chamber pop', u'art rock', u'love at first listen', u'alternative', u'epic', u'post-revolutionary pop song', u'2016', u'Avantgarde Pop', u'electronic', u'rock', u'british', u'alternative rock', u'art pop', u'achingly intelligent', u'Iconic', u'indie rock', u'chamber music', u'strings', u'england', u'political', u'synthpop', u'radiohead', u'fip', u'5 Stars', u'FM4', u'clinically romantic', u'2010s', u'russian rock', u'thom yorke', u'witch', u'best of 2015', u'somafm', u'Bagel', u'best of 2016', u'2016 single', u'epic', u'sounds like old radiohead', u'anti-snooping', u'nsa leakes', u'love at thousandth listen', u'best of 2016', u'burn', u'2016 Loved', u'domingo-s\xe1bado-segunda-sexta', u'ter\xe7a-quarta-quinta']"
116,Burn the Witch,215852,1593999,220000,"[u'chamber pop', u'art rock', u'love at first listen', u'alternative', u'epic', u'post-revolutionary pop song', u'2016', u'Avantgarde Pop', u'electronic', u'rock', u'british', u'alternative rock', u'art pop', u'achingly intelligent', u'Iconic', u'indie rock', u'chamber music', u'strings', u'england', u'political', u'synthpop', u'radiohead', u'fip', u'5 Stars', u'FM4', u'clinically romantic', u'2010s', u'russian rock', u'thom yorke', u'witch', u'best of 2015', u'somafm', u'Bagel', u'best of 2016', u'2016 single', u'epic', u'sounds like old radiohead', u'anti-snooping', u'nsa leakes', u'love at thousandth listen', u'best of 2016', u'burn', u'2016 Loved', u'domingo-s\xe1bado-segunda-sexta', u'ter\xe7a-quarta-quinta']"
