,Songs,Listeners,Playcount,Duration,Tags
163,Sonnet,404528,1861190,261000,"[u'britpop', u'rock', u'indie', u'alternative', u'90s', u'british', u'alternative rock', u'The Verve', u'indie rock', u'beautiful', u'Love', u'melancholy', u'pop', u'verve', u'Sonnet', u'chillout', u'sad', u'UK', u'Mellow', u'male vocalists', u'nostalgia', u'brit pop', u'melancholic', u'Favourites', u'1997', u'Britrock', u'Richard Ashcroft', u'classic rock', u'indie pop', u'alt rock', u'lovedbyale', u'space rock', u'brit rock', u'classics', u'british i like', u'Brit-pop', u'Soundtrack Of My Life', u'LastfmSC', u'I never saw you dancing', u'chill', u'favorites', u'Alternative  Punk', u'Dreamy', u'favourite artists', u'beautiful melodies', u'awesome anytime', u'favorite songs', u'singer-songwriter', u'easy listening', u'england']"
164,Cash Is Money,7427,34917,182000,[]
165,Husk (Mix),429,1230,434000,[]
166,Solar (Extended),216,717,293000,[]
167,Husk,3232,13579,192000,"[u'punk', u'Legopop']"
168,Solar,2609,10604,191000,"[u'Oi', u'mountain forest']"
169,Teletron,3102,10007,190000,"[u'British Punk', u'lovedbybeyondwithin', u'beyondwithins favorites', u'beyondwithins party']"
170,H.M.K. Grey,1633,4827,186000,"[u'punk rock', u'lovedbybeyondwithin', u'beyondwithins party']"
171,Skin,1350,4121,183000,[]
172,For You,1579,5864,326000,[]
173,Flowers & Fire,2575,13156,261000,"[u'post-punk', u'intense', u'male vocals', u'fire', u'flowers', u'music I like', u'Music I Own', u'guitar based', u'absolute favourites ever', u'Luxury Stranger']"
174,Into the Daylight,2335,8196,154000,"[u'post-punk', u'Joy Division']"
175,Into the Daylight,2335,8196,154000,"[u'post-punk', u'Joy Division']"
176,I Remember Nothing,265836,1428750,360000,"[u'post-punk', u'new wave', u'alternative', u'Gothic', u'Joy Division', u'rock', u'70s', u'british', u'dark', u'indie', u'Gothic Rock', u'punk rock', u'cold wave', u'80s', u'haunting', u'Manchester', u'depressing', u'gloomy', u'punk', u'goth', u'british i like', u'classic rock', u'atmospheric', u'melancholy', u'melancholic', u'darkwave', u'goth rock', u'electronic', u'experimental', u'indie rock', u'Alternative  Punk', u'britpop', u'Post punk', u'hypnotic', u'1979', u'bleak', u'depressive', u'beautiful', u'death', u'favourite', u""80's"", u'4', u'english', u'insomnia', u'hopeless', u'cold core', u'fav tracks', u'i remember nothing', u'we were strangers', u'electronica']"
177,Interzone,311969,1893237,130000,"[u'post-punk', u'new wave', u'alternative', u'Joy Division', u'rock', u'70s', u'Post punk', u'Manchester', u'indie', u'80s', u'punk rock', u'goth', u'british', u'dark', u'Gothic', u'1979', u'punk', u'indie rock', u'british i like', u'alternative rock', u'Alternative  Punk', u'great lyrics', u'noise industrial', u'classic rock', u'indie pop', u'britpop', u'rocknroll', u'Gothic Rock', u'a masterpiece', u'factory records', u'play loud', u'Resistance is futile', u'lizvelrene postpunk', u'vampire', u'singer-songwriter', u'dance', u'energy', u'Love', u'Lo-Fi', u'beautiful', u'cyberpunk', u'darkwave', u'Favorite', u'i am a party girl here is my soundtrack', u'independent', u'alternative & punk', u'hysterical', u'indie classics', u'77davez-all-tracks', u'club-dance rock']"
178,Wilderness,295183,1735576,155000,"[u'post-punk', u'new wave', u'alternative', u'80s', u'Post punk', u'rock', u'Joy Division', u'british', u'bass', u'Manchester', u'punk', u'dark', u'Gothic', u'70s', u'UK', u'punk rock', u'darkwave', u'british i like', u'classic rock', u'indie', u'classic', u'Favourites', u'gloomy', u'amayzes loved', u'cold core', u'alternative rock', u'cold wave', u'1970s', u'1979', u'davaho53', u'Alternative  Punk', u'guitar', u'depressing', u'Gothic Rock', u'madchester', u'8 of 10 stars', u'heavy bottom end', u'depressive', u'storytellers', u'Afterpunk', u'krautcold', u'zeru', u'zeru ta lur', u'goth', u'heavy', u'hardcore', u'indie pop', u'indie rock', u'New-Wave', u'albums I own']"
179,Shadowplay,507106,3570124,230000,"[u'post-punk', u'new wave', u'alternative', u'british', u'Post punk', u'Joy Division', u'rock', u'just cut me down', u'80s', u'dark', u'70s', u'indie', u'Manchester', u'punk', u'alternative rock', u'Gothic Rock', u'cold wave', u'punk rock', u'darkwave', u'Gothic', u'goth', u'atmospheric', u'favorites', u'1979', u'classic rock', u'indie rock', u'male vocalists', u'shadowplay', u'sad', u'post-rock', u'melancholy', u'british i like', u'antial', u'depressive urban', u'favorite songs', u'beautiful', u'favourite', u'raw', u'factory', u'madchester', u'dark wave', u'perfect', u'Favourites', u'Ian Curtis', u'goth rock', u'i am sad and this is what i need right now', u'records to play when you come home from the pub pissed', u'thissongblowyourheadaway', u'unknown pleasures']"
180,She's Lost Control,612933,5305116,249000,"[u'post-punk', u'new wave', u'alternative', u'80s', u'Joy Division', u'british', u'rock', u'Post punk', u'indie', u'dark', u'70s', u'Manchester', u'darkwave', u'goth', u'Ian Curtis', u'alternative rock', u'depressing', u'cold wave', u'Gothic Rock', u'electronic', u'indie rock', u'favorites', u'sad', u'UK', u'Gothic', u'punk rock', u'punk', u'intense', u'dark wave', u'Favourites', u'1979', u'Favourite Songs', u'Soundtrack Of My Life', u'classic rock', u'Recommended', u'skins', u'haunting', u'favourite', u'kickasstic', u'pay attention', u'sexy', u'Love', u'beautiful', u'melancholic', u'Favorite', u'drinking in the dark', u'Soundtrack', u'psychedelic', u'bass', u'hypnotic']"
181,New Dawn Fades,450454,3053243,287000,"[u'post-punk', u'new wave', u'Joy Division', u'80s', u'Post punk', u'alternative', u'rock', u'british', u'dark', u'Gothic', u'indie', u'melancholy', u'70s', u'punk', u'Manchester', u'depressing', u'goth', u'melancholic', u'Gothic Rock', u'alternative rock', u'cold wave', u'epic', u'1979', u'sad', u'indie rock', u'punk rock', u'darkwave', u'classic rock', u'favorites', u'england', u'haunting', u'UK', u'depression', u'Favorite', u'british i like', u'Ian Curtis', u'antial', u'classic', u'Love', u'Alternative  Punk', u'britpop', u'intense', u'dramatic', u'1970s', u'Masterpiece', u'all time faves', u'favs', u'joy', u'goth rock', u'bassy']"
182,Insight,374304,2355446,240000,"[u'post-punk', u'new wave', u'alternative', u'Joy Division', u'Post punk', u'80s', u'rock', u'british', u'pew pew', u'indie', u'dark', u'cold wave', u'70s', u'Manchester', u'Gothic', u'punk', u'indie rock', u'punk rock', u'melancholy', u'alternative rock', u'goth', u'sad', u'industrial', u'Gothic Rock', u'gloomy', u'electronic', u'UK', u'depressed', u'psychedelic', u'genius', u'british i like', u'electronica', u'dark wave', u'1979', u'Ian Curtis', u'amayzes loved', u'dark as hell', u'cold core', u'classic rock', u'favorites', u'factory', u'nostalgia', u'factory records', u'favs', u'joy', u'davaho53', u'The Spell', u'unknown pleasures', u'johnnytop', u'vugube62']"
183,Candidate,307756,1885513,180000,"[u'post-punk', u'new wave', u'Joy Division', u'british', u'alternative', u'Post punk', u'70s', u'rock', u'dark', u'Manchester', u'darkwave', u'indie', u'goth', u'Gothic', u'punk rock', u'scary sexy great', u'80s', u'depressed', u'cold wave', u'british i like', u'classic rock', u'alternative rock', u'indie rock', u'Gothic Rock', u'amayzes loved', u'creepy as hell', u'punk', u'psychedelic', u'mood', u'1970s', u'creepy', u'Ian Curtis', u'influential', u'depressive', u'loved tracks', u'candidate', u'davaho53', u'Alternative  Punk', u'postpunk', u'cyberpunk', u'live', u'factory', u'Favorite', u'hopeless', u'for rainy days', u'Sunday Music', u'unknown pleasures', u'electronic', u'Favorite Bands', u'experimental']"
184,Day of the Lords,345973,2188150,283000,"[u'post-punk', u'new wave', u'alternative', u'80s', u'Post punk', u'Joy Division', u'dark', u'british', u'punk', u'rock', u'Gothic', u'Manchester', u'indie', u'Gothic Rock', u'70s', u'melancholy', u'darkwave', u'goth', u'punk rock', u'alternative rock', u'haunting', u'1979', u'depressed', u'cold wave', u'english', u'british i like', u'UK', u'epic', u'madchester', u'factory', u'isolated', u'IF I EVER MADE A MOVIE THIS WOULD BE THE SOUNDTRACK', u'day of the lords', u'classic rock', u'pop', u'electro', u'Alternative  Punk', u'england', u""80's"", u'Favorite', u'1970s', u'despair', u'Favourite Songs', u'favs', u'Ian Curtis', u'depressive', u'British Punk', u'cold core', u'transitmelancolic', u'strangeromanticdeadrockcave']"
185,Disorder,593481,5203465,216000,"[u'post-punk', u'new wave', u'80s', u'alternative', u'Joy Division', u'british', u'indie', u'Post punk', u'rock', u'70s', u'Manchester', u'dark', u'beautiful', u'punk', u'Favourites', u'Ian Curtis', u'melancholy', u'Gothic', u'alternative rock', u'genius', u'love at first listen', u'Gothic Rock', u'punk rock', u'cold wave', u'All time favourites', u'goth', u'indie rock', u'favorites', u'Love', u'depressive', u'sad', u'New-Wave', u'amazing', u'male vocalists', u'1979', u'songs that i will still be listening to in a billion years', u'Awesome', u'darkwave', u'Favourite Songs', u'memories', u'Dreamy', u'loved', u'british i like', u'Pitchfork 500', u'influential', u'disorder', u'absolute classics', u'favorite songs', u'guitar', u'gay']"
186,Transmission,565652,4398194,230000,"[u'post-punk', u'new wave', u'80s', u'alternative', u'Joy Division', u'rock', u'british', u'Post punk', u'indie', u'70s', u'Manchester', u'punk', u'dark', u'Gothic', u'indie rock', u'alternative rock', u'UK', u'darkwave', u'goth', u'melancholy', u'1979', u'punk rock', u'Favourites', u'factory', u'dark wave', u'lovedbygdchill', u'songs that i will still be listening to in a billion years', u'favorites', u'classic rock', u'Love', u'male vocalists', u'cold wave', u'dance dance dance to the radio', u'favorite songs', u'bass', u'england', u'Radio', u'melancholic', u'perfect', u'Favourite Songs', u'transmission', u'soundtrackgdchill', u'Too bad the singer died so young', u'electronic', u'New-Wave', u'intense', u'brit rock', u'depressing', u'live', u'british i like']"
187,Shadowplay,507106,3570124,230000,"[u'post-punk', u'new wave', u'alternative', u'british', u'Post punk', u'Joy Division', u'rock', u'just cut me down', u'80s', u'dark', u'70s', u'indie', u'Manchester', u'punk', u'alternative rock', u'Gothic Rock', u'cold wave', u'punk rock', u'darkwave', u'Gothic', u'goth', u'atmospheric', u'favorites', u'1979', u'classic rock', u'indie rock', u'male vocalists', u'shadowplay', u'sad', u'post-rock', u'melancholy', u'british i like', u'antial', u'depressive urban', u'favorite songs', u'beautiful', u'favourite', u'raw', u'factory', u'madchester', u'dark wave', u'perfect', u'Favourites', u'Ian Curtis', u'goth rock', u'i am sad and this is what i need right now', u'records to play when you come home from the pub pissed', u'thissongblowyourheadaway', u'unknown pleasures']"
188,She's Lost Control,612933,5305116,249000,"[u'post-punk', u'new wave', u'alternative', u'80s', u'Joy Division', u'british', u'rock', u'Post punk', u'indie', u'dark', u'70s', u'Manchester', u'darkwave', u'goth', u'Ian Curtis', u'alternative rock', u'depressing', u'cold wave', u'Gothic Rock', u'electronic', u'indie rock', u'favorites', u'sad', u'UK', u'Gothic', u'punk rock', u'punk', u'intense', u'dark wave', u'Favourites', u'1979', u'Favourite Songs', u'Soundtrack Of My Life', u'classic rock', u'Recommended', u'skins', u'haunting', u'favourite', u'kickasstic', u'pay attention', u'sexy', u'Love', u'beautiful', u'melancholic', u'Favorite', u'drinking in the dark', u'Soundtrack', u'psychedelic', u'bass', u'hypnotic']"
189,She's Lost Control,612933,5305116,249000,"[u'post-punk', u'new wave', u'alternative', u'80s', u'Joy Division', u'british', u'rock', u'Post punk', u'indie', u'dark', u'70s', u'Manchester', u'darkwave', u'goth', u'Ian Curtis', u'alternative rock', u'depressing', u'cold wave', u'Gothic Rock', u'electronic', u'indie rock', u'favorites', u'sad', u'UK', u'Gothic', u'punk rock', u'punk', u'intense', u'dark wave', u'Favourites', u'1979', u'Favourite Songs', u'Soundtrack Of My Life', u'classic rock', u'Recommended', u'skins', u'haunting', u'favourite', u'kickasstic', u'pay attention', u'sexy', u'Love', u'beautiful', u'melancholic', u'Favorite', u'drinking in the dark', u'Soundtrack', u'psychedelic', u'bass', u'hypnotic']"
190,Love Will Tear Us Apart,1044643,9196025,207000,"[u'post-punk', u'new wave', u'80s', u'alternative', u'Joy Division', u'british', u'rock', u'indie', u'Love', u'Post punk', u'melancholy', u'Manchester', u'sad', u'alternative rock', u'punk', u'favorites', u'dark', u'indie rock', u'classic', u'Gothic', u'beautiful', u'classic rock', u'Donnie Darko', u'Favourite Songs', u'Favourites', u'Love Will Tear Us Apart', u'Soundtrack', u'electronic', u'genius', u'melancholic', u'70s', u'goth', u'Awesome', u'1980', u'darkwave', u'UK', u'love at first listen', u'Ian Curtis', u'male vocalists', u'songs not to play at your wedding', u'pop', u'Gothic Rock', u'dance', u'cold wave', u'atmospheric', u'favorite songs', u'england', u'favourite', u'Favorite', u'britpop']"
191,Dead Souls,402015,2456124,290000,"[u'post-punk', u'new wave', u'80s', u'alternative', u'Joy Division', u'rock', u'british', u'alternative rock', u'indie', u'punk', u'Post punk', u'dark', u'Gothic', u'Gothic Rock', u'goth', u'Manchester', u'dark wave', u'70s', u'lovedbygdchill', u'UK', u'punk rock', u'indie rock', u'favorites', u'intense', u'darkwave', u'Favourites', u'halloween', u'Ian Curtis', u'antial', u'Awesome', u'melancholy', u'cold wave', u'british i like', u'serial killer soundtrack', u'soundtrackgdchill', u'dead souls', u'Soundtrack', u'sad', u'industrial', u'factory records', u'1980', u'best songs ever', u'a place for people with that tiny black spot on their brain to go when the darkness leaks out and does what it wills', u'neatneatneat', u'classic rock', u'dance', u'Love', u'beautiful', u'psychedelic', u'england']"
192,Zé Canjica,7877,29040,233000,"[u'70s', u'latin', u'brasil', u'samba', u'samba rock', u'Jorge Ben', u'rj']"
193,Zé Canjica,7877,29040,233000,"[u'70s', u'latin', u'brasil', u'samba', u'samba rock', u'Jorge Ben', u'rj']"
194,Zé Canjica,7877,29040,233000,"[u'70s', u'latin', u'brasil', u'samba', u'samba rock', u'Jorge Ben', u'rj']"
195,Zé Canjica,7877,29040,233000,"[u'70s', u'latin', u'brasil', u'samba', u'samba rock', u'Jorge Ben', u'rj']"
196,Zé Canjica,7877,29040,233000,"[u'70s', u'latin', u'brasil', u'samba', u'samba rock', u'Jorge Ben', u'rj']"
197,Flat of Angles,10137,32379,295000,"[u'post-punk', u'Psychedelic Rock', u'The Fall', u'alternative', u'Post punk', u'art punk', u'great lyrics', u'valentines day', u'killer bass', u'anti-rock', u'glorious vocals', u'up on trial', u'technical perfection', u'godlike drumming', u'all time great songs', u'god-tier guitar']"
198,Muzorewi's Daughter,10334,31904,223000,"[u'indie rock', u'post-punk', u'good7', u'The Falls Best', u'muzorewis daughter']"
199,Your Heart Out,10927,37006,187000,"[u'post-punk', u'i dont sing i just shout', u'avant confrontational kraut art attack post-punk', u'Glee Inducing', u'rockabilly', u'new wave', u'avantgarde', u'Seminal', u'body parts', u'sing', u'HappySad', u'tnphp eclectic', u'herz', u'UK Independent', u'The Falls Best', u'UK Punk and New Wave', u'The TNL Top Ten', u'que es esto', u'makes you smile', u'good4', u'track no 20000', u'my 20000 track', u'Lauf', u'favorite the fall songs', u'just look at me too much speed', u'your heart out']"
200,Before the Moon Falls,10310,30641,260000,"[u'post-punk', u'indie', u'70s', u'punk', u'alternative', u'alternative rock', u'Alternative  Punk', u'Awesome', u'quirky', u'space', u'halloween', u'good7', u'awesome songs', u'fondation', u'mond', u'Lauf']"
201,Dice Man,11508,36834,105000,"[u'70s', u'punk', u'favorites', u'post-punk', u'great lyrics', u'fav', u'Remember', u'books', u'sing', u'under two minutes', u'another planet', u'virgin prunes', u'good1', u'mind bending', u'glorious vocals', u'balls on the line', u'favorite the fall songs', u'all time great songs']"
202,Printhead,10371,30874,177000,"[u'post-punk', u'The Fall', u'experimental', u'new wave', u'somafm', u'Bagel', u'UK Independent', u'UK Punk and New Wave', u'good6', u'kopf', u'Lauf', u'favorite the fall songs']"
203,A Figure Walks,10206,30644,365000,"[u'postpunk', u'transport', u'HappySad', u'good7', u'Oktober', u'Multi Dash']"
204,Psykick Dance Hall,7023,19309,229000,"[u'post-punk', u'Experimental Rock', u'postpunk', u'Manchester', u'4', u'Pre-and-Post Punk', u'good9', u'avant confrontational kraut art attack post-punk', u'favorite the fall songs']"
205,Still Together,82852,503702,219000,"[u'indie', u'rock', u'indie rock', u'singer-songwriter', u'cute', u'acoustic', u'Canadian', u'montreal', u'2012', u'10s', u'best of 2012', u'captured tracks', u'kiki', u'fungo']"
206,Boe Zaah,78512,510557,102000,"[u'indie', u'rock', u'instrumental', u'indie rock', u'singer-songwriter', u'Canadian', u'montreal', u'2012', u'10s', u'captured tracks', u'a couple of instrumentals', u'caminar', u'if the stars had a sound']"
207,Robson Girl,85585,618294,176000,"[u'rock', u'indie', u'indie rock', u'post-punk', u'Canadian', u'Surf', u'experimental', u'post-rock', u'singer-songwriter', u'Stoner Rock', u'canada', u'Lo-Fi', u'jangle pop', u'Experimental pop', u'art rock', u'Mellow', u'favourite', u'glam', u'Psychedelic Rock', u'montreal', u'2012', u'10s', u'best of 2012', u'Neo-Psychedelia', u'perfecto', u'surf pop', u'art pop', u'captured tracks', u'beach pop', u'beach rock', u'tranca', u'if the stars had a sound', u'mansibal', u'sound of magic orgasm ejecutated on guitar']"
208,Ode to Viceroy,145898,1218579,234000,"[u'rock', u'Canadian', u'2012', u'best of 2012', u'indie', u'Lo-Fi', u'post-punk', u'psychedelic', u'similar to: pavement', u'chill', u'Surf', u'experimental', u'indie rock', u'singer-songwriter', u'Stoner Rock', u'canada', u'new wave', u'jangle pop', u'quirky', u'favourite', u'glam', u'fun', u'garage', u'suave', u'montreal', u'Beach', u'road trip', u'10s', u'2010s', u'Neo-Psychedelia', u'hypnagogic pop', u'perfecto', u'garage pop', u'surf pop', u'captured tracks', u'beach pop', u'beach rock', u'stoner pop', u'bubble pop', u'Darts', u'maciej', u':sunday morning', u'gr cw3', u'AI MEU KOKORO', u'dance floor - pocket', u'similar to: pale blue eyes by the velvet underground', u'transpottingear', u'they mentioned cigarettes', u'mansibal', u'Cigarettecore']"
209,Freaking Out the Neighborhood,117972,1002490,174000,"[u'Lo-Fi', u'rock', u'similar to: pavement', u'love at first listen', u'2012', u'seen live', u'indie', u'80s', u'indie pop', u'indie rock', u'singer-songwriter', u'post-punk', u'Canadian', u'summer', u'relaxing', u'fip', u'montreal', u'roadtrip', u'10s', u'best of 2012', u'perfecto', u'lennon', u'later', u'captured tracks', u'puts me in a good mood', u'suburbs', u'cool as fuck and even better', u'badass jammers', u'good trip', u'80s-influenced', u'2 cool 4 skool', u'Top ten songs of all time', u'actual favorite', u'la sube', u'cool as fuck guitar', u'superguitarsolo', u'mansibal', u'i love this song i love him', u'feel like freaking out this neighborhood haha', u'whoooa', u'pxs friends: loved', u'ed edd n eddy']"
210,Dreaming,100330,763550,147000,"[u'indie', u'indie rock', u'Canadian', u'chill', u'rock', u'Surf', u'experimental', u'singer-songwriter', u'Stoner Rock', u'canada', u'sadcore', u'Lo-Fi', u'post-punk', u'jangle pop', u'psychedelic pop', u'quirky', u'Avant-Garde', u'art rock', u'glam', u'montreal', u'surf rock', u'2012', u'10s', u'magic', u'best of 2012', u'Neo-Psychedelia', u'hypnagogic pop', u'stoned', u'surf pop', u'art pop', u'slacker rock', u'real love', u'captured tracks', u'slacker anthem', u'if the stars had a sound', u'Mac Demarco', u'dreaaaaaamin', u'sun glaring off hot concrete']"
211,Sherrill,80505,511499,150000,"[u'indie', u'rock', u'indie rock', u'singer-songwriter', u'Canadian', u'Berlin', u'montreal', u'love at first listen', u'2012', u'personal favourites', u'10', u'captured tracks', u'Mac Demarco']"
212,Annie,94261,703472,191000,"[u'indie', u'rock', u'Canadian', u'experimental', u'indie rock', u'singer-songwriter', u'post-punk', u'montreal', u'chill', u'folk', u'Surf', u'post-rock', u'canada', u'sadcore', u'Lo-Fi', u'jangle pop', u'psychedelic pop', u'Avant-Garde', u'synthpop', u'Garage Rock', u'glam', u'fip', u'garage', u'indie folk', u'surf rock', u'dreampop', u'2012', u'10s', u'best of 2012', u'Neo-Psychedelia', u'hypnagogic pop', u'perfecto', u'garage pop', u'surf pop', u'neo-folk', u'Post-punk revival', u'art pop', u'captured tracks', u'surfgaze', u'tell me your first name', u'Jizz Jazz', u'bici', u'if the stars had a sound', u'la sube', u'mansibal', u'ana songs', u'pxs friends: loved']"
213,Sweet Head,25962,98603,254000,"[u'glam rock', u'classic rock', u'rock', u'70s', u'david bowie', u'glam', u'british', u'guitar', u'Energetic', u'rockabilly', u'alternative', u'pop rock', u'Awesome', u'amazing', u'favourite', u'sex', u'fip', u'cool', u'proto-punk', u'Favourites', u'poprock', u'dancing', u'bowie', u'untaggedhome', u'mick ronson', u'songs about fellatio', u'played on the bat and the bird', u'bowie at his best', u'trevor bolder', u'Mick Woodmansey', u'Radiotsar approved', u'Till there was rock', u'you only had god']"
214,Telephone Play No. 1,8546,25447,75000,[]
215,Red Comes In Many Shades,7519,24635,312000,[]
216,Sed Knife,8109,27803,161000,"[u'indie pop', u'somafm', u'Bagel']"
217,Navy & Cream,7250,25296,253000,"[u'Cocteau Twins', u'vaporwave']"
218,New Age Thriller,8879,34099,298000,"[u'psychedelic pop', u'synth', u'synthpop', u'hypnagogic pop']"
219,Sororal Feelings,12223,42943,177000,"[u'somafm', u'Bagel']"
220,Island Song,17101,70003,252000,"[u'psychedelic', u'prda', u'absolutely amazing', u'Es regnet Kaviar', u'choose the moment from which to look back or ahead']"
221,Window Shades,19612,70293,281000,[u'ktcth']
222,Lady Madonna - Remastered 2015,25843,54371,0,[]
223,"Hello, Goodbye - Remastered 2015",29729,62421,0,[]
224,Alberto Balsam,31285,140634,0,"[u'electronic', u'idm', u'chillout', u'electronica', u'ambient', u'genius', u'experimental', u'chill', u'instrumental', u'british', u'downtempo', u'UK', u'Love', u'Awesome', u'night', u'90s', u'late night', u'Favorite', u'Europe', u'play this at my funeral', u'brilliant', u'love at first listen', u'mistagged', u'interesante', u'fotomotor', u'eargasms', u'tracks', u'1995', u'european', u'the morning after', u'evocative', u'mistagged track', u'nattmusik', u'incorrectly tagged', u'music to melt to', u'fucking great', u'life is easy', u'mistagged title', u'music for a rainy summer day', u'favourite aphex twin songs', u'theta inducing', u'radio europe', u'3am songs', u'the word limit', u'suaaaave', u'nightdrive', u'oscuro', u'fotomotor-nightdrive', u'electronic luxury', u'walk down a memory lane']"
225,All You Need Is Love - Remastered 2015,32566,68546,0,[]
226,Penny Lane - Remastered 2015,31658,68752,0,[]
227,Eleanor Rigby - Remastered 2015,34300,82358,0,[]
228,Yellow Submarine - Remastered 2015,30950,65304,0,[]
229,Paperback Writer - Remastered 2015,29243,60812,0,[]
230,Hold Me Dancin',1149,3027,173000,[u'truncation and elision']
231,Shine,1237,2958,184000,[u'soft pop']
232,California Shake,7444,23061,208000,"[u'indie', u'pop', u'alternative', u'psychedelic pop', u'sunshine pop', u'psychedelic', u'folk rock', u'post-revolutionary pop song', u'Miscellaneous', u'barefoot', u'Avantgarde Pop', u'folkpop', u'le beat electrique', u'french pop 60s']"
233,I'd Like to See the Bad Guys Win,1478,4262,104000,"[u'pop', u'cute', u'whisper-quiet', u'krampus taint']"
234,Yes I Am,1309,3153,191000,"[u'modest comebacks', u'msixties pop']"
235,Please Believe Me,1211,3194,234000,[]
236,The Hum,1460,3867,165000,"[u'pop', u'psychedelic pop', u'sunshine pop', u'psychedelic', u'folkpop']"
237,I Think a Lot About You,3754,11084,138000,"[u'psychedelic pop', u'60s pop', u'mixtapes']"
238,Values,1330,3099,153000,[]
239,It's Alright Now,3572,9949,122000,"[u'pop', u'60s', u'psychedelic pop', u'sunshine pop', u'psychedelic folk', u'folkpop', u'OK FM']"
240,Timothy Gone,4709,16292,106000,"[u'60s', u'psychedelic pop', u'pop', u'folk', u'favorites', u'sunshine pop', u'psychedelic', u'Discoveries', u'dreamy sun', u'folkpop', u'aibolits traumschloss', u'aibolits kindergarten']"
241,Come to Me Slowly,2447,8009,143000,"[u'soft', u'msixties pop']"
242,I Don't Intend to Spend Christmas Without You,2779,6964,140000,"[u'christmas', u'xmas', u'christmas islands', u'doowop party']"
243,Thoughts,7264,24343,135000,"[u'1968', u'60s', u'baroque pop', u'psychedelic pop', u'60s pop', u'barefoot', u'le beat electrique', u'msixties pop']"
244,Love Songs,8986,32759,155000,"[u'folk', u'female vocalists', u'psychedelic', u'pop', u'60s', u'pop rock', u'psychedelic pop', u'sunshine pop', u'Psychedelic Rock', u'fip', u'singer-songwriters', u'dreamy sun', u'folkpop', u'barefoot in the park', u'mo rio mood', u'msixties pop']"
245,The 8:17 Northbound Success Merry-Go-Round,1055,2741,130000,[]
246,Most of My Life,1648,4240,131000,[]
247,Sun,9875,34592,156000,"[u'psychedelic pop', u'sunshine pop', u'summer', u'pop', u'60s', u'folk', u'pop rock', u'psychedelic', u'1968', u'dreamy sun', u'folkpop', u'le beat electrique', u'Oli through the Looking Glass', u'bicycle bells and buckets', u'Playlist: Plenty of Sunshine Heading My Way', u'msixties pop']"
248,Think of Rain,7517,24841,142000,"[u'rain', u'pop', u'60s', u'soft rock', u'folk', u'baroque pop', u'psychedelic pop', u'sunshine pop', u'folkpop', u'la maree haute', u'for the rain', u'msixties pop', u'regen mix']"
249,Can You Tell,6467,21045,150000,"[u'sunshine pop', u'vocal', u'60s', u'folk', u'piano', u'psychedelic pop', u'psychedelic', u'orchestral', u'1968', u'60s pop', u'Beatlesque', u'Margo Guryan', u'Twee twee twiddle-lee-dee', u'hippy-dippy', u'msixties pop']"
