,Songs,Listeners,Playcount,Duration,Tags
591,She's Lost Control,612933,5305116,249000,"[u'post-punk', u'new wave', u'alternative', u'80s', u'Joy Division', u'british', u'rock', u'Post punk', u'indie', u'dark', u'70s', u'Manchester', u'darkwave', u'goth', u'Ian Curtis', u'alternative rock', u'depressing', u'cold wave', u'Gothic Rock', u'electronic', u'indie rock', u'favorites', u'sad', u'UK', u'Gothic', u'punk rock', u'punk', u'intense', u'dark wave', u'Favourites', u'1979', u'Favourite Songs', u'Soundtrack Of My Life', u'classic rock', u'Recommended', u'skins', u'haunting', u'favourite', u'kickasstic', u'pay attention', u'sexy', u'Love', u'beautiful', u'melancholic', u'Favorite', u'drinking in the dark', u'Soundtrack', u'psychedelic', u'bass', u'hypnotic']"
592,Novelty,197872,973924,239000,"[u'post-punk', u'new wave', u'80s', u'alternative', u'Joy Division', u'rock', u'british', u'punk', u'Gothic', u'goth', u'Post punk', u'Manchester', u'indie', u'70s', u'dark', u'factory', u'british i like', u'alternative rock', u'UK', u'punk rock', u'Morose Deep dilate Crimson', u""80's"", u'angst', u'great intros', u'All-Time Favorites', u'what is rock exactly and does it matter', u'songs to kill yourself to', u'pop', u'electro', u'depressed', u'Alternative  Punk', u'novelty', u'Gothic Rock', u'wave', u'Favorite', u'friendsofthekingofrummelpop', u'gloomy', u'antial', u'vibrant', u'nowa fala', u'Pre-and-Post Punk', u'i love singing along', u'no love lost', u'dark life', u'classic rock', u'metal', u'chillout', u'sexy', u'energy', u'Love']"
593,No Love Lost,228910,1330104,223000,"[u'post-punk', u'new wave', u'rock', u'alternative', u'Joy Division', u'punk', u'british', u'Post punk', u'Manchester', u'70s', u'dark', u'punk rock', u'Gothic Rock', u'darkwave', u'80s', u'indie rock', u'alternative rock', u'goth', u'factory', u'indie', u'UK', u'british i like', u'classic rock', u'Gothic', u'beautiful', u'dark wave', u'dum dum dum', u'Love', u'Avant-Garde', u'cold wave', u'Excellent tune', u'no love lost', u'loved', u'hate', u'madchester', u'Control', u'Ian Curtis', u'meaningful lyrics', u""70's"", u'great rhythm section', u'my favorite songs', u'records and tapes', u'psychedelic alternatif rock', u'test', u'classic', u'favorite songs', u'experimental', u'indie pop', u'noise rock', u'dance']"
594,Love Will Tear Us Apart,1044643,9196025,207000,"[u'post-punk', u'new wave', u'80s', u'alternative', u'Joy Division', u'british', u'rock', u'indie', u'Love', u'Post punk', u'melancholy', u'Manchester', u'sad', u'alternative rock', u'punk', u'favorites', u'dark', u'indie rock', u'classic', u'Gothic', u'beautiful', u'classic rock', u'Donnie Darko', u'Favourite Songs', u'Favourites', u'Love Will Tear Us Apart', u'Soundtrack', u'electronic', u'genius', u'melancholic', u'70s', u'goth', u'Awesome', u'1980', u'darkwave', u'UK', u'love at first listen', u'Ian Curtis', u'male vocalists', u'songs not to play at your wedding', u'pop', u'Gothic Rock', u'dance', u'cold wave', u'atmospheric', u'favorite songs', u'england', u'favourite', u'Favorite', u'britpop']"
595,Leaders of Men,220318,1183809,155000,"[u'post-punk', u'new wave', u'alternative', u'rock', u'Joy Division', u'british', u'punk', u'70s', u'80s', u'Manchester', u'Post punk', u'indie', u'goth', u'punk rock', u'Ian Curtis', u'alternative rock', u'Gothic', u'cold wave', u'british i like', u'antial', u'classic rock', u'UK', u'dead cool', u'leaders of men', u'Mellow', u'Gothic Rock', u""70's"", u'britannique', u'Pre-and-Post Punk', u'I want back to the 80s', u'joy division - leaders of men', u'pop', u'classic', u'indie rock', u'Love', u'dark', u'Lo-Fi', u'beautiful', u'psychedelic', u'Retro', u'england', u'3', u'spoken word', u'introspective', u'1978', u'1', u'political', u'amazing', u'favourite', u'darkwave']"
596,Komakino,148154,608757,232000,"[u'post-punk', u'new wave', u'rock', u'british', u'Joy Division', u'indie', u'80s', u'alternative', u'alternative rock', u'punk', u'cold wave', u'british i like', u'dark', u'Manchester', u'Morose Deep dilate Crimson', u'Gothic', u'beautiful', u'goth rock', u'where is my mind', u'classic rock', u'compulsive repeat listenings', u'antial', u'where is my bong', u'by bass be driven', u'dark life', u'chill', u'70s', u'instrumental', u'goth', u'vampire', u'indie rock', u'Electroclash', u'singer-songwriter', u'UK', u'memories', u'Experimental Rock', u'Post punk', u'Awesome', u'drums', u'Retro', u'Justin Timberlake', u'postpunk', u'punk rock', u'melancholy', u'depressing', u'Gothic Rock', u'factory', u'songs i love', u'dark wave', u'mine']"
597,Incubation,229790,1111923,172000,"[u'post-punk', u'instrumental', u'new wave', u'rock', u'80s', u'alternative', u'british', u'Joy Division', u'indie', u'punk', u'alternative rock', u'Manchester', u'british i like', u'indie rock', u'UK', u'Post punk', u'punk rock', u'Gothic Rock', u'factory', u'classic rock', u'goth', u'Mellow', u'brit rock', u'cold wave', u'goth rock', u'Solomusika-Loved', u'shazam rock', u'70s', u'vampire', u'experimental', u'sexy', u'New-Wave', u'electro', u'omg', u'dark', u'industrial', u'Experimental Rock', u'Gothic', u'shoegaze', u'instrumental rock', u'groove', u'Retro', u'great', u'space rock', u'motorik', u'cyberpunk', u'ebm', u'darkwave', u'loved', u'cool']"
598,Glass,206968,999067,235000,"[u'post-punk', u'new wave', u'rock', u'alternative', u'british', u'Joy Division', u'punk', u'80s', u'Manchester', u'cold wave', u'indie', u'goth', u'british i like', u'handclaps', u'Morose Deep dilate Crimson', u'alternative rock', u'indie rock', u'UK', u'Post punk', u'punk rock', u'depressive', u'classic rock', u'70s', u'antial', u'vampire', u'indie pop', u'dark', u'Experimental Rock', u'Alternative  Punk', u'britpop', u'Gothic', u'other', u'beautiful', u'Awesome', u'Retro', u'club', u'genius', u'darkwave', u'male vocalists', u'hand claps', u""80's"", u'Gothic Rock', u'best song ever', u'factory', u'madchester', u'Favorite', u'english', u'sparse', u'three', u'4 Stars']"
599,From Safety to Where...?,48292,196922,147000,"[u'post-punk', u'new wave', u'alternative', u'british i like', u'indie', u'Alternative  Punk', u'lovelovelove', u'classic rock', u'rock', u'70s', u'favorite songs', u'favorites', u'industrial', u'Retro', u'factory', u'shit', u'Perfection', u'title is a full sentence', u'Ian Curtis', u'Legendary', u'all time favorites', u'question mark', u'cold core', u'my favorite songs', u'posh', u'77davez-all-tracks', u'Solomusika-Loved', u'Out of Space', u'good question', u'garage days', u'postpunkgdchill', u'songs that make me think', u'my secret agent lover man', u'stupid questions', u'music is magic', u'punk delights']"
600,Failures,185109,901839,224000,"[u'post-punk', u'new wave', u'punk', u'rock', u'alternative', u'british', u'Joy Division', u'70s', u'Manchester', u'punk rock', u'alternative rock', u'Post punk', u'indie', u'80s', u'Ian Curtis', u'indie rock', u'dark wave', u'british i like', u'UK', u'socio-political', u'Morose Deep dilate Crimson', u'Energetic', u'Garage Rock', u'factory', u'lizvelrene postpunk', u'classic rock', u'Hard', u'John Peel', u'classic music', u'Losing My Edge', u'gw rock', u'goth', u'grindcore', u'fast', u'hard rock', u'epic', u'dark', u'beautiful', u'Retro', u'Favorite Artists', u'darkwave', u'f', u'garage', u'raw', u'underrated', u'Gothic Rock', u'Favorite', u'guitar virtuoso', u'Favourites', u'hits']"
601,Digital,372316,2304498,169000,"[u'post-punk', u'new wave', u'alternative', u'british', u'Joy Division', u'rock', u'80s', u'Manchester', u'punk', u'alternative rock', u'70s', u'indie', u'Post punk', u'Gothic', u'indie rock', u'Ian Curtis', u'dark', u'punk rock', u'darkwave', u'Gothic Rock', u'dance music for darkened floors', u'day in day out day in day out', u'Love', u'beautiful', u'male vocalists', u'perfect', u'british i like', u'classic rock', u'goth', u'UK', u'favorites', u'Morose Deep dilate Crimson', u'digital', u'Alternative  Punk', u'Awesome', u'great', u'melancholic', u'brit rock', u'Favorite', u'best', u'all time favorites', u'involuntary movement of body parts', u'good ghosts from the past', u'lizvelrene postpunk', u'incomparable', u'Digital Quirkiness', u'johnnytop', u'experimental', u'psychedelic', u'Retro']"
602,Dead Souls,402015,2456124,290000,"[u'post-punk', u'new wave', u'80s', u'alternative', u'Joy Division', u'rock', u'british', u'alternative rock', u'indie', u'punk', u'Post punk', u'dark', u'Gothic', u'Gothic Rock', u'goth', u'Manchester', u'dark wave', u'70s', u'lovedbygdchill', u'UK', u'punk rock', u'indie rock', u'favorites', u'intense', u'darkwave', u'Favourites', u'halloween', u'Ian Curtis', u'antial', u'Awesome', u'melancholy', u'cold wave', u'british i like', u'serial killer soundtrack', u'soundtrackgdchill', u'dead souls', u'Soundtrack', u'sad', u'industrial', u'factory records', u'1980', u'best songs ever', u'a place for people with that tiny black spot on their brain to go when the darkness leaks out and does what it wills', u'neatneatneat', u'classic rock', u'dance', u'Love', u'beautiful', u'psychedelic', u'england']"
603,Autosuggestion,152470,691215,368000,"[u'post-punk', u'new wave', u'rock', u'80s', u'Joy Division', u'alternative', u'british', u'Post punk', u'punk', u'alternative rock', u'goth', u'british i like', u'cool trip', u'Gothic', u'Manchester', u'Ian Curtis', u'Glitter Grind and Static', u'indie', u'male vocalists', u'Gothic Rock', u'cold wave', u'silent intensity', u'i feel high just listening to this', u'blaengar', u'70s', u'UK', u'Mellow', u'1979', u'all time favorites', u'77davez-all-tracks', u'antial', u'where is my bong', u'substance', u'shugaze', u'pop lament', u'Solomusika-TheBest4Me', u'electronic', u'pop', u'classic', u'electro', u'favorites', u'dark', u'college rock', u'Experimental Rock', u'Alternative  Punk', u'psychedelic', u'90s', u'great', u'punk rock', u'b-side']"
604,Atmosphere,432776,2906771,287000,"[u'post-punk', u'new wave', u'alternative', u'80s', u'british', u'rock', u'atmospheric', u'Joy Division', u'sad', u'melancholy', u'beautiful', u'doomed', u'somafm', u'Post punk', u'epic', u'Manchester', u'genius', u'darkwave', u'alternative rock', u'dark', u'melancholic', u'indie', u'Soundtrack', u'UK', u'classic', u'goth', u'Gothic Rock', u'Heartbreaking', u'haunting', u'cold wave', u'perfect', u'Favourite Songs', u'1980', u'Ian Curtis', u'70s', u'Mellow', u'Atmosphere', u'Gothic', u'best songs ever', u'factory records', u'Control', u'lovedbygdchill', u'you are alone', u'electronic', u'favourite', u'punk', u'ambient', u'memories', u'amazing', u'great lyrics']"
605,Batu,37229,152721,376000,"[u'Post-Metal', u'instrumental', u'post-rock', u'atmospheric', u'metal', u'experimental', u'bass', u'drums', u'Masterpiece']"
606,Atackla,41534,176228,447000,"[u'Post-Metal', u'instrumental', u'experimental', u'post-rock', u'metal', u'bass', u'drums', u'atmospheric', u'spiritual']"
607,Schiphol,44727,198502,375000,"[u'post-rock', u'instrumental', u'Post-Metal', u'math rock', u'experimental', u'drums', u'epic', u'instrumental rock', u'melancholic', u'post rock', u'Favorite', u'instrumental post-rock', u'Eargasm', u'powerful', u'airport', u'spelled wrong']"
608,MlÃ¡dek,1273,6557,459000,"[u'instrumental', u'math rock', u'post-rock', u'bass', u'drums', u'true love', u'Post-Metal', u'vivacubalibre loved tracks']"
609,309,51205,235731,529000,"[u'post-rock', u'Post-Metal', u'instrumental', u'black metal', u'metal', u'indie', u'rock', u'math rock', u'experimental', u'indie rock', u'bass', u'drums', u'Progressive', u'chicago', u'2011', u'10s', u'420', u'crushing', u'sargent house', u'for howisya to hear', u'Russian Circles', u'mainplaylist']"
610,Malko,55446,293565,283000,"[u'post-rock', u'Post-Metal', u'instrumental', u'Progressive', u'drums', u'post-rock underground full tracks', u'hardcore', u'experimental', u'Progressive rock', u'bass', u'post rock', u'post metal', u'geneva', u'holy shit awesome', u'sonic fetish', u'Russian Circles', u'emperorcryn', u'k1r7m']"
611,Hexed All,54849,290414,270000,"[u'post-rock', u'instrumental', u'Mellow', u'post rock', u'Post-Metal', u'ambient', u'beautiful', u'post-rock underground full tracks', u'Russian Circles', u'alternative', u'calm', u'american', u'Like', u'instrumenta', u'ruhig', u'music to fall asleep to', u'geneva', u'dreaming about nothing', u'good sleeping music', u'hexed all', u'giusychevola gifts from friends']"
612,Melee,58168,310412,459000,"[u'post-rock', u'instrumental', u'Post-Metal', u'drums', u'drone', u'post rock', u'study', u'post-rock underground full tracks', u'alternative', u'ambient', u'experimental', u'2009', u'Progressive rock', u'violins', u'intense', u'Favorite', u'instrumental post-rock', u'2000s', u'Stunning', u'study music', u'Arguman-loved tracks', u'geneva', u'lovedbybeyondwithin', u'Top1000', u'songs to download', u'Post Rock Instrumental', u'Russian Circles', u'may cause a seizure', u'wtf is a tag i dont know', u'rdfv']"
613,Geneva,64639,367537,347000,"[u'post-rock', u'instrumental', u'Post-Metal', u'Sludge', u'2009', u'post rock', u'holy shit', u'song for the armageddon', u'bass', u'post-rock underground full tracks', u'geneva', u'Russian Circles', u'4jspostmetal', u':deceptionpoint', u'heavy metal', u'seen live', u'dark', u'drums', u'drone', u'00s', u'chaos', u'sludge metal', u'2000s', u'fantasy', u'badass', u'true love', u'godly', u'HFSILT', u'over 5 minutes long', u'Q4', u'Arguman-loved tracks', u'Game Boss Music and stuff that would work well as it', u'would work as a video game boss theme', u'dat bass', u'postrockig', u'q4jslfm', u'nightmare vision', u'aguante', u'dirty dirty bass', u'Soothe me feather', u'salvomivida', u'herr rafal', u'9207']"
614,Fathom,64874,347476,295000,"[u'post-rock', u'instrumental', u'Post-Metal', u'hardcore', u'indie rock', u'2009', u'Sludge', u'amazing', u'post rock', u'post-rock underground full tracks', u'kick ass bass', u'dead space 2', u'4jspostmetal', u'q5jslfm', u':deceptionpoint', u'heavy metal', u'rock', u'Progressive metal', u'dark', u'instrumental rock', u'guitar', u'drone', u'instrumental post-rock', u'Eargasm', u'2000s', u'Arguman-loved tracks', u'2009 albums', u'geneva', u'zarf', u'naba', u'amazing bass', u'niceness', u'arsivde', u'3rd album', u'Russian Circles', u'nightmare vision', u'4fb', u'fathom', u'Soothe me feather', u'amazing drumms', u'mainplaylist', u'k1r7m']"
615,Philos,46699,226540,626000,"[u'post-rock', u'Post-Metal', u'instrumental', u'melancholy', u'post-rock underground full tracks', u'ambient', u'Progressive metal', u'dark', u'post rock', u'great intros', u'duyster', u'Songs over 10 minutes long', u'nightmare vision', u'Da scaricare']"
616,When the Mountain Comes to Muhammad,49641,246497,480000,"[u'post-rock', u'instrumental', u'melancholic', u'Post-Metal', u'post-rock underground full tracks', u'chillout', u'alternative', u'2009', u'Progressive metal', u'post rock', u'2000s', u'ugh', u'names', u'geneva', u'All The Number Ones', u'Russian Circles', u'chapot', u'giusychevola gifts from friends', u'kappe classic', u'kappe metall', u'Owned and Operated', u'emperorcryn']"
617,Sirens,1601,4813,445000,[u'micah']
618,Search and Replace,763,2312,194000,[]
619,Fragment/Fatigue,748,2368,276000,[]
620,Kaleidoscoped,1088,3541,216000,"[u'post-punk', u'coldwave', u'4 Stars']"
621,Memory Work,1131,3658,254000,"[u'Awesome', u'darkwave', u'coldwave', u'best of 2014']"
622,In Images,714,2080,95000,[]
623,La foi au fil de l'eau,525,1606,184000,[]
624,Cold Fascination,661,2057,252000,[]
625,Loss of Sensation,557,2120,241000,[]
626,Observatory Time,653,1971,236000,[]
627,Succession,837,2651,264000,[]
628,Merge,889,2907,169000,[u'batsinthebelfryradio']
629,Haunted Summer,633,2625,334000,[]
630,Gipfelrausch,402,1947,556000,[]
631,Phantasmagoria,470,2424,374000,[]
632,Calling Of The Shades,459,2430,221000,[]
633,The Curse Of Bryon,408,2238,0,[]
634,The Goat Head,510,2832,274000,[u'trance']
635,Danaus Plexippus,639,4500,207000,[]
636,Cloak Of Dispersion,544,2701,274000,[]
637,Stygian,649,3429,199000,[]
638,Atackla,41534,176228,447000,"[u'Post-Metal', u'instrumental', u'experimental', u'post-rock', u'metal', u'bass', u'drums', u'atmospheric', u'spiritual']"
639,Schiphol,44727,198502,375000,"[u'post-rock', u'instrumental', u'Post-Metal', u'math rock', u'experimental', u'drums', u'epic', u'instrumental rock', u'melancholic', u'post rock', u'Favorite', u'instrumental post-rock', u'Eargasm', u'powerful', u'airport', u'spelled wrong']"
640,MlÃ¡dek,1273,6557,459000,"[u'instrumental', u'math rock', u'post-rock', u'bass', u'drums', u'true love', u'Post-Metal', u'vivacubalibre loved tracks']"
641,309,51205,235731,529000,"[u'post-rock', u'Post-Metal', u'instrumental', u'black metal', u'metal', u'indie', u'rock', u'math rock', u'experimental', u'indie rock', u'bass', u'drums', u'Progressive', u'chicago', u'2011', u'10s', u'420', u'crushing', u'sargent house', u'for howisya to hear', u'Russian Circles', u'mainplaylist']"
642,Malko,55446,293565,283000,"[u'post-rock', u'Post-Metal', u'instrumental', u'Progressive', u'drums', u'post-rock underground full tracks', u'hardcore', u'experimental', u'Progressive rock', u'bass', u'post rock', u'post metal', u'geneva', u'holy shit awesome', u'sonic fetish', u'Russian Circles', u'emperorcryn', u'k1r7m']"
643,Hexed All,54849,290414,270000,"[u'post-rock', u'instrumental', u'Mellow', u'post rock', u'Post-Metal', u'ambient', u'beautiful', u'post-rock underground full tracks', u'Russian Circles', u'alternative', u'calm', u'american', u'Like', u'instrumenta', u'ruhig', u'music to fall asleep to', u'geneva', u'dreaming about nothing', u'good sleeping music', u'hexed all', u'giusychevola gifts from friends']"
644,Melee,58168,310412,459000,"[u'post-rock', u'instrumental', u'Post-Metal', u'drums', u'drone', u'post rock', u'study', u'post-rock underground full tracks', u'alternative', u'ambient', u'experimental', u'2009', u'Progressive rock', u'violins', u'intense', u'Favorite', u'instrumental post-rock', u'2000s', u'Stunning', u'study music', u'Arguman-loved tracks', u'geneva', u'lovedbybeyondwithin', u'Top1000', u'songs to download', u'Post Rock Instrumental', u'Russian Circles', u'may cause a seizure', u'wtf is a tag i dont know', u'rdfv']"
645,Geneva,64639,367537,347000,"[u'post-rock', u'instrumental', u'Post-Metal', u'Sludge', u'2009', u'post rock', u'holy shit', u'song for the armageddon', u'bass', u'post-rock underground full tracks', u'geneva', u'Russian Circles', u'4jspostmetal', u':deceptionpoint', u'heavy metal', u'seen live', u'dark', u'drums', u'drone', u'00s', u'chaos', u'sludge metal', u'2000s', u'fantasy', u'badass', u'true love', u'godly', u'HFSILT', u'over 5 minutes long', u'Q4', u'Arguman-loved tracks', u'Game Boss Music and stuff that would work well as it', u'would work as a video game boss theme', u'dat bass', u'postrockig', u'q4jslfm', u'nightmare vision', u'aguante', u'dirty dirty bass', u'Soothe me feather', u'salvomivida', u'herr rafal', u'9207']"
646,Fathom,64874,347476,295000,"[u'post-rock', u'instrumental', u'Post-Metal', u'hardcore', u'indie rock', u'2009', u'Sludge', u'amazing', u'post rock', u'post-rock underground full tracks', u'kick ass bass', u'dead space 2', u'4jspostmetal', u'q5jslfm', u':deceptionpoint', u'heavy metal', u'rock', u'Progressive metal', u'dark', u'instrumental rock', u'guitar', u'drone', u'instrumental post-rock', u'Eargasm', u'2000s', u'Arguman-loved tracks', u'2009 albums', u'geneva', u'zarf', u'naba', u'amazing bass', u'niceness', u'arsivde', u'3rd album', u'Russian Circles', u'nightmare vision', u'4fb', u'fathom', u'Soothe me feather', u'amazing drumms', u'mainplaylist', u'k1r7m']"
647,Philos,46699,226540,626000,"[u'post-rock', u'Post-Metal', u'instrumental', u'melancholy', u'post-rock underground full tracks', u'ambient', u'Progressive metal', u'dark', u'post rock', u'great intros', u'duyster', u'Songs over 10 minutes long', u'nightmare vision', u'Da scaricare']"
648,When the Mountain Comes to Muhammad,49641,246497,480000,"[u'post-rock', u'instrumental', u'melancholic', u'Post-Metal', u'post-rock underground full tracks', u'chillout', u'alternative', u'2009', u'Progressive metal', u'post rock', u'2000s', u'ugh', u'names', u'geneva', u'All The Number Ones', u'Russian Circles', u'chapot', u'giusychevola gifts from friends', u'kappe classic', u'kappe metall', u'Owned and Operated', u'emperorcryn']"
649,Sirens,1601,4813,445000,[u'micah']
650,If I Speak,7226,35103,233000,"[u'deathrock', u'Gothic Rock', u'goth', u'post-punk', u'Gothic', u'frank the baptist', u'seen live', u'00s', u'pirates', u'goth rock', u'batcave', u'discover', u'dark americana', u'strangeromanticdeadrockcave', u'transitglambat', u'22111991', u'221119912', u'Schuettel Dein Haar fuer mich', u'fresh from the grave', u'transittranquille']"
651,Interlude,153,593,102000,[]
652,The Gate,57449,263639,123000,"[u'new age', u'ambient', u'enigma', u'electronic', u'chillout', u'electronica', u'chill', u'pop', u'alternative', u'90s', u'spoken word', u'carl orff', u'female vocalists', u'techno', u'relaxing', u'relaxation', u'Fortuna', u'electronica roots', u'light synth fx', u'straight drum beats', u'Solomusika-Loved', u'unsyncopated ensemble rhythms', u'thickly layered production', u'extensive studio production', u'Classical Influences', u'tripped-out production', u'unmetered speech', u'a variety of synth sounds', u'a wet recording sound', u'downtempo influences', u'synth heavy arrangements', u'new age roots', u'orchestral arrangements', u'Storytelling Lyrics', u'a hand percussion layer', u'Orchestral Riffs', u'The Screen Behind The Mirror', u'Soundtrack', u'noise', u'trance', u'instrumental', u'down tempo', u'albums I own', u'new wave', u'easy listening', u'psychedelic', u'1', u'ethereal', u'spiritual', u'german']"
653,Silence Must Be Heard,100394,433872,286000,"[u'new age', u'ambient', u'chillout', u'enigma', u'electronic', u'electronica', u'female vocalists', u'world', u'german', u'chill', u'relaxing', u'relax', u'alternative', u'easy listening', u'90s', u'Mellow', u'spiritual', u'00s', u'silence must be heard', u'rock', u'instrumental', u'Progressive rock', u'Awesome', u'atmospheric', u'relaxation', u'french', u'pop', u'sexy', u'electro', u'favorites', u'bass', u'Driving', u'ethereal', u'melancholic', u'sex', u'cool', u'sensual', u'Dream', u'electrorock', u'deep techno', u'ambient trance', u'dream trance', u'Silkred-LovedAll', u'-New-Age-and-Ambient-', u'trance', u'classic rock', u'trip-hop', u'electropop', u'vocal', u'experimental']"
654,Between Mind & Heart,49299,217408,239000,"[u'new age', u'ambient', u'chillout', u'enigma', u'electronic', u'relaxing', u'pop', u'chill', u'instrumental', u'Dreamy', u'atmospheric', u'Mellow', u'electronica', u'Classical', u'experimental', u'female vocalists', u'calm', u'quiet storm', u'beautiful', u'Awesome', u'90s', u'peaceful', u'vangelis', u'great', u'ethereal', u'spiritual', u'Meditation', u'german', u'melancholic', u'hypnotic', u'Calming', u'male vocalists', u'warm', u'relaxation', u'work', u'7 of 10 stars', u'german artist', u'chant', u'comforting', u'enigmatic', u'mystic', u'contemporary instrumental', u'jarre', u'you love these', u'-New-Age-and-Ambient-', u'SND', u'between', u'piehti', u'listened', u'Club Dance']"
655,Camera Obscura,47139,355289,99000,"[u'new age', u'ambient', u'electronic', u'enigma', u'chillout', u'trance', u'electronica', u'Camera Obscura', u'pop', u'chill', u'intense', u'enigmatic', u'ambience', u'you love these', u'classical influence', u'-New-Age-and-Ambient-', u'-favorites-', u'vocal centric', u'alternative', u'experimental', u'fast', u'female vocalists', u'90s', u'Driving', u'3', u'covers', u'Mellow', u'ethereal', u'spiritual', u'german', u'relaxing', u'hypnotic', u'male vocalists', u'00s', u'Ambiente', u'Ambient Techno', u'relaxation', u'german artist', u'mystic', u'Monumental Dance', u'Favourite Music', u'ambiental', u'a', u'Favoritos', u'favoritas', u'primal', u'O Fortuna', u'o fortuna sample', u'listened', u'best of new age']"
656,Endless Quest,55892,236724,187000,"[u'new age', u'ambient', u'chillout', u'electronic', u'enigma', u'instrumental', u'chill', u'electronica', u'relaxing', u'relax', u'pop', u'Dreamy', u'ethereal', u'hypnotic', u'meditative', u'Favorite', u'enigmatic', u'mystic', u'endless quest', u'trance', u'alternative', u'experimental', u'female vocalists', u'downtempo', u'dance', u'Fusion', u'world', u'romantic', u'90s', u'introspective', u'Mellow', u'nostalgic', u'gentle', u'chilled', u'spiritual', u'german', u'World Music', u'good', u'heard on Pandora', u'00s', u'Ambient Techno', u'chill out', u'relaxation', u'sunset', u'music to fall asleep to', u'electronic top', u'10 of 10 stars', u'german artist', u'pan flute', u'ethnic fusion']"
657,The Screen Behind the Mirror,62109,269920,239000,"[u'new age', u'ambient', u'enigma', u'chillout', u'electronic', u'electronica', u'downtempo', u'enigmatic', u'pop', u'alternative', u'relaxation', u'chill', u'instrumental', u'90s', u'relaxing', u'relax', u'Soundtrack', u'trance', u'trip-hop', u'experimental', u'female vocalists', u'dance', u'House', u'Mellow', u'spiritual', u'german', u'Breathtaking', u'the secret behind the mirror', u'Enigmopodobne', u'hip hop', u'sexy', u'albums I own', u'electro', u'easy listening', u'Fusion', u'beautiful', u'bass', u'Dreamy', u'atmospheric', u'Like', u'ethereal', u'Meditation', u'hypnotic', u'complex', u'space music', u'f', u'vocal trance', u'good', u'male vocalists', u'mysterious']"
658,Traces,2270,5548,0,"[u'new age', u'ambient', u'chillout', u'electronica', u'electronic', u'enigma', u'trance', u'alternative', u'female vocalists', u'downtempo', u'electro', u'easy listening', u'Mellow', u'relaxing', u'celtic', u'relax', u'relaxation music', u'-New-Age-and-Ambient-', u'My Style', u'-yulunga-', u'The Screen Behind The Mirror', u'Enigmopodobne']"
