,Songs,Listeners,Playcount,Duration,Tags
583,Stop The Rain,9472,21158,268000,"[u'soul', u'sampled', u'funk', u'classic soul', u'acid jazz', u'average white band', u'funky', u'Gilles Peterson', u'Rainy Day', u'garage', u'Smooth Jazz', u'p-funk', u'ay', u'danny boy', u'cool grooves', u'UK soul', u'classic uk soul', u'FUNK FROM THE TRUNK', u'from vinyl to ipod', u'victor', u'str', u'summer deck', u'k-rainydayradio', u'kmem6700', u'ooooh deep', u'supper with friends', u'sampeln', u'DJPMan-loved-tracks', u'smu funk', u'djpman loved tracks']"
584,DJ Premier In Deep Concentration,8598,27774,193000,"[u'turntablism', u'hip hop', u'instrumental', u'dj premier', u'instrumental hip hop', u'Gang Starr', u'original turntablism', u'Hip-Hop', u'Gilles Peterson', u'1989', u'5 of 10 stars', u'Classic Hip Hop', u'where are my headphones', u'primo', u'Gang Star', u'beats for days', u'i know that sample', u'fun to rhyme over']"
585,Loose Booty,12436,33131,285000,"[u'funk', u'p-funk', u'soul', u'70s', u'rock', u'clean', u'psychedelic', u'Dope', u'detroit', u'genius', u'underground', u'funkadelic', u'sick beats', u'20th Century', u'old favorites', u'rhythm-blues', u'decadent', u'Classic soul and funk', u'Funk Tag', u'bootyshaker', u'intergalactic funk', u'neck-deep-in-fry-O-lator-grease FONK']"
586,Groove Is in the Heart,299947,1173832,210000,"[u'dance', u'90s', u'pop', u'funk', u'electronic', u'funky', u'Disco', u'party', u'House', u'1990', u'female vocalists', u'electronica', u'groove', u'fun', u'upbeat', u'groovy', u'Deee-Lite', u'happy', u'club', u'80s', u'one hit wonder', u'classic', u'catchy', u'cool', u'dance dance dance', u'bootsy collins', u'soul', u'electro', u'Love', u'dance-pop', u'party music', u""90's"", u'TELECFUNKNOHAUSINDUBSTRIPIALBREAKSTEP', u'alternative', u'female vocalist', u'Guilty Pleasures', u'Groove Is in the Heart', u'Baron Von Redberry', u'q-tip', u'70s80s', u'house hop', u'hip hop', u'rock', u'USA', u'favorites', u'psychedelic', u'feel good', u'Retro', u'summer', u'guilty pleasure']"
587,Slow Down,59570,148137,300000,"[u'Hip-Hop', u'hip hop', u'rap', u'brand nubian', u'hiphop', u'90s', u'new york', u'old school', u'old school rap', u'grand puba', u'Jazz Hop', u'east coast rap', u'Old School Hip Hop', u'Classic Hip Hop', u'intelligent hip hop', u'classic', u'underground hip-hop', u'Gangsta Rap', u'samples', u'90s Hip Hop', u'hip-hop and rap', u'real hip hop', u'hip-hop classics', u'Slow Down', u'sadat x', u'lord jamar', u'Golden Era Hip Hop', u'Simply a classic', u'hiphopapocrypha', u'pop', u'alternative', u'oldschool', u'nineties', u'classic hiphop', u'Pink Floyd', u'tight', u'oldskool', u'favourite', u'fun', u'fip', u'schaf', u'clssc rap', u'underground hip hop', u'i am a party girl here is my soundtrack', u'skate', u'true school', u'1990', u'alternative rap', u'native tongues', u'cl']"
588,BlahBludify,961,2193,153000,[]
589,C'Mon Children,4942,11798,188000,"[u'funk', u'70s', u'funky', u'title is imperative']"
590,Turned Away,4313,13235,250000,"[u'rnb', u'chuckii booker', u'soul', u'great percussion', u'new jack swing', u'80s soul', u'80s', u'1989', u'jazzysfunkmotownandmore', u'chucki booker', u'quiet storm', u'90s', u'funky', u'soulful', u'Favorite', u'Old School soul', u'sage', u'80s RnB', u'High School Memories', u'old school classic', u'slowjamz', u'chu', u'80s grooves', u'kk', u'groove to this', u'g-flat major', u'boys to men', u'soul tag', u'oquendo', u'funky tune s', u'DJPMan-loved-tracks', u'Chuckii Booker- Turned Away', u'West Side 1980']"
591,Countdown,109775,362208,141000,"[u'jazz', u'saxophone', u'free jazz', u'Hard Bop', u'john coltrane', u'bebop', u'Coltrane', u'60s', u'strings organs rubber wind', u'bop', u'sax', u'50s', u'miles davis', u'american', u'insane', u'complex', u'jazz saxophone', u'best fucking track ever', u'Virtuoso', u'jazz sax', u'1960', u'Jazz favorites', u'Instrumental Jazz Tag', u'slgdmjazz', u'MJ-Jazzin Giants', u'gimme sum giants', u'instrumental', u'USA', u'piano', u'blues', u'Tenor Sax', u'modal jazz', u'genius', u'smooth', u'jazzy', u'cool', u'heard on Pandora', u'laptop', u'anarchy', u'9 of 10 stars', u'freedom', u'classics', u'Masterpiece', u'10 of 10 stars', u'legends', u'cannonball adderley', u'classic jazz', u'eloquent', u'ecstatic', u'XAp']"
592,Tell Me What It Is,2317,6097,296000,"[u'funk', u'jazz funk', u'fip', u'Instrumental Jazz Tag']"
593,Fly With Wings Of Love,3207,8864,451000,"[u'Joe Sample', u'Smooth Jazz', u'instrumental', u'Fusion', u'jazz', u'Love', u'piano', u'Contemporary', u'contemporary jazz', u'songs i own', u'smooth jazz piano', u'Joe4']"
594,Wars of Armageddon,71953,175303,568000,"[u'funk', u'p-funk', u'soul', u'psychedelic', u'psychedelic funk', u'70s', u'groove', u'funkadelic', u'rock', u'Baron Von Redberry', u'wars of armageddon', u'cowbell', u'experimental', u'beautiful', u'Experi-MENTAL', u'Flowing Juices', u'eargasms', u'mind revolution', u'TELECFUNKNOHAUSINDUBSTRIPIALBREAKSTEP', u'tantotempotaste', u'afro armpit funk', u'tripfunk', u'vugube62', u'Psychedelic Rock', u'chaotic', u'apocalyptic', u'Rips my fucking soul apart', u'antidepressivo', u'as good as it gets', u'elvirisms fave', u'meeeow', u'dirty funk', u'weirdo', u'psychotic', u'Best band in the world', u'needs more cowbell', u'undoubtedly one of my faves ever', u'suppa duppa badass psychedelic funk crazy wah wah rock', u'mind-expanding', u'songs to listen when you get stoned', u'instrumental freak-out', u'Very Funky', u'funk out the yin-yang', u'moar cowbell', u'soul for the whole', u'Funk Tag', u'neu funk', u'favorite songs', u'noise rock', u'hard rock']"
595,Musicology,41327,175228,264000,"[u'funk', u'prince', u'soul', u'pop', u'dance', u'rock', u'funky', u'groove', u'rnb', u'urban', u'00s', u'80s', u'groovy', u'musicology', u'Hip-Hop', u'catchy', u'party', u'booty-shaker', u'Verbotene Liebe', u'Funk Tag', u'classic rock', u'metal', u'electronic', u'punk', u'rap', u'singer-songwriter', u'USA', u'energy', u'jazz-funk', u'psychedelic', u'2003', u'guitar', u'drums', u'Retro', u'morning', u'r and b', u'good shit', u'Garage Rock', u'fun', u'glam rock', u'fip', u'male vocalists', u'powerpop', u'Rock and Roll', u'vocal harmonies', u'interesting', u'surf rock', u'hot', u'brilliant', u'FM4']"
596,Mickey,114477,389375,216000,"[u'80s', u'pop', u'new wave', u'female vocalists', u'dance', u'One Hit Wonders', u'Toni Basil', u'mickey', u'rock', u'cheese', u'fun', u'female', u'happy', u'Guilty Pleasures', u'one hit wonder', u""80's"", u'1982', u'catchy', u'oldies', u'gay', u'1980s', u'cheerleader', u'cover', u'upbeat', u'party', u'female vocalist', u'silly', u'female vocals', u'guilty pleasure', u'bouncy', u'Favourite Songs', u'cheerleading', u'vugube62', u'Soundtrack', u'electronic', u'pop rock', u'favorites', u'synth pop', u'Awesome', u'Retro', u'american', u'covers', u'novelty', u'80', u'popular', u'Favourites', u'80s Pop', u'handclaps', u'1981', u'songs I absolutely love']"
597,Fan The Fire,5675,14562,0,"[u'funk', u'funky', u'soul', u'classic', u'70s', u'urban', u'trippy', u'heard on Pandora', u'eclectic', u'vocalization', u'Old School soul', u'influential', u'aint it funky', u'lyricism', u'favorite by this group', u'chicagoland', u'family act', u'Chi-Town Soul', u'fuoco', u'title is imperative']"
598,O.P.P.,88063,325618,95000,"[u'Hip-Hop', u'rap', u'90s', u'hip hop', u'old school', u'classic', u'american', u'1991', u'naughty by nature', u'east coast hip-hop', u'party', u'chill', u'anthems', u'pop', u'new york', u'clean', u'oldschool', u'dance', u'underground hip-hop', u'Dope', u'hiphop', u'NYC', u'nice', u'loved', u'good', u'samples', u'funny', u""90's"", u'english', u'true school', u'9 of 10 stars', u'nostalgia', u'lol', u'fotomotor', u'personal favourites', u'Excellent tune', u'1990s', u'Good Stuff', u'feelgood', u'Radio Music', u'Feel Good Music', u'sample', u'anthem', u'Old School Hip Hop', u'new jersey', u'acronyms', u'adultery', u'From: USA', u'old skool hip-hop tracks', u'90s Hip Hop']"
599,Hypnotize,604824,2219456,230000,"[u'rap', u'Hip-Hop', u'hip hop', u'Gangsta Rap', u'notorious big', u'90s', u'Hypnotize', u'Biggie', u'new york', u'american', u'1997', u'east coast hip hop', u'the notorious big', u'3', u'east coast rap', u'2pac', u'big', u'the pitchfork 500', u'pop', u'female vocalists', u'urban', u'funk', u'summer', u'party', u'NYC', u'old school', u'East Coast', u'4', u'Favorite', u'Best of', u'bad boy', u'New York City', u'misc', u'gute laune', u'whtd-FM', u'wjlb-FM', u'1990s', u'awesomeness', u'yeah', u'Pitchfork 500', u'bland', u'All', u'pr', u'40th-warmup', u'generic', u'adult', u'5 star songs', u'east coast hip-hop', u'Gangster Rap', u'iTunes']"
600,All for One,33338,80924,106000,"[u'Hip-Hop', u'hip hop', u'old school', u'classic', u'GTA IV', u'brand nubian', u'the classics', u'rap', u'underground hip hop', u'jazz-hop', u'Classic Hip Hop', u'STRICTLY FOR THE UNDERGOUND', u'beatfarm', u'da real old skool Hip Hop', u'the classics 104-1', u'chillout', u'80s', u'funk', u'hiphop', u'smooth', u'East Coast', u'DJ Mix', u'True Hip Hop', u'work songs', u'Jazz Hop', u'east coast rap', u'Faves', u'Real hip-hop', u'lyricist', u'stream', u'Grand Theft Auto', u'east-coast', u'Grand Theft Auto 4', u'wheelhouse', u'gta 4', u'1979-2006: A Hip-Hop Odyssey - 800 Tracks In A 48 Minute Mix', u'GTAIV tracks', u'metro funky', u'DA REAL UNDERGROUND OLD SKOOL HIP HOP', u'sadat x', u'EXTRA BUTTA', u'DJ Premier Productions', u'relaxo', u'grand puba', u'lord jamar', u'bizzlebeats', u'don m oldskool', u'less than satisfactory sampling', u'new radical chic', u'chill906']"
601,What I Like About You,167312,631068,176000,"[u'80s', u'rock', u'new wave', u'pop', u'power pop', u'classic rock', u'dance', u'pop rock', u'happy', u'fun', u'The Romantics', u'catchy', u'romantics', u'punk', u'Energetic', u'party', u'harmonica', u'1980', u'what i like about you', u'Soundtrack', u'favorites', u'upbeat', u'american', u'male vocalists', u'rock n roll', u'handclaps', u'70s', u'Awesome', u'guitar', u'oldies', u'Uplifting', u'powerpop', u'Rock and Roll', u'favs', u'clapping', u'dance around your bedroom', u'critically acclaimed song', u'acclaimed music top 3000 bubbling under', u'crowning moment of awesome', u'superrock kyoi', u'indie', u'alternative rock', u'fast', u'hard rock', u'USA', u'energy', u'folk-rock', u'acoustic', u'post-punk', u'bass']"
602,Love Shack,303397,1168963,322000,"[u'80s', u'pop', u'new wave', u'rock', u'dance', u'fun', u'alternative', u'party', u'happy', u'upbeat', u'female vocalists', u'1989', u'classic rock', u'the b-52s', u'quirky', u'love shack', u'pop rock', u'american', u'oldies', u'favorites', u'groovy', u""80's"", u'Love', u'catchy', u'male vocalists', u""B-52's"", u'post-punk', u'90s', u'i am a party girl here is my soundtrack', u'Rolling Stones Top 500 Songs of All Time', u'college rock', u'funk', u'funky', u'summer', u'Guilty Pleasures', u'singalong', u'B-52s', u'indie', u'classic', u'guilty pleasure', u'80s Pop', u'dance party', u'party rock', u'amayzes loved', u'dance around your bedroom', u'B52s', u'Disco', u'Post punk', u'Favorite Artists', u'Uplifting']"
603,You're Nobody (Til Somebody Kills You),40938,147973,293000,"[u'hip hop', u'Hip-Hop', u'rap', u'Gangsta Rap', u'east coast rap', u'the notorious big', u'classic', u'dark', u'90s', u'songs about death', u'biggie smalls', u'bad boy records', u'diddy', u'till somebody kills you', u'youre nobody']"
604,Hit It and Quit It,122271,392369,228000,"[u'funk', u'soul', u'p-funk', u'70s', u'psychedelic', u'Psychedelic Soul', u'Funk Rock', u'funky', u'rock', u'Psychedelic Rock', u'80s', u'funkadelic', u'psychedelic funk', u'vugube62', u'Hip-Hop', u'dance', u'blaxploitation', u'acid jazz', u'rhythm and blues', u'Favourites', u'lets dance', u'Slow Funk', u'carnival 2006 notting hill', u'notting hill carnival 2008', u'black music', u'fonky', u'Stoner Funk', u'7low', u'suppa duppa badass psychedelic funk crazy wah wah rock', u'fonk', u'funk love', u'funk out the yin-yang', u'Funk Tag', u'p-funk stylez', u'DSJ-loved-tracks', u'proto p-funk', u'groovy mood', u'classic rock', u'seen live', u'classic', u'hard rock', u'Driving', u'horns', u'george clinton', u'american', u'r&b', u'party', u'rnb', u'fip', u'garage']"
605,Frownland,78916,232653,99000,"[u'experimental', u'Avant-Garde', u'psychedelic', u'rock', u'Experimental Rock', u'60s', u'Psychedelic Rock', u'blues', u'Progressive rock', u'american', u'singer-songwriter', u'art rock', u'Captain Beefheart', u'classic rock', u'weird', u'Psychedelia', u'freak zone', u'hilarious', u'1969', u'frownland', u'instrumental', u'alternative', u'Hard', u'hard rock', u'acoustic', u'Fusion', u'blues-rock', u'guitar', u'quirky', u'improv', u'bluesy', u'freak', u'psych', u'Garage Rock', u'California', u'blues rock', u'garage', u'John Peel', u'proto-punk', u'4', u'anarchy', u'SCHEISSE', u'perfect', u'broken', u'inhuman', u'RIO', u'classic hard rock', u'Don', u'1960s', u'5']"
606,What Cha' Gonna Do For Me,27022,73133,233000,"[u'soul', u'funk', u'female vocalists', u'80s', u'chaka khan', u'rnb', u'RB', u'Disco', u'90s', u'groovy', u'female vocalist', u'80s soul', u'anthony jackson', u'jazz', u'pop', u'chill', u'classic', u'USA', u'dance', u'Driving', u'funky', u'Gilles Peterson', u'r&b', u'Mellow', u'fun', u'love songs', u'rhythm and blues', u'laptop', u'favorite by this singer', u'vocalization', u'Old School soul', u'legends', u'1981', u'Electric Bass', u'influential', u'attitude', u'My Favorites', u'tantotempotaste', u'Soul And RB', u'cool down', u'Soul Funk', u'slow jams tag', u'classic soul', u'sleek', u'rhythum and blues tag', u'favouritestreamable', u'topfavouritestreamable', u'the singles', u'old school groove', u'DANCEFLOOR CLASSICS']"
607,Bimini,9124,20055,358000,"[u'jazz', u'free jazz', u'alternative', u'Avant-Garde', u'drums', u'Big Band', u'sunday jazz', u'greater psychedelphia', u'spaceways']"
608,Pusherman,211619,717660,290000,"[u'funk', u'soul', u'70s', u'blaxploitation', u'Soundtrack', u'curtis mayfield', u'funky', u'drugs', u'pusherman', u'motown', u'rnb', u'classic soul', u'superfly', u'groove', u'oldies', u'groovy', u'1972', u'blues', u'rock', u'classic', u'singer-songwriter', u'rhythm and blues', u'blues n soul', u'Freaky Kicks Without Without', u'jazz funk', u'r and b', u'male vocalists', u'drug songs', u'jazzysfunkmotownandmore', u'smooth', u'cool', u'Old School soul', u'weed', u'Soul Funk', u'MetroHadriani Loves this music', u'Disco', u'jazz', u'american', u'funk soul', u'secretagent', u'soulfunk', u'Best of the best', u'Classic soul and funk', u'70s soul', u'funkgdchill', u'gdchills70s', u'afro armpit funk']"
609,Valdez in the Country,8865,32160,212000,"[u'funk', u'funky', u'soul', u'70s', u'instrumental', u'fip', u'Smooth Jazz', u'Old School soul', u'1973', u'aint it funky', u'Funk Tag']"
610,Soul Controller,1884,4678,265000,"[u'hiphop', u'native tongues', u'afrofuturism']"
611,I Swear,143948,505539,261000,"[u'90s', u'rnb', u'pop', u'Love', u'All-4-One', u'Ballad', u'love songs', u'romantic', u'slow jams', u'1994', u'soul', u'I swear', u'r&b', u'male vocalists', u'guilty pleasure', u'All 4 one', u'cover', u'jazzyslovedrnbsoul', u'90s soul', u'jazzyslovedtracks 2010B', u'Soundtrack', u'Hip-Hop', u'favorites', u'memories', u'beautiful', u'american', u'covers', u'smooth', u'emotional', u'harmony', u'harmonies', u'cheesy', u'love song', u'best friends', u'90s pop', u'slow jams tag', u'my favorite', u'90s Rnb', u'us number one', u'formative years', u'radio memories', u'all4one', u'chill', u'country', u'80s', u'clean', u'USA', u'easy listening', u'quiet storm', u'soft rock']"
612,Dr. Feelgood,283312,1492434,290000,"[u'hard rock', u'hair metal', u'80s', u'rock', u'metal', u'heavy metal', u'Glam Metal', u'motley crue', u'glam rock', u'classic rock', u'80s rock', u'glam', u'american', u'1989', u'80s hair metal', u'80s metal', u'arena rock', u'90s', u'upbeat', u""80's"", u'seen live', u'classic', u'Driving', u'drugs', u'rifftastic', u'Awesome', u'feel good', u'great', u'fun', u'rock n roll', u'80s Heavy Metal', u'10 of 10 stars', u'rock band dlc', u'motley', u'Barney Stinson Get Psyched mix', u'Dr Feelgood', u'70s', u'cowbell', u'favorites', u'album rock', u'sex', u'male vocalists', u'rock band', u'Guilty Pleasures', u'Cock rock', u'heavy rock', u'wrif-fm', u'1980s', u'hair band', u'hair bands']"
613,It Ain't No Fun To Me,4536,12347,0,"[u'funk', u'rnb', u'Funk Tag', u'soul', u'bass gods', u'Best voices', u'kmem10500', u'al green composistion']"
614,Time of the Season,358192,1718726,212000,"[u'60s', u'classic rock', u'psychedelic', u'oldies', u'rock', u'Psychedelic Rock', u'british', u'The Zombies', u'pop', u'british invasion', u'sexy', u'Mellow', u'psychedelic pop', u'zombies', u'Time of the season', u'1968', u'Flower Power', u'classic', u'favorites', u'cool', u'Awesome', u'male vocalists', u'Soundtrack', u'organ', u'Summery', u'beautiful', u'Love', u'soft rock', u'baroque pop', u'summer', u'The Simpsons', u'indie', u'fun', u'swinging sixties', u'trippy', u""60's"", u'1960s', u'1969', u'British Psychedelia', u'Morose Deep dilate Crimson', u'the zombies time of the season', u'UK', u'britpop', u'feel good', u'lounge', u'sunny', u'classics', u'sixties', u'handclaps', u'favs']"
615,"What'd I Say, Pts. 1 & 2",5850,20852,0,"[u'rhythm and blues', u'soul', u'jazz', u'piano', u'blues', u'r and b', u'gospel', u'1950s', u'country', u'feel good', u'american', u'oldies', u'cool', u'male vocalist', u'50s', u""60's"", u'work', u'Black', u'greatest hits', u'powerful', u'communication', u'All time favourites', u'Soul And RB', u'music for people with superior taste in music', u'great male voices', u'soulish', u'masked marvel', u'older than me', u'awwwwwwwww', u'canciones que dan ganas de gritar', u'canciones que me gusta cantar']"
616,Laughing Song,13137,39741,134000,"[u'experimental', u'Avant-Garde', u'psychedelic', u'electronic', u'The Residents', u'weird', u'scary', u'creepy', u'noise', u'70s', u'alternative', u'Experimental Rock', u'avant garde', u'post-revolutionary pop song', u'obscure', u'avant-rock', u'mindfuck', u'boy band', u'industrial noise', u'new music', u'post modern', u'Experimental Noise', u'san fransisco', u'avant-noise', u'Avantgarde Pop', u'Solomusika-Loved', u'post classical', u'alchemical noise', u'avant-punk', u'occultronics', u'My Best', u'rez', u'atonality', u'shamanic noise', u'signals from the shadow pools', u'good time music', u'gloriously deranged', u'SuperFreaky', u'freak wave', u'laughing song', u'recent history', u'PCLR', u'after the escape of sickness']"
617,You Are in My System,3047,11756,349000,"[u'funk', u'pop', u'80s', u'electro-funk', u'electro', u'dance', u'male vocalists', u'1982', u'1983', u'electrofunk', u'soul', u'new wave', u'synth pop', u'Retro', u'rnb', u'synthesizer', u'eclectic', u'Cool song', u'vintage', u'1980s', u'post-disco', u'classic soul', u'80s soul', u'deep-clash', u'cimx-fm', u'DisCompany', u'from vinyl to ipod', u'jack that body', u'jheri curls', u'emotio-electro', u'rakt over disc', u'Funk Tag', u'dated but great', u'Black male vocalists', u'kss1984 - excellent']"
618,Shank,1765,4268,173000,"[u'moog', u'grins and smiles and giggles and laughs', u'1970s electrochanical', u'strings organs rubber wind', u'moog and theremin', u'instrumental', u'secretagent', u'somafm', u'moogy', u'1970s electronic', u'synth', u'space funk', u'70s electronic', u'gogoriffic', u'strange instruments', u'topsy', u'moog70']"
619,So Goes the Story,9861,25913,235000,"[u'funk', u'p-funk', u'Funk Tag', u'soul', u'Psychedelic Rock', u'Psychedelic Soul', u'oldies', u'rnb', u'damn', u'fantasy tarantino soundtrack', u'i want back to the 70s', u'eddie hazel', u'jeppf', u'PTFI']"
620,Shutterbugg,85799,385607,215000,"[u'rap', u'Hip-Hop', u'funk', u'outkast', u'2010', u'hip hop', u'G-funk', u'def jam', u'Scott Storch', u'really good', u'shutter', u'electronic', u'synth', u'hiphop', u'party', u'cool', u'Jam', u'best of 2010', u'10s', u'badass', u'2010s', u'atlanta', u'good rap', u'd', u'electro-funk', u'best tracks', u'burning man', u'bubbling', u'dungeon family', u'Big Boi', u'natalicious partaychoonz', u'elizabeth marie lester', u'theboyz', u'the boyz', u'nix partly', u'new find', u'pitchfork music festival 2010', u'the strombo show', u'got on vinyl', u'natattack: top ribena anthems', u'Natattack: New Improved Top Party Anthems', u'REALLY REALLY REALLY REALLY REALLY REALLY GOOD', u'GREATEST EVER', u'Nasty Nasty', u'holen', u'tzatrack', u'tzarap', u'Bigboi', u'Found: fall 2010', u'brownsugaristic']"
621,All Day Music,15797,49035,244000,"[u'soul', u'funk', u'war', u'groovyacousticsoul', u'favorites', u'Old School soul', u'DarkestRose-loved tracks', u'chillout', u'jazz', u'rock', u'70s', u'beautiful', u'funky', u'summer', u'oldies', u'smooth', u'funky jazz', u'old school', u'rnb', u'blues rock', u'soulful', u'Michael Franti', u'music about music', u'singalong', u'feelgood', u'lush', u'philly soul', u'1971', u'Stevie Wonder', u'joy', u'tantotempotaste', u'rhythm-blues', u'rhythum and blues tag', u'old school funk', u'New faves', u'all day and all of the night', u'2giveme5', u'TantoTempo-My 70s Heaven', u'Sunny Days', u'soul classic', u'Nat', u'birds bees flowers trees', u'RB - Ol Skool', u'misc rock', u'fell in love with this', u'funk lift off', u'all day music', u'michael franti and spearhead', u'singsongs', u'old school groove']"
622,Chant of the Unborn,6454,16919,82000,"[u'Outsider and Incorrect Music', u'Chant of the Unborn', u'electronica', u'1970', u'Obscuro', u'bruce haack', u'planned obscur', u'The Real Dude Radio Shaw-Root362', u'whiffer unbound', u'whunderplayed', u'The Electric Lucifer 1970', u'playful avant prog']"
623,Shine On You Crazy Diamond (Part One) (1-5) (1992 Digital Remaster),2584,9645,0,"[u'Progressive rock', u'classic rock', u'rock', u'psychedelic', u'Pink Floyd', u'70s', u'Psychedelic Rock', u'Titanium Salvia Lapis Lazuli', u'jtm 70s', u'electronic', u'chill', u'blues', u'beautiful', u'Progressive', u'oldies', u'Sommer', u'1975', u""70's"", u'over 5 minutes long', u'My Favs', u'Songs over 10 minutes long', u'recos', u'pinkfloyd', u'Wish You Were Here', u'jepp', u'drunken singalong', u'pink floyed', u'reading song', u'sandras wish list', u'fave guitar tunes', u'shine on you crazy diamond psychedelic rock classic rock wish you were here', u'Pink Floyd Shine on your crazy diamond']"
624,No Time or Space,2226,4062,1505000,"[u'electronic', u'experimental', u'ambient', u'techno', u'musique concrete', u'squizoidelectrical', u'noise', u'pop', u'60s', u'long', u'drone', u'space', u'halloween', u'time', u'1969', u'no', u'george harrison', u'the word no', u'oh god my brain', u'1960s electronic', u'Songs over 10 minutes long', u'the word time', u'Over 10 minutes', u'solo beatles', u'Pla5tiC 3la5tiK', u'electronic sound', u'Freakies', u'the word space', u'wiresynthtricity', u'word time', u'word no', u'No Time or Space', u'word space']"
625,Black Water,166332,592415,257000,"[u'classic rock', u'70s', u'Southern Rock', u'rock', u'live', u'The Doobie Brothers', u'black water', u'doobie brothers', u'pop', u'Mellow', u'favorites', u'american', u'oldies', u'guitar rock', u'doobies', u'folk', u'acoustic', u'male vocalists', u'top 40', u'1974', u'pop rock', u'americana', u'soft rock', u'guitar', u'Sunday afternoon mix', u'jazzyfunA-K', u'jtm 70s', u'the doobie Brothers - black water', u'jazzyslovedtracks 2011', u'soul', u'hard rock', u'catchy', u'vocals', u'folk rock', u'west coast', u'blues rock', u'male vocalist', u'rhythm and blues', u'rock n roll', u'roots rock', u'Favourites', u'1970s', u'classics', u'southern', u'timeless', u'sing-along', u'number one hits', u""70's"", u'us number one', u'70s favorites']"
626,Free Your Mind and Your Ass Will Follow,31792,80550,600000,"[u'funk', u'psychedelic', u'p-funk', u'psychedelic funk', u'70s', u'funkadelic', u'jazzysfunkmotownandmore', u'soul', u'rock', u'funky', u'r&b', u'r00ts', u'another planet', u'funkgdchill', u'Funk Tag', u'Soul Remedy', u'noise', u'electronic', u'experimental', u'downtempo', u'RIP', u'dark', u'RB', u'Psychedelic Soul', u'night', u'guitar', u'Energetic', u'laidback', u'space', u'Gilles Peterson', u'party', u'psych', u'amazing', u'old school', u'nice', u'spacey', u'Psychedelic Rock', u'cool', u'jamband', u'Hard Dance', u'distortion', u'freedom', u'Funk Rock', u'badass', u'title is a full sentence', u'music', u'Old School soul', u'philosophy', u'long track', u'funky lounge']"
627,After The Love Has Gone,137800,463126,0,"[u'soul', u'70s', u'funk', u'Disco', u'80s', u'Love', u'easy listening', u'groove', u'romantic', u'Earth Wind and Fire', u'pop', u'rnb', u'After The Love Has Gone', u'jazz', u'oldies', u'love songs', u'slow jams', u'Old School soul', u'ewf', u'r&b', u'1979', u'chillout', u'classic', u'slow', u'quiet storm', u'male vocalists', u'Earth', u'Dennis Coleman', u'motown', u'soft rock', u'saxophone', u'american', u'funky', u'smooth', u'Smooth Jazz', u'live', u'rhythm and blues', u'chicago', u'love song', u'wind', u'Soul Funk', u'classic soul', u'cold case', u'DarkestRose-loved tracks', u'old soul', u'critically acclaimed song', u'acclaimed music top 3000 bubbling under', u'sweetest and greatest song ever', u'1052 loved', u'DJPMan-loved-tracks']"
