,Songs,Listeners,Playcount,Duration,Tags
775,Detroit Rock City,380922,1918852,320000,"[u'hard rock', u'classic rock', u'rock', u'kiss', u'glam rock', u'70s', u'heavy metal', u'80s', u'metal', u'rock band', u'detroit', u'Glam Metal', u'favorites', u'rock n roll', u'kiss army', u'hair metal', u'arena rock', u'Shock Rock', u'american', u'detroit rock city', u'seen live', u'favorite songs', u'Rock and Roll', u'1976', u'classic', u'glam', u'Michigan', u'Kiss Detroit Rock city', u'heavy', u'live', u'Masterpiece', u'destroyer', u'legend', u'the best of classic rock', u'Greatest Rock Anthems', u'Rock on', u'rock gods', u'USA', u'cool', u'Favorite', u'songs i love', u'cities', u'wrif-fm', u'classic hard rock', u'classic metal', u'4 minute madness', u'this one goes to eleven']"
776,Refrão De Bolero,56742,531563,274000,"[u'rock', u'brazilian rock', u'brasil', u'engenheiros do hawaii', u'brazilian', u'rock brasil', u'rock nacional', u'Nacional', u'classic rock', u'Love', u'acoustic', u'brazil', u'sul', u'mpb', u'melancholy', u'relax', u'amor', u'The soundtrack to my wasted life', u'perfeita', u'Amo', u'tihuana', u'Depressivas', u'bebida', u'Musicaslegais', u'engenheiros', u'last fm various', u'indie', u'80s', u'indie rock', u'sad', u'pop rock', u'slow', u'beautiful', u'live', u'Ballad', u'compulsive repeat listenings', u'Solitude', u'broken heart', u'1990', u'sweet pain', u'fucking beautiful', u'reminds me of you', u'Marcelo D2', u'rdb', u'My pop music', u'FODA', u'planet hemp', u'ao vivo', u'rock brazuca', u'psicodelico']"
777,Piano Bar,38752,357317,252000,"[u'rock', u'rock brasileiro', u'brazilian', u'Nacional', u'engenheiros do hawaii', u'rock brasil', u'brazilian rock', u'mpb', u'pop', u'acoustic', u'brasil', u'male vocalists', u'rock gaucho', u'folk', u'Love', u'folk rock', u'indie', u'80s', u'pop rock', u'melancholic', u'1991', u'music', u'piano bar', u'The Trick is to Keep Breathing', u'songs that make me remember things', u'Pra Ouvir Em Dia De Chuva', u'enghaw', u'classic rock', u'alternative', u'alternative rock', u'indie rock', u'sad', u'singer-songwriter', u'slow', u'old times', u'dark', u'folk-rock', u'easy listening', u'beautiful', u'guitar', u'portuguese', u'sul', u'bar', u'2007', u'indie folk', u'Pop-Rock', u'best', u'love at first listen', u'i fucking love this song', u'want to see live']"
778,Alexandria,17137,127743,222000,[u'TAPA NA CARA DA SOCIEDADE']
779,Fear of the Dark,454063,3480343,443000,"[u'heavy metal', u'metal', u'Iron Maiden', u'NWOBHM', u'rock', u'hard rock', u'classic metal', u'Fear of the Dark', u'New Wave of British Heavy Metal', u'Power metal', u'classic rock', u'80s', u'british', u'seen live', u'90s', u'favorites', u'Legendary', u'Awesome', u'live', u'guitar', u'British Metal', u'Maiden', u'heavy', u'epic', u'classic', u'Masterpiece', u'Favourite Songs', u'The Best Of Iron Maiden', u'top rock songs', u'Favourites', u'dark', u'Play this loud enough to raise the dead', u'bruce dickinson', u'Progressive metal', u'UK', u'legend', u'favorite songs', u'beautiful', u'speed metal', u'amazing', u'10 of 10 stars', u'anthem', u'My Favourites', u'top 100 greatest songs of all time', u'classic heavy metal', u'iron maiden - fear of the dark live']"
780,Dance Little Liar,309567,2565611,283000,"[u'indie rock', u'british', u'rock', u'indie', u'alternative', u'alternative rock', u'arctic monkeys', u'00s', u'UK', u'humbug', u'2009', u'Psychedelic Rock', u'narcotic indie', u'vugube62', u'post-punk', u'garage rock revival', u'beautiful', u'nice drums', u'Post-punk revival', u'songs I fucking love to death', u'severo tema', u'dance little liar', u'chill', u'epic', u'Alternative  Punk', u'Contemporary', u'blues', u'other', u'Awesome', u'genius', u'new', u'amazing', u'Indie-Rock', u'Garage Rock', u'favourite', u'sex', u'male vocalists', u'british invasion', u'Favourites', u'love at first listen', u'Walter White', u'drumalong', u'sweet', u'best lyrics', u'truth', u'6 of 10 stars', u'5', u'38', u'2016', u'album']"
781,bilhetinho azul,13828,69156,0,"[u'blues', u'pop', u'rock', u'brasil', u'80s', u'brazil', u'brazilian', u'brazilian rock', u'Love', u'rock brasileiro', u'balada', u'barao vermelho', u'Eletrotango', u'O Rappa', u'Blues Brasil', u'Lauf', u'galatita']"
782,Another Brick in the Wall Part 2,114423,677134,239000,"[u'Progressive rock', u'classic rock', u'rock', u'Psychedelic Rock', u'70s', u'Pink Floyd', u'british', u'hard rock', u'psychedelic', u'guitar', u'classics', u'epic', u'dark', u'Progressive', u'intelligent', u'Funk Rock', u'angry', u'funky', u'prog rock', u'children', u'from my childhood', u'pop', u'RockPop', u'kids', u'male vocalist', u'male vocalists', u'freedom', u'school', u'Educational', u'good music', u'art metal', u'better than radiohead', u'simply genius', u'staroe-dobroe', u'electronic', u'classic', u'80s', u'alternative rock', u'prog', u'favorites', u'memories', u'slow', u'album rock', u'male vocal', u'oldies', u'deep', u'political', u'old school', u'melancholic', u'fip']"
783,Lady Evil,136713,609250,262000,"[u'heavy metal', u'hard rock', u'classic rock', u'metal', u'Black Sabbath', u'rock', u'Dio', u'80s', u'doom metal', u'70s', u'classic metal', u'british', u'Ronnie James Dio', u'British Metal', u'sabbath', u'Tony Iommi', u'dio sabbath era', u'guitar', u'Power metal', u'fantasy', u'1980', u'brass balls', u'New Wave of British Heavy Metal', u'Sabbath with Dio', u'80s hard rock', u'lady evil', u'chillout', u'pop', u'japanese', u'classic', u'emo', u'female vocalists', u'dance', u'Stoner Rock', u'pop rock', u'Love', u'catchy', u'cute', u'epic', u'album rock', u'easy listening', u'hair metal', u'medieval', u'new age', u'pretentious', u'kitsch', u'sunday', u'thrash metal', u'party', u'gay']"
784,De Todas As Coisas,10116,66713,166000,[]
785,Mardy Bum,1024958,8650047,175000,"[u'indie rock', u'indie', u'british', u'rock', u'alternative', u'arctic monkeys', u'alternative rock', u'britpop', u'00s', u'brit rock', u'seen live', u'UK', u'Love', u'favorites', u'happy', u'Awesome', u'mardy bum', u'Favourites', u'Britrock', u'Garage Rock', u'artic monkeys', u'indie pop', u'catchy', u'favourite', u'Sheffield', u'2006', u'pop', u'love at first listen', u'english', u'Brit', u'punk', u'post-punk', u'cool', u'pop rock', u'cute', u'punk rock', u'lovely', u'Love it', u'british indie', u'romantic', u'fun', u'brit pop', u'british rock', u'Post-punk revival', u'beautiful', u'Favorite', u'want to see live', u'alternative-rock', u'memories', u'guitar']"
786,Dom Quixote,38129,362945,204000,"[u'brazilian rock', u'rock', u'brazilian', u'Engenheiros do Hawaii-', u'classic rock', u'brasil', u'engenheiros do hawaii', u'rock nacional', u'rio grande do sul', u'gaucho', u'pop nacional', u'alternative rock', u'acoustic', u'engenheiros', u'pop', u'alternative', u'folk', u'pop rock', u'Love', u'folk rock', u'male vocalist', u'male vocalists', u'live', u'rock brasileiro', u'rs', u'pop rock nacional', u'egotrip', u'nacionais', u'enghaw', u'Engenheiros do Hawai', u'rock galeti', u'LPSA', u'v6v6v6', u'pouca vogal', u'00s live']"
787,Any Colour You Like,615500,4268877,205000,"[u'Progressive rock', u'classic rock', u'rock', u'Psychedelic Rock', u'Pink Floyd', u'instrumental', u'psychedelic', u'70s', u'british', u'Progressive', u'space rock', u'experimental', u'trippy', u'art rock', u'instrumental rock', u'electronic', u'favorites', u'prog rock', u'Dark Side of the Moon', u'chill', u'amazing', u'guitar', u'1973', u'classic', u'Symphonic Rock', u'chillout', u'beautiful', u'Mellow', u'Floyd', u'Dreamy', u'synthesizer', u'Guitar Solo', u'sufu5a', u'pop', u'alternative', u'hard rock', u'Experimental Rock', u'blues rock', u'Eargasm', u'LSD', u'the dark side of the moon', u'seen live', u'singer-songwriter', u'UK', u'epic', u'blues', u'Awesome', u'male vocalists', u'trip', u'8 of 10 stars']"
788,Another Brick in the Wall Part 3,76502,383202,100000,"[u'Progressive rock', u'classic rock', u'rock', u'Pink Floyd', u'psychedelic suicide', u'70s', u'sing out loud', u'pop', u'alternative', u'alternative rock', u'hard rock', u'epic', u'album rock', u'psychedelic', u'art rock', u'Progressive', u'Psychedelic Rock', u'loved', u'group of people who are', u'heard live', u'6 of 10 stars', u'seventies', u'Prog-RockArt Rock', u'under 2 minutes long', u'PopRock - Progressive']"
789,4th Dimensional Transition,625624,3339898,238000,"[u'indie', u'psychedelic', u'electronic', u'alternative', u'indie rock', u'mgmt', u'rock', u'electronica', u'indie pop', u'Psychedelic Rock', u'american', u'00s', u'pop', u'electro', u'back flight', u'seen live', u'synth pop', u'Neo-Psychedelia', u'indie pop techno', u'electropop', u'favorites', u'Love', u'Electro Pop', u'Mellow', u'trippy', u'good', u'male vocalist', u'hippie', u'New York City', u'6 of 10 stars', u'ambient noise', u'I would play this stuff while driving if I had a car', u'a clear focus on recording studio production', u'And I hate that my feet are dancing so much', u'vugube62', u'alternative rock', u'new york', u'USA', u'2008', u'dance', u'Experimental Rock', u'Alternative  Punk', u'psychedelic pop', u'indietronica', u'Awesome', u'synth', u'upbeat', u'synthpop', u'ethereal', u'2007']"
790,3x4,31357,284269,231000,"[u'rock', u'brazilian', u'engenheiros do hawaii', u'rock brasileiro', u'brazilian rock', u'rock gaucho', u'brasil', u'80s', u'pop rock', u'folk rock', u'classic rock', u'alternative rock', u'acoustic', u'rock nacional', u'enghaw', u'pop', u'favorite songs', u'brazil', u'sul', u'mpb', u'live', u'rock brasil', u'Rock and Roll', u'<3', u'rs', u'balada', u'BANDA', u'perfeita', u'ao vivo', u'Amo', u'adoro', u'pop rock nacional', u'rock anos 80', u'Engenheiros do Hawai', u'namorada', u'nota 10', u'eu quero', u'npta 10', u'rock galeti', u'adoro o som', u'KCDR', u'uma luz que no produz sombra', u'Engenheiros 3x4', u'Engenheiros do Hawaii-', u'00s live']"
791,Olhos Iguais Aos Seus,10225,49436,225000,"[u'rock gaucho', u'rock', u'rock nacional', u'wurlitzer and fender rhodes', u'cute ones', u'engenheiros do hawaii', u'engenheiros', u'like it as it is']"
792,Judas Be My Guide - 1998 Remastered Version,4157,10317,0,"[u'heavy metal', u'metal', u'hard rock', u'8 of 10 stars', u'devon', u'Miley Cyrus', u'scarlett johansson', u'Melody Thornton', u'nicole bahls', u'jade laroche']"
793,Refrão De Bolero,56742,531563,274000,"[u'rock', u'brazilian rock', u'brasil', u'engenheiros do hawaii', u'brazilian', u'rock brasil', u'rock nacional', u'Nacional', u'classic rock', u'Love', u'acoustic', u'brazil', u'sul', u'mpb', u'melancholy', u'relax', u'amor', u'The soundtrack to my wasted life', u'perfeita', u'Amo', u'tihuana', u'Depressivas', u'bebida', u'Musicaslegais', u'engenheiros', u'last fm various', u'indie', u'80s', u'indie rock', u'sad', u'pop rock', u'slow', u'beautiful', u'live', u'Ballad', u'compulsive repeat listenings', u'Solitude', u'broken heart', u'1990', u'sweet pain', u'fucking beautiful', u'reminds me of you', u'Marcelo D2', u'rdb', u'My pop music', u'FODA', u'planet hemp', u'ao vivo', u'rock brazuca', u'psicodelico']"
794,Dom Quixote,38129,362945,204000,"[u'brazilian rock', u'rock', u'brazilian', u'Engenheiros do Hawaii-', u'classic rock', u'brasil', u'engenheiros do hawaii', u'rock nacional', u'rio grande do sul', u'gaucho', u'pop nacional', u'alternative rock', u'acoustic', u'engenheiros', u'pop', u'alternative', u'folk', u'pop rock', u'Love', u'folk rock', u'male vocalist', u'male vocalists', u'live', u'rock brasileiro', u'rs', u'pop rock nacional', u'egotrip', u'nacionais', u'enghaw', u'Engenheiros do Hawai', u'rock galeti', u'LPSA', u'v6v6v6', u'pouca vogal', u'00s live']"
795,Alívio Imediato,26941,218673,211000,"[u'rock', u'brazilian', u'rock nacional', u'brazilian rock', u'pop', u'engenheiros do hawaii', u'male vocalists', u'rock brasil', u'rock brasileiro', u'Shakira', u'pop rock', u'favorites', u'sul', u'mpb', u'Favourites', u'1989', u'cold war', u'rock gaucho', u'BANDA', u'ENG', u'nacionais', u'brazilian band', u'canta a minha vida', u'engenheiros', u'cantando junto', u'tarde', u'letrinhas lindas', u'nota 10', u'npta 10', u'eltonluc', u'brazilian songwriter', u'brazilian high quality']"
796,Fluorescent Adolescent,890212,9179606,177000,"[u'indie rock', u'indie', u'british', u'rock', u'alternative', u'arctic monkeys', u'alternative rock', u'britpop', u'00s', u'UK', u'brit rock', u'catchy', u'seen live', u'post-punk', u'Awesome', u'favorites', u'fun', u'male vocalists', u'pop', u'2007', u'Post-punk revival', u'Garage Rock', u'Favourites', u'Sheffield', u'indie pop', u'beautiful', u'amazing', u'love at first listen', u'Britrock', u'happy', u'cool', u'Uplifting', u'great lyrics', u'Favorite', u'artic monkeys', u'genius', u'art rock', u'favourite', u'2000s', u'Favourite Songs', u'brit pop', u'catchy as hell', u'Progressive rock', u'melodic', u'<3', u'chillout', u'dance', u'Alternative  Punk', u'garage rock revival', u'nostalgic']"
797,Mil Razões,12420,91423,244000,[]
798,"Baby, I Love You",79110,328924,227000,"[u'punk', u'punk rock', u'cover', u'80s', u'beautiful melodies', u'classic rock', u'beautiful', u'strings', u'phil spector', u'alternative', u'american', u'covers', u'NYC', u'Ramones', u'ronettes cover', u'70s', u'songs for a girl', u'boy plus guitar', u'boogiewoogieflu', u'awwwwie love songs', u'pop', u'rock', u'pop rock', u'Love', u'new wave', u'romantic', u'poetry', u'intense', u'loved', u'harmony', u'fav', u'favies', u'Favourites', u'New York Punk', u'the ronettes', u'out of genre covers', u'bubblegum', u'baby', u'dance punk', u'essentials', u'You and I', u'cover version', u'geek rock', u'wedding', u'takes me back', u'1980', u'great cover', u'the word baby', u'skapunk', u'Classic Punk']"
799,Até O Fim,38921,318203,235000,"[u'mpb', u'rock', u'brazilian rock', u'rock brasil', u'acustico', u'brasil', u'live', u'rock nacional', u'rock gaucho', u'classic rock', u'alternative rock', u'Progressive rock', u'acoustic', u'rs', u'br', u'pop rock nacional', u'engenheiros do hawaii', u'engenheiros', u'enghaw', u'Engenheiros do Hawai', u'rock galeti', u'nao vim ate aqui pra desistir agora', u'00s live']"
800,Terra De Gigantes,37635,252700,347000,"[u'Engenheiros do Hawai', u'rock brasileiro', u'rock', u'brasil', u'rock nacional', u'nacionais', u'brazilian rock', u'Nacional', u'rock gaucho', u'engenheiros do hawaii', u'engenheiros', u'terra de gigantes', u'80s', u'reggae', u'pop rock', u'slow', u'sul', u'mpb', u'cool', u'Rock and Roll', u'hawaii', u'Brasilian', u'1987', u'All', u'brasileira', u'vi ao vivo', u'Preferidas', u'BANDA', u'politica', u'rock brazuca', u'brazilian pop rock', u'Amo', u'relaxante', u'engenheiros do havaii', u'Victor e Leo', u'pop nacional', u'Maximo', u'Sweet Leaf', u'apocalipse', u'anos 80', u'brazilian classic rock', u'jovens', u'Meus Favoritos', u'last fm various', u'fofas', u'enghaw', u'Executivo Por Sonho', u'balada fria', u'rock galeti', u'00s Brazil']"
801,Dom Quixote,38129,362945,204000,"[u'brazilian rock', u'rock', u'brazilian', u'Engenheiros do Hawaii-', u'classic rock', u'brasil', u'engenheiros do hawaii', u'rock nacional', u'rio grande do sul', u'gaucho', u'pop nacional', u'alternative rock', u'acoustic', u'engenheiros', u'pop', u'alternative', u'folk', u'pop rock', u'Love', u'folk rock', u'male vocalist', u'male vocalists', u'live', u'rock brasileiro', u'rs', u'pop rock nacional', u'egotrip', u'nacionais', u'enghaw', u'Engenheiros do Hawai', u'rock galeti', u'LPSA', u'v6v6v6', u'pouca vogal', u'00s live']"
802,Another Brick in the Wall Part 2,114423,677134,239000,"[u'Progressive rock', u'classic rock', u'rock', u'Psychedelic Rock', u'70s', u'Pink Floyd', u'british', u'hard rock', u'psychedelic', u'guitar', u'classics', u'epic', u'dark', u'Progressive', u'intelligent', u'Funk Rock', u'angry', u'funky', u'prog rock', u'children', u'from my childhood', u'pop', u'RockPop', u'kids', u'male vocalist', u'male vocalists', u'freedom', u'school', u'Educational', u'good music', u'art metal', u'better than radiohead', u'simply genius', u'staroe-dobroe', u'electronic', u'classic', u'80s', u'alternative rock', u'prog', u'favorites', u'memories', u'slow', u'album rock', u'male vocal', u'oldies', u'deep', u'political', u'old school', u'melancholic', u'fip']"
803,"Armas Químicas E Poemas - Live At Espaço Locall, Sao Paulo/ 2004",3413,10569,0,[]
804,"Infinita Highway - Live At Espaço Locall, Sao Paulo/ 2004",9806,31893,0,[]
805,"Vida Real - Live At Espaço Locall, Sao Paulo/ 2004",2905,8956,0,[]
806,"Até O Fim - Live At Espaço Locall, Sao Paulo/ 2004",4206,13486,0,[]
807,Era um garoto que como eu amava os beatles e os rolling stones,18140,125111,172000,"[u'alternative rock', u'classic rock', u'brazilian', u'rock', u'alternative', u'brazilian rock', u'rock gaucho', u'brazilian classic rock', u'engenheiros', u'new wave', u'brasil', u'guitarra', u'Nacional', u'rock brazuca', u'era um garoto']"
808,Time to Pretend,1339916,11722805,261000,"[u'indie', u'electronic', u'alternative', u'indietronica', u'electronica', u'mgmt', u'psychedelic', u'indie rock', u'indie pop', u'pop', u'00s', u'catchy', u'synthpop', u'electropop', u'happy', u'drugs', u'rock', u'dance', u'skins', u'2008', u'Awesome', u'summer', u'time to pretend', u'american', u'electronic indie', u'alternative rock', u'fun', u'love at first listen', u'electro', u'makes me happy', u'party', u'favorites', u'addictive', u'experimental', u'nostalgic', u'cool', u'gossip girl', u'Love', u'Dreamy', u'chillout', u'great lyrics', u'songs you must hear before you die', u'driving around really fast and being awesome', u'seen live', u'epic', u'psychedelic pop', u'indie disco', u'best of 2008', u'handclaps', u'Energetic']"
809,Vicar in a Tutu,285707,1577529,141000,"[u'indie', u'80s', u'alternative', u'british', u'new wave', u'britpop', u'rock', u'The Smiths', u'post-punk', u'pop', u'indie pop', u'smiths', u'Morrissey', u'alternative rock', u'Manchester', u'indie rock', u'1986', u'british i like', u'UK', u'80s alternative', u'amayzes loved', u'melancholy', u'davaho53', u'vugube62', u'classic rock', u'rockabilly', u'Favorite Bands', u'favorites', u'happy', u'Alternative  Punk', u'jangle pop', u'Post punk', u'beautiful', u'moody', u'90s', u'Mellow', u'Favorite Artists', u'love at first listen', u'Moz', u'5 of 10 stars', u'Reasons why I love Moz', u'The 80s was not a dead decade', u'dumb but fun ridiculous', u'storytelling at its finest', u'mpt', u'cute', u'alternative pop rock', u'college rock', u'other', u'RockPop']"
810,Cataflor,10452,79449,227000,"[u'lovesong', u'linda', u'QUE VOZ', u'me acalma']"
811,Career Opportunities,203910,935726,126000,"[u'punk', u'punk rock', u'british', u'rock', u'70s', u'political', u'the clash', u'classic rock', u'Classic Punk', u'1977', u'british i like', u'working', u'clash', u'classic', u'Old School Punk', u'UK', u'Alternative  Punk', u'theo73 loves this music', u'neatneatneat', u'pop', u'under two minutes', u'rockin', u'Joe Strummer', u'Sandinista', u'UK Punk', u'tantotempotaste', u'Anti-Work', u'so true lyrics', u'80s', u'alternative rock', u'Dead', u'favorites', u'old skool', u'great', u'old school', u'good shit', u'Garage Rock', u'nice', u'british folk', u'kids', u'male vocalists', u'live', u'great lyrics', u'class struggle', u'Favorite', u'songs i love', u'short', u'popular', u'punkrock', u'work songs']"
812,Fake Tales of San Francisco,1003652,7298776,176000,"[u'indie rock', u'indie', u'british', u'rock', u'alternative', u'arctic monkeys', u'alternative rock', u'britpop', u'brit rock', u'00s', u'UK', u'Garage Rock', u'seen live', u'favorites', u'post-punk', u'Awesome', u'upbeat', u'fun', u'Sheffield', u'Britrock', u'Favourite Songs', u'catchy', u'england', u'punk rock', u'favourite', u'san francisco', u'Favourites', u'want to see live', u'british rock', u'punk', u'Indie-Rock', u'english', u'cities', u'artic monkeys', u'sexy', u'Alternative  Punk', u'great', u'male vocalists', u'2005', u'fake tales of san francisco', u'cool', u'Favorite', u'brilliant', u'pop', u'indie pop', u'dance', u'epic', u'funk', u'Retro', u'good shit']"
813,N.I.B.,320658,1764772,368000,"[u'heavy metal', u'classic rock', u'hard rock', u'metal', u'rock', u'Black Sabbath', u'70s', u'doom metal', u'classic metal', u'Stoner Rock', u'british', u'Psychedelic Rock', u'guitar', u'favorites', u'1970', u'ozzy', u'N I B', u'rock band', u'heavy rock', u'Ozzy Osbourne', u'classic', u'Awesome', u'bass', u'Traditional Doom Metal', u'NIB', u'heavy', u'Love', u'oldies', u'Favourites', u'great songs', u'Masterpiece', u'Favourite Songs', u'Guitar Solo', u'rock band dlc', u'Megadeth', u'Tony Iommi', u'fucking CLASSIC', u'rock anthem', u'70s metal', u'seen live', u'80s', u'favorite songs', u'epic', u'blues', u'psychedelic', u'Doom', u'favourite', u'nice', u'blues rock', u'live']"
814,Anarchy in the U.K.,536726,2739938,210000,"[u'punk', u'punk rock', u'70s', u'british', u'Classic Punk', u'rock', u'sex pistols', u'classic rock', u'British Punk', u'political', u'anarchy', u'UK', u'Old School Punk', u'sid vicious', u'alternative', u'Guitar Hero', u'1976', u'england', u'favorites', u'male vocalists', u'hard rock', u'1977', u'neatneatneat', u'alternative rock', u'london', u'male vocalist', u'anarcho-punk', u'1970s', u'johnny rotten', u'77 punk', u'fucking CLASSIC', u'Anarchy In The UK', u'Punk 77', u'anarchy punk']"
815,Mil Razões,12420,91423,244000,[]
816,O Tempo Não Pára,45891,263807,280000,"[u'rock', u'brazilian', u'cazuza', u'80s', u'hino', u'mpb', u'outro que nosdeixou muito cedo', u'poetry', u'male vocalists', u'rock nacional', u'alternative', u'pop rock', u'brasil', u'rock brasileiro', u'brazilian rock', u'As melhores do Brasil', u'Memorias', u'alternative rock', u'catchy', u'soft rock', u'latin', u'beautiful', u'brazil', u'political', u'1988', u'fav', u'rio de janeiro', u'nostalgia', u'childhood', u'male vocals', u'1980s', u'South American', u'influential', u'80s rock', u'best of 80s', u'FAVORITA', u'the soundtrack of my life', u'ratos', u'FODA', u'melhor', u'otima', u'best of 1988', u'radio astral', u'rock alternativo', u'bbb', u'poeta', u'Meu Brasil', u'made in brazil', u'Inesquecivel', u'best of 1980s']"
817,Bossa,9010,57465,221000,[]
818,"Frankly, Mr. Shankly",234921,1431962,137000,"[u'80s', u'indie', u'british', u'new wave', u'alternative', u'The Smiths', u'post-punk', u'rock', u'Manchester', u'indie rock', u'britpop', u'pop', u'alternative rock', u'indie pop', u'UK', u'Morrissey', u'1986', u'amayzes loved', u'punk', u'favorites', u'driving music', u'genius', u'sardonic', u'smiths', u'davaho53', u'vugube62', u'favourite', u'fun', u'male vocalists', u'Favourites', u'Diss', u'acoustic rhythm guitars', u'Faves', u'humorous lyrics', u'classic rock', u'rockabilly', u'classic', u'sad', u'pop rock', u'happy', u'Love', u'dark', u'indiepop', u'jangle pop', u'RockPop', u'upbeat', u'punk rock', u'Pink Floyd', u'intelligent', u'Bittersweet']"
819,Another Brick in the Wall Part 3,76502,383202,100000,"[u'Progressive rock', u'classic rock', u'rock', u'Pink Floyd', u'psychedelic suicide', u'70s', u'sing out loud', u'pop', u'alternative', u'alternative rock', u'hard rock', u'epic', u'album rock', u'psychedelic', u'art rock', u'Progressive', u'Psychedelic Rock', u'loved', u'group of people who are', u'heard live', u'6 of 10 stars', u'seventies', u'Prog-RockArt Rock', u'under 2 minutes long', u'PopRock - Progressive']"
820,4th Dimensional Transition,625624,3339898,238000,"[u'indie', u'psychedelic', u'electronic', u'alternative', u'indie rock', u'mgmt', u'rock', u'electronica', u'indie pop', u'Psychedelic Rock', u'american', u'00s', u'pop', u'electro', u'back flight', u'seen live', u'synth pop', u'Neo-Psychedelia', u'indie pop techno', u'electropop', u'favorites', u'Love', u'Electro Pop', u'Mellow', u'trippy', u'good', u'male vocalist', u'hippie', u'New York City', u'6 of 10 stars', u'ambient noise', u'I would play this stuff while driving if I had a car', u'a clear focus on recording studio production', u'And I hate that my feet are dancing so much', u'vugube62', u'alternative rock', u'new york', u'USA', u'2008', u'dance', u'Experimental Rock', u'Alternative  Punk', u'psychedelic pop', u'indietronica', u'Awesome', u'synth', u'upbeat', u'synthpop', u'ethereal', u'2007']"
821,O exército de um homem só,8638,59434,344000,"[u'rock', u'brasil', u'rock brasileiro', u'engenheiros']"
822,I Was Made for Lovin' You,474137,2715908,270000,"[u'hard rock', u'rock', u'classic rock', u'glam rock', u'70s', u'kiss', u'80s', u'Disco', u'1979', u'hair metal', u'Glam Metal', u'heavy metal', u'metal', u'rock n roll', u'70s rock', u'Love', u'glam', u'yeaaahhhhh', u'Awesome', u'oldies', u'kiss army', u'male vocalists', u'Rock and Roll', u'I was made for lovin you', u'seen live', u'classic', u'USA', u'arena rock', u'american', u'Favourite Songs', u'80s rock', u'Morose Deep dilate Crimson', u'pop', u'favorites', u'relax', u'FUCKING AWESOME', u'1975', u'sleaze rock', u'hardrock', u'Power ballad', u'sleazy', u'Favourites', u'Cock rock', u'great songs', u'poprock', u'sleaze', u'Shock Rock', u'sleazy rock', u'ridiculously awesomely good', u'ultimate hits']"
823,When the Sun Goes Down,901552,8116906,200000,"[u'indie', u'indie rock', u'british', u'rock', u'alternative', u'arctic monkeys', u'alternative rock', u'britpop', u'00s', u'UK', u'brit rock', u'punk', u'Garage Rock', u'Britrock', u'Awesome', u'seen live', u'favorites', u'Love', u'indie pop', u'cool', u'2006', u'catchy', u'post-punk', u'upbeat', u'england', u'Favorite', u'Favourite Songs', u'dance', u'male vocalists', u'amazing', u'Brit', u'pop', u'Energetic', u'punk rock', u'favourite', u'Favourites', u'Sheffield', u'Post-punk revival', u'genius', u'fun', u'modern rock', u'male vocalist', u'FUCKING AWESOME', u'british rock', u'amayzes loved', u'Whatever People Say I Am', u'sexy', u'garage rock revival', u'loved', u'love at first listen']"
