,Songs,Listeners,Playcount,Duration,Tags
676,Happy House,160035,735485,230000,"[u'post-punk', u'80s', u'new wave', u'goth', u'Gothic', u'female vocalists', u'alternative', u'Gothic Rock', u'Post punk', u'Siouxsie', u'punk', u'rock', u'darkwave', u'goth rock', u'british', u'dark', u""80's"", u'indie', u'happy', u'1980', u'Happy House', u'Siouxsie and the Banshees', u'seen live', u'alternative rock', u'favorites', u'female vocalist', u'whistling', u'old school goth', u'goth days', u'she wants revenge', u'Roctronik', u'pop', u'UK', u'Love', u'psychedelic', u'Driving', u'Favourites', u'dark wave', u'batcave', u'lizvelrene postpunk', u'mvideo', u'girls', u'postpunk', u'punk rock', u'cool', u'deathrock', u'cold wave', u'to listen', u'Female Voices', u'1980s']"
677,Viva Las Vegas,17933,55779,190000,"[u'rock', u'cover', u'classic rock', u'covers', u'elvis presley cover', u'pop', u'male vocalist', u'compilation', u""Rock 'n' Roll"", u'Ballad', u'freedom', u'bruce covering', u'bruce', u'wanderlust', u'cover track', u'songs about cities', u'rock tag', u'coole cover', u'z-lieblingslieder']"
678,Monsterbait,2276,7109,189000,[u'halloween']
679,Norwegian Stars,14115,63921,188000,"[u'Dreamy', u'trip-hop', u'trip hop', u'loooove', u'chillout', u'electronica', u'beautiful', u'lounge', u'dream pop', u'belgian', u'magic']"
680,Down on the Corner,498727,2175423,163000,"[u'classic rock', u'rock', u'60s', u'Southern Rock', u'oldies', u'creedence clearwater revival', u'CCR', u'70s', u'country rock', u'american', u'folk', u'cowbell', u'Down on the corner', u'pop', u'classic', u'blues', u'blues rock', u'80s', u'favorites', u'rock n roll', u'Rock and Roll', u'roots rock', u'swamp rock', u'Creedence', u'country', u'more cowbell', u'catchy', u'americana', u'soft rock', u'guitar', u'male vocalists', u'1969', u'gladys the tag', u'favorite songs', u'USA', u'Awesome', u'upbeat', u'folk rock', u'loved', u'rhythm and blues', u'rocknroll', u'sunny', u'Rock 80s', u'70s classic rock', u'60s favorites', u'livin out the trip', u'sufu5a', u'happy', u'fun', u""60's""]"
681,Wheels,11466,44665,273000,"[u'rock', u'Veronica Mars', u'blues', u'blues rock', u'loved', u'heard on Pandora', u'sunshine songs', u'pretty depressing', u'jeden z niewielu Bogow ktory przezyl']"
682,We Come 1,162595,657201,499000,"[u'electronic', u'dance', u'trip-hop', u'House', u'electronica', u'trance', u'Faithless', u'club', u'techno', u'90s', u'british', u'alternative', u'electro', u'Progressive House', u'british i like', u'favorites', u'we come 1', u'chill', u'party', u'favourite', u'Rave', u'cool', u'Favorite', u'chillout', u'seen live', u'progressive trance', u'relax', u'Best of', u'2001', u'old', u'All time favourites', u'nice sound', u'alternative-dance', u'77davez-seen-live', u'MJ-just playin tunes', u'Disco', u'indie', u'pop', u'rock', u'favorite songs', u'ambient', u'UK', u'energy', u'epic', u'beautiful', u'Awesome', u'idm', u'Energetic', u'trip hop', u'funky']"
683,Piss Where You Please,1456,4971,166000,[]
684,Kill An Addict,19599,65314,64000,"[u'hardcore', u'metalcore', u'death metal', u'i love it']"
685,Trouble's Back in Town,371,703,136000,[]
686,Blinded by the Light,118721,443856,302000,"[u'rock', u'classic rock', u'70s', u'singer-songwriter', u'Bruce Springsteen', u'folk rock', u'saxophone', u'heartland rock', u'american', u'folk', u'americana', u'happy', u'guitar', u'cover', u'fun', u'male vocalists', u'new jersey', u'bruce', u'springsteen', u'the boss', u'great rock albums', u'springsteen bruce', u'seen live', u'jazz', u'pop', u'classic', u'80s', u'sad', u'hard rock', u'piano', u'acoustic', u'soft rock', u'acid jazz', u'Awesome', u'melodic', u'psychedelic', u'bass', u'feel good', u'quirky', u'drums', u'organ', u'summer', u'poetry', u'soft', u'favourite', u'heard on Pandora', u'male vocalist', u'Alternative Folk', u'folkrock', u'Ballad']"
687,Rock Your Baby,101924,341587,386000,"[u'Disco', u'70s', u'soul', u'oldies', u'pop', u'George McCrae', u'dance', u'rock your baby', u'funk', u'1974', u'funky', u'rnb', u""70's"", u'rock', u'party', u'male vocalists', u'70s disco', u'Disco 70s', u'Love', u'Rock you Baby', u'now thats funk', u'80s', u'sexy', u'romantic', u'groovy', u'rhythm and blues', u'Favourites', u'jecks', u'70', u'breakfast on pluto', u'Soundtrack', u'r&b', u'soft', u'love songs', u'fav', u'best', u'Sommer', u'one hit wonder', u'DJMFmylovedmusic', u'Beelloved', u'tantotempotaste', u'swingtown', u'free soul', u'uk number one', u'smooth n groovy', u'Classic Disco', u'70 - SEVENTIES', u'Happy retirement mix']"
688,Restless Soul,10251,53067,329000,"[u'Power metal', u'heavy metal', u'epic metal', u'metal', u'swedish', u'Swedish Metal', u'Hammerfall', u'mycket bra']"
689,Kingdom Of Fear,52,171,170000,[]
690,Reich Der Träume (bonus track),1564,5748,399000,"[u'cover', u'cover version', u'Nico', u'lutz ulbrich', u'Christa Paeffgen', u'luul', u'Christa Paffgen']"
691,Miles Away From Here,1248,3371,210000,"[u'belgian', u'Belgian music', u'beautifull']"
692,Surrealist Appearance,3104,9061,339000,[]
693,Fed on Fury,244,514,360000,[]
694,The Spy,176383,855880,255000,"[u'classic rock', u'Psychedelic Rock', u'rock', u'blues', u'70s', u'blues rock', u'psychedelic', u'The Doors', u'60s', u'sexy', u'chill', u'blues-rock', u'american', u'Consistent Dodo Radio - Flittering', u'USA', u'piano', u'oldies', u'male vocalists', u'miami vice', u'sixties', u'Acid Rock', u'doors', u'1970', u'music to get high to', u'greatest lyrics', u'dreamers', u'severo tema', u'slgdmblues', u'genre: psychedelic rock', u'genre: blues rock', u'type: sex rock', u'Soundtrack', u'Stoner Rock', u'favorites', u'dark', u'album rock', u'Rock  Roll', u'other', u'beautiful', u'poetry', u'bluesy', u'Mellow', u'Psychedelia', u'great', u'Like', u'favourite', u'fip', u'trippy', u'band', u'loved']"
695,tv.song,9,25,0,[]
696,Now's the Time,3984,8182,238000,"[u'jazz', u'saxophone', u'best', u'comtemporary jazz', u'sunday jazz', u'admired', u'garten jazz', u'zonk jazz']"
697,Open Season,17309,66109,234000,"[u'thrash metal', u'metal', u'thrash', u'bay area thrash metal', u'red shoes ecstasy', u'heavy metal', u'exodus', u'headbangers ball', u'punk', u'heard on Pandora', u'1988', u'1980s', u'4 of 10 stars', u'american artist', u'old school thrash metal', u'bay area thrash', u'Thrash-Metal', u'west coast thrash', u'great guitar riffs', u'wyjebany w kosmos thrash', u'neatneatneat', u'Fabulous Disaster', u'bay area old school thrash metal']"
698,Meat Heart,2215,5230,399000,"[u'ambient', u'dark', u'drone', u'Blackened Death Metal', u'progressive black metal', u'groove metal', u'Dark Music']"
699,Chalice of Blood,13965,73430,348000,"[u'thrash metal', u'metal', u'thrash', u'heavy metal', u'speed metal', u'80s', u'bay area thrash metal', u'bay area thrash', u'amazing solos', u'american', u'trash metal', u'Bay Area', u'Technical Thrash Metal', u'classic thrash', u'over 5 minutes long', u'feel the noise', u'forbidden', u'Music That kicks Yer Ass', u'AAAAAAAAAAAAAAAAAAAAAAAAAAAAAAAAAAAAAAAHHHHHHH', u'Diabolic Power In YOur Ass', u'kriskronos Sunday school Halleluijah metal massacre', u'The Gospel According to kriskronos chp7vs77']"
700,Relentless Revolution,14953,58293,268000,"[u'thrash metal', u'metal', u'heavy metal', u'thrash', u'Power metal', u'speed metal', u'Bay Area', u'9 of 10 stars', u'badass', u'title track', u'Technical Thrash Metal', u'bay area thrash metal', u'technical speed metal', u'cherrysthorne']"
701,Learn My Lesson,3477,10384,218000,"[u'classic rock', u'alternative rock', u'hard rock', u'blues', u'blues rock', u'Rock and Roll', u'rock n roll', u'retro rock', u'7 of 10 stars', u'retro hard rock']"
702,Nowhere,56037,241233,146000,"[u'rock', u'alternative', u'90s', u'alternative rock', u'metal', u'1994', u'heavy metal', u'seen live', u'irish', u'therapy', u'punk', u'male vocalists', u'Punk Metal', u'glorious tracks', u'absolutely fucking love it', u'cookdandbombd', u'classic rock', u'electronica', u'indie', u'pop', u'heavy', u'hard rock', u'favorites', u'Love', u'lalala', u'blues', u'party', u'great', u'pop punk', u'alternative metal', u'intense', u'Massive Attack', u'depressing', u'rock n roll', u'Nu Metal', u'5 Stars', u'poppy', u'8 of 10 stars', u'nostalgia', u'wake up', u'youth', u'aggro', u'eclectonia', u'wolo999', u'1995', u'Great Music', u'all time fav', u'kick ass', u'All time favourites', u'5 star songs']"
703,Transsylvanian Express,5284,29728,230000,"[u'psychobilly', u'80s', u'vampire', u'favorites', u'favoriten']"
704,Sonne,528922,4773915,272000,"[u'industrial metal', u'metal', u'german', u'industrial', u'Rammstein', u'rock', u'hard rock', u'deutsch', u'heavy metal', u'Sonne', u'German metal', u'industrial rock', u'Neue Deutsche Haerte', u'epic', u'neue deutsche h\xe4rte', u'favorites', u'alternative', u'dance metal', u'Awesome', u'germany', u'tanz-metall', u'rammstein - sonne', u'heavy', u'00s', u'alternative metal', u'Nu Metal', u'seen live', u'mutter', u'alternative rock', u'Deutschrock', u'male vocalists', u'NDH', u'tanz metal', u'sexy', u'Progressive metal', u'Love', u'dark', u'techno metal', u'Favourite Songs', u'german rock', u'chillout', u'electronic', u'Hard', u'beautiful', u'melodic', u'Gothic Metal', u'Favorite', u'Power metal', u'2001']"
705,Asche zu Asche,256760,2051992,204000,"[u'industrial metal', u'metal', u'industrial', u'german', u'Rammstein', u'rock', u'deutsch', u'hard rock', u'Neue Deutsche Haerte', u'neue deutsche h\xe4rte', u'germany', u'industrial rock', u'German metal', u'heavy metal', u'favorites', u'Awesome', u'90s', u'tanz-metall', u'tanz metall', u'seen live', u'herzeleid', u'6 of 10 stars', u'german music', u'dance metal', u'german rock', u'tanz-metal', u'alternative', u'heavy', u'Gothic', u'Driving', u'thrash metal', u'live', u'Favourites', u'10 of 10 stars', u'german industrial', u'tanz metal', u'hardrock', u'Germans', u'malloy2000 playlist - top songs - classical to metal', u'Best of Rammstein', u'djungle club', u'metal top', u'Asche zu Asche', u'christian alexander tietgen']"
706,I Will Be Heard,139732,892812,179000,"[u'hardcore', u'metalcore', u'metal', u'moshcore', u'FUCKING AWESOME', u'Hatebreed', u'rock', u'death metal', u'aggressive', u'Soundtrack', u'heavy metal', u'seen live', u'punk', u'00s', u'Favourite Songs', u'i will be heard', u'brutal', u'grindcore', u'hard rock', u'rage', u'hardcore metal', u'Pleasuredome Oppenwehe', u'neverbackdown', u'rocks your face off', u'I will b heard', u'alternative', u'slow', u'Awesome', u'loud', u'subway', u'insane', u'thrash', u'punk rock', u'psychobilly', u'cool', u'Favourites', u'hardcore punk', u'i love it', u'yeah', u'genious', u'toughguy hardcore', u'metallic hardcore', u'fuckyeah', u'perseverance', u'fight', u'awe-inspiring', u'Preferidas', u'auto', u'two step', u'In Your Fucking Face']"
707,There's No I In Fuck,13514,64009,0,"[u'hardcore', u'metalcore', u'Female fronted metal', u'metal', u'female vocalists', u'favorite tracks', u'live seen', u'Walls Of Jericho', u'Candace Kucsulain']"
708,Heaven Nor Hell,104411,712468,322000,"[u'rock', u'hard rock', u'rockabilly', u'metal', u'heavy metal', u'Awesome', u'groove metal', u'punk rock', u'Volbeat', u'happy', u'catchy', u'alternative metal', u'amazing', u'2010s', u'wrif-fm', u'danish dynamite', u'Danish band', u'songs of the moment', u'metalcore', u'harmonica', u'male vocalist', u'rock n roll', u'00s', u'Favorite', u'danish', u'english', u'2012', u'10s', u'4 Stars', u'heard live', u'7 of 10 stars', u'danish artist', u'Faves', u'fucking amazing', u'5', u'choice', u'elvis metal', u'Power Rock', u'over 5 minutes long', u'p', u'riesenhits', u'olnicla - melorock', u'olnicla - rock', u'rar33', u'mocnie i energia']"
709,Ritual,88061,849805,269000,"[u'heavy metal', u'occult rock', u'Psychedelic Rock', u'hard rock', u'doom metal', u'metal', u'rock', u'swedish', u'Brutal Death Metal', u'Traditional Doom Metal', u'psychedelic black metal', u'Female fronted metal', u'Progressive rock', u'Stoner Rock', u'hair metal', u'Skinhead', u'Reggaeton', u'female vocalist', u'queercore', u'shit', u'RAC', u'goregrind', u'homocore', u'Officially Shit', u'deathcore', u'nsbm', u'deathgrind', u'FAGGOT', u'all things annoying in the world put together into one stupid bitch', u'approximately 1000 times less pleasant than EXTREME ANAL CAVING', u'crunkcore', u'brutal deathcore', u'the worst thing ever to happen to music', u'hiv positive', u'shit only a fag would listen to', u'shit only a retard would listen to', u'I hope you get shot', u'national socialist black metal', u'Fashioncore', u'dildocore', u'antifa', u'goatse', u'moshcore', u'everytime you listen to this crap a truck hits a granny', u'They look like serial prostitutes with fake dildos to scare little kids', u'I would rather beat myself to death with a hammer than listen to this', u'More Gay Than a San Fransisco Man in a Hawaiian Shirt Sniffing Some Liquid Gold and Watching Sex in the City', u'micropenis', u'music to suck cock to', u'homoerotic']"
710,Rex,9963,69327,200000,"[u'rock', u'Belgium', u'alternative', u'alternative rock', u'post-punk', u'seen', u'Belgisch']"
711,Death by Diamonds and Pearls,126454,697553,193000,"[u'rock', u'indie', u'indie rock', u'blues rock', u'british', u'alternative', u'alternative rock', u'Garage Rock', u'2009', u'garage', u'alt rock', u'electronic', u'vocal', u'chill', u'blues', u'Awesome', u'film', u'upbeat', u'Passionate', u'ost', u'female vocals', u'cool', u'love at first listen', u'fashion', u'5 Stars', u'english', u'perfect', u'running', u'2000s', u'powerful', u'<3', u'LOVE LOVE LOVE', u'diamonds', u'beach house', u'white stripes', u'glamour', u'songs of 2009', u'garage blues', u'cool rock', u'somafm', u'damned good', u'turquoise and coral', u'Dirty Rock', u'recos', u'Bagel', u'The Horrors', u'tame impala', u'music choice: alternative', u'warpaint', u'has official video']"
712,The Pretender,1150362,9373745,269000,"[u'rock', u'alternative rock', u'alternative', u'foo fighters', u'Grunge', u'hard rock', u'post-grunge', u'00s', u'american', u'the pretender', u'powerful', u'FUCKING AWESOME', u'Dave Grohl', u'favorites', u'Awesome', u'male vocalists', u'indie', u'2007', u'Post Grunge', u'Energetic', u'angry', u'seen live', u'best of 2007', u'pretender', u'I could listen to this song forever', u'Favourites', u'epic', u'guitar', u'Foo Fighters - The Pretender', u'seattle', u'indie rock', u'energy', u'foo', u'punk', u'Guitar Hero', u'classic rock', u'pop', u'90s', u'cool', u'2000s', u'best songs ever', u'USA', u'Favourite Songs', u'Nirvana', u'Rock on', u'favorite songs', u'Love', u'punk rock', u'aggressive', u'emotional']"
713,Lay It Down,6174,24163,180000,"[u'rock', u'alternative', u'alternative rock', u'indie rock', u'female vocalists', u'90s', u'old school alternative', u'classic rock', u'indie', u'Grunge', u'USA', u'favorites', u'memories', u'Love', u'new', u'pop punk', u""90's"", u'running', u'school', u'friendsofthekingofrummelpop', u'1990s', u'psychobaby', u'kenny', u'songs that make me happy', u'radcliffe', u'stoner pop', u'random mix', u'tempestas choice', u'yet another 4', u'radio as i want it', u'up on trial', u'less than 100', u'gr 90s', u'less than 95', u'less than 88', u'gr eve', u'Classic American Indie Rock']"
714,Waking Up,67646,249204,197000,"[u'britpop', u'indie', u'90s', u'rock', u'alternative', u'female vocalists', u'alternative rock', u'female', u'british', u'indie rock', u'heard on Pandora', u'1995', u'Elastica', u'pop', u'punk', u'UK', u'sexy', u'indie pop', u'female vocal', u'Brit-pop', u'Mark and Lard Graveyard Shift', u'new wave', u'1990s', u'cup of tea', u'nwonw', u'if my life had a soundtrack', u'reminds me of high school', u'catchy', u'Alternative  Punk', u'lyrics', u'friendsofthekingofrummelpop', u'rockin', u'heard on last-fm', u'festive fifty', u'playful Indie yolala', u'So 90s', u'great basslines', u'Rock  Pop', u'critically acclaimed song', u'acclaimed music top 3000 bubbling under', u'90s craze', u'teen angst mix', u'pop slash rock', u'nostalji', u'in the lab', u'my new theme song', u'tseuq rock', u'anilar', u'Good Britpop', u'seen live']"
715,Ziet Em Doen,2,25,0,[]
716,Codo,18012,64198,0,"[u'NDW', u'80s', u'Neue Deutsche Welle', u'deutsch', u'german', u'codo', u'80er', u'party', u'austrian', u'gute laune', u'1983', u'pop', u'new wave', u'austro pop', u'space', u'comedy', u""80's"", u'German Pop', u'1980s', u'one hit wonder', u'inga humpe', u'die wahren perlen deutschsprachiger popmusik', u'christian alexander tietgen', u'classic', u'alternative', u'electro', u'Awesome', u'weird', u'germany', u'synth', u'eighties', u'dream pop', u'oldies', u'austropop', u'excellent', u'1', u'deutschland', u'male vocalists', u'dj', u'wave', u'Favourites', u'silly', u'perlen deutschsprachiger popmusik', u'ilikeit', u'nostalgia', u'Lea', u'Austria', u'lol', u'eclectonia', u'7 of 10 stars']"
717,suds.&.soda,12,32,0,[]
718,I <3 U So,91561,458410,222000,"[u'dubstep', u'2011', u'dance', u'House', u'electronica', u'french', u'french house', u'BIRP', u'electronic', u'ed banger', u'Love', u'electro house', u'trip hop', u'breaks', u'amazing', u'great song', u'good', u'soulful', u'sappy', u'Anthemic', u'kat fm', u'One of the best', u'powerful', u'<3', u'dancefloor', u'june', u'metro downtempo', u'loved tracks', u'eurosport', u'radio nova', u'deftfavourite', u'p6dramaja', u'Giusychevola e che ama', u'giusychevola gifts from friends', u'but why i love you i never know']"
719,All the Small Things,1110895,8033598,168000,"[u'punk rock', u'punk', u'rock', u'pop punk', u'Blink 182', u'alternative', u'90s', u'all the small things', u'alternative rock', u'pop', u'american', u'blink-182', u'party', u'favorites', u'catchy', u'fun', u'emo', u'happy', u'skate punk', u'blink', u'Awesome', u'Pop-punk', u'pop rock', u'California', u'00s', u'rock band', u'indie', u'Energetic', u'punk pop', u'2000', u'BliNk182', u'blink 182 - all the small things', u'seen live', u'indie rock', u'hard rock', u'Love', u'summer', u'memories', u'guitar', u'upbeat', u'male vocalist', u'male vocalists', u'funny', u'2000s', u'na na na', u'classic', u'hardcore', u'USA', u'nostalgia', u'1999']"
720,Big In Japan (Original),5737,22827,286000,"[u'80s', u'new wave', u'synthpop', u'KS rocky', u'electronic', u'pop', u'dance', u'memories', u'synth pop', u'synth', u'new romantic', u'hot', u'I like this', u'1980s', u'top 100', u'top 10', u'superhit', u'oldiebutgoodie', u'Big in Japan', u'All time hit', u'ailenrocsongs', u'ailenroc80s', u'Egoist', u'gia tunes', u'Middle 1980s', u'KS dance', u'alphaville-big in japan']"
721,Who Is the King,556,1664,211000,[]
722,Are You With Me,56614,446318,137000,"[u'deep house', u'2015', u'House', u'electronic', u'electronica', u'party', u'belgian', u'love at first listen', u'10s', u'radio-andree', u'Happy songs', u'instant happiness', u'holiday songs', u'2014 single', u'bbc radio1 playlist 2015', u'uk number one', u'songs that remind me of places', u'are you with me', u'christian alexander tietgen', u'german number one', u'One Moment In Time', u'playlista rmf fm', u'australian number one']"
723,Wait and Bleed,775785,5662151,147000,"[u'metal', u'Nu Metal', u'Slipknot', u'heavy metal', u'rock', u'alternative metal', u'Nu-metal', u'hard rock', u'hardcore', u'alternative', u'metalcore', u'death metal', u'angry', u'aggressive', u'FUCKING AWESOME', u'Slipknot - Wait and Bleed', u'thrash metal', u'Wait and Bleed', u'heavy', u'Awesome', u'alternative rock', u'american', u'rapcore', u'maggot music', u'corey taylor', u'favorite songs', u'1999', u'seen live', u'punk', u'favorites', u'groove metal', u'bleed', u'wait', u'dark', u'new metal', u'Soundtrack', u'rap metal', u'radioultra', u'Grunge', u'emo', u'industrial', u'cool', u'I love this song', u'powerful', u'favourite vocalists', u'fucking good', u'sufu5a']"
724,Bullet in the Head,587925,2832734,308000,"[u'rock', u'alternative rock', u'political', u'alternative', u'metal', u'rapcore', u'Rage Against The Machine', u'90s', u'hard rock', u'rap metal', u'crossover', u'alternative metal', u'funk metal', u'angry', u'ratm', u'rage', u'rap', u'funk', u'american', u'punk', u'Hip-Hop', u'indie', u'hardcore', u'bass', u'Nu Metal', u'Awesome', u'1992', u'jump da fuck up', u'hip hop', u'Hard', u'guitar', u'Funk Rock', u'rap rock', u'political rock', u'heavy metal', u'Grunge', u'REVOLUTIONARY', u'Zack de la Rocha', u'heavy', u'favorites', u'Favourites', u'8 of 10 stars', u'90s Rock', u'tom morello', u'Morose Deep dilate Crimson', u'revolution', u'experimental', u'Progressive metal', u'energy', u'Progressive']"
725,Somebody Told Me,1567313,11698639,197000,"[u'rock', u'indie', u'indie rock', u'alternative', u'The Killers', u'alternative rock', u'pop', u'Killers', u'00s', u'somebody told me', u'favorites', u'britpop', u'american', u'pop rock', u'synth rock', u'dance', u'catchy', u'party', u'favorite songs', u'seen live', u'indie pop', u'new wave', u'male vocalists', u'The Killers - Somebody Told Me', u'electronic', u'Favorite', u'Awesome', u'Favourites', u'Love', u'2004', u'dance rock', u'Energetic', u'punk rock', u'fun', u'glam rock', u'british', u'punk', u'cool', u'upbeat', u'Love it', u'electronica', u'love at first listen', u'las vegas', u'post-punk', u'2005', u'Favourite Songs', u'favourite', u'good', u'i am a party girl here is my soundtrack', u'songs that make me move']"
726,Parklife,546222,2724705,185000,"[u'britpop', u'british', u'90s', u'indie', u'rock', u'alternative', u'blur', u'indie rock', u'pop', u'alternative rock', u'fun', u'1994', u'brit pop', u'Parklife', u'UK', u'happy', u'catchy', u'Favourites', u'damon albarn', u'seen live', u'indie pop', u'favorites', u'spoken word', u'male vocalists', u'memories', u'summer', u'funny', u'british i like', u'phil daniels', u'pop rock', u'Love', u'Alternative  Punk', u'england', u'favourite', u'Favorite', u'english', u'Favourite Songs', u'Brit-pop', u'Britrock', u'classic rock', u'male', u'epic', u'london', u'new', u'cheerful', u'cool', u'male vocalist', u'Brit', u'All time favourites', u'cockney']"
727,Come On Inside,1817,4755,162000,"[u'alternative rock', u'Chicks that Rock', u'nuff said', u'beanoboo']"
728,Fuck Authority,128405,563622,196000,"[u'punk', u'punk rock', u'political', u'rock', u'pennywise', u'hardcore', u'skate punk', u'melodic hardcore', u'seen live', u'american', u'punkrock', u'political punk', u'hardcore punk', u'Fuck Authority', u'favorites', u'00s', u'Classic Punk', u'favorite songs', u'fast', u'90s', u'angry', u'California', u'street punk', u'Faves', u'Punk-Rock', u'5 of 10 stars', u'epitaph', u'makes me sing', u'fuck u', u'Pennywise - Fuck Authority', u'male', u'alternative', u'alternative rock', u'post-punk', u'Awesome', u'bass', u'upbeat', u'bounce', u'party', u'Random', u'best', u'psycho', u'anarcho punk', u'anarchy', u'9 of 10 stars', u'best of 2001', u'gute laune', u'fuck', u'Protest', u'REVOLUTIONARY']"
729,Stories,715,2197,256000,[]
730,Sleeping Room,997,3021,266000,[]
731,Same City,658,1912,448000,[]
732,Return,1130,3673,330000,[]
733,One Note Song,733,2082,281000,[]
734,Lucile,975,3142,288000,[]
735,Landlord,867,2689,478000,[]
736,Hardcore,787,2327,339000,[]
737,City,1601,5348,392000,[]
738,Words on Paper,888,3088,0,[]
739,Golden Serpents,1201,4013,349000,[]
740,Vantablack,1126,4107,602000,[]
741,Skeleton Tree,39025,144019,243000,"[u'<3', u'Nick Cave', u'nick cave & the bad seeds', u'skeleton tree']"
742,Distant Sky,36557,135156,336000,"[u'dark', u'love at first listen', u'Nick Cave']"
743,I Need You,44280,171559,358000,"[u'sad', u'Nick Cave', u'2016', u'best of 2016', u'Nennes yearlist', u'nick cave & the bad seeds', u'skeleton tree', u'nennes yearlist 2016']"
744,Anthrocene,38756,134793,274000,"[u'band', u'<3', u'Nick Cave', u'nick cave & the bad seeds', u'skeleton tree']"
745,Magneto,41179,149930,322000,"[u'Oh the urge to kill somebody was basically overwhelming - I had such hard blues down there in the supermarket queues', u'alternative', u'experimental', u'sad', u'dark', u'one more time with feeling', u'Darac XoX']"
746,Girl in Amber,44402,177277,0,"[u'sad', u'piano', u'Nick Cave', u'\u2665', u'skeleton tree']"
747,Rings of Saturn,52035,195681,0,"[u'alternative', u'4 Stars', u'Nick Cave', u'sun and moon and stars and outer space', u'nick cave & the bad seeds', u'skeleton tree', u'hi rap']"
748,Jesus Alone,54620,198715,352000,"[u'alternative', u'alternative rock', u'australian', u'4 Stars', u'Nick Cave', u'2016', u'somafm', u'Bagel', u'blurry', u'bewitching', u'2016 single', u'nick cave & the bad seeds']"
749,Ain t Much Loving,489,1791,0,[]
750,Get Outta This Place,2340,6467,0,[]
751,Voodoo Queen,2415,6973,0,[]
752,Shaman Blues,2513,7152,0,[]
753,One Day,2569,7202,0,[]
754,Love & death,2599,7263,0,[]
755,Magdalene,2767,7942,0,[]
756,"Of sirens, vampires and lovers",2873,8039,0,[]
757,Better the Devil I Know,2845,8045,0,[]
758,Cross My Heart And Hope To Die,4089,14234,0,[u'polish']
759,On the Road,3273,9463,0,[]
760,Nightride,3805,10465,0,[]
761,My Church Is Black,8570,28150,0,[]
762,When A Blind Man Cries,25426,110180,275000,"[u'cover', u'hard rock', u'classic rock', u'heavy metal', u'rock', u'deep purple', u'James Hetfield', u'Music Choice: Rock', u'metal', u'chillout', u'chill', u'classic', u'70s', u'sad', u'world', u'Awesome', u'guitar', u'bass', u'drums', u'3', u'american', u'covers', u'emotional', u'melancholic', u'World Music', u'Ballad', u'Awesome Guitar Jams', u'cover songs', u'Favorite', u'Tribute', u'rock ballad', u'design', u'2012', u'10s', u'2010s', u'classic hard rock', u'metallica', u'1972', u'when', u'man', u'sunflower', u'the word man', u'the word when', u'Guitar Solo', u'ROBERT TRUJILLO', u'classic metal', u'Awesome solo', u'Blind', u'Machine Head', u'Kirk Hammett']"
763,Ronnie Rising Medley (A Light In The Black / Tarot Woman / Stargazer / Kill The King),10981,27965,543000,"[u'Awesome', u'thrash metal', u'Favorite', u'Guitar Solo', u'DELUXE EDITION']"
