,Songs,Listeners,Playcount,Duration,Tags
0,Guest Room,248960,2042204,200000,"[u'indie rock', u'rock', u'indie', u'alternative', u'alternative rock', u'The National', u'american i like', u'night', u'american', u'melancholy', u'2007', u'Bittersweet', u'00s', u'male vocals', u'fucking brilliant', u'boxer', u'vugube62', u'indie pop', u'USA', u'Awesome', u'melancholic', u'loved', u'relax', u'Favourites', u'american rock', u'best new sounds', u'seen live', u'pop', u'favorite songs', u'folk', u'Alternative  Punk', u'britpop', u'Brooklyn', u'Mellow', u'modern rock', u""80's"", u'Favorite', u'best of 2008', u'love at first listen', u'wall of sound', u'News', u'3 stars', u'Lowlands', u'guests', u'rooms', u'soothing', u'nonsensical', u'mid', u'Love this song', u'post punk revival']"
1,Start a War,287117,2573542,198000,"[u'indie', u'indie rock', u'rock', u'alternative', u'acoustic', u'american', u'melancholy', u'house md', u'Mellow', u'american i like', u'seen live', u'loved', u'00s', u'alternative rock', u'USA', u'The National', u'vugube62', u'beautiful', u'atmospheric', u'late night', u'melancholic', u'Favourites', u'9 of 10 stars', u'2000s', u'real', u'quiet hours of the night', u'saddest sad-ass songs', u'lyrics like a poem', u'similar to: wilco', u'similar to: nick drake', u'pxs: loved', u'pop', u'Love', u'dark', u'Alternative  Punk', u'americana', u'britpop', u'House', u'tv', u'Brooklyn', u'insane', u'Favorite Artists', u'raw', u'male vocalist', u'bliss', u'unusual', u'best song ever', u'gorgeous', u'baritone', u'war']"
2,Apartment Story,279678,2696356,214000,"[u'indie rock', u'rock', u'indie', u'alternative', u'american', u'00s', u'seen live', u'beautiful', u'catchy as hell', u'american i like', u'alternative rock', u'amazing', u'shoegaze', u'Brooklyn', u'2007', u'intimate', u'Uplifting', u'great lyrics', u'Favourites', u'optimism', u'The National', u'boxer', u'vugube62', u'USA', u'favorites', u'Love', u'Awesome', u'pretty', u'melancholic', u'love at first listen', u'perfect', u'Perfection', u'reassuring', u'rockin', u'open road', u'american rock', u'catchiness', u'cant resist singing along', u'2007 Fave Songs', u'pop', u'chill', u'favorite songs', u'new york', u'happy', u'cute', u'Alternative  Punk', u'britpop', u'lounge', u'Driving', u'Reflective']"
3,Slow Show,328200,3547941,250000,"[u'indie rock', u'indie', u'rock', u'alternative', u'beautiful', u'gossip girl', u'you know i dreamed about you for 29 years before i saw you', u'melancholic', u'Love', u'american', u'Bittersweet', u'love at first listen', u'so beautiful it hurts', u'acoustic', u'seen live', u'2007', u'00s', u'Chuck', u'The National', u'Mellow', u'One Tree Hill', u'american i like', u'hurts when I listen to it', u'sad', u'favorites', u'piano', u'melancholy', u'emotional', u'Perfection', u'quiet hours of the night', u'alternative rock', u'sexy', u'indie pop', u'slow', u'Awesome', u'narrative', u'male vocalists', u'lovely', u'love the lyrics', u'as good as it gets', u'boxer', u'I dreamed about you before I saw you', u'we are in our car and we dont care', u'slow show', u'vugube62', u'chill', u'folk', u'singer-songwriter', u'USA', u'memories']"
4,Green Gloves,276217,2457969,219000,"[u'indie rock', u'rock', u'indie', u'alternative', u'lovedbyale', u'american', u'melancholic', u'The National', u'One Tree Hill', u'american i like', u'seen live', u'alternative rock', u'beautiful', u'Mellow', u'00s', u'melancholy', u'gentle', u'male vocalists', u'love at first listen', u'boxer', u'vugube62', u'chillout', u'folk', u'sad', u'USA', u'favorites', u'Love', u'Brooklyn', u'genius', u'2007', u'lyrical', u'perfect', u'My favourite', u'lovely voice', u'green gloves', u'pop', u'chill', u'favorite songs', u'new york', u'slow', u'Alternative  Punk', u'britpop', u'beauty', u'amazing', u'Rainy Day', u'intense', u'Bittersweet', u'relaxing', u'5 Stars', u'9 of 10 stars']"
5,Squalor Victoria,267158,2413649,181000,"[u'indie rock', u'rock', u'indie', u'alternative', u'american', u'seen live', u'american i like', u'The National', u'my ears find this style of drumming pleasing', u'alternative rock', u'strings', u'violin', u'sweet drums', u'vugube62', u'folk', u'USA', u'night', u'Brooklyn', u'melancholy', u'melancholic', u'Bittersweet', u'loved', u'00s', u'american rock', u'pop', u'favorite songs', u'favorites', u'Alternative  Punk', u'beautiful', u'cello', u'Drum', u'insane', u'Mellow', u'favorite albums', u'cool', u""80's"", u'Favorite', u'Norway', u'lyrical', u'want to see live', u'drum solo', u'9 of 10 stars', u'male vocals', u'angst', u'eclectonia', u'6 of 10 stars', u'favourite albums', u'national anthems', u'eric', u'Female Names']"
6,Brainy,283800,2726015,196000,"[u'indie rock', u'indie', u'rock', u'alternative', u'melancholy', u'lovedbygdchill', u'american', u'obsessive', u'Beautifully creepy', u'pop', u'american i like', u'post-punk', u'00s', u'The National', u'favorites', u'night', u'melancholic', u'vugube62', u'seen live', u'USA', u'epic', u'dark', u'upbeat', u'2007', u'Uplifting', u'creepy', u'easy', u'alternative punk', u'boxer', u'hubba-hubba', u'just cannot forget that voice', u'I would put this song in a movie', u'living underwater', u'similar to: modest mouse', u'chill', u'alternative rock', u'folk', u'new york', u'Love', u'Alternative  Punk', u'Awesome', u'lounge', u'loud', u'Brooklyn', u'Mellow', u'soft', u'I like', u'relaxing', u""80's"", u'baritone']"
7,Mistaken for Strangers,342451,3573454,211000,"[u'indie rock', u'indie', u'rock', u'alternative', u'post-punk', u'alternative rock', u'beautiful', u'00s', u'atmospheric', u'american', u'The National', u'melancholy', u'2007', u'seen live', u'Brooklyn', u'best of 2007', u'american i like', u'favorite songs', u'Love', u'upbeat', u'intense', u'interpol', u'sad', u'USA', u'dark', u'Gothic', u'Awesome', u'night', u'moody', u'drums', u'melancholic', u'cool', u'dance music for darkened floors', u'fucking catchy', u'Do caralho', u'Freaking Amazing', u'surprise surprise they wouldnt wanna watch', u'vugube62', u'grindcore', u'favorites', u'epic', u'genius', u'male vocalists', u'Favourites', u'love at first listen', u'male vocals', u'2000s', u'a subtle use of vocal harmony', u'electric rhythm guitars', u'extensive vamping']"
8,Fake Empire,448201,4837815,205000,"[u'indie rock', u'indie', u'rock', u'alternative', u'beautiful', u'melancholy', u'piano', u'seen live', u'melancholic', u'The National', u'Mellow', u'favorites', u'american', u'amazing', u'best of 2007', u'One Tree Hill', u'2007', u'00s', u'Perfection', u'new york', u'indie pop', u'post-punk', u'love at first listen', u'walking the streets at night with your headphones on', u'pop', u'chill', u'sad', u'USA', u'atmospheric', u'loved', u'Favorite', u'Chuck', u'american i like', u'best tracks of 2007', u'alternative rock', u'favorite songs', u'memories', u'Love', u'Awesome', u'horns', u'late night', u'intense', u'relaxation', u'while walking at night in the city', u'acoustic', u'night', u'summer', u'male vocalists', u'Favourites', u'perfect to listen to while leaving the planet']"
9,You Were a Kindness,66789,326373,265000,"[u'Bittersweet', u'indie rock', u'piano', u'indie', u'rock', u'alternative', u'alternative rock', u'favorite songs', u'depressed', u'post-punk', u'american', u'introspective', u'Mellow', u'melancholy', u'melancholic', u'depressing', u'lovely', u'nostalgia', u'perfect', u'I love this song', u'10s', u'wah', u'best songs ever', u'nonsensical', u'heartbroken', u'fucking incredible', u'song that make me cry', u'post punk revival', u'fools in love', u'love love and more love', u'Dear Diary', u'a hunter for a lonely heart', u'el soundtrack de mi vida', u'melancholic mood', u'life song', u'sad blue tears favorite versailles', u'songs i should put in a fanmix someday', u'these songs feel the same', u'voice is perfect']"
10,Wake Up Your Saints,65426,309959,254000,"[u'indie rock', u'i just love any song by the national', u'indie', u'rock', u'alternative rock', u'happy', u'american', u'Mellow', u'melancholic', u'lovely', u'love at first listen', u'2010', u'Ecstasy', u'10s', u'nonsensical', u'Ion B radio', u'post punk revival', u'soundtrack to my life', u'3-stars', u'dia de los muertos', u'every name has a story', u'Bellezza', u'Buon umore', u'high violet expanded version', u'the nationalll', u'iras favourite', u'oh this voice', u'and hers']"
11,Terrible Love (Alternate Version),74201,368554,258000,"[u'indie rock', u'indie', u'alternative', u'alternative rock', u'american', u'Alternate', u'rock', u'Brooklyn', u'Mellow', u'melancholic', u'Favourites', u'road trip', u'2010', u'10s', u'as good as it gets', u'The National', u'nonsensical', u'Ion B radio', u'top quality', u'we have weirdback', u'post punk revival', u'Possibly one of the best songs ever', u'worth dying for', u'pa volim te', u'perfect version', u'he was my friend justice', u'Band: The National']"
12,Vanderlyle Crybaby Geeks,246978,2104872,252000,"[u'indie rock', u'rock', u'indie', u'american', u'Awesome', u'american i like', u'beautiful', u'Chuck', u'Music you should have listened to before you die die die', u'alternative', u'melancholy', u'male vocalists', u'10s', u'seen live', u'2010', u'god I love this song', u'songs that make me remember things', u'vugube62', u'chill', u'acoustic', u'violin', u'summer', u'Mellow', u'melancholic', u'4ad', u""Grey's Anatomy"", u'best of 2010', u'autumn', u'The National', u'so good i forget to breathe', u'Songs from tv', u'shut the fuck up and listen at night', u'just fucking brilliant', u'Consistent Dodo Radio - Flittering', u'has a special meaning now', u'piuvicini', u'walking alone at night through the city streets smoking too many cigarettes and thinking about how much you love her', u'alternative rock', u'folk', u'sad', u'post-rock', u'USA', u'favorites', u'piano', u'epic', u'new wave', u'fantastic', u'lounge', u'Brooklyn', u'Garage Rock']"
13,England,284706,2489460,340000,"[u'indie rock', u'rock', u'indie', u'beautiful', u'alternative rock', u'epic', u'seen live', u'american i like', u'alternative', u'england', u'american', u'2010', u'10s', u'favorites', u'melancholic', u'piano rock', u'male vocalists', u'vugube62', u'Awesome', u'haunting', u'melancholy', u'loved', u'Heartbreaking', u'lovely', u'night drive', u'come back and haunt me', u'downtempo', u'USA', u'Love', u'acoustic', u'strings', u'violin', u'Brooklyn', u'Mellow', u'deep', u'Bittersweet', u'male vocalist', u'4ad', u'best song ever', u'gorgeous', u'Favorite', u'brilliant', u'greys anatomy', u""Grey's Anatomy"", u'comfort', u'best of 2010', u'New York City', u'personal favourites', u'love the lyrics', u'2010s']"
14,Conversation 16,289403,2916583,258000,"[u'indie rock', u'indie', u'rock', u'alternative rock', u'lizvelrene2010', u'seen live', u'alternative', u'best of 2010', u'post-punk', u'Mellow', u'melancholic', u'2010', u'beautiful', u'american', u'american i like', u'love at first listen', u'sad', u'post-rock', u'haunting', u'emotional', u'great lyrics', u'10s', u'The National', u'vugube62', u'new york', u'experimental', u'USA', u'favorites', u'slow', u'dark', u'me', u'melancholy', u'relaxing', u'depressing', u'my brain sings', u'roadtrip', u'lovely', u'lyrics', u'autumn', u'personal favourites', u'love the lyrics', u'<3', u'fucking genius', u'airplane sounds', u'Songs seen played live', u'gonul teli', u'LifeSong', u'weeta', u'drunken anthem', u'Consistent Dodo Radio - Flittering']"
15,Runaway,291366,2409269,333000,"[u'indie rock', u'indie', u'rock', u'alternative', u'american', u'alternative rock', u'beautiful', u'american i like', u'Mellow', u'melancholy', u'lovely', u'2010', u'perfect', u'10s', u'The National', u'vugube62', u'seen live', u'epic', u'Awesome', u'amazing', u'melancholic', u'makes me cry', u'better than god', u'chillax', u'skins', u'runaway', u'High Violet', u'Consistent Dodo Radio - Flittering', u'miasto w deszcz', u'similar to: pavement', u'sad', u'USA', u'favorites', u'Love', u'post-punk', u'me', u'Sleep', u'great song', u'indie folk', u'loved', u'male vocalist', u'Norway', u""Grey's Anatomy"", u'wow', u'8 of 10 stars', u'best of 2010', u'running', u'spring', u'I love this song', u'fuckin genius']"
16,Lemonworld,280343,2588618,203000,"[u'indie rock', u'rock', u'indie', u'american', u'Mellow', u'alternative rock', u'melancholy', u'american i like', u'alternative', u'2010', u'beautiful', u'Perfection', u'male vocals', u'10s', u'The National', u'Greatest fuckin song ever', u'pure musical genius', u'vugube62', u'seen live', u'favorite songs', u'sad', u'singer-songwriter', u'USA', u'favorites', u'Love', u'melancholic', u'the world could end while im listening to it and i wouldnt notice', u'music I wanna hug but can not hug because it is music and you can not hug sounds', u'post-rock', u'epic', u'post-punk', u'peace', u'narrative', u'ethereal', u'loved', u'Favorite', u'melody', u'lovely', u'love at first listen', u'perfect', u'food', u'2010s', u'The Vampire Diaries', u'Excellent tune', u'stories', u'jesus christ', u'create new tag', u'best songs of 2010', u'sad and beautiful', u'nonsensical']"
17,Bloodbuzz Ohio,398411,3987672,275000,"[u'indie rock', u'indie', u'rock', u'2010', u'post-punk', u'alternative', u'american', u'10s', u'alternative rock', u'best of 2010', u'lizvelrene2010', u'seen live', u'epic', u'love at first listen', u'Perfection', u'Masterpiece', u'The National', u'american i like', u'melancholy', u'roadtrip', u'post-rock', u'beautiful', u'Mellow', u'Bittersweet', u'bliss', u'Contemplation', u'skins', u'Post-punk revival', u'unique vocalists', u'All the cool kids listen to this', u'vugube62', u'Love', u'atmospheric', u'Brooklyn', u'amazing', u'ethereal', u'melancholic', u'loved', u'cool', u'4ad', u'yearning', u'Ohio', u'Favorite', u'lovely', u'FM4', u'inspiring', u'New York City', u'states', u'Supercalifragilisticexpialidocious', u'best songs of 2010']"
18,Afraid of Everyone,300832,2726953,259000,"[u'indie rock', u'indie', u'alternative', u'rock', u'beautiful', u'lovedbyale', u'seen live', u'post-punk', u'haunting', u'Masterpiece', u'10s', u'american i like', u'2010', u'alternative rock', u'melancholic', u'male vocalists', u'best of 2010', u'sufjan stevens', u'Awesome', u'american', u'melancholy', u'emotional', u'reflection', u'love the lyrics', u'Post-punk revival', u'mpsvd-luisterpaal-j', u'vugube62', u'chill', u'sad', u'Mellow', u'great', u'Heartbreaking', u'gossip girl', u'Soundtrack Of My Life', u'indiena sound', u'cinder', u'post-rock', u'USA', u'favorites', u'london', u'Driving', u'Brooklyn', u'Like', u'Tense', u'post rock', u'great song', u'loved', u'male vocalist', u'4ad', u'great lyrics']"
19,Little Faith,273044,2291288,276000,"[u'indie rock', u'rock', u'indie', u'alternative', u'alternative rock', u'american', u'melancholy', u'american i like', u'10s', u'vugube62', u'post-punk', u'strings', u'moody', u'violin', u'Mellow', u'melancholic', u'love at first listen', u'2010', u'delicious', u'Post-punk revival', u'chillout', u'seen live', u'folk', u'sad', u'post-rock', u'USA', u'favorites', u'omg', u'epic', u'Brooklyn', u'post rock', u'loved', u'00s', u'running', u'New York City', u'FUCKING AWESOME', u'Masterpiece', u'radio paradise', u'radioparadise', u'favorite song', u'7 of 10 stars', u'6 of 10 stars', u'The National', u'IIIIIIIIII AMAZING TRACK :D IIIIIIIIII', u'nonsensical', u'my life', u'mid', u'Ion B radio', u'top quality', u'beggars banquet']"
20,Anyoneâ€™s Ghost,154401,844668,0,"[u'indie rock', u'lovedbyale', u'american i like', u'vugube62', u'post-rock', u'2010', u'album favorite', u'listened to this ironically', u'seen live', u'indie', u'alternative rock', u'winter', u'Mellow', u'amazing', u'melancholic', u'loved', u'lovely', u'10s', u'Excellent tune', u'Sombre', u'nonsensical', u'Songs seen played live', u'winter 10', u'hotlist2010', u'post punk revival', u'teenage love between the sheets', u'taught me to grow', u'teenage fan girl', u'soundtrack to my wasted life', u'christmoose', u'Giusychevola e che ama', u'iras favourite', u'i lust']"
21,Sorrow,350230,3324125,205000,"[u'indie rock', u'indie', u'rock', u'alternative', u'love at first listen', u'alternative rock', u'beautiful', u'lizvelrene2010', u'sad', u'melancholy', u'american', u'2010', u'10s', u'american i like', u'Mellow', u'The National', u'melancholic', u'male vocalists', u'makes me cry', u'Sad Songs For Being Alone', u'mpsvd-luisterpaal-j', u'vugube62', u'seen live', u'slow', u'psychedelic', u'strings', u'winter', u'WBER', u'Heartbreaking', u'angst', u'skins', u'songs that i will still be listening to in a billion years', u'music to hear alone', u'my essential songs', u'songs to break up to', u'Consistent Dodo Radio - Flittering', u'sherlock feels', u'USA', u'favorites', u'memories', u'Love', u'epic', u'acoustic', u'night', u'song', u'me', u'download', u'deep', u'12', u'amazing']"
22,Terrible Love,340174,2988757,279000,"[u'indie rock', u'indie', u'rock', u'alternative rock', u'2010', u'lizvelrene2010', u'alternative', u'seen live', u'beautiful', u'love at first listen', u'american', u'melancholic', u'10s', u'american i like', u'epic', u'Brooklyn', u'just fucking brilliant', u'Consistent Dodo Radio - Flittering', u'vugube62', u'Mellow', u'male vocalists', u'compulsive repeat listenings', u'I love this song', u'songs that make me remember things', u'High Violet', u'folk', u'USA', u'shoegaze', u'Hope', u'summer', u'crescendo', u'emotional', u'indie folk', u'modern rock', u'4ad', u'Favorite', u'Norway', u'fav', u'Sigh and swoon in equal measure', u'best', u'Favourites', u'wall of sound', u'8 of 10 stars', u'best of 2010', u'running', u'spring', u'New York City', u'personal favourites', u'favorite song', u'love the lyrics']"
23,Just One of the Guys,80316,323558,231000,"[u'alternative', u'american', u'indie pop', u'indie rock', u'dream pop', u'fallon', u'2010s', u'somafm', u'conan', u'2014 single', u'favorites 2014', u'Bagel', u'Channel X', u'sharv11', u'music choice: indie']"
24,She's Not Me,53292,222985,249000,"[u'alternative', u'american', u'Heartbreaking', u'2010s', u'envy', u'tragedy', u'reminisce', u'2014 single', u'Meyers', u'music choice: indie']"
25,Just Breathe (feat. Katie Kim),65,102,0,[]
26,The Science of Summer,483,761,0,[]
27,So I Can See the Stars (feat. Ken Lally),31,41,0,[]
28,Stars Prelude,28,37,0,[]
29,Kissing Sparks (feat. Aisling Browne),30,40,0,[]
30,Amy (feat. Susan O'Neill),30,41,0,[]
31,Pleasure Evidence (feat. Ken Lally),48,88,0,[]
32,Take Me with You (feat. Cat Dowling),1486,3416,0,[u'how to get away with murder']
33,The Church,2558,6786,181000,[]
34,Drowning,14798,120305,108000,"[u'Soundtrack', u'instrumental', u'contemporary classical', u'cinematic', u'amazing', u'composers', u'polish', u'film score', u'2010', u'Low', u'string', u'mid', u'Instrumentale', u'chambre meublee', u'de mannen van de movies', u'salon', u'the string component', u'was eine scatullae my heart', u'the kitsch component', u'red is darker than green at night bastardo beloved']"
35,Stillness of the Mind,21786,195691,234000,"[u'Soundtrack', u'instrumental', u'contemporary classical', u'classic', u'Mellow', u'beautiful', u'ost', u'polish', u'movie score', u'songs that make me cry', u'so sad', u'the string component', u'a single man', u'pop', u'chill', u'80s', u'ska', u'Dreamy', u'cinematic', u'lounge', u'atmospheric', u'Adult Alternative', u'melancholic', u'composers', u'wish list', u'neo classical', u'loneliness after dusk', u'80s Pop', u'Low', u'All', u'string', u'stillness', u'Amazing music', u'mid', u'spine tingling', u'smoothy', u'Instrumentale', u'chambre meublee', u'de mannen van de movies', u'low key classic', u'salon', u'movie ost', u'was eine scatullae my heart', u'red is darker than green at night bastardo beloved', u'last penis audacieux', u'aufgerissene buesten ohne badekappen', u'all the good times and the flowers and the wine', u'Abel Korzeniowski', u'Top Artist 2012', u'filmweb']"
36,Halfway to Nowhere,10198,33369,0,[]
37,Halfway to Nowhere,10198,33369,0,[]
38,Halfway to Nowhere,10198,33369,0,[]
39,Halfway to Nowhere,10198,33369,0,[]
40,Halfway to Nowhere,10198,33369,0,[]
41,Halfway to Nowhere,10198,33369,0,[]
42,Halfway to Nowhere,10198,33369,0,[]
43,Halfway to Nowhere,10198,33369,0,[]
44,Halfway to Nowhere,10198,33369,0,[]
45,Halfway to Nowhere,10198,33369,0,[]
46,Halfway to Nowhere,10198,33369,0,[]
47,Halfway to Nowhere,10198,33369,0,[]
48,Halfway to Nowhere,10198,33369,0,[]
49,Halfway to Nowhere,10198,33369,0,[]
50,Halfway to Nowhere,10198,33369,0,[]
51,Halfway to Nowhere,10198,33369,0,[]
52,Halfway to Nowhere,10198,33369,0,[]
53,Halfway to Nowhere,10198,33369,0,[]
54,Halfway to Nowhere,10198,33369,0,[]
55,Halfway to Nowhere,10198,33369,0,[]
56,Halfway to Nowhere,10198,33369,0,[]
57,Halfway to Nowhere,10198,33369,0,[]
58,Halfway to Nowhere,10198,33369,0,[]
59,Halfway to Nowhere,10198,33369,0,[]
60,Halfway to Nowhere,10198,33369,0,[]
61,Halfway to Nowhere,10198,33369,0,[]
62,Halfway to Nowhere,10198,33369,0,[]
63,Halfway to Nowhere,10198,33369,0,[]
64,Halfway to Nowhere,10198,33369,0,[]
65,Halfway to Nowhere,10198,33369,0,[]
66,Halfway to Nowhere,10198,33369,0,[]
67,Halfway to Nowhere,10198,33369,0,[]
68,Halfway to Nowhere,10198,33369,0,[]
69,Halfway to Nowhere,10198,33369,0,[]
70,Halfway to Nowhere,10198,33369,0,[]
71,Halfway to Nowhere,10198,33369,0,[]
72,Suicide by Star,193294,1525067,278000,"[u'post-rock', u'instrumental', u'ambient', u'post rock', u'atmospheric', u'alternative', u'experimental', u'epic', u'instrumental rock', u'indie', u'rock', u'irish', u'electronic', u'Progressive rock', u'Awesome', u'grey storia', u'Experimental Rock', u'beautiful', u'another planet', u'God Is An Astronaut', u'favorite songs', u'instrumental post-rock', u'chillout', u'shoegaze', u'00s', u'Favourite Songs', u'rustycanuckambient', u'fly high', u'Impending Doom', u'someone help me i am crashing into the sun', u'god is an atronaut', u'alternative rock', u'post', u'emotional', u'hypnotic', u'brilliant', u'Eargasm', u'Music To Die For', u'Instrumental music that makes you feel-group tag radio', u'dobra jeba na kvadrat', u'absolutte favoritter']"
73,Infinite Horizons,175264,1213336,147000,"[u'post-rock', u'instrumental', u'ambient', u'post rock', u'Experimental Rock', u'irish', u'alternative', u'atmospheric', u'experimental', u'electronic', u'Relaxing Instrumental', u'God Is An Astronaut', u'indie', u'rock', u'instrumental rock', u'Dream', u'religion', u'Instrumental music that makes you feel-group tag radio', u'sleep and dreams', u'ambient-rock', u'psychedelic', u'melancholy', u'nice', u'dream rock', u'Night Sounds', u'beyond reality', u'chill', u'alternative rock', u'sad', u'Progressive rock', u'new age', u'post', u'Progressive', u'winter', u'great', u'nostalgic', u'melancholic', u'quiet', u'beat', u'4', u'Pop-Rock', u'angel', u'autumn', u'lush', u'dreams', u'gloomy', u'lustig', u'heard on last-fm', u'ambient rock', u'they play this in the queue for heaven']"
74,A Deafening Distance,176477,1264716,228000,"[u'post-rock', u'instrumental', u'ambient', u'post rock', u'experimental', u'alternative', u'atmospheric', u'irish', u'Progressive rock', u'rock', u'indie', u'God Is An Astronaut', u'Experimental Rock', u'instrumental rock', u'melancholic', u'grey storia', u'Favorite', u'chill', u'post', u'postrock', u'Reflective', u'00s', u'electronic', u'epic', u'new wave', u'shoegaze', u'beautiful', u'Awesome', u'space rock', u'bliss', u'ireland', u'I Like It', u'instrumental post rock', u'Some of my favorite post-rock', u'electronica', u'seen live', u'UK', u'Love', u'dark', u'new age', u'night', u'guitar', u'cello', u'Dreamy', u'winter', u'Mellow', u'nostalgic', u'good', u'no wave', u'buy']"
75,Fire Flies and Empty Skies,161030,1307531,234000,"[u'post-rock', u'instrumental', u'ambient', u'experimental', u'post rock', u'atmospheric', u'electronic', u'alternative', u'rock', u'God Is An Astronaut', u'indie', u'instrumental rock', u'irish', u'this is what I want my dreams to sound like', u'Experimental Rock', u'beautiful', u'favorite songs', u'epic', u'favourite', u'chillout', u'melodic', u'another planet', u'dreamscape', u'slgdm', u'punk', u'alternative rock', u'indie rock', u'Progressive rock', u'electro', u'favorites', u'happy', u'shoegaze', u'Awesome', u'post', u'space rock', u'melancholic', u'nice', u'quiet', u'cool', u'prog rock', u'Favorite', u'fav', u'melody', u'check out', u'addictive', u'sweet', u'perfect', u'instrumental post-rock', u'good morning', u'autumn']"
76,Forever Lost,208805,1657737,380000,"[u'post-rock', u'instrumental', u'ambient', u'experimental', u'post rock', u'atmospheric', u'alternative', u'chillout', u'beautiful', u'piano', u'indie', u'rock', u'irish', u'when life seems to be too much I just listen to this with my eyes closed and my mind in blank', u'Progressive rock', u'chill', u'Awesome', u'All time favourites', u'forever lost', u'grey storia', u'postrock', u'amayzes loved', u'God Is An Astronaut', u'electronic', u'melodic', u'duyster', u'counting black sheep zzz', u'Experimental Rock', u'shoegaze', u'instrumental rock', u'post', u'Mellow', u'melancholic', u'nice', u'love at first listen', u'davaho53', u'stunning instrumentals', u'Music that gets you high', u'tears come pouring down my face when i listen to this', u'True Beauty', u'sad', u'smooth', u'amazing', u'Ambiente', u'autumn', u'iLikeTHisSONG', u'simply fucking awesome', u'jennis beste favoritter', u'the fading', u'what the fuck just happened']"
