,Songs,Listeners,Playcount,Duration,Tags
336,Fragile,16607,44581,208000,"[u'piano', u'experimental', u'minimal', u'Classical', u'instrumental', u'sleepy', u'Atmosphere', u'le kiff', u'best ambient', u'piano based', u'you should hear me play piano', u'best experimental', u'Hauschka Piano']"
337,Avril 14th,390184,2480259,125000,"[u'piano', u'ambient', u'instrumental', u'beautiful', u'electronic', u'chillout', u'aphex twin', u'idm', u'chill', u'experimental', u'melancholy', u'Mellow', u'relax', u'lovely', u'Love', u'relaxing', u'Marie Antoinette Soundtrack', u'electronica', u'minimal', u'romantic', u'favorites', u'sad', u'marie antoinette', u'Soundtrack', u'brilliant', u'Classical', u'nostalgic', u'cool', u'play this at my funeral', u'soundtrackgdchill', u'british', u'electro', u'Awesome', u'Dreamy', u'atmospheric', u'melancholic', u'gorgeous', u'Favourites', u'lullaby', u'prepared piano', u'avril 14th', u'dance', u'acoustic', u'easy listening', u'Warp', u'pretty', u'Favorite Artists', u'soft', u'I like', u'loved']"
338,Poland,31641,141952,210000,"[u'ambient', u'piano', u'cinematic', u'contemporary classical', u'melancholy', u'minimalism', u'melancholic', u'neoclassical', u'post-classical', u'piano ambient', u'contemporary piano', u'ambient piano', u'minimalist', u'instrumental', u'alternative', u'neo-classical', u'Experimental-Ambient', u'minimal ambient', u'electronic', u'new age', u'atmospheric', u'ethereal', u'electroacoustic', u'electro-acoustic', u'21st century classical', u'PostClassical', u'true ambient', u'zone minimal', u'modern classical', u'icelandic', u'modern composition', u'solo piano', u'minimal piano', u'mbient']"
339,They Move on Tracks of Never-Ending Light,134302,734236,416000,"[u'post-rock', u'instrumental', u'ambient', u'beautiful', u'post rock', u'emotional', u'experimental', u'dark', u'shoegaze', u'grey storia', u'indie', u'Dreamy', u'melancholic', u'dark ambient', u'loved tracks', u'electronic', u'guitar', u'late night', u'postrock', u'amazing', u'relaxing', u'quiet', u'insomnia', u'atmospheric ambient', u'seen live', u'rock', u'alternative', u'Awesome', u'peaceful', u'post', u'favourite', u'super', u'travelling', u'texas', u'Favorite', u'away', u'gaensehaut', u'Awesome song', u'3 of 10 stars', u'Night Driving', u'fucking beautiful', u'questionable content', u'awesome track', u'need to buy', u'Breathtaking', u'TX', u'exogaze', u'exogazing', u'Post-rock goodness', u'Infinite Horizons']"
340,My Neighborhood,26358,115190,287000,"[u'piano', u'ambient', u'instrumental', u'contemporary classical', u'minimalism', u'melancholy', u'melancholic', u'modern classical', u'Classical', u'Contemporary', u'minimal', u'cinematic', u'Avant-Garde', u'avantgarde', u'composer', u'quiet', u'relax', u'chill out', u'modern classic', u'neoclassical', u'contemporary instrumental', u'post-classical', u'piano ambient', u'contemporary piano', u'ambient piano', u'Piano Quiet', u'serene piano', u'qwerty101-loved piano', u'Soundtrack', u'favorites', u'Love', u'acoustic', u'new age', u'beautiful', u'atmospheric', u'hypnotic', u'nice', u'good', u'lonely', u'ruhig', u'melancholie', u'lovely', u'poignant', u'emotion', u'sensual', u'I like this', u'Fave', u'minimalist', u'martyrs', u'Sentimental']"
341,Sol,27851,125413,149000,"[u'piano', u'melancholy', u'ambient', u'contemporary classical', u'melancholic', u'piano ambient', u'ambient piano', u'cinematic', u'minimalism', u'neoclassical', u'post-classical', u'contemporary piano', u'minimalist', u'neo-classical', u'modern classical', u'minimal ambient', u'Melancholism', u'contemporary classic', u'Experimental-Ambient', u'21st century classical', u'PostClassical', u'zone minimal', u'instrumental', u'alternative', u'electroacoustic', u'electro-acoustic', u'electronic', u'new age', u'beautiful', u'atmospheric', u'ethereal', u'warm', u'neo classical', u'modern composition', u'solo piano', u'true ambient', u'minimal piano', u'deep sleep']"
342,Courage,26331,73748,201000,[]
343,Primavera,272,523,191000,[]
344,Röyksopp Forever,256497,1648958,299000,"[u'electronic', u'ambient', u'chillout', u'downtempo', u'epic', u'instrumental', u'electronica', u'strings', u'chill', u'orchestral', u'symphonic', u'electric barbarella', u'norwegian', u'lounge', u'violin', u'vule', u'trip-hop', u'beautiful', u'Dreamy', u'trip hop', u'vugube62', u'electropop', u'alternative', u'electro', u'favorites', u'calm', u'downbeat', u'Awesome', u'Mellow', u'ethereal', u'relaxing', u'nice', u'00s', u'sweet', u'FUCKING AWESOME', u'loneliness after dusk', u'royksopp', u'5 of 10 stars', u'loved tracks', u'lizvelrene2009', u'Crybs symphony', u'Soundtrack', u'indie', u'Classical', u'punk', u'experimental', u'2009', u'dance', u'synth pop', u'electro house']"
345,The Light,166219,774875,269000,"[u'ambient', u'post-rock', u'instrumental', u'indie', u'atmospheric', u'electronic', u'experimental', u'chillout', u'chill', u'grey storia', u'Progressive rock', u'Dreamy', u'nostalgic', u'relaxing', u'post rock', u'downtempo', u'shoegaze', u'Hear my thoughts', u'alternative', u'indie rock', u'calm', u'Love', u'beautiful', u'digitalis', u'relax', u'music to fall asleep to', u'ambient post-rock', u'somafm', u'The Album Leaf', u'pop', u'rock', u'USA', u'piano', u'idm', u'lounge', u'soundscape', u'american', u'winter', u'Mellow', u'melancholy', u'reflection', u'piano rock', u'cool', u'00s', u'worship', u'Ambiente', u'audioase', u'ilikeit', u'sweet', u'indie electro']"
346,Don't Get Any Closer,69790,196756,546000,"[u'ambient', u'Mellow', u'modern classical', u'indiena sound']"
347,Embers,45995,185552,218000,"[u'piano', u'ambient', u'contemporary classical', u'instrumental', u'neoclassical', u'violin', u'melancholy', u'melancholic', u'Classical', u'Love', u'beautiful', u'post-classical', u'cinematic', u'modern classical', u'contemporary piano', u'vugube62', u'sebolo90', u'electronic', u'Contemporary', u'atmospheric', u'modern classic', u'music to fall asleep to', u'contemporary instrumental', u'ambient piano', u'max richter', u'eternity and a day', u'alternative', u'experimental', u'new age', u'melodic', u'late night', u'Mellow', u'top', u'xxx', u'ethereal', u'minimalism', u'electroacoustic', u'nice', u'good', u'soulful', u'Ballad', u'Favorite', u'neo-classical', u'melancholie', u'Experimental-Ambient', u'Klassik', u'sensual', u'minimal ambient', u'Masterpiece', u'2000s']"
348,I Can Almost See You (2016 Remaster),1298,2715,255000,[]
349,Plains,67888,331836,197000,"[u'indie', u'instrumental', u'post-rock', u'ambient', u'post rock', u'somafm', u'chillout', u'chill', u'rock', u'indie rock', u'atmospheric', u'Passionate', u'postrock', u'digitalis', u'emotional', u'fip', u'san francisco', u'chill out', u'10s', u'emotive', u'2014', u'Ghostly International', u'plancha', u'art union', u'synt', u'spring 2014', u'the earth is not a cold dead place']"
350,Miss You(Original Mix),2070,6178,0,[]
351,Glámur,92930,365164,351000,"[u'ambient', u'icelandic', u'melancholy', u'iceland', u'post-rock', u'instrumental', u'Sleep', u'chillout', u'Dreamy', u'Mellow', u'Amiina', u'downtempo', u'post rock', u'chill', u'strings', u'dream pop', u'ethereal', u'sigur ros', u'vugube62', u'sebolo90', u'electronic', u'experimental', u'piano', u'scandinavian', u'violin', u'late night', u'pretty', u'melancholic', u'cool', u'wedding', u'Float', u'sounds like winter', u'life is but a dream babs', u'stonesoup', u'decompressing', u'CaroME', u'with bells', u'Soundtrack', u'seen live', u'indie', u'rock', u'alternative', u'sad', u'calm', u'Love', u'epic', u'acoustic', u'beautiful', u'melodic', u'lounge']"
352,Ciel ouvert,726,2855,342000,"[u'vule', u'chillout', u'ambient', u'light ambient', u'mind music', u'neoambient', u'Eyes Wide Open', u'downtempo', u'downbeat', u'atmospheric', u'relaxing', u'Boards of Canada', u'BoC', u'ambiOfusion', u'subsonic harmonence', u'deep electronic', u'Future structures', u'deep ocean', u'sonicwire', u'futureradio', u'outer dimensions', u'peaceful ambient', u'wide horizon', u'inflight music', u'limehyperambient', u'Soundtrack', u'experimental', u'calm', u'shoegaze', u'Warp', u'soundscape', u'psychill', u'Chillosophy', u'illbient', u'trippy', u'relax', u'chill out', u'pixies palace', u'zen', u'ultimae', u'dreamscape', u'Amb', u'wide open', u'Contemporary Electronic Soundscapes', u'open mind music', u'electronic', u'electronica', u'chill', u'idm', u'trumpet']"
353,Halcyon,37818,137841,301000,"[u'chillout', u'downtempo', u'groovesalad', u'electronica', u'beautiful', u'somafm', u'vugube62', u'electronic', u'calm', u'rock', u'ambient', u'clean', u'peaceful', u'floating', u'Passionate', u'smooth', u'relaxing', u'male vocalists', u'nighttime is the righttime', u'relax', u'fav', u'sex and the city', u'Love it', u'study', u'BG', u'psy-ambient', u'liquid soul', u'Benign', u'Jon Hopkins- Halcyon', u'Halcyon by Jon Hopkins']"
354,Gleypa okkur,61207,346078,348000,"[u'contemporary classical', u'neoclassical', u'post-classical', u'modern classical', u'piano', u'neo-classical', u'neo classical', u'PostClassical', u'post classical', u'Contemporary', u'modern composition', u'composer', u'instrumental', u'contemporary classic', u'ambient', u'beautiful', u'melancholic', u'melancholy', u'contemporary piano', u'cinematic', u'contemporary instrumental', u'minimalism', u'chillout', u'Awesome', u'modern classic', u'piano ambient', u'ambient piano', u'alternative', u'icelandic', u'minimalist', u'soundscape', u'electroacoustic', u'Experimental-Ambient', u'minimal ambient', u'electro-acoustic', u'minimal piano', u'electronic', u'Classical', u'sad', u'sadcore', u'Lo-Fi', u'new age', u'strings', u'atmospheric', u'digitalis', u'organic', u'ethereal', u'emotional', u'eerie', u'iceland']"
355,Song To The Siren (remastered),3730,8529,211000,[]
356,Song To The Siren (remastered),3730,8529,211000,[]
357,Song To The Siren (remastered),3730,8529,211000,[]
358,Song To The Siren (remastered),3730,8529,211000,[]
359,Venus Fly (feat. Janelle Monáe),12103,141235,225000,"[u'electronic', u'seen live', u'experimental', u'House', u'synthpop', u'sick', u'fire', u'best of 2015', u'heavy bass', u'hino', u'Janelle Monae', u'Janelle Mon\xe1e', u'grimes']"
360,World Princess Part II,68813,498485,305000,"[u'synthpop', u'electronic', u'electropop', u'pop', u'Grime', u'Love', u'love at first listen', u'bitpop', u'production value', u'90s EDM', u'THIS IS CANDY TO MY EARS', u'sick af', u'dirty barbie']"
361,REALiTi,107888,1106065,307000,"[u'love at first listen', u'alternative', u'synthpop', u'electronic', u'indie', u'experimental', u'Canadian', u'dream pop', u'ethereal', u'lost album', u'trance', u'trip-hop', u'seen live', u'electropop', u'pop', u'ambient', u'indie pop', u'singer-songwriter', u'dance', u'pop rock', u'Love', u'psychedelic pop', u'Dreamy', u'12', u'relaxing', u'darkwave', u'groovy', u'dance pop', u'dreampop', u'addictive', u'perfect', u'Unreleased', u'summer songs', u'demo', u'dreamwave', u'art pop', u'hino', u'2015 single', u'the demo was better', u'grimes', u'headphone heaven', u'nocne wyciszenie', u'nocna energia', u'demo version is better', u'my rainy nights in tokyo']"
362,Pin,79491,599282,212000,"[u'love at first listen', u'electropop', u'pop', u'alternative', u'synthpop', u'alternative pop', u'godly', u'best songs of 2015', u'synthwave', u'best song of the whole album']"
363,Easily,82464,547121,183000,"[u'alternative', u'indie pop', u'Love', u'synthpop', u'soulful', u'love at first listen', u'hino', u'90s revival']"
364,Artangels,84388,624111,247000,"[u'dance-pop', u'synthpop', u'love at first listen', u'omfg']"
365,Kill V. Maim,117160,1447452,0,"[u'hino', u'electronic', u'synthpop', u'electropop', u'Electroclash', u'love at first listen', u'2015', u'pop', u'Love', u'indiepop', u'synth pop', u'Canadian', u'Mellow', u'samba', u'dance pop', u'alternative pop', u'Indietronic', u'personal favourites', u'dark pop', u'art pop', u'banger', u'catchy as hell', u'Play this loud enough to raise the dead', u'best of 2015', u""can't stop listening"", u'listen on repeat', u'like a lot', u'favs 2015', u'pisou na demi', u'B E H A V E agressive!', u'crazy', u'B-E-H-A-V-E', u'WHAT IS HAPPENING RIGHT NOW', u'fresh uh', u'can listen to this song on repeat all day', u'que isso meu deus', u'me arromba grimes', u'gente do c\xe9u que hino \xe9 esse', u'2016 single']"
366,Belly of the Beat,90381,625353,205000,"[u'pop', u'synth pop', u'vocals', u'love at first listen', u'sick', u'transitions', u'clapping hands', u'like a lot', u'nudne jak american oxygen']"
367,Flesh Without Blood,144687,1393076,264000,"[u'pop', u'electronic', u'dream pop', u'love at first listen', u'best of 2015', u'synthpop', u'electropop', u'2015', u'indie', u'indie pop', u'female vocalists', u'Canadian', u'poptron', u'grimes', u'electronica', u'seen live', u'punk', u'alternative', u'indie rock', u'synth pop', u'psychedelic', u'haunting', u'party', u'dance pop', u'dreampop', u'alternative dance', u'2010s', u'4 Stars', u'concert', u'2016', u'artpop', u'best songs of 2015', u'somafm', u'experimentalpop', u'2015 single', u'bbc radio1 playlist 2015', u'mezzanine', u'favorites 2015', u'yummy goodness', u'identified', u'headphone heaven', u'cathy as hell', u'baby believe me', u'old grimes has passed away', u'reminds me oblivion', u'art angels', u'bbc radio1 playlist 2016']"
368,Scream (feat. Aristophanes),18543,140079,140000,"[u'experimental', u'electronic', u'seen live', u'alternative', u'sexy', u'weird', u'love at first listen', u'Love it', u'scream', u'screaming', u'taiwanese', u'synthrock', u'best of 2015', u'to entendendo nada']"
369,California,122489,847094,198000,"[u'electropop', u'electronic', u'synthpop', u'catchy', u'horrivel', u'dance-pop', u'Canadian', u'love at first listen', u'2016 single']"
370,Laughing and Not Being Normal,97228,535138,107000,"[u'dream pop', u'electronic', u'Masterpiece', u'best intro ever', u'Iconic', u'so sad', u'sad as fuck', u'breaks my heart', u'prologue', u'like a lot', u'grimes']"
371,Lean On (feat. MØ & DJ Snake),377477,3955404,177000,"[u'2015', u'anthem', u'epic', u'elektronic beats', u'electronic', u'dance', u'best of 2015', u'pop', u'rel-yr:2015', u'major lazer', u'summer', u'EDM', u'MO', u'electropop', u'amazing', u'dancehall', u'love at first listen', u'diplo', u'hino', u'moombahton', u'dj snake', u'2015 fig', u'test', u'electronica', u'electro', u'House', u'Awesome', u'feel good', u'car', u'Reggaeton', u'Progressive House', u'top 40', u'deephouse', u'hits', u'work', u'10s', u'fallon', u'eletronic', u'featuring', u'music', u'summer songs', u'hit', u'like it', u'crack', u'if this were a pokemon i would catch it', u'test2', u'radio disney', u'Addicted', u'summer song', u'summer hit']"
372,Fall Over,61968,337642,210000,"[u'pop', u'electropop', u'4 Stars', u'radio likes', u'r&b', u'electronic', u'trip-hop', u'chill', u'alternative', u'sexy', u'female vocalists', u'hypnotic', u'sex', u'hot', u'2013', u'relax', u'check out', u'work', u'I want to have sex with this song', u'10 of 10 stars', u'4 of 10 stars', u'a', u'why on earth is this just a bonus track', u'outubro', u'thats what scared me this morning Qornz', u'what scared me when uuuia said the shit']"
373,Affection,189342,1350817,157000,"[u'electronic', u'experimental', u'witch house', u'2012', u'Canadian', u'electronica', u'Lo-Fi', u'electropop', u'electro', u'love at first listen', u'chillwave', u'10s', u'Crystal Castles', u'rock', u'alternative', u'female vocalists', u'dark', u'synth pop', u'indietronica', u'Dreamy', u'synthpop', u'ethereal', u'indie', u'vocal', u'chill', u'classic', u'ambient', u'Love', u'Experimental pop', u'idm', u'psychedelic', u'bass', u'glitch', u'new rave', u'dream pop', u'Avant-Garde', u'r&b', u'winter', u'darkwave', u'female vocals', u'dark ambient', u'dreampop', u'duo', u'psychic', u'2012 single', u'favorite song', u'best of 2012', u'glitch pop', u'electro-pop', u'Dream']"
374,Running From the Cops,107879,578366,237000,"[u'trip-hop', u'electronic', u'electro', u'1Live Fiehe', u'experimental', u'vugube62', u'indie electronic', u'beautiful', u'groove', u'Driving', u'haunting', u'Like', u'phantogram', u'electronica', u'alternative', u'ambient', u'indie pop', u'epic', u'dark', u'strange', u'indietronica', u'Awesome', u'creeping', u'introspective', u'new', u'beats', u'f', u'trippy', u'gorgeous', u'duo', u'brilliant', u'love at first listen', u'8 of 10 stars', u'sinister', u'loooove', u'magic', u'mind-melting', u'kat fm', u'10 of 10 stars', u'creepy', u'REVOLUTIONARY', u'Easy To Listen To', u'Very Good', u'pulsing', u'somafm', u'Worth investigating further', u'Bagel', u'Sasquatch 2010', u'hovering', u'triphopgdchill']"
375,Eight,221284,1490306,107000,"[u'electronic', u'synth pop', u'Canadian', u'female vocalists', u'2012', u'experimental', u'ambient', u'psychedelic', u'female vocals', u'grimes', u'pop', u'synthpop', u'electronica', u'indie pop', u'electro', u'dance', u'post-punk', u'indietronica', u'trip hop', u'dream pop', u'american', u'cheerful', u'darkwave', u'fluxblog', u'short', u'love at first listen', u'cold wave', u'zeus', u'zeusdidit', u'10s', u'fotomotor', u'LOVE LOVE LOVE', u'female voice', u'art pop', u'1 minute songs', u'eight', u'Madeira', u'dingen die ik ooit nog moet draaien', u'chibi robots', u'titleluv', u'spiders spiders']"
376,Lofticries,216533,1638746,239000,"[u'electronic', u'experimental', u'chillwave', u'glitch pop', u'post-dubstep', u'female vocalists', u'indie', u'pop', u'ambient', u'Canadian', u'synthpop', u'trip-hop', u'beautiful', u'chill', u'2011', u'Eargasm', u'best of 2011', u'how do things this good exist', u'purity ring', u'chillout', u'electronica', u'alternative', u'indie pop', u'synth pop', u'indietronica', u'Dreamy', u'dream pop', u'female vocals', u'2012', u'6 of 10 stars', u'BIRP', u'obsessed', u'songs for lonely road trips', u'trance', u'sexy', u'indie electronic', u'dubstep', u'electro', u'Love', u'Lo-Fi', u'new wave', u'psychedelic pop', u'Experimental pop', u'Awesome', u'idm', u'psychedelic', u'glitch', u'spooky', u'trip hop', u'noise pop']"
377,Cut 4 Me (Prod. Kingdom),29675,105866,233000,"[u'trip-hop', u'experimental', u'rnb', u'alternative rnb', u'80s vibe', u'decent vocals']"
378,Lights On,22714,81757,261000,"[u'Hip-Hop', u'trip-hop', u'electropop', u'rap', u'indie pop', u'USA', u'male vocal', u'female vocal', u'2015', u'dream-pop']"
379,True Disaster,43138,427106,224000,"[u'pop', u'hino', u'electronic', u'electropop', u'2016', u'best of 2016', u'alternative', u'swedish', u'synth', u'synthpop', u'love at first listen', u'Alternativo', u'rainha', u'Meyers', u'Tove Lo', u'nocna energia', u'2016 single', u'lady wood', u'the best 2016']"
380,Polish Girl,297195,1941184,264000,"[u'electronic', u'chillwave', u'psychedelic', u'electropop', u'indie', u'alternative', u'synthpop', u'indie pop', u'Lo-Fi', u'chill', u'electronica', u'beautiful', u'2011', u'videogame', u'love at first listen', u'Love', u'8-bit', u'best song ever', u'electro-pop', u'<3', u'best of 2011', u'indie rock', u'happy', u'synth pop', u'noise pop', u'american', u'summer', u'melancholic', u'Heartbreaking', u'fav', u'Love it', u'10s', u'Synthetic', u'somafm', u'poptron', u'lightning bolts shooting out of my eyes', u'exquisite sound waves', u'pop', u'sad', u'indie electronic', u'electro', u'new wave', u'psychedelic pop', u'melodic', u'groove', u'Dreamy', u'atmospheric', u'Brooklyn', u'Electro Pop', u'Acid']"
381,Kiss Kiss Kiss,15953,45572,161000,"[u'female vocalists', u'avant garde', u'yoko ono', u'80s', u'post-punk', u'Avant-Garde', u'experimental', u'female vocalist', u'pop', u'punk', u'sexy', u'dance', u'new wave', u'sex', u'kiss kiss kiss', u'electronic', u'indie', u'female', u'rock', u'alternative', u'singer-songwriter', u'Love', u'oldies', u'avantgarde', u'synthpop', u'Random', u'feminist', u'no wave', u'hand claps', u'j-pop', u'love at first listen', u'plastic', u'time', u'kiss', u'awful', u'post-revolutionary pop song', u'misc', u'sexual', u'Seminal', u'different', u'handclaps', u'possibilities', u'yoko', u'Maybe', u'All', u'Shady', u'achingly intelligent', u'got it on vinyl', u'beatles collection', u'Avantgarde Pop']"
382,"Gifted [Feat. Kanye West, Santigold & Lykke Li]",338,835,0,[]
383,Fuck With Myself,49346,383594,175000,"[u'alternative', u'experimental', u'trip-hop', u'sexy', u'electronic', u'alternative rnb', u'indie', u'downtempo', u'Love', u'indiepop', u'american', u'triphop', u'uk bass', u'2016', u'2016 single', u'am\xe9m BANKS', u'so i fuck with myself more than anybody else', u'cause i fuck with myself more than anybody else']"
384,"Your Drums, Your Love",153910,870995,285000,"[u'synthpop', u'electronic', u'british', u'rnb', u'trip-hop', u'electropop', u'2013', u'uk bass', u'alternative rnb', u'treading water for your love', u'chillout', u'pop', u'alternative', u'female vocalists', u'female vocals', u'garage', u'duo', u'road trip', u'Best of', u'2012', u'2012 single', u'best of 2012', u'czHit', u'3 minute songs', u'glitch pop', u'future garage', u'best of 2013', u'fave bands', u'contemporary rnb', u'somafm', u'save', u'My fave bands', u'favorites 2014', u'pitch soul', u'fave female singers', u'poptron', u'like2009-2014', u'TooMuch', u'favorites 2012', u'low pitch', u'fave tunez', u'fave singer-songwriters', u'love tunez', u'Ladytronica', u'funkhaus europa indigo', u'bbc radio1 playlist 2012', u'so good i want to throw things']"
385,Crimewave,370646,2742594,255000,"[u'electronic', u'electro', u'electronica', u'8-bit', u'synth pop', u'8-bit electro', u'Crystal Castles', u'indie', u'Canadian', u'new rave', u'dance', u'female vocalists', u'synthpop', u'colobocuro', u'Retro', u'electropunk', u'party', u'seen live', u'chiptune', u'gossip girl', u'crimewave', u'synth', u'chillout', u'Nintendocore', u'Electroclash', u'health', u'experimental', u'hypnotic', u'female vocalist', u'00s', u'fuck yeah', u'electropop', u'new wave', u'8bit', u'Favourites', u'beautiful memories', u'alternative', u'indie rock', u'techno', u'indietronica', u'amazing', u'Trash', u'Indietronic', u'electro punk', u'i really really liked this song for an undefined period of time', u'robots walking into an uncertain future', u'sonic the hedgehog on a double drop', u'vugube62', u'chill', u'sexy']"
386,Coming Down,45300,340108,223000,"[u'pop', u'halsey', u'indie', u'indie pop', u'american', u'2015', u'love like religion']"
387,Strange Love,37129,323783,247000,"[u'love at first listen', u'pop', u'alternative', u'indie pop', u'Fave', u'Jams', u'secrets', u'halsey', u'rovinsky']"
388,Colors pt. II,29412,202120,0,[u'pop']
389,Colors,104884,1011674,267000,"[u'pop', u'alternative', u'indie pop', u'american', u'2015', u'indie', u'new york', u'female vocalists', u'singer-songwriter', u'beautiful', u'Dreamy', u'Bittersweet', u'female vocalist', u""00's"", u'Favorite', u'love at first listen', u'single', u'fallon', u'Badlands', u'this is so good', u'halsey', u""you're ripped at every edge but you're a masterpiece"", u'my top 100 of 2015', u'2016 single', u'everything is blue']"
390,Ghost,108811,926335,154000,"[u'electronic', u'indie', u'pop', u'american', u'post-nerdcore', u'indie pop', u'k', u'fav', u'love at first listen', u'10s', u'2010s', u'2014', u'2015', u'best of 2015', u'ghost', u'2014 single', u'bbc radio1 playlist 2015', u'music choice: alternative', u'loved by hottybotty', u'ecf02', u'must re-listen', u'Heartless Breathless Loveless', u'halsey', u'indie grls n boys', u'Hottybotty Acousitc']"
391,Roman Holiday,49817,434105,201000,"[u'love at first listen', u'pop', u'indie', u'indie pop', u'american', u'2015', u'bluesey', u'instant love', u'halsey']"
392,Hurricane,67898,620735,223000,"[u'electronic', u'pop', u'american', u'amazing', u'love at first listen', u'indie', u'indie pop', u'female vocalists', u'Awesome', u'Love it', u'<3', u'songs about me', u'2014 single', u'bbc radio1 playlist 2015', u'songs that i love singing', u'indie grls n boys']"
393,Drive,60950,511848,259000,"[u'pop', u'love at first listen', u'indie', u'indie pop', u'american', u'2015', u'bluesey', u'this is so good', u'halsey']"
394,New Americana,141872,1133376,183000,"[u'eita vicio', u'indie', u'pop', u'alternative', u'american', u'love at first listen', u'best tracks of 2015', u'electronic', u'indie pop', u'female vocalists', u'Crap', u'addictive', u'Love it', u'10s', u'2010s', u'<3', u'2016', u'juicy', u'best of 2015', u'dumb lyrics', u'piece of crap', u'2015 single', u'music choice: alternative', u'sky high', u'halsey', u'indie grls n boys', u'high on legal marijuana', u'song about legal marijuana', u'bbc radio1 playlist 2016']"
395,Hold Me Down,92827,695208,204000,"[u'halsey', u'indie', u'pop', u'american', u'electronic', u'instrumental', u'indie pop', u'amazing', u'love at first listen', u'Perfection', u'2015', u'best of 2015', u'Badlands', u'Hold Me Down', u'I Like Women']"
396,Castle,68857,583741,277000,"[u'pop', u'american', u'indie', u'indie pop', u'love at first listen', u'Incredible', u'2015', u'movie song', u'halsey', u'2016 single', u'favorites 2016']"
397,I Walk the Line,35694,266304,165000,"[u'cover', u'calm', u'love at first listen', u'Power Rangers', u'adansey', u'gansey']"
398,Young God,45444,377716,180000,"[u'indie', u'pop', u'indie pop', u'american', u'love at first listen', u'sex music', u'2015', u'halsey', u'adansey', u'gansey']"
399,Control,51601,454144,214000,"[u'indie', u'pop', u'indie pop', u'american', u'2015', u'dark pop', u'estadunidense', u'halsey', u'GODDAMN RIGHT YOU SHOULD BE SCARED OF ME', u'who is in control?', u'my top 100 of 2015', u'outernatia song contest', u'overrated borefest', u'Kauf']"
400,Gasoline,63812,645232,200000,"[u'love at first listen', u'amazing', u'electronic', u'pop', u'indie pop', u'indietronica', u'melancholy', u'Electronic Pop', u'Faves', u'Favez']"
