,Songs,Listeners,Playcount,Duration,Tags
682,Our Love Will Carry On,3953,15248,238000,"[u'japanese', u'emo', u'pretentious', u'anime', u'j-pop', u'Trash', u'garbage', u'sellout', u'all things annoying in the world put together into one stupid bitch', u'wannabe', u'anison', u'poser', u'posers', u'attention whore', u'church of satan', u'Slut pop', u'not experimental', u'pitchforkcore', u'singing cunt', u'Satanic Shit', u'worst of 2016', u'so bad its bad', u'worst songs of 2016', u'dance', u'kitsch', u'gay', u'comedy', u'satanic', u'shit', u'ridiculous', u'love at first listen', u'emocore', u'hilarious', u'evil', u'whore', u'dumb', u'lame', u'trash metal', u'Gay Metal', u'stupid', u'Slut', u'not jazz', u'hipster', u'lucifer', u'troll', u'racist', u'over the top', u'disgrace to society', u'weeaboo', u'over-the-top']"
683,Who Taught You How to Love,4927,20247,0,"[u'japanese', u'anime', u'j-pop', u'sellout', u'emo', u'Trash', u'weeaboo', u'anison', u'poser', u'church of satan', u'Satanic Shit', u'worst of 2016', u'pop', u'pretentious', u'comedy', u'shit', u'love at first listen', u'visual kei', u'Gay Metal', u'stupid', u'lucifer', u'wannabe', u'posers', u'attention whore', u'Slut pop', u'not experimental', u'pitchforkcore', u'singing cunt', u'trying too hard', u'so bad its bad', u'female vocalists', u'dance', u'kitsch', u'gay', u'humour', u'satanic', u'parody', u'ridiculous', u'hilarious', u'boring', u'bullshit', u'garbage', u'BDSM', u'whore', u'lame', u'Slut', u'all things annoying in the world put together into one stupid bitch', u'troll', u'gaycore', u'doujin']"
684,I Don't Wanna Dream Anymore,3748,17526,282000,[]
685,Holy Christos,5126,18492,172000,"[u'japanese', u'pretentious', u'anime', u'j-pop', u'Trash', u'sellout', u'anison', u'poser', u'church of satan', u'not experimental', u'pitchforkcore', u'trying too hard', u'shit', u'love at first listen', u'overrated', u'garbage', u'whore', u'Slut', u'hipster', u'over the top', u'wannabe', u'weeaboo', u'over-the-top', u'posers', u'attention whore', u'Slut pop', u'singing cunt', u'gothic my ass', u'satancore', u'Satanic Shit', u'worst of 2016', u'so bad its bad', u'worst songs of 2016', u'pop', u'emo', u'dance', u'kitsch', u'gay', u'comedy', u'satanic', u'ridiculous', u'hilarious', u'dumb', u'lame', u'visual kei', u'Gay Metal', u'stupid', u'all things annoying in the world put together into one stupid bitch', u'no talent', u'lucifer']"
686,The Leather One,3451,11689,136000,"[u'japanese', u'emo', u'anime', u'j-pop', u'sellout', u'lucifer', u'weeaboo', u'church of satan', u'Satanic Shit', u'pop', u'female vocalists', u'pretentious', u'kitsch', u'gay', u'comedy', u'humour', u'parody', u'ridiculous', u'Trash', u'bullshit', u'garbage', u'BDSM', u'whore', u'lame', u'visual kei', u'Gay Metal', u'stupid', u'Slut', u'troll', u'gaycore', u'doujin', u'wannabe', u'disgrace to society', u'chuck norris does not approve', u'4chan', u'anison', u'folklore intellectuel', u'poser', u'posers', u'doujin ongaku', u'attention whore', u'wimp', u'atrocious', u'unlistenable', u'Slut pop', u'not experimental', u'culture cultivee', u'pitchforkcore', u'Ayn Rand', u'singing cunt']"
687,The Girls,2760,9124,195000,"[u'japanese', u'emo', u'pretentious', u'kitsch', u'anime', u'j-pop', u'ridiculous', u'Trash', u'evil', u'garbage', u'whore', u'sellout', u'lame', u'Slut', u'all things annoying in the world put together into one stupid bitch', u'lucifer', u'troll', u'over the top', u'wannabe', u'disgrace to society', u'weeaboo', u'over-the-top', u'chuck norris does not approve', u'4chan', u'anison', u'dildocore', u'poser', u'posers', u'attention whore', u'wimp', u'atrocious', u'church of satan', u'unlistenable', u'Slut pop', u'not experimental', u'pitchforkcore', u'Ayn Rand', u'singing cunt', u'trying too hard', u'Satanic Shit', u'amatue', u'worst of 2016', u'so bad its bad', u'worst songs of 2016', u'Hip-Hop', u'chillout', u'hip hop', u'pop', u'rap', u'female vocalists']"
688,The Heavy Curtain,4220,21326,269000,[]
689,Silver Crucifix,3839,22227,190000,[]
690,You Know My Lord,3951,19260,224000,[]
691,Set It Off,158493,554770,256000,"[u'Nu Metal', u'rock', u'metal', u'rapcore', u'POD', u'alternative', u'alternative rock', u'alternative metal', u'Morose Deep dilate Crimson', u'hard rock', u'christian', u'POD - Set It Off', u'Set It Off', u'heavy metal', u'christian rock', u'rap metal', u'4 Stars', u'Smallville', u'Kicks ass', u'PADDYS NEW MIX', u'PADDYS MIX', u'metalcore', u'seen live', u'punk', u'favorite songs', u'Hard', u'heavy', u'hardcore', u'pop rock', u'favorites', u'Love', u'funk metal', u'blues', u'angry', u'free', u'american', u'screamo', u'contemporary christian', u'00s', u'Favorite', u'best', u'check out', u'faith no more', u'wake up', u'love this', u'gute laune', u'heard live', u'powerful', u'6 of 10 stars', u'2001']"
692,Dragula,492894,2924133,222000,"[u'metal', u'industrial metal', u'industrial', u'rob zombie', u'rock', u'hard rock', u'heavy metal', u'90s', u'dragula', u'alternative', u'horror', u'alternative metal', u'electronic', u'Nu Metal', u'zombie', u'favorites', u'Gothic Metal', u'alternative rock', u'industrial rock', u'halloween', u'monster metal', u'Soundtrack', u'1998', u'hardcore', u'dark', u'Gothic', u'heavy', u'dance', u'Awesome', u'classic rock', u'electronica', u'punk', u'Hard', u'american', u'aggressive', u'heard on Pandora', u'music for an ass-beating', u'matrix', u'horror rock', u'Rob Zombie - Dragula', u'punk rock', u'death metal', u'Favorite', u'fuck', u'groove metal', u'Shock Rock', u'powerfuck', u'sexy', u'Love', u'angry']"
693,Wrong Side of Heaven,78409,660172,271000,"[u'metal', u'hard rock', u'10s', u'best of 2013', u'heavy metal', u'rock', u'Favorite Bands', u'favorites', u'death', u'american', u'male vocalist', u'male vocalists', u'best song ever', u'FUCKING AWESOME', u'2010s', u'4 Stars', u'veterans', u'2014', u'groove metal', u'five', u'punch', u'Music Choice: Rock', u'FavBand', u'1er sur le Fredz Chart', u'ttl', u'Awesomness', u'finger', u'Five Finger Death Punch', u'2015 New4Me', u'lea froidefond', u'Cindy Crawford', u'cindy bastien', u'phoenix marie', u'snusmumrikenodobryae', u'nuuskamuikkunenodobryae']"
694,I'll Take Care of You,18240,94699,170000,"[u'rock', u'blues', u'Veronica Mars', u'singer-songwriter', u'Love', u'beautiful', u'blues rock', u'alternative', u'alternative rock', u'sexy', u'cover', u'melancholy', u'Whiskey', u'Heartbreaking', u'sleepytime', u'must listen', u'heartache', u'romance', u'sweet', u'temazo', u'brooding', u'nighttime', u'popular culture', u'oh yeah', u'foxy', u'Mark Lanegan', u'Soundtrack Of My Life', u'gentlemen', u'Chillin Grooves', u'my musical boyfriends', u'magnolia october', u'egocentric', u'whiskey voice', u'gravelly', u'portalternativo', u'amo este tema', u'TEMON', u'hermoso tema', u'hermosa letra', u'hermosa melodia', u'tell me your story', u'crooning men', u'yet another 4', u'radio as i want it', u'donegal77-loved', u'less than 400', u'less than 200']"
695,Holy Diver,193590,1468631,250000,"[u'metalcore', u'cover', u'metal', u'heavy metal', u'covers', u'dio cover', u'killswitch engage', u'hardcore', u'Melodic Death Metal', u'cover songs', u'Power metal', u'FUCKING AWESOME', u'Dio', u'rock', u'Nu Metal', u'kick ass', u'thrash metal', u'hard rock', u'alternative metal', u'wrif-fm', u'cover song', u'holy diver', u'THE BEST OFF KILLSWITCH ENGAGE', u'seen live', u'favorites', u'Awesome', u'punk rock', u'2007', u'00s', u'2006', u'718 Metal', u'Hell Yeah', u'Killswitch', u'fucking THRASH metal', u'fucking super hot stuff', u'favorite songs', u'beautiful', u'melodic', u'speed metal', u'Driving', u'angry', u'american', u'thrash', u'death metal', u'raw', u'rock n roll', u'drinking', u'Favourites', u'games', u'80s Heavy Metal']"
696,Think,84928,320344,212000,"[u'metal', u'Nu Metal', u'heavy metal', u'Drowning Pool', u'hard rock', u'alternative metal', u'rock', u'Nu-metal', u'hardcore', u'think', u'alternative', u'1', u'cool', u'kick ass', u'Best of best', u'metalcore', u'Favorite Bands', u'favorite songs', u'Hard', u'loud', u'Ogre', u'favourite', u'male vocalists', u'00s', u'Favorite', u'fav', u'2', u'favorite song', u'fuck', u'american artist', u'look into', u'sound storm', u'rocking out', u'Fuckin AWESOME', u'smack', u'bang your head', u'kiinnostava', u'Head Banging', u'abrocken', u'mazafaka', u'new good', u'Purpletag', u'Fride Favourites', u'GrtNuMetal', u'amanda seyfried', u'ouara', u'endomorfina', u'Pwnin', u'Musica pa namorar', u'Let s riot']"
697,Nothing's Impossible,120800,695842,262000,"[u'electronic', u'Depeche Mode', u'synthpop', u'synth pop', u'new wave', u'alternative', u'rock', u'dark', u'british', u'melancholic', u'00s', u'electronica', u'alternative rock', u'darkwave', u'alternative dance', u'Love', u'electronic rock', u'DM', u'favorites', u'Gothic', u'synth', u'atmospheric', u'rainbowfreezepoppers', u'melancholy', u'synth-pop', u'electropop', u'80s', u'electro', u'mute', u'haunting', u'modern rock', u'2005', u'dark wave', u'lyrics', u'pearls in stereo', u'darklounge', u'driving on a summer night', u'trance', u'chillout', u'sexy', u'Favoriter', u'UK', u'Lo-Fi', u'Alternative  Punk', u'post-punk', u'romantic', u'night', u'Dreamy', u'Voice', u'moody']"
698,Slave To Love - 1999 Digital Remaster,14819,40206,266000,"[u'rock', u'new wave']"
699,7 Flies,4877,19924,289000,[u'Stoner Rock']
700,Be Free,16778,71142,0,"[u'Hip-Hop', u'chillout', u'hip hop', u'pop', u'japanese', u'emo', u'rap', u'female vocalists', u'dance', u'cute', u'epic', u'easy listening', u'new age', u'pretentious', u'kitsch', u'JPop', u'club', u'gay', u'comedy', u'rnb', u'humour', u'anime', u'guilty pleasure', u'corny', u'Workout', u'J-rock', u'parody', u'j-pop', u'ridiculous', u'wtf', u'Guilty Pleasures', u'love at first listen', u'Trash', u'SCHEISSE', u'cheesy', u'hilarious', u'evil', u'boring', u'overrated', u'bullshit', u'halloween', u'garbage', u'BDSM', u'whore', u'dumb', u'sellout', u'porn', u'annoying', u'What', u'awful']"
701,Bed On Fire,6300,18222,0,[u'chelsea wolfe']
702,Holy Water,4123,20291,152000,[]
703,Fear is All You Know,11860,55614,184000,"[u'japanese', u'emo', u'female vocalists', u'gay', u'comedy', u'humour', u'anime', u'parody', u'j-pop', u'bullshit', u'BDSM', u'sellout', u'visual kei', u'Gay Metal', u'stupid', u'lucifer', u'gaycore', u'doujin', u'weeaboo', u'folklore intellectuel', u'doujin ongaku', u'church of satan', u'culture cultivee', u'Ayn Rand', u'Satanic Shit', u'Terry Goodkind', u'chillout', u'pop', u'alternative', u'dance', u'cute', u'epic', u'easy listening', u'new age', u'Schlager', u'pretentious', u'kitsch', u'JPop', u'satanic', u'Crap', u'shit', u'J-rock', u'ridiculous', u'wtf', u'love at first listen', u'Trash', u'SCHEISSE', u'hilarious', u'boring', u'overrated']"
704,Be Free,16778,71142,0,"[u'Hip-Hop', u'chillout', u'hip hop', u'pop', u'japanese', u'emo', u'rap', u'female vocalists', u'dance', u'cute', u'epic', u'easy listening', u'new age', u'pretentious', u'kitsch', u'JPop', u'club', u'gay', u'comedy', u'rnb', u'humour', u'anime', u'guilty pleasure', u'corny', u'Workout', u'J-rock', u'parody', u'j-pop', u'ridiculous', u'wtf', u'Guilty Pleasures', u'love at first listen', u'Trash', u'SCHEISSE', u'cheesy', u'hilarious', u'evil', u'boring', u'overrated', u'bullshit', u'halloween', u'garbage', u'BDSM', u'whore', u'dumb', u'sellout', u'porn', u'annoying', u'What', u'awful']"
705,Black Butterfly,6044,28654,206000,[]
706,Rosemary,5076,26741,191000,[]
707,Lucifer's the Light of the World,14357,102719,154000,"[u'church of satan', u'hipster', u'overrated', u'not experimental', u'japanese', u'emo', u'pretentious', u'satanic', u'anime', u'j-pop', u'sellout', u'pitchforkcore', u'trying too hard', u'gothic my ass', u'satancore', u'Satanic Shit', u'very dark music', u'pop', u'gay', u'comedy', u'shit', u'love at first listen', u'Trash', u'garbage', u'BDSM', u'whore', u'Gay Metal', u'stupid', u'Slut', u'lucifer', u'over the top', u'wannabe', u'disgrace to society', u'weeaboo', u'over-the-top', u'anison', u'poser', u'posers', u'hipster garbage', u'attention whore', u'Slut pop', u'singing cunt', u'epic bitch', u'amatue', u'worst of 2016', u'so bad its bad', u'worst songs of 2016', u'female vocalists', u'dance', u'epic']"
708,Our Love Will Carry On,3953,15248,238000,"[u'japanese', u'emo', u'pretentious', u'anime', u'j-pop', u'Trash', u'garbage', u'sellout', u'all things annoying in the world put together into one stupid bitch', u'wannabe', u'anison', u'poser', u'posers', u'attention whore', u'church of satan', u'Slut pop', u'not experimental', u'pitchforkcore', u'singing cunt', u'Satanic Shit', u'worst of 2016', u'so bad its bad', u'worst songs of 2016', u'dance', u'kitsch', u'gay', u'comedy', u'satanic', u'shit', u'ridiculous', u'love at first listen', u'emocore', u'hilarious', u'evil', u'whore', u'dumb', u'lame', u'trash metal', u'Gay Metal', u'stupid', u'Slut', u'not jazz', u'hipster', u'lucifer', u'troll', u'racist', u'over the top', u'disgrace to society', u'weeaboo', u'over-the-top']"
709,Conflict & Climax,3232,10450,159000,"[u'japanese', u'emo', u'kitsch', u'anime', u'j-pop', u'ridiculous', u'Trash', u'whore', u'sellout', u'lame', u'Slut', u'lucifer', u'troll', u'wannabe', u'disgrace to society', u'weeaboo', u'chuck norris does not approve', u'4chan', u'anison', u'poser', u'posers', u'attention whore', u'wimp', u'atrocious', u'church of satan', u'unlistenable', u'Slut pop', u'not experimental', u'Ayn Rand', u'singing cunt', u'trying too hard', u'Satanic Shit', u'amatue', u'worst of 2016', u'so bad its bad', u'chillout', u'pop', u'female vocalists', u'dance', u'cute', u'epic', u'easy listening', u'new age', u'pretentious', u'gay', u'comedy', u'humour', u'J-rock', u'parody', u'wtf']"
710,I Don't Wanna Dream Anymore,3748,17526,282000,[]
711,A Little Bit of Baby Gonna Make Me Wanna Live Again,4545,25120,142000,"[u'pop', u'japanese', u'emo', u'female vocalists', u'Schlager', u'JPop', u'gay', u'comedy', u'humour', u'satanic', u'anime', u'Crap', u'shit', u'parody', u'j-pop', u'bullshit', u'BDSM', u'sellout', u'visual kei', u'bondage', u'satan', u'Prometheus', u'Gay Metal', u'stupid', u'lucifer', u'gaycore', u'doujin', u'govno', u'mierda', u'weeaboo', u'pedophile', u'Tokio Hotel', u'whalecore', u'folklore intellectuel', u'doujin ongaku', u'caca', u'asian music', u'merda', u'child molester', u'church of satan', u'Asian Pop', u'Gowno', u'schwul', u'masochism', u'brainwashing', u'Objectivism', u'Ayn Rand', u'pedophilecore', u'acg', u'Satanic Shit']"
712,Deal With The Devil,5864,30101,351000,"[u'pop', u'rock', u'japanese', u'emo', u'seattle', u'experimental', u'female vocalists', u'Lo-Fi', u'Schlager', u'JPop', u'gay', u'comedy', u'humour', u'satanic', u'anime', u'neofolk', u'Crap', u'devotional', u'shit', u'parody', u'j-pop', u'bullshit', u'BDSM', u'sellout', u'visual kei', u'bondage', u'satan', u'Prometheus', u'Gay Metal', u'stupid', u'lucifer', u'gaycore', u'doujin', u'govno', u'mierda', u'weeaboo', u'Tokio Hotel', u'whalecore', u'folklore intellectuel', u'doujin ongaku', u'caca', u'asian music', u'merda', u'dark americana', u'church of satan', u'Asian Pop', u'Gowno', u'schwul', u'masochism', u'culture cultivee']"
713,Bed On Fire,6300,18222,0,[u'chelsea wolfe']
714,The Heavy Curtain,4220,21326,269000,[]
715,Holy Water,4123,20291,152000,[]
716,The Girls,2760,9124,195000,"[u'japanese', u'emo', u'pretentious', u'kitsch', u'anime', u'j-pop', u'ridiculous', u'Trash', u'evil', u'garbage', u'whore', u'sellout', u'lame', u'Slut', u'all things annoying in the world put together into one stupid bitch', u'lucifer', u'troll', u'over the top', u'wannabe', u'disgrace to society', u'weeaboo', u'over-the-top', u'chuck norris does not approve', u'4chan', u'anison', u'dildocore', u'poser', u'posers', u'attention whore', u'wimp', u'atrocious', u'church of satan', u'unlistenable', u'Slut pop', u'not experimental', u'pitchforkcore', u'Ayn Rand', u'singing cunt', u'trying too hard', u'Satanic Shit', u'amatue', u'worst of 2016', u'so bad its bad', u'worst songs of 2016', u'Hip-Hop', u'chillout', u'hip hop', u'pop', u'rap', u'female vocalists']"
717,Fear is All You Know,11860,55614,184000,"[u'japanese', u'emo', u'female vocalists', u'gay', u'comedy', u'humour', u'anime', u'parody', u'j-pop', u'bullshit', u'BDSM', u'sellout', u'visual kei', u'Gay Metal', u'stupid', u'lucifer', u'gaycore', u'doujin', u'weeaboo', u'folklore intellectuel', u'doujin ongaku', u'church of satan', u'culture cultivee', u'Ayn Rand', u'Satanic Shit', u'Terry Goodkind', u'chillout', u'pop', u'alternative', u'dance', u'cute', u'epic', u'easy listening', u'new age', u'Schlager', u'pretentious', u'kitsch', u'JPop', u'satanic', u'Crap', u'shit', u'J-rock', u'ridiculous', u'wtf', u'love at first listen', u'Trash', u'SCHEISSE', u'hilarious', u'boring', u'overrated']"
718,Our Love Will Carry On,3953,15248,238000,"[u'japanese', u'emo', u'pretentious', u'anime', u'j-pop', u'Trash', u'garbage', u'sellout', u'all things annoying in the world put together into one stupid bitch', u'wannabe', u'anison', u'poser', u'posers', u'attention whore', u'church of satan', u'Slut pop', u'not experimental', u'pitchforkcore', u'singing cunt', u'Satanic Shit', u'worst of 2016', u'so bad its bad', u'worst songs of 2016', u'dance', u'kitsch', u'gay', u'comedy', u'satanic', u'shit', u'ridiculous', u'love at first listen', u'emocore', u'hilarious', u'evil', u'whore', u'dumb', u'lame', u'trash metal', u'Gay Metal', u'stupid', u'Slut', u'not jazz', u'hipster', u'lucifer', u'troll', u'racist', u'over the top', u'disgrace to society', u'weeaboo', u'over-the-top']"
719,Be Free,16778,71142,0,"[u'Hip-Hop', u'chillout', u'hip hop', u'pop', u'japanese', u'emo', u'rap', u'female vocalists', u'dance', u'cute', u'epic', u'easy listening', u'new age', u'pretentious', u'kitsch', u'JPop', u'club', u'gay', u'comedy', u'rnb', u'humour', u'anime', u'guilty pleasure', u'corny', u'Workout', u'J-rock', u'parody', u'j-pop', u'ridiculous', u'wtf', u'Guilty Pleasures', u'love at first listen', u'Trash', u'SCHEISSE', u'cheesy', u'hilarious', u'evil', u'boring', u'overrated', u'bullshit', u'halloween', u'garbage', u'BDSM', u'whore', u'dumb', u'sellout', u'porn', u'annoying', u'What', u'awful']"
720,Who Taught You How to Love,4927,20247,0,"[u'japanese', u'anime', u'j-pop', u'sellout', u'emo', u'Trash', u'weeaboo', u'anison', u'poser', u'church of satan', u'Satanic Shit', u'worst of 2016', u'pop', u'pretentious', u'comedy', u'shit', u'love at first listen', u'visual kei', u'Gay Metal', u'stupid', u'lucifer', u'wannabe', u'posers', u'attention whore', u'Slut pop', u'not experimental', u'pitchforkcore', u'singing cunt', u'trying too hard', u'so bad its bad', u'female vocalists', u'dance', u'kitsch', u'gay', u'humour', u'satanic', u'parody', u'ridiculous', u'hilarious', u'boring', u'bullshit', u'garbage', u'BDSM', u'whore', u'lame', u'Slut', u'all things annoying in the world put together into one stupid bitch', u'troll', u'gaycore', u'doujin']"
721,Black Butterfly,6044,28654,206000,[]
722,Rosemary,5076,26741,191000,[]
723,Who Taught You How to Love,4927,20247,0,"[u'japanese', u'anime', u'j-pop', u'sellout', u'emo', u'Trash', u'weeaboo', u'anison', u'poser', u'church of satan', u'Satanic Shit', u'worst of 2016', u'pop', u'pretentious', u'comedy', u'shit', u'love at first listen', u'visual kei', u'Gay Metal', u'stupid', u'lucifer', u'wannabe', u'posers', u'attention whore', u'Slut pop', u'not experimental', u'pitchforkcore', u'singing cunt', u'trying too hard', u'so bad its bad', u'female vocalists', u'dance', u'kitsch', u'gay', u'humour', u'satanic', u'parody', u'ridiculous', u'hilarious', u'boring', u'bullshit', u'garbage', u'BDSM', u'whore', u'lame', u'Slut', u'all things annoying in the world put together into one stupid bitch', u'troll', u'gaycore', u'doujin']"
724,The Leather One,3451,11689,136000,"[u'japanese', u'emo', u'anime', u'j-pop', u'sellout', u'lucifer', u'weeaboo', u'church of satan', u'Satanic Shit', u'pop', u'female vocalists', u'pretentious', u'kitsch', u'gay', u'comedy', u'humour', u'parody', u'ridiculous', u'Trash', u'bullshit', u'garbage', u'BDSM', u'whore', u'lame', u'visual kei', u'Gay Metal', u'stupid', u'Slut', u'troll', u'gaycore', u'doujin', u'wannabe', u'disgrace to society', u'chuck norris does not approve', u'4chan', u'anison', u'folklore intellectuel', u'poser', u'posers', u'doujin ongaku', u'attention whore', u'wimp', u'atrocious', u'unlistenable', u'Slut pop', u'not experimental', u'culture cultivee', u'pitchforkcore', u'Ayn Rand', u'singing cunt']"
725,Lucifer's the Light of the World,14357,102719,154000,"[u'church of satan', u'hipster', u'overrated', u'not experimental', u'japanese', u'emo', u'pretentious', u'satanic', u'anime', u'j-pop', u'sellout', u'pitchforkcore', u'trying too hard', u'gothic my ass', u'satancore', u'Satanic Shit', u'very dark music', u'pop', u'gay', u'comedy', u'shit', u'love at first listen', u'Trash', u'garbage', u'BDSM', u'whore', u'Gay Metal', u'stupid', u'Slut', u'lucifer', u'over the top', u'wannabe', u'disgrace to society', u'weeaboo', u'over-the-top', u'anison', u'poser', u'posers', u'hipster garbage', u'attention whore', u'Slut pop', u'singing cunt', u'epic bitch', u'amatue', u'worst of 2016', u'so bad its bad', u'worst songs of 2016', u'female vocalists', u'dance', u'epic']"
726,Holy Christos,5126,18492,172000,"[u'japanese', u'pretentious', u'anime', u'j-pop', u'Trash', u'sellout', u'anison', u'poser', u'church of satan', u'not experimental', u'pitchforkcore', u'trying too hard', u'shit', u'love at first listen', u'overrated', u'garbage', u'whore', u'Slut', u'hipster', u'over the top', u'wannabe', u'weeaboo', u'over-the-top', u'posers', u'attention whore', u'Slut pop', u'singing cunt', u'gothic my ass', u'satancore', u'Satanic Shit', u'worst of 2016', u'so bad its bad', u'worst songs of 2016', u'pop', u'emo', u'dance', u'kitsch', u'gay', u'comedy', u'satanic', u'ridiculous', u'hilarious', u'dumb', u'lame', u'visual kei', u'Gay Metal', u'stupid', u'all things annoying in the world put together into one stupid bitch', u'no talent', u'lucifer']"
727,Our Love Will Carry On,3953,15248,238000,"[u'japanese', u'emo', u'pretentious', u'anime', u'j-pop', u'Trash', u'garbage', u'sellout', u'all things annoying in the world put together into one stupid bitch', u'wannabe', u'anison', u'poser', u'posers', u'attention whore', u'church of satan', u'Slut pop', u'not experimental', u'pitchforkcore', u'singing cunt', u'Satanic Shit', u'worst of 2016', u'so bad its bad', u'worst songs of 2016', u'dance', u'kitsch', u'gay', u'comedy', u'satanic', u'shit', u'ridiculous', u'love at first listen', u'emocore', u'hilarious', u'evil', u'whore', u'dumb', u'lame', u'trash metal', u'Gay Metal', u'stupid', u'Slut', u'not jazz', u'hipster', u'lucifer', u'troll', u'racist', u'over the top', u'disgrace to society', u'weeaboo', u'over-the-top']"
728,Conflict & Climax,3232,10450,159000,"[u'japanese', u'emo', u'kitsch', u'anime', u'j-pop', u'ridiculous', u'Trash', u'whore', u'sellout', u'lame', u'Slut', u'lucifer', u'troll', u'wannabe', u'disgrace to society', u'weeaboo', u'chuck norris does not approve', u'4chan', u'anison', u'poser', u'posers', u'attention whore', u'wimp', u'atrocious', u'church of satan', u'unlistenable', u'Slut pop', u'not experimental', u'Ayn Rand', u'singing cunt', u'trying too hard', u'Satanic Shit', u'amatue', u'worst of 2016', u'so bad its bad', u'chillout', u'pop', u'female vocalists', u'dance', u'cute', u'epic', u'easy listening', u'new age', u'pretentious', u'gay', u'comedy', u'humour', u'J-rock', u'parody', u'wtf']"
729,Our Love Will Carry On,3953,15248,238000,"[u'japanese', u'emo', u'pretentious', u'anime', u'j-pop', u'Trash', u'garbage', u'sellout', u'all things annoying in the world put together into one stupid bitch', u'wannabe', u'anison', u'poser', u'posers', u'attention whore', u'church of satan', u'Slut pop', u'not experimental', u'pitchforkcore', u'singing cunt', u'Satanic Shit', u'worst of 2016', u'so bad its bad', u'worst songs of 2016', u'dance', u'kitsch', u'gay', u'comedy', u'satanic', u'shit', u'ridiculous', u'love at first listen', u'emocore', u'hilarious', u'evil', u'whore', u'dumb', u'lame', u'trash metal', u'Gay Metal', u'stupid', u'Slut', u'not jazz', u'hipster', u'lucifer', u'troll', u'racist', u'over the top', u'disgrace to society', u'weeaboo', u'over-the-top']"
730,I Wanna Die At 69,4371,17017,330000,"[u'japanese', u'pretentious', u'anime', u'j-pop', u'Trash', u'sellout', u'anison', u'poser', u'church of satan', u'not experimental', u'pitchforkcore', u'trying too hard', u'worst of 2016', u'worst songs of 2016', u'emo', u'love at first listen', u'overrated', u'garbage', u'whore', u'Slut', u'hipster', u'over the top', u'wannabe', u'weeaboo', u'over-the-top', u'posers', u'attention whore', u'Slut pop', u'singing cunt', u'gothic my ass', u'satancore', u'Satanic Shit', u'so bad its bad', u'pop', u'female vocalists', u'dance', u'kitsch', u'gay', u'comedy', u'shit', u'ridiculous', u'hilarious', u'boring', u'dumb', u'lame', u'visual kei', u'Gay Metal', u'stupid', u'all things annoying in the world put together into one stupid bitch', u'no talent']"
731,Who Taught You How to Love,4927,20247,0,"[u'japanese', u'anime', u'j-pop', u'sellout', u'emo', u'Trash', u'weeaboo', u'anison', u'poser', u'church of satan', u'Satanic Shit', u'worst of 2016', u'pop', u'pretentious', u'comedy', u'shit', u'love at first listen', u'visual kei', u'Gay Metal', u'stupid', u'lucifer', u'wannabe', u'posers', u'attention whore', u'Slut pop', u'not experimental', u'pitchforkcore', u'singing cunt', u'trying too hard', u'so bad its bad', u'female vocalists', u'dance', u'kitsch', u'gay', u'humour', u'satanic', u'parody', u'ridiculous', u'hilarious', u'boring', u'bullshit', u'garbage', u'BDSM', u'whore', u'lame', u'Slut', u'all things annoying in the world put together into one stupid bitch', u'troll', u'gaycore', u'doujin']"
