,Songs,Listeners,Playcount,Duration,Tags
414,Deathcar,36465,226756,238000,"[u'post-hardcore', u'rock', u'alternative', u'alternative rock', u'screamo', u'Resident Evil', u'Fightstar', u'metal', u'emo', u'Soundtrack', u'metalcore', u'alternative metal', u'post hardcore', u'heavy metal', u'black metal', u'seen live', u'british', u'epic', u'top', u'ost', u'male vocalists', u'post-grunge', u'english', u'wow', u'8 of 10 stars', u'emocore', u'perfect', u'FUCKING AWESOME', u'Eargasm', u'I love', u'scramo', u'britcore', u'demure', u'the best tracks in the whole f-ig world', u'effin great', u'that dude with smexy voice']"
415,One Day Son,24948,145465,256000,"[u'british', u'rock', u'alternative', u'hard rock', u'Awesome', u'post-hardcore', u'alternative rock', u'Progressive rock', u'fantastic', u'beautiful', u'amazing', u'love at first listen', u'sweet', u'FUCKING AWESOME', u'Favourite Songs', u'fucking amazing', u'makes me happy', u'delicious', u'favourite voices', u'Fightstar', u'huge sound', u'metal', u'indie', u'punk', u'favorite songs', u'emo', u'sexy', u'favorites', u'Love', u'cute', u'punk rock', u'super', u'good', u'great lyrics', u'hot', u'best', u'brilliant', u'lovely', u'perfect', u'Dream', u'6 of 10 stars', u'Good Stuff', u'<3', u'okay', u'in love', u'slow and sad', u'songs on repeat', u'favourite one :D', u'officially awesome', u'fucking great song']"
416,Floods,40418,259624,214000,"[u'alternative rock', u'post-hardcore', u'rock', u'piano', u'emo', u'alternative', u'Favourite Songs', u'Fightstar', u'amazing', u'Mind blowing', u'absolute fave', u'seen live', u'british', u'Awesome', u'Muse', u'perfect', u'FUCKING AWESOME', u'powerful', u'yeahhh', u'very special', u'kinda progressive', u'pop', u'favorite songs', u'sexy', u'Progressive metal', u'favorites', u'melodic', u'Rocking', u'space rock', u'live', u'Favorite', u'best', u'Love it', u'Cross Rhythms', u'6 of 10 stars', u'in love', u'sounds like', u'the suburbs i didnt live in', u'kerrang tour', u'make me high', u'demure', u'so fucking cool', u'fave song ever', u'chce tak grac', u'hw 2 b n mo']"
417,We Apologise For Nothing,28535,199041,253000,"[u'rock', u'post-hardcore', u'Fightstar', u'seen live', u'alternative rock', u'Awesome', u'perfect', u'Columbine', u'pure awsome-ness', u'AMAH-ZIN', u'silberberg', u'pure ace-ness', u'best song everrrrrrrrrrr']"
418,99,29968,176089,245000,"[u'alternative rock', u'rock', u'post-hardcore', u'british', u'Fightstar', u'seen live', u'fantastic', u'amazing', u'FUCKING AWESOME', u'Dream', u'Favourite Songs', u'sexy voice', u'huge sound', u'alternative', u'hard rock', u'favorites', u'want to see live', u'perfect', u'I love this song', u'Meaningful', u'in love', u'Fly', u'One of my favourite songs', u'favourite one :D', u'favourite voices', u'make me high', u'amazing sound', u'metal', u'singer-songwriter', u'Awesome', u'feel good', u'Indie-Rock', u'male vocalists', u'Favourites', u'brilliant', u'lovely', u'not emo', u'UK Bands', u'uk rock', u'Charlie Simpson', u'hard emotional', u'Dreaming Soundtrack']"
419,Wake Up,17028,101193,278000,"[u'rock', u'Fightstar', u'Awesome', u'post-hardcore', u'seen live', u'Favorite Bands', u'british', u'alternative', u'alternative rock', u'emo', u'sexy', u'favorites', u'cute', u'epic', u'romantic', u'fantastic', u'feel good', u'pretty', u'amazing', u'emotional', u'relaxing', u'great lyrics', u'want to see live', u'sing along', u'Favourite Songs', u'FAV SONG', u'Meaningful', u'in love', u'songs I absolutely love', u'Fly', u'One of my favourite songs', u'favourite one :D', u'favourite song by this artist', u'favourite voices', u'so great', u'make me high', u'magic song', u'wonderful vocals', u'so energetic', u'yeeaah', u'x3 cute', u'z kubkiem herbaty']"
420,Grand Unification (Part 2),3759,27466,0,"[u'seen live', u'beautiful', u'Favorite', u'post-hardcore', u'Fightstar', u'from heart']"
421,Hazy Eyes,26439,170940,192000,"[u'Fightstar', u'rock', u'emo', u'post-hardcore', u'Punk-Rock', u'seen live', u'british', u'Favourite song', u'punk', u'alternative', u'punk rock', u'english', u'I love', u'Juliana', u'rad lyrics', u'Hazy Eyes', u'that dude with smexy voice', u'i wanna punch you']"
422,Mono,29130,213609,384000,"[u'rock', u'emo', u'post-hardcore', u'alternative', u'Fightstar', u'melodic rock', u'beautiful', u'Meaningful', u'british', u'alternative rock', u'favorites', u'epic', u'Awesome', u'Dreamy', u'moody', u'Energetic', u'alternative metal', u'amazing', u'emotional', u'Favourites', u'FUCKING AWESOME', u'Anthemic', u'songs I absolutely love', u'Fly', u'One of my favourite songs', u'absolutely wonderful', u'make me high', u'magic song', u'hard emotional', u'great feelings', u'Time to dream and forget all of problems', u'seen live', u'indie', u'pop', u'sexy', u'Love', u'cute', u'romantic', u'feel good', u'pretty', u'cool', u'male vocalist', u'Favorite', u'alt rock', u'Guilty Pleasures', u'lovely', u'english', u'want to see live', u'comfort', u'I love this song']"
423,Open Your Eyes,18976,110089,246000,"[u'Fightstar', u'post-hardcore', u'rock', u'british', u'emo', u'beautiful', u'brilliant', u'seen live', u'sexy', u'soft rock', u'fantastic', u'amazing', u'male vocalist', u'lovely', u'research', u'EXCELLENT live']"
424,Lost Like Tears in Rain,34901,228939,240000,"[u'rock', u'post-hardcore', u'emo', u'Fightstar', u'Music i love', u'british', u'heavy metal', u'metal', u'favorites', u'epic', u'Awesome', u'punk rock', u'pop punk', u'alternative metal', u'I like', u'slow and sad', u'recently discovered', u'Lost Like Tears In The Rain', u'lap', u'Fucking Musical Fire', u'lifeamongpeople']"
425,Here Again (Last Conversation),19617,127311,194000,"[u'Fightstar', u'post-hardcore', u'alternative rock', u'rock', u'british', u'alternative metal', u'emo', u'8 of 10 stars', u'medina lake']"
426,Build An Army,22341,143184,241000,"[u'rock', u'emo', u'screamo', u'post hardcore', u'Fightstar', u'seen live', u'post-hardcore', u'british', u'english', u'FUCKING AWESOME', u'Good Stuff', u'kickass', u'All time favourites', u'Rad', u'I love', u'one of my faves', u'rad lyrics', u'rad guitar', u'perform this please', u'skream out loud', u'eureka best', u'that dude with smexy voice']"
427,Paint Your Target,56287,414149,195000,"[u'rock', u'emo', u'post-hardcore', u'alternative rock', u'screamo', u'Fightstar', u'punk', u'alternative', u'hardcore', u'post hardcore', u'FUCKING AWESOME', u'seen live', u'male vocalist', u'emocore', u'Favourite Songs', u'Punk-Rock', u'kevin', u'bloody awesome', u'THIS KICKS ASS', u'metal', u'indie', u'pop', u'british', u'sexy', u'hard rock', u'Progressive rock', u'favorites', u'epic', u'road', u'alternative metal', u'great song', u'great lyrics', u'hot', u'post-grunge', u'alt rock', u'english', u'tune', u'flames', u'tags', u'kickass', u'Wilson', u'I love', u'bloody', u'Discoverockult', u'Engage', u'inflames', u'in', u'officially awesome', u'A7X', u'jumping around']"
428,Sleep Well Tonight,22754,153063,254000,"[u'rock', u'alternative', u'emo', u'punk', u'post-hardcore', u'Fightstar', u'seen live', u'heavy metal', u'metal', u'pop', u'british', u'alternative rock', u'alternative metal', u'6 of 10 stars', u'All time favourites', u'Punk-Rock']"
429,Waste A Moment,28756,195408,206000,"[u'rock', u'post-hardcore', u'alternative rock', u'emo', u'Fightstar', u'british', u'alternative', u'Favourite Songs', u'heavy metal', u'metal', u'seen live', u'screamo', u'alternative metal', u'english', u'love song', u'european', u'kickass', u'Punk-Rock', u'One of the best songs ever', u'I love', u'kat', u'rad lyrics', u'rad guitar', u'perform this please', u'screamo-ish', u'other cool stuff', u'that dude with smexy voice']"
430,Grand Unification (part 1),5218,46775,0,"[u'post-hardcore', u'seen live', u'amazing', u'bouncy', u'brilliant', u'Fightstar']"
431,To Sleep,25719,120332,96000,"[u'relaxing', u'Sleep', u'emo', u'post-hardcore', u'rock', u'ambient', u'Fightstar', u'instrumental', u'Songs I sleep to', u'Na sen', u'heavy metal', u'metal', u'seen live', u'british', u'alternative', u'intro', u'feel good', u'alternative metal', u'Punk-Rock', u'Fly', u'favourite one :D', u'favourite song by this artist', u'make me high', u'sen', u'peaceful melody just to stop thinking about fuckin problems']"
432,"If You Think This Song Is About You, It Probably Is",61014,687325,151000,"[u'post-hardcore', u'post hardcore', u'rock', u'addictive', u'hard core', u'emo', u'love at first listen', u'fucking love this', u'a little pop', u'metal', u'punk', u'hardcore', u'hate', u'title is a full sentence', u'cimx-fm', u'craig owens', u'songs to listen while drinking beer to make life too awesome', u'songs I can actually listen to on repeat', u'Forever Love', u'First Song', u'im not angry', u'Punch me in the dead spot again']"
433,"If You Think This Song Is About You, It Probably Is",61014,687325,151000,"[u'post-hardcore', u'post hardcore', u'rock', u'addictive', u'hard core', u'emo', u'love at first listen', u'fucking love this', u'a little pop', u'metal', u'punk', u'hardcore', u'hate', u'title is a full sentence', u'cimx-fm', u'craig owens', u'songs to listen while drinking beer to make life too awesome', u'songs I can actually listen to on repeat', u'Forever Love', u'First Song', u'im not angry', u'Punch me in the dead spot again']"
434,We Be Robots,714,4911,288000,[u'alternative rock']
435,The Red in the Fog,695,3686,301000,[u'alternative metal']
436,Sweet November,727,3843,240000,[]
437,The Part,752,4099,633000,[]
438,In Search of a Ghost,890,5495,305000,[]
439,Do You Really Like...,854,4860,315000,[]
440,Wait for Me Now,882,4381,275000,[]
441,Reactions,971,5464,208000,[]
442,Choose Nothing,915,4573,208000,[]
443,Its Not Enough,7,439,0,[]
444,The Cloud Collectors,1080,5635,226000,[u'alternative rock']
445,Room 5,671,4424,367000,[]
446,Myron,741,4767,212000,[]
447,Capital,771,4693,223000,[]
448,Notes From A Sunday Morning,729,4336,178000,[]
449,Naming The Monster,734,4670,127000,[]
450,Knuckles,782,4938,230000,[]
451,Closure,938,6348,263000,[]
452,Meantime,933,6515,253000,[]
453,Falling,855,5605,151000,"[u'rock', u'alternative', u'alternative rock', u'hard rock', u'Progressive rock', u'alternative metal']"
454,Facepoint,983,6217,188000,[]
455,Tired,1015,6851,238000,[]
456,Way Out,1100,7310,197000,[u'alternative metal']
457,Throwin Pennies,967,6325,177000,[]
458,Paper Planets,871,4963,51000,[u'rock']
459,Year Zero,152605,875199,278000,"[u'alternative rock', u'rock', u'alternative', u'30 seconds to mars', u'Progressive rock', u'emo', u'space rock', u'indie', u'metal', u'hard rock', u'alternative metal', u'american', u'00s', u'30stm', u'indie rock', u'alternrock', u'Jared Leto', u'year zero', u'-year zero-', u'seen live', u'Love', u'epic', u'new wave', u'atmospheric', u'favourite', u'good', u'Favorite', u'post-hardcore', u'FUCKING AWESOME', u'tool', u'rockin', u'3 star', u'Shannon Leto', u'Tomo Milicevic', u'2000s alternative', u'good angry rock', u'fucking amazingggg', u'electronic', u'electronica', u'pop', u'favorite songs', u'experimental', u'sexy', u'favorites', u'dark', u'christmas', u'genius', u'cosmic', u'new', u'punk rock']"
460,93 Million Miles,175771,1111351,318000,"[u'alternative rock', u'rock', u'alternative', u'30 seconds to mars', u'space rock', u'hard rock', u'Progressive rock', u'emo', u'alternative metal', u'Awesome', u'indie', u'american', u'Jared Leto', u'30stm', u'metal', u'favourite', u'indie rock', u'screamo', u'Love it', u'most loved', u'listened to over and over', u'hardcore', u'favorites', u'epic', u'surreal', u'art rock', u'punk rock', u'male vocalist', u'male vocalists', u'00s', u'brilliant', u'Nu Metal', u'5 Stars', u'badass', u'angst', u'sound storm', u'Better Than Sex', u'Shannon', u'retrospective', u'best live', u'I didnt know them', u'happyness', u'30 seconds to mars yeah', u'rock 30 seconds to mars', u'i feel like a superhero', u'93 million miles', u'electronic', u'pop', u'instrumental', u'80s']"
461,End of the Beginning,191074,1249044,277000,"[u'alternative rock', u'rock', u'30 seconds to mars', u'alternative', u'Progressive rock', u'emo', u'space rock', u'Jared Leto', u'hard rock', u'new wave', u'metal', u'Awesome', u'Favorite Bands', u'punk', u'male vocalists', u'Favorite', u'indie', u'pop', u'beautiful', u'american', u'alternative metal', u'amazing', u'male vocalist', u'00s', u'alt rock', u'FUCKING AWESOME', u'music to fuck to', u'Love this song', u'30stm', u'Shannon Leto', u'rockoblivion', u'seen live', u'favorite songs', u'pop rock', u'power', u'Love', u'industrial', u'RockPop', u'downbeat', u'loud', u'moody', u'industrial rock', u'Progressive', u'favourite', u'emotional', u'melancholic', u'spacey', u'good', u'modern rock', u'guilty pleasure']"
462,The Mission,200805,1430975,242000,"[u'alternative rock', u'rock', u'30 seconds to mars', u'alternative', u'emo', u'Progressive rock', u'Jared Leto', u'space rock', u'30stm', u'hard rock', u'cool', u'indie', u'favourite', u'Love', u'driving music', u'Emo rock', u'The Mission', u'songs that you wanna listen to over and over again', u'30stm is love', u'im addicted to', u'new wave', u'Awesome', u'good', u'00s', u'best', u'FUCKING AWESOME', u'art-rock', u'speed', u'sound storm', u'not emo', u'best played loud', u'most loved', u'Rock on', u'seen live', u'pop', u'Favorite Bands', u'indie rock', u'power', u'industrial', u'synth', u'american', u'alternative metal', u'prog rock', u'depression', u'Favorite', u'post-hardcore', u'beautiful voice', u'rhythmic', u'Mars', u'songs I absolutely love']"
463,Welcome to the Universe,185650,1180278,158000,"[u'alternative rock', u'rock', u'alternative', u'30 seconds to mars', u'emo', u'Progressive rock', u'space rock', u'Jared Leto', u'Favorite Bands', u'hard rock', u'seen live', u'industrial', u'30 seconds to mars-welcome to the universe', u'american', u'screamo', u'male vocalists', u'30stm', u'metal', u'indie', u'alternative metal', u'00s', u'Welcome To The Universe', u'pop', u'indie rock', u'power', u'emocore', u'favourite artists', u'not emo', u'loved tracks', u'sexy voice', u'pure energy', u'most excellent rock', u'metalcore', u'electronic', u'favorite songs', u'hardcore', u'ambient', u'USA', u'strange', u'beautiful', u'Awesome', u'industrial rock', u'nostalgic', u'favourite', u'male vocalist', u'Prog-Rock', u'depression', u'alt rock', u'I Like It', u'perfect']"
464,Echelon,197166,1439818,347000,"[u'alternative rock', u'rock', u'30 seconds to mars', u'alternative', u'Progressive rock', u'space rock', u'emo', u'echelon', u'hard rock', u'30stm', u'seen live', u'Jared Leto', u'indie', u'00s', u'american', u'Favorite', u'screamo', u'post-grunge', u'Nu Metal', u'Favourite Songs', u'songs that you wanna listen to over and over again', u'Jaredlicious', u'industrial', u'Gothic', u'favourite', u'male vocalists', u'if you fall in love with me you should know these songs by heart', u'moody alternative', u'voices that i love', u'This makes me feel this moment like the last one', u'Shannon Leto', u'Awesome', u'Soundtracks', u'atmospheric', u'alternative metal', u'heard on Pandora', u'emocore', u'FUCKING AWESOME', u'Mars', u'not emo', u'the best', u'Favourite song', u'Shannon', u'songs that changed my life', u'Genialne', u'music to dream', u'songs that are important to me', u'Some earlier 30 seconds to mars', u'provehito in altum', u'30 seconds to mars-echelon']"
465,Buddha for Mary,185448,1344020,343000,"[u'alternative rock', u'rock', u'alternative', u'30 seconds to mars', u'Progressive rock', u'space rock', u'30stm', u'emo', u'hard rock', u'industrial', u'seen live', u'Progressive', u'indie rock', u'RockPop', u'alternative metal', u'modern rock', u'Jared Leto', u'echelon', u'Buddha For Mary', u'metal', u'favorites', u'new wave', u'Awesome', u'favourite', u'00s', u'industrial metal', u'FUCKING AWESOME', u'art-rock', u'Buddha', u'The Fucking Best', u'rockoblivion', u'electronic', u'indie', u'chill', u'beautiful', u'american', u'California', u'loved', u'male vocalist', u'Favorite', u'alt rock', u'great songs', u'favourite artists', u'bleed', u'songs I absolutely love', u'Awake', u'i get this song stuck in my head', u'songs that you wanna listen to over and over again', u'paradise song', u'songs that changed my life']"
466,Oblivion,242752,1827682,207000,"[u'alternative rock', u'rock', u'30 seconds to mars', u'alternative', u'emo', u'Progressive rock', u'space rock', u'Oblivion', u'30stm', u'favorites', u'screamo', u'songs that you wanna listen to over and over again', u'hard rock', u'punk rock', u'Favorite', u'Jared Leto', u'Love', u'american', u'00s', u'metal', u'punk', u'Awesome', u'The Fucking Best', u'alt rock', u'seen live', u'indie', u'indie rock', u'power', u'heard on Pandora', u'FUCKING AWESOME', u'absolute love', u'Music that makes me happy', u'experimental', u'Progressive', u'emotional', u'post-grunge', u'art-rock', u'alternrock', u'Best Band EVER', u'30 seconds', u'if you fall in love with me you should know these songs by heart', u'emotional affecting', u'echelon', u'when you need to get over someone', u'30sec to mars', u'pop', u'chill', u'industrial', u'acoustic', u'alternative metal']"
467,Fallen,219356,1381537,297000,"[u'alternative rock', u'rock', u'30 seconds to mars', u'alternative', u'Progressive rock', u'hard rock', u'emo', u'metal', u'space rock', u'industrial', u'30stm', u'seen live', u'power', u'Favourites', u'Jared Leto', u'genius', u'male vocalists', u'indie', u'american', u'00s', u'FUCKING AWESOME', u'addicting', u'beautiful', u'alternative metal', u'amazing', u'echelon', u'country', u'punk', u'art rock', u'favourite', u'aggressive', u'Favorite', u'Nu Metal', u'10 of 10 stars', u'speed', u'insightful', u'Soundtrack Of My Life', u'play again', u'Awesome xD', u'my drum songs', u'i know it by heart', u'I can tell you why people go insane', u'rockoblivion', u'classic rock', u'pop', u'chill', u'instrumental', u'Progressive metal', u'favorites', u'epic']"
468,Edge of the Earth,262941,1897620,275000,"[u'alternative rock', u'rock', u'30 seconds to mars', u'alternative', u'Progressive rock', u'emo', u'space rock', u'hard rock', u'Jared Leto', u'Awesome', u'post-grunge', u'Grunge', u'industrial', u'30stm', u'songs that you wanna listen to over and over again', u'metal', u'alternative metal', u'male vocalists', u'industrial metal', u'amayzes loved', u'sexy voice', u'radioultra', u'edge of the earth', u'Edge of Earth - 30 Seconds to Mars', u'favorite songs', u'great', u'fucking beautiful', u'30stm is love', u'Shannon Leto', u'american', u'favourite', u'cool', u'good', u'00s', u'Nu Metal', u'my music', u'songs I absolutely love', u'davaho53', u'echelon', u'hot band members', u'metalcore', u'seen live', u'indie', u'modern rock', u'Favorite', u'emocore', u'Emo rock', u'electronic rock', u'not emo', u'Strange metal']"
469,Capricorn (A Brand New Name),178095,1362447,233000,"[u'alternative rock', u'rock', u'30 seconds to mars', u'alternative', u'Progressive rock', u'space rock', u'emo', u'hard rock', u'Jared Leto', u'30stm', u'alternative metal', u'Awesome', u'FUCKING AWESOME', u'songs that you wanna listen to over and over again', u'favorites', u'male vocalist', u'00s', u'Nu Metal', u'metal', u'pop', u'favorite songs', u'Love', u'epic', u'industrial', u'american', u'cool', u'post-grunge', u'Favorite', u'Favourite Songs', u'art-rock', u'not emo', u'new wave', u'great', u'favourite', u'emotional', u'heard on Pandora', u'male vocalists', u'Down', u'I love this song', u'Love it', u'Atmosphere', u'Best Band EVER', u'songs I absolutely love', u'00s rock', u'capricorn', u'Music that makes me happy', u'radioultra', u'my rockin out music', u'Shannon Leto', u'electronic']"
470,"If You Think This Song Is About You, It Probably Is",61014,687325,151000,"[u'post-hardcore', u'post hardcore', u'rock', u'addictive', u'hard core', u'emo', u'love at first listen', u'fucking love this', u'a little pop', u'metal', u'punk', u'hardcore', u'hate', u'title is a full sentence', u'cimx-fm', u'craig owens', u'songs to listen while drinking beer to make life too awesome', u'songs I can actually listen to on repeat', u'Forever Love', u'First Song', u'im not angry', u'Punch me in the dead spot again']"
471,Wayfarer Youth,17847,131526,220000,"[u'rock', u'import', u'post hardcore', u'Songs Seen Live', u'powerful']"
472,Looking for the Perfect Beat,29542,82548,418000,"[u'Hip-Hop', u'electro', u'old school', u'80s', u'rap', u'old skool', u'hip hop', u'funk', u'electronic', u'turntablism', u'ElectglitchdubhoP', u'electro old school', u'Afrika Bambaataa  Looking For the Perfect Beat', u'dance', u'funky', u'old school rap', u'cool', u'beat', u'electro funk', u'1980s', u'Afrika Bambaataa', u'808', u'old skool hip-hop tracks', u'5 star songs', u'classic hip-hop', u'bronx', u'GTA', u'718 Love', u'perfect beat', u'electronica', u'alternative', u'new york', u'experimental', u'USA', u'oldschool', u'beautiful', u'eighties', u'american', u'NYC', u'oldskool', u'synthesizer', u'super', u'good', u'heard on Pandora', u'male vocalist', u'classic electro', u'break', u'Workout', u'alternative hip-hop', u'dance dance dance']"
473,Tell Me a Bedtime Story,28576,70078,300000,"[u'jazz', u'piano', u'jazz piano', u'jazz fusion', u'herbie hancock', u'60s', u'funk', u'Smooth Jazz', u'chill', u'jazz instrumental', u'chillout', u'sexy', u'downtempo', u'Love', u'Fusion', u'urban', u'contemporary jazz', u'cool jazz', u'great song', u'heard on Pandora', u'fav', u'Swift-Tuttle Oh how I do love you', u'the one', u'-2', u'legend', u'rhodes', u'E-Piano', u'lounge jazz', u'20th Century', u'jazz-fusion', u'fender rhodes', u'herbie', u'Random stuff', u'Instrumental Jazz Tag', u'nigh', u'3STYLE', u'Tell me a bedtime story', u'and then came then', u'Funk Tag', u'Juns1', u'double-ender 5', u'Tellme', u'artist - Herbie Hancock', u'3 - Sterne', u'HHancock', u'real deal jazz', u'Taudot']"
474,Helter Skelter,438904,2421653,270000,"[u'classic rock', u'rock', u'hard rock', u'60s', u'The Beatles', u'british', u'psychedelic', u'heavy metal', u'beatles', u'proto-metal', u'Psychedelic Rock', u'pop', u'ive got blisters on my fingers', u'experimental', u'alternative', u'classic', u'Rock and Roll', u'Awesome', u'1968', u'metal', u'rock n roll', u'oldies', u'punk', u'favorites', u'paul mccartney', u'FUCKING AWESOME', u'guitar', u'intense', u'heavy', u'britpop', u'angry', u'groovy', u'Charles Manson', u'Grunge', u'favorite songs', u'Proto-Heavy Metal', u'indie', u'70s', u'Love', u'crazy', u'helter skelter', u'proto metal', u'rock out', u'Hell Yeah', u'not about some guy who formed a cult', u'wild and crazy things', u'seen live', u'UK', u'Energetic', u'amazing']"
475,Smooth Operator,26521,68949,277000,"[u'Hip-Hop', u'rap', u'Big Daddy Kane', u'hip hop', u'classic', u'underground hip-hop', u'good shit', u'loved', u'1989', u'Real hip-hop', u'hiphop classics', u'come on baby', u'logic the da', u'chillout', u'electronic', u'indie', u'chill', u'rock', u'80s', u'dance', u'Love', u'guitar', u'lounge', u'american', u'jazz funk', u'Chillosophy', u'funky jazz', u'old school', u'male vocals', u'alternative rap', u'Jazz Hop', u'operators', u'smoothness', u'real hip hop', u'east coast hip-hop', u'5 of 10 stars', u'all time favorites', u'classic hip-hop', u'global fusion', u'funky ass shit', u'rap hip hop', u'1979-2006: A Hip-Hop Odyssey - 800 Tracks In A 48 Minute Mix', u'essential hip hop', u'produced by big daddy kane', u'cold chillin', u'hippity hoppity', u'chill906', u'i know that sample', u'Crici', u'hip hop party']"
476,Paid in Full,153014,449388,213000,"[u'Hip-Hop', u'old school', u'hip hop', u'80s', u'rap', u'classic', u'Old School Hip Hop', u'eric b and rakim', u'1987', u'new york', u'old school rap', u'classic hip-hop', u'hiphop', u'party', u'east coast rap', u'money', u'Real hip-hop', u'Classic Hip Hop', u'ElectglitchdubhoP', u'critically acclaimed song', u'paid in full', u'mojolukasmojo', u'Kiche', u'Dope', u'old skool', u""80's"", u'Jazz Hop', u'Lyrical Flow', u'vh1 top 100 hip-hop songs', u'vugube62', u'pop', u'chill', u'beats', u'East Coast', u'rakim', u'legend', u'golden age', u'real hip hop', u'ny', u'banger', u'Golden Age hip-hop', u'Coldcut 7 minutes of madness remix', u'best fucking hip-hop song ever', u'Erik B And Rakim - Paid In Full', u'break-hop', u'beats for days', u'old school heroes', u'electronic', u'rock', u'singer-songwriter']"
477,DJ Premier In Deep Concentration,8598,27774,193000,"[u'turntablism', u'hip hop', u'instrumental', u'dj premier', u'instrumental hip hop', u'Gang Starr', u'original turntablism', u'Hip-Hop', u'Gilles Peterson', u'1989', u'5 of 10 stars', u'Classic Hip Hop', u'where are my headphones', u'primo', u'Gang Star', u'beats for days', u'i know that sample', u'fun to rhyme over']"
478,Chicken Strut,19559,56634,164000,"[u'funk', u'New Orleans', u'Funk Tag', u'chill', u'USA', u'crazy', u'funky', u'hand claps', u'ridiculous', u'animals', u'Love it', u'1970', u'bateria', u'the meters', u'chicken', u'Chicken Music', u'RadioNOLA', u'Superior Music', u'dance my ass off', u'Good N Funky']"
479,Eulogy and Light,22530,48120,209000,"[u'funk', u'p-funk', u'psychedelic', u'70s', u'soul', u'Psychedelic Soul', u'spiritual', u'funkadelic', u'funkgdchill', u'Funk Tag', u'rock', u'weird', u'funky', u'Dope', u'spoken word', u'psych', u'political', u'good shit', u'Flamenco', u'satire', u'Old School soul', u'burlesque', u'reversed', u'silent intensity', u'silent inanity', u'aint it funky', u'knorpelfunky', u'brain2brain', u'tripadelic', u'suppa duppa badass psychedelic funk crazy wah wah rock', u'lets go deep', u'Hartz IV', u'cream cheese', u'smallworldpodcast', u'eraza', u'freeformnetwerk', u'frsd', u'wmfo', u'soulbrother number 1', u'kalijaa', u'Budsbuddy']"
