,Songs,Listeners,Playcount,Duration,Tags
521,The City Is At War,203932,1446113,171000,"[u'alternative', u'dance', u'rock', u'alternative rock', u'indie', u'pop punk', u'cobra starship', u'dance rock', u'party', u'fun', u'hot', u'indietronica', u'makes me want to dance', u'indie rock', u'dance punk', u'electro-pop', u'I love', u'The City is at War', u'electronic', u'pop', u'favorite songs', u'electro', u'powerpop', u'bang', u'Really Really Ridiculously Fun to Dance To', u'cobra starship - the city is at war', u'emo', u'indie pop', u'Awesome', u'groove', u'emotronica', u'good', u'00s', u'Cool song', u'FUCKING AWESOME', u'Love it', u'poprock', u'<3', u'dancy', u'Snakes on a Motherfucking Plane', u'dancecore', u'songs I fucking love to death', u'cobra', u'gabe', u'viva la cobra', u'Wicked shizzle', u'starside casino', u'seen live', u'electropop', u'punk']"
522,Hot Mess,96170,1002262,172000,"[u'dance', u'electropop', u'alternative', u'pop punk', u'synthpop', u'cobra starship', u'pop', u'love at first listen', u'indie', u'alternative rock', u'catchy', u'rock', u'electronic', u'party', u'electronica', u'2009', u'Awesome', u'addictive', u'party time', u'i wanna dance', u'starside casino', u'sexy', u'pop rock', u'favorites', u'new rave', u'fun', u'Guilty Pleasures', u'dance rock', u'Love it', u'dance dance', u'fangs up cobra style', u'a song to put on repeat', u'aaakkkeeelll', u'your a hot mess', u'seen live', u'hip hop', u'indie rock', u'happy', u'synth', u'upbeat', u'Energetic', u'amazing', u'cool', u'powerpop', u'00s', u'Favorite', u'Favourites', u'want to see live', u'ego', u'FUCKING AWESOME']"
523,Ocean Avenue,499998,3270068,198000,"[u'rock', u'punk rock', u'alternative', u'pop punk', u'Yellowcard', u'punk', u'emo', u'alternative rock', u'favorites', u'summer', u'Ocean Avenue', u'pop', u'Love', u'guilty pleasure', u'pop rock', u'00s', u'memories', u'catchy', u'Awesome', u'fun', u'happy', u'amazing', u'rock now', u'favorite songs', u'punk pop', u'teen', u'yellow card', u'violin', u'upbeat', u'great', u'Pop-punk', u'alt rock', u'skate punk', u'nostalgia', u'happiness', u'My Favorites', u'teenie', u'seen live', u'american', u'Favourites', u'Summery', u'Good Stuff', u'awsome rock', u'yellowcard ocean avenue', u'indie', u'indie rock', u'power', u'2004', u'Driving', u'High School']"
524,Welcome to the Black Parade,779456,6152524,313000,"[u'rock', u'emo', u'alternative', u'punk rock', u'punk', u'my chemical romance', u'alternative rock', u'mcr', u'favorites', u'Awesome', u'pop punk', u'epic', u'00s', u'Welcome to the Black Parade', u'screamo', u'pretty fucking awesome', u'seen live', u'Love', u'black parade', u'2006', u'pop', u'american', u'emocore', u'the black parade', u'FUCKING AWESOME', u'indie', u'catchy', u'Good Stuff', u'favorite songs', u'indie rock', u'Energetic', u'Favorite', u'Gerard Way', u'<3', u'metal', u'piano', u'beautiful', u'male vocalists', u'Favourites', u'emo punk', u'hard rock', u'pop rock', u'post-hardcore', u'best', u'new jersey', u'post-punk', u'favourite', u'Gothic Rock', u'Guilty Pleasures', u'favorite song']"
525,I Don't Love You,473421,3782283,238000,"[u'rock', u'emo', u'alternative', u'my chemical romance', u'punk rock', u'alternative rock', u'mcr', u'punk', u'Love', u'favorites', u'emotional', u'sad', u'seen live', u'american', u'00s', u'I Dont Love You', u'pop punk', u'Favorite Bands', u'beautiful', u'screamo', u'Ballad', u'2006', u'emocore', u'Love it', u'the black parade', u'pop', u'makes me cry', u'FUCKING AWESOME', u'romantic', u'Awesome', u'i love it', u'sounds like love should feel', u'epic', u'Emo rock', u'not emo', u'breakup song', u'favorite songs', u'indie rock', u'slow', u'favourite', u'loved', u'guilty pleasure', u'Favourites', u'breakup', u'power ballads', u'rock ballads', u'sad song', u'the desperate kingdom of love', u'lo mejor', u'best song titles']"
526,Did It Hurt,37827,386649,124000,"[u'indie', u'acoustic', u'rock', u'powerpop', u'I WANT TO FUCK THIS SONG']"
527,Did It Hurt,37827,386649,124000,"[u'indie', u'acoustic', u'rock', u'powerpop', u'I WANT TO FUCK THIS SONG']"
528,360 O Arrocha Do Poder (Ao Vivo),1537,4078,154000,[]
529,Fiorino,4861,27407,191000,"[u'epic', u'guilty pleasure', u'classe', u'giulia', u'Bagaceira', u'fiorino', u'radio dinamica fm dj wander']"
530,Faz Uó,22352,265347,0,"[u'guilty pleasure', u'tecno brega', u'2012', u'Brega', u'electrobrega', u'pop', u'pop rock', u'Electro Pop', u'comedy', u'brazilian', u'hino', u'motel', u'matheus', u'davi', u'fogonorabo']"
531,Todo Dia,13289,150660,0,"[u'pop', u'funk', u'drag queen', u'ressuscita']"
532,Did It Hurt,37827,386649,124000,"[u'indie', u'acoustic', u'rock', u'powerpop', u'I WANT TO FUCK THIS SONG']"
533,Bucky Done Gun,233357,1374725,157000,"[u'Hip-Hop', u'electronic', u'dance', u'Grime', u'female vocalists', u'hip hop', u'Funk Carioca', u'funk', u'dancehall', u'baile funk', u'electro', u'electronica', u'british', u'indie', u'00s', u'mia', u'alternative', u'rap', u'fun', u'2005', u'urban', u'experimental', u'world', u'UK', u'favorites', u'catchy', u'ClubDance', u'alternative dance', u'female', u'pop', u'sexy', u'indie pop', u'Electroclash', u'Driving', u'bounce', u'hiphop', u'party', u'beats', u'UK hip hop', u'cool', u'female vocal', u'perfect', u'diplo', u'wake me up', u'Switch', u'M.I.A', u'MIA is her own genre', u'seen live', u'chill', u'reggae']"
534,Wannabe - Radio Edit,218770,725961,172000,"[u'pop', u'90s', u'dance', u'british', u'1996', u'hip hop', u'dance pop', u'Guilty Pleasures', u'nostalgia', u'gute laune', u'girl power', u'1997', u'sonnendeck', u'Iconic', u'gute laune sonnendeck', u'old but gold', u'rsrssrsrrs', u'90s90s90s', u'VH1 100 Greatest Songs Of The 90s']"
535,Todo Dia,13289,150660,0,"[u'pop', u'funk', u'drag queen', u'ressuscita']"
536,Star Girl,75727,578566,207000,"[u'McFly', u'pop rock', u'pop', u'british', u'britpop', u'Awesome', u'amazing', u'catchy', u'rock', u'happy', u'english', u'talented', u'dougie poytner', u'cute', u'upbeat', u'good', u'boybands', u'danny jones', u'tom fletcher', u'seen live', u'UK', u'harry judd', u'Love', u'england', u'pop punk', u'male vocalists', u'want to see live', u'addictive', u'Star Girl', u'galaxy defenders stay forever', u'indie', u'alternative', u'power pop', u'dance', u'favorites', u'car', u'summer', u'great', u'fun', u'guilty pleasure', u'00s', u'Favorite', u'Pop-Rock', u'brilliant', u'smile', u'Fave', u'singalong', u'Good Stuff', u'makes me happy', u'Brit-pop']"
537,Todo Dia,13289,150660,0,"[u'pop', u'funk', u'drag queen', u'ressuscita']"
538,Faz Uó,22352,265347,0,"[u'guilty pleasure', u'tecno brega', u'2012', u'Brega', u'electrobrega', u'pop', u'pop rock', u'Electro Pop', u'comedy', u'brazilian', u'hino', u'motel', u'matheus', u'davi', u'fogonorabo']"
539,Chifrudo (feat. Mulher Pepita),8462,98707,0,"[u'pop', u'funk', u'Raaan', u'pau no cu do mundo', u'aceita que eu sou gostosa', u'trans', u'hino', u'POP Brasil', u'corno music', u'Pepita', u'raaaaan', u'aceita eu sou gostosa', u'EI PEPITAA', u'ei pepita', u'Ei Pepitaaaaaaaaaa']"
540,Todo Dia,13289,150660,0,"[u'pop', u'funk', u'drag queen', u'ressuscita']"
541,She's A Lady,189171,1043905,240000,"[u'pop punk', u'powerpop', u'forever the sickest kids', u'<3', u'shes a lady', u'Awesome', u'indie', u'alternative', u'catchy', u'rock', u'punk', u'Love', u'i fell in love with this band due to this song', u'pop', u'upbeat', u'punk rock', u'sing out loud', u'Shes A lady-FTSK', u'electronic', u'alternative rock', u'power pop', u'dance', u'pop rock', u'fun', u'danceable', u'seen live', u'indie pop', u'road trip', u'Love it', u'like it', u'What I like', u'wayyyy too catchy', u'ftsk', u'song to download', u'emo', u'RockPop', u'amazing', u'loveit', u'good song', u'liar', u'New faves', u'love these boys', u'like vegas', u'sounds saddly like me S', u'forever the sickest kidzzz', u'electronica', u'vocal', u'chill', u'indie rock', u'hard rock']"
542,The City Is At War,203932,1446113,171000,"[u'alternative', u'dance', u'rock', u'alternative rock', u'indie', u'pop punk', u'cobra starship', u'dance rock', u'party', u'fun', u'hot', u'indietronica', u'makes me want to dance', u'indie rock', u'dance punk', u'electro-pop', u'I love', u'The City is at War', u'electronic', u'pop', u'favorite songs', u'electro', u'powerpop', u'bang', u'Really Really Ridiculously Fun to Dance To', u'cobra starship - the city is at war', u'emo', u'indie pop', u'Awesome', u'groove', u'emotronica', u'good', u'00s', u'Cool song', u'FUCKING AWESOME', u'Love it', u'poprock', u'<3', u'dancy', u'Snakes on a Motherfucking Plane', u'dancecore', u'songs I fucking love to death', u'cobra', u'gabe', u'viva la cobra', u'Wicked shizzle', u'starside casino', u'seen live', u'electropop', u'punk']"
543,Starlight,1300165,12244881,239000,"[u'alternative rock', u'rock', u'alternative', u'Muse', u'british', u'indie', u'Progressive rock', u'indie rock', u'beautiful', u'britpop', u'starlight', u'seen live', u'Love', u'favorites', u'Awesome', u'00s', u'epic', u'male vocalists', u'piano', u'brit rock', u'UK', u'electronic', u'pop', u'space rock', u'amazing', u'Britrock', u'songs to hear before you die', u'happy', u'Favourites', u'Love it', u'Muse - Starlight', u'piano rock', u'Progressive', u'2006', u'melancholic', u'male vocalist', u'Favourite Songs', u'black holes and revelations', u'Makes Me Smile', u'catchy', u'Favorite', u'FUCKING AWESOME', u'feelgood', u'loved', u'<3', u'british rock', u'romantic', u'favourite', u'emotional', u'great']"
544,Starlight,1300165,12244881,239000,"[u'alternative rock', u'rock', u'alternative', u'Muse', u'british', u'indie', u'Progressive rock', u'indie rock', u'beautiful', u'britpop', u'starlight', u'seen live', u'Love', u'favorites', u'Awesome', u'00s', u'epic', u'male vocalists', u'piano', u'brit rock', u'UK', u'electronic', u'pop', u'space rock', u'amazing', u'Britrock', u'songs to hear before you die', u'happy', u'Favourites', u'Love it', u'Muse - Starlight', u'piano rock', u'Progressive', u'2006', u'melancholic', u'male vocalist', u'Favourite Songs', u'black holes and revelations', u'Makes Me Smile', u'catchy', u'Favorite', u'FUCKING AWESOME', u'feelgood', u'loved', u'<3', u'british rock', u'romantic', u'favourite', u'emotional', u'great']"
545,O Primeiro Dia,925,3087,179000,[]
546,Starlight,1300165,12244881,239000,"[u'alternative rock', u'rock', u'alternative', u'Muse', u'british', u'indie', u'Progressive rock', u'indie rock', u'beautiful', u'britpop', u'starlight', u'seen live', u'Love', u'favorites', u'Awesome', u'00s', u'epic', u'male vocalists', u'piano', u'brit rock', u'UK', u'electronic', u'pop', u'space rock', u'amazing', u'Britrock', u'songs to hear before you die', u'happy', u'Favourites', u'Love it', u'Muse - Starlight', u'piano rock', u'Progressive', u'2006', u'melancholic', u'male vocalist', u'Favourite Songs', u'black holes and revelations', u'Makes Me Smile', u'catchy', u'Favorite', u'FUCKING AWESOME', u'feelgood', u'loved', u'<3', u'british rock', u'romantic', u'favourite', u'emotional', u'great']"
547,My Propeller,392007,3584895,208000,"[u'indie rock', u'british', u'indie', u'alternative rock', u'alternative', u'rock', u'arctic monkeys', u'sexy', u'00s', u'FUCKING AWESOME', u'2009', u'post-punk', u'sex', u'Favorite', u'<3', u'humbug', u'so fucking good', u'totally not about sex', u'vugube62', u'seen live', u'UK', u'catchy', u'dark', u'other', u'beautiful', u'Retro', u'Psychedelic Rock', u'male vocalist', u'male vocalists', u'play this at my funeral', u'Favourites', u'Eargasm', u'I love', u'lizvelrene2009', u'hot beats dirty sheets', u'expand your horizons', u'so slick it sounds slightly evil', u'My Propeller', u'classic rock', u'chill', u'hard rock', u'singer-songwriter', u'favorites', u'memories', u'Love', u'Lo-Fi', u'Alternative  Punk', u'Contemporary', u'soft rock', u'garage rock revival']"
548,Red Light,312112,1720047,191000,"[u'indie rock', u'rock', u'indie', u'alternative', u'The Strokes', u'alternative rock', u'Garage Rock', u'00s', u'american', u'heard on Pandora', u'sweet', u'new york', u'pop rock', u'indie pop', u'Love', u'cute', u'Retro', u'garage', u'Strokes', u'classic rock', u'seen live', u'punk', u'Lo-Fi', u'narrative', u'NYC', u'male vocalists', u'bouncy', u'english', u'colours', u'jive', u'cheers me up', u'when you love a song more than yourself', u'pop', u'british', u'folk', u'albums I own', u'USA', u'dance', u'favorites', u'memories', u'happy', u'britpop', u'post-punk', u'girls', u'summer', u'art rock', u'arctic monkeys', u'Mellow', u'fun', u'groovy']"
549,I Would Do Anything for You,432268,2935434,214000,"[u'indie', u'indie rock', u'alternative', u'indie pop', u'electropop', u'electronic', u'rock', u'foster the people', u'alternative rock', u'Love', u'summer', u'love at first listen', u'pop', u'american', u'2011', u'addictive', u'handclaps', u'dance', u'this song makes me smile', u'songs that make me happy to be young', u'Torches', u'chill', u'electro', u'catchy', u'Mellow', u'synthpop', u'alternative pop', u'10s', u'chillax', u'Motivation', u'redrage keys', u'my 10s', u'this song reminds me of foals', u'glugluglu', u'woolala', u'chillout', u'folk', u'USA', u'favorites', u'indiepop', u'beautiful', u'Awesome', u'upbeat', u'Lady Gaga', u'Like', u'soft', u'California', u'cool', u'good', u'male vocalists']"
550,Sinceramente,57002,360517,252000,"[u'rock', u'brazilian', u'brazilian rock', u'rock gaucho', u'alternative', u'brasil', u'Cachorro Grande', u'indie', u'Cachorro Grande- Sinceramente', u'Sinceramente', u'alternative rock', u'indie rock', u'rock nacional', u'male vocalists', u'rock brasil', u'rio grande do sul', u'liquidificador de sentimentos', u'eu casava', u'seen live', u'hardcore', u'brazil', u'rock n roll', u'musicas que mexem com meu coracao', u'cachorro', u'pra sussurar no ouvido', u'agradavel aos ouvidos', u'para seres apaixonados', u'musicas que me lembram alguem', u'Rock Grande do Sul', u'classic rock', u'emo', u'post-rock', u'blues', u'Awesome', u'sul', u'poetry', u'nostalgic', u'loved', u'cool', u'latino', u'Southern Rock', u'00s', u'2005', u'rock brasileiro', u'addictive', u'perfect', u'FUCKING AWESOME', u'2', u'cinderella', u'Lovers']"
551,O Primeiro Dia,925,3087,179000,[]
552,Starlight,1300165,12244881,239000,"[u'alternative rock', u'rock', u'alternative', u'Muse', u'british', u'indie', u'Progressive rock', u'indie rock', u'beautiful', u'britpop', u'starlight', u'seen live', u'Love', u'favorites', u'Awesome', u'00s', u'epic', u'male vocalists', u'piano', u'brit rock', u'UK', u'electronic', u'pop', u'space rock', u'amazing', u'Britrock', u'songs to hear before you die', u'happy', u'Favourites', u'Love it', u'Muse - Starlight', u'piano rock', u'Progressive', u'2006', u'melancholic', u'male vocalist', u'Favourite Songs', u'black holes and revelations', u'Makes Me Smile', u'catchy', u'Favorite', u'FUCKING AWESOME', u'feelgood', u'loved', u'<3', u'british rock', u'romantic', u'favourite', u'emotional', u'great']"
553,My Propeller,392007,3584895,208000,"[u'indie rock', u'british', u'indie', u'alternative rock', u'alternative', u'rock', u'arctic monkeys', u'sexy', u'00s', u'FUCKING AWESOME', u'2009', u'post-punk', u'sex', u'Favorite', u'<3', u'humbug', u'so fucking good', u'totally not about sex', u'vugube62', u'seen live', u'UK', u'catchy', u'dark', u'other', u'beautiful', u'Retro', u'Psychedelic Rock', u'male vocalist', u'male vocalists', u'play this at my funeral', u'Favourites', u'Eargasm', u'I love', u'lizvelrene2009', u'hot beats dirty sheets', u'expand your horizons', u'so slick it sounds slightly evil', u'My Propeller', u'classic rock', u'chill', u'hard rock', u'singer-songwriter', u'favorites', u'memories', u'Love', u'Lo-Fi', u'Alternative  Punk', u'Contemporary', u'soft rock', u'garage rock revival']"
554,Meu Sol,22328,212932,200000,"[u'indie', u'para um amor', u'folk', u'indie rock', u'brasil', u'mpb', u'folk rock', u'brazilian', u'brazilian music', u'brazilian indie', u'musics of my life', u'br porra', u'novela lixosa', u'tipo thiago pequeno', u'o melhor da musica brasileira']"
555,There Is A Light That Never Goes Out - 2011 Remastered Version,177926,839652,0,"[u'new wave', u'80s', u'90s', u'Pop-Rock', u'music choice: classic alternative', u'british', u'alternative rock', u'memories', u'post-punk', u'The Smiths', u'male vocalists', u'1986', u'anthem', u'evening', u'80s New Wave', u'D:', u'hermosura', u'there is a light that never goes out', u'ukojenie', u'death drive', u'este tema me da ganas de ser feliz', u'gorda feelings', u'amor bocha']"
556,Awake My Soul,501837,3695800,256000,"[u'folk', u'indie folk', u'indie', u'british', u'beautiful', u'bluegrass', u'acoustic', u'emotional', u'folk rock', u'indie rock', u'Mellow', u'amazing', u'Song for rainy day', u'favorites', u'Awesome', u'male vocalist', u'mumford and Sons', u'ridiculously catchy', u'alternative', u'favourite', u'loved', u'Alternative Folk', u'vugube62', u'rock', u'Favorite Bands', u'singer-songwriter', u'catchy', u'atmospheric', u'Like', u'Favorite', u'2000s', u'6 of 10 stars', u'Favourite Songs', u'cool songs', u'favourite artist', u'Soundtrack Of My Life', u'Songs to Die for', u'sex for my ears', u'we can all die now', u'Sweet Summer Sounds', u'Contempororyfolk', u'opaque nature', u'Awake My Soul', u'Soundtrack', u'indie pop', u'UK', u'Love', u'singersongwriter', u'Fusion', u'britpop']"
557,In Your Sleep,1112,4570,177000,[]
558,When I'm Whit You,2280,8478,186000,[]
559,Toothpaste Kisses,315440,1642007,159000,"[u'indie', u'british', u'indie rock', u'Dreamy', u'indie pop', u'Love', u'cute', u'the maccabees', u'chill', u'Mellow', u'alternative', u'beautiful', u'Acoustic Indie', u'sweet', u'gives me a warm fuzzy feeling', u'happy', u'acoustic', u'love or something close', u'music for rainy days', u'toothpaste kisses', u'britpop', u'wistful', u'matter-of-fact cuteness', u'love songs hate songs and everything inbetween', u'rock', u'Love it', u'milk music', u'music for superheros', u'kills me softly', u'be my valentine', u'chillout', u'romantic', u'summer', u'00s', u'relax', u'lovely', u'love at first listen', u'english', u'romantic tension', u'so cute', u'holding hands', u'outrageously beautiful', u'Maccabees', u'when i make a film im putting this song in it', u'emotional attachment to this song', u'just simply adorable', u'coo like coca cola', u'woop-a-woo', u'seen live', u'alternative rock']"
560,Did It Hurt,37827,386649,124000,"[u'indie', u'acoustic', u'rock', u'powerpop', u'I WANT TO FUCK THIS SONG']"
561,Maria Augusta,19211,188473,270000,"[u'indie', u'rock gaucho', u'rock', u'alternative', u'brazilian', u'delicious', u'indie rock', u'omg', u'love at first listen', u'<3', u'classe', u'bruna', u'brasil novo', u'fake lounge', u'Qirbbufus Quorn-When the future gets real tough', u'it is at the moment mother vangelis']"
562,Na Ponta dos Pés,7633,55869,206000,[]
563,Get Sick Soon,40725,213600,176000,"[u'indie', u'swedish', u'female vocalists', u'singer-songwriter', u'indie pop', u'pop', u'Love', u'Mellow', u'hello saferide', u'folk', u'cute', u'female vocalist', u'sunshine', u'hey song youre so fucking cute', u'i love this song with every inch of my being', u'electronic', u'chill', u'memories', u'happy', u'slow', u'svenskt', u'beautiful', u'quirky', u'Voice', u'nordic', u'Reflective', u'waltz', u'sunday', u'soft', u'Rainy Day', u'Indiesoc faves', u'Best of 2005', u'quiet', u'loved', u'cool', u'funny', u'female artists', u'female vocal', u'lovely', u'I Like It', u'lyrics', u'sick', u'textschnipsel', u'love the lyrics', u'friendsofthekingofrummelpop', u'gloeckchen', u'Air of December', u'adorable', u'great voice', u'singalong']"
564,My Kind of Woman,116427,1007848,191000,"[u'indie', u'indie rock', u'Canadian', u'good vibes', u'canada', u'Lo-Fi', u'Jizz Jazz', u'music to put on lipstick to', u'similar to: pavement', u'vocal', u'rock', u'experimental', u'indie pop', u'post-rock', u'singer-songwriter', u'memories', u'post-punk', u'jangle pop', u'psychedelic', u'Like', u'montreal', u'surf rock', u'2013', u'5 Stars', u'2012', u'10s', u'2010s', u'Lieder des Tages', u'surf pop', u'slacker rock', u'captured tracks', u'21st century', u'if the stars had a sound', u'luvedtrax', u'unreal stuff', u'fucking my life', u'dreamlove', u'Magic deMarco']"
565,I Could Die for You,410388,2171144,193000,"[u'rock', u'alternative rock', u'alternative', u'Funk Rock', u'Red Hot Chili Peppers', u'funk', u'Mellow', u'00s', u'beautiful', u'pop rock', u'favorites', u'rhcp', u'seen live', u'Love', u'90s', u'american', u'hard rock', u'California', u'indie', u'pop', u'chill', u'Rock and Roll', u'John Frusciante', u'By the Way', u'i could die for you', u'chillout', u'indie rock', u'modern', u'Awesome', u'Ballad', u'6 of 10 stars', u'classic rock', u'feel good', u'my love', u'amazing', u'soft', u'relaxing', u'sweet', u'Love it', u'blue', u'best songs ever', u'funk-rock', u'flea', u'makes me feel good', u'all about love', u'anthony kiedis', u'chad smith', u'Alternative Pop and Rock', u'Genialne', u'I am trying to break your heart']"
566,Somewhere Only We Know,176636,895792,210000,"[u'cover', u'Ballad', u'piano', u'british', u'pop', u'female vocalists', u'christmas', u'beautiful', u'better than the original', u'uk number one', u'Keane cover', u'chillout', u'indie', u'female', u'chill', u'singer-songwriter', u'UK', u'calm', u'acoustic', u'world', u'3', u'covers', u'Mellow', u'elegant', u'World Music', u'2013', u'love at first listen', u'5 Stars', u'perfect', u'emotion', u'good covers', u'beautiful voice', u'Love it', u'Masterpiece', u'cover version', u'7 of 10 stars', u'Keane', u'<3', u'sunflower', u'best of 2014', u'IIIIIIIIII AMAZING TRACK :D IIIIIIIIII', u'cover better than original', u'bonus track', u'Lily Allen', u'flawless', u'classy', u'I remember', u'white music for white people', u'Hitler', u'so good']"
567,Shine On - Digital,2770,7959,0,[]
568,360 O Arrocha Do Poder (Ao Vivo),1537,4078,154000,[]
569,360 O Arrocha Do Poder (Ao Vivo),1537,4078,154000,[]
570,I Love It (feat. Charli XCX) - Original Version,104055,375979,155000,"[u'sunflower', u'fav888', u'chillout', u'chill', u'swedish', u'world', u'3', u'World Music', u'charli xcx', u'Skitz0rz', u'Icona Pop', u'uitluisteren artist', u'holloween skitz0rz', u'my dance room']"
571,Todo Dia,13289,150660,0,"[u'pop', u'funk', u'drag queen', u'ressuscita']"
572,Walk,556332,3389236,315000,"[u'metal', u'thrash metal', u'groove metal', u'heavy metal', u'pantera', u'Power metal', u'rock', u'90s', u'thrash', u'hard rock', u'walk', u'american', u'death metal', u'Dimebag', u'FUCKING AWESOME', u'Southern metal', u'Post-thrash Metal', u'favorites', u'Power groove', u'hardcore', u'speed metal', u'classic rock', u'Favorite', u'badass', u'trash metal', u'songs with awesome solos', u'pantera kicks everybodys ass', u'metalcore', u'alternative', u'favorite songs', u'great riff', u'90s metal', u'Grunge', u'Awesome', u'groove', u'aggressive', u'1992', u'respect', u'alternative rock', u'90s Rock', u'gladys the tag', u'Are you talking to me', u'pantera-walk', u'music to punch some assholes to', u'no way punk', u'Progressive metal', u'epic', u'texas', u'songs i love', u'guitar virtuoso']"
573,Tears Don't Fall,678956,5216149,348000,"[u'metalcore', u'metal', u'emocore', u'screamo', u'emo', u'bullet for my valentine', u'hardcore', u'rock', u'hard rock', u'heavy metal', u'Nu Metal', u'alternative', u'tears dont fall', u'alternative rock', u'alternative metal', u'BFMV', u'melodic metalcore', u'Awesome', u'british', u'seen live', u'amazing', u'Love it', u'<3', u'punk', u'Favourite Songs', u'sad', u'I love this song', u'rock-metal', u'favorites', u'Love', u'Melodic Death Metal', u'punk rock', u'Emo rock', u'favourite', u'cool', u'melodic hardcore', u'post hardcore', u'Metal songs', u'best damn song ever', u'Bullet for my Valentine - Tears Dont Fall', u'beautiful', u'emotional', u'Favourites', u'welsh', u'Tears', u'no emo', u'Way my favourite in the fucking world', u'bullet', u'true lyrics', u'heavy']"
574,Rubber Band Stacks,8517,94463,177000,"[u'2015', u'love at first listen', u'Hip-Hop', u'rap', u'american', u'FLOP', u'2015 single', u'farofa', u'rap n\xe3o uma dem\xf4nio', u'faz feat com a azealia', u'fode com essa buceta', u'segura a marimba a\xed iggy']"
575,Smells Like Teen Spirit,1934990,14638490,301000,"[u'Grunge', u'rock', u'Nirvana', u'90s', u'alternative', u'alternative rock', u'punk', u'classic rock', u'anthem', u'hard rock', u'Kurt Cobain', u'seattle', u'american', u'classic', u'favorites', u'Smells Like Teen Spirit', u'punk rock', u'legend', u'Awesome', u'Grunge Rock', u'indie', u'1991', u'best songs ever', u'metal', u'FUCKING AWESOME', u'Favourites', u'90s Rock', u'party', u'favourite', u'guitar', u'cool', u'male vocalists', u'genius', u'powerful', u'favorite songs', u'USA', u'best song ever', u'nevermind', u'Favourite Songs', u'Energetic', u'amazing', u'Rolling Stone 500 Greatest Songs of All Time', u'indie rock', u'epic']"
576,Malandramente,15352,72297,0,"[u'funk', u'Funk Carioca', u'meme']"
577,Ruby,890881,5351075,202000,"[u'indie', u'indie rock', u'rock', u'britpop', u'british', u'alternative', u'kaiser chiefs', u'alternative rock', u'Ruby', u'pop', u'00s', u'catchy', u'Guitar Hero', u'2007', u'UK', u'happy', u'favorites', u'seen live', u'male vocalists', u'brit rock', u'indie pop', u'cool', u'pop rock', u'Awesome', u'brit pop', u'Britrock', u'Kaiser Chiefs - Ruby', u'england', u'Favorite', u'party', u'fun', u'2000s', u'Guitar Hero 3', u'Brit', u'british indie', u'Ruby Ruby Ruby Ruby', u'ruby ruby ruby', u'Energetic', u'Favourites', u'Love', u'upbeat', u'feelgood', u'Leeds', u'dance', u'summer', u'sing along', u'chill', u'post-punk', u'gute laune', u'makes me happy']"
