,Songs,Listeners,Playcount,Duration,Tags
248,Big Exit,198832,872970,231000,"[u'female vocalists', u'rock', u'alternative', u'alternative rock', u'indie', u'singer-songwriter', u'pj harvey', u'indie rock', u'british', u'00s', u'female vocal', u'2000', u'sexy', u'amayzes loved', u'PJ Harvey best songs', u'seen live', u'female', u'post-punk', u'Energetic', u'angry', u'emotional', u'female vocals', u'UK', u'beautiful', u'brit rock', u'female vocalist', u'Favourites', u'liberating', u'PJ', u'davaho53', u'mix-worthy', u'best first tracks', u'jumping and screaming while dedicating it there', u'Polly Jean', u'big exit', u'vugube62', u'favorites', u'Experimental Rock', u'Alternative  Punk', u'britpop', u'guitar', u'brilliant', u'2000s', u'powerful', u'Favourite Songs', u'goosebumps', u'tantotempotaste', u'spunky', u'slgdmbestof', u'music that feels like an old friend']"
249,Lovesong - Remastered,42562,143498,0,"[u'chillout', u'chill', u'alternative rock', u'world', u'post-punk', u'3', u'World Music', u'sunflower', u'antyradio', u'Skitz0rz', u'uitluisteren artist', u'holloween skitz0rz']"
250,Everybody Wants to Rule the World,564150,3003927,252000,"[u'80s', u'pop', u'new wave', u'Tears for Fears', u'rock', u'synth pop', u'british', u'classic rock', u'1985', u'favorites', u'Everybody Wants To Rule The World', u'synthpop', u""80's"", u'alternative', u'oldies', u'dance', u'male vocalists', u'new romantic', u'pop rock', u'soft rock', u'80s Pop', u'classic', u'Mellow', u'nostalgia', u'My 80s', u'Favourites', u'Real Genius', u'Tears For Fears - Everybody Wants To Rule The World', u'electronic', u'summer', u'loved', u'Soundtrack', u'chill', u'alternative rock', u'Love', u'Retro', u'Pop-Rock', u'1980s']"
251,Save A Prayer,210739,949696,333000,"[u'80s', u'new wave', u'pop', u'duran duran', u'synth pop', u'new romantic', u'synthpop', u'british', u'rock', u'alternative', u'melancholy', u'electronic', u'beautiful', u'pop rock', u'1982', u'electronica', u'UK', u'Ballad', u'80s Pop', u'save a prayer', u'male vocalists', u""80's"", u'1980s', u'dance', u'favorites', u'Love', u'melancholic', u'nostalgia', u'chill', u'classic', u'Favourites', u'cold case', u'123 drippy sappy', u'alternative rock', u'eighties', u'dramatic', u'early mtv years', u'My 80s', u'songs i love to sing', u'duran-duran', u'roktronic', u'classic rock', u'synth', u'Mellow', u'amazing', u'Bittersweet', u'Pop-Rock', u'poprock', u'80er', u'80s y 90s']"
252,Hurting,86586,504845,303000,"[u'electronic', u'indie', u'british', u'funky', u'pop', u'fantastic', u'beautiful', u'summer', u'synthpop', u'cool', u'love at first listen', u'feelgood', u'awesomeness', u'electronica', u'alternative', u'sexy', u'dance', u'Love', u'funk', u'indietronica', u'Awesome', u'Dreamy', u'synth', u'new rave', u'amazing', u'fun', u'2011', u'alternative dance', u'Night Music', u'electro rock', u'dancy', u'awesome intro', u'mesmerizing', u'Captivating', u""can't stop listening"", u'saw it live', u'Best singles of 2011', u'106 bpm', u'may-december romance', u'weird but good weird', u'2011 single', u'muzykobloger likes the fact that I like it']"
253,The Racing Rats,294977,1895021,248000,"[u'indie rock', u'indie', u'rock', u'alternative', u'british', u'alternative rock', u'editors', u'post-punk', u'00s', u'britpop', u'favorites', u'seen live', u'beautiful', u'Post-punk revival', u'UK', u'epic', u'melancholy', u'racing rats', u'england', u'brit rock', u'powerful', u'Awesome', u'2007', u'good music', u'songs that make me move', u'guitar', u'dramatic', u'hypnotic', u'pop', u'energy', u'amazing', u'male vocalists', u'addictive', u'FUCKING AWESOME', u'amazing singer', u'Beloved tracks', u'so british', u'the racing rats', u'acoustic', u'new wave', u'Like', u'birmingham', u'rats', u'8 of 10 stars', u'animals', u'Excellent tune', u'favs', u'lowlands 2008', u'The end of the world', u'Brilliant2007']"
254,Tidal Wave,62000,336819,258000,"[u'indie rock', u'indie', u'10s', u'autumn music', u'imtts', u'a ciclovia do rj']"
255,Last Night in the City (feat. Kiesza),12890,39848,284000,[]
256,Come Undone,258018,1482492,278000,"[u'80s', u'new wave', u'pop', u'90s', u'rock', u'duran duran', u'synth pop', u'new romantic', u'british', u'beautiful', u'favorites', u'alternative', u'synthpop', u'Love', u'sexy', u'Mellow', u'electronic', u'chillout', u'1993', u'romantic', u'Come Undone', u'male vocalists', u'chill', u'britpop', u'Favourites', u'classic rock', u'alternative rock', u'pop rock', u'sad', u""80's"", u'Ballad', u'classic', u'melancholic', u'Pop-Rock', u'nostalgia', u'Duran Duran - Come Undone', u'oldies', u'hypnotic', u'sensual', u'amayzes loved', u'moody', u'loved', u'Favorite', u'synth-pop', u'80s Pop', u'I could listen to this song forever', u'Depeche', u'the complete one', u'seen live', u'favorite songs']"
257,Save A Prayer,210739,949696,333000,"[u'80s', u'new wave', u'pop', u'duran duran', u'synth pop', u'new romantic', u'synthpop', u'british', u'rock', u'alternative', u'melancholy', u'electronic', u'beautiful', u'pop rock', u'1982', u'electronica', u'UK', u'Ballad', u'80s Pop', u'save a prayer', u'male vocalists', u""80's"", u'1980s', u'dance', u'favorites', u'Love', u'melancholic', u'nostalgia', u'chill', u'classic', u'Favourites', u'cold case', u'123 drippy sappy', u'alternative rock', u'eighties', u'dramatic', u'early mtv years', u'My 80s', u'songs i love to sing', u'duran-duran', u'roktronic', u'classic rock', u'synth', u'Mellow', u'amazing', u'Bittersweet', u'Pop-Rock', u'poprock', u'80er', u'80s y 90s']"
258,Miracle Aligner,56342,368690,245000,"[u'indie', u'british', u'duo', u'Supergroup', u'<3', u'2016', u'TLSP', u'2016 single', u'bbc radio1 playlist 2016', u'opener festival 2016']"
259,Song 2,1411479,8913476,122000,"[u'rock', u'britpop', u'alternative', u'90s', u'indie', u'alternative rock', u'british', u'blur', u'indie rock', u'party', u'Energetic', u'woohoo', u'punk', u'pop', u'fun', u'brit pop', u'favorites', u'UK', u'1997', u'Awesome', u'Grunge', u'song 2', u'dance', u'cool', u'male vocalists', u'classic rock', u'hard rock', u'energy', u'punk rock', u'guitar', u'indie pop', u'Woo hoo', u'catchy', u'Favourite Songs', u'Love', u'loud', u'powerful', u'happy', u'favourite', u'Brit', u'fifa', u'seen live', u'classic', u'upbeat', u'Favorite', u'i am a party girl here is my soundtrack', u'brit rock', u'Brit-pop', u'damon albarn', u'Favourites']"
260,The Bitter End,677756,5258057,191000,"[u'rock', u'alternative rock', u'alternative', u'Placebo', u'indie', u'british', u'indie rock', u'britpop', u'seen live', u'favorites', u'00s', u'melancholic', u'male vocalists', u'The Bitter End', u'Awesome', u'energy', u'sad', u'UK', u'Favourites', u'glam rock', u'electronic', u'Driving', u'FUCKING AWESOME', u'emo', u'pop', u'Love', u'2003', u'Favourite Songs', u'Energetic', u'male vocalist', u'Britrock', u'english', u'Great Lyricists', u'post-rock', u'90s', u'amazing', u'classic rock', u'singer-songwriter', u'dark', u'melancholy', u'favourite', u'Favorite', u'best', u'perfect', u'bitter', u'good music to cry with', u'the best', u'Bitter end', u'Placebo The Bitter End', u'metal']"
261,Last Post on the Bugle,208574,1289545,144000,"[u'indie rock', u'indie', u'british', u'rock', u'alternative', u'britpop', u'punk', u'the libertines', u'Garage Rock', u'british i like', u'post-punk', u'genius', u'brit rock', u'songs that i will still be listening to in a billion years', u'alternative rock', u'punk rock', u'loved', u'00s', u'english', u'libertines', u'pete', u'brilliant just brilliant', u'favorite songs', u'garage rock revival', u'Awesome', u'drums', u'male vocalists', u'Favourites', u'perfect', u'handclaps', u'Brit', u'Britrock', u'Post-punk revival', u'Punk Revival', u'no radiohead radio', u'FREAKING BRILLIANT', u'finest Indie', u'heroine', u'brilliant song', u'Loves of my life', u'finast', u'The best of the Libertines', u'seen live', u'singer-songwriter', u'pop rock', u'favorites', u'other', u'2004', u'moody', u'Retro']"
262,The Suburbs,598098,5913686,557000,"[u'indie rock', u'indie', u'rock', u'alternative', u'Canadian', u'Arcade Fire', u'beautiful', u'alternative rock', u'2010', u'summer', u'melancholy', u'baroque pop', u'love at first listen', u'nostalgic', u'pop', u'piano', u'the world could end while im listening to it and i wouldnt notice', u'so good i would get it tattooed', u'indie pop', u'genius', u'melancholic', u'best of 2010', u'10s', u'I could listen to this song forever', u'makes me move my feet', u'seen live', u'male vocalists', u'great lyrics', u'play this at my funeral', u'Oh My God', u'Possibly made by God', u'canadiangdchill', u'i wanna hold her hand before all this damage is done', u'music to listen in the bus', u'the suburbs', u'sad', u'singer-songwriter', u'favorites', u'calm', u'Awesome', u'best song ever', u'Favorite', u'1Live Fiehe', u'Soundtrack For Life', u'nice start', u'chamber pop', u'Mellow', u'relaxing', u'piano rock', u'lovely']"
263,Black Sheep,145893,1262726,297000,"[u'indie rock', u'scott pilgrim', u'alternative', u'Canadian', u'female vocalists', u'Soundtrack', u'rock', u'indie', u'Metric', u'femalevocalistsgdchill', u'new wave', u'alt rock', u'Roctronik', u'pop', u'alternative rock', u'favorite songs', u'sexy', u'favorites', u'ost', u'female vocalist', u'dance rock', u'2010', u'10s', u'emily', u'Songs seen played live', u'must be played at full volume', u'electronic', u'seen live', u'singer-songwriter', u'canada', u'epic', u'dark', u'guitar', u'Dreamy', u'f', u'female vocals', u'euphoria', u'bliss', u'2011', u'Female Voices', u'animals', u'best of 2010', u'school', u'FUCKING AWESOME', u'Masterpiece', u'eclectonia', u'sing along', u'movie soundtrack', u'10 of 10 stars', u'Favourite Songs']"
264,Bling (Confession of a King),460898,2772154,248000,"[u'rock', u'indie', u'indie rock', u'alternative rock', u'alternative', u'The Killers', u'american', u'00s', u'favorites', u'upbeat', u'seen live', u'cool', u'pop', u'Favorite Bands', u'USA', u'epic', u'new wave', u'Driving', u'fucking legend', u'hard rock', u'pop rock', u'Awesome', u'Dreamy', u'synth', u'favourite', u'2006', u'magic', u'best songs of the 00s', u'10 of 10 stars', u'top quality', u'21st century', u'surprisingly awesome', u'fucking awesome words', u'has to be heard loudly', u'music to get a speeding ticket to', u'electronic', u'male', u'punk', u'favorite songs', u'catchy', u'easy listening', u'beautiful', u'Energetic', u'road', u'Indie-Rock', u'loved', u'groovy', u'male vocalist', u'wave', u'U2']"
265,My Desire,94013,584110,300000,"[u'indie rock', u'indie', u'alternative rock', u'post-punk', u'best of 2014', u'electronic', u'rock', u'alternative', u'post-rock', u'american', u'00s', u'lyrics', u'FM4', u'10s', u'Post-punk revival', u'conan', u'fab', u'2014 single', u'Program Trzeci', u'like at first listen', u'pasion', u'person-reminders', u'arabic disco dance rock']"
266,The Power of Good-Bye,127422,824000,252000,"[u'pop', u'Madonna', u'90s', u'female vocalists', u'Ballad', u'electronic', u'sad', u'beautiful', u'dance', u'ray of light', u'american', u'female vocalist', u'The Power Of GoodBye', u'chillout', u'1998', u'melancholy', u'william orbit', u'alternative', u'favorites', u'haunting', u'favourite', u'emotional', u'top artists', u'female', u'rock', u'80s', u'ambient', u'singer-songwriter', u'Love', u'easy listening', u'adult contemporary', u'atmospheric', u'Mellow', u'Favorite Artists', u'amazing', u'melancholic', u'heartbreak', u'queen of pop', u'trance', u'trip-hop', u'favorite songs', u'sexy', u'downtempo', u'techno', u'Dreamy', u'female vocals', u'loved', u'love songs', u'Favorite', u'love at first listen']"
267,The Winner Takes It All,346317,1709667,296000,"[u'pop', u'abba', u'80s', u'Disco', u'swedish', u'70s', u'female vocalists', u'oldies', u'rock', u'Ballad', u'sad', u'dance', u'romantic', u'The Winner Takes It All', u'1980', u'Europop', u'Sweden', u'scandinavian', u'favorites', u'beautiful', u'heartbreak', u'melancholy', u'classic', u'soft rock', u'Favourites', u'80s Pop', u'ballads', u'easy listening', u'emotional', u'love songs', u'breakup', u'uk number one', u'Guilty Pleasures', u'UK number ones', u'modern vs classical', u'female', u'pop rock', u'melancholic', u'relaxing', u'female vocalist', u'great lyrics', u'english', u'great songs', u'gold', u'10 of 10 stars', u'Sentimental', u'the best', u'top artists', u'lost love', u'Soundtrack Of My Life']"
268,I Was Made for Lovin' You,474137,2715908,270000,"[u'hard rock', u'rock', u'classic rock', u'glam rock', u'70s', u'kiss', u'80s', u'Disco', u'1979', u'hair metal', u'Glam Metal', u'heavy metal', u'metal', u'rock n roll', u'70s rock', u'Love', u'glam', u'yeaaahhhhh', u'Awesome', u'oldies', u'kiss army', u'male vocalists', u'Rock and Roll', u'I was made for lovin you', u'seen live', u'classic', u'USA', u'arena rock', u'american', u'Favourite Songs', u'80s rock', u'Morose Deep dilate Crimson', u'pop', u'favorites', u'relax', u'FUCKING AWESOME', u'1975', u'sleaze rock', u'hardrock', u'Power ballad', u'sleazy', u'Favourites', u'Cock rock', u'great songs', u'poprock', u'sleaze', u'Shock Rock', u'sleazy rock', u'ridiculously awesomely good', u'ultimate hits']"
269,Save A Prayer,210739,949696,333000,"[u'80s', u'new wave', u'pop', u'duran duran', u'synth pop', u'new romantic', u'synthpop', u'british', u'rock', u'alternative', u'melancholy', u'electronic', u'beautiful', u'pop rock', u'1982', u'electronica', u'UK', u'Ballad', u'80s Pop', u'save a prayer', u'male vocalists', u""80's"", u'1980s', u'dance', u'favorites', u'Love', u'melancholic', u'nostalgia', u'chill', u'classic', u'Favourites', u'cold case', u'123 drippy sappy', u'alternative rock', u'eighties', u'dramatic', u'early mtv years', u'My 80s', u'songs i love to sing', u'duran-duran', u'roktronic', u'classic rock', u'synth', u'Mellow', u'amazing', u'Bittersweet', u'Pop-Rock', u'poprock', u'80er', u'80s y 90s']"
270,I Say a Little Prayer,407087,1784761,210000,"[u'soul', u'female vocalists', u'oldies', u'60s', u'motown', u'Aretha Franklin', u'jazz', u'rhythm and blues', u'rnb', u'easy listening', u'female vocalist', u'Love', u'blues', u'classic', u'i say a little prayer', u'pop', u'romantic', u'aretha', u'bacharach', u'happy', u'american', u'Soundtrack', u'love songs', u'RB', u'burt bacharach', u'gospel', u'1968', u'chill', u'rock', u'70s', u'beautiful', u'loved', u'female', u'favorites', u'upbeat', u'r&b', u'Mellow', u'female vocal', u'best songs ever', u'sunny morning', u'classic soul', u'60s soul', u'classic rock', u'vocal jazz', u'funk', u'funky', u'smooth', u'groovy', u'prayer']"
271,I'm Every Woman,148524,476196,304000,"[u'soul', u'Disco', u'funk', u'female vocalists', u'70s', u'chaka khan', u'rnb', u'80s', u'dance', u'pop', u'party', u'female vocalist', u'Soundtrack', u'RB', u'1978', u'Old School soul', u'r&b', u'oldies', u'american', u'Favourites', u'classic soul', u'chaka', u'rhythm and blues', u'discotheque', u'disco party', u'vugube62', u'female', u'jazz', u'favorites', u'lounge', u'funky', u'old skool', u'ost', u'old school', u'loved', u'good', u'live', u'Workout', u'Soul And RB', u'lap dance', u'khan', u'Foxy Lady', u'critically acclaimed song', u'acclaimed music top 3000 bubbling under', u'bridget jones', u'this is uncool', u'Valerie Simpson on the keys', u'1052 disco', u'The sistas anthem', u'every woman']"
272,Careless Whisper,432862,1974302,300000,"[u'80s', u'pop', u'George Michael', u'romantic', u'Love', u'Ballad', u'soul', u'saxophone', u'careless whisper', u'easy listening', u'british', u'male vocalists', u'love songs', u'love song', u'sexy', u'soft rock', u""80's"", u'slow', u'smooth', u'1984', u'favorites', u'beautiful', u'dance', u'relax', u'classic rock', u'classic', u'sad', u'melancholy', u'relaxing', u'sensual', u'ballads', u'rock', u'Mellow', u'emotional', u'sax', u'gay', u'80s Pop', u'chillout', u'jazz', u'chill', u'singer-songwriter', u'90s', u'oldies', u'favourite', u'Sentimental', u'rakkauslaulu', u'pop rock', u'Dreamy', u'good', u'Favourites']"
273,I'm So Excited,250355,960669,229000,"[u'80s', u'Disco', u'pop', u'dance', u'soul', u'female vocalists', u'party', u'oldies', u'the pointer sisters', u'70s', u'1982', u'motown', u'Energetic', u'Soundtrack', u'happy', u'im so excited', u'funk', u'pointer sisters', u'rock', u'upbeat', u'rnb', u'female', u'favorites', u'female vocalist', u'dance pop', u'80s Pop', u'alternative', u'USA', u'Love', u'catchy', u'r&b', u'gay', u'fun', u'cool', u'Girl Groups', u'Beelloved', u'70s disco', u'Excited', u'cheese', u'new wave', u'dance-pop', u'Awesome', u'feel good', u'eighties', u'american', u'party music', u'great song', u'good', u'1984', u'Guilty Pleasures']"
274,Private Dancer - Single Edit,17880,50492,240000,"[u'rock', u'pop', u'r&b']"
275,Jolene,401137,2007260,160000,"[u'country', u'female vocalists', u'classic country', u'Dolly Parton', u'folk', u'70s', u'jolene', u'american', u'singer-songwriter', u'female vocalist', u'female', u'oldies', u'acoustic', u'classic', u'Love', u'sweet', u'bluegrass', u'names', u'jealousy', u'classic rock', u'pop', u'favorites', u'americana', u'guitar', u'nostalgia', u'Country-Pop', u'Favorite', u'1973', u'sad', u'female vocals', u'heartbreak', u'Favourites', u'Guilty Pleasures', u'Dolly', u'USA', u'easy listening', u'melancholy', u'favourite', u'best', u'lovely', u'1970s', u'classics', u'Rolling Stones Top 500 Songs of All Time', u'Rolling Stone 500 Greatest Songs of All Time', u'vocals female', u'old fashion romance', u'80s', u'great', u'nice', u'good']"
276,Turn the Beat Around,28211,88216,233000,"[u'dance', u'pop', u'90s', u'latin', u'female vocalists', u'cover', u'covers', u'gloria estefan', u'Disco', u'80s', u'best', u'favorite by this singer', u'latin diva', u'Soundtrack', u'spanish', u'chillout', u'favorite songs', u'favorites', u'memories', u'dance-pop', u'Latin Dance', u'Awesome', u'feel good', u'swing', u'Energetic', u'espa\xf1ol', u'cuba', u'party', u'gay', u'cuban', u'favourite', u'fun', u'great song', u'loved', u'live', u'bouncy', u'recuerdos', u'english', u'Sommer', u'personal favourites', u'vocalization', u'7 of 10 stars', u'1994', u'a subtle use of vocal harmony', u'intricate melodic phrasing', u'repetitive melodic phrasing', u'minor key tonality', u'witty', u'influential', u'favourite tracks']"
277,Immigrant Song,876654,6032122,146000,"[u'classic rock', u'rock', u'hard rock', u'Led Zeppelin', u'70s', u'british', u'heavy metal', u'Progressive rock', u'blues rock', u'favorites', u'psychedelic', u'metal', u'Psychedelic Rock', u'classic', u'guitar', u'oldies', u'Awesome', u'blues', u'rock n roll', u'1970', u'70s rock', u'Immigrant Song', u'epic', u'arena rock', u'Robert Plant', u'Soundtrack', u'male vocalists', u'60s', u'Favourite Songs', u'jimmy page', u'Play this loud enough to raise the dead', u'Energetic', u'Awesome Guitar Jams', u'Driving', u'male vocalist', u'School of Rock', u'heavy', u'led zep', u'nordic', u'old school', u'Favourites', u'classics', u'fuck yeah', u'Killer riff', u'vikings', u'Led Zeppelin  - immigrant song', u'guitar rock', u'10 of 10 stars', u'alternative', u'amazing']"
278,Coming Around Again,82703,291961,218000,"[u'female vocalists', u'pop', u'80s', u'singer-songwriter', u'70s', u'Carly Simon', u'Ballad', u'easy listening', u'rock', u'coming around again', u'Love', u'american', u'oldies', u'soft', u'folk', u'soft rock', u'romantic', u'chillout', u'singer songwriter', u'female vocal', u'Female Voices', u'Soundtrack', u'pop rock', u'Pop-Rock', u'i love 80s', u'female', u'favorites', u'beautiful', u'Mellow', u'favourite', u'female vocalist', u'heartbreak', u'sensual', u'poprock', u'1987', u'top 2000', u'Beelloved', u'dx7', u'sentimentalismo ao cubo', u'carly simon coming around again', u'classic rock', u'Classical', u'jazz', u'alternative rock', u'new york', u'sexy', u'sad', u'downtempo', u'USA', u'memories']"
279,Super Trouper,268256,1172607,253000,"[u'pop', u'abba', u'Disco', u'80s', u'swedish', u'70s', u'oldies', u'dance', u'rock', u'female vocalists', u'Europop', u'1980', u'70s pop', u'super trouper', u'female vocalist', u'Sweden', u'uk number one', u'super', u'super trooper', u'top 40', u'I love this song', u'european pop', u'pop rock', u'favorites', u'happy', u'dance-pop', u'scandinavian', u'party', u'cheerful', u""80's"", u'Favourites', u'UK number ones', u'euro-pop', u'Top1000', u'electropop', u'easy listening', u'Awesome', u'synthpop', u'fun', u'loved', u'eurodance', u'good', u'Swedish Pop', u'popular', u'1980s', u'6 of 10 stars', u'80s Pop', u'the best', u'Euro Disco', u'Mamma mia']"
280,YMCA - Original Version 1978,14410,33823,287000,[u'perlast']
281,Detroit Rock City,380922,1918852,320000,"[u'hard rock', u'classic rock', u'rock', u'kiss', u'glam rock', u'70s', u'heavy metal', u'80s', u'metal', u'rock band', u'detroit', u'Glam Metal', u'favorites', u'rock n roll', u'kiss army', u'hair metal', u'arena rock', u'Shock Rock', u'american', u'detroit rock city', u'seen live', u'favorite songs', u'Rock and Roll', u'1976', u'classic', u'glam', u'Michigan', u'Kiss Detroit Rock city', u'heavy', u'live', u'Masterpiece', u'destroyer', u'legend', u'the best of classic rock', u'Greatest Rock Anthems', u'Rock on', u'rock gods', u'USA', u'cool', u'Favorite', u'songs i love', u'cities', u'wrif-fm', u'classic hard rock', u'classic metal', u'4 minute madness', u'this one goes to eleven']"
282,Higher Love - Remastered,4458,11732,0,[]
283,A Question of Lust,192613,1066003,409000,"[u'80s', u'new wave', u'synthpop', u'electronic', u'Depeche Mode', u'synth pop', u'british', u'alternative', u'rock', u'pop', u'alternative rock', u'1986', u'electronica', u'male vocalists', u'Ballad', u'beautiful', u'DM', u'UK', u'romantic', u'Martin Gore', u'Love', u'synth', u'new romantic', u'industrial', u'Gothic', u""80's"", u'amayzes loved', u'songs I absolutely love', u'top pop songs', u'martin gore vocal', u'the complete one', u'seen live', u'sexy', u'favorites', u'melancholy', u'darkwave', u'music to listen to in the dark', u'antial', u'best of depeche mode', u'johnnytop', u'pop rock', u'eighties', u'synth-pop', u'all time faves', u'80er', u'be-my-baby drum', u'-favorites-', u'beautiful melody', u'davaho53', u'a question of lust']"
284,"Strangelove - 7"" Version",863,1743,0,[]
285,Walking in My Shoes - Remastered,14832,46094,0,"[u'90s', u'electronic', u'electronica', u'rock', u'alternative', u'alternative rock', u'dance', u'new wave', u'synthpop', u'alternative dance', u'1993', u'80er']"
286,A Question of Time,215973,1283493,279000,"[u'80s', u'new wave', u'synthpop', u'electronic', u'Depeche Mode', u'synth pop', u'rock', u'alternative', u'pop', u'electronica', u'british', u'UK', u'dance', u'1986', u'seen live', u'industrial', u'darkwave', u'DM', u'alternative rock', u'synth-pop', u'favorites', u'dark', u'new romantic', u'electropop', u'dramatic', u'alternative dance', u'antial', u'electro', u'techno', u'90s', u'synth', u'heard on Pandora', u'Favourites', u'best songs ever', u'Black Celebration', u'golden 80s', u'question of time', u'favorite songs', u'indie rock', u'catchy', u'romantic', u'Gothic', u'Retro', u'Tense', u'melancholic', u""80's"", u'Favorite', u'dark wave', u'misc', u'1980s']"
287,See You - Remastered,9767,22454,236000,[]
288,Dream On - 2007 Remastered Version,1532,3522,260000,[]
289,Precious,469146,3453265,250000,"[u'electronic', u'new wave', u'Depeche Mode', u'synth pop', u'synthpop', u'80s', u'alternative', u'electronica', u'pop', u'british', u'rock', u'Precious', u'00s', u'melancholy', u'alternative rock', u'favorites', u'beautiful', u'chillout', u'2005', u'electro', u'Love', u'synth', u'DM', u'seen live', u'UK', u'darkwave', u'industrial', u'male vocalists', u'dance', u'Smallville', u'relax', u'britpop', u'Awesome', u'sad', u'dark', u'Favourites', u'amazing', u'classic rock', u'electropop', u'chill', u'heard on Pandora', u'indie', u'ambient', u'melancholic', u'alternative dance', u'Favourite Songs', u'bones', u'favorite songs', u'sexy', u'male vocalist']"
290,Sweetest Perfection - 2006 Remastered Version,3348,7741,0,[]
291,Hourglass,46274,176932,324000,[]
292,Holding On,77585,337968,0,[]
293,Omen,57610,307146,197000,"[u'electronic', u'dance', u'r&b', u'party', u'featuring', u'2015', u'snl', u'2015 single', u'bbc radio1 playlist 2015']"
294,Nocturnal,49909,201661,405000,[]
295,Magnets - A-Trak Remix,25698,81290,0,[]
296,White Noise (feat. AlunaGeorge),263811,1769316,216000,"[u'House', u'dance', u'UK Garage', u'electronic', u'uk funky', u'2013', u'pop', u'deep house', u'best of 2013', u'british', u'female vocalists', u'electronica', u'seen live', u'indie', u'alternative', u'Awesome', u'club', u'Favorite', u'top 40', u'best', u'white noise', u'dance dance dance', u'10s', u'4 Stars', u'kat fm', u'duets', u'uk house', u'EDM', u'more cowbell', u'Do caralho', u'dancepop', u'nah', u'Classic shit', u'driving tune', u'currently-addicted-to', u'TooMuch', u'90s garage revival', u'disclosure', u'best 2013', u'diary 2013', u'HOF 2013', u'alunageorge', u'9207', u'made in chelsea', u'Everie Approved', u'opener 2015']"
297,Help Me Lose My Mind (feat. London Grammar),239521,1542352,518000,"[u'electronic', u'deep house', u'UK Garage', u'vocal house', u'electronica', u'House', u'pop', u'2013', u'2013 single', u'seen live', u'electropop', u'vocal', u'chill', u'female vocalists', u'UK', u'dubstep', u'urban', u'tech house', u'bass', u'trip hop', u'Mellow', u'relaxing', u'female vocals', u'cool', u'Favorite', u'9 of 10 stars', u'2', u'10s', u'2010s', u'featuring', u'10 of 10 stars', u'heavenly', u'Milla Jovovich', u'serene', u'streamable track wants', u'best of 2013', u'suburbia', u'21st century', u'rel-yr:2013', u'rel-mnth:2013:september', u'future bass', u'favorite track right now', u'song of the year', u'new find', u'london grammar', u'bbc radio1 playlist 2013', u'disclosure', u'best single of 2013', u'nocne wyciszenie', u'doris ivy loves hardstyle']"
