,Songs,Listeners,Playcount,Duration,Tags
541,The Touch,30078,168446,262000,"[u'Soundtrack', u'80s', u'transformers', u'rock', u'classic rock', u'stan bush', u'cheesy', u'Chuck', u'pop', u'hard rock', u'pop rock', u'epic', u'Awesome', u'male vocalists', u'rock band', u'melodic rock', u'unintentionally funny', u'rad-o-rama', u'Rock Band Network', u'the touch', u'Power ballad', u'tv', u'Soundtracks', u'upbeat', u'american', u'ost', u'AOR', u'fun', u'Uplifting', u'game', u'underrated', u""80's"", u'corny', u'film score', u'8 of 10 stars', u'perfect', u'male vocals', u'lol', u'lame', u'movie soundtrack', u'Feel Good Music', u'lulz', u'meme', u'dorky', u'movie', u'earworm', u'movie themes', u'5', u'Film Soundtrack', u'positive']"
542,Everybody's Crazy,2114,6000,282000,"[u'AOR', u'melodic rock', u'american', u'rhythum and blues tag']"
543,Madalaine,21771,75612,221000,"[u'hard rock', u'80s', u'hair metal', u'rock', u'Winger', u'Glam Metal', u'classic rock', u'catchy', u'cool', u'Pop Metal', u'heavy metal', u'metal', u'glam', u'glam rock', u'Favorite', u'cheesy', u'wrif-fm', u'hair', u'80s rock', u'80s hair metal', u'panty31772', u'my glam fav']"
544,Dream Warriors,28425,140977,249000,"[u'hard rock', u'80s', u'rock', u'hair metal', u'dokken', u'heavy metal', u'metal', u'american', u'80s Heavy Metal', u'Soundtrack', u'halloween', u'greatest hits', u""80's metal"", u'favorite songs', u'favorites', u'guitar', u'1', u'horror', u'8 of 10 stars', u'Best of', u'freddy', u'fantasy', u'3 stars', u'wrif-fm', u'halloween mix', u'Halloween Party', u'halloween music', u'1987', u'horror soundtrack', u'malloy2000 playlist - top songs - classical to metal', u'-4', u'hard rock hits', u'A Nightmare on Elm Street', u'horror movie soundtrack', u'metal top', u'U68 Power Hour', u'dream warriors', u'hair metal hits Filitriste', u'my glam fav', u'triumphant music', u'A Nightmare On Elm Street 3 Dream Warriors', u'triumphatism']"
545,Noise Level Critical,1900,10194,323000,"[u'hard rock', u'glam rock', u'classic rock', u'metal', u'rock', u'british', u'hair metal', u'arena rock', u'90s', u'welsh', u'wales', u'Glam Metal', u'british rock', u'tigertaliz']"
546,Gimme One More Night,971,3132,267000,"[u'hard rock', u'melodic rock']"
547,Fly High Michelle,22761,76274,256000,"[u'hair metal', u'Power ballad', u'80s', u'rock', u'hard rock', u'Glam Metal', u'glam rock', u'Ballad', u'metal', u'power pop', u'power ballads', u'melodic rock', u'hair band', u'sleaze', u'hair band ballads', u'heavy metal', u'ballads', u'tender', u'rock ballads', u'Pop Metal', u'songs named after girls', u'slgdmbestof', u'enuff znuff', u'80s heavy metal or hair band', u'slgdmbllds', u'classic rock', u'70s', u'sad', u'slow', u'soft rock', u'dream pop', u'american', u'powerpop', u'rock n roll', u'wrif-fm', u'1980s', u'<3', u'scum', u'hampton', u'hair bands', u'melodic hard rock', u'christian metal', u'80s hair metal', u'best of 1989', u'80s hard rock', u'video killed the radio star', u'metal edge', u'music choice: retro rock', u'hr', u'dette kalles musikk']"
548,The Ballad Of Jayne,65718,194134,280000,"[u'rock', u'hair metal', u'80s', u'hard rock', u'glam rock', u'classic rock', u'Power ballad', u'Ballad', u'80s Heavy Metal', u'la guns', u'metal', u'rock ballads', u'80s rock', u'80s hard rock', u'hair ballad', u'Love', u'rock ballad', u'heavy metal', u'slow', u'glam', u'rock n roll', u'Favorite', u'1980s', u'Favourite Songs', u'hair band', u'ballads', u'power ballads', u'Glam Metal', u'hair bands', u'80s metal', u'80s hair metal', u'monster ballad', u'metal ballads', u'L.A. Guns', u'80s hair bands', u'guns and roses', u'Jayne', u'slgdmbllds', u'the ballad of jayne', u'chillout', u'seen live', u'favorite songs', u'sad', u'pop rock', u'favorites', u'acoustic', u'arena rock', u'Awesome', u'psychedelic', u'90s']"
549,Don't You Ever Leave Me,40599,181911,246000,"[u'hard rock', u'rock', u'hair metal', u'glam rock', u'80s', u'finnish', u'Hanoi Rocks', u'glam', u'Ballad', u'classic rock', u'heavy metal', u'Favorite', u'Morose Deep dilate Crimson', u'seen live', u'favourite', u'glam punk', u'rock ballad', u'finland', u'Glam Metal', u'rock ballads', u'sleaze rock', u'80s rock', u'80s hard rock', u'Michael Monroe', u'just rock', u'headbangers ball', u'indie', u'indie rock', u'memories', u'loud', u'heard on Pandora', u'male vocalists', u'love songs', u'rock n roll', u'addiction', u'songs i love', u'1984', u'fav', u'sleazy', u'Cock rock', u'80s Heavy Metal', u'classic hard rock', u'1980s', u'sleaze', u'together', u'legend', u'suomirock', u'Sleaze Metal', u'80s metal', u'finnish rock']"
550,We're Not Gonna Take It,362583,1559620,218000,"[u'hard rock', u'80s', u'rock', u'heavy metal', u'classic rock', u'hair metal', u'Twisted Sister', u'metal', u'glam rock', u'Glam Metal', u'classic', u'classic metal', u'glam', u'party', u'favorites', u'happy', u'rock n roll', u'pop', u'1984', u'80s rock', u'were not gonna take it', u'alternative', u'male vocalists', u'amayzes loved', u'cowbell', u'guitar', u'political', u'fun', u'rock-n-roll', u'Favorite', u'1980s', u'Chuck', u'80s hair metal', u'Twisted Sister-Were not going to take it', u'seen live', u'catchy', u'Awesome', u'punk rock', u'Twisted', u'wrif-fm', u'80s metal', u'Shock Rock', u'Play this loud enough to raise the dead', u'GTA', u""80's rock"", u'80s y 90s', u'davaho53', u'Taking no shit from the man', u'hair metal classics', u'Soundtrack']"
551,Good Girl Gone Bad,12476,29193,223000,"[u'glam rock', u'hair metal', u'rock', u'hard rock', u'heavy metal', u'metal', u'Cock rock', u'Pretty Boy Floyd', u'HAIR-METAL-EIGHTIES', u'80s', u'party', u'rock n roll', u'sleazy', u'hair', u'sleaze', u'Glam Metal', u'guitar heroes', u'sleaze rock', u'sleazy rock', u'good girl gone bad']"
552,Headed For A Heartbreak,38589,141602,310000,"[u'80s', u'hard rock', u'Power ballad', u'hair metal', u'Winger', u'rock', u'80s metal', u'classic rock', u'Ballad', u'power ballads', u'metal', u'Glam Metal', u'80s glam', u'heavy metal', u'glam rock', u'heard on Pandora', u'1988', u'melodic rock', u'ballads', u'childhood memories', u'rock ballads', u'Megadeth', u'music choice: retro rock', u'80s hair bands', u'sad', u'favourite', u'glam', u'keyboard', u""80's"", u'guitar virtuoso', u'loneliness', u'wrif-fm', u'1980s', u'10 of 10 stars', u'hair band', u'collection', u'Guitar Solo', u'the best', u'Arena Rock Legends', u'Play this loud enough to raise the dead', u'backyard', u'Pop Metal', u'Testament', u'Soft Metal', u'my favorite', u'Amazing songs', u'lackluster', u'exodus', u'slgdmbestof', u'white power']"
553,Creeping Death,1034,3922,371000,"[u'cover songs', u'hard rock', u'cover', u'cover metallica']"
554,Ninja,37628,134623,227000,"[u'hard rock', u'80s', u'metal', u'Europe', u'Glam Metal', u'rock', u'classic rock', u'rock ballad', u'seen live', u'Power ballad', u'hair metal', u'glam', u'80', u'Ballad', u'J-rock', u'Sweden', u'9 of 10 stars', u'running', u'7 of 10 stars', u'battle', u'Guitar Solo', u'melodic hard rock', u'My Favourites', u'hairmetal', u'Pop Metal', u'Soft Metal', u'KICK', u'slgdmbestof', u'lol metal', u'hard rock hits', u'music I have or have to buy', u'La Renga', u'wasted timejt', u'SamiThaCoolOnes favourites', u'gitara lubie ja']"
555,Shut Up,2113,7871,238000,"[u'hard rock', u'90s', u'rocknroll', u'fight']"
556,We've Got Rock 'n' Roll,758,2261,218000,[]
557,Your Love,326251,1839921,218000,"[u'80s', u'rock', u'classic rock', u'new wave', u'pop', u'british', u""80's"", u'the outfield', u'best of 80s', u'GTA Vice city', u'Your Love', u'1986', u'pop rock', u'favorites', u'Power ballad', u'Grand Theft Auto', u'power pop', u'catchy', u'minor key tonality', u'One Hit Wonders', u'one hit wonder', u'Love', u'male vocalists', u'repetitive melodic phrasing', u'GTA', u'classic', u'summer', u'1984', u'a dynamic male vocalist', u'electric guitar riffs', u'Criminally Underrated', u'heavy use of vocal harmonies', u'paired vocal harmony', u'pop rock qualities', u'This song rocks', u'Awesome', u'oldies', u'amazing', u'cool', u'outfield', u'Vice City', u'The Best of 80s']"
558,If Looks Could Kill,40873,156142,222000,"[u'rock', u'classic rock', u'80s', u'female vocalists', u'hard rock', u'heart', u'Fleetwood Mac', u'guitar', u'american', u'female vocalist', u'Stevie Nicks', u'90s', u'female vocals', u'rock n roll', u'melodic rock', u'pissed off', u'Chicks that Rock', u'christine mcvie', u'danny kirwan', u'heavy metal', u'female', u'pop', u'classic', u'70s', u'favorite songs', u'sad', u'favorites', u'album rock', u'arena rock', u'Awesome', u'song', u'Retro', u'Driving', u'angry', u'eu', u'old school', u'glam', u'Rock and Roll', u'00s', u'1986', u'top 40', u'female singers', u'Best of', u'greatest hits', u'fuck yeah', u'6 of 10 stars', u'sisters', u'yeah', u'1985', u'motivate']"
559,Twist and Shake,1587,9476,212000,"[u'rock', u'classic rock', u'metal', u'british', u'hard rock', u'dance', u'catchy', u'hair metal', u'arena rock', u'90s', u'upbeat', u'fun', u'glam rock', u'Uplifting', u'dance rock', u'welsh', u'wales', u'Glam Metal', u'british rock', u'tigertaliz']"
560,Love Overload,1660,8774,232000,"[u'rock', u'hard rock', u'metal', u'british', u'hair metal', u'90s', u'glam rock', u'welsh', u'wales', u'Glam Metal', u'british rock', u'Pop Metal', u'Tigertailz']"
561,Forever Free,39753,174085,311000,"[u'heavy metal', u'metal', u'hard rock', u'80s', u'WASP', u'Ballad', u'rock', u'hair metal', u'1989', u'rock ballad', u'classic rock', u'glam rock', u'sad', u'Power ballad', u'Awesome', u'rock ballads', u'80s metal', u'forever free', u'60s', u'heavy', u'guitar', u'american', u'Mellow', u'glam', u'Favorite', u'best', u'freedom', u'i love this', u'ballads', u'cryptic', u'Alexisonfire', u'Glam Metal', u'biker rock', u'Guitar Solo', u'All time favourites', u'i love you', u'Awesome solo', u'Play this loud enough to raise the dead', u'songs with awesome solos', u'I love', u'metal ballad', u'metal ballads', u'100 Greatest Guitar Solos', u'Beautiful Song', u'fajny', u'teen metal', u'80s hard rock', u'Powerballad', u'classic rock - metal', u'crying songs']"
562,Restless,8753,20858,243000,"[u'glam rock', u'hair metal', u'hard rock', u'Glam Metal', u'rock', u'Garage Rock', u'glam', u'rock n roll', u'looove', u'balada de poder']"
563,Saturday Night in the USA,966,2744,300000,[]
564,Hands Off My Radio,2423,9072,249000,[]
565,48 Hours,22726,63395,185000,"[u'hard rock', u'hair metal', u'80s', u'glam rock', u'rock', u'Glam Metal', u'rock n roll', u'sleaze rock', u'metal', u'Like', u'glam', u'sleazy', u'Cock rock', u'80s Heavy Metal', u'sleaze', u'80s metal', u'80s rock', u'sleazy rock', u'80s hard rock', u'great beat', u'pretty rock boys', u'farofa']"
566,Turn up the Radio,99072,409542,262000,"[u'hard rock', u'80s', u'hair metal', u'rock', u'heavy metal', u'classic rock', u'Autograph', u'80s rock', u'metal', u'Glam Metal', u'glam rock', u'turn up the radio', u'GTA', u'GTA Vice city', u'v-rock', u'pop', u'arena rock', u'Grand Theft Auto', u'Vice City', u'favorites', u'party', u'Rock and Roll', u'melodic rock', u'Autograph - Turn Up the Radio', u'catchy', u'90s', u'upbeat', u'oldies', u'AOR', u'1984', u'hair band', u'Grand Theft Auto: Vice City Soundtrack', u'party rock', u'80s metal', u'Fun Music', u'Hair Rock', u'Pop Metal', u'80s hair metal', u'Power Rock', u'gta vc', u'80s hard rock', u'video killed the radio star', u'headbangers ball', u'Grand Theft Auto: Vice City', u'Tema Increible', u'good ol 80s', u'autograph turn up the radio', u'Soundtrack', u'test', u'classic']"
567,Ding Dong Song (You Touch My Tralala),1462,8816,0,[]
568,Golddiggers,11396,50218,216000,"[u'sexy', u'pop', u'swedish', u'dance', u'Europop', u'champagne', u'intercourse', u'swinging my thing']"
569,My Michelle,344699,1845981,219000,"[u'hard rock', u'rock', u'classic rock', u'80s', u'metal', u'Guns N Roses', u'heavy metal', u'hair metal', u'american', u'glam rock', u'Glam Metal', u'1987', u'seen live', u'rock n roll', u'GNR', u'guitar', u'90s', u'male vocalists', u""Guns N' Roses"", u'Appetite For Destruction', u'alternative rock', u'USA', u'great', u'8 of 10 stars', u'my michelle', u'classic', u'alternative', u'heavy', u'80s Heavy Metal', u'sleaze', u'nice songs', u'Grunge', u'dark', u'blues', u'vocals', u'death metal', u'nice', u'cool', u'great songs', u'1980s', u'names', u'Slash', u'classic metal', u'80s metal', u'hardrock', u'iTunes', u""80's rock"", u'Axl Rose', u'Name Droppers', u'80s hard rock']"
570,Blow My Fuse,16340,53010,242000,"[u'hard rock', u'hair metal', u'80s', u'rock', u'rock n roll', u'classic rock', u'Glam Metal', u'glam rock', u'80s metal', u'sleazy rock', u'80s hard rock', u'heavy metal', u'seen live', u'arena rock', u'glam', u'good', u'songs i love', u'sleazy', u'Cock rock', u'80s Heavy Metal', u'wrif-fm', u'classic hard rock', u'1980s', u'sleaze', u'Best music ever', u'hair bands', u'tasty guitar licks and riffs', u'sleaze rock', u'80s rock', u""80's metal"", u'classic heavy metal', u'daves faves', u'Rock out music', u'midnite', u'my metal', u'music choice: retro rock', u'Dave Hiddens Music Box', u'midnite dynamite', u'Poser Night']"
571,Nigdy! (FMR Jarocin'86),124,216,0,[]
572,Your Love,326251,1839921,218000,"[u'80s', u'rock', u'classic rock', u'new wave', u'pop', u'british', u""80's"", u'the outfield', u'best of 80s', u'GTA Vice city', u'Your Love', u'1986', u'pop rock', u'favorites', u'Power ballad', u'Grand Theft Auto', u'power pop', u'catchy', u'minor key tonality', u'One Hit Wonders', u'one hit wonder', u'Love', u'male vocalists', u'repetitive melodic phrasing', u'GTA', u'classic', u'summer', u'1984', u'a dynamic male vocalist', u'electric guitar riffs', u'Criminally Underrated', u'heavy use of vocal harmonies', u'paired vocal harmony', u'pop rock qualities', u'This song rocks', u'Awesome', u'oldies', u'amazing', u'cool', u'outfield', u'Vice City', u'The Best of 80s']"
573,Young Turks,103035,512778,275000,"[u'80s', u'rock', u'classic rock', u'soft rock', u'pop', u'rod stewart', u'new wave', u'GTA', u'K-DST', u'singer-songwriter', u'male vocalists', u'1981', u'Grand Theft Auto', u'british', u'gta san andreas', u'gtasa tracks', u'smooth', u'Young Turks', u'Soundtrack', u'classic', u'70s', u'synthpop', u'early mtv years', u'gta sa', u'pop rock', u'Awesome', u'lyrical', u'perfect', u'gold', u'1982', u'lyrical genius', u'synthrock', u'San Andreas', u'top10', u'i know all the words to this', u'the faces', u'the greatest song ever written', u'Vida', u'cant help but dance', u'early mtv', u'chillout', u'alternative', u'hard rock', u'dance', u'favorites', u'album rock', u'adult contemporary', u'other', u'beautiful', u'Dreamy']"
574,Baby Jane,73805,314408,282000,"[u'rock', u'80s', u'pop', u'classic rock', u'rod stewart', u'soft rock', u'70s', u'1983', u'pop rock', u'uk number one', u'british', u'synthpop', u'male vocalists', u'Pop-Rock', u'all the best', u'the good of the 80s', u'baby jane', u'Disco', u'seen live', u'singer-songwriter', u'UK', u'dance', u'easy listening', u'adult contemporary', u'saxophone', u'loud', u'California', u'blues rock', u'good', u'love songs', u'guilty pleasure', u""80's"", u'Ballad', u'Guilty Pleasures', u'8 of 10 stars', u'freedom', u'lyrics', u'Remember', u'lol', u'sympathy68', u'sing along', u'6 of 10 stars', u'ballads', u'dancing', u'names', u'yeah', u'aleister crowley', u'swagger', u'rewind', u'linedance']"
575,Da Ya Think I'm Sexy?,105464,363724,327000,"[u'classic rock', u'rock', u'70s', u'Disco', u'pop', u'rod stewart', u'oldies', u'male vocalists', u'80s', u'soft rock', u'british', u'dance', u'pop rock', u'sexy', u'catchy', u'Rod', u'singer-songwriter', u'old times', u'easy listening', u'adult contemporary', u'cool', u'Guilty Pleasures', u'UK Pop', u'Rolling Stone 500 Greatest Songs of All Time', u'maggie may', u'do ya think Im sexy', u'electronic', u'seen live', u'classic', u'oldschool', u'favorites', u'omg', u'Power ballad', u'oldie', u'other', u'Awesome', u'saxophone', u'groove', u'guitar', u'contemplative', u'Driving', u'upbeat', u'subway', u'party', u'1978', u'great', u'amazing', u'party music', u'sex', u'groovy']"
576,The Ballad Of Jayne,65718,194134,280000,"[u'rock', u'hair metal', u'80s', u'hard rock', u'glam rock', u'classic rock', u'Power ballad', u'Ballad', u'80s Heavy Metal', u'la guns', u'metal', u'rock ballads', u'80s rock', u'80s hard rock', u'hair ballad', u'Love', u'rock ballad', u'heavy metal', u'slow', u'glam', u'rock n roll', u'Favorite', u'1980s', u'Favourite Songs', u'hair band', u'ballads', u'power ballads', u'Glam Metal', u'hair bands', u'80s metal', u'80s hair metal', u'monster ballad', u'metal ballads', u'L.A. Guns', u'80s hair bands', u'guns and roses', u'Jayne', u'slgdmbllds', u'the ballad of jayne', u'chillout', u'seen live', u'favorite songs', u'sad', u'pop rock', u'favorites', u'acoustic', u'arena rock', u'Awesome', u'psychedelic', u'90s']"
577,Crystal Eyes,21164,78774,354000,"[u'hard rock', u'Glam Metal', u'rock', u'rock ballads', u'metal', u'Power ballad', u'hair metal', u'glam rock', u'Ballad', u'Titanium Salvia Lapis Lazuli', u'heavy metal', u'Awesome', u'90s', u'rock ballad', u'great ballads', u'L.A. Guns', u'classic rock', u'sleaze', u'90s Rock', u'sleaze rock', u'best ballads ever', u'pop rock', u'easy listening', u'arena rock', u'beautiful', u'melodic', u'guitar', u'american', u'relaxing', u'glam', u'nice', u'underrated', u'rock n roll', u'songs i love', u'relax', u'sleazy', u'Cock rock', u'melodic rock', u'1991', u'hair band', u'ballads', u'easy', u'chris', u'Guitar Solo', u'Axl', u'sleazy rock', u'fajny', u'malloy2000 playlist - top songs - classical to metal', u'90s metal', u'90s hard rock']"
578,I Am The Program,2665,11700,385000,[]
579,Blow My Fuse,16340,53010,242000,"[u'hard rock', u'hair metal', u'80s', u'rock', u'rock n roll', u'classic rock', u'Glam Metal', u'glam rock', u'80s metal', u'sleazy rock', u'80s hard rock', u'heavy metal', u'seen live', u'arena rock', u'glam', u'good', u'songs i love', u'sleazy', u'Cock rock', u'80s Heavy Metal', u'wrif-fm', u'classic hard rock', u'1980s', u'sleaze', u'Best music ever', u'hair bands', u'tasty guitar licks and riffs', u'sleaze rock', u'80s rock', u""80's metal"", u'classic heavy metal', u'daves faves', u'Rock out music', u'midnite', u'my metal', u'music choice: retro rock', u'Dave Hiddens Music Box', u'midnite dynamite', u'Poser Night']"
580,Cold Blood,8304,38536,257000,"[u'hard rock', u'hair metal', u'rock', u'classic rock', u'glam rock', u'80s Heavy Metal', u'Glam Metal', u'80s metal', u'80s rock', u'Kix', u'80s hard rock', u'heavy metal', u'80s', u'rock n roll', u'songs i love', u'1988', u'sleazy', u'Cock rock', u'wrif-fm', u'classic hard rock', u'sleaze', u'sleaze rock', u'2 of 10 stars', u'sleazy rock', u'classic heavy metal', u'midnite', u'viernes', u'Worst of the 80s', u'midnite dynamite']"
581,(Fridays With PewDiePie - Part 102),2,2,0,[]
582,Part 109),15,16,0,[]
583,The Bitter Pill,11126,35114,246000,"[u'hard rock', u'Warrant', u'hair metal', u'glam rock', u'rock ballad', u'Glam Metal', u'80s hair metal', u'80s glam', u'heavy metal', u'rock', u'Power ballad', u'Awesome', u'90s', u'favourite', u'glam', u'Ballad', u'addiction', u'Favorite', u'1992', u'good lyrics', u'hair', u'Guitar Gods', u'sound storm', u'80s metal', u'80s rock', u'poser', u'80s hair bands', u'hair ballad', u'Fav Rock', u'temazos', u'Sofisticated', u'jani lane', u'panty31772', u'fantastyczny', u'metalnco radio', u'Scumbag Ballads']"
584,Bohemian Rhapsody,1281435,8599944,353000,"[u'classic rock', u'rock', u'Queen', u'70s', u'80s', u'british', u'epic', u'hard rock', u'glam rock', u'classic', u'rock opera', u'Progressive rock', u'favorites', u'Awesome', u'Bohemian Rhapsody', u'freddie mercury', u'Masterpiece', u'oldies', u'pop', u'best songs ever', u'best song ever', u'piano', u'male vocalists', u'1975', u'beautiful', u'favorite songs', u'genius', u'Legendary', u'Soundtrack', u'guitar', u'Favourites', u'UK', u'opera', u'amazing', u'classics', u'opera rock', u'Love', u'arena rock', u'FUCKING AWESOME', u'legend', u'art rock', u'Symphonic Rock', u'Progressive', u'Favourite Songs', u'brilliant', u'Rhapsody', u'alternative', u'glam', u'bohemian', u'favourite']"
585,Hold On to My Heart,52739,298514,263000,"[u'heavy metal', u'metal ballads', u'hard rock', u'Ballad', u'metal', u'rock', u'hair metal', u'80s', u'WASP', u'WASP hold on to my heart', u'ballads', u'Power ballad', u'rock ballad', u'american', u'ballade', u'rock ballads', u'All time favourites', u'80s metal', u'classic rock', u'soul', u'90s', u'heart', u'love at first listen', u'power ballads', u'Glam Metal', u'best ever', u'fucking beautiful', u'metal ballad', u'baladas rock', u'songs of drops', u'reminds me of someone special', u'slgdm', u'chante pour moi', u'hooold on too myyy heeeaaaart', u'myk wasp', u'Hold On to My Heart', u'seen live', u'british', u'experimental', u'USA', u'slow', u'calm', u'Love', u'cute', u'beautiful', u'night', u'g', u'melancholy', u'Favorite Artists', u'melancholic']"
586,Crystal Eyes,21164,78774,354000,"[u'hard rock', u'Glam Metal', u'rock', u'rock ballads', u'metal', u'Power ballad', u'hair metal', u'glam rock', u'Ballad', u'Titanium Salvia Lapis Lazuli', u'heavy metal', u'Awesome', u'90s', u'rock ballad', u'great ballads', u'L.A. Guns', u'classic rock', u'sleaze', u'90s Rock', u'sleaze rock', u'best ballads ever', u'pop rock', u'easy listening', u'arena rock', u'beautiful', u'melodic', u'guitar', u'american', u'relaxing', u'glam', u'nice', u'underrated', u'rock n roll', u'songs i love', u'relax', u'sleazy', u'Cock rock', u'melodic rock', u'1991', u'hair band', u'ballads', u'easy', u'chris', u'Guitar Solo', u'Axl', u'sleazy rock', u'fajny', u'malloy2000 playlist - top songs - classical to metal', u'90s metal', u'90s hard rock']"
587,I'd Do Anything for Love (But I Won't Do That),146816,667929,345000,"[u'rock', u'classic rock', u'Meat Loaf', u'80s', u'90s', u'hard rock', u'rock opera', u'Love', u'rock ballad', u'Ballad', u'epic', u'piano', u'american', u'pop', u'long', u'male vocalists', u'love songs', u'alternative', u'best song ever', u'Wagnerian Rock', u'romantic', u'beautiful', u'duet', u'love song', u'favorites', u'Power ballad', u'Meatloaf', u'Meat Loaf anything for love', u'1993', u'10 of 10 stars', u'metal', u'Awesome', u'oldies', u""80's"", u'Operatic Rock', u'jim steinman', u'Id do anything for love', u'songs everybody knows', u'70s', u'alternative rock', u'singer-songwriter', u'catchy', u'soft rock', u'amazing', u'fun', u'best', u'long song', u'emotion', u'title is a full sentence', u'powerful']"
588,Alone,270051,1312741,218000,"[u'80s', u'rock', u'classic rock', u'female vocalists', u'heart', u'pop', u'alone', u'Ballad', u'power ballads', u'Love', u'hard rock', u'Fleetwood Mac', u'Power ballad', u'soft rock', u'love songs', u'1987', u'christine mcvie', u'rock ballad', u'rock ballads', u'female vocalist', u'ballads', u'favorites', u'oldies', u'Stevie Nicks', u'70s', u'beautiful', u'melancholy', u'pop rock', u'romantic', u'female vocals', u'danny kirwan', u'123 drippy sappy', u'seattle', u'piano', u'american', u'emotional', u""80's"", u'melodic rock', u'heart-alone', u'USA', u'easy listening', u'hair metal', u'Awesome', u'nostalgic', u'soft', u'female vocal', u'Guilty Pleasures', u'love song', u'1980s', u'80s Pop']"
589,Holding Out for a Hero,295299,1360231,281000,"[u'80s', u'pop', u'rock', u'female vocalists', u'Soundtrack', u'bonnie tyler', u'female vocalist', u'dance', u'classic rock', u'oldies', u'party', u'footloose', u'80s Pop', u'Disco', u'british', u'pop rock', u'energy', u'Holding Out For A Hero', u""80's"", u'power', u'Guilty Pleasures', u'welsh', u'soft rock', u'Energetic', u'1984', u'best', u'i need a hero', u'cheese', u'Power ballad', u'Driving', u'Favourites', u'8 of 10 stars', u'hero music', u'jim steinman', u'80s favorites', u'Shrek2', u'female', u'70s', u'hard rock', u'memories', u'oldie', u'upbeat', u'guilty pleasure', u'camp', u'6 of 10 stars', u'short circuit', u'Holding out for a hero  Bonnioe Tyler']"
590,Total Eclipse of the Heart,462631,2296621,349000,"[u'80s', u'pop', u'female vocalists', u'rock', u'Ballad', u'bonnie tyler', u'classic rock', u'Love', u'female vocalist', u'oldies', u'love songs', u'romantic', u'favorites', u'Power ballad', u'ballads', u'Total Eclipse of the Heart', u'female', u'british', u'soft rock', u""80's"", u'80s Pop', u'epic', u'easy listening', u'Guilty Pleasures', u'classic', u'guilty pleasure', u'1983', u'beautiful', u'emotional', u'Sentimental', u'jim steinman', u'Bonnie Tyler Total Eclipse of the Heart', u'slow', u'power ballads', u'sad', u'dramatic', u'love song', u'bonnie', u'memories', u'Awesome', u'total eclipse', u'piano', u'melancholy', u'soft', u'nostalgia', u'pop ballad', u'pop rock', u'Passionate', u'melancholic', u'1980s']"
591,I'd Do Anything for Love (But I Won't Do That),146816,667929,345000,"[u'rock', u'classic rock', u'Meat Loaf', u'80s', u'90s', u'hard rock', u'rock opera', u'Love', u'rock ballad', u'Ballad', u'epic', u'piano', u'american', u'pop', u'long', u'male vocalists', u'love songs', u'alternative', u'best song ever', u'Wagnerian Rock', u'romantic', u'beautiful', u'duet', u'love song', u'favorites', u'Power ballad', u'Meatloaf', u'Meat Loaf anything for love', u'1993', u'10 of 10 stars', u'metal', u'Awesome', u'oldies', u""80's"", u'Operatic Rock', u'jim steinman', u'Id do anything for love', u'songs everybody knows', u'70s', u'alternative rock', u'singer-songwriter', u'catchy', u'soft rock', u'amazing', u'fun', u'best', u'long song', u'emotion', u'title is a full sentence', u'powerful']"
